platform,product_id,title,brand,category,current_price,original_price,discount,rating,reviews_count,availability,main_image,product_url,scraped_at
amazon,B0BS3GJM1B,Product B0BS3GJM1B,Baby Einstein Go Opus Go 4-in-1 Crawl and Chase Baby Toy,Toys & Games,"EGP 3,978.96","EGP 4,681.13",,4.7,(960),In Stock,https://m.media-amazon.com/images/I/71NWbgEmdHL._AC_UL320_.jpg,https://www.amazon.eg/dp/B0BS3GJM1B,2026-05-14T06:29:03.662798
amazon,B0DQJJPNQY,Product B0DQJJPNQY,"G-Tab T8S Kids 5G WiFi 4GB RAM 64GB ROM 8-inch IPS LCD 800x1280 Android 14 Tablet, Gray/Blue",Toys & Games,"EGP 4,200.00",,,3.9,(12),In Stock,https://m.media-amazon.com/images/I/61M4cpaHpdL._AC_UL320_.jpg,https://www.amazon.eg/dp/B0DQJJPNQY,2026-05-14T06:29:03.666526
amazon,B0DWDJWS3D,Product B0DWDJWS3D,LEGO Technic Aston Martin Valkyrie Race Car Toy - Model Building Kit with V12 Engine & Opening Gullwing Doors - Collectible Gift for 9+ Year Old Boys & Girls - 42208,Toys & Games,"EGP 4,039.00",,,4.8,(460),In Stock,https://m.media-amazon.com/images/I/71gRm0qfiXL._AC_UL320_.jpg,https://www.amazon.eg/dp/B0DWDJWS3D,2026-05-14T06:29:03.669781
amazon,B0DCZKWP2Z,Product B0DCZKWP2Z,"R36S Handheld Game Console,3.5-Inch IPS Screen Retro Gaming Console,3500mAh,Built in 20000+ Games. (Black-128G(20000+ Games))",Toys & Games,"EGP 2,008.82","EGP 2,721.50",,3.2,(40),In Stock,https://m.media-amazon.com/images/I/61BVPROt32L._AC_UL320_.jpg,https://www.amazon.eg/dp/B0DCZKWP2Z,2026-05-14T06:29:03.673763
amazon,B0B99JKXZG,Product B0B99JKXZG,"AIGLUN LED Mask with Gesture Sensing, LED Face Transforming Mask Toy, Christmas Gift Idea for Boys and Girls",Toys & Games,"EGP 3,726.64","EGP 4,140.71",,4.4,(459),In Stock,https://m.media-amazon.com/images/I/81Q1kF2NapL._AC_UL320_.jpg,https://www.amazon.eg/dp/B0B99JKXZG,2026-05-14T06:29:03.678211
amazon,B0DWDGQVLM,Product B0DWDGQVLM,"LEGO DUPLO│Disney Anna and Elsa's Frozen Castle Party - Educational Toy with 5 Figures Incl. Olaf & Baby Sven, plus a Light Brick - Gift for 2+ Year Old Toddlers, Girls & Boys - 10455",Toys & Games,"EGP 4,849.00",,,4.8,(267),In Stock,https://m.media-amazon.com/images/I/61OxXcFPBvL._AC_UL320_.jpg,https://www.amazon.eg/dp/B0DWDGQVLM,2026-05-14T06:29:03.681627
amazon,B0CWH36MYS,Product B0CWH36MYS,"LEGO Creator 3in1 T. rex to Triceratops to Pterodactyl Toys, Dinosaur Figures for 9 Plus Year Old Boys & Girls, Posable Dino Toy Model Building Set, Birthday Gift Idea for Kids 31151",Toys & Games,"EGP 3,789.00","EGP 4,099.00",,4.8,(731),In Stock,https://m.media-amazon.com/images/I/81C91FABz3L._AC_UL320_.jpg,https://www.amazon.eg/dp/B0CWH36MYS,2026-05-14T06:29:03.685886
amazon,B09Z4GVXWH,Product B09Z4GVXWH,Electric Baby Swing Cradle Infant Bouncer Portable Adjustable Motorized Rocker with Bluetooth Music Speaker and 5 Swaying Gears Preset Lullabies and Smooth Remote Control (Grey),Toys & Games,"EGP 3,278.00",,,4.1,(12),In Stock,https://m.media-amazon.com/images/I/7135rVsbjSL._AC_UL320_.jpg,https://www.amazon.eg/dp/B09Z4GVXWH,2026-05-14T06:29:03.689784
amazon,B0BXKWLKTW,Product B0BXKWLKTW,"Dance Mat for Kids - Electronic Dance Mats with Wireless Bluetooth for 3-12 Year Old Kids, Lights Up Dance Pad with Built-in Music 5 Levels 4 Mode, Gifts for Children",Toys & Games,"EGP 2,413.15","EGP 2,681.28",,4.4,(72),In Stock,https://m.media-amazon.com/images/I/81Fg53y8CoL._AC_UL320_.jpg,https://www.amazon.eg/dp/B0BXKWLKTW,2026-05-14T06:29:03.694171
amazon,B0CDS7X728,Product B0CDS7X728,"BAYBEE Coaster Tricycle for Kids, 2-5 Years, Blue, Unisex, 54 cm x 36 cm x 36 cm, 25 KG Max Weight, Smart Plug n Play, Front & Rear Storage Baskets, Quiet Ride Tires, Nonslip Handle, Ideal First Ride",Toys & Games,"EGP 2,026.92",,,2.2,(6),In Stock,https://m.media-amazon.com/images/I/61GSbSouDyL._AC_UL320_.jpg,https://www.amazon.eg/dp/B0CDS7X728,2026-05-14T06:29:03.697506
amazon,B0CWH3BRYZ,Product B0CWH3BRYZ,"LEGO Super Mario Adventures with Interactive LEGO Luigi Super Mario, Nintendo‍ Gift for Boys, Girls, and Egamers 6 Year Old, Kids Garden Playset, Pink Baby Yoshi Figure 71440",Toys & Games,"EGP 3,869.00","EGP 3,999.00",,4.8,(682),In Stock,https://m.media-amazon.com/images/I/61e85DfyYmL._AC_UL320_.jpg,https://www.amazon.eg/dp/B0CWH3BRYZ,2026-05-14T06:29:03.701770
amazon,B0CFVXJ72J,Product B0CFVXJ72J,"LEGO 71812 NINJAGO Kai's Ninja Climber Mech Adventure Toy Set for Kids with Buildable Figure and 4 Mini Figures, Birthday Gift for Boys and Girls Ages 9+ who love independent play",Toys & Games,"EGP 4,139.00",,,4.8,(790),In Stock,https://m.media-amazon.com/images/I/612O8JgF0LL._AC_UL320_.jpg,https://www.amazon.eg/dp/B0CFVXJ72J,2026-05-14T06:29:03.705364
amazon,B0DWDR1DBS,Product B0DWDR1DBS,"LEGO ONE PIECE Buggy the Clown's Circus Tent - Interactive Toy with 4 Minifigures incl. Luffy, Nami & Zoro, plus 2 Wanted Posters - Anime Gift for 8+ Year Old Boys, Girls & Fans - 75637",Toys & Games,"EGP 3,219.00",,,4.7,(402),In Stock,https://m.media-amazon.com/images/I/712aeUE9UqL._AC_UL320_.jpg,https://www.amazon.eg/dp/B0DWDR1DBS,2026-05-14T06:29:03.708515
amazon,B0DHSCC5QP,Product B0DHSCC5QP,"LEGO DREAMZzz 2in1 Cooper’s Tiger Mech & Zero’s Hot Rod Car Toy for 9 Plus Year Old Boys and Girls, Set with Mech Robot, Z-Blob and 3 Minifigures, Birthday Gift Idea 71497",Toys & Games,"EGP 4,408.00",,,4.8,(54),In Stock,https://m.media-amazon.com/images/I/81wfl3mSFAL._AC_UL320_.jpg,https://www.amazon.eg/dp/B0DHSCC5QP,2026-05-14T06:29:03.711668
amazon,B0DHSDLW2V,Product B0DHSDLW2V,"LEGO DREAMZzz 2in1 Mateo and the Z-Blob Action Race Car to Motorbike Toy, Vehicle Set for 8 Plus Year Old Boys & Girls, Includes z-Blob, a Spider Figure and 2 Minifigures 71491",Toys & Games,"EGP 2,999.00","EGP 3,129.00",,4.7,(103),In Stock,https://m.media-amazon.com/images/I/81g8wCJoaBL._AC_UL320_.jpg,https://www.amazon.eg/dp/B0DHSDLW2V,2026-05-14T06:29:03.715529
amazon,B0GZGG7WMB,Product B0GZGG7WMB,"Vespa Shape Electric Bicycle for Kids, Brown and White, Battery Operated, Suitable for Toddlers",Toys & Games,"EGP 4,600.00",,,,EGP 4600.00EGP4600.00,In Stock,https://m.media-amazon.com/images/I/81gCOzlmxAL._AC_UL320_.jpg,https://www.amazon.eg/dp/B0GZGG7WMB,2026-05-14T06:29:03.718533
amazon,B0GW34XLJ1,Product B0GW34XLJ1,"Rattan Hanging Swing with Black Metal Stand and Cushion, Hanging Egg Chair for Garden Balcony (Beige and Black)",Toys & Games,"EGP 2,700.00","EGP 2,999.00",,,EGP 2700.00EGP2700.00List: EGP 2999.00List:EGP 2999.00EGP2999.00,In Stock,https://m.media-amazon.com/images/I/51z2r8tQhgL._AC_UL320_.jpg,https://www.amazon.eg/dp/B0GW34XLJ1,2026-05-14T06:29:03.722411
amazon,B0GQPTW4M8,Product B0GQPTW4M8,"TOYS LAND 1:16 RC Drift Car, 2.4GHz Remote Control Car, 18KM/H High Speed 4WD Cars, LED Lights & Spray Effect, Extra Drift Tires, 2 Rechargeable Batteries, Racing Toy Vehicles for Adults Kids Boys 8+",Toys & Games,"EGP 2,999.00",,,,EGP 2999.00EGP2999.00,In Stock,https://m.media-amazon.com/images/I/7177aL6QG1L._AC_UL320_.jpg,https://www.amazon.eg/dp/B0GQPTW4M8,2026-05-14T06:29:03.725449
amazon,B0FJ7WTCW5,Product B0FJ7WTCW5,"Kid's scooter 3 wheels Big pedal Foldable scooter with music, height-adjustable PU with LED light wheels, best for gifts for children from 3 to 12_from HAPPY KIDDO",Toys & Games,"EGP 2,256.00",,,,EGP 2256.00EGP2256.00,In Stock,https://m.media-amazon.com/images/I/51PEPja-yCL._AC_UL320_.jpg,https://www.amazon.eg/dp/B0FJ7WTCW5,2026-05-14T06:29:03.728831
amazon,B0BVVF6V1S,Product B0BVVF6V1S,"100PCS Magnetic Tiles STEM Building Toys Set with 2 Cars, Sensory Stacking Magnetic Blocks for Toddlers & Kids, Ideal for Preschool Montessori Toys Christmas Birthday Gifts for Boys & Girls Ages 3+",Toys & Games,"EGP 2,999.00",,,4.8,(1.4K),In Stock,https://m.media-amazon.com/images/I/81fWYEXHUpL._AC_UL320_.jpg,https://www.amazon.eg/dp/B0BVVF6V1S,2026-05-14T06:29:03.732026
amazon,B0GV83VRXW,Product B0GV83VRXW,"Flash Pink Girls' Bike with Sound and LED Light, 20 Inch, Ages 8-12, Unisex, Metal Frame",Toys & Games,"EGP 4,270.00",,,,EGP 4270.00EGP4270.00,In Stock,https://m.media-amazon.com/images/I/61jCg+T2VjL._AC_UL320_.jpg,https://www.amazon.eg/dp/B0GV83VRXW,2026-05-14T06:29:03.735217
amazon,B0FJS4Y25W,Product B0FJS4Y25W,دراجة اطفال ولادي SP من فلاش 4 ألوان ثلاث مقاسات - الوكيل الرسمية في مصر المنتج GTG TOYS,Toys & Games,"EGP 4,270.00",,,4.4,(7),In Stock,https://m.media-amazon.com/images/I/61YnSUjW8AL._AC_UL320_.jpg,https://www.amazon.eg/dp/B0FJS4Y25W,2026-05-14T06:29:03.741420
amazon,B0CWH4S4XH,Product B0CWH4S4XH,LEGO Harry Potter Mandrake Magical Plant Toy Figure 76433,Toys & Games,"EGP 4,279.00","EGP 4,459.00",,4.8,(958),In Stock,https://m.media-amazon.com/images/I/61zHF1a5s3L._AC_UL320_.jpg,https://www.amazon.eg/dp/B0CWH4S4XH,2026-05-14T06:29:03.745870
amazon,B014FA42SG,Product B014FA42SG,Bestway BWAY POOL SPLASH N SHADE 244X51,Toys & Games,"EGP 5,000.00",,,4.6,(281),In Stock,https://m.media-amazon.com/images/I/81mNPfACsdL._AC_UL320_.jpg,https://www.amazon.eg/dp/B014FA42SG,2026-05-14T06:29:04.536698
amazon,B0D8QMJGR3,Product B0D8QMJGR3,3-In-1 Fabstudio Vanity Easel For Kids - Pink/Blue,Toys & Games,"EGP 5,000.00",,,,EGP 5000.00EGP5000.00,In Stock,https://m.media-amazon.com/images/I/41bsFGgXdmL._AC_UL320_.jpg,https://www.amazon.eg/dp/B0D8QMJGR3,2026-05-14T06:29:04.539653
amazon,B0BBWK83F2,Product B0BBWK83F2,"LEGO City Fire Rescue Boat Building Set - Floatable Boat Toy for Boys & Girls, Ages 5+ - Kids Pretend Play Toy for Preschool - Gift for Birthdays - 60373",Toys & Games,"EGP 5,000.00",,,4.8,(1.3K),In Stock,https://m.media-amazon.com/images/I/91mzzPouV6L._AC_UL320_.jpg,https://www.amazon.eg/dp/B0BBWK83F2,2026-05-14T06:29:04.542776
amazon,B0BBRYJ4LR,Product B0BBRYJ4LR,"LEGO 41735 Friends Mobile Tiny House, Forest Camping Opening Dollshouse Playset with Toy Car, Leo & Liann Minidolls, Gift Idea for Kids 7 Plus, 2023 Characters",Toys & Games,"EGP 5,021.63",,,4.8,(885),In Stock,https://m.media-amazon.com/images/I/71KXfOdXEeL._AC_UL320_.jpg,https://www.amazon.eg/dp/B0BBRYJ4LR,2026-05-14T06:29:04.546356
amazon,B0BV7CW1VW,Product B0BV7CW1VW,"LEGO 76990 Sonic the Hedgehog Sonic's Speed Sphere Challenge Set, Buildable Toy Game with 3 Characters incl. a Moto Bug Badnik Figure, Toys for Kids, Boys & Girls 6 Plus Years Old",Toys & Games,,,,4.8,(1.4K),In Stock,https://m.media-amazon.com/images/I/61JDbD7qJpL._AC_UL320_.jpg,https://www.amazon.eg/dp/B0BV7CW1VW,2026-05-14T06:29:04.548676
amazon,B0BBS1KGWC,Product B0BBS1KGWC,LEGO® Speed Champions Pagani Utopia 76915 Building Toy Set (249 Pieces),Toys & Games,,,,4.8,(3.1K),In Stock,https://m.media-amazon.com/images/I/61BV4p8CrzL._AC_UL320_.jpg,https://www.amazon.eg/dp/B0BBS1KGWC,2026-05-14T06:29:04.551008
amazon,B07FKVD2Y2,Product B07FKVD2Y2,"Bestway 56401 Steel Pro Pool | Swimming Pool, Rectangle Above Ground Fast Set Pool, Children’s Detachable Pool, Multiple Sizes, Blue, 221 x 150 x 43 cm",Toys & Games,"EGP 5,000.00",,,4.4,(438),In Stock,https://m.media-amazon.com/images/I/71cVNI16VxL._AC_UL320_.jpg,https://www.amazon.eg/dp/B07FKVD2Y2,2026-05-14T06:29:04.554083
amazon,B0GV1KNQF4,Product B0GV1KNQF4,لعبة باسكت بول +3 سنوات,Toys & Games,"EGP 5,000.00",,,,EGP 5000.00EGP5000.00,In Stock,https://m.media-amazon.com/images/I/81G80FDVYVL._AC_UL320_.jpg,https://www.amazon.eg/dp/B0GV1KNQF4,2026-05-14T06:29:04.556898
amazon,B0GTWNBSKC,Product B0GTWNBSKC,Artist Drawing Board - 33-Piece Set,Toys & Games,,,,,(1 new offer),In Stock,https://m.media-amazon.com/images/I/51dyFfoncIL._AC_UL320_.jpg,https://www.amazon.eg/dp/B0GTWNBSKC,2026-05-14T06:29:04.558906
amazon,B0GRSNZT6N,Product B0GRSNZT6N,"Chess Board Tournament Set with Timer and Staunton Pieces, 2-Player, Ages 6 and Up, Acrylic",Toys & Games,"EGP 5,000.00",,,,EGP 5000.00EGP5000.00,In Stock,https://m.media-amazon.com/images/I/61Z7NTuu4ZL._AC_UL320_.jpg,https://www.amazon.eg/dp/B0GRSNZT6N,2026-05-14T06:29:04.561966
amazon,B0GRLBXFHD,Product B0GRLBXFHD,"Generic Chess Board Tournament Set with Timer and Staunton Pieces, 2-Player Board Game for Ages 6 and Up",Toys & Games,"EGP 5,000.00",,,,EGP 5000.00EGP5000.00,In Stock,https://m.media-amazon.com/images/I/61Z7NTuu4ZL._AC_UL320_.jpg,https://www.amazon.eg/dp/B0GRLBXFHD,2026-05-14T06:29:04.565049
amazon,B0GRL8VGYL,Product B0GRL8VGYL,B. toys Micro Urban Worker Fleet (Light& sound),Toys & Games,"EGP 5,000.00",,,,EGP 5000.00EGP5000.00,In Stock,https://m.media-amazon.com/images/I/71xD8Asl76L._AC_UL320_.jpg,https://www.amazon.eg/dp/B0GRL8VGYL,2026-05-14T06:29:04.568192
amazon,B0F74QRSN4,Product B0F74QRSN4,"YIBEIQI Kids Bike – 16"" Black x Orange with Basket & Muzzle Make Play and Go More Fun with YIBEIQI Brand Kids Bike, 16 Inch, Designed for Children Ages 4-7",Toys & Games,,,,,,In Stock,https://m.media-amazon.com/images/I/61gCJ0kyZ7L._AC_UL320_.jpg,https://www.amazon.eg/dp/B0F74QRSN4,2026-05-14T06:29:04.569515
amazon,B0F74FDDMY,Product B0F74FDDMY,"YIBEIQI Kids Bike – 16 inch Green x Black with Basket & Muzzle Make Your Play and Go More Fun with YIBEIQI Brand Kids Bike, 16 Inch, Designed for Children from 4 to 7 Years Old",Toys & Games,,,,,,In Stock,https://m.media-amazon.com/images/I/610xjy1aANL._AC_UL320_.jpg,https://www.amazon.eg/dp/B0F74FDDMY,2026-05-14T06:29:04.570843
amazon,B0F6B763X9,Product B0F6B763X9,95 Swiss Raben Old Coin Switzerland Coin,Toys & Games,"EGP 5,000.00",,,,EGP 5000.00EGP5000.00,In Stock,https://m.media-amazon.com/images/I/71Cmq6iq3tL._AC_UL320_.jpg,https://www.amazon.eg/dp/B0F6B763X9,2026-05-14T06:29:04.573663
amazon,B0D8JNCXXN,Product B0D8JNCXXN,Ssangyong Tivoli Regular & xlv Doorstep,Toys & Games,"EGP 5,000.00",,,,EGP 5000.00EGP5000.00,In Stock,https://m.media-amazon.com/images/I/715w9J+XPJL._AC_UL320_.jpg,https://www.amazon.eg/dp/B0D8JNCXXN,2026-05-14T06:29:04.576669
amazon,B0CX58SF84,Product B0CX58SF84,"DRIVEN Dump Truck R/C, Standard Size",Toys & Games,"EGP 5,000.00",,,,EGP 5000.00EGP5000.00,In Stock,https://m.media-amazon.com/images/I/71DAmLCd8LL._AC_UL320_.jpg,https://www.amazon.eg/dp/B0CX58SF84,2026-05-14T06:29:04.579672
amazon,B0CGXZ79WH,Product B0CGXZ79WH,"LEGO Star Wars Clone Trooper & Battle Droid Battle Pack Set for Kids, Buildable Toy Speeder Bike Vehicle, Tri-Droid and Defensive Post, Collectible, Gift for Boys and Girls Aged 7 and Up, 75372",Toys & Games,,,,4.8,(3.1K),In Stock,https://m.media-amazon.com/images/I/814iDqQEBlL._AC_UL320_.jpg,https://www.amazon.eg/dp/B0CGXZ79WH,2026-05-14T06:29:04.581994
amazon,B0BTXK1WP1,Product B0BTXK1WP1,Old Coin 10 Sharks Olaf 1917,Toys & Games,"EGP 5,000.00",,,,EGP 5000.00EGP5000.00,In Stock,https://m.media-amazon.com/images/I/71mUE6w5IjL._AC_UL320_.jpg,https://www.amazon.eg/dp/B0BTXK1WP1,2026-05-14T06:29:04.584809
amazon,B0BTXH2QLR,Product B0BTXH2QLR,Antique Coin Souvenir Silver Fairy Electric High Drag,Toys & Games,"EGP 5,000.00",,,,EGP 5000.00EGP5000.00,In Stock,https://m.media-amazon.com/images/I/71p1AG4eOnL._AC_UL320_.jpg,https://www.amazon.eg/dp/B0BTXH2QLR,2026-05-14T06:29:04.587625
amazon,B0BLJ4MV8V,Product B0BLJ4MV8V,"LEGO Speed Champions Pagani Utopia 76915 Race Car Toy Model Building Kit, Italian Hypercar, Collectible Racing Vehicle, 2023 Set",Toys & Games,"EGP 5,000.00",,,4.8,(2.4K),In Stock,https://m.media-amazon.com/images/I/71Q6vqdTszL._AC_UL320_.jpg,https://www.amazon.eg/dp/B0BLJ4MV8V,2026-05-14T06:29:04.590728
amazon,B0BC6QRN4Q,Product B0BC6QRN4Q,LEGO Super Heroes 76154 Sluwe Hinderlaag,Toys & Games,"EGP 5,000.00",,,5.0,(1),In Stock,https://m.media-amazon.com/images/I/71BHGlfSbGL._AC_UL320_.jpg,https://www.amazon.eg/dp/B0BC6QRN4Q,2026-05-14T06:29:04.593814
amazon,B0BBYH1HCM,Product B0BBYH1HCM,"LEGO NINJAGO Creative Ninja Brick Box 71787, Toy Storage, Bricks to Build Dojo, Ninja Car, Motorbike, 6 Minifigures & More, Toys for Kids 5 Plus",Toys & Games,"EGP 5,000.00",,,4.8,(414),In Stock,https://m.media-amazon.com/images/I/81Zww4FMA5L._AC_UL320_.jpg,https://www.amazon.eg/dp/B0BBYH1HCM,2026-05-14T06:29:04.596905
amazon,B09BP5MVVL,Product B09BP5MVVL,LEGO® Marvel Gargantos Showdown 76205 Building Kit (264 Pieces),Toys & Games,"EGP 5,000.00",,,4.7,(1.2K),In Stock,https://m.media-amazon.com/images/I/91cfeROkR0L._AC_UL320_.jpg,https://www.amazon.eg/dp/B09BP5MVVL,2026-05-14T06:29:04.600117
amazon,B096L7LCRY,Product B096L7LCRY,"Other Microfiber Towel for Cars, 30Ã—40 cm - Assorted Color-Small",Automotive,EGP 24.00,EGP 33.00,,3.6,(2.1K),In Stock,https://m.media-amazon.com/images/I/71AJWihjPoL._AC_UL320_.jpg,https://www.amazon.eg/dp/B096L7LCRY,2026-05-14T06:29:35.372400
amazon,B09NRNLTZV,Product B09NRNLTZV,"Micro fiber towel - 4 pieces, 35cmx40cm",Automotive,EGP 80.00,EGP 98.00,,3.6,(1.2K),In Stock,https://m.media-amazon.com/images/I/71Y-MqQtGzL._AC_UL320_.jpg,https://www.amazon.eg/dp/B09NRNLTZV,2026-05-14T06:29:35.376868
amazon,B09V27R871,Product B09V27R871,"NC Car Windshield Sun Shade Foldable car Sun Umbrella,Blocks UV Rays Sun Visor for car[48 25.6 inches (122 * 65 cm)] Fit Most Vehicle",Automotive,EGP 115.42,EGP 213.00,,3.6,(1.7K),In Stock,https://m.media-amazon.com/images/I/41gto9vM37L._AC_UL320_.jpg,https://www.amazon.eg/dp/B09V27R871,2026-05-14T06:29:35.381730
amazon,B0BGPLGQKQ,Product B0BGPLGQKQ,"Miytsya 1 PC Car Trash Can with Lid, Multifunctional Folding Car Dustbin Garbage Organizer Holder, Leak-Proof Hanging Mini Trash Can Containers, Suitable for Cars, Homes, Offices (Black)",Automotive,EGP 59.00,EGP 104.00,,3.4,(626),In Stock,https://m.media-amazon.com/images/I/613Kq2rkjOL._AC_UL320_.jpg,https://www.amazon.eg/dp/B0BGPLGQKQ,2026-05-14T06:29:35.386148
amazon,B0CXPDG6KV,Product B0CXPDG6KV,"Amrules 2PCS Car Interior Detailing Brush, Auto Car Detailing Brush Dusting Brush, Soft Bristles Car Interior Cleaning Tool for Dashboard Interior, Exterior, Skylight, Leather, Dust Brush Without Cap",Automotive,EGP 81.00,EGP 157.00,,3.5,(1.3K),In Stock,https://m.media-amazon.com/images/I/61b14ZGFlDL._AC_UL320_.jpg,https://www.amazon.eg/dp/B0CXPDG6KV,2026-05-14T06:29:35.391025
amazon,B0BTSHHWQM,Product B0BTSHHWQM,Frida Aqua chicka dee 460ml,Automotive,EGP 57.00,,,4.4,(237),In Stock,https://m.media-amazon.com/images/I/51elpssNZyL._AC_UL320_.jpg,https://www.amazon.eg/dp/B0BTSHHWQM,2026-05-14T06:29:35.394906
amazon,B0DRPCD2GZ,Product B0DRPCD2GZ,REOKILY 2026 Upgraded Vacuum Magnetic Car Phone Holder 360° Reinforced 96LBS Ultra Suction Cup Phone Mount for MagSafe Cell Phone Holders for Your Car/Gym/Mirror Mount for iPhone & Android,Automotive,EGP 115.00,EGP 120.00,,4.1,(3.3K),In Stock,https://m.media-amazon.com/images/I/61t7XiPnzdL._AC_UL320_.jpg,https://www.amazon.eg/dp/B0DRPCD2GZ,2026-05-14T06:29:35.399307
amazon,B096L5ZB2L,Product B096L5ZB2L,Water For Glass Wipers 2 Liter,Automotive,EGP 57.60,EGP 72.00,,4.2,(915),In Stock,https://m.media-amazon.com/images/I/81oZjO-+pDL._AC_UL320_.jpg,https://www.amazon.eg/dp/B096L5ZB2L,2026-05-14T06:29:35.403745
amazon,B0CMV9DC3L,Product B0CMV9DC3L,Fogg Air Freshener - Ice,Automotive,EGP 41.00,,,3.8,(372),In Stock,https://m.media-amazon.com/images/I/51bWqa3a7EL._AC_UL320_.jpg,https://www.amazon.eg/dp/B0CMV9DC3L,2026-05-14T06:29:35.407213
amazon,B0931ZQ9Q6,Product B0931ZQ9Q6,"RABIGALA Balaclava Face Mask Ski Mask for Men Women UV Protection Neck Gaiter for Skiing Motorcycle Black, Stretch, M",Automotive,EGP 51.30,EGP 68.30,,3.6,(1.7K),In Stock,https://m.media-amazon.com/images/I/71k7CX6oGWL._AC_UL320_.jpg,https://www.amazon.eg/dp/B0931ZQ9Q6,2026-05-14T06:29:35.412003
amazon,B0CMVB27L8,Product B0CMVB27L8,Fogg Air Freshener - Strawberry,Automotive,EGP 22.00,EGP 30.00,,4.0,(99),In Stock,https://m.media-amazon.com/images/I/51M4INEDahL._AC_UL320_.jpg,https://www.amazon.eg/dp/B0CMVB27L8,2026-05-14T06:29:35.416029
amazon,B07MX3F36F,Product B07MX3F36F,"WD-40 Rust Remover, 330ml",Automotive,EGP 258.68,EGP 2.59,,4.6,(12.3K),In Stock,https://m.media-amazon.com/images/I/61U3hZhETmL._AC_UL320_.jpg,https://www.amazon.eg/dp/B07MX3F36F,2026-05-14T06:29:35.421251
amazon,B08B88F49X,Product B08B88F49X,Joyroom JR-OK3 Car Phone Holder – Dashboard & Windshield Mount – Black 360° Rotation | Telescopic Arm | One-Hand Operation Fits 4.0–7.0″ Phones | Strong Suction | Stable Driving | 12 Months Warranty,Automotive,EGP 199.00,EGP 214.00,,3.7,(2.1K),In Stock,https://m.media-amazon.com/images/I/51R0qh7VxEL._AC_UL320_.jpg,https://www.amazon.eg/dp/B08B88F49X,2026-05-14T06:29:35.425729
amazon,B0DMF1DHF3,Product B0DMF1DHF3,Car Windshield Cleaning Degreasing Cleaning Window Rainproof Cleaning Car Glass Cleaning Brush 120ml Car Windshield Cleaner Liquid Hydrophobic Coating for Car Glass Car Cleaning Accessories,Automotive,EGP 40.00,EGP 94.00,,2.4,(215),In Stock,https://m.media-amazon.com/images/I/61ar-pQMTfL._AC_UL320_.jpg,https://www.amazon.eg/dp/B0DMF1DHF3,2026-05-14T06:29:35.429762
amazon,B0998DWDKY,Product B0998DWDKY,SCIENISH Generic Car leather tissue holder for car back seat headrest hanging tissue boxes holder case multi-use car tissue paper holder,Automotive,EGP 84.00,EGP 89.26,,3.3,(980),In Stock,https://m.media-amazon.com/images/I/61urPoaN7iS._AC_UL320_.jpg,https://www.amazon.eg/dp/B0998DWDKY,2026-05-14T06:29:35.434594
amazon,B098X8QS69,Product B098X8QS69,Ardith Removable Telescopic Car Wax Drag Nano Fiber Car Duster/Wash Brush Exterior Interior Cleaning Kit 1 Pcs Set (Multicolor),Automotive,EGP 150.00,,,3.7,(2.2K),In Stock,https://m.media-amazon.com/images/I/71YzJVp+IRS._AC_UL320_.jpg,https://www.amazon.eg/dp/B098X8QS69,2026-05-14T06:29:35.438547
amazon,B0CDC5MTQF,Product B0CDC5MTQF,"Car Gear Shift Knob Cover, Universal Protect Accessories, Silicone Automatic Protector for Most Cars (K1, Black)",Automotive,EGP 72.00,EGP 79.50,,3.2,(656),In Stock,https://m.media-amazon.com/images/I/61dSMk7IpAL._AC_UL320_.jpg,https://www.amazon.eg/dp/B0CDC5MTQF,2026-05-14T06:29:35.442961
amazon,B0B2JHS3ZS,Product B0B2JHS3ZS,generic PRAMUKHAM Car Cleaning Microfiber Removable Telescopic Brush Dusting Tool Car and Solar Panel Washing Mop Dash Duster Exterior Interior Cleaning Car Duster 1 Pcs,Automotive,EGP 99.75,EGP 136.00,,3.9,(122),In Stock,https://m.media-amazon.com/images/I/61yCERp-LYL._AC_UL320_.jpg,https://www.amazon.eg/dp/B0B2JHS3ZS,2026-05-14T06:29:35.447374
amazon,B0DCFZFML2,Product B0DCFZFML2,Joyroom JR‑TCF21 20W Dual‑Port USB‑A & USB‑C Fast Charger Compact Wall Charger for Smartphones & Tablets – White (12‑Month Warranty),Automotive,EGP 281.89,EGP 307.00,,4.3,(55),In Stock,https://m.media-amazon.com/images/I/41JekojYY1L._AC_UL320_.jpg,https://www.amazon.eg/dp/B0DCFZFML2,2026-05-14T06:29:35.452632
amazon,B088DJ8CKR,Product B088DJ8CKR,"FLAMINGO CARCARE TECH A/C PRO, AC CLEANER, AIR CONDITIONER CLEANER, ANTI BACKTERIAL, ANTI CORROSIVE, F020, 500ML, منظف مكيف, معقم مكيف, غسيل مكيف, مزيل الرائحة و يقضي على البكتريا والجراثيم في المكيف",Automotive,EGP 209.64,,,4.1,(222),In Stock,https://m.media-amazon.com/images/I/61pmxST5RQL._AC_UL320_.jpg,https://www.amazon.eg/dp/B088DJ8CKR,2026-05-14T06:29:35.456571
amazon,B0CQ4QJWTD,Product B0CQ4QJWTD,"2 Packs Car Window Sunshade Curtains, Foldable Suction Cup Auto Side Window Sun Visor Shield Sunshade Protector, Car Window Privacy Blackout UV Rays Heat Reflector for Breastfeeding, Taking a Nap",Automotive,EGP 105.00,,,3.5,(67),In Stock,https://m.media-amazon.com/images/I/611CXWBFpxL._AC_UL320_.jpg,https://www.amazon.eg/dp/B0CQ4QJWTD,2026-05-14T06:29:35.460431
amazon,B07HZ2DN8Z,Product B07HZ2DN8Z,A1+ Shades Automotive Car Windshield Sunshade Car Sunshade Front Window Car Sun Shade Car Windshield Shade Truck Sun Shade for Windshield Suvs Minivan (Small),Automotive,EGP 100.00,EGP 150.82,,4.4,(8.5K),In Stock,https://m.media-amazon.com/images/I/711dYrMKcrL._AC_UL320_.jpg,https://www.amazon.eg/dp/B07HZ2DN8Z,2026-05-14T06:29:35.464865
amazon,B0BX9LS16N,Product B0BX9LS16N,"AOCISKA Car Interior Detailing Soft Bristle Cleaning Detailing Brush Dusting,Car Interior Cleaning Tool,Auto Detail Dash Duster Brush (Black)",Automotive,EGP 49.00,EGP 62.00,,3.7,(6K),In Stock,https://m.media-amazon.com/images/I/718gbpFsIqL._AC_UL320_.jpg,https://www.amazon.eg/dp/B0BX9LS16N,2026-05-14T06:29:35.469561
amazon,B0DN237DS4,Product B0DN237DS4,"Reflective Phosphorescent Seat Belt Covers For your safety in Car, Night Driving, 2-Pack (Green)",Automotive,EGP 28.00,,,4.1,(69),In Stock,https://m.media-amazon.com/images/I/41inJV87BzL._AC_UL320_.jpg,https://www.amazon.eg/dp/B0DN237DS4,2026-05-14T06:29:35.473947
amazon,B0BYXNFXV5,Product B0BYXNFXV5,TotalEnergies QUARTZ 5000 SL 20W-50-5 Liter Engine Oil for Passenger Car (5 Liters),Automotive,EGP 799.20,,,4.3,(332),In Stock,https://m.media-amazon.com/images/I/61VJgigVzoL._AC_UL320_.jpg,https://www.amazon.eg/dp/B0BYXNFXV5,2026-05-14T06:30:21.296780
amazon,B0F6T6N2B1,Product B0F6T6N2B1,"Carlinkit Mini Ultra CarPlay Wireless Adapter for iPhone, Wireless Android Auto Adapter, Converts Wired to Wireless CarPlay and Android Auto, Plug-and-Play Setup,Compatible with Cars from 2016+",Automotive,EGP 915.00,"EGP 1,254.00",,3.8,(652),In Stock,https://m.media-amazon.com/images/I/6104sxLr4zL._AC_UL320_.jpg,https://www.amazon.eg/dp/B0F6T6N2B1,2026-05-14T06:30:21.301069
amazon,B0D9NPDLG3,Product B0D9NPDLG3,"Anker USB-C Car Charger, 75W Max Ultra-Compact Type-C Fast Car Charger with Built-in Retractable Cable, Car Adapter for iPhone 16/15/14 Series, MacBook Pro/Air, iPad, Galaxy, AirPods, and More",Automotive,EGP 945.00,,,4.7,(2.5K),In Stock,https://m.media-amazon.com/images/I/61AWjk2OVkL._AC_UL320_.jpg,https://www.amazon.eg/dp/B0D9NPDLG3,2026-05-14T06:30:21.304464
amazon,B0BSNMQ3MV,Product B0BSNMQ3MV,TotalEnergies COOLELF AUTO SUPRA -26°C - 4 - Liters - Antifreeze and Coolants,Automotive,EGP 529.00,,,4.7,(236),In Stock,https://m.media-amazon.com/images/I/71S8rKLkJFL._AC_UL320_.jpg,https://www.amazon.eg/dp/B0BSNMQ3MV,2026-05-14T06:30:21.307824
