platform,product_id,title,brand,category,current_price,original_price,discount,rating,reviews_count,availability,main_image,product_url,scraped_at
amazon,B0FHK7Z6XT,Product B0FHK7Z6XT,"Infinix XWatch N4 pro (XW4E)- Obsidian Black,1.43"" Amoled HD screen, IP68 Waterproof, Up to12 days usage time, V5.3,Heart rate,SPO2,300mAh battery, Wireless Charging, supports call,12 Month Warranty.",Office Supplies,"EGP 2,500.00","EGP 3,470.00",,3.6,(5),In Stock,https://m.media-amazon.com/images/I/81MKe2-mDZL._AC_UL320_.jpg,https://www.amazon.eg/dp/B0FHK7Z6XT,2026-05-23T06:19:44.220466
amazon,B0CTCLBST5,Product B0CTCLBST5,"Samsung Galaxy Fit3 Smartwatch, Exercise and Sleep Tracking, Fall Detection, Bluetooth, 40mm, Gray",Office Supplies,"EGP 2,100.00",,,4.3,(3.1K),In Stock,https://m.media-amazon.com/images/I/61K2qby-3oL._AC_UL320_.jpg,https://www.amazon.eg/dp/B0CTCLBST5,2026-05-23T06:19:44.224281
amazon,B01KZO9010,Product B01KZO9010,Fresh Wall Fan Shabah 20 Inch,Office Supplies,"EGP 2,004.00","EGP 2,130.00",,4.3,(388),In Stock,https://m.media-amazon.com/images/I/71BcfWE2TmL._AC_UL320_.jpg,https://www.amazon.eg/dp/B01KZO9010,2026-05-23T06:19:44.229405
amazon,B098TTS66G,Product B098TTS66G,"Fresh washing machine with antibacterial spin drum - white, 4Kg",Office Supplies,"EGP 2,235.00",,,4.0,(532),In Stock,https://m.media-amazon.com/images/I/41rVRroZQIL._AC_UL320_.jpg,https://www.amazon.eg/dp/B098TTS66G,2026-05-23T06:19:44.233264
amazon,B0BBRMRPPR,Product B0BBRMRPPR,Olympic electric water heater/hero / 50 lt enamel - hero digital display,Office Supplies,"EGP 4,799.00","EGP 6,321.73",,4.3,(126),In Stock,https://m.media-amazon.com/images/I/51k8qSdGYEL._AC_UL320_.jpg,https://www.amazon.eg/dp/B0BBRMRPPR,2026-05-23T06:19:44.237510
amazon,B0BZZJWGPQ,Product B0BZZJWGPQ,Kérastase Nutritive 8H Magic Night Serum for Dry Hair 90ml,Office Supplies,"EGP 2,328.23",,,4.6,(7.3K),In Stock,https://m.media-amazon.com/images/I/51LZstXj+IL._AC_UL320_.jpg,https://www.amazon.eg/dp/B0BZZJWGPQ,2026-05-23T06:19:44.240926
amazon,B0FKN93TCN,Product B0FKN93TCN,"HUAWEI FreeBuds 7i (Conch-T010) Wireless Bluetooth Earphones, Active Noise Cancelling, 55.5 mAh Earbuds + 510 mAh Charging Case, Built-in Lithium-Ion Battery, White",Office Supplies,"EGP 3,510.00","EGP 4,499.00",,4.1,(369),In Stock,https://m.media-amazon.com/images/I/61CBCexvicL._AC_UL320_.jpg,https://www.amazon.eg/dp/B0FKN93TCN,2026-05-23T06:19:44.245779
amazon,B01N0Y6D8Z,Product B01N0Y6D8Z,Arzum Okka - Turkish Coffee Machine Minio - Black/Chrome - OK004-K,Office Supplies,"EGP 2,799.00","EGP 3,794.99",,4.2,(1.3K),In Stock,https://m.media-amazon.com/images/I/61PVYIad79L._AC_UL320_.jpg,https://www.amazon.eg/dp/B01N0Y6D8Z,2026-05-23T06:19:44.249467
amazon,B0DCBTWXLM,Product B0DCBTWXLM,"soundcore Liberty 4 Pro by Anker, Noise Cancelling Wireless Earbuds, 7-Sensor and Real-Time Adaptive Noise Cancelling, 2× Faster Charging, Studio-Level Hi-Fi Music, Clear Calls with 6 Mics and AI",Office Supplies,"EGP 4,363.33",,,4.1,(4.1K),In Stock,https://m.media-amazon.com/images/I/51EBquSzXNL._AC_UL320_.jpg,https://www.amazon.eg/dp/B0DCBTWXLM,2026-05-23T06:19:44.253342
amazon,B075CP646D,Product B075CP646D,"Nokia 105 Dual Sim, 4MB 2G Phone, Black",Health & Personal Care,EGP 565.66,,,3.1,(9.1K),In Stock,https://m.media-amazon.com/images/I/61lhBBERORL._AC_UL320_.jpg,https://www.amazon.eg/dp/B075CP646D,2026-05-23T06:19:48.221374
amazon,B07XLML2YS,Product B07XLML2YS,"Tapo c200 360-degree smart wi-fi pan and tilt camera, 1080 p - white",Health & Personal Care,EGP 808.98,EGP 909.00,,4.6,(147.2K),In Stock,https://m.media-amazon.com/images/I/41a5w8F1xGL._AC_UL320_.jpg,https://www.amazon.eg/dp/B07XLML2YS,2026-05-23T06:19:48.225425
amazon,B0D2YX39MB,Product B0D2YX39MB,Amazon.eg eGift Card - (Digital Delivery),Health & Personal Care,EGP 1.00,"EGP 2,000.00",,4.4,(277),In Stock,https://m.media-amazon.com/images/I/517hY12cdLL._AC_UL320_.jpg,https://www.amazon.eg/dp/B0D2YX39MB,2026-05-23T06:19:48.228033
amazon,B0D49ZSBFV,Product B0D49ZSBFV,Ariel Automatic Detergent Powder Touch of Downy 8 KG (packaging may vary),Health & Personal Care,EGP 653.32,,,4.5,(2.2K),In Stock,https://m.media-amazon.com/images/I/71vCkrk1ttL._AC_UL320_.jpg,https://www.amazon.eg/dp/B0D49ZSBFV,2026-05-23T06:19:48.231637
amazon,B0976Z2D1G,Product B0976Z2D1G,"Pampers premium EXTRA care Taped diapers, size 6, with Lotion with Aloe Vera, 48 baby diapers",Health & Personal Care,EGP 537.51,EGP 558.00,,4.5,(4K),In Stock,https://m.media-amazon.com/images/I/81xwRgyCzWL._AC_UL320_.jpg,https://www.amazon.eg/dp/B0976Z2D1G,2026-05-23T06:19:48.235661
amazon,B0G5PRV5YP,Product B0G5PRV5YP,Finish Powerball Ultimate Plus Dishwasher Detergent - Lemon Fragrance Scent| 45 Tablets x 2,Health & Personal Care,EGP 699.99,EGP 731.90,,4.7,(158),In Stock,https://m.media-amazon.com/images/I/61Yi7DNmDPL._AC_UL320_.jpg,https://www.amazon.eg/dp/B0G5PRV5YP,2026-05-23T06:19:48.238947
amazon,B0B433G4MV,Product B0B433G4MV,OXI LS Fine Fragrance 8KG + 1KG,Health & Personal Care,EGP 559.07,,,4.7,(264),In Stock,https://m.media-amazon.com/images/I/81IeOGm9ihL._AC_UL320_.jpg,https://www.amazon.eg/dp/B0B433G4MV,2026-05-23T06:19:48.241781
amazon,B09CDPFFZ1,Product B09CDPFFZ1,Tank PRO Cartridge - 6 Purification Compressed Functions with BACTBAN Technology,Health & Personal Care,EGP 599.00,EGP 689.00,,4.4,(597),In Stock,https://m.media-amazon.com/images/I/51RAYaUR2DL._AC_UL320_.jpg,https://www.amazon.eg/dp/B09CDPFFZ1,2026-05-23T06:19:48.245390
amazon,B0976ZF83N,Product B0976ZF83N,"Pampers Baby Dry Pants Diapers, size 5, 12-18 kg, with Lotion with Olive Oil, 70 baby Diapers",Health & Personal Care,EGP 538.99,,,4.2,(1.2K),In Stock,https://m.media-amazon.com/images/I/71CjsVEv6hL._AC_UL320_.jpg,https://www.amazon.eg/dp/B0976ZF83N,2026-05-23T06:19:48.248231
amazon,B0D6R8Z4K1,Product B0D6R8Z4K1,SkyLine Stand Fan 18`` JET 6 Blades - مروحة سكاي لاين ستاند 18 بوصة جيت,Health & Personal Care,EGP 999.00,"EGP 1,120.00",,3.4,(335),In Stock,https://m.media-amazon.com/images/I/51VTnq9rciL._AC_UL320_.jpg,https://www.amazon.eg/dp/B0D6R8Z4K1,2026-05-23T06:19:48.251928
amazon,B09X4FJJJ5,Product B09X4FJJJ5,VGR V-393 Washable Double Sided Double Blade Shaver Set Hybrid,Health & Personal Care,EGP 897.00,,,4.1,(299),In Stock,https://m.media-amazon.com/images/I/61OccGxXyDL._AC_UL320_.jpg,https://www.amazon.eg/dp/B09X4FJJJ5,2026-05-23T06:19:48.255117
amazon,B09DGKXFLK,Product B09DGKXFLK,Ludwik All-In-One Mint Dishwasher Tablets 2 x 30-Pieces,Health & Personal Care,EGP 600.00,,,4.5,(305),In Stock,https://m.media-amazon.com/images/I/81NnpQ1ycwL._AC_UL320_.jpg,https://www.amazon.eg/dp/B09DGKXFLK,2026-05-23T06:19:48.257946
amazon,B0BF5C2S2Y,Product B0BF5C2S2Y,"Pampers Premium EXTRA CARE Taped Diapers, Size 3, 6-10 kg, with Lotion with Aloe Vera, Saving Pack, 84 Baby Diapers",Health & Personal Care,EGP 595.45,EGP 613.00,,4.5,(4K),In Stock,https://m.media-amazon.com/images/I/81asxTK-mjL._AC_UL320_.jpg,https://www.amazon.eg/dp/B0BF5C2S2Y,2026-05-23T06:19:48.261955
amazon,B075L6BL61,Product B075L6BL61,Karseell Hair Repair Mask - Deep Conditioning MACA Collagen for Dry Damaged Hair (16.9 fl oz),Health & Personal Care,EGP 683.50,EGP 810.00,,4.6,(30.9K),In Stock,https://m.media-amazon.com/images/I/51R-VS4++KL._AC_UL320_.jpg,https://www.amazon.eg/dp/B075L6BL61,2026-05-23T06:19:48.265217
amazon,B0GXGTX3JF,Product B0GXGTX3JF,Domana (DOMANA) Medical Memory Foam Pillow for Neck and Back Pain - Ergonomic Design for Spinal Support with Washable Cover for Healthy and Comfortable Sleep (50 * 30),Health & Personal Care,EGP 550.00,,,4.7,(7),In Stock,https://m.media-amazon.com/images/I/61q1W-GG+jL._AC_UL320_.jpg,https://www.amazon.eg/dp/B0GXGTX3JF,2026-05-23T06:19:48.268369
amazon,B077N513Z1,Product B077N513Z1,Maybelline New York Superstay Matte Ink Liquid Lipstick - 65 Seductress,Health & Personal Care,EGP 510.48,EGP 685.00,,4.4,(33.2K),In Stock,https://m.media-amazon.com/images/I/51X8cvkamAL._AC_UL320_.jpg,https://www.amazon.eg/dp/B077N513Z1,2026-05-23T06:19:48.272578
amazon,B00AHXXJVW,Product B00AHXXJVW,TP-Link 300MBPS TL-WA850RE Wi-Fi Range Extender - White,Health & Personal Care,EGP 729.00,,,4.5,(32.6K),In Stock,https://m.media-amazon.com/images/I/61eCzGg4AXL._AC_UL320_.jpg,https://www.amazon.eg/dp/B00AHXXJVW,2026-05-23T06:19:48.276149
amazon,B0FPBGYYM5,Product B0FPBGYYM5,Truman - Digital Satellite Receiver Mini HD - TM 9K,Health & Personal Care,EGP 540.00,,,4.1,(104),In Stock,https://m.media-amazon.com/images/I/51ex3OWwJkL._AC_UL320_.jpg,https://www.amazon.eg/dp/B0FPBGYYM5,2026-05-23T06:19:48.279309
amazon,B09LT848WD,Product B09LT848WD,"Red Bull Energy Drink, 250 ml, (12 pack)",Health & Personal Care,EGP 639.70,,,4.7,(55),In Stock,https://m.media-amazon.com/images/I/71dZltqdUSL._AC_UL320_.jpg,https://www.amazon.eg/dp/B09LT848WD,2026-05-23T06:19:48.282146
amazon,B06XYLG4KB,Product B06XYLG4KB,"Gillette Venus ComfortGlide Breeze Blades Refills 3 Bladed, 4 Count",Health & Personal Care,EGP 540.00,EGP 575.00,,4.6,(1.5K),In Stock,https://m.media-amazon.com/images/I/71Ugh4yb5LL._AC_UL320_.jpg,https://www.amazon.eg/dp/B06XYLG4KB,2026-05-23T06:19:48.285797
amazon,B095PWZ1V5,Product B095PWZ1V5,Dettol Antiseptic Antibacterial Disinfectant Liquid -| 950ML x 2| 40% OFF,Health & Personal Care,EGP 679.95,EGP 713.00,,4.7,(434),In Stock,https://m.media-amazon.com/images/I/81ANNBwq3DL._AC_UL320_.jpg,https://www.amazon.eg/dp/B095PWZ1V5,2026-05-23T06:19:48.289485
amazon,B08YDR6TJ1,Product B08YDR6TJ1,"NAN Optipro Stage 3 (1 - 3 years), 800g",Health & Personal Care,EGP 633.99,EGP 665.00,,4.6,(292),In Stock,https://m.media-amazon.com/images/I/71n6VyIvDfL._AC_UL320_.jpg,https://www.amazon.eg/dp/B08YDR6TJ1,2026-05-23T06:19:48.292803
amazon,B0DBGSRW73,Product B0DBGSRW73,مصحف القرآن تدبر وعمل حجم ٢٨*٢٠,Health & Personal Care,EGP 585.00,,,4.1,(13),In Stock,https://m.media-amazon.com/images/I/71AjdomGn7L._AC_UL320_.jpg,https://www.amazon.eg/dp/B0DBGSRW73,2026-05-23T06:19:48.296110
amazon,B0G5JF2FC2,Product B0G5JF2FC2,Daly Women's Wide Leg Plus Size Jeans,Health & Personal Care,EGP 680.00,EGP 700.00,,3.7,(46),In Stock,https://m.media-amazon.com/images/I/416V9d29cyL._AC_UL320_.jpg,https://www.amazon.eg/dp/B0G5JF2FC2,2026-05-23T06:19:48.300623
amazon,B0CL3G5ZCS,Product B0CL3G5ZCS,Cottonil Men Set of 6 Everyday Boxer Shorts (pack of 6),Health & Personal Care,EGP 576.00,,,4.0,(927),In Stock,https://m.media-amazon.com/images/I/61BrklOTicL._AC_UL320_.jpg,https://www.amazon.eg/dp/B0CL3G5ZCS,2026-05-23T06:19:48.304358
amazon,B0BVZYZYX5,Product B0BVZYZYX5,Fairy automatic dishwasher platinum plus 50 capsules,Health & Personal Care,EGP 536.99,,,4.6,(4.1K),In Stock,https://m.media-amazon.com/images/I/71IonAg5J6L._AC_UL320_.jpg,https://www.amazon.eg/dp/B0BVZYZYX5,2026-05-23T06:19:48.307599
amazon,B0F4C2L474,Product B0F4C2L474,Clothes Rack with Double Rods 1.10M Metal Clothes Coat Rack Shoes Rack Clothes Rack Multipurpose Clothes Hanger Organizer (Black),Health & Personal Care,EGP 625.00,,,4.0,(66),In Stock,https://m.media-amazon.com/images/I/41eXBZhttmL._AC_UL320_.jpg,https://www.amazon.eg/dp/B0F4C2L474,2026-05-23T06:19:48.310792
amazon,B0GM7ZXZ55,Product B0GM7ZXZ55,Organic nation Berberine-60Serv.-60Caps,Health & Personal Care,EGP 695.00,,,4.4,(20),In Stock,https://m.media-amazon.com/images/I/61itxDLjvKL._AC_UL320_.jpg,https://www.amazon.eg/dp/B0GM7ZXZ55,2026-05-23T06:19:48.313227
amazon,B09QQT41TP,Product B09QQT41TP,Dercos Anti-Dandruff Shampoo Oily 200Ml,Health & Personal Care,EGP 610.00,EGP 768.00,,4.6,(729),In Stock,https://m.media-amazon.com/images/I/714uXn5lnLL._AC_UL320_.jpg,https://www.amazon.eg/dp/B09QQT41TP,2026-05-23T06:19:48.316514
amazon,B097713S53,Product B097713S53,"Pampers Pants, Size 4, with Lotion with Olive Oil, 80 Baby Diapers",Health & Personal Care,EGP 641.38,,,4.2,(1.2K),In Stock,https://m.media-amazon.com/images/I/71XkeHepC1L._AC_UL320_.jpg,https://www.amazon.eg/dp/B097713S53,2026-05-23T06:19:48.319336
amazon,B0CXMYJT8W,Product B0CXMYJT8W,"Oraimo Watch 4 Plus: 2.01"" HD Display & Bluetooth Calling All-in-One Fitness: 100+ Sports Modes & Health Tracking Rugged IP68 Waterproof Design for Daily Performance",Health & Personal Care,EGP 999.00,"EGP 1,199.00",,4.0,(307),In Stock,https://m.media-amazon.com/images/I/61Yj9K3WJrL._AC_UL320_.jpg,https://www.amazon.eg/dp/B0CXMYJT8W,2026-05-23T06:19:48.323347
amazon,B0DXLBNG6K,Product B0DXLBNG6K,"Anker Zolo 1C Wall Charger Type-C 30W Fast Charging, Improved Temperature Control, Small Design and Charge 3X Faster, Compatible with iPhone, iPad, Samsung, Pixel and - Black -18 Months Warranty",Health & Personal Care,EGP 699.00,,,4.5,(652),In Stock,https://m.media-amazon.com/images/I/41E4kEpByfL._AC_UL320_.jpg,https://www.amazon.eg/dp/B0DXLBNG6K,2026-05-23T06:19:48.326898
amazon,B0DK4Y2YP3,Product B0DK4Y2YP3,celimax Retinal shot tightening Booster for Firm skin 15 ml,Health & Personal Care,EGP 770.00,"EGP 1,081.86",,4.4,(13.8K),In Stock,https://m.media-amazon.com/images/I/51utpRckeQL._AC_UL320_.jpg,https://www.amazon.eg/dp/B0DK4Y2YP3,2026-05-23T06:19:48.330178
amazon,B0CQ5GGM86,Product B0CQ5GGM86,Cottonil Men Set of 6 Everyday Boxer Shorts (pack of 6),Health & Personal Care,EGP 612.00,,,4.0,(927),In Stock,https://m.media-amazon.com/images/I/71kdcuj9hiL._AC_UL320_.jpg,https://www.amazon.eg/dp/B0CQ5GGM86,2026-05-23T06:19:48.333882
amazon,B0B4344YG7,Product B0B4344YG7,OXI LS ORIENTAL 8KG + 1KG,Health & Personal Care,EGP 630.00,,,4.5,(619),In Stock,https://m.media-amazon.com/images/I/81B6a-OciTL._AC_UL320_.jpg,https://www.amazon.eg/dp/B0B4344YG7,2026-05-23T06:19:48.340661
amazon,B0DBHRWRKC,Product B0DBHRWRKC,"Xiaomi Wireless Earphones, Redmi buds 6 Play, 36 Hours Playtime, AI Call Noise Reduction, Ultra Lightweight, Compatible with Google Fast Pair, Fast Charging, Black |6 month manufacturer warranty",Health & Personal Care,EGP 749.00,EGP 855.00,,4.0,(21.1K),In Stock,https://m.media-amazon.com/images/I/613gJ8g29aL._AC_UL320_.jpg,https://www.amazon.eg/dp/B0DBHRWRKC,2026-05-23T06:19:48.346195
amazon,B00EYW1U68,Product B00EYW1U68,Tp-link TL-WA855RE 300 Mbps Wi-Fi Range Extender,Health & Personal Care,EGP 848.98,,,4.4,(20.6K),In Stock,https://m.media-amazon.com/images/I/41wUOrzC40L._AC_UL320_.jpg,https://www.amazon.eg/dp/B00EYW1U68,2026-05-23T06:19:48.349741
amazon,B013YBAA60,Product B013YBAA60,Gillette Fusion5 Power Blade Refills – Pack of 4,Health & Personal Care,EGP 704.35,,,4.6,(4.7K),In Stock,https://m.media-amazon.com/images/I/61ItYU5dm2L._AC_UL320_.jpg,https://www.amazon.eg/dp/B013YBAA60,2026-05-23T06:19:48.353398
amazon,B0GPSPR5C1,Product B0GPSPR5C1,Charleston Women's High Lycra Special Size Jeans Dark Blue sh dark-$P,Health & Personal Care,EGP 800.00,,,4.2,(88),In Stock,https://m.media-amazon.com/images/I/51LArc33UcL._AC_UL320_.jpg,https://www.amazon.eg/dp/B0GPSPR5C1,2026-05-23T06:19:48.356594
amazon,B0FMQZM6YN,Product B0FMQZM6YN,"MC200 Pan & Tilt Home Security Wi-Fi Camera,360° horizontal, enabling complete coverage of the area,1080p high-definition video, providing users with clear and detailed footage, Two-Way Audio.",Health & Personal Care,EGP 687.00,,,4.5,(99),In Stock,https://m.media-amazon.com/images/I/51YubpaqWXL._AC_UL320_.jpg,https://www.amazon.eg/dp/B0FMQZM6YN,2026-05-23T06:19:48.359457
amazon,B088QGQ3WJ,Product B088QGQ3WJ,Fresh Boxer Fan 12 Inch,Health & Personal Care,EGP 929.00,,,4.4,(1K),In Stock,https://m.media-amazon.com/images/I/61hfBVDjRXL._AC_UL320_.jpg,https://www.amazon.eg/dp/B088QGQ3WJ,2026-05-23T06:19:48.363337
amazon,B0FCZTYSN6,Product B0FCZTYSN6,Kingston Canvas Select Plus microSD Memory Card 128GB microSDXC Gen3 150MB/s A1 Card + Adapter - SDCS3/128GB,Health & Personal Care,EGP 999.00,,,4.5,(1.1K),In Stock,https://m.media-amazon.com/images/I/71913emXQOL._AC_UL320_.jpg,https://www.amazon.eg/dp/B0FCZTYSN6,2026-05-23T06:19:48.366496
amazon,B0BLZMXKY3,Product B0BLZMXKY3,"Pampers Premium Care Pants Diapers Case, With Lotion, with Aloe Vera, Size 4, 9-14KG, 88 Diaper (Pack of 2-44 * 2) (pack may vary)",Health & Personal Care,,,,4.3,(1K),In Stock,https://m.media-amazon.com/images/I/81aRZNi1uqL._AC_UL320_.jpg,https://www.amazon.eg/dp/B0BLZMXKY3,2026-05-23T06:19:48.368570
amazon,B07FSR1VB3,Product B07FSR1VB3,"Illy Espresso Medium Roasted Ground Coffee, 250g",Health & Personal Care,EGP 562.50,EGP 629.00,,4.4,(6.5K),In Stock,https://m.media-amazon.com/images/I/71LPcssfRvL._AC_UL320_.jpg,https://www.amazon.eg/dp/B07FSR1VB3,2026-05-23T06:19:48.372601
amazon,B0BM6J9ZP4,Product B0BM6J9ZP4,VGR V-962 Professional Pro Self Haircut Hair Clipper Beard trimmer Digital Display Blades USB Charging cable 4 Guide Combs for men 0mm Bald Head Clipper Runtime 200 mins 1200 mAh Li-ion Battery,Health & Personal Care,EGP 513.60,,,4.4,(2.8K),In Stock,https://m.media-amazon.com/images/I/71qCR40EXHL._AC_UL320_.jpg,https://www.amazon.eg/dp/B0BM6J9ZP4,2026-05-23T06:19:48.375813
amazon,9777642695,Product 9777642695,مصحف القيام حجم 20*28 مع التقسيم الموضوعي لآيات القرآن الكريم وقارىء QR كود لكل صفحة,Health & Personal Care,EGP 550.00,,,4.8,(6),In Stock,https://m.media-amazon.com/images/I/61giJ46jpgL._AC_UL320_.jpg,https://www.amazon.eg/dp/9777642695,2026-05-23T06:19:48.378653
amazon,B000LAKYW8,Product B000LAKYW8,"Casio Collection Unisex Adults Watch A168WA, Silver, Bracelet",Health & Personal Care,EGP 588.24,,,2.7,(19.7K),In Stock,https://m.media-amazon.com/images/I/613BThUhjoL._AC_UL320_.jpg,https://www.amazon.eg/dp/B000LAKYW8,2026-05-23T06:19:48.381865
amazon,B0G26K5Y9X,Product B0G26K5Y9X,"XIAOMI Mijia Brushless Electric Drill 2 Gen,Maximum 50N·m Torque,32-Speed Gear,Brushless Motor Type C",Industrial,"EGP 5,000.00","EGP 6,199.00",,4.0,(1),In Stock,https://m.media-amazon.com/images/I/615Q1ZUF7uL._AC_UL320_.jpg,https://www.amazon.eg/dp/B0G26K5Y9X,2026-05-23T06:24:16.484628
amazon,B0FDBBHXBP,Product B0FDBBHXBP,"YATO Hot Air Soldering Station, 750W, Digital Tool for Precision Soldering and Desoldering in Electronics and Repairs",Industrial,"EGP 5,000.00",,,,EGP 5000.00EGP5000.00,In Stock,https://m.media-amazon.com/images/I/610fdEVFU6L._AC_UL320_.jpg,https://www.amazon.eg/dp/B0FDBBHXBP,2026-05-23T06:24:16.487619
amazon,B093259TRY,Product B093259TRY,"KEWEI Commode Toilet Chair， Heavy Duty Steel Medical Folding Supply With Safety Frame Rails Bedside, For Disabled, Elderly, Pregnant Woman",Industrial,"EGP 5,000.00",,,2.8,(3),In Stock,https://m.media-amazon.com/images/I/51bGdQPIcVL._AC_UL320_.jpg,https://www.amazon.eg/dp/B093259TRY,2026-05-23T06:24:16.491276
amazon,B0DDCF6YX9,Product B0DDCF6YX9,"Fuzion Digital Shipping Postal Scale - 88lb x 0.1oz, Stainless Steel Platform, 5 Units, Hold/Tare/PCS Counting, Easy Calibration, Large LCD, Scale for Packages, All-in-1 Shipping Scale",Industrial,"EGP 5,000.00",,,4.7,(359),In Stock,https://m.media-amazon.com/images/I/71xdP6wGwaL._AC_UL320_.jpg,https://www.amazon.eg/dp/B0DDCF6YX9,2026-05-23T06:24:16.494466
amazon,B09RKB6Z8R,Product B09RKB6Z8R,Total 20V Tree Branch Trim Scissors Model: TOTAL TSSLI2001,Industrial,"EGP 5,000.00",,,4.2,(5),In Stock,https://m.media-amazon.com/images/I/51nvWTpo8pL._AC_UL320_.jpg,https://www.amazon.eg/dp/B09RKB6Z8R,2026-05-23T06:24:16.497739
amazon,B0D9P2HCBW,Product B0D9P2HCBW,Large Digital Kitchen Scale 40kg/88lb Stainless Steel Price Computing Scale Counting Scale Deli Scale with LCD Display for Baking Bread Cooking Meat Prep Parts and Coins Adapter Included (Black),Industrial,"EGP 5,000.00",,,4.6,(108),In Stock,https://m.media-amazon.com/images/I/7136Rgpw2AL._AC_UL320_.jpg,https://www.amazon.eg/dp/B0D9P2HCBW,2026-05-23T06:24:16.500785
amazon,B0CFHT2NL9,Product B0CFHT2NL9,"Rosa FM Golden Shell Organic Porcelain Round Dinner Set 24 Pieces - Multi Color 6 Dessert Plates, 6 Soup Plates, 6 Dinner Plates, 6 Bowls",Industrial,"EGP 5,000.00",,,4.0,(7),In Stock,https://m.media-amazon.com/images/I/517+xsK96fL._AC_UL320_.jpg,https://www.amazon.eg/dp/B0CFHT2NL9,2026-05-23T06:24:16.503818
amazon,B0922YPS5F,Product B0922YPS5F,"Total Tools High Pressure Washer, 150 Bar",Industrial,"EGP 5,000.00",,,5.0,(1),In Stock,https://m.media-amazon.com/images/I/61rAiRDUjdL._AC_UL320_.jpg,https://www.amazon.eg/dp/B0922YPS5F,2026-05-23T06:24:16.507303
amazon,B0F8J76HVP,Product B0F8J76HVP,Digital Lab Scale 5000g x 0.1g LCD Display Analytical Balance Jewelry Scale with Charging Precision Electronic Scale Scientific Scale 0.1g Accuracy for Laboratory Kitchen Measurement,Industrial,"EGP 5,000.00",,,4.3,(13),In Stock,https://m.media-amazon.com/images/I/71-q5U6g75L._AC_UL320_.jpg,https://www.amazon.eg/dp/B0F8J76HVP,2026-05-23T06:24:16.510333
amazon,B091J6L6ZN,Product B091J6L6ZN,inGCO GCS45185 Gasoline Chain Saw - 1800 Watt,Industrial,"EGP 5,000.00",,,3.8,(4),In Stock,https://m.media-amazon.com/images/I/51SIaL-5kzL._AC_UL320_.jpg,https://www.amazon.eg/dp/B091J6L6ZN,2026-05-23T06:24:16.513444
amazon,B0DQL26W7X,Product B0DQL26W7X,"Digital Postal Scale, 88lb/0.1oz, Stainless Steel Platform, 5 Units, Hold/PCS Function, Back-lit LCD Display, Scale for Package and Office, All-in-1 Shipping Scale, with a Tape",Industrial,"EGP 5,000.00",,,4.4,(78),In Stock,https://m.media-amazon.com/images/I/71zdL+DmiEL._AC_UL320_.jpg,https://www.amazon.eg/dp/B0DQL26W7X,2026-05-23T06:24:16.516464
amazon,B0F6K5R8RN,Product B0F6K5R8RN,"UNIWEIGH Milligram Scale Precision 0.001g/50g, Digital Jewelry Scale for Powder,Coins,Gold,Gem,Reloading,Micro Gram Scale with 6 Units,Tare,Cal Weight,Pocket mg Scale with USB&Battery Powered",Industrial,"EGP 5,000.00",,,4.5,(213),In Stock,https://m.media-amazon.com/images/I/81V-v1GXN0L._AC_UL320_.jpg,https://www.amazon.eg/dp/B0F6K5R8RN,2026-05-23T06:24:16.519476
amazon,B0FX3GT1FW,Product B0FX3GT1FW,"Safety-Line Fiberglass Fire Blanket, 120x120cm, Emergency Safety Blanket for Kitchen and Commercial Fire Protection, Red and White (12)",Industrial,"EGP 5,000.00",,,,EGP 5000.00EGP5000.00,In Stock,https://m.media-amazon.com/images/I/51kAK9hSUwL._AC_UL320_.jpg,https://www.amazon.eg/dp/B0FX3GT1FW,2026-05-23T06:24:16.522428
amazon,B0GRP29QZM,Product B0GRP29QZM,"Porcelain Tea and Cake Set 24 Pieces, Black with Gold Lines, Includes Cups, Saucers and Dessert Plates, High Quality Glossy Finish",Industrial,"EGP 5,000.00",,,,EGP 5000.00EGP5000.00,In Stock,https://m.media-amazon.com/images/I/61PruFWSKaL._AC_UL320_.jpg,https://www.amazon.eg/dp/B0GRP29QZM,2026-05-23T06:24:16.525392
amazon,B0GF3735CB,Product B0GF3735CB,Emtop 1800 W Metal Heavy Duty Rotary Hammer (36mm SDS-Plus) With Plastic Case - Red,Industrial,,,,,(1 new offer),In Stock,https://m.media-amazon.com/images/I/61bLSRYV83L._AC_UL320_.jpg,https://www.amazon.eg/dp/B0GF3735CB,2026-05-23T06:24:16.527300
amazon,B0GF2CYP2L,Product B0GF2CYP2L,Emtop 20V Heavy-Duty Cordless Rotary Hammer 22mm Kit with 2 x 4.0Ah Batteries - Red/Blue,Industrial,"EGP 5,000.00",,,,EGP 5000.00EGP5000.00,In Stock,https://m.media-amazon.com/images/I/41Inx+NRgmL._AC_UL320_.jpg,https://www.amazon.eg/dp/B0GF2CYP2L,2026-05-23T06:24:16.530280
amazon,B0GBLSL42K,Product B0GBLSL42K,MOLEX SFP+ 5M,Industrial,"EGP 5,000.00",,,,EGP 5000.00EGP5000.00,In Stock,https://m.media-amazon.com/images/I/51h63nMl4nL._AC_UL320_.jpg,https://www.amazon.eg/dp/B0GBLSL42K,2026-05-23T06:24:16.533079
amazon,B0G8LY83TB,Product B0G8LY83TB,SFP-H10GB-CU 5M,Industrial,"EGP 5,000.00",,,,EGP 5000.00EGP5000.00,In Stock,https://m.media-amazon.com/images/I/51mSqdEcZQL._AC_UL320_.jpg,https://www.amazon.eg/dp/B0G8LY83TB,2026-05-23T06:24:16.536045
amazon,B0G82KGSNS,Product B0G82KGSNS,MA-CBL-40G-1M,Industrial,"EGP 5,000.00",,,,EGP 5000.00EGP5000.00,In Stock,https://m.media-amazon.com/images/I/51U2UQTKUdL._AC_UL320_.jpg,https://www.amazon.eg/dp/B0G82KGSNS,2026-05-23T06:24:16.539012
amazon,B0FZ935LT7,Product B0FZ935LT7,KRLZ 3 in 1 Endoscope Inspection Camera Borescope HD Camera Waterproof Snake Pipe Drain with 6 Adjustable Led Light Snake Cable USB Adapter for Android Phone Tablet Device (Size: 2 M),Industrial,"EGP 5,000.00",,,3.3,(20),In Stock,https://m.media-amazon.com/images/I/71xSbxaUVpL._AC_UL320_.jpg,https://www.amazon.eg/dp/B0FZ935LT7,2026-05-23T06:24:16.542250
amazon,B0FV9D5RYH,Product B0FV9D5RYH,"Mobile Endoscope Camera,Type-C Compatible, 720P HD with 6 LED Light,Waterproof IP67 Inspection Camera,2M Wire for Android Phone | PC | Tablet Security Type C App Camera.",Industrial,"EGP 5,000.00",,,3.6,(19),In Stock,https://m.media-amazon.com/images/I/81yV19V8TLL._AC_UL320_.jpg,https://www.amazon.eg/dp/B0FV9D5RYH,2026-05-23T06:24:16.545294
amazon,B0FQQ9D35Q,Product B0FQQ9D35Q,Glass Platform Digital Kitchen Scale - for Food Coffee Lab - LCD Display gram Ounces lb:oz fl.oz ml - 11 LB/5 KG Capacity - Battery Included - White by The Display Guys,Industrial,"EGP 5,000.00",,,4.4,(19),In Stock,https://m.media-amazon.com/images/I/51lORiZl45L._AC_UL320_.jpg,https://www.amazon.eg/dp/B0FQQ9D35Q,2026-05-23T06:24:16.548491
amazon,B0FP2RQLB2,Product B0FP2RQLB2,"eclissiaMobile Endoscope Camera,Type-C Compatible, 720P HD with 6 LED Light,Waterproof IP67 Inspection Camera,2M Wire for Android Phone | PC | Tablet Security Type C App Camera.",Industrial,"EGP 5,000.00",,,2.4,(8),In Stock,https://m.media-amazon.com/images/I/71FaVjXUHnL._AC_UL320_.jpg,https://www.amazon.eg/dp/B0FP2RQLB2,2026-05-23T06:24:16.551545
amazon,B0FL21FSPT,Product B0FL21FSPT,"INGCO 20V SDS-Plus Rotary Hammer, Brushless Motor, 1100RPM, 2.0J, 22mm in Conrete with 2Pcs 4.0Ah Battery and 1Pcs Charger CRHLI212282",Industrial,"EGP 5,000.00",,,4.2,(4),In Stock,https://m.media-amazon.com/images/I/91IXPBadZOL._AC_UL320_.jpg,https://www.amazon.eg/dp/B0FL21FSPT,2026-05-23T06:24:16.554748
