platform,asin,title,brand,category,current_price,original_price,discount,rating,reviews_count,prime_eligible,amazon_choice,sponsored,main_image,product_url,scraped_at
amazon,,"JZK 3.5mm to 2.5mm Adapter Jack, Female 3.5mm Socket to Male 2.5mm Plug, Standard Headphones Socket Jack Stereo Adaptor, Stereo Adapter Converter Extender",,Electronics,EGP 15.93,,,4.0,,,,,https://m.media-amazon.com/images/I/514KP6mKF9L._AC_UL320_.jpg,https://www.amazon.eg/dp/B0F2MVH4M3,2026-05-26T04:57:35.824198
amazon,,"UGREEN CAT7 Network Cable 0.5m, 10000Mbps Nylon Braided Ethernet Cable with RJ45 Connector 10Gbps 600MHz, FTP Cable Compatible with Cat6 Cat5e, PC, MacBook, PS5",,Electronics,EGP 109.00,,,4.7,,,,,https://m.media-amazon.com/images/I/71t3xWbUfXL._AC_UL320_.jpg,https://www.amazon.eg/dp/B086G7VHP3,2026-05-26T04:57:35.824626
amazon,,"TECHZONE 3-in-1 Laptop & Screen Cleaning Kit | Electronics Cleaner Spray + Microfiber Cloth + Brush | Safe for Laptops, Computers, Monitors, Tablets & Phones (Soft Brush)",,Electronics,EGP 109.00,,,4.0,,,,,https://m.media-amazon.com/images/I/510MMzKDbbL._AC_UL320_.jpg,https://www.amazon.eg/dp/B0GD7M863D,2026-05-26T04:57:35.825081
amazon,,Sata USB 2.0 Adapter Cable (2.5),,Electronics,EGP 135.00,EGP 169.00,,3.5,List:,,,,https://m.media-amazon.com/images/I/51MmoaZ3uJL._AC_UL320_.jpg,https://www.amazon.eg/dp/B082MSNTVP,2026-05-26T04:57:35.825591
amazon,,Lead Trend CP-0102 Twist Cable Protector,,Electronics,EGP 17.57,,,4.0,,,,,https://m.media-amazon.com/images/I/51zU-Ni6zXL._AC_UL320_.jpg,https://www.amazon.eg/dp/B01MTD6932,2026-05-26T04:57:38.887389
amazon,,"3 in 1 Fast Charging USB Cable, 120W 6A, Smartphone, Power Bank, Projector, PC",,Electronics,EGP 79.00,,,2.8,,,,,https://m.media-amazon.com/images/I/41VmSME977L._AC_UL320_.jpg,https://www.amazon.eg/dp/B0DRWDQ8DL,2026-05-26T04:57:38.887877
amazon,,iLOCK USB-C to Type-C Charging Cable | 1 Meter | Ultra Durable Braided Cable | 65 Watt Fast Charging (Type C to Type C),,Electronics,,,,4.4,,,,,https://m.media-amazon.com/images/I/61wnJG7NCkL._AC_UL320_.jpg,https://www.amazon.eg/dp/B0F338WVGB,2026-05-26T04:57:38.888325
amazon,,"Keendex KX 2518 Micro Charger & Data Sync Cable, 15cm - White, USB",,Electronics,EGP 34.78,,,3.2,,,,,https://m.media-amazon.com/images/I/41E5ghEFwzL._AC_UL320_.jpg,https://www.amazon.eg/dp/B0B9146J3W,2026-05-26T04:57:38.888763
amazon,,"USB C Digital to 3.5 mm Female Headphone Jack Adapter, Type C Aux Audio Dongle Converter Fits Various Smart Phones (2pic Black)",,Electronics,EGP 171.98,,,3.1,,,,,https://m.media-amazon.com/images/I/41KJAwUvnTL._AC_UL320_.jpg,https://www.amazon.eg/dp/B0DXCF3R5G,2026-05-26T04:57:38.889212
amazon,,1080P HDMI Female to HDMI Female Adapters Connectors HDMI Extension cord Adapters Plug For HDTV,,Electronics,EGP 56.67,,,3.9,,,,,https://m.media-amazon.com/images/I/61SwmQOH2aL._AC_UL320_.jpg,https://www.amazon.eg/dp/B08YNPWRXY,2026-05-26T04:57:38.889700
amazon,,موزع USB_لافا_4.Port.Switch_USB.2 23299 من Loky boy,,Electronics,EGP 150.00,,,,,,,,https://m.media-amazon.com/images/I/51D4HgHkmFL._AC_UL320_.jpg,https://www.amazon.eg/dp/B0CP63BYKK,2026-05-26T04:57:38.890104
amazon,,5 X Audio Connector 3.5mm Stereo Plug to 2 x RCA Jack Adapter.,,Electronics,EGP 16.00,,,5.0,,,,,https://m.media-amazon.com/images/I/41fEasJOEkL._AC_UL320_.jpg,https://www.amazon.eg/dp/B0DBJ76G7L,2026-05-26T04:57:38.890545
amazon,,Generic 1000uf 16v Capacitor 5 Pieces,,Electronics,EGP 14.15,,,3.8,,,,,https://m.media-amazon.com/images/I/51r7gIs790L._AC_UL320_.jpg,https://www.amazon.eg/dp/B091FS6J13,2026-05-26T04:57:38.891051
amazon,,Yellow Micro to USB OTG Converter with Memory Card Reader / V8 Input & USB Output,,Electronics,EGP 49.99,,,3.7,,,,,https://m.media-amazon.com/images/I/419hrLzZvmL._AC_UL320_.jpg,https://www.amazon.eg/dp/B0C2Z2WC3D,2026-05-26T04:57:38.891490
amazon,,Keendex SATA Cable with Power for Inspiron - Black,,Electronics,EGP 38.65,,,3.4,,,,,https://m.media-amazon.com/images/I/614n7a2seOL._AC_UL320_.jpg,https://www.amazon.eg/dp/B0BDZZHGFH,2026-05-26T04:57:38.891936
amazon,,"Joyroom SA25-CL3 Light-Speed Series 30W Fast Charging Type-C to Lightning Data Cable, 1.2m – Black",,Electronics,EGP 188.00,EGP 282.03,,4.3,List:,,,,https://m.media-amazon.com/images/I/617gJuaM-GL._AC_UL320_.jpg,https://www.amazon.eg/dp/B0CNH4Q1L3,2026-05-26T04:57:38.892448
amazon,,Exon X1143 HDMI Cable Right Angle High Speed 90 Degree Flat High Resolution 1080P for TV PC Monitor Box PS4/5 Cable (1.5m),,Electronics,EGP 58.29,,,4.7,,,,,https://m.media-amazon.com/images/I/61CtYsoqzaL._AC_UL320_.jpg,https://www.amazon.eg/dp/B0CQ3PGK6Z,2026-05-26T04:57:38.892909
amazon,,"Km Technology 4 in 1 Convertible Metal Fast Data Cable, 3.9ft USB C USB A, 65W, Compatible With iPhone/iPad/MacBook Pro/Airpods/Samsung/Android (Black)",,Electronics,EGP 150.00,EGP 38.46,,4.8,(,,,,https://m.media-amazon.com/images/I/61tiCGiZI-L._AC_UL320_.jpg,https://www.amazon.eg/dp/B0FK221KFB,2026-05-26T04:57:38.893403
amazon,,Keendex 1742 rj45 to usb converter - black,,Electronics,EGP 120.37,,,3.4,,,,,https://m.media-amazon.com/images/I/51X-hQ5j2CL._AC_UL320_.jpg,https://www.amazon.eg/dp/B096L8SMJT,2026-05-26T04:57:38.893888
amazon,,"WiWU Wi-C014 Platinum 3-in-1 Charging Cable (Type-C, Micro, Lightning) Durable 3.1A High-Speed Multi-Device Power & Sync Cord (1.2M) Reinforced Nylon Braided Universal Charging Cable - Black",,Electronics,EGP 175.45,,,3.9,,,,,https://m.media-amazon.com/images/I/61pOhKgxJ0L._AC_UL320_.jpg,https://www.amazon.eg/dp/B0DH8BS676,2026-05-26T04:57:38.894313
amazon,,Premium Arduino Compatible Uno R3 - Fully Assembled Development Board with USB Cable for Electronics Engineering,,Electronics,EGP 477.00,EGP 552.55,,4.2,Was:,,,,https://m.media-amazon.com/images/I/61GqecU2NHL._AC_UL320_.jpg,https://www.amazon.eg/dp/B081VL211P,2026-05-26T04:57:38.894868
amazon,,"Tempered Glass Camera Lens Protector, 9H Hardness, Full Coverage, Ultra Clear, Bubble Free Easy Installation, High Touch Sensitivity Compatible with Samsung Galaxy S10E - Transparent",,Electronics,EGP 14.00,,,,,,,,https://m.media-amazon.com/images/I/61t+HV72cTL._AC_UL320_.jpg,https://www.amazon.eg/dp/B0F9T92LZZ,2026-05-26T04:57:38.895288
amazon,,"ZALUJMUS Multifunctional Data Cable for Lightning Devices, USB-C and Micro-USB, Universal Data Transfer Cable (Black)",,Electronics,EGP 290.00,,,4.2,,,,,https://m.media-amazon.com/images/I/519QW9ORu4L._AC_UL320_.jpg,https://www.amazon.eg/dp/B09NPKN1L1,2026-05-26T04:57:38.895708
amazon,,"UGREEN 60W USB C to USB C Cable 2M, PD 3.0 3A Fast Charging Cord Type C Cable Compatible with iPhone 15 Series, MacBook Pro, iPad Pro, Samsung Galaxy S23/22/Z Fold/Z Flip, Google Pixel 7/6A,PS5,Switch",,Electronics,EGP 295.00,,,4.6,,,,,https://m.media-amazon.com/images/I/61b5RUAnTbL._AC_UL320_.jpg,https://www.amazon.eg/dp/B08GM8WN8P,2026-05-26T04:57:38.896173
amazon,,"3 in 1 Fast Charging Cable for Type-C,Micro & iOS Smartphones,Smart Charge 3 Port Data Charging Cable,Power line Compatible with mobile,laptop,audio player,tablet,computer (White)",,Electronics,EGP 75.00,,,3.6,,,,,https://m.media-amazon.com/images/I/51wvaia5L8L._AC_UL320_.jpg,https://www.amazon.eg/dp/B0DLHWVTKL,2026-05-26T04:57:38.896606
amazon,,Eaglerich 12V Electronics Car Fan Plugs into Cigarette Lighter 360 Degree Car Air Conditioner Cooling Low Noise Automobile Vehicle Fan,,Electronics,EGP 349.00,,,5.0,,,,,https://m.media-amazon.com/images/I/61+g79gr+LL._AC_UL320_.jpg,https://www.amazon.eg/dp/B01FH8VJ7W,2026-05-26T04:57:38.897048
amazon,,15pin SATA Power to 6pin PCI-e PCI Express Adapter Cable for Video Card,,Electronics,EGP 39.48,EGP 48.00,,3.6,List:,,,,https://m.media-amazon.com/images/I/61Bl1TnU5UL._AC_UL320_.jpg,https://www.amazon.eg/dp/B091DB3FKK,2026-05-26T04:57:38.897547
amazon,,"Baseus USB C Cable, 240W PD 5A Fast Charging USBC to USBC Cable, Zine Alloy Nylon Braided Type C Charger Cord for iPhone 16 15 Pro/Plus/Pro Max, MacBook, iPad Pro/Mini, Samsung S23/S22+ (3.3ft)",,Electronics,EGP 449.99,,,4.6,,,,,https://m.media-amazon.com/images/I/71ynGO6-rqL._AC_UL320_.jpg,https://www.amazon.eg/dp/B0C1ZR44VH,2026-05-26T04:57:38.898011
amazon,,"Metal USB Charging Cable 4-in-1 Nylon Type C/USB A/for Lightning 27W, 33W, 45W, 67W, 80W, 120W, 3A, 4.5A, 5A, 6A Compatible With Iphone, Samsung Galaxy Super Fast Charging Oppo Vooc, mi turboo(4 * 1)",,Electronics,EGP 142.00,EGP 35.50,,3.8,(,,,,https://m.media-amazon.com/images/I/71tfpzBBeuL._AC_UL320_.jpg,https://www.amazon.eg/dp/B0DTKFW6WH,2026-05-26T04:57:42.345621
amazon,,4Pcs USB Cable Protector Saver Earphone Cord Protection Wire Cover Data Charger Line Protection Headphone Winder,,Electronics,EGP 33.00,,,4.0,,,,,https://m.media-amazon.com/images/I/51hbkAKOnAL._AC_UL320_.jpg,https://www.amazon.eg/dp/B08YNFNHL4,2026-05-26T04:57:42.346177
amazon,,portal Electronic USB DC 5V to 12V Router Cable Step Up Power Cable Power Supply USB Cable with DC Jack 5.5 x 2.1mm (1M),,Electronics,EGP 72.00,,,,,,,,https://m.media-amazon.com/images/I/61mrf3Hj9uL._AC_UL320_.jpg,https://www.amazon.eg/dp/B0DLB55XR8,2026-05-26T04:57:42.346569
amazon,,"LDNIO LC901C USB-C to USB-C Cable 1M, 65W PD Fast Charging & Data Transfer, Durable Charger Cord for Smartphones, Tablets & Laptops – White",,Electronics,EGP 91.00,,,4.0,,,,,https://m.media-amazon.com/images/I/41OkorW4diL._AC_UL320_.jpg,https://www.amazon.eg/dp/B0DL3JDFBZ,2026-05-26T04:57:42.347094
amazon,,New Baseus 100W PD3.0 QC4.0 5A 2 Meter Rapid Series Quick Fast Charging Type-C to Type C Cable Braided USB C Fast 480 mbps Data Transfer for all Mobiles Tablets iPad iPhone Galaxy all Devices (SKY),,Electronics,EGP 449.99,EGP 64.28,,4.1,(,,,,https://m.media-amazon.com/images/I/41FrctP0RKL._AC_UL320_.jpg,https://www.amazon.eg/dp/B0DQLXHQXW,2026-05-26T04:57:42.347603
amazon,,"Jadever JDUB1501 USB Type A to Type C Cable, 1-Meter Length",,Electronics,EGP 37.00,,,2.9,,,,,https://m.media-amazon.com/images/I/31JcYg2rctL._AC_UL320_.jpg,https://www.amazon.eg/dp/B0DY7QR86T,2026-05-26T04:57:42.348114
amazon,,"Belkin BoostCharge USB-C to USB-C Power charger cable, USB-IF certified fast charging cable with 240W Power Delivery for iPhone 15, MacBook, Chromebook, Samsung Galaxy, iPad, Pixel & More - 1m, white",,Electronics,"EGP 1,099.00",,,4.6,,,,,https://m.media-amazon.com/images/I/514ABXEWDTL._AC_UL320_.jpg,https://www.amazon.eg/dp/B0CB841KK8,2026-05-26T04:57:42.348547
amazon,,"Joyroom S‑A11 3A Surpass Series 18W USB‑A to Lightning Fast Charging & Data Cable, 1.2 m – Durable Nylon-Braided – Black",,Electronics,EGP 115.78,EGP 127.00,,3.8,List:,,,,https://m.media-amazon.com/images/I/61RBMwOYptL._AC_UL320_.jpg,https://www.amazon.eg/dp/B01AZDVEGK,2026-05-26T04:57:42.349113
amazon,,Micro USB to USB Type C Adapter (Black) - Pack of 2,,Electronics,,,,3.4,,,,,https://m.media-amazon.com/images/I/51R6YTH4IIL._AC_UL320_.jpg,https://www.amazon.eg/dp/B08YNLLD2T,2026-05-26T04:57:42.349531
amazon,,"Laptop Cooling Pad ZR750, 4 Silent Fans with LED Lights, Adjustable Height Stand, Integrated Phone Holder, Dual USB Ports, UP TO 15 Inch - Multicolor",,Electronics,EGP 549.00,,,5.0,,,,,https://m.media-amazon.com/images/I/818TH+sUYsL._AC_UL320_.jpg,https://www.amazon.eg/dp/B0GS5Q3XXP,2026-05-26T04:57:42.349968
amazon,,"USB Type-C to L Charging Cable, White",,Electronics,EGP 75.60,EGP 84.00,,1.7,Was:,,,,https://m.media-amazon.com/images/I/615MHVptOXL._AC_UL320_.jpg,https://www.amazon.eg/dp/B0DF44PQQR,2026-05-26T04:57:42.350476
amazon,,"Anker 322 USB-C to USB-C Cable 6 fT USB C Charger Cable for MacBook Pro 2020, iPad Pro 2020, Switch, Samsung Galaxy S23 Plus, S24, S25 Plus + (Black) 18 months Local Warranty",,Electronics,,,,4.5,,,,,https://m.media-amazon.com/images/I/71DC1nU+lEL._AC_UL320_.jpg,https://www.amazon.eg/dp/B0C5Y11VMM,2026-05-26T04:57:42.350907
amazon,,"Multi USB Cable 3 in 1 Fast Charging 6A/120W Zinc Alloy, Thicker Version",,Electronics,EGP 79.00,,,2.8,,,,,https://m.media-amazon.com/images/I/61Vzjl65ykL._AC_UL320_.jpg,https://www.amazon.eg/dp/B0DRWCD4X6,2026-05-26T04:57:42.351342
amazon,,"Ergonomic Adjustable Aluminum Laptop Stand (10-15.6"") - Improves Posture & Cooling - for Desk, MacBook, HP, Dell & More - Silver",,Electronics,EGP 140.00,,,3.8,,,,,https://m.media-amazon.com/images/I/51Z9U3t0oQL._AC_UL320_.jpg,https://www.amazon.eg/dp/B0D4KCC4QS,2026-05-26T04:57:42.351844
amazon,,"GENARIC 3 Pack USB C to USB A Adapter, 3.0 Male to Female, Multi Color, 3 in 1, 2Amp, 480Mbps, Aluminum Alloy, Laptop, Phone, PC",,Electronics,,,,3.0,,,,,https://m.media-amazon.com/images/I/51rNhEBUuwL._AC_UL320_.jpg,https://www.amazon.eg/dp/B0DWTFJ8M7,2026-05-26T04:57:42.352264
amazon,,"Anker USB-C to USB-C 2.0 cable (3ft/0.9m), High Durability Type C Braided Charging Cable Compatible with All Android Devices And More, Black, 18 Months Warranty",,Electronics,EGP 260.00,,,4.5,,,,,https://m.media-amazon.com/images/I/51IZ24O2w5L._AC_UL320_.jpg,https://www.amazon.eg/dp/B0DH8JZ2Z4,2026-05-26T04:57:42.352702
amazon,,ELUPTA Heat Shrink Tubing Set of 164 Heat Shrink Tubing Heat Insulation Cable Wrap,,Electronics,EGP 158.00,,,4.0,,,,,https://m.media-amazon.com/images/I/71Zfc+DXQUL._AC_UL320_.jpg,https://www.amazon.eg/dp/B0CR925194,2026-05-26T04:57:42.353138
amazon,,"Youmeisha Portable Desktop Phone Stand 360° Rotatable and Foldable Cell Phone Holder for Desk with iPhone and All Mobile Phone,Metal Base, Mobile Phone Accessories (Black)",,Electronics,EGP 54.00,,,3.3,,,,,https://m.media-amazon.com/images/I/71Z7TEo58CL._AC_UL320_.jpg,https://www.amazon.eg/dp/B0BXCYL8WM,2026-05-26T04:57:42.353560
amazon,,"Nylon 3 in 1 fast Charging Cable for Type-C, Micro and iPhone Pins,Smart Charge 3 Port Data Charging Cable,power line(3 in 1 cable)",,Electronics,EGP 119.00,,,3.1,,,,,https://m.media-amazon.com/images/I/51RN-DIE-7L._AC_UL320_.jpg,https://www.amazon.eg/dp/B096D1YN4F,2026-05-26T04:57:42.354005
amazon,,"Baseus 20W PD Fast Charging USB-C to Lightning Cable, 2M Durable Power & Data Cord (480Mbps) for Apple iPhone 14 Pro Max, 13, 12, 11, XS, XR, X, 8 Plus, 7, 6s and for iPad – Super Flash Series (Blue)",,Electronics,EGP 349.99,,,4.1,,,,,https://m.media-amazon.com/images/I/51lUK8GXLAL._AC_UL320_.jpg,https://www.amazon.eg/dp/B0DVRQKTN4,2026-05-26T04:57:42.354445
amazon,,"V VOLT Foldable Laptop Stand for Desk, 7-Level Adjustable Aluminum Laptop Stand, Compatible with MacBook Pro/Air, Dell, HP, Lenovo, Fits 11-15.6 Inch Laptop, Tablet (Silver)",,Electronics,EGP 162.29,,,3.2,,,,,https://m.media-amazon.com/images/I/71HSoylW5yL._AC_UL320_.jpg,https://www.amazon.eg/dp/B0DRSZBVDP,2026-05-26T04:57:42.354950
amazon,,KM Technology Micro USB Fast Charging Cable And data transfer unpacking 1Meter length - Black,,Electronics,EGP 59.00,,,,,,,,https://m.media-amazon.com/images/I/413mJzG4zxL._AC_UL320_.jpg,https://www.amazon.eg/dp/B0GRR5HJK3,2026-05-26T04:57:42.355330
amazon,,"Total USB type-A to type-C cable,Cable length:1M-TIUCC01",,Electronics,EGP 39.00,,,3.0,,,,,https://m.media-amazon.com/images/I/61Jm5af4yzL._AC_UL320_.jpg,https://www.amazon.eg/dp/B0CVXQRDGL,2026-05-26T04:57:42.355757
amazon,,VINMEN Cord Desk Holder Winder Desktop Tidy Management Silicone Cable Organizer Clips Holder for Mouse Keyboard Earphone Headset,,Electronics,EGP 115.00,,,3.2,,,,,https://m.media-amazon.com/images/I/61ncFiAVggS._AC_UL320_.jpg,https://www.amazon.eg/dp/B0987JKHP8,2026-05-26T04:57:42.356265
amazon,,"Dust cleaning brush for computer/laptop/keyboard, multi-colour",,Electronics,EGP 77.00,,,4.2,,,,,https://m.media-amazon.com/images/I/61aoI9cqUdL._AC_UL320_.jpg,https://www.amazon.eg/dp/B09SGJHBSL,2026-05-26T04:57:45.482230
amazon,,TULMAN Magic Gel Cleaner for Keyboard Computer Laptop Home & Office Window Grill Electronics Car Interior Dust Cleaner – Green 160g,,Electronics,EGP 163.00,,,3.2,,,,,https://m.media-amazon.com/images/I/817KuqGGQaL._AC_UL320_.jpg,https://www.amazon.eg/dp/B07Q7XG76B,2026-05-26T04:57:45.482685
amazon,,"1M Micro USB Charging Cable and Synchronous Charging with Android Phones - HTC, LG.",,Electronics,EGP 54.90,EGP 61.00,,5.0,Was:,,,,https://m.media-amazon.com/images/I/41WdOr+xdVL._AC_UL320_.jpg,https://www.amazon.eg/dp/B0DV8YSKZY,2026-05-26T04:57:45.483617
amazon,,PS4 Controller Dual USB Charging Charger Docking Station for PS4 / PS4 Slim / PS4 Pro Controller,,Electronics,EGP 420.00,,,4.4,,,,,https://m.media-amazon.com/images/I/61JUO+0RVRL._AC_UL320_.jpg,https://www.amazon.eg/dp/B07MCRBHR7,2026-05-26T04:57:45.484099
amazon,,"Baseus USB to Lightning Charging Cable iPhone 14 Pro Max Cafule Nylon Braided High-Density Quick Charge Compatible for iPhone 13 12 11 Pro Max Mini XS X 8 7 6 5 SE iPad (2 Meter, 1.5 A, Gray+Black)",,Electronics,EGP 329.99,EGP 349.99,,4.4,Was:,,,,https://m.media-amazon.com/images/I/61eK3CXeyTL._AC_UL320_.jpg,https://www.amazon.eg/dp/B09LTB1V3N,2026-05-26T04:57:45.484591
amazon,,Generic Very Fast Charging Cable With Turbo Charger (White 6A(120W)),,Electronics,,,,4.3,,,,,https://m.media-amazon.com/images/I/61KCC+WCfiL._AC_UL320_.jpg,https://www.amazon.eg/dp/B0DD2R5LVC,2026-05-26T04:57:45.485024
amazon,,ELECTRONIC_CABLE,,Electronics,EGP 100.00,,,3.4,,,,,https://m.media-amazon.com/images/I/61gzshDJfvL._AC_UL320_.jpg,https://www.amazon.eg/dp/B0F99X2J19,2026-05-26T04:57:45.485466
amazon,,Anker 322 USB-A to USB-C Cable (1.8m Braided) - Black,,Electronics,EGP 365.00,,,4.6,,,,,https://m.media-amazon.com/images/I/71iH7cKxg1L._AC_UL320_.jpg,https://www.amazon.eg/dp/B0C9JP6J45,2026-05-26T04:57:45.485914
amazon,,"Electronics HDMI 2.0 High Speed Cable, 4K UHD 2160P, Aluminium Alloy Housing, Full Compatible with gaming consoles, smart displays ((5M))",,Electronics,EGP 231.98,,,,,,,,https://m.media-amazon.com/images/I/61u633oTBYL._AC_UL320_.jpg,https://www.amazon.eg/dp/B0GS32V27F,2026-05-26T04:57:45.486292
amazon,,Silicon Twist Cable Protector Set Of 4 For Cables And Chargers - Black,,Electronics,EGP 25.00,,,4.0,,,,,https://m.media-amazon.com/images/I/51QABIbCBcL._AC_UL320_.jpg,https://www.amazon.eg/dp/B091D9DFPT,2026-05-26T04:57:45.486716
amazon,,IBAMA Multifunctional 60W USB Data Cable Fast Charge Line Storage Box Mini Digital Electronic Gadgets Organizer Card Removal Pin Set (Blue),,Electronics,EGP 285.00,,,2.4,,,,,https://m.media-amazon.com/images/I/61u8o5GnHqL._AC_UL320_.jpg,https://www.amazon.eg/dp/B0BCFV331J,2026-05-26T04:57:45.487151
amazon,,"7-in-1 Electronics Cleaner Kit - Keyboard Cleaner kit, Portable Multifunctional Cleaning Tool for PC Monitor/Earbud/Cell Phone/Laptop/Computer/Bluetooth Earphones (White)",,Electronics,EGP 110.00,,,4.1,,,,,https://m.media-amazon.com/images/I/41wyyvFkR1L._AC_UL320_.jpg,https://www.amazon.eg/dp/B0DSV5RPC5,2026-05-26T04:57:45.487589
amazon,,"Zero Electronics DisplayPort Cable 1.8M, High Resolution for Monitor, Female-to-Female, Black",,Electronics,EGP 100.00,,,,,,,,https://m.media-amazon.com/images/I/41LqhW2viBL._AC_UL320_.jpg,https://www.amazon.eg/dp/B0GXB8NT5S,2026-05-26T04:57:45.487986
amazon,,Laptop Backpack for Men and Women with 17.3inch Computer Compartment Travel Laptop Backpack Water Resistant Backpacks with USB Charging Port-Black,,Electronics,EGP 228.00,EGP 301.00,,3.2,Get it faster,,,,https://m.media-amazon.com/images/I/719L205NrBL._AC_UL320_.jpg,https://www.amazon.eg/dp/B09VPDKRHQ,2026-05-26T04:57:45.488627
amazon,,ELECTRONIC_CABLE,,Electronics,EGP 175.00,,,5.0,,,,,https://m.media-amazon.com/images/I/41QO2R3BhjL._AC_UL320_.jpg,https://www.amazon.eg/dp/B0F145V1CC,2026-05-26T04:57:45.489075
amazon,,ProCase Hard Travel Electronic Organizer Case for MacBook Power Adapter Chargers Cables Power Bank Apple Magic Mouse Apple Pencil USB Flash Disk SD Card Small Portable Accessories Bag,,Electronics,"EGP 2,134.43",,,4.3,,,,,https://m.media-amazon.com/images/I/81djjH6-cwL._AC_UL320_.jpg,https://www.amazon.eg/dp/B0CBPS7GBP,2026-05-26T04:57:45.489554
amazon,,ProCase Hard Travel Electronic Organizer Case for MacBook Power Adapter Chargers Cables Power Bank Apple Magic Mouse Apple Pencil USB Flash Disk SD Card Small Portable Accessories Bag -Black,,Electronics,"EGP 2,499.00",,,4.5,,,,,https://m.media-amazon.com/images/I/81omLXuaRyL._AC_UL320_.jpg,https://www.amazon.eg/dp/B09CPXLJ8Q,2026-05-26T04:57:45.489992
amazon,,ELECTRONIC_CABLE,,Electronics,EGP 310.00,,,4.1,,,,,https://m.media-amazon.com/images/I/61Bznvv2PJL._AC_UL320_.jpg,https://www.amazon.eg/dp/B0FV8RHKVZ,2026-05-26T04:57:45.490476
amazon,,G-Power Hard Silicone Charger Protector And Cable Protector Designed With Electronic Game Shaped Set Of 2 Pieces - Multi Color,,Electronics,EGP 72.00,,,3.0,,,,,https://m.media-amazon.com/images/I/51G4K3iuh2L._AC_UL320_.jpg,https://www.amazon.eg/dp/B0D5MPF9T7,2026-05-26T04:57:45.490906
amazon,,Multi Charging Cable 3 in 1 Nylon Braided 120CM Multi USB Cable Multiple Charger Fast Charging Cord Compatible with Most Smart Phones & Pads (Multiple),,Electronics,EGP 255.77,EGP 2.13,,3.5,(,,,,https://m.media-amazon.com/images/I/61xfyyyo3+L._AC_UL320_.jpg,https://www.amazon.eg/dp/B0D8ZT6CTG,2026-05-26T04:57:45.491395
amazon,,"Travel Cable Organizer Bag, Electronics Accessories Carry Cases Portable Cord Organizer Bag for Cable, Charger, Phone, USB, SD Card, Earphones More Out-Going, Business Travel Gadget Bag, Black",,Electronics,EGP 173.00,EGP 196.99,,4.1,List:,,,,https://m.media-amazon.com/images/I/71RUyaZdqrL._AC_UL320_.jpg,https://www.amazon.eg/dp/B08BNWNKWF,2026-05-26T04:57:45.491980
amazon,,"Electronic Travel Organizer - Storage Bag for Cables, Chargers, USB Flash Drives and Accessories, Black, Modern",,Electronics,EGP 135.00,,,4.2,,,,,https://m.media-amazon.com/images/I/71PjLSpS1TL._AC_UL320_.jpg,https://www.amazon.eg/dp/B0D8P8QPDP,2026-05-26T04:57:45.492505
amazon,,"Luxtude Electronic Organizer Travel Case, Small Tech Organizer, Hard Charger Case, Travel Tech Bag, Portable Electronics Bag, Travel Essentials for Apple Accessories/Magic Mouse/SD/Cash/Card/Pen",,Electronics,"EGP 5,899.00",,,4.6,,,,,https://m.media-amazon.com/images/I/81mTHxQM48L._AC_UL320_.jpg,https://www.amazon.eg/dp/B0BFQKRZ1L,2026-05-26T04:57:45.492959
amazon,,"Joyroom JR-TCF20 20W USB-C PD Fast Wall Charger with 1M USB-C to USB-C Cable, Compact Safe Charging Adapter – White | 12 Months Warranty",,Electronics,,,,4.1,,,,,https://m.media-amazon.com/images/I/51ELaUnc2JL._AC_UL320_.jpg,https://www.amazon.eg/dp/B0DCFLFJ2Y,2026-05-26T04:57:48.590227
amazon,,"Lcsmaokin Electronics Travel Organizer, Portable Waterproof Electronic Storage Bag for Small Charging Cord Storage, Charger, Small Electronics, SD Card etc, for Travel, Business and School - Navy Blue",,Electronics,EGP 185.00,,,4.4,,,,,https://m.media-amazon.com/images/I/61Ch3KaZKeL._AC_UL320_.jpg,https://www.amazon.eg/dp/B0BPSSJ4Y4,2026-05-26T04:57:48.590762
amazon,,"Travel Electronic Organizer Bag Cable Organizer Case Portable digital Storage Bag for Electronic Accessories USB Cables, Power Bank, SD Card",,Electronics,EGP 113.29,,,4.2,,,,,https://m.media-amazon.com/images/I/91K9W3wYN4L._AC_UL320_.jpg,https://www.amazon.eg/dp/B0B68J5JFD,2026-05-26T04:57:48.591262
amazon,,Abro Contact Cleaner EC-833 for Electronic Parts,,Electronics,EGP 315.00,,,5.0,,,,,https://m.media-amazon.com/images/I/71Ayh6GnIwS._AC_UL320_.jpg,https://www.amazon.eg/dp/B091JTC9Q3,2026-05-26T04:57:48.591705
amazon,,"Onikoma Wired Gaming Stereo Headset with RGB Light, Headphones Over Ear with Mic, 3.5Mm Aux, Volume Control, Compatible with PS5, PS4, Laptops, Smartphone, PC, Mac Nintendo Switch (K19, Camo Red)",,Electronics,EGP 792.98,,,,,,,,https://m.media-amazon.com/images/I/71jZnyMpvaL._AC_UL320_.jpg,https://www.amazon.eg/dp/B0FQCY15X8,2026-05-26T04:57:48.592110
amazon,,"Sanpyl Slim Console Cooling Fan, Quiet Fan with LED Light, 3 Fans Rear Cooling Fan, Efficient Cooling",,Electronics,EGP 999.00,,,4.2,,,,,https://m.media-amazon.com/images/I/61A-TpG5VSL._AC_UL320_.jpg,https://www.amazon.eg/dp/B0CPWRZ3J1,2026-05-26T04:57:48.592533
amazon,,"Electronics Organizer Waterproof Travel Accessories Case Double Layer Storage Bag For Cables, Charger, Power Bank, Flash Drive, Tablet, Phone, SD Card 27x20 Cm Portable Gadget Bag (Gray)",,Electronics,EGP 344.00,,,3.4,,,,,https://m.media-amazon.com/images/I/6119SYQplLL._AC_UL320_.jpg,https://www.amazon.eg/dp/B0FL1J8WS7,2026-05-26T04:57:48.592981
amazon,,LDNIO LS612 Lightning 25W Fast charging Data Cable 2M Length - White,,Electronics,EGP 64.78,,,3.7,,,,,https://m.media-amazon.com/images/I/51dRPcnnhdL._AC_UL320_.jpg,https://www.amazon.eg/dp/B0C1H16Y8B,2026-05-26T04:57:48.593413
amazon,,"Acrylic wire organizer - For organizing chargers, power cords, computer cables, and electronics. Pack of 20, assorted colors.",,Electronics,EGP 199.00,,,,,,,,https://m.media-amazon.com/images/I/51JQlk8JueL._AC_UL320_.jpg,https://www.amazon.eg/dp/B0GRVHDYPR,2026-05-26T04:57:48.593782
amazon,,"Electronic Organizer - Cable Case Portable digital Storage Bag for Electronic Accessories cell phone, USB Cables, Power Bank, SD Card, Flash memory stick, charger, Cord, Earphone, earpod (Grey)",,Electronics,EGP 135.41,,,4.2,,,,,https://m.media-amazon.com/images/I/71POyuD4RjL._AC_UL320_.jpg,https://www.amazon.eg/dp/B0BY41QWZ4,2026-05-26T04:57:48.594217
amazon,,"HCFGS Electronics Accessories Organizer Bag, Travel Cable Organiser Bag, Universal Carry Travel Gadget Bag for USB Cable Drive, SD Card, Charger Hard Disk (Gray)",,Electronics,EGP 135.00,EGP 177.00,,4.4,List:,,,,https://m.media-amazon.com/images/I/81iuhjqdqiL._AC_UL320_.jpg,https://www.amazon.eg/dp/B07SPBQLQW,2026-05-26T04:57:48.594747
amazon,,"TiMOVO Compatible With iPad 10th Generation 10.9 Inch 2022, Slim Clear PC Tri-fold Case With Stylus Holder, Auto Wake/Sleep, Sunny Sky Blue",,Electronics,EGP 699.00,,,4.6,,,,,https://m.media-amazon.com/images/I/61JiUIoNOcL._AC_UL320_.jpg,https://www.amazon.eg/dp/B0CRRGSBJ6,2026-05-26T04:57:48.595363
