platform,asin,title,brand,category,current_price,original_price,discount,rating,reviews_count,prime_eligible,amazon_choice,sponsored,main_image,product_url,scraped_at
amazon,,"FYY Electronic Organizer, Travel Cable Organizer Bag Pouch Electronic Accessories Carry Case Portable Waterproof Double Layers All-in-One Storage Bag for Cable, Cord, Charger, Phone, Earphone Navy",,Electronics,EGP 250.00,,,4.1,,,,,https://m.media-amazon.com/images/I/81cEz6cyc8L._AC_UL320_.jpg,https://www.amazon.eg/dp/B09Z6M1J8G,2026-05-26T04:57:48.595831
amazon,,"CILLA Travel Cord Organizer Case, Electronic Organizer Small Cable Organizer Portable Waterproof Storage Bag for Charger, Cord, USB, Power Bank, Earphone, SD Card, Traveling Essentials for Women",,Electronics,EGP 168.15,EGP 174.00,,4.2,List:,,,,https://m.media-amazon.com/images/I/91qDYY1gjLL._AC_UL320_.jpg,https://www.amazon.eg/dp/B08QVM44VV,2026-05-26T04:57:48.596365
amazon,,"YHQZ 1 Pcs Universal Carry Travel Gadget Bag,Travel Cable OrganiserBag and Cables OrganiserBag,Electronics Accessories Organizer Bag for Chargers,Cables,USB Drive,SD Card,Power Bank,Disk(Black), Black",,Electronics,EGP 135.00,,,4.2,,,,,https://m.media-amazon.com/images/I/81UXzCxnUrL._AC_UL320_.jpg,https://www.amazon.eg/dp/B0DFBCP5NM,2026-05-26T04:57:48.596796
amazon,,Electronic Organizer Bag Cable Organizer Travel Cord Organizer Case Pouch Portable Carrying Case for Charger Hard Drive Earphone USB SD Card (Blue),,Electronics,EGP 185.99,,,4.4,,,,,https://m.media-amazon.com/images/I/613PHL2UMvL._AC_UL320_.jpg,https://www.amazon.eg/dp/B09Y81SG9H,2026-05-26T04:57:48.597241
amazon,,"Electronics Organizer, OrgaWise Electronic Accessories Bag Travel Waterproof for iPad Mini, Kindle, Hard Drives, Cables, Chargers",,Electronics,EGP 229.00,,,4.2,,,,,https://m.media-amazon.com/images/I/81VoSd1YQcL._AC_UL320_.jpg,https://www.amazon.eg/dp/B0BNPHM7GC,2026-05-26T04:57:48.597665
amazon,,"DELFINO Electronic Accessories Storage Bag Small Portable Travel Cable Storage Bag All-in-One Organizer Storage for Power Cords, Chargers, Hard Drives, Headphones, USB, SD Cards, and More (Grey)",,Electronics,EGP 185.00,EGP 206.00,,4.0,List:,,,,https://m.media-amazon.com/images/I/81RGn++Zd7L._AC_UL320_.jpg,https://www.amazon.eg/dp/B09TZTN873,2026-05-26T04:57:48.598172
amazon,,"FYY Electronic Organizer, Travel Cable Organizer Bag Pouch Electronic Accessories Carry Case Portable Waterproof Double Layers Storage Bag for Cable, Cord, Charger, Phone, Earphone, Medium Size Grey",,Electronics,EGP 250.00,,,4.0,,,,,https://m.media-amazon.com/images/I/81qQTC6Rj4L._AC_UL320_.jpg,https://www.amazon.eg/dp/B09Z6LHK1S,2026-05-26T04:57:48.598601
amazon,,"FYY Travel Cable Organizer Pouch Electronic Accessories Carry Case Portable Waterproof Double Layers All-in-One Storage Bag for Cord, Charger, Phone, Earphone Black",,Electronics,EGP 355.00,,,4.5,,,,,https://m.media-amazon.com/images/I/81hLyL0rX2S._AC_UL320_.jpg,https://www.amazon.eg/dp/B0924H4XB9,2026-05-26T04:57:48.599065
amazon,,"Travel Electronics Organizer Bag, Waterproof Double-Layer Cable Storage Case, Portable Pouch for Charger, Earphones, Power Bank, Tech Accessories Organizer for Men and Women, Black",,Electronics,EGP 250.00,,,3.3,,,,,https://m.media-amazon.com/images/I/81hLyL0rX2S._AC_UL320_.jpg,https://www.amazon.eg/dp/B0FF7VG1ZX,2026-05-26T04:57:48.599486
amazon,,"Electronics Organizer Travel Cable Bag, Waterproof Portable Digital Storage Case with Adjustable Dividers, Grey Cationic Fabric, 24 x 18 x 10 cm",,Electronics,EGP 829.00,,,,,,,,https://m.media-amazon.com/images/I/61FAmyG6bkL._AC_UL320_.jpg,https://www.amazon.eg/dp/B0GK8FBQH2,2026-05-26T04:57:48.599913
amazon,,Travel Electronics Organizer Portable Cable Bag for Storage Electronic Accessories Case with Multiple Pockets and Elastic Loops Waterproof Tech Pouch for Phone Charger Cord Flash Drive (Black),,Electronics,EGP 152.00,,,4.1,,,,,https://m.media-amazon.com/images/I/61FtGwuaKtL._AC_UL320_.jpg,https://www.amazon.eg/dp/B0FH5KNMHD,2026-05-26T04:57:48.600413
amazon,,"Songaa Electronic Organizer Small Travel Cable Organizer Bag Electronic Accessories Portable Waterproof Tech Travel Storage Bag for Cable, Cord, Charger, Phone, USB, Wine Red",,Electronics,EGP 139.00,,,3.3,,,,,https://m.media-amazon.com/images/I/61Wl9av8SJL._AC_UL320_.jpg,https://www.amazon.eg/dp/B0BR3MKWTL,2026-05-26T04:57:48.600858
amazon,,"""Smart Wire Secrets & Electronics Organization Bag: Carry Your Digital Life Safely"" Portable Organizer Bag for Cables, Electronic Accessories, Cords, Mobile, Charger, Flash Drive and More (Blue)",,Electronics,EGP 170.00,,,4.0,,,,,https://m.media-amazon.com/images/I/51o0Vy-87nL._AC_UL320_.jpg,https://www.amazon.eg/dp/B0CL2WMH5W,2026-05-26T04:57:52.512385
amazon,,"Woodland cable bag and cable organiser bag is a travel essentials electronics travel organizer for Chargers, Cables, USB Drive, SD Card, power bank and Hard Disk with Handle (Red, Small)",,Electronics,EGP 149.99,,,4.5,,,,,https://m.media-amazon.com/images/I/71jJ7uQ8kQL._AC_UL320_.jpg,https://www.amazon.eg/dp/B0FL2VR53K,2026-05-26T04:57:52.512931
amazon,,"LDNIO Robust 240W Super Fast Cable Rapid Charging USB-C to USB-C PD3.1 QC4.0 for Samsung Galaxy S25 Ultra, S4Ultra, S23, for Huawei, Oppo, Xiaomi, Apple and all Type C Devices (2 Meter, 2, Pices)",,Electronics,EGP 539.99,EGP 270.00,,3.9,(,,,,https://m.media-amazon.com/images/I/61eVcHO5CtL._AC_UL320_.jpg,https://www.amazon.eg/dp/B0DS6M1MX9,2026-05-26T04:57:52.513444
amazon,,"Electronics Accessories Organizer Pouch Bag, Electronic Organizer Travel Universal Cable Organizer Electronics Accessories Bag for Cable, Charger, Phone, SD Card, Business Travel Gadget Bag",,Electronics,EGP 340.00,,,3.5,,,,,https://m.media-amazon.com/images/I/61pxf4eMAtL._AC_UL320_.jpg,https://www.amazon.eg/dp/B0DD3GRR9M,2026-05-26T04:57:52.513901
amazon,,"Ultimate Electronics Accessories Organizer Pouch – Travel Universal Cable Organizer Bag for Cables, Chargers, SD Cards, Earphones, Phone & Gadgets – Compact & Portable Business Travel Case (Blue)",,Electronics,EGP 250.00,,,1.5,,,,,https://m.media-amazon.com/images/I/51h4EvPoRnL._AC_UL320_.jpg,https://www.amazon.eg/dp/B0DPG814VF,2026-05-26T04:57:52.514403
amazon,,"Cable Bag, Electronic Accessories Organiser, Portable Cable Organiser, Double Cable Bag for Electronic Accessories, USB Power Bank, SD Card, Charging Cable, 7.5 x 4.3 x 2.2 inches, Black",,Electronics,EGP 340.00,,,4.7,,,,,https://m.media-amazon.com/images/I/61pxf4eMAtL._AC_UL320_.jpg,https://www.amazon.eg/dp/B0DD3MCMND,2026-05-26T04:57:52.514870
amazon,,"dealcase Electronics Accessories Bag, Digital Gadget Organizer Case, Waterproof Travel Gear Storage Carrying Sleeve Pouch for Cable, USB, Earphones, Portable Hard Drives, Power Banks Assorted Colors",,Electronics,EGP 144.99,,,4.4,,,,,https://m.media-amazon.com/images/I/715Y5IsiI2L._AC_UL320_.jpg,https://www.amazon.eg/dp/B08BNRNXV8,2026-05-26T04:57:52.515302
amazon,,"Electronic Organizer Travel Cable Organizer Bag Digital Accessories Storage Case with Dividers for Hard Drives, Portable Charger, Cables, Phone, USB, SD Card(Wine Red)",,Electronics,EGP 185.00,,,4.3,,,,,https://m.media-amazon.com/images/I/61Pg+NZB2ZL._AC_UL320_.jpg,https://www.amazon.eg/dp/B0BTBWL2X3,2026-05-26T04:57:52.515843
amazon,,"Big Travel Universal Cable Organizer Waterproof Carrying Bag, Gadgets Electronics Accessories Storage Case for Charger, USB Cables, Earphone, Ipad Mini, Phone, SD Card, Power Bank (Gery) (Black)",,Electronics,EGP 299.00,,,3.5,,,,,https://m.media-amazon.com/images/I/51J9BDngi1L._AC_UL320_.jpg,https://www.amazon.eg/dp/B0FYJZ6JMS,2026-05-26T04:57:52.516292
amazon,,"Case Compatible with Huawei MatePad 11.5s (2024)/11.5 (2025/2023)/Air 11.5 with Pencil Holder, Slim TPU Shockproof Cover with Protective Clear Back Case for Huawei MatePad 11.5S - (Black)",,Electronics,EGP 559.00,EGP 650.00,,3.0,Was:,,,,https://m.media-amazon.com/images/I/31f7LFtQKKL._AC_UL320_.jpg,https://www.amazon.eg/dp/B0G6MLSRG8,2026-05-26T04:57:52.516902
amazon,,"Electronics Accessories Organizer Bag, Travel Cable Organiser Bag, Universal Carry Travel Gadget Bag for USB Cable Drive, SD Card, Charger Hard Disk (Black)",,Electronics,EGP 299.99,,,5.0,,,,,https://m.media-amazon.com/images/I/81-g7R600FL._AC_UL320_.jpg,https://www.amazon.eg/dp/B0F3MVQHV8,2026-05-26T04:57:52.517409
amazon,,"Electronic Organizer Travel Universal Cable Organizer Electronics Accessories Bag for Cable, Charger, Phone, USB, SD Card,1Pack",,Electronics,EGP 298.00,,,4.5,,,,,https://m.media-amazon.com/images/I/81SpFZC-6FL._AC_UL320_.jpg,https://www.amazon.eg/dp/B08Z773HM5,2026-05-26T04:57:52.517857
amazon,,"Lcsmaokin Electronics Travel Organizer, Portable Waterproof Electronic Storage Bag for Small Charging Cord Storage, Charger, Small Electronics, SD Card etc, for Travel, Business and School - Wine Red",,Electronics,EGP 185.30,,,4.4,,,,,https://m.media-amazon.com/images/I/61jtFuZjINL._AC_UL320_.jpg,https://www.amazon.eg/dp/B0BPSSBG3S,2026-05-26T04:57:52.518343
amazon,,"Woodland cable bag and cable organiser bag is a travel essentials electronics travel organizer for Chargers, Cables, USB Drive, SD Card, power bank and Hard Disk with Handle (Navy)",,Electronics,EGP 280.00,,,4.4,,,,,https://m.media-amazon.com/images/I/81Fai9283+L._AC_UL320_.jpg,https://www.amazon.eg/dp/B0BX4DJ78C,2026-05-26T04:57:52.518758
amazon,,"Case for Huawei MatePad Air 12 inch 2025/MatePad 12X 2025 with Pencil Holder, Soft TPU Back Cover, Trifold Stand, Smart Cover, Auto Wake/Sleep (Transparent Black)",,Electronics,EGP 650.00,EGP 750.00,,1.8,Was:,,,,https://m.media-amazon.com/images/I/511hHZMmQML._AC_UL320_.jpg,https://www.amazon.eg/dp/B0GTR9HH1J,2026-05-26T04:57:52.519266
amazon,,"Fekra Cover for iPad 11th (A16) / 10th Generation Cover Case (2025/2022) [Pencil Holder] (Right Side) [Auto Sleep Wake], Trifold Flip Stand Case for iPad 10th Gen / 11th Generation (Black)",,Electronics,EGP 533.00,EGP 555.00,,3.0,Was:,,,,https://m.media-amazon.com/images/I/51Ff1mFmpyL._AC_UL320_.jpg,https://www.amazon.eg/dp/B0DT4H4W2J,2026-05-26T04:57:52.519759
amazon,,"Electronics Organizer Waterproof Travel Accessories Case Double Layer Storage Bag For Cables, Charger, Power Bank, Flash Drive, Tablet, Phone, SD Card 27x20 Cm Portable Gadget Bag (Gray)",,Electronics,EGP 255.00,,,,,,,,https://m.media-amazon.com/images/I/61IMb4iTUhL._AC_UL320_.jpg,https://www.amazon.eg/dp/B0FY7NZR7X,2026-05-26T04:57:52.520149
amazon,,ANKHGIFTSHOP CABLE BITE PROTECTOR Cute 3D USB Grade Silicone Cover Cartoon 3D Charger PROTECTOR for CHARGERS & CABLES (MIKE UNI),,Electronics,EGP 75.00,,,3.7,,,,,https://m.media-amazon.com/images/I/61hY7UC7mQL._AC_UL320_.jpg,https://www.amazon.eg/dp/B0D9PNZSK4,2026-05-26T04:57:52.520573
amazon,,"Cable Organizer Bag,Large Capacity Electronics Accessories Travel Storage Pouch for USB, SD Card, Headset Wire, Game Cards, PC Charger, Headset Wire,Adapter, External Hard Drive",,Electronics,EGP 280.00,,,5.0,,,,,https://m.media-amazon.com/images/I/71itkMD3z-L._AC_UL320_.jpg,https://www.amazon.eg/dp/B0BPX6GN8B,2026-05-26T04:57:52.521001
amazon,,"Electronics Accessories Organizer Bag, Travel Cable Organizer Case for Cords, Chargers, USB Drives, and SD Cards, Portable Pouch with Multiple Compartments for Gadget Storage, Black",,Electronics,EGP 265.00,,,,,,,,https://m.media-amazon.com/images/I/81iuhjqdqiL._AC_UL320_.jpg,https://www.amazon.eg/dp/B0FG1JBL6Y,2026-05-26T04:57:52.521368
amazon,,Travel Electronics Organizer Portable Cable Bag for Storage Electronic Accessories Case with Multiple Pockets and Elastic Loops Waterproof Tech Pouch for Phone Charger Cord Flash Drive (Grey),,Electronics,EGP 152.00,,,4.1,,,,,https://m.media-amazon.com/images/I/71Dc8uT5YcL._AC_UL320_.jpg,https://www.amazon.eg/dp/B0FH5MDHYF,2026-05-26T04:57:52.521858
amazon,,"Big Travel Universal Cable Organizer Waterproof Carrying Bag, Gadgets Electronics Accessories Storage Case for Charger, USB Cables, Earphone, Ipad Mini, Phone, SD Card, Power Bank (Gery) (Red)",,Electronics,EGP 299.00,,,,,,,,https://m.media-amazon.com/images/I/51uPEpMusRL._AC_UL320_.jpg,https://www.amazon.eg/dp/B0FTY2HBZY,2026-05-26T04:57:52.522233
amazon,,Cable Organizer Bag Electronic Accessories Wire Case Bag (Purple),,Electronics,EGP 220.00,,,4.6,,,,,https://m.media-amazon.com/images/I/6181hetUE8L._AC_UL320_.jpg,https://www.amazon.eg/dp/B0CM3ST4RM,2026-05-26T04:57:52.522717
amazon,,EooCoo Compatible 【2023 M5 MacBook Pro 16-Inch Case M4/M3/M2/M1 Pro/Max】 Chip Included 2023-2021 Release A3428 A3249 A3403 A3186 A2485 A2780 Cover - Crystal Clear,,Electronics,EGP 649.00,,,4.3,,,,,https://m.media-amazon.com/images/I/6176A63eGqL._AC_UL320_.jpg,https://www.amazon.eg/dp/B0CNRC9ZRD,2026-05-26T04:57:52.523340
amazon,,"Electronics Accessories Organizer Bag, Travel Cable Organiser Bag, Universal Carry Travel Gadget Bag for USB Cable Drive, SD Card, Charger Hard Disk (Navy)",,Electronics,EGP 299.99,,,5.0,,,,,https://m.media-amazon.com/images/I/81Bi4TK7EcL._AC_UL320_.jpg,https://www.amazon.eg/dp/B0F3MN3YVM,2026-05-26T04:57:56.363155
amazon,,Portable Electronic Accessories Organizer Case Travel Cable Storage Pouch Zippered Gadget Holder Compact Bag Charger Earphone Power Bank Management Solution Black,,Electronics,EGP 344.00,,,,,,,,https://m.media-amazon.com/images/I/61VsCdpp-FL._AC_UL320_.jpg,https://www.amazon.eg/dp/B0GCHBG9C2,2026-05-26T04:57:56.363618
amazon,,"Perla 4-in-1 Convertible USB Fast Charging Cable 1M, 65W, Nylon Braided, USB-C Charger Cable, Multiple Device Charging for Smartphones, Tablets, and Laptops (3)",,Electronics,,,,3.6,,,,,https://m.media-amazon.com/images/I/611UtMlp1kL._AC_UL320_.jpg,https://www.amazon.eg/dp/B0F2J5V2C5,2026-05-26T04:57:56.364072
amazon,,Smart Leather Flip Case for Samsung Galaxy Tab A7 10.4 (2020) with Multi-Angle Stand & Magnetic Closure (Camel),,Electronics,EGP 220.00,,,,,,,,https://m.media-amazon.com/images/I/71xBUSeABcL._AC_UL320_.jpg,https://www.amazon.eg/dp/B0H2R5RKM3,2026-05-26T04:57:56.364465
amazon,,LDNIO LS371 Lightning 2.1A Fast charging Data Cable 1M Length - White,,Electronics,EGP 54.00,,,,,,,,https://m.media-amazon.com/images/I/51ceN7u-K+L._AC_UL320_.jpg,https://www.amazon.eg/dp/B0C1H11SRX,2026-05-26T04:57:56.364861
amazon,,"FINTIE Hybrid Case Compatible with iPad Air 5th Generation (2022) / iPad Air 4th Generation (2020) 10.9 inch - Slim Clear Back Cover with Pencil Holder, Auto Wake/Sleep, Green",,Electronics,EGP 525.00,,,4.5,,,,,https://m.media-amazon.com/images/I/71bQAU8gGKL._AC_UL320_.jpg,https://www.amazon.eg/dp/B08ZSHQ96F,2026-05-26T04:57:56.365408
amazon,,"Dl3 Mobilak Case for Samsung Galaxy Tab A7 (SM-T500 / T505) 10.4 inch 2020, Slim PU Leather Folio with Adjustable Stand, 3D Pattern Shock-Absorbing Tablet Cover (Style 20)",,Electronics,EGP 700.00,,,5.0,,,,,https://m.media-amazon.com/images/I/61YzptnJN9L._AC_UL320_.jpg,https://www.amazon.eg/dp/B0GSYS3Z16,2026-05-26T04:57:56.365981
amazon,,"[MFi Certified] iPhone Charger Cable 2m, 2 Pack Lightning Cable 2 metre Extra Long Nylon USB Charging&Syncing Cord for Apple iPhone 12/iPhone 11/11Pro/11Max/X/XS/XR/XS Max/8/7/6/5S",,Electronics,EGP 499.00,,,4.4,,,,,https://m.media-amazon.com/images/I/71ebw2yqvBL._AC_UL320_.jpg,https://www.amazon.eg/dp/B09J8DFHCD,2026-05-26T04:57:56.366423
amazon,,"Energy Case ® 15.6 inch Laptop Sleeve Waterpoof Case for HP, Pavilion 15, HP ProBook 15, Acer/Predator/Aspire 3 5 15.6, Lenovo Dell Inspiron 15, ASUS MSI Computer Bag (red)",,Electronics,EGP 254.02,,,4.4,,,,,https://m.media-amazon.com/images/I/61FbJrgbfbL._AC_UL320_.jpg,https://www.amazon.eg/dp/B0DY8NLQV7,2026-05-26T04:57:56.366983
amazon,,"TECOOL Case Compatible with MacBook Pro 14 Inch, A2992 A2918 A2779 A2442 with M3 M2 M1 Pro/Max Chip, 2021 2023 Release, Slim Plastic Snap On Hard Shell Cover, Black",,Electronics,EGP 649.00,,,4.2,,,,,https://m.media-amazon.com/images/I/514-lh1qzvL._AC_UL320_.jpg,https://www.amazon.eg/dp/B09LLW2VXR,2026-05-26T04:57:56.368618
amazon,,"G-Power Silicone Cable Protector Kit, Flexible Protective Cover Against Tangles 3D Cute Design, Suitable for All Chargers Set of 4 Pieces - Multi Color (D)",,Electronics,EGP 84.00,,,4.7,,,,,https://m.media-amazon.com/images/I/41roNhdhonL._AC_UL320_.jpg,https://www.amazon.eg/dp/B0F545VDDC,2026-05-26T04:57:56.369073
amazon,,"Tilt Sensitivity Palm Rejection Stylus Pen for Apple iPad(2018 and After) 6/7/8/9/10/11 th Generation/ipad Pro 11/Pro 12.9/Pro 13''/Air 3 4 5 6/Mini 5&6,Precise Digital Electronic Pens iPad Pencil",,Electronics,"EGP 1,428.50","EGP 1,999.00",Save 29%,4.4,Was:,,,,https://m.media-amazon.com/images/I/61mdPCZmjoL._AC_UL320_.jpg,https://www.amazon.eg/dp/B08FJB9M5G,2026-05-26T04:57:56.370013
amazon,,"Fintie Case Compatible with MacBook Air 13 (2018-2020 Version) A2337(M1)/A2179/A1932, Ultra Thin Hard Case Protective Snap Case, Lavender (Matte)",,Electronics,EGP 724.00,,,4.1,,,,,https://m.media-amazon.com/images/I/51CPA7gCIaL._AC_UL320_.jpg,https://www.amazon.eg/dp/B09JK4WZXF,2026-05-26T04:57:56.370575
amazon,,"Fintie Case for MacBook Air 13.6 Inch A3113 A2681 (2022 2023 2024 Release) - Snap On Hard Shell Cover for MacBook Air 13.6"" M2 M3 Chip with Liquid Retina Display and Touch ID (Frost Gray)",,Electronics,EGP 749.00,,,4.4,,,,,https://m.media-amazon.com/images/I/61seetQkAXL._AC_UL320_.jpg,https://www.amazon.eg/dp/B0CPJ54KNF,2026-05-26T04:57:56.371151
amazon,,Cleaning Pen Soft Brush Keyboard Cleaner 5-in-1 Multi-Function Computer Cleaning Tools Kit Corner Gap Duster Keycap Puller for Bluetooth Earphones Laptop Airpods Pro Camera Lens (White_Gray),,Electronics,EGP 93.96,,,4.1,,,,,https://m.media-amazon.com/images/I/51ASEK+9HAL._AC_UL320_.jpg,https://www.amazon.eg/dp/B09YQJDCP6,2026-05-26T04:57:56.371611
amazon,,EooCoo Compatible MacBook Air 13 Inch Case with M1 Chip 2020 2018-2019 Release A2337 A2179 A1932 Cover - Matte Black,,Electronics,EGP 619.00,,,,,,,,https://m.media-amazon.com/images/I/41YhVWP4IRL._AC_UL320_.jpg,https://www.amazon.eg/dp/B0D186HZQK,2026-05-26T04:57:56.372031
amazon,,"Generic USB-C Female Power Pigtail Connector, Flush-Mount Socket, 2 Wires (Red V+, Black GND), 10.5cm (4.13"") for DIY Electronics Projects, Repair, & For Arduino - Power Only (8)",,Electronics,,,,,,,,,https://m.media-amazon.com/images/I/51vQ+FVZBAL._AC_UL320_.jpg,https://www.amazon.eg/dp/B0GT14PYNX,2026-05-26T04:57:56.372392
amazon,,"Tempered Glass Camera Lens Protector, 9H Hardness, Full Coverage, Ultra Clear, Bubble Free Easy Installation, High Touch Sensitivity Compatible with Oneplus 8 Pro - Transparent",,Electronics,EGP 14.00,,,1.0,,,,,https://m.media-amazon.com/images/I/61RrDS2f-GL._AC_UL320_.jpg,https://www.amazon.eg/dp/B0F9T55M5B,2026-05-26T04:57:56.372839
amazon,,"Shockproof Tablet Case Compatible with Huawei MatePad SE 11 inch 2024, Slim Trifold PU Shockproof Case with Pencil Holder (Black)",,Electronics,EGP 610.00,,,3.7,,,,,https://m.media-amazon.com/images/I/41YVrZgUdqL._AC_UL320_.jpg,https://www.amazon.eg/dp/B0GTRKG5R4,2026-05-26T04:57:56.373367
amazon,,Di Pelle 14.6 Inch Laptop Sleeve Compatible with All UltraSlim | Felt & PU Leather,,Electronics,EGP 414.00,EGP 460.00,,4.1,Was:,,,,https://m.media-amazon.com/images/I/817G+LgAdmL._AC_UL320_.jpg,https://www.amazon.eg/dp/B0GMCV16X6,2026-05-26T04:57:56.373916
amazon,,PORTABLE_ELECTRONIC_DEVICE_STAND,,Electronics,EGP 139.10,,,4.7,,,,,https://m.media-amazon.com/images/I/61QqLV1rkOL._AC_UL320_.jpg,https://www.amazon.eg/dp/B0891S9QMQ,2026-05-26T04:58:00.825196
amazon,,"FINTIE iPad Pro 13 Inch (M4) 2024 Case with Pencil Holder - Slim Lightweight Transparent Back Cover with Soft TPU Edge, (Sky Blue)",,Electronics,EGP 430.00,EGP 480.00,,4.4,Was:,,,,https://m.media-amazon.com/images/I/61OcyEjT2OL._AC_UL320_.jpg,https://www.amazon.eg/dp/B0D4M49C1S,2026-05-26T04:58:00.828222
amazon,,"Fintie Case for MacBook Pro 13 Inch A2338(M2 M1) A2251 A2289 A2159 A1989 A1706 A1708 (2016-2021 2022 2023 Release) with/Without Touch Bar- Snap On Hard Shell Case Cover, Frost Gray",,Electronics,EGP 499.00,,,4.0,,,,,https://m.media-amazon.com/images/I/51FNSiOdfxL._AC_UL320_.jpg,https://www.amazon.eg/dp/B08C2N2H8X,2026-05-26T04:58:00.828772
amazon,,"Metal Laptop Stand, 7 Height Levels, Foldable, Laptop Stand Compatible with All 10-17 Inch Devices (Non-Slip Silicone + Storage Bag) Compatible with HP, DELL MACBOOK (Black)",,Electronics,EGP 120.23,EGP 159.00,,3.1,List:,,,,https://m.media-amazon.com/images/I/71zBP3aJ3vL._AC_UL320_.jpg,https://www.amazon.eg/dp/B0FQFHBRLM,2026-05-26T04:58:00.829289
amazon,,"Cougar-EGY laptob Sleeve solid color 15.6"" laptop Protective Case with Zipper Carrying Bag laptop sleeve (grey)",,Electronics,EGP 144.00,,,3.9,,,,,https://m.media-amazon.com/images/I/811SUBlj8eL._AC_UL320_.jpg,https://www.amazon.eg/dp/B0C5MY7Z1R,2026-05-26T04:58:00.829826
amazon,,"Fox Casual [Premium Leather] Laptop Sleeve Case Bag, Soft Felt & PU Leather MacBook Accessory Case Bag Compatible with MacBook Air/Pro HP,Dell,Acer Aspire,Asus Notebook,Laptop (Havan, 15 inch)",,Electronics,EGP 399.00,,,3.2,,,,,https://m.media-amazon.com/images/I/716nSqsdfeL._AC_UL320_.jpg,https://www.amazon.eg/dp/B0CQT6835Y,2026-05-26T04:58:00.830358
amazon,,Smart Stuff Super Slim Protective Padded Sleeve for All Laptop Apple/Microsoft/Dell 2in1/ Asus/Lenovo/Toshiba/Samsung/Huawei/HP/MSI with Siwssgear Design Laptop Case - Black (15.6 inch),,Electronics,EGP 399.99,,,3.6,,,,,https://m.media-amazon.com/images/I/717j+tfSwvS._AC_UL320_.jpg,https://www.amazon.eg/dp/B0DPKV1624,2026-05-26T04:58:00.830857
amazon,,"Fintie Case for MacBook Pro 13 Inch A2338(M2 M1) A2251 A2289 A2159 A1989 A1706 A1708 (2016-2021 2022 2023 Release) with/Without Touch Bar- Snap On Hard Shell Case Cover, Midnight Green",,Electronics,EGP 520.00,,,4.0,,,,,https://m.media-amazon.com/images/I/51oOy6bqy-L._AC_UL320_.jpg,https://www.amazon.eg/dp/B09J3D8ZC6,2026-05-26T04:58:03.715798
amazon,,"TORNADO 4K Smart DLED TV 70 Inch, Wi-Fi Connection - 70US1500E - Shahid VIP Promotion",,Electronics,"EGP 28,549.00","EGP 30,549.00",,4.0,List:,,,,https://m.media-amazon.com/images/I/61NZQmqPXuL._AC_UL320_.jpg,https://www.amazon.eg/dp/B0BRH9QZ3F,2026-05-26T04:58:07.549425
amazon,,"Oraimo Trumpet 3 In-Ear Wired Earphone,10mm Dynamic Driver,HiFi Stereo Audio In-Ear Headphones,Built-in Microphones fro Clear Calls,3.5 mm Jack, Volume Control,Compatible for Smartphones and Laptops",,Electronics,EGP 217.90,EGP 268.80,,3.7,List:,,,,https://m.media-amazon.com/images/I/51eFx0ZZnRL._AC_UL320_.jpg,https://www.amazon.eg/dp/B0D1JX8QCZ,2026-05-26T04:58:07.550053
amazon,,"Oraimo Halo Airy In-Ear Wired Earphone with Type C Plug,HiFi Stereo USB C Earphones With Mic & Volume Control,Compatible for Smartphones with Type-C Ports (Black)",,Electronics,EGP 260.00,,,3.4,,,,,https://m.media-amazon.com/images/I/61jQWilebuL._AC_UL320_.jpg,https://www.amazon.eg/dp/B0CF2SBJQ5,2026-05-26T04:58:07.550578
amazon,,"Fekra Cute 3D Case for iPad Air 13 inch Cases M2 2024 with Pencil Holder, Compatible with iPad Pro 12.9 6th/5th/4th/3rd Generation Case 2022/2021/2020/2018, Auto Wake/Sleep (S-Poohh)",,Electronics,EGP 555.00,EGP 699.00,Save 21%,5.0,Was:,,,,https://m.media-amazon.com/images/I/41ArRnE93LL._AC_UL320_.jpg,https://www.amazon.eg/dp/B0G3B6R3PN,2026-05-26T04:58:07.551107
amazon,,Sony HT-S40R 5.1Ch Real Surround 600 WaT Soundbar with Wireless Rear Speakers Bluetooth Dolby Digital HDMI ARC Optical Input,,Electronics,"EGP 21,999.00","EGP 22,675.00",,4.4,List:,,,,https://m.media-amazon.com/images/I/61N1Uu6xSpS._AC_UL320_.jpg,https://www.amazon.eg/dp/B096BH9VMK,2026-05-26T04:58:07.552166
amazon,,"Sony WH-1000XM5 Noise Cancelling Wireless Headphones - 30 hours battery life - Over-ear style - Optimised for Alexa and the Google Assistant - with built-in mic for phone calls - Black, Bluetooth",,Electronics,"EGP 13,279.65","EGP 20,800.00",,4.3,List:,,,,https://m.media-amazon.com/images/I/514bkhGFloL._AC_UL320_.jpg,https://www.amazon.eg/dp/B09ZFD9CBB,2026-05-26T04:58:07.552733
amazon,,Generic Electronics Wall Speaker 3W 8ohm,,Electronics,EGP 514.50,,,,,,,,https://m.media-amazon.com/images/I/41ZA-L+MGlL._AC_UL320_.jpg,https://www.amazon.eg/dp/B0G72V1GRN,2026-05-26T04:58:07.553199
amazon,,"Zero Electronics Z175 Portable Bluetooth Speaker, RGB LED Light, Strong Bass, 5W Wireless Mini Speaker, TF Card & USB Support, Rechargeable 1200mAh Battery, Black",,Electronics,EGP 425.00,,,,,,,,https://m.media-amazon.com/images/I/61EEMbf98zL._AC_UL320_.jpg,https://www.amazon.eg/dp/B0GYKBDVJ9,2026-05-26T04:58:07.553653
amazon,,"HY320 Mini Projector Android 11, 1080P WIFI6 BT5.0 Home Cinema, 12000 Lumen FHD 4K Support, Car Keystone Outdoor/Home, Compatible with USB/Fire Stick/TV",,Electronics,"EGP 4,999.00",,,,,,,,https://m.media-amazon.com/images/I/61L+xp+ip+L._AC_UL320_.jpg,https://www.amazon.eg/dp/B0GQ431Q5C,2026-05-26T04:58:07.554626
