platform,asin,title,brand,category,current_price,original_price,discount,rating,reviews_count,prime_eligible,amazon_choice,sponsored,main_image,product_url,scraped_at
amazon,B01GG2RJZY,"city star sport Referee Whistle, Fox 80, With Non-Toxic, Long Lasting Material - Blue",Brand: city star sport,Sports & Outdoors > Exercise & Fitness > Accessories,EGP37.05,,,3.1,,,,,https://m.media-amazon.com/images/I/51Qnlnwa2TL._AC_SX300_SY300_QL70_ML2_.jpg,https://www.amazon.eg/dp/B01GG2RJZY,2026-03-29T10:35:03.153120
amazon,B01KKHS04K,Cetaphil Baby Ultra Soothing Lotion for Sensitive Skin 226 g,Brand: Cetaphil,Beauty > Skin Care > Body > Moisturizers > Body Lotions,"EGP1,510.00",,,4.7,,,,,https://m.media-amazon.com/images/I/71lQZThBIvL._AC_SY300_SX300_QL70_ML2_.jpg,https://www.amazon.eg/dp/B01KKHS04K,2026-03-29T10:35:05.595839
amazon,B07594HZ6Y,"Tribit XSound Go Bluetooth Speaker, 16W Portable Wireless Speaker with Loud Sound, 24H Playtime, IPX7 Waterproof, Custom EQ, XBass, BT5.3, TWS Pairing, Type-C, Outdoor/Home/Travel/Beach/Shower (Black)",Brand: Tribit,Electronics > Portable Sound & Vision > Accessories > Portable Speakers & Docks,"EGP5,488.00",,,4.6,,,,,https://m.media-amazon.com/images/I/61hHuYV3vML._AC_SX300_SY300_QL70_ML2_.jpg,https://www.amazon.eg/dp/B07594HZ6Y,2026-03-29T10:35:13.429554
amazon,B0774PVZX9,Lenovo HS10 Smart Scale - Black,Lenovo,Health & Household Products > Medical Supplies & Equipment > Home Tests & Monitoring > Scales > Digital Bathroom Scales,"EGP4,999.00",,,3.9,,,,,https://m.media-amazon.com/images/I/51jWKKnPkPL._AC_SX300_SY300_QL70_ML2_.jpg,https://www.amazon.eg/dp/B0774PVZX9,2026-03-29T10:35:15.781974
amazon,B07PN23GZ5,Other Drain Cleaner Sewer Cleaning Sticks Sewage Decontamination Deodorant The Kitchen Toilet Bathtub 3Pieces A Set,Spaceshoop,Health & Household Products > Home Care & Cleaning > Household Cleaners > Drain Openers,EGP106.00,,,3.0,,,,,https://m.media-amazon.com/images/I/71Nr9zF6cuL._AC_SY300_SX300_QL70_ML2_.jpg,https://www.amazon.eg/dp/B07PN23GZ5,2026-03-29T10:35:43.009240
amazon,B07SB2N2S5,Cerruti 1881 Bicolore Gun Ballpoint Pen - Black,Brand: Cerruti 1881,"Office Products > Pens, Pencils & Writing Supplies > Pens & Refills > Ballpoint Pens > Multi-Function Ballpoint Pens","EGP4,550.00",,,4.6,,,,,https://m.media-amazon.com/images/I/61uQ3yqqdIL._AC_SY300_SX300_QL70_ML2_.jpg,https://www.amazon.eg/dp/B07SB2N2S5,2026-03-29T10:35:48.364346
amazon,B07VRDCC4N,"RKINC Case for Huawei Nova 3i, Crystal Clear Reinforced Corners Soft TPU Bumper Cushion + Hybrid Rugged Soft Transparent Panel Cover for Huawei Nova 3i",Brand: RKINC,Electronics > Mobile Phones & Communication > Accessories > Cases & Covers > Bumpers,EGP150.00,,,4.0,,,,,https://m.media-amazon.com/images/I/61i3iyBB5OL._AC_SY300_SX300_QL70_ML2_.jpg,https://www.amazon.eg/dp/B07VRDCC4N,2026-03-29T10:35:52.924700
amazon,B07X1SJ2TW,DeFacto Womens Coool Parachute Woven Bottom Trousers Trousers (pack of 1),DeFacto,Fashion > Women > Clothing > Pants,,,,,,,,,https://m.media-amazon.com/images/I/51L1vLN037L._AC_SY445_SX342_QL70_ML2_.jpg,https://www.amazon.eg/dp/B07X1SJ2TW,2026-03-29T10:35:55.508778
amazon,B08BCS5LD8,Cool Plain Elastic Waist Front Logo Boxers for Men - Brown,Brand: Cool,Fashion > Men > Clothing > Underwear > Boxers,,,,,,,,,https://m.media-amazon.com/images/I/71A0EI9910S._AC_SX342_SY445_QL70_ML2_.jpg,https://www.amazon.eg/dp/B08BCS5LD8,2026-03-29T10:36:21.709302
amazon,B08BWNC996,Dahab Cotton Set Of 2 Pieces Plain Sleeveless V-Neck Full Slip For Women-Multicolor-2XL,Brand: Dahab,"Fashion > Women > Clothing > Nightwear, Lingerie & Underwear > Lingerie & Underwear > Slips > Full Slips",,,,,,,,,https://m.media-amazon.com/images/I/61I4r65qiPL._AC_SX342_SY445_QL70_ML2_.jpg,https://www.amazon.eg/dp/B08BWNC996,2026-03-29T10:36:25.841033
amazon,B08CX1HH1D,"LIFEEZY Dish soap dispenser for kitchen, innovative soap dispenser and sponge holder 2 in1, countertop soap pump dispenser caddy",Brand: LIFEEZY,"Home & Kitchen > Bath > Bathroom Accessories > Holders, Dispensers & Organizers > Lotion & Soap Dispensers",EGP66.60,,,3.1,,,,,https://m.media-amazon.com/images/I/716L-lDf+BL._AC_SY300_SX300_QL70_ML2_.jpg,https://www.amazon.eg/dp/B08CX1HH1D,2026-03-29T10:36:29.753579
amazon,B08WJPWY42,"Frida green valley liquid handwash, 520 gm",Brand: Frida,Beauty > Bath & Body > Cleansers > Hand Wash,EGP52.00,,,4.4,,,,,https://m.media-amazon.com/images/I/71vLUJYgaHL._AC_SY300_SX300_QL70_ML2_.jpg,https://www.amazon.eg/dp/B08WJPWY42,2026-03-29T10:37:05.837247
amazon,B08ZXV3ZM3,DRILL KEY 13 MM,Brand: Generic,Tools & Home Improvement > Power & Hand Tools > Hand Tools > Spanners & Wrenches > Hex Keys,EGP50.00,,,4.0,,,,,https://m.media-amazon.com/images/I/51a36YTMi8L._AC_SX300_SY300_QL70_ML2_.jpg,https://www.amazon.eg/dp/B08ZXV3ZM3,2026-03-29T10:37:26.815989
amazon,B091J8C96Z,"Descaler for Coffee Machines, 250ml",Brand: Cairo Coffee Talks,"Home & Kitchen > Kitchen > Coffee, Tea & Espresso > Coffee Machine Accessories > Coffee Machine Cleaning Products",EGP239.00,,,4.6,,,,,https://m.media-amazon.com/images/I/61QlBrrQk8L._AC_SY300_SX300_QL70_ML2_.jpg,https://www.amazon.eg/dp/B091J8C96Z,2026-03-29T10:37:53.297087
amazon,B0922WWN81,"Silicone Collapsible Coffee Cup, 350ml Convenient Travel Coffee Mug Lightweight Food Grade Silicone & PP BPA Free for Camping Hiking Outdoor Commuters - Pink",Brand: Other,Sports & Outdoors > Outdoor Recreation > Camping & Hiking > Camp Kitchen > Tableware > Cups & Mugs,EGP60.40,EGP99.00,,3.5,,,,,https://m.media-amazon.com/images/I/61zdzXRyKCL._AC_SY300_SX300_QL70_ML2_.jpg,https://www.amazon.eg/dp/B0922WWN81,2026-03-29T10:38:04.320948
amazon,B0965J2JMX,Remax Stereo Music Earphones Wired Headset Noise Cancelling In-Ear Earphone For iPhone Xiaomi Huawei Mobile phone PS4 RM-711,Brand: Remax,"Electronics > Headphones, Earbuds & Accessories > Headphones & Earbuds > In-Ear Headphones",,,,3.2,,,,,https://m.media-amazon.com/images/I/51XedHPbQ6L._AC_SX300_SY300_QL70_ML2_.jpg,https://www.amazon.eg/dp/B0965J2JMX,2026-03-29T10:38:25.968846
amazon,B096BFNXXT,Say & Sincere Multi-Use Non-Scratch Scrubber Dish Sponge (Ah001-smile1),Brand: Say & Sincere,Home & Kitchen > Household Cleaning Tools & Vacuums > Sponges > Kitchen Cleaning Sponges,EGP50.00,,,3.6,,,,,https://m.media-amazon.com/images/I/81AL7zPmwXS._AC_SY300_SX300_QL70_ML2_.jpg,https://www.amazon.eg/dp/B096BFNXXT,2026-03-29T10:38:34.283880
amazon,B096L6MDL5,"Sylla plastic forks, 25 count - white",Brand: Sila,Home & Kitchen > Kitchen > Tableware > Disposable Tableware > Forks,EGP33.00,,,4.5,,,,,https://m.media-amazon.com/images/I/61Ul+ngKfmS._AC_SX300_SY300_QL70_ML2_.jpg,https://www.amazon.eg/dp/B096L6MDL5,2026-03-29T10:38:37.809289
amazon,B096L7ZNJH,Cottonil Scoop-Neck Solid Slim-Fit Tank Top for Women,Brand: Cottonil,Fashion > Women > Clothing > Activewear > Shirts & Tees > Tank Tops,,EGP129.00,,3.6,,,,,https://m.media-amazon.com/images/I/41nydXHOKJL._AC_SX342_SY445_QL70_ML2_.jpg,https://www.amazon.eg/dp/B096L7ZNJH,2026-03-29T10:38:40.028746
amazon,B098MYBN49,"Printed Boxer Briefs for Men, Set of 3 2725612813173",Brand: Embrator,Fashion > Men > Clothing > Underwear > Boxers,,,,4.5,,,,,https://m.media-amazon.com/images/I/61C3NMvNdqL._AC_SX342_SY445_QL70_ML2_.jpg,https://www.amazon.eg/dp/B098MYBN49,2026-03-29T10:38:54.055406
amazon,B09HGTP5D3,"BOQO 10 Pcs Shower Dredge Brush, Gap Hole Anti-Clogging Cleaning Brush Small Hole Cleaner Brush",Brand: BOQO,Home & Kitchen > Household Cleaning Tools & Vacuums > Brushes > Bathroom Cleaning Brushes,EGP18.00,,,3.1,,,,,https://m.media-amazon.com/images/I/51VutY3OF+L._AC_SY300_SX300_QL70_ML2_.jpg,https://www.amazon.eg/dp/B09HGTP5D3,2026-03-29T10:39:19.350128
amazon,B09LMN7689,Cottonil set of 6 Pro Boxer 103 Multicolor,Brand: Cottonil,Fashion > Men > Clothing > Underwear > Boxers,,,,3.9,,,,,https://m.media-amazon.com/images/I/71KsuodbQdL._AC_SX342_SY445_QL70_ML2_.jpg,https://www.amazon.eg/dp/B09LMN7689,2026-03-29T10:39:31.552475
amazon,B09PGJN6X9,"Ormyla Carrot Seed Oil Raw Virgin for Hair, Skin and Body, 30ml",Brand: Generic,Beauty > Skin Care > Body > Moisturizers > Oils,EGP88.00,,,4.2,,,,,https://m.media-amazon.com/images/I/514KZgTFFLL._AC_SY300_SX300_QL70_ML2_.jpg,https://www.amazon.eg/dp/B09PGJN6X9,2026-03-29T10:39:46.551671
amazon,B0B633QXFM,"YINUOYOUJIA 50 Packs of A7 envelopes for invitation, 5x7 envelopes for Cards-Self Seal, Square Flap, Great for Wedding, Baby Shower, Mailing, Birthday Party (black)",Brand: YINUOYOUJIA,Office Products > Envelopes & Mailing Supplies > Envelopes > Greeting Card & Invitation Envelopes,EGP750.00,,,4.8,,,,,https://m.media-amazon.com/images/I/41XNUGrMzML._AC_SY300_SX300_QL70_ML2_.jpg,https://www.amazon.eg/dp/B0B633QXFM,2026-03-29T10:40:36.075495
amazon,B0BRBSZFDT,Brief interpretation 14x20,Brand: Generic,Arts & Crafts > Crafting > Paper & Paper Crafts > Paper > Drawing Pads & Books,EGP298.00,,,3.9,,,,,https://m.media-amazon.com/images/I/71Rl7nbOoPL._AC_SY300_SX300_QL70_ML2_.jpg,https://www.amazon.eg/dp/B0BRBSZFDT,2026-03-29T10:41:28.198330
amazon,B0C3RFXJ55,Plastic Bisque - Multicolor,Brand: elyassin,"Home & Kitchen > Bath > Bathroom Accessories > Holders, Dispensers & Organizers > Soap Dishes",EGP14.76,,,5.0,,,,,https://m.media-amazon.com/images/I/51sk2uml2NL._AC_SX300_SY300_QL70_ML2_.jpg,https://www.amazon.eg/dp/B0C3RFXJ55,2026-03-29T10:42:25.723622
amazon,B0C6MSP9NV,Women’s 100% Cotton Underwear | Elegant Lace-Trimmed Women's Underwear | Ultimate Comfort and Style,Brand: YOUNG UNDERWEAR,"Fashion > Women > Clothing > Nightwear, Lingerie & Underwear > Lingerie & Underwear > Panties",,,,3.9,,,,,https://m.media-amazon.com/images/I/510l2SKV1YL._AC_SX342_SY445_QL70_ML2_.jpg,https://www.amazon.eg/dp/B0C6MSP9NV,2026-03-29T10:42:39.871191
amazon,B0C8JLHXSJ,"5pcs 9V Battery Clip Connector with Leads – Soft Buckle Snap Type, DC Power Cable Wire -17cm Length -",Brand: Generic,Electronics > Household Batteries & Chargers > Battery Holders,EGP79.99,,,3.9,,,,,https://m.media-amazon.com/images/I/51c9z-gBPOL._AC_SY300_SX300_QL70_ML2_.jpg,https://www.amazon.eg/dp/B0C8JLHXSJ,2026-03-29T10:42:45.821861
amazon,B0C996MYMB,"Moro Moro 3 Baby Changing Pad Cover - 1 Pack, 16x32, Blue Dinosaur, Soft Breathable Microfiber, Fits Standard Changing Pads",Moro Moro 3,Baby Products > Diaper Changing > Changing Pads & Covers > Covers,EGP205.00,,,1.9,,,,,https://m.media-amazon.com/images/I/61+OHumg9TL._AC_SY300_SX300_QL70_ML2_.jpg,https://www.amazon.eg/dp/B0C996MYMB,2026-03-29T10:42:48.220119
amazon,B0CJK3XFZ4,DOMS Dust Collector Pencil Sharpener in Blister Pack,Brand: Doms,"Office Products > Pens, Pencils & Writing Supplies > Pencil Sharpeners",EGP23.31,,,2.6,,,,,https://m.media-amazon.com/images/I/61kO1dZxZOL._AC_SY300_SX300_QL70_ML2_.jpg,https://www.amazon.eg/dp/B0CJK3XFZ4,2026-03-29T10:43:25.181408
amazon,B0CQNCH9PN,Reebok WOMEN IDENTITY BIG LOGO TEE REEBOK IDENTITY BIG LOGO TEE,Brand: Reebok,Fashion > Women > Clothing > Activewear > Shirts & Tees > T-Shirts,,,,4.2,,,,,https://m.media-amazon.com/images/I/51OxBb5mm4L._AC_SX342_SY445_QL70_ML2_.jpg,https://www.amazon.eg/dp/B0CQNCH9PN,2026-03-29T10:44:09.022818
amazon,B0CRP7Z7K9,Mesery Comfortable Scoop Neck Undershirt - White -,Brand: Mesery,"Fashion > Women > Clothing > Nightwear, Lingerie & Underwear > Lingerie & Underwear > Camisoles & Tanks",,EGP109.00,,4.0,,,,,https://m.media-amazon.com/images/I/41z3PUcBFcL._AC_SX342_SY445_QL70_ML2_.jpg,https://www.amazon.eg/dp/B0CRP7Z7K9,2026-03-29T10:44:15.098577
amazon,B0CYW7JV7S,Clear Case Compatible with Huawei Nova 3i 4 Corners Full Body Protection TPU Anti-Yellowing Clear Phone Cover - Clear,Brand: Generic,Electronics > Mobile Phones & Communication > Accessories > Cases & Covers > Basic Cases,EGP52.51,EGP59.00,,4.0,,,,,https://m.media-amazon.com/images/I/61CMSBvdlSL._AC_SY300_SX300_QL70_ML2_.jpg,https://www.amazon.eg/dp/B0CYW7JV7S,2026-03-29T10:44:46.034675
amazon,B0D31N6RPF,GRABIST Shockproof Back Case Cover with Best Camera Protection Compatible with Samsung Galaxy S24 Shockproof Case Reinforced Edges Protection (Samsung Galaxy S24),Brand: GRABIST,Electronics > Mobile Phones & Communication > Accessories > Cases & Covers > Basic Cases,EGP40.00,,,4.5,,,,,https://m.media-amazon.com/images/I/61B5RlhTrhL._AC_SY300_SX300_QL70_ML2_.jpg,https://www.amazon.eg/dp/B0D31N6RPF,2026-03-29T10:45:03.884283
amazon,B0D3Z2VGZM,Back Cover Stand Case Magnetic Car Holder Soft Silicone Horizontal & Vertical Kickstand Cover Wrist Strap Full protection Anti Fingerprint Case (iPhone 13 mini),Brand: Generic,Electronics > Mobile Phones & Communication > Accessories > Cases & Covers > Basic Cases,EGP139.50,EGP155.00,,4.1,,,,,https://m.media-amazon.com/images/I/51TDM5NEFeL._AC_SY300_SX300_QL70_ML2_.jpg,https://www.amazon.eg/dp/B0D3Z2VGZM,2026-03-29T10:45:10.866335
amazon,B0D4K7XX7W,"Elmaayergy Plastic ID Card Holder With Neck Strap 613_DX-614 D-48/D-50 Suitable For classroom, Homeschooling, And Individual Study Environments",Brand: Elmaayergy,Office Products > School & Educational Supplies,EGP21.00,,,4.4,,,,,https://m.media-amazon.com/images/I/618z4M6-oKL._AC_SX300_SY300_QL70_ML2_.jpg,https://www.amazon.eg/dp/B0D4K7XX7W,2026-03-29T10:45:17.008033
amazon,B0D9FK3QBF,MB3 Womens Set Of 2 Pieces Jacquard Elastic Brief Underwear Set Of 2 Pieces Jacquard Elastic Brief Printed Shapes (pack of 1),Brand: MB3,Fashion > Women > Clothing > Activewear > Underwear > Briefs,,,,5.0,,,,,https://m.media-amazon.com/images/I/81wFKwHt-dL._AC_SX342_SY445_QL70_ML2_.jpg,https://www.amazon.eg/dp/B0D9FK3QBF,2026-03-29T10:45:45.959549
amazon,B0D9R53XJW,"Vgr V-981 Professional Hair Trimmer For Men, Corded & Cordless With Led Display & Turbo Mode Function, 150 Min Runtime With 1 Year Warranty (Blue)",Brand: VGR,"Beauty > Shaving & Hair Removal > Trimmers, Clippers & Body Groomers > Men's > Beard & Mustache Trimmers",EGP475.00,EGP515.00,,5.0,,,,,https://m.media-amazon.com/images/I/71JbP1e5wyL._AC_SY300_SX300_QL70_ML2_.jpg,https://www.amazon.eg/dp/B0D9R53XJW,2026-03-29T10:45:50.304242
amazon,B0DJYFFXW3,"Pack of 12 Washing Machine Effervescent Tablets - Deep Clean & Deodorize - Specially Designed for Front & Top Load Washing Machines to Eliminate Bad Odors, From Elegant Home",Brand: Generic,Health & Household Products > Home Care & Cleaning > Laundry > Laundry Detergent > Detergent Capsules & Tablets,EGP245.00,,,,,,,,https://m.media-amazon.com/images/I/71WCWm2e-qL._AC_SY300_SX300_QL70_ML2_.jpg,https://www.amazon.eg/dp/B0DJYFFXW3,2026-03-29T10:46:54.156798
amazon,B0DMXQTK5N,Compatible with Huawei Mate 60 Pro Clear Shockproof Soft Case Cover,Brand: Generic,Electronics > Mobile Phones & Communication > Accessories > Cases & Covers > Basic Cases,EGP75.00,,,,,,,,https://m.media-amazon.com/images/I/51TOr-9RfEL._AC_SY300_SX300_QL70_ML2_.jpg,https://www.amazon.eg/dp/B0DMXQTK5N,2026-03-29T10:47:13.743002
amazon,B0DNCRS9J6,"PRIMA Writing Bundle ( flash ballpoint pen, set of 10 assorted colors +Hopax-stick'n 21007 sticky note 76x76 mm - yellow, 100 sheets)",Brand: PRIMA,"Office Products > Pens, Pencils & Writing Supplies > Pens & Refills > Ballpoint Pens > Multi-Function Ballpoint Pens",EGP66.76,EGP87.78,,,,,,,https://m.media-amazon.com/images/I/41uxMsOUGAL._AC_SY300_SX300_QL70_ML2_.jpg,https://www.amazon.eg/dp/B0DNCRS9J6,2026-03-29T10:47:16.239991
amazon,B0DQ5JZW64,Bravo Stationery Bundle: 100 Ballpoint Pen 6-Pack + Staedtler Graphite Mechanical Pencil 0.7mm,Brand: Bravo,"Office Products > Pens, Pencils & Writing Supplies > Pens & Refills > Ballpoint Pens > Multi-Function Ballpoint Pens",EGP91.38,,,,,,,,https://m.media-amazon.com/images/I/41KeTvGUFUL._AC_SY300_SX300_QL70_ML2_.jpg,https://www.amazon.eg/dp/B0DQ5JZW64,2026-03-29T10:47:29.776146
amazon,B0DT4LPD68,KOTON Womens TROUSERS BSC WOVEN BOTTOMS (pack of 1),KOTON,Fashion > Women > Clothing > Pants,,,,,,,,,https://m.media-amazon.com/images/I/71mO1D8k8WL._AC_SY445_SX342_QL70_ML2_.jpg,https://www.amazon.eg/dp/B0DT4LPD68,2026-03-29T10:47:50.994724
amazon,B0DWLNPKXM,Trendyol Women Pink Embroidered Lace Rope Strapless Knitted Underwear Set THMAW24CC00014 Briefs,Brand: Trendyol,"Fashion > Women > Clothing > Nightwear, Lingerie & Underwear > Lingerie & Underwear > Panties",,EGP909.00,,5.0,,,,,https://m.media-amazon.com/images/I/71XlV4ceqZL._AC_SY445_SX342_QL70_ML2_.jpg,https://www.amazon.eg/dp/B0DWLNPKXM,2026-03-29T10:48:04.176199
amazon,B0DZ9D2LHQ,"Dl3 Mobilak Luxury Case Compatible with Xiaomi Redmi Note 10 4G/Note 10S, Ultra-Thin Soft TPU Frame, Back Leather Mixed Double+Plexiglass Protective Cover With Built-in Car Magnetic (Blue)",Brand: Dl3 Mobilak,Electronics > Mobile Phones & Communication > Accessories > Cases & Covers > Basic Cases,EGP175.00,,,4.6,,,,,https://m.media-amazon.com/images/I/51H876rq6-L._AC_SY300_SX300_QL70_ML2_.jpg,https://www.amazon.eg/dp/B0DZ9D2LHQ,2026-03-29T10:48:31.958940
amazon,B0F6LTRRQD,"Glass Wiper with & Silicone Floor Squeegee Long Stainless Steel Handle – 180° Rotating Mop for Wet & Dry Cleaning – Perfect for Windows, Bathrooms, Floors, and Kitchen Surfaces (Grey)",Brand: Generic,Home & Kitchen > Household Cleaning Tools & Vacuums > Squeegees,EGP100.00,,,1.0,,,,,https://m.media-amazon.com/images/I/31Gm86UL5bL._AC_SY300_SX300_QL70_ML2_.jpg,https://www.amazon.eg/dp/B0F6LTRRQD,2026-03-29T10:49:04.866375
amazon,B0F8HP5B3C,Liquid Soap 600ml,Brand: Happy Clean,Beauty > Bath & Body > Cleansers > Hand Wash,EGP23.00,,,,,,,,https://m.media-amazon.com/images/I/71LjlvwXmGL._AC_SY300_SX300_QL70_ML2_.jpg,https://www.amazon.eg/dp/B0F8HP5B3C,2026-03-29T10:49:15.756414
amazon,B0F9VTPDF7,Town Baby Diapers - 20 Pieces (Size 2) - حفاضات أطفال مقاس 2 للبشرة الحساسة بدون عطر، ناعمة ومريحة على بشرة طفلك الرقيقة. مثالية للاستخدام النهاري والليلي. مناسبة للأولاد والبنات,Brand: Generic,Baby Products > Diaper Changing > Disposable Diapers > Baby Diapers,EGP99.00,,,3.5,,,,,https://m.media-amazon.com/images/I/71BfRL-RfAL._AC_SX300_SY300_QL70_ML2_.jpg,https://www.amazon.eg/dp/B0F9VTPDF7,2026-03-29T10:49:30.116159
amazon,B0FBBRB6BN,"unisex Hooded Fur Robe, Soft Bathrobe for Womens, Cute Long House Coat",Generic,"Fashion > Women > Clothing > Nightwear, Lingerie & Underwear > Nightwear > Robes",,EGP699.99,,3.9,,,,,https://m.media-amazon.com/images/I/61ysfroVRiL._AC_SX342_SY445_QL70_ML2_.jpg,https://www.amazon.eg/dp/B0FBBRB6BN,2026-03-29T10:49:33.903469
amazon,B0FG17174L,"Seamless Sports Bra, Red, V-Neck Athletic Crop Top for Women",Brand: Generic,Fashion > Women > Clothing > Activewear > Underwear > Sports Bras,,,,,,,,,https://m.media-amazon.com/images/I/51iwI4ARZaL._AC_SY445_SX342_QL70_ML2_.jpg,https://www.amazon.eg/dp/B0FG17174L,2026-03-29T10:49:58.835360
amazon,B0FG326H82,"M&G Hi-Polymeric Leads, Bold Writing, 2B 0.5mm, High-Quality Graphite",M&G,"Office Products > Pens, Pencils & Writing Supplies > Pencils > Mechanical Pencil Leads",EGP12.00,,,,,,,,https://m.media-amazon.com/images/I/61L5-Roia+L._AC_SY300_SX300_QL70_ML2_.jpg,https://www.amazon.eg/dp/B0FG326H82,2026-03-29T10:50:01.100469
amazon,B0FHNXCKGL,Dahab Womens 3301 Undershirt (pack of 1),Brand: Dahab,"Fashion > Women > Clothing > Nightwear, Lingerie & Underwear > Lingerie & Underwear > Camisoles & Tanks",,,,4.2,,,,,https://m.media-amazon.com/images/I/51kamKnyTOL._AC_SX342_SY445_QL70_ML2_.jpg,https://www.amazon.eg/dp/B0FHNXCKGL,2026-03-29T10:50:18.273418
amazon,B0FJ8DGG8W,(For 14C) Back Cover Soft Silicon Bumper TPU Case Camera Protection with Variety Prominent Toys For Xiaomi Redmi 14C Case (Green),Brand: Generic,Electronics > Mobile Phones & Communication > Accessories > Cases & Covers > Basic Cases,EGP79.00,,,5.0,,,,,https://m.media-amazon.com/images/I/71dw24WGO-L._AC_SY300_SX300_QL70_ML2_.jpg,https://www.amazon.eg/dp/B0FJ8DGG8W,2026-03-29T10:50:32.498669
amazon,B0FJG25JM4,Pello Oil in water micellar water 120ml,Brand: kdpello pielclara,Beauty > Skin Care > Makeup Removers > Makeup Cleansing Water,EGP80.00,,,5.0,,,,,https://m.media-amazon.com/images/I/61tqI59uwjL._AC_SY300_SX300_QL70_ML2_.jpg,https://www.amazon.eg/dp/B0FJG25JM4,2026-03-29T10:50:38.286440
amazon,B0FMQ4QHGC,"Yadoo Sticky Notes, 7 Arrow Colors Dividers, 45x12mm, 25 Sheets, Precise Organization for Notes",Brand: Yidoo,"Office Products > Office Paper Products > Notebooks, Writing Pads & Diaries > Self-Stick Notes",EGP31.01,,,5.0,,,,,https://m.media-amazon.com/images/I/61XToDmW2oL._AC_SY300_SX300_QL70_ML2_.jpg,https://www.amazon.eg/dp/B0FMQ4QHGC,2026-03-29T10:51:06.243644
amazon,B0FMXW3T8Z,Tamara Kitchen Paper Roll 8-Piece Set,Brand: Tamara,"Health & Household Products > Home Care & Cleaning > Papers, Wraps & Bags > Kitchen Rolls",EGP84.65,,,2.0,,,,,https://m.media-amazon.com/images/I/71uwlfpeVyL._AC_SX300_SY300_QL70_ML2_.jpg,https://www.amazon.eg/dp/B0FMXW3T8Z,2026-03-29T10:51:08.344470
amazon,B0FR9K966N,Kayser Women's Cotton 3 Pack Underwear (Large),Brand: Kayser,"Fashion > Women > Clothing > Nightwear, Lingerie & Underwear > Lingerie & Underwear > Panties",,,,4.4,,,,,https://m.media-amazon.com/images/I/51AiIl8wBxL._AC_SX342_SY445_QL70_ML2_.jpg,https://www.amazon.eg/dp/B0FR9K966N,2026-03-29T10:51:32.471466
amazon,B0FV8NLB5T,Vector London Landmark Silicone Printed mobile case compatible with Xiaomi Redmi 10A,Brand: Generic,Electronics > Mobile Phones & Communication > Accessories > Cases & Covers > Basic Cases,EGP137.00,,,,,,,,https://m.media-amazon.com/images/I/71xra110RaL._AC_SY300_SX300_QL70_ML2_.jpg,https://www.amazon.eg/dp/B0FV8NLB5T,2026-03-29T10:51:58.165735
amazon,B0FWD7SRP2,"Plastic Back Cover For Apple iPhone 14 Pro Max, Blue M-S-405",Brand: Generic,Electronics > Mobile Phones & Communication > Accessories > Cases & Covers > Basic Cases,EGP100.00,,,,,,,,https://m.media-amazon.com/images/I/41119uIoXjL._AC_SY300_SX300_QL70_ML2_.jpg,https://www.amazon.eg/dp/B0FWD7SRP2,2026-03-29T10:52:06.952239
amazon,B0FWDD8SDZ,"Plastic Back Cover For Xiaomi Poco C65, Multi Color M-S-606",Brand: Generic,Electronics > Mobile Phones & Communication > Accessories > Cases & Covers > Basic Cases,EGP150.00,,,,,,,,https://m.media-amazon.com/images/I/511di-799YL._AC_SY300_SX300_QL70_ML2_.jpg,https://www.amazon.eg/dp/B0FWDD8SDZ,2026-03-29T10:52:10.754203
amazon,B0G15DBTLF,Lee Cooper Ankle Length Plain Jeans with Pocket Detail and Belt Loops BLUE -size 36 6292378230019,Brand: Lee Cooper,Fashion > Women > Clothing > Pants,,,,,,,,,https://m.media-amazon.com/images/I/71JZ0qaWrGL._AC_SX342_SY445_QL70_ML2_.jpg,https://www.amazon.eg/dp/B0G15DBTLF,2026-03-29T10:52:44.812421
amazon,B0G1MM3KHQ,M&G Ballpoint Pen 4-Color - Black,M&G,"Office Products > Pens, Pencils & Writing Supplies > Pens & Refills > Ballpoint Pens > Stick Ballpoint Pens",EGP75.00,,,,,,,,https://m.media-amazon.com/images/I/21q2YCVbX6L._AC_SY300_SX300_QL70_ML2_.jpg,https://www.amazon.eg/dp/B0G1MM3KHQ,2026-03-29T10:52:49.049662
amazon,B0G3DJB7LQ,Design 39 Silicone Printed mobile case compatible with Samsung Galaxy A07,Brand: Generic,Electronics > Mobile Phones & Communication > Accessories > Cases & Covers > Basic Cases,EGP137.00,,,,,,,,https://m.media-amazon.com/images/I/418HJC4kAaL._AC_SY300_SX300_QL70_ML2_.jpg,https://www.amazon.eg/dp/B0G3DJB7LQ,2026-03-29T10:53:23.782796
amazon,B0G4CDT38R,C.F.S TPU Glitter Print Back Cover for Apple iPhone 13 Pro Max - Light Green - CFS2510,Brand: C.F.S,Electronics > Mobile Phones & Communication > Accessories > Cases & Covers > Basic Cases,EGP100.00,,,,,,,,https://m.media-amazon.com/images/I/51k+qCKWM5L._AC_SY300_SX300_QL70_ML2_.jpg,https://www.amazon.eg/dp/B0G4CDT38R,2026-03-29T10:53:33.881170
amazon,B0GPZQ9VCB,Mother Club Mom dad parents Hoodie Washed 8,Brand: Generic,Fashion > Women > Clothing > Hoodies & Sweatshirts > Hoodies,,,,,,,,,https://m.media-amazon.com/images/I/51XsPWHsioL._AC_SX342_SY445_QL70_ML2_.jpg,https://www.amazon.eg/dp/B0GPZQ9VCB,2026-03-29T10:55:38.958822
amazon,B0GRRMDD2L,Vacation Aqua-repair Micellar Water 200ml,Vacation,Beauty > Skin Care > Makeup Removers > Makeup Cleansing Water,EGP230.00,,,,,,,,https://m.media-amazon.com/images/I/51KxryVQBvL._AC_SY300_SX300_QL70_ML2_.jpg,https://www.amazon.eg/dp/B0GRRMDD2L,2026-03-29T10:56:17.809748
amazon,B0GS39L8ZK,"Huawei MatePad 11.5 Case, 360 Degree Rotating Multi-Angle PU Leather Case for Huawei MatePad 11.5 Tablet",Brand: Generic,"Electronics > Computers, Components & Accessories > Accessories > Tablet Accessories > Bags, Cases & Sleeves > Cases",EGP499.00,,,,,,,,https://m.media-amazon.com/images/I/61nVU05cU1L._AC_SX300_SY300_QL70_ML2_.jpg,https://www.amazon.eg/dp/B0GS39L8ZK,2026-03-29T10:56:24.736903
amazon,B0GSB7CTL7,لانجرى سكسى مثير لانجرى ساخن لعشاق التنكرى لانجرى تنكري الشرطيه الساخنه تنكرى فتاه الشرطه الشقيه المثيره ياتى بدون كلبش لانجرى سيكسى لانجرى حريمى من FOUR H كود 735,Brand: Generic,"Fashion > Women > Clothing > Nightwear, Lingerie & Underwear > Lingerie & Underwear",,,,,,,,,https://m.media-amazon.com/images/I/51e+r+HhqzL._AC_SY445_SX342_QL70_ML2_.jpg,https://www.amazon.eg/dp/B0GSB7CTL7,2026-03-29T10:56:32.184524
amazon,B0GSH66BQZ,Case for Realme C85 Matte Case Soft TPU Silicone Cover Full Camera Protection Shockproof Case for Realme C85 (Blue),Brand: Generic,Electronics > Mobile Phones & Communication > Accessories > Cases & Covers > Basic Cases,EGP150.00,,,,,,,,https://m.media-amazon.com/images/I/51qy2wWFCpL._AC_SY300_SX300_QL70_ML2_.jpg,https://www.amazon.eg/dp/B0GSH66BQZ,2026-03-29T10:56:35.970724
amazon,B0GTN988P1,"Thermal Glass Coffee and Milk Pot, 400 ml Capacity, Wooden Lid with Golden Deer Figurine, Use on Direct Fire",Brand: Generic,Home & Kitchen > Kitchen > Tableware > Dishware & Serving Pieces > Teapots & Coffee Servers > Coffee Pots,EGP324.00,,,,,,,,https://m.media-amazon.com/images/I/61zYBWPFgYL._AC_SY300_SX300_QL70_ML2_.jpg,https://www.amazon.eg/dp/B0GTN988P1,2026-03-29T10:57:27.471341
