platform,product_id,title,brand,category,current_price,original_price,discount,rating,reviews_count,availability,seller,express_delivery,platform_badge,sponsored,main_image,all_images,description,weight,dimensions,model_number,country_of_origin,warranty,tech_specs,variations,ships_from,delivery_date,product_url,scraped_at
amazon,B0D5HWQ666,"Portable Air Conditioner - Personal Humidifier, Evaporative Air Cooler, Mini USB, Desktop Air Conditioner - 4 in 1 Air Cooler Fan for Home and Office Use by YOSHOP",,AR-AC,EGP 666.90,,,3.6,,,,,,,https://m.media-amazon.com/images/I/51UkSBUpsJL._AC_UL320_.jpg,https://m.media-amazon.com/images/I/51UkSBUpsJL._AC_UL320_.jpg,,,,,,,,,,,https://www.amazon.eg/dp/B0D5HWQ666,2026-05-07T04:50:53.976269
amazon,B0BZWNV6KX,"NTMY Personal Air Cooler, 1200ml Portable Air Conditioner, Ultra-Quiet Mini Air Cooling Fan with Humidifier for All Season Use, 5 Cool Mist & 4 Speeds, 7 Night Light & 2-8H Timer, Remote Control",,AR-AC,EGP 991.36,,,3.2,,,,,,,https://m.media-amazon.com/images/I/61ULDTlXY+L._AC_UL320_.jpg,https://m.media-amazon.com/images/I/61ULDTlXY+L._AC_UL320_.jpg,,,,,,,,,,,https://www.amazon.eg/dp/B0BZWNV6KX,2026-05-07T04:50:53.979071
amazon,B0FPJRVW58,"TORNADO Split Air Conditioner 4 HP Cool - Heat Inverter Digital Plasma Shield, Turbo Function, Defrost Function, Auto Restart, Self Diagnose, Tropical Rotary Compressor, Self Diagnose White TY-X30CEE",,AR-AC,"EGP 79,310.00",,,,,,,,,,https://m.media-amazon.com/images/I/31RcRULr8PL._AC_UL320_.jpg,https://m.media-amazon.com/images/I/31RcRULr8PL._AC_UL320_.jpg,,,,,,,,,,,https://www.amazon.eg/dp/B0FPJRVW58,2026-05-07T04:50:53.980146
amazon,B09MC5LBBP,"SHARP Split Air Conditioner 1.5 HP 12966 (BTU/H) Inverter, Cool - Heat, (AIOT) Smart, Plasmacluster, Eco Mode, Fast Cooling, Auto Swing, Self Clean, Tropical Compressor, Red AY-XP12YHER",,AR-AC,"EGP 37,500.00",,,3.6,,,,,,,https://m.media-amazon.com/images/I/619yn6x8jrL._AC_UL320_.jpg,https://m.media-amazon.com/images/I/619yn6x8jrL._AC_UL320_.jpg,,,,,,,,,,,https://www.amazon.eg/dp/B09MC5LBBP,2026-05-07T04:50:53.980696
amazon,B0D92ZK1CN,Carrier 42QHET30DN-708F 4HP Tropical Air Conditioner Optimax High Wall Inverter System Cool & Hot,,AR-AC,"EGP 81,785.10",,,,,,,,,,https://m.media-amazon.com/images/I/31mL4CU0pFL._AC_UL320_.jpg,https://m.media-amazon.com/images/I/31mL4CU0pFL._AC_UL320_.jpg,,,,,,,,,,,https://www.amazon.eg/dp/B0D92ZK1CN,2026-05-07T04:50:53.984086
amazon,B0D8QJV7JK,"Fresh Desert Air Cooler, Cool and Hot",,AR-AC,"EGP 2,999.00","EGP 3,725.00",,1.0,List:,,,,,,https://m.media-amazon.com/images/I/41lKTVOVPuL._AC_UL320_.jpg,https://m.media-amazon.com/images/I/41lKTVOVPuL._AC_UL320_.jpg,,,,,,,,,,,https://www.amazon.eg/dp/B0D8QJV7JK,2026-05-07T04:50:53.985219
amazon,B0BXT2J4CC,"Carrier HW Optimax Inverter 2.25HP - Cooling and Heating Smart Tropical A/C, Wi-Fi Enabled",,AR-AC,"EGP 47,499.00",,,2.9,,,,,,,https://m.media-amazon.com/images/I/41QvDYBeHAL._AC_UL320_.jpg,https://m.media-amazon.com/images/I/41QvDYBeHAL._AC_UL320_.jpg,,,,,,,,,,,https://www.amazon.eg/dp/B0BXT2J4CC,2026-05-07T04:50:53.989235
amazon,B0DY867PHY,Carrier 4 Horse Power Inverter Cooling and Heating,,AR-AC,"EGP 84,999.00",,,,,,,,,,https://m.media-amazon.com/images/I/516qIo2fBCL._AC_UL320_.jpg,https://m.media-amazon.com/images/I/516qIo2fBCL._AC_UL320_.jpg,,,,,,,,,,,https://www.amazon.eg/dp/B0DY867PHY,2026-05-07T04:50:53.989721
amazon,B0C9MFF9MX,"SHENGYI Portable Air Conditioner Fan, Mini Personal Evaporative Air Cooler Oscillation/Humidifier/Timing Function, Desktop Misting Fast Cooling Fan With Led Light For Room Office Camping (Multicolor)",,AR-AC,EGP 345.00,,,2.9,,,,,,,https://m.media-amazon.com/images/I/71RnuxZBzkL._AC_UL320_.jpg,https://m.media-amazon.com/images/I/71RnuxZBzkL._AC_UL320_.jpg,,,,,,,,,,,https://www.amazon.eg/dp/B0C9MFF9MX,2026-05-07T04:50:53.990868
amazon,B0D3LXCZ88,"Beko 3 HP Cool and Heat Air Conditioner with Pro Smart Inverter and Jet Cool Function, Acrylic Silver - 9212503200",,AR-AC,"EGP 57,040.00",,,,,,,,,,https://m.media-amazon.com/images/I/618IGwyeDRL._AC_UL320_.jpg,https://m.media-amazon.com/images/I/618IGwyeDRL._AC_UL320_.jpg,,,,,,,,,,,https://www.amazon.eg/dp/B0D3LXCZ88,2026-05-07T04:50:53.991923
amazon,B0D57FTQCZ,"Air Conditioner Portable Cooling Fan, Mini Air Cooler, Portable Personal Mobile Cooler, Humidifier, 3 Speed Misting Fan USB Cooler Personal Fan, Strong Airflow Quiet Operation",,AR-AC,EGP 570.30,,,,,,,,,,https://m.media-amazon.com/images/I/71GFMYLl3zL._AC_UL320_.jpg,https://m.media-amazon.com/images/I/71GFMYLl3zL._AC_UL320_.jpg,,,,,,,,,,,https://www.amazon.eg/dp/B0D57FTQCZ,2026-05-07T04:50:53.993399
amazon,B0BXT2QFT9,Midea HW Mission Inverter 5HP - Cooling and Heating Tropical A/C,,AR-AC,"EGP 89,720.00",,,1.8,,,,,,,https://m.media-amazon.com/images/I/41DQpYRDNaL._AC_UL320_.jpg,https://m.media-amazon.com/images/I/41DQpYRDNaL._AC_UL320_.jpg,,,,,,,,,,,https://www.amazon.eg/dp/B0BXT2QFT9,2026-05-07T04:50:53.995150
amazon,B0DB1R59S7,"KINZILLA Portable Air Conditioner - Small Personal Air Cooler Quiet AC Portable Mini Computer Cooling Fan USB Powered 1/2/3H Timer, 3 Speed",,AR-AC,EGP 350.00,,,2.2,,,,,,,https://m.media-amazon.com/images/I/7180B3OthzL._AC_UL320_.jpg,https://m.media-amazon.com/images/I/7180B3OthzL._AC_UL320_.jpg,,,,,,,,,,,https://www.amazon.eg/dp/B0DB1R59S7,2026-05-07T04:50:53.995716
amazon,B094W6W4L9,"Kasan Mobile Air Conditioner Air Conditioner Fan, Mini Air Cooler, Portable Personal Mobile Air Conditioners Circulator, Humidifier, 3 Speed Misting Fan,for Home & Office & Outdoor",,AR-AC,EGP 364.00,,,2.7,,,,,,,https://m.media-amazon.com/images/I/7125GEQ2qIS._AC_UL320_.jpg,https://m.media-amazon.com/images/I/7125GEQ2qIS._AC_UL320_.jpg,,,,,,,,,,,https://www.amazon.eg/dp/B094W6W4L9,2026-05-07T04:50:53.996216
amazon,B0DFQHDP4W,Portable Air Conditioner Personal Desktop Air Cooler Humidifier Air Purification USB Mini Fan with 7 Color LED Light for Home or Office,,AR-AC,EGP 475.00,,,1.0,,,,,,,https://m.media-amazon.com/images/I/61OopOxK7ZL._AC_UL320_.jpg,https://m.media-amazon.com/images/I/61OopOxK7ZL._AC_UL320_.jpg,,,,,,,,,,,https://www.amazon.eg/dp/B0DFQHDP4W,2026-05-07T04:50:53.996755
amazon,B0FJ217WR7,High Quality Air Conditioner Condenser 5+50uF Air Conditioner Compressor Strengthener,,AR-AC,EGP 300.00,,,,,,,,,,https://m.media-amazon.com/images/I/61D0EqmFRpL._AC_UL320_.jpg,https://m.media-amazon.com/images/I/61D0EqmFRpL._AC_UL320_.jpg,,,,,,,,,,,https://www.amazon.eg/dp/B0FJ217WR7,2026-05-07T04:50:53.997211
amazon,B0GXRZ3KGD,"Retractable Air Conditioner Deflector, Prevent Direct Flow, 95x12cm, White",,AR-AC,EGP 250.00,,,,,,,,,,https://m.media-amazon.com/images/I/61a8Mf1u62L._AC_UL320_.jpg,https://m.media-amazon.com/images/I/61a8Mf1u62L._AC_UL320_.jpg,,,,,,,,,,,https://www.amazon.eg/dp/B0GXRZ3KGD,2026-05-07T04:50:53.997696
amazon,B00AFN0VX8,موزع تكييف سبليت قابل للتعديل، عاكس اتجاه هواء سهل التركيب يناسب جميع أحجام مكيفات الهواء، مزخرف بتصاميم والوان مختلفة,,AR-AC,EGP 450.00,,,3.6,,,,,,,https://m.media-amazon.com/images/I/51W35T7qdDL._AC_UL320_.jpg,https://m.media-amazon.com/images/I/51W35T7qdDL._AC_UL320_.jpg,,,,,,,,,,,https://www.amazon.eg/dp/B00AFN0VX8,2026-05-07T04:50:53.998261
amazon,B0CGQ5S192,House of Quirk Air Conditioner Deflector for Directing and Preventing Direct Flow and Adjustable Cover for Air Protection Wanda.Store,,AR-AC,EGP 109.00,,,2.6,,,,,,,https://m.media-amazon.com/images/I/71Yqmsvrq0L._AC_UL320_.jpg,https://m.media-amazon.com/images/I/71Yqmsvrq0L._AC_UL320_.jpg,,,,,,,,,,,https://www.amazon.eg/dp/B0CGQ5S192,2026-05-07T04:50:53.999270
amazon,B0CGQ4LH6L,House of Quirk Air Conditioner Deflector Avoid Directly Directing Air Conditioner with Adjustable Stand - Wanda.Store Resort,,AR-AC,EGP 120.00,,,3.2,,,,,,,https://m.media-amazon.com/images/I/71Yqmsvrq0L._AC_UL320_.jpg,https://m.media-amazon.com/images/I/71Yqmsvrq0L._AC_UL320_.jpg,,,,,,,,,,,https://www.amazon.eg/dp/B0CGQ4LH6L,2026-05-07T04:50:54.000337
amazon,B0876J7PLN,"Adjustable split air conditioner air flow guide, without wall perforation",,AR-AC,EGP 390.00,,,3.7,,,,,,,https://m.media-amazon.com/images/I/41b0gXKm6KL._AC_UL320_.jpg,https://m.media-amazon.com/images/I/41b0gXKm6KL._AC_UL320_.jpg,,,,,,,,,,,https://www.amazon.eg/dp/B0876J7PLN,2026-05-07T04:50:54.000913
amazon,B0GW6FZMGQ,"Air Conditioner Airflow Deflector – Adjustable AC Diffuser, No Electricity Required – Multi-Directional Cooling",,AR-AC,EGP 135.00,,,,,,,,,,https://m.media-amazon.com/images/I/11cRK04lSIL._AC_UL320_.jpg,https://m.media-amazon.com/images/I/11cRK04lSIL._AC_UL320_.jpg,,,,,,,,,,,https://www.amazon.eg/dp/B0GW6FZMGQ,2026-05-07T04:50:57.489625
amazon,B09YYP2LC2,"Portable Air Conditioner 4 In 1, Mini Air Conditioner Ice Water, Air Cooler with Mist, Air Conditioner Fan, Air Conditioning Fans Rechargeable Type-C 3 Speeds Cooling Fan with Timer Humidifier (Green)",,AR-AC,,,,3.4,,,,,,,https://m.media-amazon.com/images/I/714BbzkjbpL._AC_UL320_.jpg,https://m.media-amazon.com/images/I/714BbzkjbpL._AC_UL320_.jpg,,,,,,,,,,,https://www.amazon.eg/dp/B09YYP2LC2,2026-05-07T04:50:57.493858
amazon,B0DPTKJM3D,"Garkoo Air Conditioner Air Distributor, Adjustable Airflow Deflector for Split Air Conditioners, 60-110 cm, Perfect and Quiet Air Distribution (شفاف)",,AR-AC,EGP 639.00,,,3.1,,,,,,,https://m.media-amazon.com/images/I/716mtTRrEDL._AC_UL320_.jpg,https://m.media-amazon.com/images/I/716mtTRrEDL._AC_UL320_.jpg,,,,,,,,,,,https://www.amazon.eg/dp/B0DPTKJM3D,2026-05-07T04:50:57.494379
amazon,B0BXT2QXTQ,Midea HW Mission Pro Fixed Speed 2.25HP - Cooling only Tropical A/C,,AR-AC,"EGP 32,300.00",,,3.6,,,,,,,https://m.media-amazon.com/images/I/51ycPS-rclL._AC_UL320_.jpg,https://m.media-amazon.com/images/I/51ycPS-rclL._AC_UL320_.jpg,,,,,,,,,,,https://www.amazon.eg/dp/B0BXT2QXTQ,2026-05-07T04:50:57.494979
amazon,B0BZCXTCJQ,"GARKOO RG MART Air Cooler Fan Arctic Mini Portable Air Cooler Mini Air Conditioner Humidifier Air Cooler Fan Arctic USB Air Cooler, Air Cooler",,AR-AC,EGP 464.00,,,1.8,,,,,,,https://m.media-amazon.com/images/I/71xeBXVxzBL._AC_UL320_.jpg,https://m.media-amazon.com/images/I/71xeBXVxzBL._AC_UL320_.jpg,,,,,,,,,,,https://www.amazon.eg/dp/B0BZCXTCJQ,2026-05-07T04:50:57.495528
amazon,B0DWKP73WP,Midea 2.25 horse power Cooling and Heating - Inverter - MSC1T-18HR-DN,,AR-AC,"EGP 41,000.00",,,5.0,,,,,,,https://m.media-amazon.com/images/I/51djHJwmfHL._AC_UL320_.jpg,https://m.media-amazon.com/images/I/51djHJwmfHL._AC_UL320_.jpg,,,,,,,,,,,https://www.amazon.eg/dp/B0DWKP73WP,2026-05-07T04:50:57.496103
amazon,B0FH5L2G7R,AUX Split Air conditioner Q-Series 1.5 HP Turbo Cooling Heating,,AR-AC,"EGP 23,900.00",,,,,,,,,,https://m.media-amazon.com/images/I/518+6OJmPqL._AC_UL320_.jpg,https://m.media-amazon.com/images/I/518+6OJmPqL._AC_UL320_.jpg,,,,,,,,,,,https://www.amazon.eg/dp/B0FH5L2G7R,2026-05-07T04:50:57.496635
amazon,B07MW3M7DK,Cooler Small Air Conditioning Appliances Mini Fans Air Cooling Fan Air Conditioner,,AR-AC,EGP 620.00,,,1.0,,,,,,,https://m.media-amazon.com/images/I/612uQUkBmUL._AC_UL320_.jpg,https://m.media-amazon.com/images/I/612uQUkBmUL._AC_UL320_.jpg,,,,,,,,,,,https://www.amazon.eg/dp/B07MW3M7DK,2026-05-07T04:50:57.497183
amazon,B0DY6LRVJ4,SHARP Split Air Conditioner 1.5 HP Cool Digital Plasmacluster White AH-AP12ZHE,,AR-AC,"EGP 27,500.00",,,4.0,,,,,,,https://m.media-amazon.com/images/I/21gCzl6ipUL._AC_UL320_.jpg,https://m.media-amazon.com/images/I/21gCzl6ipUL._AC_UL320_.jpg,,,,,,,,,,,https://www.amazon.eg/dp/B0DY6LRVJ4,2026-05-07T04:50:57.497785
amazon,B0FF6TP7MW,Wall Mounted Unit - Anti-direct Blowing Windshield for Optimal Air Conditioner Performance in Any Space (Model No.1 Dark Green),,AR-AC,,,,,,,,,,,https://m.media-amazon.com/images/I/31dZbKog3LL._AC_UL320_.jpg,https://m.media-amazon.com/images/I/31dZbKog3LL._AC_UL320_.jpg,,,,,,,,,,,https://www.amazon.eg/dp/B0FF6TP7MW,2026-05-07T04:50:57.498172
amazon,B07VWJ82WJ,Other Split AC Adjustable Flow Deflector,,AR-AC,EGP 390.00,,,5.0,,,,,,,https://m.media-amazon.com/images/I/61yxZ8RshXL._AC_UL320_.jpg,https://m.media-amazon.com/images/I/61yxZ8RshXL._AC_UL320_.jpg,,,,,,,,,,,https://www.amazon.eg/dp/B07VWJ82WJ,2026-05-07T04:50:57.498719
amazon,B0DY86DFZL,Midea 4 Horse Power Fixed Speed Cooling and Heating,,AR-AC,,,,,,,,,,,https://m.media-amazon.com/images/I/519VZrMSErL._AC_UL320_.jpg,https://m.media-amazon.com/images/I/519VZrMSErL._AC_UL320_.jpg,,,,,,,,,,,https://www.amazon.eg/dp/B0DY86DFZL,2026-05-07T04:50:57.499135
amazon,B091NYCY8P,Tornado Split System Air Conditioner 18000 - 24000 btus - TH-C24WEE,,AR-AC,"EGP 36,800.00",,,3.9,,,,,,,https://m.media-amazon.com/images/I/31qLi7CRFEL._AC_UL320_.jpg,https://m.media-amazon.com/images/I/31qLi7CRFEL._AC_UL320_.jpg,,,,,,,,,,,https://www.amazon.eg/dp/B091NYCY8P,2026-05-07T04:50:57.499694
amazon,B091DBV3TD,Unionaire - Air Conditioner 3 Megavai Cool Horse,,AR-AC,"EGP 33,299.00",,,3.2,,,,,,,https://m.media-amazon.com/images/I/41jQFwFfnKL._AC_UL320_.jpg,https://m.media-amazon.com/images/I/41jQFwFfnKL._AC_UL320_.jpg,,,,,,,,,,,https://www.amazon.eg/dp/B091DBV3TD,2026-05-07T04:50:57.500212
amazon,B01LF125RI,"Fresh SPIFW20H/IP-SPIFW20H/OP Split Air Conditioner, 2.25 HP, Smart Digital, Cooling/Heating - White",,AR-AC,"EGP 39,517.00","EGP 51,300.00",,1.0,List:,,,,,,https://m.media-amazon.com/images/I/411q5kz3ebL._AC_UL320_.jpg,https://m.media-amazon.com/images/I/411q5kz3ebL._AC_UL320_.jpg,,,,,,,,,,,https://www.amazon.eg/dp/B01LF125RI,2026-05-07T04:50:57.501394
amazon,B0DGF8PX4Z,"Haier Smart ECO Inverter Air Conditioner, HSU-24KCRIC, Cooling only, Modified Sine Wave, 220V, White, 3 HP",,AR-AC,,,,3.3,,,,,,,https://m.media-amazon.com/images/I/410YuZSGKhL._AC_UL320_.jpg,https://m.media-amazon.com/images/I/410YuZSGKhL._AC_UL320_.jpg,,,,,,,,,,,https://www.amazon.eg/dp/B0DGF8PX4Z,2026-05-07T04:50:57.501919
amazon,B0C3R8RPVM,"2 in 1 Portable Mini Evaporative Air Cooler with Water Tank, USB Charging Desk Fan 3 Speeds, Humidifier for Bedroom, Yellow",,AR-AC,EGP 560.00,EGP 609.00,,3.0,List:,,,,,,https://m.media-amazon.com/images/I/61l3HoF-3ML._AC_UL320_.jpg,https://m.media-amazon.com/images/I/61l3HoF-3ML._AC_UL320_.jpg,,,,,,,,,,,https://www.amazon.eg/dp/B0C3R8RPVM,2026-05-07T04:50:57.502599
amazon,B096R39CDY,Xflow Air Wave for Split Air Conditioners,,AR-AC,EGP 390.00,,,3.8,,,,,,,https://m.media-amazon.com/images/I/519Btqiv3GL._AC_UL320_.jpg,https://m.media-amazon.com/images/I/519Btqiv3GL._AC_UL320_.jpg,,,,,,,,,,,https://www.amazon.eg/dp/B096R39CDY,2026-05-07T04:50:57.503113
amazon,B0D33JL38V,"Richelin Air Conditioner Deflector, Retractable Air Conditioning Deflector Deflector Direction Deflector, 84 x 23 x 0.5 cm, Multi",,AR-AC,EGP 75.00,EGP 80.00,,3.0,Was:,,,,,,https://m.media-amazon.com/images/I/61f3VKFRslL._AC_UL320_.jpg,https://m.media-amazon.com/images/I/61f3VKFRslL._AC_UL320_.jpg,,,,,,,,,,,https://www.amazon.eg/dp/B0D33JL38V,2026-05-07T04:50:57.503745
amazon,B0946DK8W1,Bisofice Portable Air Conditioner Air Cooler Fan 3600mah Battery Operated with Function Cooling Humidifier Filtration 3 Speeds Colorful Night Light,,AR-AC,"EGP 1,061.63",,,2.8,,,,,,,https://m.media-amazon.com/images/I/612MJ83gScL._AC_UL320_.jpg,https://m.media-amazon.com/images/I/612MJ83gScL._AC_UL320_.jpg,,,,,,,,,,,https://www.amazon.eg/dp/B0946DK8W1,2026-05-07T04:50:57.504263
amazon,B0C5TZBNT3,(Air Conditioner Diffuser - Hand Operated AC Without Electricity and Without Remote. (Same as the picture,,AR-AC,EGP 124.00,,,3.5,,,,,,,https://m.media-amazon.com/images/I/61eIjscJMXL._AC_UL320_.jpg,https://m.media-amazon.com/images/I/61eIjscJMXL._AC_UL320_.jpg,,,,,,,,,,,https://www.amazon.eg/dp/B0C5TZBNT3,2026-05-07T04:50:57.504807
amazon,B08Z47SF55,Fresh SFW24C/IP Cooling Only Split Air Conditioner - 3 HP - Came without holder,,AR-AC,"EGP 37,650.00",,,4.6,,,,,,,https://m.media-amazon.com/images/I/415xy+4aAOL._AC_UL320_.jpg,https://m.media-amazon.com/images/I/415xy+4aAOL._AC_UL320_.jpg,,,,,,,,,,,https://www.amazon.eg/dp/B08Z47SF55,2026-05-07T04:50:57.505329
amazon,B0DQKK8GDQ,"Carrier 1.5 HP Cooling & Heating High Wall Split A/C, Includes Indoor & Outdoor Units, Remote Control, 3m Piping, Ionizer, Self-Clean, Smart Air Flow, Follow Me, Turbo, ECO Sleep",,AR-AC,"EGP 26,090.00",,,5.0,,,,,,,https://m.media-amazon.com/images/I/51Wdpe59iHL._AC_UL320_.jpg,https://m.media-amazon.com/images/I/51Wdpe59iHL._AC_UL320_.jpg,,,,,,,,,,,https://www.amazon.eg/dp/B0DQKK8GDQ,2026-05-07T04:50:57.505881
amazon,B0D3HYKWM6,"Beko 1.5 HP Cool and Heat Air Conditioner with Pro Smart Inverter and Jet Cool, Acrylic Silver - 9212463200",,AR-AC,"EGP 36,384.05",,,,,,,,,,https://m.media-amazon.com/images/I/618IGwyeDRL._AC_UL320_.jpg,https://m.media-amazon.com/images/I/618IGwyeDRL._AC_UL320_.jpg,,,,,,,,,,,https://www.amazon.eg/dp/B0D3HYKWM6,2026-05-07T04:50:57.506332
amazon,B0FQC1YRLQ,Midea AI Eco Master 3 HP Inverter Heat & Cool Split AC – M1SEFT-24HRDN8F-Q8,,AR-AC,"EGP 45,700.00","EGP 55,475.00",,,List:,,,,,,https://m.media-amazon.com/images/I/41fulfSqIJL._AC_UL320_.jpg,https://m.media-amazon.com/images/I/41fulfSqIJL._AC_UL320_.jpg,,,,,,,,,,,https://www.amazon.eg/dp/B0FQC1YRLQ,2026-05-07T04:50:57.506909
amazon,B07RWSJDTV,"Other Retractable Air Conditioner Deflector, Adjustable Anti Direct Blowing Windshield Split AC Air Conditioning Baffles",,AR-AC,EGP 84.90,,,2.9,,,,,,,https://m.media-amazon.com/images/I/61AwR-2msYL._AC_UL320_.jpg,https://m.media-amazon.com/images/I/61AwR-2msYL._AC_UL320_.jpg,,,,,,,,,,,https://www.amazon.eg/dp/B07RWSJDTV,2026-05-07T04:50:57.507469
amazon,B07VT34ZGK,"Portable Air Cooler, USB Mini Air Conditioner Fan Artic Air Personal Air Cooler Humidifier Adjustable 3 Fan Speeds Colorful LED Light Desktop Table Cooling Fan for Home Office",,AR-AC,EGP 320.00,,,1.8,,,,,,,https://m.media-amazon.com/images/I/61O9KHYj94L._AC_UL320_.jpg,https://m.media-amazon.com/images/I/61O9KHYj94L._AC_UL320_.jpg,,,,,,,,,,,https://www.amazon.eg/dp/B07VT34ZGK,2026-05-07T04:50:57.508028
amazon,B0FM9TJG8B,Temperature Balance Device - Dual-Panel Air Conditioner Vent for Enhanced Comfort and Airborne Pathogen Reduction (Pack (1 Piece)),,AR-AC,EGP 232.00,,,,,,,,,,https://m.media-amazon.com/images/I/81UhwDA4ORL._AC_UL320_.jpg,https://m.media-amazon.com/images/I/81UhwDA4ORL._AC_UL320_.jpg,,,,,,,,,,,https://www.amazon.eg/dp/B0FM9TJG8B,2026-05-07T04:50:57.508492
amazon,B0FRY1PKY3,Midea AI Eco Master 2.25 HP Inverter Heat & Cool Split AC,,AR-AC,"EGP 42,650.00",,,,,,,,,,https://m.media-amazon.com/images/I/41fulfSqIJL._AC_UL320_.jpg,https://m.media-amazon.com/images/I/41fulfSqIJL._AC_UL320_.jpg,,,,,,,,,,,https://www.amazon.eg/dp/B0FRY1PKY3,2026-05-07T04:50:57.509010
amazon,B0FVTC1W67,"SHARP Split Air Conditioner 3 HP 23500 (BTU/H) Inverter, Cool - Heat, Digital, Plasmacluster, ECO Mode, Dry Mode, Fast Cooling, Auto Swing, Self Clean, Tropical Compressor, White AY-XP24BME",,AR-AC,,,,5.0,,,,,,,https://m.media-amazon.com/images/I/418RrttKS-L._AC_UL320_.jpg,https://m.media-amazon.com/images/I/418RrttKS-L._AC_UL320_.jpg,,,,,,,,,,,https://www.amazon.eg/dp/B0FVTC1W67,2026-05-07T04:50:57.509513
amazon,B0F4DXGX3Q,Beko Medium Spilit Air Conditioner - 1.5 HP - Cooling & Heating - Pro Smart Inverter Compressor - Jet Cooling - BIHT1241X,,AR-AC,,,,5.0,,,,,,,https://m.media-amazon.com/images/I/51FqgNgYaPL._AC_UL320_.jpg,https://m.media-amazon.com/images/I/51FqgNgYaPL._AC_UL320_.jpg,,,,,,,,,,,https://www.amazon.eg/dp/B0F4DXGX3Q,2026-05-07T04:50:57.510010
amazon,B0FM9LQ9ZX,Air Conditioner Diverter - Adjustable Dual-Outlet Vent to Optimize Airflow Distribution and Enhance Indoor Climate Comfort (Pack (2 Pieces)),,AR-AC,EGP 381.00,,,4.0,,,,,,,https://m.media-amazon.com/images/I/716JrLOB6ML._AC_UL320_.jpg,https://m.media-amazon.com/images/I/716JrLOB6ML._AC_UL320_.jpg,,,,,,,,,,,https://www.amazon.eg/dp/B0FM9LQ9ZX,2026-05-07T04:50:57.510537
amazon,B0B53HFQ49,"Richelin Air Conditioner Deflector, Retractable Air Conditioning Deflector Deflector Direction Deflector Anti-Direct Flow Deflector 84x23x0.5cm",,AR-AC,EGP 72.00,,,3.0,,,,,,,https://m.media-amazon.com/images/I/61wqK5U6y7L._AC_UL320_.jpg,https://m.media-amazon.com/images/I/61wqK5U6y7L._AC_UL320_.jpg,,,,,,,,,,,https://www.amazon.eg/dp/B0B53HFQ49,2026-05-07T04:50:57.511066
amazon,B091CZB39D,air flow Air Flow Deflector,,AR-AC,EGP 390.00,,,3.9,,,,,,,https://m.media-amazon.com/images/I/711+PujVxvL._AC_UL320_.jpg,https://m.media-amazon.com/images/I/711+PujVxvL._AC_UL320_.jpg,,,,,,,,,,,https://www.amazon.eg/dp/B091CZB39D,2026-05-07T04:50:57.511612
amazon,B0976DNC9B,"LG S4-W30R43EA Dual Inverter Cooling and Heating Split Air Conditioner, 4 HP - White",,AR-AC,,,,5.0,,,,,,,https://m.media-amazon.com/images/I/61KnodIZV9L._AC_UL320_.jpg,https://m.media-amazon.com/images/I/61KnodIZV9L._AC_UL320_.jpg,,,,,,,,,,,https://www.amazon.eg/dp/B0976DNC9B,2026-05-07T04:50:57.512104
amazon,B0GXRTSMLL,"Air Conditioner Wind Deflector with Flamingo Design - Wall Mount, Adjustable 180-Degree Tilt, Anti-Condensation, Lightweight for Efficient Airflow Control",,AR-AC,EGP 281.42,,,,,,,,,,https://m.media-amazon.com/images/I/81+tu5qc7EL._AC_UL320_.jpg,https://m.media-amazon.com/images/I/81+tu5qc7EL._AC_UL320_.jpg,,,,,,,,,,,https://www.amazon.eg/dp/B0GXRTSMLL,2026-05-07T04:50:57.512564
amazon,B0D941642N,"Portable Desk Fan, Dual Head Spray Tower Air Cooler With Control 3 Speeds 7 Colors Light, Rechargeable Rotatable Portable Air Conditioners for Room Outdoor",,AR-AC,EGP 520.00,,,1.6,,,,,,,https://m.media-amazon.com/images/I/51f2cWqyY4L._AC_UL320_.jpg,https://m.media-amazon.com/images/I/51f2cWqyY4L._AC_UL320_.jpg,,,,,,,,,,,https://www.amazon.eg/dp/B0D941642N,2026-05-07T04:50:57.513147
amazon,B0FBGWKQ9T,"Free Air Split Air Conditioner Cool And Hot With Inverter Technology, 1.5 HP, White - AS-12HR",,AR-AC,,,,5.0,,,,,,,https://m.media-amazon.com/images/I/21oT75CrNaL._AC_UL320_.jpg,https://m.media-amazon.com/images/I/21oT75CrNaL._AC_UL320_.jpg,,,,,,,,,,,https://www.amazon.eg/dp/B0FBGWKQ9T,2026-05-07T04:50:57.513665
amazon,B0FH5MC2HC,AUX Split Air conditioner Q-Series 2.25 HP Turbo Cooling Heating,,AR-AC,"EGP 43,092.68",,,,,,,,,,https://m.media-amazon.com/images/I/518+6OJmPqL._AC_UL320_.jpg,https://m.media-amazon.com/images/I/518+6OJmPqL._AC_UL320_.jpg,,,,,,,,,,,https://www.amazon.eg/dp/B0FH5MC2HC,2026-05-07T04:51:00.651084
amazon,B0FH5MZBSS,AUX Split Air conditioner C-Series 3 HP Turbo Cooling Heating,,AR-AC,"EGP 48,512.58",,,,,,,,,,https://m.media-amazon.com/images/I/61dZlEs9txL._AC_UL320_.jpg,https://m.media-amazon.com/images/I/61dZlEs9txL._AC_UL320_.jpg,,,,,,,,,,,https://www.amazon.eg/dp/B0FH5MZBSS,2026-05-07T04:51:00.652069
amazon,B09MC6M9MM,"SHARP Split Air Conditioner 3 HP Cool - Heat, Turbo, White AY-A24YSE",,AR-AC,"EGP 46,200.00",,,4.4,,,,,,,https://m.media-amazon.com/images/I/31tjU2XLxDL._AC_UL320_.jpg,https://m.media-amazon.com/images/I/31tjU2XLxDL._AC_UL320_.jpg,,,,,,,,,,,https://www.amazon.eg/dp/B09MC6M9MM,2026-05-07T04:51:00.652625
amazon,B0BYWFNSLL,"SHARP Remote Control, Split Inverter and Premium Plus Air Conditioner, White",,AR-AC,EGP 559.00,,,4.9,,,,,,,https://m.media-amazon.com/images/I/41d4NpG+knL._AC_UL320_.jpg,https://m.media-amazon.com/images/I/41d4NpG+knL._AC_UL320_.jpg,,,,,,,,,,,https://www.amazon.eg/dp/B0BYWFNSLL,2026-05-07T04:51:00.653138
amazon,B0C86PTNBN,Air Conditioner Diffuser Air Conditioner Manual Air Flow Improve Cold Air Flow Goodbye To Colds (Manual) Same As Picture Shown,,AR-AC,EGP 139.00,,,3.0,,,,,,,https://m.media-amazon.com/images/I/61eyNvg3WpL._AC_UL320_.jpg,https://m.media-amazon.com/images/I/61eyNvg3WpL._AC_UL320_.jpg,,,,,,,,,,,https://www.amazon.eg/dp/B0C86PTNBN,2026-05-07T04:51:00.653694
amazon,B0DY85HTNP,Carrier 1.5 Horse Power Fixed Speed Cooling and Heating,,AR-AC,,,,4.1,,,,,,,https://m.media-amazon.com/images/I/41LSS6D108L._AC_UL320_.jpg,https://m.media-amazon.com/images/I/41LSS6D108L._AC_UL320_.jpg,,,,,,,,,,,https://www.amazon.eg/dp/B0DY85HTNP,2026-05-07T04:51:00.654185
amazon,B0CGQ4YNVC,"Creativity House Air Conditioner Deflector, Direct Flow Prevention, Soft & Indirect Air Control, Adjustable Wall, Blown Protection Cover | Wanda.Store",,AR-AC,EGP 91.64,,,2.8,,,,,,,https://m.media-amazon.com/images/I/710AFu9MxqL._AC_UL320_.jpg,https://m.media-amazon.com/images/I/710AFu9MxqL._AC_UL320_.jpg,,,,,,,,,,,https://www.amazon.eg/dp/B0CGQ4YNVC,2026-05-07T04:51:00.654733
amazon,B0F6KFDHJN,"Garkoo Air Flow Deflector for Split Air Conditioners, Adjustable 60-110cm, Perfect Air Distribution and Quiet, Transparent Design",,AR-AC,EGP 639.00,,,4.0,,,,,,,https://m.media-amazon.com/images/I/71b5jEGAbML._AC_UL320_.jpg,https://m.media-amazon.com/images/I/71b5jEGAbML._AC_UL320_.jpg,,,,,,,,,,,https://www.amazon.eg/dp/B0F6KFDHJN,2026-05-07T04:51:00.655248
amazon,B07RWLXJP6,Air Conditioner Wind Deflector Universal Wall-Mounted AC Vent Deflector Baffle with Porous - Anti Direct Blowing Wind Guide Shield Air Diverter,,AR-AC,EGP 120.00,,,2.0,,,,,,,https://m.media-amazon.com/images/I/61BV93t9U5L._AC_UL320_.jpg,https://m.media-amazon.com/images/I/61BV93t9U5L._AC_UL320_.jpg,,,,,,,,,,,https://www.amazon.eg/dp/B07RWLXJP6,2026-05-07T04:51:00.655810
amazon,B0BXSZK4SL,Midea HW Mission Inverter 4HP - Cooling and Heating Tropical A/C White,,AR-AC,"EGP 74,000.00",,,5.0,,,,,,,https://m.media-amazon.com/images/I/41xUJNNG6+L._AC_UL320_.jpg,https://m.media-amazon.com/images/I/41xUJNNG6+L._AC_UL320_.jpg,,,,,,,,,,,https://www.amazon.eg/dp/B0BXSZK4SL,2026-05-07T04:51:00.656332
amazon,B0GNTPX4L8,Express Footwear,Express Footwear,AR-Shoes,EGP 350.00,,,4.4,,,,,,,https://m.media-amazon.com/images/I/618jgxjiJuL._AC_UL320_.jpg,https://m.media-amazon.com/images/I/618jgxjiJuL._AC_UL320_.jpg,,,,,,,,,,,https://www.amazon.eg/dp/B0GNTPX4L8,2026-05-07T04:50:59.567308
