platform,asin,title,brand,category,current_price,original_price,discount,rating,reviews_count,prime_eligible,amazon_choice,sponsored,main_image,product_url,scraped_at
amazon,,"External Portable Hard Drive (Black, 2.5in)",,Electronics,EGP 75.00,,,4.4,,,,,https://m.media-amazon.com/images/I/41CSk0wu-0L._AC_UL320_.jpg,https://www.amazon.eg/dp/B0923166MG,2026-05-26T04:57:24.732470
amazon,,"Hollyland LARK A1 Wireless Mini Microphone for iPhone 15/16 & Android, 48kHz/24-bit, 3-Level Intelligent Noise Cancel, Microphone for YouTube, Podcast, Vlogging (Black, 2TX + USB-C RX + Charging Case)",,Electronics,"EGP 2,249.00",,,4.6,,,,,https://m.media-amazon.com/images/I/61LVm6EDHrL._AC_UL320_.jpg,https://www.amazon.eg/dp/B0F3D55D5R,2026-05-26T04:57:24.732920
amazon,,"20 in 1 Electronic Cleaner Kit, Multifunctional Cleaning Kit for Airpods pro,Phone, Laptop, Camera, Keyboard,Screen, Keyboard Cleaner with Dust Air Blown and Spray Clean",,Electronics,EGP 299.00,,,3.9,,,,,https://m.media-amazon.com/images/I/61NvwABgUYL._AC_UL320_.jpg,https://www.amazon.eg/dp/B0CDR286ZF,2026-05-26T04:57:24.733359
amazon,,"XKCZ USB C Lightning Cable, 4 in 1 Fast Charging, 65W, Type-A to Multi Port Charger Cable for iPhone, iPad, Samsung, 3ft",,Electronics,EGP 54.00,,,3.5,,,,,https://m.media-amazon.com/images/I/71fE2M1bC9L._AC_UL320_.jpg,https://www.amazon.eg/dp/B0D5XVSTST,2026-05-26T04:57:24.733870
amazon,,"HDMI Extender Adapter Over Cat5e/6 (1pair), HDMI Repeater to RJ45 Ethernet Network Converter, 4k HD 1080p UP to 30m/98ft, for HDTV, Set-top Boxes, DVD, PS4, STB, Blue",,Electronics,EGP 94.00,,,3.7,,,,,https://m.media-amazon.com/images/I/51xH2qrxFoL._AC_UL320_.jpg,https://www.amazon.eg/dp/B0B42CZGNW,2026-05-26T04:57:24.734357
amazon,,"Webcam with Microphone, Distortion-Free Privacy Cover, 1080P, USB Camera, Plug, Microphone, Full Ultra HD Webcam, Video Camera, Calls, Conferences, Streaming for",,Electronics,EGP 699.00,,,4.0,,,,,https://m.media-amazon.com/images/I/61v27vCrJ2L._AC_UL320_.jpg,https://www.amazon.eg/dp/B0C48YPP3R,2026-05-26T04:57:24.734827
amazon,,Writing Pads Toy Tablet LCD Graphic Tablet Writing Tablet 8.5 Inch Electronic Note Pad Color As Per Availability,,Electronics,EGP 72.01,,,3.8,,,,,https://m.media-amazon.com/images/I/61KmPwjepCL._AC_UL320_.jpg,https://www.amazon.eg/dp/B08WR81KMJ,2026-05-26T04:57:24.735259
amazon,,"Yesimla USB C Adapter OTG Cable Kit, Multi Charging Cable Case Convertor USB C to iOS Device/Type C/Micro/USB A Adapter, Data Transfer Contains Card Slot for Traveling, Use as Phone Holder (Black)",,Electronics,EGP 99.00,,,4.0,,,,,https://m.media-amazon.com/images/I/61Ayk50i-cL._AC_UL320_.jpg,https://www.amazon.eg/dp/B09NSKJYX6,2026-05-26T04:57:24.735689
amazon,,"Bluetooth Mouse Wireless (Bluetooth 5.1 + USB 2.4 GHz) LED Dual Mode Rechargeable Optical Office Wireless Mouse for Laptop MacBook Air Pro, iPad, PC, Computer, Desktop, Mouse with USB C Adapter",,Electronics,EGP 151.00,,,4.3,,,,,https://m.media-amazon.com/images/I/51yhEEC6IYL._AC_UL320_.jpg,https://www.amazon.eg/dp/B0BVM9TXWK,2026-05-26T04:57:24.736167
amazon,,"Anker Zolo 1C Wall Charger Type-C 30W Fast Charging, Improved Temperature Control, Small Design and Charge 3X Faster, Compatible with iPhone, iPad, Samsung, Pixel and - Black -18 Months Warranty",,Electronics,EGP 698.98,,,4.5,,,,,https://m.media-amazon.com/images/I/41E4kEpByfL._AC_UL320_.jpg,https://www.amazon.eg/dp/B0DXLBNG6K,2026-05-26T04:57:24.736675
amazon,,RAPOO C280 WEBCAM 2K HD USB2.0 MIC ROTATABLE CAMERA,,Electronics,"EGP 1,663.25","EGP 2,022.00",,3.9,List:,,,,https://m.media-amazon.com/images/I/61a7256By3S._AC_UL320_.jpg,https://www.amazon.eg/dp/B092ZFBSZD,2026-05-26T04:57:24.737236
amazon,,"Wireless Earbuds with LED Display Case, Digital Battery Indicator, Pink-black-white (white)",,Electronics,EGP 219.00,EGP 250.00,,3.1,List:,,,,https://m.media-amazon.com/images/I/51tq9oEAJAL._AC_UL320_.jpg,https://www.amazon.eg/dp/B0GHKC2X1F,2026-05-26T04:57:24.737873
amazon,,"Logitech M171 Wireless Mouse 2.4 Ghz wireless Wireless range, Black",,Electronics,EGP 521.25,,,4.4,,,,,https://m.media-amazon.com/images/I/41TszOgiDCL._AC_UL320_.jpg,https://www.amazon.eg/dp/B01A9GXEOI,2026-05-26T04:57:24.738363
amazon,,"USB C Adapter OTG Cable Kit, Multi Charging Cable Case Convertor USB C to iOS Device/Type C/Micro/USB A Adapter, Data Transfer Contains Card Slot for Traveling, Use as Phone Holder",,Electronics,EGP 67.00,,,3.2,,,,,https://m.media-amazon.com/images/I/51UdHs7s8FL._AC_UL320_.jpg,https://www.amazon.eg/dp/B0FHBLTTFL,2026-05-26T04:57:24.738783
amazon,,Mp3 bluetooth usb memori aux fm radio,,Electronics,EGP 200.00,EGP 230.90,,2.9,List:,,,,https://m.media-amazon.com/images/I/61j3OKjWqKL._AC_UL320_.jpg,https://www.amazon.eg/dp/B099MKGJHB,2026-05-26T04:57:24.739363
amazon,,"Xiaomi Wireless Earphones, Redmi buds 6 Play, 36 Hours Playtime, AI Call Noise Reduction, Ultra Lightweight, Compatible with Google Fast Pair, Fast Charging, Black |6 month manufacturer warranty",,Electronics,,,,4.0,,,,,https://m.media-amazon.com/images/I/613gJ8g29aL._AC_UL320_.jpg,https://www.amazon.eg/dp/B0DBHRWRKC,2026-05-26T04:57:24.740347
amazon,,"ElecMoga USB C to VGA HDMI Adapter, 4 in 1 Type C to 4K HDMI/VGA/USB 3.0/USB C PD Charging Multiport Hub Adapter Compatible with Macbook Pro/Air,Nintendo,Dell,HP,Samsung S8/S9,Huawei P30 and More",,Electronics,EGP 224.50,EGP 239.00,,3.7,List:,,,,https://m.media-amazon.com/images/I/71dkx3VSGgL._AC_UL320_.jpg,https://www.amazon.eg/dp/B07Z54C6RD,2026-05-26T04:57:24.740902
amazon,,Charging & Data charger 3 in 1usb magnetic 8 pin and Micro/Type C charging cable for mobile phone 2025,,Electronics,EGP 119.00,,,3.5,,,,,https://m.media-amazon.com/images/I/41Bjre4sOEL._AC_UL320_.jpg,https://www.amazon.eg/dp/B0FW9GQT2S,2026-05-26T04:57:24.741347
amazon,,"Wall Mount Phone Holder, Phone Stand with Self Adhesive. Phone Holder for Shower, Charging and RV for iPhone and Android (1Pc,White)",,Electronics,EGP 22.00,,,3.0,,,,,https://m.media-amazon.com/images/I/51k4CYbqWlS._AC_UL320_.jpg,https://www.amazon.eg/dp/B08JCCHKS8,2026-05-26T04:57:28.179587
amazon,,"MMH 7 in 1 Airpod Pro Cleaner Kit with Spray, Multi-Function Electronic Keyboard MacBook Laptop Screen Earbud Cleaner Kit Tool with Cleaning Pen Brush for iPod,Phone,Tablet,PC,Computer,Headphone Pink",,Electronics,EGP 87.90,,,3.8,,,,,https://m.media-amazon.com/images/I/61NDDJ4QWFL._AC_UL320_.jpg,https://www.amazon.eg/dp/B0B8VQ421Y,2026-05-26T04:57:28.180057
amazon,,JOPHEK Mini Hand Fan 5000 mAh Portable USB Fan with Aromatherapy Tablet and White Cord,,Electronics,EGP 185.00,EGP 299.99,,2.9,List:,,,,https://m.media-amazon.com/images/I/61nQK5a5XCL._AC_UL320_.jpg,https://www.amazon.eg/dp/B0B795TKVM,2026-05-26T04:57:28.180561
amazon,,keendex KX 3166 Waterproof Strong Keyboard Sticker for Laptop PC-Black,,Electronics,EGP 21.00,EGP 34.20,,3.8,Was:,,,,https://m.media-amazon.com/images/I/614Bp5iY1qL._AC_UL320_.jpg,https://www.amazon.eg/dp/B0CBXGS6RR,2026-05-26T04:57:28.181085
amazon,,"Generic Type-C USB Male to USB Female Converter,Assorted Colors",,Electronics,EGP 60.00,,,3.7,,,,,https://m.media-amazon.com/images/I/51J1iQsD8SL._AC_UL320_.jpg,https://www.amazon.eg/dp/B09FHT7PHM,2026-05-26T04:57:28.181594
amazon,,"p47m Wireless Bluetooth Headphone Cat RGB LED - Over Ear Stereo Music Headset with Memory Card Support, Gaming Headphones with Built-in Microphone for Laptop, Mobile Phone, Kids,Girls,PC (Blue)",,Electronics,EGP 249.99,,,3.6,,,,,https://m.media-amazon.com/images/I/51yYOawHxAL._AC_UL320_.jpg,https://www.amazon.eg/dp/B0DHXNPS73,2026-05-26T04:57:28.182142
amazon,,"Redragon Hylas H260 RGB Gaming Headphones - Gaming Headphones with Stereo Sound - Large Earpads - Compatibility Xbox One, Nintendo Switch, PS4/5, Mac, PC or Laptop",,Electronics,EGP 910.00,,,4.5,,,,,https://m.media-amazon.com/images/I/51Cm9mmZHeL._AC_UL320_.jpg,https://www.amazon.eg/dp/B09BFZSRGN,2026-05-26T04:57:28.182664
amazon,,Joyroom S-H151 Adapter Type-C Male to USB - Silver,,Electronics,EGP 115.00,,,4.0,,,,,https://m.media-amazon.com/images/I/51yB0IZmaEL._AC_UL320_.jpg,https://www.amazon.eg/dp/B0DCGBP9S8,2026-05-26T04:57:28.183120
amazon,,"JBL BAR 1000MK2 7.1.4 Channel Soundbar with Dolby Atmos, DTS:X, Detachable Wireless Surround Speakers, 960W Output, 10"" Subwoofer, HDMI eARC, and Wi-Fi",,Electronics,"EGP 58,399.00",,,4.0,,,,,https://m.media-amazon.com/images/I/51Vr+PeQpOL._AC_UL320_.jpg,https://www.amazon.eg/dp/B0F7HRFCSX,2026-05-26T04:57:28.183549
amazon,,"Joyroom JR‑TCF23 25 W USB‑C PD Fast Wall Charger with 1 m USB‑C to USB‑C Cable, Single Port Rapid Charging Adapter for Smartphones & Tablets - Black | 12-Month Warranty",,Electronics,EGP 369.55,,,4.4,,,,,https://m.media-amazon.com/images/I/61pnUc-QvqL._AC_UL320_.jpg,https://www.amazon.eg/dp/B0DCFKK63T,2026-05-26T04:57:28.184056
amazon,,"Earldom EH161 Adjustable Smartphone Stand – Foldable, Portable Phone Holder Made from Durable Polypropylene, Multi-Angle Viewing for Desk, Compatible with All Smartphones and Tablets",,Electronics,EGP 59.00,EGP 120.00,,4.0,List:,,,,https://m.media-amazon.com/images/I/516jAtoKgML._AC_UL320_.jpg,https://www.amazon.eg/dp/B0DR3KVKL2,2026-05-26T04:57:28.184594
amazon,,"60W Fast Charge Data Cable Adapter Kit with Storage Box, USB C to Micro USB/Lightning/USB A Conversion Head Adapter, With Sim Card Slot and Sim Card Pin (White)",,Electronics,EGP 90.00,,,3.8,,,,,https://m.media-amazon.com/images/I/51+8VgC4dKL._AC_UL320_.jpg,https://www.amazon.eg/dp/B0BTDQP3RD,2026-05-26T04:57:28.185047
amazon,,"Joyroom S-Uc027A9 3A USB-A to Type-C Fast Charging Cable – 2M – Black High-Speed 3A Charging | Durable PVC | Tangle-Free Compatible with iPhone, Samsung & Android | Long-Lasting | 12 Months Warranty",,Electronics,EGP 70.00,,,4.5,,,,,https://m.media-amazon.com/images/I/51797jy7BTL._AC_UL320_.jpg,https://www.amazon.eg/dp/B0CPC8N96L,2026-05-26T04:57:28.185481
amazon,,"Generic [2 Pack] 8.5 Inch LCD Writing Tablet, TIQUS Digital Ewriter Electronic Graphics Drawing Board, Portable Handwriting Pad (Single Color Writing",,Electronics,EGP 139.90,,,4.0,,,,,https://m.media-amazon.com/images/I/51jv4L1TvWL._AC_UL320_.jpg,https://www.amazon.eg/dp/B08R6NRTFZ,2026-05-26T04:57:28.185963
amazon,,"iLOCK Power Strip - Mini (3 m, yellow)",,Electronics,EGP 201.00,EGP 280.00,,4.8,List:,,,,https://m.media-amazon.com/images/I/61NmJeGoz7L._AC_UL320_.jpg,https://www.amazon.eg/dp/B0CLKQKFL3,2026-05-26T04:57:28.186470
amazon,,"Adjustable laptop stand, portable aluminium laptop riser laptop holder for desk, foldable ventilated cooling computer support stand for apple macbook pro/air, hp, sony, dell, more 10-15.6''",,Electronics,EGP 109.00,EGP 135.00,,3.9,List:,,,,https://m.media-amazon.com/images/I/61fRwSb0z0L._AC_UL320_.jpg,https://www.amazon.eg/dp/B08D11MN1M,2026-05-26T04:57:28.187123
amazon,,Portable Bluetooth Speaker Ball Shape with Phone Holder and Colorful LED Light (Pink),,Electronics,EGP 328.00,,,,,,,,https://m.media-amazon.com/images/I/61UUwqMBQWL._AC_UL320_.jpg,https://www.amazon.eg/dp/B0GSP6N8SS,2026-05-26T04:57:28.187584
amazon,,"APC by Schneider Electric, Smart Line-interactive UPS SMC2000I C-2000VA LCD AVR 230V",,Electronics,"EGP 41,850.00",,,5.0,,,,,https://m.media-amazon.com/images/I/51bqevemawL._AC_UL320_.jpg,https://www.amazon.eg/dp/B07HNJQNJK,2026-05-26T04:57:28.188034
amazon,,LCD Writing Tablet Electronic Writing Drawing Board 10-inch Handwriting Board Drawing Tablet with Erase Button Screen Lock Button Gift for Kids Adults at Home School Office Scratch Paper,,Electronics,EGP 88.02,,,3.6,,,,,https://m.media-amazon.com/images/I/515p-qtOL3L._AC_UL320_.jpg,https://www.amazon.eg/dp/B07N625VLQ,2026-05-26T04:57:28.188507
amazon,,"Redragon M724 Wired Gaming Mouse, 49G Ultra-Light 12,400 Max DPI Optical Gaming Mouse with 5 Programmable Buttons, Ergonomic Natural Grip Build, Software Supports DIY Keybinds & DPI, Black",,Electronics,EGP 929.00,,,4.7,,,,,https://m.media-amazon.com/images/I/51h06ltKy4L._AC_UL320_.jpg,https://www.amazon.eg/dp/B0D41SDLTB,2026-05-26T04:57:28.189015
amazon,,"TECHZONE Laptop Phone Holder – Slim, Foldable Monitor Side Mount for Smartphones – Portable Computer Expansion Bracket, Compatible with All Phones, Silver",,Electronics,EGP 89.00,,,2.6,,,,,https://m.media-amazon.com/images/I/51KVDl-5wdL._AC_UL320_.jpg,https://www.amazon.eg/dp/B0FNNC35W1,2026-05-26T04:57:28.189448
amazon,,"USB C to USB Adapter,Type-C to USB 3.0 OTG Adapter, USB Type-C Hub Convert Connector Fast Charging Compatible with MacBook Pro, Google Chromebook, Nintendo Switch and More Type C Port Devices (Black)",,Electronics,EGP 76.45,,,3.6,,,,,https://m.media-amazon.com/images/I/81S8ybjNyTL._AC_UL320_.jpg,https://www.amazon.eg/dp/B08MZSQS4M,2026-05-26T04:57:28.189934
amazon,,Triple US Ports Plug Sockets,,Electronics,EGP 38.90,,,3.5,,,,,https://m.media-amazon.com/images/I/41EmlS57pAL._AC_UL320_.jpg,https://www.amazon.eg/dp/B09815KSPP,2026-05-26T04:57:28.190361
amazon,,iLock 3-way wall outlet adapter 3500 W (Pack 3) (black),,Electronics,EGP 168.33,EGP 184.00,,4.7,List:,,,,https://m.media-amazon.com/images/I/61Rz+p8ONML._AC_UL320_.jpg,https://www.amazon.eg/dp/B0B851YFZH,2026-05-26T04:57:32.296526
amazon,,"LCD Writing Tablet 12 Inch Handwritten Pen Intelligent Paper, Suitable for Family, School, Office, Children and Adults Writing Board, Lock Erase Button,Electronic Writing Doodle Pad Digital Drawing",,Electronics,EGP 124.32,,,3.6,,,,,https://m.media-amazon.com/images/I/61kMocaj+OL._AC_UL320_.jpg,https://www.amazon.eg/dp/B07T7V3BSN,2026-05-26T04:57:32.297061
amazon,,AULA AM210 Ultra Light Weight Wireless + Bluetooth Gaming Mouse |Adjustable DPI (800-1600) | Compatible with Windows 2000/XP/7/8/10/VISTA (Black),,Electronics,EGP 349.00,,,5.0,,,,,https://m.media-amazon.com/images/I/71400E4xVyL._AC_UL320_.jpg,https://www.amazon.eg/dp/B0DDC2DJRF,2026-05-26T04:57:32.297507
amazon,,"Keple RJ11 Cable ADSL 3ft Extension Lead Phone Cord Telephone Plug High Speed Xfinity Internet Broadband Male to Male Router and Modem to RJ11 Phone Socket, Microfilter, Landline Wire (White)",,Electronics,EGP 15.00,,,3.9,,,,,https://m.media-amazon.com/images/I/51I6E4llSSL._AC_UL320_.jpg,https://www.amazon.eg/dp/B07QP6Q7MP,2026-05-26T04:57:32.297959
amazon,,Zero Electronics ZR-200 Colorful Wired Gaming Mouse - Black,,Electronics,EGP 75.00,,,3.6,,,,,https://m.media-amazon.com/images/I/41QmxYTShcL._AC_UL320_.jpg,https://www.amazon.eg/dp/B09P5G9QP9,2026-05-26T04:57:32.298386
amazon,,"Micro HDMI to HDMI Adapter (2 Ports, Black)",,Electronics,EGP 19.87,,,3.8,,,,,https://m.media-amazon.com/images/I/61ahUmWQoVL._AC_UL320_.jpg,https://www.amazon.eg/dp/B096QWVCSB,2026-05-26T04:57:32.298864
amazon,,NOHON 4 in 1 Multi-Use USB Charging Cable: 1ft Fast Charging Cable with A/C to 65W Type-C + 27 PD Nylon Braided Multi-Port Compatible with iPhone,,Electronics,EGP 60.00,,,3.5,,,,,https://m.media-amazon.com/images/I/71a6CNrE-mL._AC_UL320_.jpg,https://www.amazon.eg/dp/B0D22RBJTC,2026-05-26T04:57:32.299320
amazon,,LDNIO LS441 Mobile Phone Cables 2.4A Fast Charging Micro USB Cable 1M - Grey,,Electronics,EGP 52.00,,,4.2,,,,,https://m.media-amazon.com/images/I/510RZkUalEL._AC_UL320_.jpg,https://www.amazon.eg/dp/B09C7W1NPC,2026-05-26T04:57:32.299754
amazon,,Logitech M90 Wired USB Mouse For PC Or Laptop 1000 DPI - Black,,Electronics,EGP 245.00,,,4.6,,,,,https://m.media-amazon.com/images/I/51yH0YpyeRL._AC_UL320_.jpg,https://www.amazon.eg/dp/B003AUZKYI,2026-05-26T04:57:32.300217
amazon,,LDNIO LS441 Mobile Phone Cables 2.4A Fast Charging Type-C USB Cable 1M - Grey,,Electronics,EGP 63.00,,,4.2,,,,,https://m.media-amazon.com/images/I/51J1F4t0zZL._AC_UL320_.jpg,https://www.amazon.eg/dp/B09C7ZGNFY,2026-05-26T04:57:32.300653
amazon,,"Keyboard ZERO RGB Electronics ZR- USB Keyboard, Stylish Spill-Resistant Design, Silent Keys (Pink, ZR-2050)",,Electronics,EGP 460.98,,,3.0,Get it faster,,,,https://m.media-amazon.com/images/I/61DvCnq03OL._AC_UL320_.jpg,https://www.amazon.eg/dp/B0FL2GFM68,2026-05-26T04:57:32.301185
amazon,,Zero Optical Gaming Mouse USB ZR-1900 From PC&Laptop,,Electronics,EGP 240.00,,,3.8,,,,,https://m.media-amazon.com/images/I/61sGaRFt5yL._AC_UL320_.jpg,https://www.amazon.eg/dp/B091J8H9FW,2026-05-26T04:57:32.301613
amazon,,Joyroom S-A9 Long-Lasting 3A USB to Micro USB Fast Charging Cable; Reinforced 1m High-Speed Data Sync Lead for Android & Accessories; Heavy-Duty 1-Meter Durable Micro USB Charging Cable – White.,,Electronics,EGP 60.00,EGP 80.21,,4.1,Was:,,,,https://m.media-amazon.com/images/I/41g9All711L._AC_UL320_.jpg,https://www.amazon.eg/dp/B0DZ2K7KZG,2026-05-26T04:57:32.302165
amazon,,Veggieg V-H107 18Gbps HDR 4K 60Hz 3D HDMI 2.0 Cable 1.5 Meter,,Electronics,EGP 170.00,,,4.8,,,,,https://m.media-amazon.com/images/I/61mBZExyqFL._AC_UL320_.jpg,https://www.amazon.eg/dp/B0F8NT948R,2026-05-26T04:57:32.302712
amazon,,"Ergonomic Adjustable Aluminum Laptop Stand (10-15.6"") - Improves Posture & Cooling - for Desk, MacBook, HP, Dell & More - Black",,Electronics,EGP 183.80,EGP 199.00,,4.2,List:,,,,https://m.media-amazon.com/images/I/61FNLa7rywL._AC_UL320_.jpg,https://www.amazon.eg/dp/B0D4KDSSCD,2026-05-26T04:57:32.303311
amazon,,Geniric usb C/lighting cable,,Electronics,EGP 65.00,EGP 77.00,,3.6,List:,,,,https://m.media-amazon.com/images/I/51kmbSst0lL._AC_UL320_.jpg,https://www.amazon.eg/dp/B0D6BZ9DMV,2026-05-26T04:57:32.303881
amazon,,"Mercusys 4G Dongle Cat4 LTE Travel Mobile Mi-Fi Hotspot, Connects up to 10 Devices, Compatible with Most Networks, Rechargeable Battery with up to 10 Hours Life, Easy Management",,Electronics,"EGP 2,750.00",,,4.0,,,,,https://m.media-amazon.com/images/I/51yhtViXSFL._AC_UL320_.jpg,https://www.amazon.eg/dp/B0DL6HP3PT,2026-05-26T04:57:32.304322
amazon,,"Lenovo 300 FHD Webcam, 1080p, Stereo Microphone, USB Camera for Live Streaming and Video Calling, Privacy Cover, Plug and Play, Desktop or Laptop, Windows, Mac, Cloud Grey, GXC1B34793",,Electronics,,,,4.1,,,,,https://m.media-amazon.com/images/I/51IpsJmhInL._AC_UL320_.jpg,https://www.amazon.eg/dp/B08KT89BWX,2026-05-26T04:57:32.304744
amazon,,"OS0823B LCD Digital Writing Drawing Tablet Portable Electronic Graphic Board (8.5in), Black",,Electronics,EGP 69.01,,,,,,,,https://m.media-amazon.com/images/I/511ELnm3uhL._AC_UL320_.jpg,https://www.amazon.eg/dp/B0922X3DGT,2026-05-26T04:57:32.305144
amazon,,8.5 Inch LCD Electronic Memo Tablet for Elderly Children Writing Communication Portable Smart Board Pink,,Electronics,EGP 78.38,,,2.5,,,,,https://m.media-amazon.com/images/I/51JNi9uHvqL._AC_UL320_.jpg,https://www.amazon.eg/dp/B0CLQJWKV5,2026-05-26T04:57:32.305571
amazon,,12 Inch LCD Writing Tablet for Electronic Drawing Blackboard Portable Writing Tablet without LED Backlight,,Electronics,EGP 139.00,EGP 144.00,,3.8,Was:,,,,https://m.media-amazon.com/images/I/31nYfkmlOFL._AC_UL320_.jpg,https://www.amazon.eg/dp/B0DGLQJYN8,2026-05-26T04:57:32.306124
amazon,,Joyroom S-AC066A16 66W Fast Charging Type-C Cable USB-C to USB-C with Digital Power Display | 480Mbps Data Transfer | 1.2M PD 66W Super Fast Charge | Smart Chip Protection | Black | 12 Months Warranty,,Electronics,EGP 382.00,,,4.2,,,,,https://m.media-amazon.com/images/I/51C3ML3NxVL._AC_UL320_.jpg,https://www.amazon.eg/dp/B0CNH7KFSR,2026-05-26T04:57:32.306552
amazon,,"Essager Type C Female to USB A 3.0 Male OTG Adapter (3A, 5Gbps) – High-Speed Transfer, Compact Metal Build – for Laptops, Flash Drives, Smartphones",,Electronics,EGP 180.00,EGP 220.00,,4.2,List:,,,,https://m.media-amazon.com/images/I/51BPNoyyvLL._AC_UL320_.jpg,https://www.amazon.eg/dp/B09DFDDLMK,2026-05-26T04:57:32.307052
amazon,,Oraimo OCD-175CC 100W USB-C to USB-C Fast Charging Cable-1.2M 5A High-Current Power Delivery&High-Speed Data Sync for USB-C Devices Durable Nylon Braided Design with Reinforced Connectors-Sleek Black,,Electronics,EGP 299.00,,,3.7,,,,,https://m.media-amazon.com/images/I/41CF3uCmpqL._AC_UL320_.jpg,https://www.amazon.eg/dp/B0G882KMTB,2026-05-26T04:57:32.307546
amazon,,"Selfie Stick Tripod, Extendable 4 in 1 Selfie Stick with Detachable Wireless Remote Compatible with iPhone 13/13 Pro/12/11/11 Pro/XS Max/XS/XR/X/8/7, Samsung and Smartphone",,Electronics,EGP 169.00,,,3.7,,,,,https://m.media-amazon.com/images/I/61sLptcCUiL._AC_UL320_.jpg,https://www.amazon.eg/dp/B09KL3VYPR,2026-05-26T04:57:35.814656
amazon,,Zonic z1011 external hard disk usb 3.0 data cable for hard disk and charger tablet super speed 50cm - black,,Electronics,EGP 122.74,EGP 156.10,,4.1,Was:,,,,https://m.media-amazon.com/images/I/61bXHzJ10KL._AC_UL320_.jpg,https://www.amazon.eg/dp/B0BT1MKRKN,2026-05-26T04:57:35.815293
amazon,,"Keendex KX 3087 Cable micro to usb,30 cm -White",,Electronics,EGP 28.34,,,3.6,,,,,https://m.media-amazon.com/images/I/41mYlql0+9L._AC_UL320_.jpg,https://www.amazon.eg/dp/B0CBRX637R,2026-05-26T04:57:35.815736
amazon,,"Ovleng GP50M 3.5mm Wired Over-Ear E-sports Gaming Headset with Rotation Microphone, Noise Canceling, 3D Stereo Surround Sound, Volume control, Compatible with PC, Mac & Consoles - Desert Yellow",,Electronics,EGP 364.80,,,3.0,,,,,https://m.media-amazon.com/images/I/41ZcBjLSC-L._AC_UL320_.jpg,https://www.amazon.eg/dp/B0F45D7Y18,2026-05-26T04:57:35.816327
amazon,,Point Connector network rj45 male usb female - black,,Electronics,EGP 21.32,EGP 46.03,,2.7,List:,,,,https://m.media-amazon.com/images/I/51GelEqegtL._AC_UL320_.jpg,https://www.amazon.eg/dp/B0BHJGYD1C,2026-05-26T04:57:35.816846
amazon,,Generic Portable Electronic LCD Digital Writing Drawing Tablet (8.5in),,Electronics,EGP 70.38,,,2.7,,,,,https://m.media-amazon.com/images/I/61vbXoGel0L._AC_UL320_.jpg,https://www.amazon.eg/dp/B0923BMXRH,2026-05-26T04:57:35.817299
amazon,,"3 in 1 Fast Charging USB Cable, 120W 6A, Smartphone, Tablet, Power Bank, Projector, PC - Orange",,Electronics,EGP 79.00,,,2.1,,,,,https://m.media-amazon.com/images/I/61Z0jhTMhfL._AC_UL320_.jpg,https://www.amazon.eg/dp/B0DRWCRKTZ,2026-05-26T04:57:35.817728
amazon,,"UGREEN Mini HDMI Male (Type C) To HDMI Female Adapter, Gold Plated Compatible With Smartphones, Camcorder, Tablets and Cameras - Black",,Electronics,EGP 129.00,EGP 156.00,,4.4,List:,,,,https://m.media-amazon.com/images/I/51ySKvOjEXL._AC_UL320_.jpg,https://www.amazon.eg/dp/B00B2HOQIW,2026-05-26T04:57:35.818248
amazon,,"Logitech Rally Bar Mini 4K UHD Conferencing Camera - 6 Beamforming Microphones, PTZ Camera, 3 Speakers, AI Viewfinder, 4X Digital Zoom, Teams, Zoom, Meet Rooms - 960-001340 (Graphite)(Renewed)",,Electronics,"EGP 265,015.80",,,,,,,,https://m.media-amazon.com/images/I/61nBF2FVs6L._AC_UL320_.jpg,https://www.amazon.eg/dp/B0CGMJGX6H,2026-05-26T04:57:35.818640
amazon,,"Joyroom JR-QP191 22.5W Power Bank 10000mAh With Large Digital Display Supports PD3.0,QC3.0 - Black|12 Months Warranty",,Electronics,,,,4.2,,,,,https://m.media-amazon.com/images/I/71bHZ9v6qVL._AC_UL320_.jpg,https://www.amazon.eg/dp/B0BFFVHZ6Y,2026-05-26T04:57:35.819083
amazon,,"Keyboard ZERO RGB Electronics ZR- USB Keyboard, Stylish Spill-Resistant Design, Silent Keys (Black, ZR-3606)",,Electronics,EGP 608.98,,,,,,,,https://m.media-amazon.com/images/I/61RHcZodvML._AC_UL320_.jpg,https://www.amazon.eg/dp/B0G3RGLRG2,2026-05-26T04:57:35.819471
amazon,,Digital Webcam 1080P Manual Focus Built-in Microphone - USB Connectivity - Compatible with All Devices - 5cm Manual Focus - Support 24 Bit True Color Video - Black,,Electronics,EGP 813.00,,,,,,,,https://m.media-amazon.com/images/I/61mhqL93YGL._AC_UL320_.jpg,https://www.amazon.eg/dp/B0FK5VVWCN,2026-05-26T04:57:35.819885
amazon,,"Rsilou R2025 Lighting to USB-C Cable, 30W, High Durability and Flexible, Fast charging and data cable, 1M, Copper Wires speed Rate 480Mbps, Tangle and Entanglement free | 12 month local warranty",,Electronics,EGP 224.00,EGP 249.00,,4.8,Was:,,,,https://m.media-amazon.com/images/I/51rqTiSMYHL._AC_UL320_.jpg,https://www.amazon.eg/dp/B0F1JPFMDH,2026-05-26T04:57:35.820422
amazon,,Exon X1130 USB-A to USB-C 3.1 Adapter - Multi Color,,Electronics,EGP 28.00,,,3.5,,,,,https://m.media-amazon.com/images/I/61CTOJRBwUL._AC_UL320_.jpg,https://www.amazon.eg/dp/B0CPD6XTK6,2026-05-26T04:57:35.820870
amazon,,3.5mm Stereo Female to 2.5mm Male Jack Audio Adapter,,Electronics,EGP 16.96,,,1.0,,,,,https://m.media-amazon.com/images/I/51IaDS22L8L._AC_UL320_.jpg,https://www.amazon.eg/dp/B091BTRMGQ,2026-05-26T04:57:35.821301
amazon,,"UGREEN Micro USB 3.0 Cable USB 3.0 Type A Male to Micro B Cord - 3 Feet""",,Electronics,EGP 200.66,,,4.7,,,,,https://m.media-amazon.com/images/I/61B3I8UrRvL._AC_UL320_.jpg,https://www.amazon.eg/dp/B00P0C4M7A,2026-05-26T04:57:35.821786
amazon,,"TP-LINK LS1005G Desktop Switch, 5 Ports - Black",,Electronics,EGP 650.00,EGP 679.00,,4.8,List:,,,,https://m.media-amazon.com/images/I/61IPjuy2hLL._AC_UL320_.jpg,https://www.amazon.eg/dp/B07VC68RW1,2026-05-26T04:57:35.822315
amazon,,Joyroom SY-A06 Audio-Transfer Series Cable Lightning to 3.5mm AUX Audio Converter 1.2M High-Quality Sound Transmission Compatible with Car Speakers & Headphones – Black,,Electronics,EGP 210.00,EGP 231.00,,4.2,List:,,,,https://m.media-amazon.com/images/I/51Z5sECaXuL._AC_UL320_.jpg,https://www.amazon.eg/dp/B0D3XW78Z1,2026-05-26T04:57:35.822829
amazon,,"Generic 8.5in Black LCD Electronic Memo and Doodle Tablet for Elderly and Children, Portable, Lightweight",,Electronics,EGP 79.81,,,3.2,,,,,https://m.media-amazon.com/images/I/61VZgmaW0XL._AC_UL320_.jpg,https://www.amazon.eg/dp/B09691WPDP,2026-05-26T04:57:35.823269
amazon,,USB DC 5V to DC 12V Voltage Converter Cable with DC 5.5x2.5mm or 5.5x2.1mm Jack USB 5V to DC 12V Cable 3ft Cable for Speaker - Router,,Electronics,EGP 69.15,,,4.0,,,,,https://m.media-amazon.com/images/I/51qbKqYXtOL._AC_UL320_.jpg,https://www.amazon.eg/dp/B0CRR3G2DP,2026-05-26T04:57:35.823744
