platform,product_id,title,brand,category,current_price,original_price,discount,rating,reviews_count,availability,main_image,product_url,scraped_at
amazon,B0F43Q9QS6,Product B0F43Q9QS6,"Cotton Swabs100 Count,-Friendly Strong Bamboo Sticks Cotton Swabs for Ears, Hygiene, Beauty Care,Clean Skin, Round Tips & Thick Cotton & Sturdy Wooden Cotton Buds (100Count)",Sporting Goods,EGP 14.13,,,3.9,(130),In Stock,https://m.media-amazon.com/images/I/6180UdWsxML._AC_UL320_.jpg,https://www.amazon.eg/dp/B0F43Q9QS6,2026-05-14T06:29:28.322799
amazon,B0BZPJ9R6S,Product B0BZPJ9R6S,"Lipton Black Tea Soft , 500 gm",Sporting Goods,EGP 84.50,EGP 89.95,,4.4,(3.5K),In Stock,https://m.media-amazon.com/images/I/71vcdIylBTL._AC_UL320_.jpg,https://www.amazon.eg/dp/B0BZPJ9R6S,2026-05-14T06:29:28.327869
amazon,B0893KRNGQ,Product B0893KRNGQ,Almarai plain milk 1L Full Cream,Sporting Goods,EGP 45.00,EGP 54.00,,4.6,(835),In Stock,https://m.media-amazon.com/images/I/71Bvh0sGVWL._AC_UL320_.jpg,https://www.amazon.eg/dp/B0893KRNGQ,2026-05-14T06:29:28.332409
amazon,B0CVW9DPCB,Product B0CVW9DPCB,"JUHAYNA Carton Full Cream Milk Multipack 1 L Ultra Edge - 6 Pack, Save 10 LE",Sporting Goods,EGP 274.95,,,4.6,(2.5K),In Stock,https://m.media-amazon.com/images/I/712t3O9xoaL._AC_UL320_.jpg,https://www.amazon.eg/dp/B0CVW9DPCB,2026-05-14T06:29:28.336379
amazon,B08WJKZF75,Product B08WJKZF75,Nescafe Classic Instant Coffee Pouch 200g,Sporting Goods,EGP 260.00,,,4.5,(2.5K),In Stock,https://m.media-amazon.com/images/I/61y5slAtL7L._AC_UL320_.jpg,https://www.amazon.eg/dp/B08WJKZF75,2026-05-14T06:29:28.340868
amazon,B0DM9M1ZLX,Product B0DM9M1ZLX,"Fine Prestige Facial Tissues 500 Sheets, 3 Ply, Pack of 6",Sporting Goods,EGP 160.75,,,4.5,(3.1K),In Stock,https://m.media-amazon.com/images/I/81YCecXjzVL._AC_UL320_.jpg,https://www.amazon.eg/dp/B0DM9M1ZLX,2026-05-14T06:29:28.345348
amazon,B07NP92L9P,Product B07NP92L9P,Queen By Lord Triple Blade Shaving Razor Set Of 4,Sporting Goods,EGP 39.60,EGP 55.00,,4.0,(1K),In Stock,https://m.media-amazon.com/images/I/71yXiUz49XL._AC_UL320_.jpg,https://www.amazon.eg/dp/B07NP92L9P,2026-05-14T06:29:28.350250
amazon,B08BLJ473G,Product B08BLJ473G,Milk frother rechargeable handheld 3-speed adjustable for latte coffee cappuccino with extra egg mixer,Sporting Goods,EGP 120.00,EGP 196.00,,3.6,(1.6K),In Stock,https://m.media-amazon.com/images/I/715bUlsWMGL._AC_UL320_.jpg,https://www.amazon.eg/dp/B08BLJ473G,2026-05-14T06:29:28.354774
amazon,B0BZRYQT19,Product B0BZRYQT19,"Papia Facial Tissue - PE MultiPack - 3 Ply - 500 X 6 - premium ""Lotion""",Sporting Goods,EGP 184.99,,,4.6,(1.6K),In Stock,https://m.media-amazon.com/images/I/71VBRgsYIYL._AC_UL320_.jpg,https://www.amazon.eg/dp/B0BZRYQT19,2026-05-14T06:29:28.358314
amazon,B08YNPFM71,Product B08YNPFM71,Dental floss and floss to clean and take care of teeth and gums 30 pieces,Sporting Goods,EGP 12.15,,,4.2,(1.3K),In Stock,https://m.media-amazon.com/images/I/513SjCBBgYL._AC_UL320_.jpg,https://www.amazon.eg/dp/B08YNPFM71,2026-05-14T06:29:28.362667
amazon,B07V24RWDQ,Product B07V24RWDQ,"Zip Ties, 100 Pcs 20 CM Cable Tie, Adjustable Durable Self locking Nylon Zip Cable Ties for Home Office Garage Workshop",Sporting Goods,EGP 35.00,,,4.3,(505),In Stock,https://m.media-amazon.com/images/I/71h22YmA7JL._AC_UL320_.jpg,https://www.amazon.eg/dp/B07V24RWDQ,2026-05-14T06:29:28.366601
amazon,B0B9LDTJJP,Product B0B9LDTJJP,White shoe wipes (pack of 20) - standard,Sporting Goods,EGP 39.50,EGP 59.00,,4.3,(1K),In Stock,https://m.media-amazon.com/images/I/61+2u1aRWiL._AC_UL320_.jpg,https://www.amazon.eg/dp/B0B9LDTJJP,2026-05-14T06:29:28.370652
amazon,B08D11MN1M,Product B08D11MN1M,"Adjustable laptop stand, portable aluminium laptop riser laptop holder for desk, foldable ventilated cooling computer support stand for apple macbook pro/air, hp, sony, dell, more 10-15.6''",Sporting Goods,EGP 100.61,EGP 135.00,,3.9,(7.2K),In Stock,https://m.media-amazon.com/images/I/61fRwSb0z0L._AC_UL320_.jpg,https://www.amazon.eg/dp/B08D11MN1M,2026-05-14T06:29:28.375973
amazon,B09NDY755K,Product B09NDY755K,"Limitless Naturals Omega 3 Fish Oil (2000mg, 30 Capsules)",Sporting Goods,EGP 207.00,EGP 230.00,,4.5,(1.9K),In Stock,https://m.media-amazon.com/images/I/51ywutvuxkL._AC_UL320_.jpg,https://www.amazon.eg/dp/B09NDY755K,2026-05-14T06:29:28.380573
amazon,B07DC3ML9R,Product B07DC3ML9R,Bonjorno Coffee Mix Pouch 400g,Sporting Goods,EGP 133.87,EGP 168.00,,4.3,(1.7K),In Stock,https://m.media-amazon.com/images/I/610zGbDYuOL._AC_UL320_.jpg,https://www.amazon.eg/dp/B07DC3ML9R,2026-05-14T06:29:28.385170
amazon,B09H6LZR7Y,Product B09H6LZR7Y,"Other Fresh Keeping Bags Food Cover, Reusable Bowl Covers Stretch Lids for Food Containers, Elastic Storage for Meal Prep Dish Plate, Family Outdoor Picnic Transparent",Sporting Goods,EGP 15.80,EGP 39.99,,4.0,(3.6K),In Stock,https://m.media-amazon.com/images/I/61E6OSLBJML._AC_UL320_.jpg,https://www.amazon.eg/dp/B09H6LZR7Y,2026-05-14T06:29:28.390045
amazon,B08WJMJHD8,Product B08WJMJHD8,Imtenan parsely and celery tea- 18 bags,Sporting Goods,EGP 36.00,EGP 39.00,,4.4,(2.4K),In Stock,https://m.media-amazon.com/images/I/716rMoXOpoL._AC_UL320_.jpg,https://www.amazon.eg/dp/B08WJMJHD8,2026-05-14T06:29:28.394488
amazon,B018QZ9HHM,Product B018QZ9HHM,zamzam sugar 1 kg,Sporting Goods,EGP 33.85,EGP 37.00,,4.5,(630),In Stock,https://m.media-amazon.com/images/I/51E-V67FVaL._AC_UL320_.jpg,https://www.amazon.eg/dp/B018QZ9HHM,2026-05-14T06:29:28.399387
amazon,B07B4JT3VS,Product B07B4JT3VS,"LISTERINE Mouthwash, Cool Mint, 250ml",Sporting Goods,EGP 105.20,,,4.5,(4K),In Stock,https://m.media-amazon.com/images/I/61lmX6D-dOL._AC_UL320_.jpg,https://www.amazon.eg/dp/B07B4JT3VS,2026-05-14T06:29:28.403346
amazon,B09Z33Q7YV,Product B09Z33Q7YV,BabyStar Bottle and Teats Cleanser 380ML,Sporting Goods,EGP 92.00,EGP 110.00,,4.6,(1.3K),In Stock,https://m.media-amazon.com/images/I/41PSRDCpjrL._AC_UL320_.jpg,https://www.amazon.eg/dp/B09Z33Q7YV,2026-05-14T06:29:28.408212
amazon,B08Y55VB3P,Product B08Y55VB3P,"Ludwik Dishwasher Salt 1.5 kg - Prevents Limescale, Enhances Performance, Spot-Free Dishes",Sporting Goods,EGP 210.00,EGP 223.13,,4.6,(473),In Stock,https://m.media-amazon.com/images/I/71vCjM8LeJL._AC_UL320_.jpg,https://www.amazon.eg/dp/B08Y55VB3P,2026-05-14T06:29:28.412337
amazon,B083X1TKQL,Product B083X1TKQL,Papia Tissue - Toilet paper - 3 Ply - 6 Rolls,Sporting Goods,EGP 65.00,,,4.6,(873),In Stock,https://m.media-amazon.com/images/I/71RSzeaisyL._AC_UL320_.jpg,https://www.amazon.eg/dp/B083X1TKQL,2026-05-14T06:29:28.415865
amazon,B0976ZF83N,Product B0976ZF83N,"Pampers Baby Dry Pants Diapers, size 5, 12-18 kg, with Lotion with Olive Oil, 70 baby Diapers",Sporting Goods,EGP 459.00,EGP 570.00,,4.2,(1.2K),In Stock,https://m.media-amazon.com/images/I/71CjsVEv6hL._AC_UL320_.jpg,https://www.amazon.eg/dp/B0976ZF83N,2026-05-14T06:29:28.420430
amazon,B0DPWVMNXM,Product B0DPWVMNXM,Ariel Automatic Detergent Gel with Touch of Downy - 3.6 KG,Sporting Goods,EGP 299.95,EGP 379.00,,4.5,(4.6K),In Stock,https://m.media-amazon.com/images/I/71qZp1XZyyL._AC_UL320_.jpg,https://www.amazon.eg/dp/B0DPWVMNXM,2026-05-14T06:29:28.425410
amazon,B0DGGQWL99,Product B0DGGQWL99,"Dove bar soap Pampering Beauty Cream, for all skin types, Shea Butter & Vanilla with ¼ moisturizing cream 90G",Sporting Goods,EGP 38.50,,,4.6,(709),In Stock,https://m.media-amazon.com/images/I/613JPsiDzsL._AC_UL320_.jpg,https://www.amazon.eg/dp/B0DGGQWL99,2026-05-14T06:29:28.429366
amazon,B09W94JPJ2,Product B09W94JPJ2,"Air Fryer Liners, 100PCS Air Fryer Disposable Paper Liner, for Air Fryer, Oil-Proof, Water-Proof, Food Grade Parchment, Air Fryer Paper(6.3in)",Sporting Goods,EGP 40.00,EGP 84.90,,3.9,(972),In Stock,https://m.media-amazon.com/images/I/71rnfh8BIjL._AC_UL320_.jpg,https://www.amazon.eg/dp/B09W94JPJ2,2026-05-14T06:29:28.433546
amazon,B09Y37BSM9,Product B09Y37BSM9,iLOCK Travel Plug adapter Converter,Sporting Goods,EGP 53.00,,,4.7,(3.4K),In Stock,https://m.media-amazon.com/images/I/61BALBWHw3L._AC_UL320_.jpg,https://www.amazon.eg/dp/B09Y37BSM9,2026-05-14T06:29:28.437958
amazon,B0BTMHZ3W3,Product B0BTMHZ3W3,Organo Natural Vinegar With 5% Acidity 900 ML - Clear,Sporting Goods,EGP 14.95,,,4.6,(1.2K),In Stock,https://m.media-amazon.com/images/I/6134xyItbdL._AC_UL320_.jpg,https://www.amazon.eg/dp/B0BTMHZ3W3,2026-05-14T06:29:28.441968
amazon,B08WJND94N,Product B08WJND94N,"Elano water bottle, 12 pieces - 1.50 liter Package design may vary",Sporting Goods,EGP 100.00,,,3.9,(2.4K),In Stock,https://m.media-amazon.com/images/I/61WgLa-0U6L._AC_UL320_.jpg,https://www.amazon.eg/dp/B08WJND94N,2026-05-14T06:29:28.445937
amazon,B0G2JJMG83,Product B0G2JJMG83,Hepta Carbamide Twenty Cream – Deep Moisturizing Cream with 20% Urea for Very Dry & Rough Skin – 50 gm,Sporting Goods,EGP 80.00,EGP 120.00,,4.5,(142),In Stock,https://m.media-amazon.com/images/I/61J7+0xDOYL._AC_UL320_.jpg,https://www.amazon.eg/dp/B0G2JJMG83,2026-05-14T06:29:28.450447
amazon,B0FTXSZGTQ,Product B0FTXSZGTQ,Dice Mens DSM-H-P P*3 Socks (pack of 3),Sporting Goods,EGP 85.00,EGP 100.00,,4.3,(107),In Stock,https://m.media-amazon.com/images/I/41YNGBOF80L._AC_UL320_.jpg,https://www.amazon.eg/dp/B0FTXSZGTQ,2026-05-14T06:29:28.455824
amazon,B08WJNFTMM,Product B08WJNFTMM,Vitrac strawberry jam- 850 gm,Sporting Goods,EGP 54.95,EGP 105.00,,4.5,(705),In Stock,https://m.media-amazon.com/images/I/71g7ONIqCkL._AC_UL320_.jpg,https://www.amazon.eg/dp/B08WJNFTMM,2026-05-14T06:29:28.460299
amazon,B08WJNCVKM,Product B08WJNCVKM,"Velveta fabric softener with lavender scent , 3 kg",Sporting Goods,EGP 210.00,,,4.5,(1.1K),In Stock,https://m.media-amazon.com/images/I/71hUWTGcPNL._AC_UL320_.jpg,https://www.amazon.eg/dp/B08WJNCVKM,2026-05-14T06:29:28.464214
amazon,B0976Z2D1G,Product B0976Z2D1G,"Pampers premium EXTRA care Taped diapers, size 6, with Lotion with Aloe Vera, 48 baby diapers",Sporting Goods,EGP 479.00,EGP 560.00,,4.5,(4K),In Stock,https://m.media-amazon.com/images/I/81xwRgyCzWL._AC_UL320_.jpg,https://www.amazon.eg/dp/B0976Z2D1G,2026-05-14T06:29:28.469579
amazon,B096CPFRD5,Product B096CPFRD5,Kolagra sun screen-50 ml,Sporting Goods,EGP 101.65,EGP 130.32,,4.1,(1.1K),In Stock,https://m.media-amazon.com/images/I/51W0EloTP8L._AC_UL320_.jpg,https://www.amazon.eg/dp/B096CPFRD5,2026-05-14T06:29:28.474469
amazon,B0CZ94NRQW,Product B0CZ94NRQW,White 80 round cotton pads,Sporting Goods,EGP 49.99,EGP 71.25,,4.6,(796),In Stock,https://m.media-amazon.com/images/I/61pi-hgdSjL._AC_UL320_.jpg,https://www.amazon.eg/dp/B0CZ94NRQW,2026-05-14T06:29:28.479001
amazon,B0CT8S41V8,Product B0CT8S41V8,"Downy Fabric Conditioner Concentrate, Vanilla & Musk 1L",Sporting Goods,EGP 164.99,EGP 254.00,,4.7,(328),In Stock,https://m.media-amazon.com/images/I/51TV5IS3mKL._AC_UL320_.jpg,https://www.amazon.eg/dp/B0CT8S41V8,2026-05-14T06:29:28.482974
amazon,B0D7KBL2WG,Product B0D7KBL2WG,Easy to Fill Travel Perfume Atomizer Bottle - Glass & Mineral Assorted colors,Sporting Goods,EGP 20.71,EGP 27.67,,3.5,(697),In Stock,https://m.media-amazon.com/images/I/71nEvBwzCBL._AC_UL320_.jpg,https://www.amazon.eg/dp/B0D7KBL2WG,2026-05-14T06:29:28.487821
amazon,B092312R94,Product B092312R94,VGR Men's Electric Shave Machine (V-071),Sporting Goods,EGP 380.00,,,4.3,(2.4K),In Stock,https://m.media-amazon.com/images/I/61Rl6XVemdL._AC_UL320_.jpg,https://www.amazon.eg/dp/B092312R94,2026-05-14T06:29:28.492198
amazon,B0DB4N4ZHQ,Product B0DB4N4ZHQ,"Shoe Washing Machine Bag,Shoe Laundry Bag-Reusable,Hangable,Shoe Bag For Washer And Dryer,Shoe Bag For Washing Machine For All Shoe Types And Sizes.(Yellow 1pc)",Sporting Goods,EGP 89.00,EGP 119.70,,4.2,(291),In Stock,https://m.media-amazon.com/images/I/71SNdDShp7L._AC_UL320_.jpg,https://www.amazon.eg/dp/B0DB4N4ZHQ,2026-05-14T06:29:28.496706
amazon,B07G977R5Q,Product B07G977R5Q,Clorox for Colors Floral 2L,Sporting Goods,EGP 123.81,,,4.6,(2.8K),In Stock,https://m.media-amazon.com/images/I/71Ju6gkRPJL._AC_UL320_.jpg,https://www.amazon.eg/dp/B07G977R5Q,2026-05-14T06:29:28.501162
amazon,B09SLQXS2B,Product B09SLQXS2B,"Pack of 60 Reusable Multifunctional Double-Sided Adhesive Tape, Washable, Non-Marking, Transparent and Removable Tape for Carpet, Photo Frame, Kitchen",Sporting Goods,EGP 16.99,EGP 0.28,,3.0,(792),In Stock,https://m.media-amazon.com/images/I/51HyYCpS+QL._AC_UL320_.jpg,https://www.amazon.eg/dp/B09SLQXS2B,2026-05-14T06:29:28.506418
amazon,B0FM8CRZHN,Product B0FM8CRZHN,"Hepta Panthenol Pink Cream – Whitening & Moisturizing Cream for Sensitive Areas 50g | Panthenol, Vitamin C&E, Alpha Arbutin, Niacinamide, Moisturizing & Softening for Sensitive Skin",Sporting Goods,EGP 90.00,EGP 120.00,,4.1,(249),In Stock,https://m.media-amazon.com/images/I/61qBBW2GRIL._AC_UL320_.jpg,https://www.amazon.eg/dp/B0FM8CRZHN,2026-05-14T06:29:28.510510
amazon,B09TCNRH1L,Product B09TCNRH1L,مجلد قصص القرآن جـ2,Sporting Goods,EGP 57.92,EGP 200.00,,4.3,(34),In Stock,https://m.media-amazon.com/images/I/71yXecmdt+L._AC_UL320_.jpg,https://www.amazon.eg/dp/B09TCNRH1L,2026-05-14T06:29:28.515274
amazon,B0F6NM2HJC,Product B0F6NM2HJC,Limitless Power Max,Sporting Goods,EGP 243.00,EGP 285.00,,4.4,(508),In Stock,https://m.media-amazon.com/images/I/51EtOcwYLiL._AC_UL320_.jpg,https://www.amazon.eg/dp/B0F6NM2HJC,2026-05-14T06:29:28.520259
amazon,B0CTMTVCW7,Product B0CTMTVCW7,Fine Deal Kitchen Tissue Paper Towel 2 Ply 6 Rolls,Sporting Goods,EGP 61.15,EGP 75.00,,4.4,(2K),In Stock,https://m.media-amazon.com/images/I/81WyC1suaoL._AC_UL320_.jpg,https://www.amazon.eg/dp/B0CTMTVCW7,2026-05-14T06:29:28.524856
amazon,B08P5MP4YC,Product B08P5MP4YC,Portal High Accuracy Digital Kitchen Scale 10 Kg - White Electronic Weight Scale - Portable Kitchen Food LCD Display Scales,Sporting Goods,EGP 102.30,EGP 135.00,,3.8,(3.2K),In Stock,https://m.media-amazon.com/images/I/51p-u4WAnYL._AC_UL320_.jpg,https://www.amazon.eg/dp/B08P5MP4YC,2026-05-14T06:29:28.529772
amazon,B0C6TZN8ZW,Product B0C6TZN8ZW,Rfid smart wallet for men and women anti theft aluminum pop up travel card holder,Sporting Goods,EGP 45.50,,,3.8,(55),In Stock,https://m.media-amazon.com/images/I/310fsgUJndL._AC_UL320_.jpg,https://www.amazon.eg/dp/B0C6TZN8ZW,2026-05-14T06:29:28.533713
amazon,B0846D5CBP,Product B0846D5CBP,Casio fx-991esplus-2wdtv digital calculator - Black - 2 Years Warranty,Sporting Goods,"EGP 1,019.00","EGP 1,399.00",,4.7,(17.2K),In Stock,https://m.media-amazon.com/images/I/514Kel0a1xL._AC_UL320_.jpg,https://www.amazon.eg/dp/B0846D5CBP,2026-05-14T06:32:49.896076
amazon,B0CQYW2NGC,Product B0CQYW2NGC,SOKANY SK-12003 Garment Steamer 1500W 250mm,Sporting Goods,"EGP 1,499.00","EGP 1,580.28",,4.0,(112),In Stock,https://m.media-amazon.com/images/I/51VGOEIB6CL._AC_UL320_.jpg,https://www.amazon.eg/dp/B0CQYW2NGC,2026-05-14T06:32:49.900505
amazon,B0FDGLCR1H,Product B0FDGLCR1H,Silver Crest Air Fryer 6 Liter 2400W Multifunction Touch Screen - Black,Sporting Goods,"EGP 1,205.00","EGP 1,351.43",,3.1,(94),In Stock,https://m.media-amazon.com/images/I/61J99-JRTrL._AC_UL320_.jpg,https://www.amazon.eg/dp/B0FDGLCR1H,2026-05-14T06:32:49.905100
amazon,B0D6BQNVXC,Product B0D6BQNVXC,"Soundcore By Anker R50i NC True Wireless Earbuds 10mm Drivers with Big Bass, Bluetooth 5.3, IP54-Sweatguard M waterproof, AI Clear Calls with 4 Mics, 22 Preset EQs via App-White - 18 Months Warranty",Sporting Goods,"EGP 1,188.88","EGP 1,230.77",,4.2,(1.2K),In Stock,https://m.media-amazon.com/images/I/61b5cOjm2eL._AC_UL320_.jpg,https://www.amazon.eg/dp/B0D6BQNVXC,2026-05-14T06:32:49.911340
amazon,B0DM9KBP4B,Product B0DM9KBP4B,"Soundcore by Anker R50i NC Wireless Bluetooth Earphones, Powerful and Smart Noise Cancelling, Powerful Bass, 45 Hours Playtime, 2-in-1 Case and Phone Stand, IP54, Bluetooth 5.4, Black",Sporting Goods,"EGP 1,163.44","EGP 1,292.87",,4.1,(220),In Stock,https://m.media-amazon.com/images/I/41QN8EKIEuL._AC_UL320_.jpg,https://www.amazon.eg/dp/B0DM9KBP4B,2026-05-14T06:32:49.915221
amazon,B0795W624R,Product B0795W624R,"Philips Oneblade Replaceable Blade Pack Including 2 Replaceable Blades, Qp220/51 (Lime)",Sporting Goods,"EGP 1,162.80",,,4.7,(2.5K),In Stock,https://m.media-amazon.com/images/I/71xZIjLsrrL._AC_UL320_.jpg,https://www.amazon.eg/dp/B0795W624R,2026-05-14T06:32:49.918610
amazon,B0G5T135KM,Product B0G5T135KM,Scooter for Kids High Quality 3 Wheels Big Pedal Foldable PU Height Adjustable LED Light Best Gift Age 3 to 12 Years Red Kid Aluminum Body,Sporting Goods,"EGP 1,059.00","EGP 1,289.00",,3.7,(34),In Stock,https://m.media-amazon.com/images/I/51NA9YrL9TL._AC_UL320_.jpg,https://www.amazon.eg/dp/B0G5T135KM,2026-05-14T06:32:49.923278
amazon,B07YV48XHP,Product B07YV48XHP,Babyliss 6704E Power Pro Hair Dryer,Sporting Goods,"EGP 1,818.00",,,4.5,(392),In Stock,https://m.media-amazon.com/images/I/51Z+hL3kMKL._AC_UL320_.jpg,https://www.amazon.eg/dp/B07YV48XHP,2026-05-14T06:32:49.926903
amazon,B0B2RST165,Product B0B2RST165,"Casio FX-991ESPLUS-2PKWDT Scientific Calculator, Pink",Sporting Goods,"EGP 1,209.00",,,4.7,(17.2K),In Stock,https://m.media-amazon.com/images/I/61A5VbemBaL._AC_UL320_.jpg,https://www.amazon.eg/dp/B0B2RST165,2026-05-14T06:32:49.931815
amazon,B0FL7KZ9LY,Product B0FL7KZ9LY,"ZoserX - Bionic Heated Massager, Wireless Portable Shiatsu Neck and Back Massager, Electric Deep Tissue 4D Kneading Massage, Simulated Human Hand Design for Pain Relief and Muscle Relax (Green)",Sporting Goods,"EGP 1,025.00",,,3.7,(224),In Stock,https://m.media-amazon.com/images/I/61JCT22ffpL._AC_UL320_.jpg,https://www.amazon.eg/dp/B0FL7KZ9LY,2026-05-14T06:32:49.935979
amazon,B0DLTL8JCM,Product B0DLTL8JCM,Facilita Blood Pressure Monitor,Sporting Goods,"EGP 1,097.15","EGP 1,354.50",,4.4,(65),In Stock,https://m.media-amazon.com/images/I/61zdU6ojN6L._AC_UL320_.jpg,https://www.amazon.eg/dp/B0DLTL8JCM,2026-05-14T06:32:49.940131
amazon,B07N6PJHVJ,Product B07N6PJHVJ,CANON Ink cartridge PG-445 BK/CL-446 COLOR MULTI PACK,Sporting Goods,"EGP 1,479.00","EGP 1,899.99",,4.4,(818),In Stock,https://m.media-amazon.com/images/I/717a1JXyIBL._AC_UL320_.jpg,https://www.amazon.eg/dp/B07N6PJHVJ,2026-05-14T06:32:49.944755
amazon,B0GHSV119N,Product B0GHSV119N,H2oFloss Rechargeable Electric Water Flosser - 360° Deep Clean Oral Irrigator with 8 Professional Nozzles & Travel Bag - IPX7 Waterproof - Ultimate Dental Hygiene System (h2ofloss Black),Sporting Goods,"EGP 1,899.00",,,4.4,(5),In Stock,https://m.media-amazon.com/images/I/51HkelX13mL._AC_UL320_.jpg,https://www.amazon.eg/dp/B0GHSV119N,2026-05-14T06:32:49.948078
amazon,B0B2RR481F,Product B0B2RR481F,"Casio Scientific Calculators Non Programmable 10 2 Digis 417 Functions Blue Color FX-991ESPLUS2BUWDT, C86",Sporting Goods,"EGP 1,029.00","EGP 1,209.00",,4.7,(17.2K),In Stock,https://m.media-amazon.com/images/I/61mxxfYRO7L._AC_UL320_.jpg,https://www.amazon.eg/dp/B0B2RR481F,2026-05-14T06:32:49.953131
amazon,B0DG5LSJ3X,Product B0DG5LSJ3X,"Mini Portable Projector 4K 1080P Full HD Support Android 11 & Netflix - WiFi 6, BT 5.0, 180° Rotation, Small Home Theater Projector with Auto Keystone Correction",Sporting Goods,"EGP 1,999.00","EGP 4,701.60",,3.4,(1.9K),In Stock,https://m.media-amazon.com/images/I/71U0ezDt70L._AC_UL320_.jpg,https://www.amazon.eg/dp/B0DG5LSJ3X,2026-05-14T06:32:49.957392
amazon,B0D3P8ZP21,Product B0D3P8ZP21,"Xiaomi Body Fat Scale S400 Bathroom Scales with Dual Frequency Measurement, 25 Health Indicators, up to 150 kg and Accuracy of 100 g, Body mass index, muscle mass, body fat, White",Sporting Goods,"EGP 1,322.00","EGP 1,533.30",,4.4,(2.2K),In Stock,https://m.media-amazon.com/images/I/51keV3OO2kL._AC_UL320_.jpg,https://www.amazon.eg/dp/B0D3P8ZP21,2026-05-14T06:32:49.961717
amazon,B0DFHFM1X9,Product B0DFHFM1X9,"Redmi Watch 5 Active Smartwatch, 2.0 Inch LCD Display, 18 Day Battery, 140+ Sports Modes, Heart Rate and SPO₂ Tracking, 5ATM Waterproof, Calls, Fitness Tracker, Silver|1 year manufacturer warranty",Sporting Goods,"EGP 1,722.00","EGP 1,917.18",,4.4,(9.5K),In Stock,https://m.media-amazon.com/images/I/61su9fqRFUL._AC_UL320_.jpg,https://www.amazon.eg/dp/B0DFHFM1X9,2026-05-14T06:32:49.966802
amazon,B0FR2MFW1H,Product B0FR2MFW1H,"TORNADO Steam Iron 2200 Watt Ceramic Soleplate, Tank Capacity 300 Ml, Anti-Drip, Adjustable Steam Dark Blue - Green TST-2200NC (Multi Color)",Sporting Goods,"EGP 1,414.00","EGP 1,613.81",,3.8,(23),In Stock,https://m.media-amazon.com/images/I/41cy8pPZWnL._AC_UL320_.jpg,https://www.amazon.eg/dp/B0FR2MFW1H,2026-05-14T06:32:49.970738
amazon,B0CRTPF7CZ,Product B0CRTPF7CZ,"soundcore P30i by Anker Noise Cancelling Earbuds, Smart Noise Cancelling, 45H Playtime, 2-in-1 Case and Phone Stand, IP54, Wireless Earbuds, Bluetooth 5.4, App Control, Blue, 18 Months Warranty",Sporting Goods,"EGP 1,232.00","EGP 1,699.00",,4.2,(31.8K),In Stock,https://m.media-amazon.com/images/I/41T7lJdeeWL._AC_UL320_.jpg,https://www.amazon.eg/dp/B0CRTPF7CZ,2026-05-14T06:32:49.977247
amazon,B0CRTYZG5C,Product B0CRTYZG5C,"Soundcore P30i by Anker Noise Cancelling Earbuds, Strong and Smart Noise Cancelling, Powerful Bass, 45H Playtime, 2-in-1 Case and Phone Stand, IP54, Wireless Earbuds, Bluetooth 5.4 (Black)",Sporting Goods,"EGP 1,296.11","EGP 1,699.00",,4.2,(31.8K),In Stock,https://m.media-amazon.com/images/I/51HbL1WS+KL._AC_UL320_.jpg,https://www.amazon.eg/dp/B0CRTYZG5C,2026-05-14T06:32:49.983351
amazon,B08X69XYLH,Product B08X69XYLH,"Fresh Stand Fan Galaxy- 16 inch Assorted Colors, Fresh Stand Fan Galaxy",Sporting Goods,"EGP 1,449.00","EGP 1,653.00",,4.0,(212),In Stock,https://m.media-amazon.com/images/I/31lFkko-eBL._AC_UL320_.jpg,https://www.amazon.eg/dp/B08X69XYLH,2026-05-14T06:32:49.988278
amazon,B09P1CMX7S,Product B09P1CMX7S,Alcatel F860/F630/S250 Wireless Telephone/Speaker/Illuminated Screen/Caller ID/50 Digit Memory/Redial Button/Different Tones/Bell Intensity Control,Sporting Goods,"EGP 1,458.00",,,4.4,(93),In Stock,https://m.media-amazon.com/images/I/51iyEbgSkbL._AC_UL320_.jpg,https://www.amazon.eg/dp/B09P1CMX7S,2026-05-14T06:32:49.992424
amazon,B08WJN8YRC,Product B08WJN8YRC,Fresh stand fan shabah 18 inch,Sporting Goods,"EGP 1,975.00",,,4.3,(746),In Stock,https://m.media-amazon.com/images/I/513n962WGwL._AC_UL320_.jpg,https://www.amazon.eg/dp/B08WJN8YRC,2026-05-14T06:32:49.996820
amazon,B09L8FNDTR,Product B09L8FNDTR,"Tank Power Water Filter 5 Stages Premium, 1 Year Warranty",Sporting Goods,"EGP 1,338.22",,,4.2,(219),In Stock,https://m.media-amazon.com/images/I/71muLGJr5BL._AC_UL320_.jpg,https://www.amazon.eg/dp/B09L8FNDTR,2026-05-14T06:32:50.000575
amazon,B0DTGT3NNW,Product B0DTGT3NNW,Sokany SK-12008 1500 W Handheld Garment Steam Iron,Sporting Goods,"EGP 1,239.00","EGP 1,383.28",,4.0,(24),In Stock,https://m.media-amazon.com/images/I/41lUwin7okL._AC_UL320_.jpg,https://www.amazon.eg/dp/B0DTGT3NNW,2026-05-14T06:32:50.004328
amazon,B093Q75MN3,Product B093Q75MN3,Apple MX532LL/A AirTag Multi-function Item Locator for iPhone/iPad - White,Sporting Goods,"EGP 1,599.00","EGP 1,655.99",,4.7,(143.7K),In Stock,https://m.media-amazon.com/images/I/61ZRE8c0SNL._AC_UL320_.jpg,https://www.amazon.eg/dp/B093Q75MN3,2026-05-14T06:32:50.009442
amazon,B00BJB8PUG,Product B00BJB8PUG,Nutrex Lipo-6 Black UC 60c,Sporting Goods,"EGP 1,085.00","EGP 1,300.00",,4.1,(126),In Stock,https://m.media-amazon.com/images/I/51sD09ZdZIL._AC_UL320_.jpg,https://www.amazon.eg/dp/B00BJB8PUG,2026-05-14T06:32:50.013332
amazon,B0FGD6VC3S,Product B0FGD6VC3S,Levi's Mens Men's Relaxed Short Sleeve Graphic T-Shirt Modern (pack of 1),Sporting Goods,"EGP 1,229.00",,,5.0,(1),In Stock,https://m.media-amazon.com/images/I/41RjIHNJa+L._AC_UL320_.jpg,https://www.amazon.eg/dp/B0FGD6VC3S,2026-05-14T06:32:50.018534
amazon,B0BKWXJB29,Product B0BKWXJB29,TotalEnergies QUARTZ 7000 10W-40 Synthetic Technology Engine oil for Passenger Car - 5 Liters,Sporting Goods,"EGP 1,199.00",,,4.5,(1.1K),In Stock,https://m.media-amazon.com/images/I/71D3lCv+7ZL._AC_UL320_.jpg,https://www.amazon.eg/dp/B0BKWXJB29,2026-05-14T06:32:50.022226
amazon,B0BS1PRC4L,Product B0BS1PRC4L,"Sony WH-CH520 Wireless Bluetooth On-Ear with Mic for Phone Call, Black",Sporting Goods,"EGP 1,899.00","EGP 1,998.98",,4.4,(30.1K),In Stock,https://m.media-amazon.com/images/I/41lArSiD5hL._AC_UL320_.jpg,https://www.amazon.eg/dp/B0BS1PRC4L,2026-05-14T06:32:50.028696
amazon,B08WJNFTJ9,Product B08WJNFTJ9,Fresh Fan Desk Smart 16 Inch,Sporting Goods,"EGP 1,180.00","EGP 1,296.00",,4.3,(274),In Stock,https://m.media-amazon.com/images/I/61KM09nlbdL._AC_UL320_.jpg,https://www.amazon.eg/dp/B08WJNFTJ9,2026-05-14T06:32:50.033705
amazon,B0CLPKWSHQ,Product B0CLPKWSHQ,"Joyroom JR-W020 20W PD Magnetic Wireless Power Bank, 10,000 mAh Fast Charging Portable Charger, MagSafe-Compatible, USB-C Power Delivery, Qi Wireless Charging – Black | 12-Month Warranty",Sporting Goods,"EGP 1,220.80",,,4.0,(135),In Stock,https://m.media-amazon.com/images/I/5165Ny8pGsL._AC_UL320_.jpg,https://www.amazon.eg/dp/B0CLPKWSHQ,2026-05-14T06:32:50.037466
amazon,B09HSK8H8K,Product B09HSK8H8K,TORNADO Orbit Fan 16 Inch 4 Blades White TOF-49Y,Sporting Goods,"EGP 1,799.00","EGP 2,541.25",,4.0,(93),In Stock,https://m.media-amazon.com/images/I/71phfB7PqPL._AC_UL320_.jpg,https://www.amazon.eg/dp/B09HSK8H8K,2026-05-14T06:32:50.041316
amazon,B0F3CV3RMQ,Product B0F3CV3RMQ,"Hollyland Lark A1 Wireless Mini Microphone for iPhone 15/16 & Android, 48kHz/24-bit, 3-Level Intelligent Noise Cancel, Magnetic Microphone for YouTube, Podcast, Vlogging (Black, 2TX + USB-C RX)",Sporting Goods,"EGP 1,749.00",,,4.4,(1.9K),In Stock,https://m.media-amazon.com/images/I/51rzGqwKHJL._AC_UL320_.jpg,https://www.amazon.eg/dp/B0F3CV3RMQ,2026-05-14T06:32:50.045005
amazon,B06XWZ41RT,Product B06XWZ41RT,Panasonic RF-2400D High Quality Digital Portable Radio AM FM - Black,Sporting Goods,"EGP 1,988.00","EGP 2,199.00",,4.4,(8.9K),In Stock,https://m.media-amazon.com/images/I/51A0trhWnoL._AC_UL320_.jpg,https://www.amazon.eg/dp/B06XWZ41RT,2026-05-14T06:32:50.049314
