platform,asin,title,brand,category,current_price,original_price,discount,rating,reviews_count,prime_eligible,amazon_choice,sponsored,main_image,product_url,scraped_at
amazon,,"2pcs Mug Hooks Mug Holder Under Cabinet,BAIEUEJO Coffee Cups Holder Hanger no Drilling,Kitchen Utensil Hooks,Storage Hooks â€‹for Cups/Kitchen Utensils/Ties Belts/Scarf/Keys Storage (White)",,Kitchen,EGP 77.60,EGP 88.90,,3.8,Was:,,,,https://m.media-amazon.com/images/I/61Gzr-sa63L._AC_UL320_.jpg,https://www.amazon.eg/dp/B09QH2F3Y6,2026-05-30T04:45:22.931411
amazon,,"62ELEVEN 5pcs Carrot Design Sealing Clip for Food Storage, Plastic Bag Sealing Clips Sealing Clip Sealed Bag Snacks Food Bag Clip for Kitchen Food Sealing Clips Bread Airtight Storage and Freezer",,Kitchen,EGP 30.00,,,3.7,,,,,https://m.media-amazon.com/images/I/61-qD-6Ys+L._AC_UL320_.jpg,https://www.amazon.eg/dp/B0BW4Y13FN,2026-05-30T04:45:22.931855
amazon,,LESTER Oil-Proof Non-Slip Kitchen Mat Set modern design shades of blue 40X60 + 40X120cm,,Kitchen,EGP 499.73,,,3.4,,,,,https://m.media-amazon.com/images/I/71APRSrR5dL._AC_UL320_.jpg,https://www.amazon.eg/dp/B0CVQV8RRH,2026-05-30T04:45:22.932290
amazon,,Stainless Steel Insulated Water Bottle - Assorted Colors & Sizes- Leak Proof with Carrying Handle- Metal Water Bottle- Stainless Steel Water Bottles (Powder Black),,Kitchen,EGP 235.00,EGP 280.00,Save 16%,4.1,Was:,,,,https://m.media-amazon.com/images/I/31JDGQlII+L._AC_UL320_.jpg,https://www.amazon.eg/dp/B0BQDSM6YJ,2026-05-30T04:45:22.932795
amazon,,"MORE BUY Waterproof Multipurpose Super Strong EVA Anti Slip Mat/Sheet for Fridge/Kitchen Drawer/Cupboard Shelf/Table/Refrigerator (Transparent, 3 Meter roll) (White)",,Kitchen,EGP 164.00,,,3.9,Get it faster,,,,https://m.media-amazon.com/images/I/61j8ja6LOgL._AC_UL320_.jpg,https://www.amazon.eg/dp/B08G53C11V,2026-05-30T04:45:22.933345
amazon,,"Kitchen Oil Filter - Equipped with fine mesh filter effectively separates food particles from oil, this kitchen essential product ensures clean and reusable oil with anti-dust with protective cover.",,Kitchen,EGP 280.58,,,,,,,,https://m.media-amazon.com/images/I/81D3UO6o0QL._AC_UL320_.jpg,https://www.amazon.eg/dp/B0DSWN71H9,2026-05-30T04:45:22.933731
amazon,,Multipurpose Cleaning Microfiber Towel - For Home And Kitchen (Pack Of 5 Towels) (Checkered blue),,Kitchen,EGP 260.00,,,3.6,,,,,https://m.media-amazon.com/images/I/61MSr47Y22L._AC_UL320_.jpg,https://www.amazon.eg/dp/B0DSR595KW,2026-05-30T04:45:22.934167
amazon,,2 Pack Spoon Rest and Lid Holder for Kitchen No Drip Practical Multi-Function Stand for Spatula Ladle Spoon,,Kitchen,EGP 125.00,,,,,,,,https://m.media-amazon.com/images/I/61lmx1VrBlL._AC_UL320_.jpg,https://www.amazon.eg/dp/B0GJJVC7WP,2026-05-30T04:45:22.934563
amazon,,"Bulfyss Multipurpose 60cm x 10m Super Strong EVA Anti-Slip Bathroom Kitchen Cabinet Drawer Shelf Mat Liner Sheets Roll, Fridge Mat, Table Mat (60cm X 10 Meters Roll, Transparent White)",,Kitchen,"EGP 1,052.68",,,4.0,,,,,https://m.media-amazon.com/images/I/61iCTMUVtES._AC_UL320_.jpg,https://www.amazon.eg/dp/B092SYC4K6,2026-05-30T04:45:22.935135
amazon,,Generic 1X Safe Fingers Protector Fruit Vegetable Cut Kitchen Hand Guard Stainless Steel,,Kitchen,EGP 45.00,,,3.0,,,,,https://m.media-amazon.com/images/I/41PLY5V+IvL._AC_UL320_.jpg,https://www.amazon.eg/dp/B091CRFBVJ,2026-05-30T04:45:22.935589
amazon,,Garneric 1set Mini Silicone Spatula for Makeup and Kitchen Use Handle Scraper for Jars and Beauty Products Easy to Clean Silicone Tool,,Kitchen,EGP 169.00,,,3.1,,,,,https://m.media-amazon.com/images/I/41jVl7shpbL._AC_UL320_.jpg,https://www.amazon.eg/dp/B0FMLZ1GXD,2026-05-30T04:45:22.936040
amazon,,"Universal Kitchen Glass Pot Lids with Carrying Handles Replacement Knobs, (Random Colour)",,Kitchen,EGP 43.90,,,3.2,,,,,https://m.media-amazon.com/images/I/41i7HW4u5-L._AC_UL320_.jpg,https://www.amazon.eg/dp/B09HCPD4Y9,2026-05-30T04:45:22.936486
amazon,,"Knife Sharpener for Sharpening Cutting Tools and Softening Blades, Ergonomic and Modern Design, Multi-Use Sharpener, Kitchen Sharpener Rejuvenation Sharpener, Stainless Steel, 15.9 x 12.8 x 8.7 cm",,Kitchen,EGP 170.00,,,,,,,,https://m.media-amazon.com/images/I/51ApvYi6UHL._AC_UL320_.jpg,https://www.amazon.eg/dp/B0GQP4YDM9,2026-05-30T04:45:22.936884
amazon,,"300ml Glass Bubbles Cup with Lid and Spoon Cute Bear Shape Great for Milk, Juice, Chocolate, Iced Coffee, Best Product Supplier Elegant Home (2)",,Kitchen,EGP 85.50,,,4.3,,,,,https://m.media-amazon.com/images/I/81q4ToWCH9L._AC_UL320_.jpg,https://www.amazon.eg/dp/B0DBBJGC9P,2026-05-30T04:45:26.881797
amazon,,"TRAMONTINA Knife, Kitchen Knife for Everyday Cutting – Dynamic – Steak & Fruit – Natural Wood - Plain Edge – 5-Inch – Red",,Kitchen,EGP 273.54,EGP 296.00,,3.8,List:,,,,https://m.media-amazon.com/images/I/61mjNNOYNTL._AC_UL320_.jpg,https://www.amazon.eg/dp/B01JMV8OXW,2026-05-30T04:45:26.884287
amazon,,Stainless Steel Fuel Injection Bottle Spray Oil Bottle Vinegar Bottle Stainless Steel Oil Sprayer Kitchen Cruet,,Kitchen,EGP 66.00,,,3.6,,,,,https://m.media-amazon.com/images/I/41OwNyf9dcL._AC_UL320_.jpg,https://www.amazon.eg/dp/B091G5SDT1,2026-05-30T04:45:26.885182
amazon,,"Generic Cabinet Rack, Spice Rack, Organization and Storage for Kitchen and Bathroom (Large) - Black",,Kitchen,EGP 499.00,,,4.8,,,,,https://m.media-amazon.com/images/I/51AmpGdcH3L._AC_UL320_.jpg,https://www.amazon.eg/dp/B0D6RX95NY,2026-05-30T04:45:26.886113
amazon,,"Pruta Food Container (Transparent, Orange)- Set of 17",,Kitchen,EGP 380.00,EGP 632.83,,4.1,List:,,,,https://m.media-amazon.com/images/I/71t6j+btb7L._AC_UL320_.jpg,https://www.amazon.eg/dp/B07NDN64Q8,2026-05-30T04:45:26.887086
amazon,,Generic Digital kitchen food cooking probe bbq meat thermometer,,Kitchen,EGP 140.00,,,4.0,,,,,https://m.media-amazon.com/images/I/51aU+dr2feL._AC_UL320_.jpg,https://www.amazon.eg/dp/B08ZXV3YFL,2026-05-30T04:45:26.889040
amazon,,"Kitchen Towel Holder By Lamsa Plast, Assorted Colors",,Kitchen,EGP 21.86,EGP 27.00,,4.0,Was:,,,,https://m.media-amazon.com/images/I/51QkrQ5pl4L._AC_UL320_.jpg,https://www.amazon.eg/dp/B091CZTWNB,2026-05-30T04:45:26.889551
amazon,,"Microfiber Dish Drying Mat - By Combining Drying Rack And Mat In One, This Product Allows You To Stack And Organize Your Dishes, Cups, And Utensils While Drying In The Air, Making The Stretch Cleaning",,Kitchen,EGP 380.00,,,4.7,,,,,https://m.media-amazon.com/images/I/71TkoKy5eqL._AC_UL320_.jpg,https://www.amazon.eg/dp/B0DTYNRLWV,2026-05-30T04:45:26.889997
amazon,,Generic Stainless steel tea filter with chain ending and hook for kitchen - silver,,Kitchen,EGP 68.40,,,4.0,,,,,https://m.media-amazon.com/images/I/61KJw+Y8EEL._AC_UL320_.jpg,https://www.amazon.eg/dp/B08YNLCQJQ,2026-05-30T04:45:26.890809
amazon,,"Non Slip Drawer Liner, Clear Non-Adhesive Waterproof Mat, Kitchen Cupboard Cabinet Shelf Drawer Line",,Kitchen,EGP 99.99,,,3.9,,,,,https://m.media-amazon.com/images/I/61usLJKfaIL._AC_UL320_.jpg,https://www.amazon.eg/dp/B08G86SZGB,2026-05-30T04:45:26.891249
amazon,,"Trueval Teflon fryer Red, size 18, F18B",,Kitchen,EGP 209.00,,,4.2,,,,,https://m.media-amazon.com/images/I/61j7akvsITL._AC_UL320_.jpg,https://www.amazon.eg/dp/B0BDTM7FN5,2026-05-30T04:45:26.891677
amazon,,"4 Pack Mini Ketchup Bottle - 25ml Portable Condiment Bottles for Lunch Boxes, Picnics, Parties, Best Product Supplier PRIME SHOP",,Kitchen,EGP 83.00,,,3.7,,,,,https://m.media-amazon.com/images/I/51pKNdmBtCL._AC_UL320_.jpg,https://www.amazon.eg/dp/B0CV54TG4Q,2026-05-30T04:45:26.892120
amazon,,Pack of 50 Palm Tree Picks Cocktail Stick Decorations 6 Colours Included Wooden Sticks Dessert or Cupcake Toppers Foil Drink Accessories Bars Weddings Birthday Party Supplies,,Kitchen,EGP 198.00,,,4.5,,,,,https://m.media-amazon.com/images/I/81akMGZFLsL._AC_UL320_.jpg,https://www.amazon.eg/dp/B081B536XV,2026-05-30T04:45:26.893008
amazon,,Bosideng 1pcs foldable mesh food cover food umbrella washable picnic barbecue party anti fly mosquito net tent kitchen gadgets,,Kitchen,EGP 115.61,EGP 150.00,,3.5,List:,,,,https://m.media-amazon.com/images/I/71G68++OO0L._AC_UL320_.jpg,https://www.amazon.eg/dp/B091CWZMP2,2026-05-30T04:45:26.893520
amazon,,"AJIODA 2 Pack Metal Mesh Steel, Storage Organizer Multi-function Hanging Kitchen s Fruit Bin with Wood Handle for Kitchen Bathroom Picnic Cabinet Home Decor, Black",,Kitchen,EGP 478.00,,,4.2,,,,,https://m.media-amazon.com/images/I/71SYhTZea1L._AC_UL320_.jpg,https://www.amazon.eg/dp/B09TVMVNF4,2026-05-30T04:45:26.894821
amazon,,"Generic Fiber Solid Pattern,Multi Color - Kitchen Towels",,Kitchen,EGP 53.94,,,2.0,,,,,https://m.media-amazon.com/images/I/711WxjdOf6S._AC_UL320_.jpg,https://www.amazon.eg/dp/B096R9GNTK,2026-05-30T04:45:26.896971
amazon,,"PerGar 3-Tier Bamboo Expandable Spice Rack, Step Shelf Cabinet Organizer Step Shelf Kitchen Pantry Cabinet Expandable Display Shelf,Spice Holder Cabinet Seasoning Tower for Kitchen(#1)",,Kitchen,EGP 550.00,,,4.0,,,,,https://m.media-amazon.com/images/I/71sxEDNoltS._AC_UL320_.jpg,https://www.amazon.eg/dp/B0CCJMP8DM,2026-05-30T04:45:26.897401
amazon,,Multipurpose Cleaning Microfiber Towel - For Home And Kitchen (Pack Of 5 Towels) (Strawberry),,Kitchen,EGP 260.00,,,3.6,,,,,https://m.media-amazon.com/images/I/61iQPMNM57L._AC_UL320_.jpg,https://www.amazon.eg/dp/B0DSQVN9V7,2026-05-30T04:45:26.897853
amazon,,"Espresso Grinder Spice Grinder Mini Coffee Grinder for Home Cafe, Coffee Grinders, Home & Garden, Kitchen, Dining, Bar, Kitchen, Dining, Bar (Blue)",,Kitchen,EGP 377.00,EGP 505.41,,3.6,List:,,,,https://m.media-amazon.com/images/I/51+J1mav1wL._AC_UL320_.jpg,https://www.amazon.eg/dp/B0D1Y25W2R,2026-05-30T04:45:26.898403
amazon,,"500 Pcs Disposable Kitchen Sink Strainer Mesh Bags, Polyester Mesh, White, Modern, Anti-Clogging, Sink Strainers",,Kitchen,EGP 343.40,,,4.4,,,,,https://m.media-amazon.com/images/I/71kpGnVj9WL._AC_UL320_.jpg,https://www.amazon.eg/dp/B0BJBH2FWT,2026-05-30T04:45:26.898856
amazon,,"JOULLI Magnetic Knife Bar, Magnetic Knife Storage Strip Magnetic Kitchen Knife Holder Knife Rack Strip 33CM",,Kitchen,EGP 199.00,,,3.8,,,,,https://m.media-amazon.com/images/I/517qIjhwabL._AC_UL320_.jpg,https://www.amazon.eg/dp/B091D84M5T,2026-05-30T04:45:26.899285
amazon,,"Generic Silicone Dish Rack, Drying Stand - Kitchen Dishware Drainer",,Kitchen,EGP 112.00,,,3.6,,,,,https://m.media-amazon.com/images/I/61Sc3ut2iAL._AC_UL320_.jpg,https://www.amazon.eg/dp/B0BXBCGWVG,2026-05-30T04:45:26.899710
amazon,,"Top Chef Granite Frying Pan,Eco product,Size 24 - Black",,Kitchen,,,,4.5,,,,,https://m.media-amazon.com/images/I/61tZYoeRYPL._AC_UL320_.jpg,https://www.amazon.eg/dp/B08WJLHJZC,2026-05-30T04:45:26.900428
amazon,,"Oil Sprayer Suitable for Air Fryer Vegetable Bottle Vinegar Oil Mini Kitchen Tool for Baking, Salad, BBQ, Roasting, Best Product Supplier Pegui Belle (Silver)",,Kitchen,EGP 36.00,,,,,,,,https://m.media-amazon.com/images/I/71YJ45XRYcL._AC_UL320_.jpg,https://www.amazon.eg/dp/B0D49DZF49,2026-05-30T04:45:26.900856
amazon,,Romance 90 Sheet kitchen Towel (5+1) rolls,,Kitchen,EGP 85.00,,,2.7,,,,,https://m.media-amazon.com/images/I/61Wl1zwkArL._AC_UL320_.jpg,https://www.amazon.eg/dp/B0CD61BQ8M,2026-05-30T04:45:26.901328
amazon,,Trueval Teflon cooking pot size 28,,Kitchen,"EGP 1,059.00",,,4.2,,,,,https://m.media-amazon.com/images/I/81yJ83RPQIL._AC_UL320_.jpg,https://www.amazon.eg/dp/B0BDTLRZPX,2026-05-30T04:45:26.901760
amazon,,Fresh Stainless Steel Chopsticks Holder,,Kitchen,EGP 79.25,EGP 87.00,,3.4,List:,,,,https://m.media-amazon.com/images/I/51w0VtEE+dL._AC_UL320_.jpg,https://www.amazon.eg/dp/B07NDMFNCP,2026-05-30T04:45:26.902275
amazon,,Portable multi-function digital kitchen scale mini pocket jewelry electronic balance platform 2000g / 0.1g,,Kitchen,EGP 270.00,,,3.1,,,,,https://m.media-amazon.com/images/I/61RDn6XwbDL._AC_UL320_.jpg,https://www.amazon.eg/dp/B091CFY2DR,2026-05-30T04:45:26.902751
amazon,,"Portal Multifunctional Household Cleaning Brushes, Soft Wash Brush with Soap Dispenser for Bathroom Kitchen - Multicolor",,Kitchen,EGP 34.40,,,,,,,,https://m.media-amazon.com/images/I/61gUPWgMrqL._AC_UL320_.jpg,https://www.amazon.eg/dp/B0D3JDHMXN,2026-05-30T04:45:26.903148
amazon,,"Christmas Tablecloth 140×250 cm – Festive Rectangular Table Cover, Kitchen & Parties – Holiday Decor, Water-Resistant, Stain-Resistant Polycotton Christmas Dinner Table Cloth (Verdella)",,Kitchen,EGP 699.00,,,3.9,,,,,https://m.media-amazon.com/images/I/61xBzseEtFL._AC_UL320_.jpg,https://www.amazon.eg/dp/B0G534G2RC,2026-05-30T04:45:26.903694
amazon,,"Carrot Mechanism Clip for Reliable Closure.Snack Holder Refrigerator Magnets Versatile Kitchen Decorative Attractive., Exclusively Available in JUST.FOR.U.STORE",,Kitchen,EGP 35.63,,,5.0,,,,,https://m.media-amazon.com/images/I/51mBA2BdsOL._AC_UL320_.jpg,https://www.amazon.eg/dp/B0D5RJRNL5,2026-05-30T04:45:31.230264
amazon,,Plastic Batter Dispenser With Measuring Label For Kitchen - Multi Color,,Kitchen,EGP 169.90,,,3.9,,,,,https://m.media-amazon.com/images/I/81x5+c1iAZL._AC_UL320_.jpg,https://www.amazon.eg/dp/B08ZXTNY9M,2026-05-30T04:45:31.230705
amazon,,"Stainless Steel Fish Scaler with Wooden Handle, Serrated Edge Kitchen Tool",,Kitchen,EGP 67.00,,,,,,,,https://m.media-amazon.com/images/I/51KubRDLH0L._AC_UL320_.jpg,https://www.amazon.eg/dp/B0F5BX3LQT,2026-05-30T04:45:31.231567
amazon,,Mintra Home Transparent Food Container 1.7L-Summer blue,,Kitchen,EGP 84.00,,,4.6,,,,,https://m.media-amazon.com/images/I/61LXWKtJb4L._AC_UL320_.jpg,https://www.amazon.eg/dp/B0C1C7QQJ6,2026-05-30T04:45:31.234338
amazon,,Ifurniture Organizing Unit for Kitchen and Any Place in The House- White,,Kitchen,"EGP 2,427.00",,,3.1,,,,,https://m.media-amazon.com/images/I/71ZTBwdng5L._AC_UL320_.jpg,https://www.amazon.eg/dp/B09236SM9W,2026-05-30T04:45:31.235276
amazon,,Electronic digital kitchen scale - sf-400-10 kg,,Kitchen,EGP 122.00,EGP 143.90,,3.8,Was:,,,,https://m.media-amazon.com/images/I/61zbKcOPuJL._AC_UL320_.jpg,https://www.amazon.eg/dp/B0968ZV4G2,2026-05-30T04:45:31.236281
amazon,,"M-Design Fresco™ Lunch Box 1.6L - 2025 Exclusive - BPA Free, Microwave Safe, Dishwasher Safe, Food Safe, Stackable - Candy Red",,Kitchen,EGP 206.77,,,4.6,,,,,https://m.media-amazon.com/images/I/71cLoOb05SL._AC_UL320_.jpg,https://www.amazon.eg/dp/B0FFHCDK9D,2026-05-30T04:45:31.237158
amazon,,Food Thermometer Kitchen Digital Cooking Meat- battery included,,Kitchen,EGP 130.48,,,3.9,,,,,https://m.media-amazon.com/images/I/61AXilrT+3L._AC_UL320_.jpg,https://www.amazon.eg/dp/B08YNM11F6,2026-05-30T04:45:31.237652
amazon,,24-Piece Stainless Steel Flatware Set Service for 6 Include Knives Forks Spoons Cutlery Set for Kitchen Restaurant Dishwasher Safe (Gold*Dark Green) (Gold/Green),,Kitchen,EGP 600.00,,,3.6,,,,,https://m.media-amazon.com/images/I/61nxewMmTTL._AC_UL320_.jpg,https://www.amazon.eg/dp/B0FV97QKYL,2026-05-30T04:45:31.239425
amazon,,6 Hooks Cup Holder Hang Kitchen Cabinet Under Shelf Storage Rack Organizer Hook Assorted Color,,Kitchen,EGP 64.00,,,3.8,,,,,https://m.media-amazon.com/images/I/51G7K9UdB8L._AC_UL320_.jpg,https://www.amazon.eg/dp/B091DBYDKB,2026-05-30T04:45:31.239916
amazon,,"Kitchen Essential Oil Spray Bottle for Air Fryer, Vegetables, Vinegar, Oil, Mini Tool for Baking, Salad Decoration, BBQ, Roasting Tasks, Best Product Supplier Pegui Bell (1)",,Kitchen,EGP 40.95,,,,,,,,https://m.media-amazon.com/images/I/81jLN-TAcGL._AC_UL320_.jpg,https://www.amazon.eg/dp/B0D49K6P5C,2026-05-30T04:45:31.240773
amazon,,"TOLEAD 3 Tier Spice Rack Kitchen Counter Organizer for Essential Oils Steady Bathroom Organizer with 4 Suction Pads Large Capacity Hold Up to 66 LBS, Black",,Kitchen,EGP 800.00,,,4.1,,,,,https://m.media-amazon.com/images/I/818wkjd6ewL._AC_UL320_.jpg,https://www.amazon.eg/dp/B083QCH87T,2026-05-30T04:45:31.241232
amazon,,Silicon baking cupcake for kitchen set of 12 pieces - multi color,,Kitchen,EGP 72.00,,,3.8,,,,,https://m.media-amazon.com/images/I/51UYUhzuaTL._AC_UL320_.jpg,https://www.amazon.eg/dp/B0984L56XG,2026-05-30T04:45:31.241708
amazon,,"Umbra Udry Drying Rack Mat, Black",,Kitchen,EGP 252.09,,,4.0,,,,,https://m.media-amazon.com/images/I/61y6SFM4TXL._AC_UL320_.jpg,https://www.amazon.eg/dp/B09VLHQVBK,2026-05-30T04:45:31.242631
amazon,,"Generic Wooden Wall Hanging 3-Shelf Rustic Black Hanging Shelf Wall Mount Shelves Easy Installation Home Decor Products (Kitchen, Living Room, Bathroom, Bedroom)",,Kitchen,EGP 350.00,,,2.5,,,,,https://m.media-amazon.com/images/I/61hG2x+NkbL._AC_UL320_.jpg,https://www.amazon.eg/dp/B0C8LRJ4RX,2026-05-30T04:45:31.243524
amazon,,"Fine Kitchen Tissue Paper Super Towel Pro, 3 Ply 2 Rolls (Pack of 2)",,Kitchen,EGP 79.44,,,4.6,,,,,https://m.media-amazon.com/images/I/71z-gWrByDL._AC_UL320_.jpg,https://www.amazon.eg/dp/B0FJ8XBPNK,2026-05-30T04:45:31.244006
amazon,,"Portal Glass Pitcher with Lid and Handle – 1.5 Liter Water Jug for Juice, Tea, or Cold Brew,with Easy Pour Spout",,Kitchen,EGP 169.98,,,2.9,,,,,https://m.media-amazon.com/images/I/41oosNOQyVL._AC_UL320_.jpg,https://www.amazon.eg/dp/B0G1K6X3W4,2026-05-30T04:45:31.244440
amazon,,"Primanova Paper Towel Holder, Deluxe Upright Towel Dispenser for Kitchen Countertop and Cabinet, Heavy Duty Solid Standup Paper Towel Holders, Plastic, White.",,Kitchen,,,,3.2,,,,,https://m.media-amazon.com/images/I/41wDsFvcDWL._AC_UL320_.jpg,https://www.amazon.eg/dp/B0BW9VR6QZ,2026-05-30T04:45:31.244868
amazon,,Daisy Floral Blue Dish Drying Mat for Kitchen Counter Microfiber Absorbent Dish Drainer Mat Small Kitchen Drying Rack Mat Heat Resistant Drying Pad for Counter 16 x 18,,Kitchen,"EGP 8,271.40",,,4.5,,,,,https://m.media-amazon.com/images/I/71uo8S7JnLL._AC_UL320_.jpg,https://www.amazon.eg/dp/B09FJB9MZ5,2026-05-30T04:45:31.246181
amazon,,"Silicone Round Cake Cupcake Molds - Versatile for Cake, Jelly, Cream Caramel - Round Kitchen Accessories, Best Product Supplier Al-Israa (12)",,Kitchen,EGP 234.51,,,,,,,,https://m.media-amazon.com/images/I/61SKoR-HalL._AC_UL320_.jpg,https://www.amazon.eg/dp/B0D321NKFY,2026-05-30T04:45:31.246568
amazon,,"Tank Everyday 350ml Mug Fresh Insulated Stainless Steel, Keeps Drinks Hot, Leakproof - Mint",,Kitchen,EGP 548.98,EGP 631.00,,3.7,List:,,,,https://m.media-amazon.com/images/I/41TLnrfaE6L._AC_UL320_.jpg,https://www.amazon.eg/dp/B0FL81G3XB,2026-05-30T04:45:31.247280
amazon,,Foldable Microwave Cover Multi Functional Food Cover with Steam Vents Splatter Guard Food Splatter Guard Lid Microwave Plate Cover for Fruit Vegetables Kitchen Cooking,,Kitchen,EGP 174.59,,,4.0,,,,,https://m.media-amazon.com/images/I/61GtHWyb7HL._AC_UL320_.jpg,https://www.amazon.eg/dp/B0BRT6BD4Y,2026-05-30T04:45:31.247720
amazon,,Showay Home Kitchen Self-Adhesive Wall-Mounted Under-Shelf Spice Organizer Spice Bottle Storage Rack Kitchen Supplies Storage In Stock,,Kitchen,EGP 314.00,EGP 349.12,,3.2,List:,,,,https://m.media-amazon.com/images/I/51V2KB-lTrS._AC_UL320_.jpg,https://www.amazon.eg/dp/B098DTMSGG,2026-05-30T04:45:31.248780
amazon,,"Top Chef Granite Cooking Pot, Size 26 - Burgundy (Eco product)",,Kitchen,"EGP 1,899.00","EGP 2,100.00",,4.5,List:,,,,https://m.media-amazon.com/images/I/81AAcEnEy1L._AC_UL320_.jpg,https://www.amazon.eg/dp/B08WJJFSVJ,2026-05-30T04:45:31.249364
amazon,,"Restokki Silicone Cooking Utensil Set, Non-Stick Silicone Cooking Utensil Spatula Set with Bucket Kitchen Gadgets Utensil Set for Home",,Kitchen,EGP 334.88,,,1.0,,,,,https://m.media-amazon.com/images/I/61UMUP1BD0L._AC_UL320_.jpg,https://www.amazon.eg/dp/B09BC1SC1H,2026-05-30T04:45:31.249793
amazon,,"Launch Innovative Products Walter Wooden Valet Tray with 3 Compartment Leatherette Organizer Box for Wallets, Coins, Keys, and Jewelry",,Kitchen,"EGP 1,999.00",,,4.7,,,,,https://m.media-amazon.com/images/I/61+eoW0M4OL._AC_UL320_.jpg,https://www.amazon.eg/dp/B00CPQJM6K,2026-05-30T04:45:31.250614
amazon,,Papia Tissue - Kitchen Towel - 3 Ply - 4 Rolls (Pack of 2),,Kitchen,EGP 150.00,,,4.6,,,,,https://m.media-amazon.com/images/I/61ZbNfiS5IL._AC_UL320_.jpg,https://www.amazon.eg/dp/B0FL9MN63W,2026-05-30T04:45:31.251100
amazon,,"Decorative Outdoor Tablecloth, Printed elegant design, Indoor and Outdoor Dining, Great for all Occasions, Perfect for Ramadan Iftar Gatherings. Size 140x250cm. (Mediterranean Mosaic)",,Kitchen,EGP 800.61,,,4.4,,,,,https://m.media-amazon.com/images/I/91MiUAfibKL._AC_UL320_.jpg,https://www.amazon.eg/dp/B0DTKQFX5W,2026-05-30T04:45:31.251682
amazon,,Familia Tissue - Kitchen Towel - Plus 12 Rolls,,Kitchen,EGP 139.99,,,4.6,,,,,https://m.media-amazon.com/images/I/81t8qlkRAeL._AC_UL320_.jpg,https://www.amazon.eg/dp/B08YY1TBMF,2026-05-30T04:45:34.364931
amazon,,"Premium Granite Frying Pan Set 3 Pieces 20/24/28– Nonstick Skillet Cookware Set, Durable, black",,Kitchen,"EGP 1,799.00",,,5.0,,,,,https://m.media-amazon.com/images/I/41zM8gqaGbL._AC_UL320_.jpg,https://www.amazon.eg/dp/B0GN3MG517,2026-05-30T04:45:34.365475
amazon,,"Premium Granite Pan – Nonstick Cooking Pan, Heavy Duty Durable Cookware, Turquoise, Scratch-Resistant, Easy to Clean, Perfect for Everyday Cooking",,Kitchen,EGP 613.98,,,,,,,,https://m.media-amazon.com/images/I/41Gpb3op8mL._AC_UL320_.jpg,https://www.amazon.eg/dp/B0GN3N93R5,2026-05-30T04:45:34.365955
amazon,,Bugatti | Kitchen Tool Set | UTENSILI SETTIMOCIELO | SET 5+1 Pieces with rack,,Kitchen,"EGP 10,173.77",,,,,,,,https://m.media-amazon.com/images/I/511TTy-QK0L._AC_UL320_.jpg,https://www.amazon.eg/dp/B0D9NWPXYG,2026-05-30T04:45:34.366420
amazon,,Microwave Stand & Shelves Kitchen,,Kitchen,EGP 318.19,,,3.3,,,,,https://m.media-amazon.com/images/I/61h33y6Go-L._AC_UL320_.jpg,https://www.amazon.eg/dp/B09GW52Q3Z,2026-05-30T04:45:34.368383
amazon,,Nice Life Kitchen Towels 200 gm,,Kitchen,EGP 29.80,,,,,,,,https://m.media-amazon.com/images/I/51LoLb4OaSL._AC_UL320_.jpg,https://www.amazon.eg/dp/B0DJKC9TC1,2026-05-30T04:45:34.369627
amazon,,"PARMEDU Classic Mini Wooden Rolling Pin 10.2 Inch, Rotating Centre Dough Roller with Handles for Kitchen Crafting and Imaginative Play, Model BK005",,Kitchen,EGP 147.00,,,3.7,,,,,https://m.media-amazon.com/images/I/613M4LqexrL._AC_UL320_.jpg,https://www.amazon.eg/dp/B0BZPQ6N8R,2026-05-30T04:45:34.371354
amazon,,"Silicone Kitchen Ladle with Perforated Design, Long Handle with Grip, Cream and Rose Gold, 30 cm",,Kitchen,EGP 95.00,,,,,,,,https://m.media-amazon.com/images/I/51BTufYKceL._AC_UL320_.jpg,https://www.amazon.eg/dp/B0F5BM1P2X,2026-05-30T04:45:34.374034
amazon,,"Stainless Steel Slotted Serving Spoon, Long Handle Kitchen Utensil",,Kitchen,EGP 130.00,,,4.5,,,,,https://m.media-amazon.com/images/I/51oiITbyfQL._AC_UL320_.jpg,https://www.amazon.eg/dp/B0F5BJCL22,2026-05-30T04:45:34.374538
amazon,,"Pasta Server Spoon, Long Handle Slotted Serving Ladle, Kitchen Utensil",,Kitchen,EGP 130.00,,,5.0,,,,,https://m.media-amazon.com/images/I/41E5-JBAROL._AC_UL320_.jpg,https://www.amazon.eg/dp/B0F5BJFH2T,2026-05-30T04:45:34.375125
amazon,,"Spaceshoop Large Natural Wood Spoon – Eco-Friendly Wooden Cooking Spoon for Kitchen Use, Durable and Heat Safe, 1 Piece",,Kitchen,EGP 59.90,,,,,,,,https://m.media-amazon.com/images/I/411ZAGtDNhL._AC_UL320_.jpg,https://www.amazon.eg/dp/B0GQ62TGJD,2026-05-30T04:45:34.375589
amazon,,"Home Decor Wooden Wall Hanging Shelves Wall Mount Shelves Kitchen Living Room Bathroom Bedroom Easy Installation Home Decor Products (White, Zipper 3 Pieces)",,Kitchen,EGP 206.00,,,2.5,,,,,https://m.media-amazon.com/images/I/61E-X1bxOAL._AC_UL320_.jpg,https://www.amazon.eg/dp/B0C8LS436C,2026-05-30T04:45:34.376043
amazon,,"Silicone Round Cake Cupcake Molds - Versatile for Cake, Jelly, Cream Caramel - Round Kitchen Accessories, Best Product Supplier Al-Israa (24)",,Kitchen,EGP 294.06,,,,,,,,https://m.media-amazon.com/images/I/618DLIJv3bL._AC_UL320_.jpg,https://www.amazon.eg/dp/B0D321SNLT,2026-05-30T04:45:34.377712
amazon,,"4 Pcs Refrigerator Mats, Inner fridge cover, Can Be Cut Refrigerator Pads, Vegetable, Fruits Fresh Pad Drawer, Table Placemats Cabinet, Protective Pads, Shelves Drawer Mats. (Assorted colors)",,Kitchen,EGP 41.33,,,3.7,,,,,https://m.media-amazon.com/images/I/61c7pEfNAZL._AC_UL320_.jpg,https://www.amazon.eg/dp/B0BV34TNV2,2026-05-30T04:45:34.378225
amazon,,Aksa Leather Set 7 Pieces Brown,,Kitchen,"EGP 1,050.00",,,,,,,,https://m.media-amazon.com/images/I/81AyvKQTgnL._AC_UL320_.jpg,https://www.amazon.eg/dp/B0DVCCV2NH,2026-05-30T04:45:34.378669
amazon,,Berghoff - santoku knife 17.5cm slate 38.5x6.8x2,,Kitchen,EGP 868.75,,,4.4,,,,,https://m.media-amazon.com/images/I/51r-yhh1nDL._AC_UL320_.jpg,https://www.amazon.eg/dp/B0BC6FKK19,2026-05-30T04:45:34.379722
amazon,,"Labell Boards L14100 Canadian Cutting Board with Groove/Steak Plate, Maple",,Kitchen,"EGP 1,499.00",,,3.2,,,,,https://m.media-amazon.com/images/I/81DZGt9p0AL._AC_UL320_.jpg,https://www.amazon.eg/dp/B00PHAYE6Y,2026-05-30T04:45:34.380631
amazon,,"Woven It Handmade Cotton round Havan small Bowl 14cm x 7cm, can be used in Kitchen, toilet, bedroom, kids room, living room, dining room, inside and outside.",,Kitchen,EGP 175.00,,,,,,,,https://m.media-amazon.com/images/I/6150OVyCq1L._AC_UL320_.jpg,https://www.amazon.eg/dp/B0G1KLJJ89,2026-05-30T04:45:34.381937
amazon,,Pasabahce Juice Cups Set of 6 - Ambassador- 260 ml - Turkey Origin,,Kitchen,EGP 401.81,,,3.9,,,,,https://m.media-amazon.com/images/I/61ecrF5myJL._AC_UL320_.jpg,https://www.amazon.eg/dp/B0BRBGZ9DF,2026-05-30T04:45:34.382367
amazon,,"IKEA Frakta 5013144005249 Bag for Trolley, Polypropylene, Blue, 73 x 35 x 30 cm",,Kitchen,EGP 450.00,,,4.4,,,,,https://m.media-amazon.com/images/I/61jIKiPiTbL._AC_UL320_.jpg,https://www.amazon.eg/dp/B00WSUJC40,2026-05-30T04:45:34.382789
amazon,,Stainless Steel Frying Chef Basket (Assorted Colors),,Kitchen,EGP 339.00,,,4.1,,,,,https://m.media-amazon.com/images/I/71vIdowTvjL._AC_UL320_.jpg,https://www.amazon.eg/dp/B091CLR1M3,2026-05-30T04:45:34.383298
