platform,asin,title,brand,category,current_price,original_price,discount,rating,reviews_count,prime_eligible,amazon_choice,sponsored,main_image,product_url,scraped_at
amazon,,"Woven it - Cotton round mixed Black & Beige small Basket 14cm x 7cm, storage basket & organizer.Can be used in Kitchen,Dining Room,Living room,Bed room,Kids Room,Bathroom,Indoor &outdoor.",,Kitchen,EGP 195.00,,,,,,,,https://m.media-amazon.com/images/I/71AwD39fYTL._AC_UL320_.jpg,https://www.amazon.eg/dp/B0G524R8WX,2026-05-30T04:45:34.383684
amazon,,"Greaseproof Paper Parchment For Cooking High Temperature Resistance Baking Donuts Paper Sheets For Oven liners, Microwave and Refrigerator (5M)",,Kitchen,EGP 145.00,,,3.9,,,,,https://m.media-amazon.com/images/I/51kCg0Dl5wL._AC_UL320_.jpg,https://www.amazon.eg/dp/B0D8RYX9VY,2026-05-30T04:45:34.384178
amazon,,"ZPAC Printed Dinosaur Slider Ziplock Bags 30-Pieces, 20 cm x 20 cm Size",,Kitchen,EGP 97.00,,,4.4,,,,,https://m.media-amazon.com/images/I/61+YenrqsGL._AC_UL320_.jpg,https://www.amazon.eg/dp/B0DWXRR3VP,2026-05-30T04:45:34.384659
amazon,,Espresso Accessory Kit - Black Ceramic Single Dosing Tray & 8ml Aluminum Spray Bottle for Espresso Coffee,,Kitchen,EGP 699.00,,,4.6,,,,,https://m.media-amazon.com/images/I/51t+shLJC8L._AC_UL320_.jpg,https://www.amazon.eg/dp/B0CLJLN9SD,2026-05-30T04:45:34.385117
amazon,,"Woven It Handmade Cotton round Yellow small Bowl 14cm x 7cm, can be used in Kitchen, toilet, bedroom, kids room, living room, dining room, inside and outside.",,Kitchen,EGP 175.00,,,,,,,,https://m.media-amazon.com/images/I/61LSUmDeu2L._AC_UL320_.jpg,https://www.amazon.eg/dp/B0G1K6ZFYB,2026-05-30T04:45:34.385489
amazon,,"QSHOP Stainless Steel Vacuum Flask Set with 3 Cups (500ml) Keeps Drinks Hot or Cold for Hours, Perfect for Travel, Outdoor Adventures, Office Use (Gray)",,Kitchen,EGP 213.00,,,2.9,,,,,https://m.media-amazon.com/images/I/61hrU3nYc7L._AC_UL320_.jpg,https://www.amazon.eg/dp/B0DJFNHK59,2026-05-30T04:45:34.386067
amazon,,"Woven It Handmade Cotton round Beige basket 22cm x 8cm, storage basket & organizer.Can be used in Kitchen,Dining Room,Living room,Bed room,Kids Room,Bathroom,Indoor &outdoor.",,Kitchen,EGP 375.00,,,,,,,,https://m.media-amazon.com/images/I/819XgcjoiUL._AC_UL320_.jpg,https://www.amazon.eg/dp/B0G3MVW91Z,2026-05-30T04:45:34.386447
amazon,,"Blanketswarm 2Pcs Drinking Glasses,Beer Can Glass Tumbler Glasses Can Shaped Beer Glasses Ice Coffee Cup for Milk Coffee Ice Water Cocktail",,Kitchen,"EGP 1,047.38",,,3.6,,,,,https://m.media-amazon.com/images/I/51bs6gtnMeL._AC_UL320_.jpg,https://www.amazon.eg/dp/B09XXLX9Y7,2026-05-30T04:45:34.387009
amazon,,"Woven it Handmade Cotton Oval Baby Blue Organizer Plate with wood accessories 27cm x 15cm x 6cm, can be used in Kitchen, toilet, bedroom, kids room, living room, dining room, inside and outside.",,Kitchen,EGP 350.00,,,,,,,,https://m.media-amazon.com/images/I/61z9RZ4CD9L._AC_UL320_.jpg,https://www.amazon.eg/dp/B0G1KG47HX,2026-05-30T04:45:34.387387
amazon,,Artistic 8 Pieces Clear White Plastic Jar 200ml - 7 Cents Diameter - Smooth Blue Lid and Plastic Medicine - High Quality Healthy Plastic Empty Refill Box Storage Jar - By Funi(Blue Smooth Cover),,Kitchen,EGP 269.00,,,3.3,,,,,https://m.media-amazon.com/images/I/51FRGFyIPTL._AC_UL320_.jpg,https://www.amazon.eg/dp/B0BRBM2ZN3,2026-05-30T04:45:34.387820
amazon,,Joker Beige * Brown Applied,,Kitchen,EGP 384.28,,,4.4,,,,,https://m.media-amazon.com/images/I/41fRcrJcXFL._AC_UL320_.jpg,https://www.amazon.eg/dp/B0DVQC55F2,2026-05-30T04:45:34.388328
amazon,,"Artistic 8-Piece Plastic Jar - White Clear, 200ml, 7cm Diameter, Black Smooth Lid & Healthy Refill Storage Jar",,Kitchen,EGP 269.00,,,4.6,,,,,https://m.media-amazon.com/images/I/51FN6of+qbL._AC_UL320_.jpg,https://www.amazon.eg/dp/B0BRBPWJCP,2026-05-30T04:45:34.388761
amazon,,"Artistic 8-Piece Clear White Plastic Jar Set - 200ml, 7 Inch Diameter, Silver Smooth Lids , Healthy Plastic Storage Jars",,Kitchen,EGP 269.00,,,4.6,,,,,https://m.media-amazon.com/images/I/51JB6Sg7-QL._AC_UL320_.jpg,https://www.amazon.eg/dp/B0BRBPND65,2026-05-30T04:45:34.389203
amazon,,"Artistic 8-Piece 200ml Round Plastic Jars - 7 Inch Diameter - Smooth Gold Lids - Food Grade, Leak Resistant, Vacuum Refill - Minimalist Storage Jars",,Kitchen,EGP 269.00,,,4.6,,,,,https://m.media-amazon.com/images/I/51Z8VZgH+iL._AC_UL320_.jpg,https://www.amazon.eg/dp/B0BRBPVSKS,2026-05-30T04:45:34.389622
amazon,,"Ikea GODMORGON Plastic Square Box with Lid (Clear, Standard) - Set of 5",,Kitchen,"EGP 1,199.00",,,4.3,,,,,https://m.media-amazon.com/images/I/71Zr4rUE4aL._AC_UL320_.jpg,https://www.amazon.eg/dp/B07TFH1JYL,2026-05-30T04:45:34.390068
amazon,,CHT LINA (4) BLUE DIFFERENT GRAPHICS,,Kitchen,EGP 239.00,,,5.0,,,,,https://m.media-amazon.com/images/I/71hsGK-DxJL._AC_UL320_.jpg,https://www.amazon.eg/dp/B0CNNNWMYS,2026-05-30T04:45:34.390502
amazon,,"Spaceshoop Modern Arabic Calligraphy Oil and Spice Dispenser Set with Rotating Bamboo Base, Stylish and Functional Kitchen Organizer White",,Kitchen,EGP 799.90,,,,,,,,https://m.media-amazon.com/images/I/41GZGBLrQhL._AC_UL320_.jpg,https://www.amazon.eg/dp/B0GPY6LHHF,2026-05-30T04:45:34.390970
amazon,,"Decorative Wooden Slotted Spoon with Marble Effect Handle, Black and Natural Wood Kitchen Utensil",,Kitchen,EGP 90.00,,,3.0,,,,,https://m.media-amazon.com/images/I/61jsr-Wq9mL._AC_UL320_.jpg,https://www.amazon.eg/dp/B0F5BKQ2JF,2026-05-30T04:45:34.391463
amazon,,"Slotted Spatula Fork, Rose Gold Kitchen Utensil, Long Handle",,Kitchen,EGP 110.00,,,,,,,,https://m.media-amazon.com/images/I/517QCGxSSJL._AC_UL320_.jpg,https://www.amazon.eg/dp/B0F5BM3BQG,2026-05-30T04:45:34.391926
amazon,,"Stainless Steel Slotted Cooking Spoon, Long Handle, White Grip",,Kitchen,EGP 120.00,,,5.0,,,,,https://m.media-amazon.com/images/I/51YNtJkhU7L._AC_UL320_.jpg,https://www.amazon.eg/dp/B0F5BPF17Z,2026-05-30T04:45:34.392429
amazon,,Ihram Clothing for Men Umrah | Ehram Ahram for Men for Hajj and Umrah - 2 Towels - Hygienic Natural 100% Cotton Towels 100cm x 220cm,,Kitchen,"EGP 1,600.00",,,4.2,,,,,https://m.media-amazon.com/images/I/713bq7WeOFL._AC_UL320_.jpg,https://www.amazon.eg/dp/B0C7D1384X,2026-05-30T04:45:38.007331
amazon,,"50ml Amber Glass Dropper Bottle (5 Pack), Brown Empty Glass Dropper Bottle with Glass Dropper Straws ~ UV Resistant, Refillable Containers for Essential Oils, Aromatherapy",,Kitchen,EGP 275.00,,,,,,,,https://m.media-amazon.com/images/I/41kgAgnzmdL._AC_UL320_.jpg,https://www.amazon.eg/dp/B0CVNPVVLZ,2026-05-30T04:45:38.007733
amazon,,"Festiko Pink Tealight Candles, Pack of 50 Pcs, Unscented, Aluminum Cup, Smokeless Wick, Diwali Decoration, Modern Style, Birthday & Festival Theme",,Kitchen,EGP 239.40,,,3.1,,,,,https://m.media-amazon.com/images/I/51QJlCY2l9L._AC_UL320_.jpg,https://www.amazon.eg/dp/B0CMDD77S6,2026-05-30T04:45:38.008214
amazon,,Oblivion Plastic Deer/Antlers Jewelry Holder Deer Tree | Creative Sika Deer Tree Tray Display Stand Holder (Black),,Kitchen,EGP 75.00,,,2.7,,,,,https://m.media-amazon.com/images/I/61N-s8KeXzL._AC_UL320_.jpg,https://www.amazon.eg/dp/B0CBFWJ5JX,2026-05-30T04:45:38.008658
amazon,,Mengshen Portable Luggage Scale/Hanging Suitcase Scale Steelyard 110lb /50kg Luggage Weighing Scale Backlit LCD Display with Fishing Hanging Hook for Home Travel Outdoor Black,,Kitchen,EGP 165.00,EGP 1.83,,4.3,(,,,,https://m.media-amazon.com/images/I/51VmCJmHG+L._AC_UL320_.jpg,https://www.amazon.eg/dp/B07GR3LWRD,2026-05-30T04:45:38.009206
amazon,,Levi's Graphic V-Neck Tee for Men,,Kitchen,"EGP 1,108.00",,,3.6,,,,,https://m.media-amazon.com/images/I/51tRh4T3o7L._AC_UL320_.jpg,https://www.amazon.eg/dp/B08L5T5ZRS,2026-05-30T04:45:38.009675
amazon,,"Max Comfort U-Shaped Neck Support Travel Pillow – Soft and Compressed Memory Foam, Navy Blue",,Kitchen,EGP 388.45,,,3.2,,,,,https://m.media-amazon.com/images/I/6167ZBap-VL._AC_UL320_.jpg,https://www.amazon.eg/dp/B0FJ7FP86S,2026-05-30T04:45:38.010133
amazon,,"DeFacto Man Fit Knitted Oversize Fit Hooded Short Sleeve T-Shirt D6708AX, Beige XL",,Kitchen,"EGP 1,297.00",,,,,,,,https://m.media-amazon.com/images/I/614hVN6WOaL._AC_UL320_.jpg,https://www.amazon.eg/dp/B07XCWJ4FM,2026-05-30T04:45:38.010516
amazon,,RED COTTON Women New model UNDERWEAR,,Kitchen,EGP 168.00,,,,,,,,https://m.media-amazon.com/images/I/716L2E7+j8L._AC_UL320_.jpg,https://www.amazon.eg/dp/B09YWNT1P1,2026-05-30T04:45:38.010903
amazon,,"Xinxin Small Stainless Steel Knife Set, 6 Pieces - Multi Color",,Kitchen,EGP 70.29,EGP 79.34,,3.7,List:,,,,https://m.media-amazon.com/images/I/61y2HTyrF6L._AC_UL320_.jpg,https://www.amazon.eg/dp/B0CKTY42HY,2026-05-30T04:45:38.011847
amazon,,"Plastic Bowls Set, Multi Sizes, Large Salad Bowl with Matching Small Bowls, Durable and Light Design for Everyday Use, Serving Meals, Snacks, Food Prep for Fruits, Salads, Desserts",,Kitchen,EGP 350.00,,,,,,,,https://m.media-amazon.com/images/I/41GjxPHq5OL._AC_UL320_.jpg,https://www.amazon.eg/dp/B0G5HK41BN,2026-05-30T04:45:38.012228
amazon,,M-DESIGN 2.3L Food Container - Clear with Red Clips,,Kitchen,EGP 160.00,,,4.7,,,,,https://m.media-amazon.com/images/I/61lEVL7sUzL._AC_UL320_.jpg,https://www.amazon.eg/dp/B0BRN3X7H8,2026-05-30T04:45:38.012648
amazon,,RONZA Kitchen Cleaning Cloth Roll 20 Pcs/Roll (Pack of 2),,Kitchen,EGP 150.48,,,4.6,,,,,https://m.media-amazon.com/images/I/61SYBAYclTL._AC_UL320_.jpg,https://www.amazon.eg/dp/B0FLB4QQ8Y,2026-05-30T04:45:38.013582
amazon,,Generic Kitchen Turbo Trolley Organizer 3-Shelf White Plastic Cart,,Kitchen,EGP 299.99,,,3.9,,,,,https://m.media-amazon.com/images/I/41G2RznY9rS._AC_UL320_.jpg,https://www.amazon.eg/dp/B097QL749Y,2026-05-30T04:45:38.014441
amazon,,"Olive Oil Sprayer for Cooking, 210ml Glass Oil Spray Mister Dispenser Bottles,kitchen Gadgets Accessories for Air Fryer,Widely used for Salad Making,Baking Frying, BBQ (Black)",,Kitchen,EGP 68.24,,,3.5,,,,,https://m.media-amazon.com/images/I/41U0ch94+TL._AC_UL320_.jpg,https://www.amazon.eg/dp/B0CBKQJ56Z,2026-05-30T04:45:38.014884
amazon,,Other Yeeng Set Of 12 Kitchen Towel - Multi Color,,Kitchen,EGP 43.32,,,3.8,,,,,https://m.media-amazon.com/images/I/51Tv1OMVvxL._AC_UL320_.jpg,https://www.amazon.eg/dp/B09BP5ZR5G,2026-05-30T04:45:38.015324
amazon,,"Achievers XSKY 3 Piece Kitchen Funnel with Detachable Strainer/Filter for Easy Transfer of Cooking Oil, Water, Powder, Sauce,ghee (Pack of 3pcs + Detachable Filter)",,Kitchen,EGP 139.00,,,4.4,,,,,https://m.media-amazon.com/images/I/51Dgvr3+gsL._AC_UL320_.jpg,https://www.amazon.eg/dp/B0C4TQGWH4,2026-05-30T04:45:38.015743
amazon,,"Cutlery drainer, Kitchen Cutlery, Utensil Holder, Acrylic Fork and Spoon Strainer, Plastic Drain Storage Holder for Spoons, Forks, Chopsticks, and Cooking Tools - Durable Tray & Shelf Box",,Kitchen,EGP 229.00,,,4.7,,,,,https://m.media-amazon.com/images/I/514TAo8rhbL._AC_UL320_.jpg,https://www.amazon.eg/dp/B0DK27VM2K,2026-05-30T04:45:38.016185
amazon,,Elisco Embellished Large Butter Box with Lid Ceramics Butter Keeper Container with Knife and Silicone Sealing Butter Dishes with Covers Kitchen Home Gift (650 ML)- White,,Kitchen,"EGP 1,100.00",,,4.0,,,,,https://m.media-amazon.com/images/I/61Y7UGMHh2L._AC_UL320_.jpg,https://www.amazon.eg/dp/B09Y96Y4G3,2026-05-30T04:45:38.016610
amazon,,"6-Piece Glass Set for Water, Juice, and Cold Drinks – Elegant Clear Drinking Cups for Home, Kitchen, Guests & Everyday Use – Durable Glassware with Comfortable Grip, Easy to Clean, Perfect for Familie",,Kitchen,EGP 209.00,,,5.0,,,,,https://m.media-amazon.com/images/I/51z2OAB-TqL._AC_UL320_.jpg,https://www.amazon.eg/dp/B0G4N6G7Z9,2026-05-30T04:45:38.017082
amazon,,Zeina Kitchen TRIO - 5 + 1 Rolls,,Kitchen,EGP 158.00,EGP 185.00,,4.6,List:,,,,https://m.media-amazon.com/images/I/610PKRphdZL._AC_UL320_.jpg,https://www.amazon.eg/dp/B0CKY1529W,2026-05-30T04:45:38.017614
amazon,,"AMIR Digital Kitchen Scale, High Precision Letter Scale, 3kg x 0.1g Digital Scale - Silver",,Kitchen,EGP 232.00,EGP 250.00,,3.4,List:,,,,https://m.media-amazon.com/images/I/71TNjtmDjmL._AC_UL320_.jpg,https://www.amazon.eg/dp/B01DKIYELO,2026-05-30T04:45:38.018135
amazon,,"Hanging Kitchen Dustbin Bucket with Lid, 7 Liter Capacity, Space-Saving Waste Bin for Cabinet Doors, Compact Garbage Container,27.8 x 17.8 x 23.3 cm. Beige",,Kitchen,EGP 260.00,,,4.7,,,,,https://m.media-amazon.com/images/I/51Y66cbiATL._AC_UL320_.jpg,https://www.amazon.eg/dp/B0FR3Q1SD8,2026-05-30T04:45:38.018565
amazon,,"Top Chef Granite Square Cooking Pot, Size 28 - Black (Eco product)",,Kitchen,"EGP 2,099.00",,,4.6,Get it faster,,,,https://m.media-amazon.com/images/I/61DLNi4BPrL._AC_UL320_.jpg,https://www.amazon.eg/dp/B08WJJQM92,2026-05-30T04:45:38.019192
amazon,,Elegant Design Kitchen Coffee Corner Pineapple 9-Piece Laser Cut Wooden Wall Decoration Product Wall Art (Large),,Kitchen,EGP 330.00,,,3.2,,,,,https://m.media-amazon.com/images/I/51d4h7eLoRL._AC_UL320_.jpg,https://www.amazon.eg/dp/B0DCW72WMT,2026-05-30T04:45:38.019657
amazon,,"Next Store Bamboo Rectangular Serving Tray Set, Practical Waterproof Chic Serving Trays Suitable for Serving Breakfast, Sali, Fruits, Pastries, Imported Quality Product (Beige)",,Kitchen,EGP 348.77,EGP 360.00,,2.5,List:,,,,https://m.media-amazon.com/images/I/51iMWI+OyFL._AC_UL320_.jpg,https://www.amazon.eg/dp/B0G82NHXRC,2026-05-30T04:45:38.020205
amazon,,"Qasem small oil absorbent kitchen roll, 50 pieces - assorted color",,Kitchen,EGP 57.35,,,3.8,,,,,https://m.media-amazon.com/images/I/61ikx25q+8L._AC_UL320_.jpg,https://www.amazon.eg/dp/B08Y91D9KZ,2026-05-30T04:45:38.020645
amazon,,"ZEVON Oil Dispenser Bottle for Kitchen 500ml (1 piece) Glass Olive Oil Dispenser, Oil and Vinegar Dispenser Set with Silica Gel Pourers, Weighted Pourer, Drip Free Spout",,Kitchen,EGP 110.00,,,3.4,,,,,https://m.media-amazon.com/images/I/61gmRDPJDNL._AC_UL320_.jpg,https://www.amazon.eg/dp/B0CZ7BSQK3,2026-05-30T04:45:38.021111
amazon,,"Multifunction Various Digital Kitchen Food Scale, 5KG",,Kitchen,EGP 251.00,EGP 359.00,,4.0,List:,,,,https://m.media-amazon.com/images/I/51eYi4njjyL._AC_UL320_.jpg,https://www.amazon.eg/dp/B091BNTQMB,2026-05-30T04:45:38.021596
amazon,,"mDesign Metal Under Shelf Hanging Storage Basket with Open Front for Organizing Kitchen Cabinets, Cabinets, Shelves - Large, 2 Pack - White",,Kitchen,EGP 193.80,,,4.2,,,,,https://m.media-amazon.com/images/I/61PR5rzxGsL._AC_UL320_.jpg,https://www.amazon.eg/dp/B07BH17BS1,2026-05-30T04:45:38.022517
amazon,,"DPWEION Dish Drainer Rack for Kitchen-Metal Dishes Drying Rack with Drip Tray/Cutlery Holder/Wooden Handles-Draining Board Racks(43x31x12cm,Black)",,Kitchen,EGP 474.95,,,4.5,,,,,https://m.media-amazon.com/images/I/61lLpnSQNxL._AC_UL320_.jpg,https://www.amazon.eg/dp/B0DV4TVC2C,2026-05-30T04:45:38.023046
amazon,,Bosch Kitchen Appliance Coffee Grinder - TSM6A011W,,Kitchen,"EGP 2,300.00","EGP 2,455.73",,4.5,List:,,,,https://m.media-amazon.com/images/I/51NOPbrhFBL._AC_UL320_.jpg,https://www.amazon.eg/dp/B07HPJLZB2,2026-05-30T04:45:38.023532
amazon,,"Electronic Kitchen Scale - 30kg , 2724446814202",,Kitchen,"EGP 1,699.00",,,3.1,,,,,https://m.media-amazon.com/images/I/610UyQ30kvL._AC_UL320_.jpg,https://www.amazon.eg/dp/B099DRGTXJ,2026-05-30T04:45:38.024473
amazon,,Cooking tools hamburger & patties maker burger hamburger press meat press cookware kitchen dining bar tool,,Kitchen,EGP 100.34,EGP 110.00,,3.7,Was:,,,,https://m.media-amazon.com/images/I/61rNr-iT-CL._AC_UL320_.jpg,https://www.amazon.eg/dp/B08Z48Z921,2026-05-30T04:45:38.024982
amazon,,"Tognana Madison 18-Piece Porcelain Dinnerware Set, Portofino Pattern",,Kitchen,"EGP 3,599.00",,,4.0,,,,,https://m.media-amazon.com/images/I/71BKrSuk9eL._AC_UL320_.jpg,https://www.amazon.eg/dp/B0CNDDH637,2026-05-30T04:45:38.025521
amazon,,The SR Brand Alloy Steel (Pack of 1) Self-Adhesive Shelf/Storage Organizer for Bathroom and Kitchen Corner Wall Mounted Rack Shelf Bathroom Accessories Storage Rack (No Drilling) (Black),,Kitchen,EGP 110.00,,,3.5,,,,,https://m.media-amazon.com/images/I/51L2AMCXrFL._AC_UL320_.jpg,https://www.amazon.eg/dp/B0FF1T75KN,2026-05-30T04:45:38.025987
amazon,,BonZeal Good Morning Water Glasses Gift Item Unique Premium Stylish Transparent Juice Drinking Glass 350 ml,,Kitchen,EGP 232.00,,,3.8,,,,,https://m.media-amazon.com/images/I/51YT5tHFKmL._AC_UL320_.jpg,https://www.amazon.eg/dp/B0B571B7L4,2026-05-30T04:45:38.026424
amazon,,"Xectes 3 in1 Manual Rotary Cheese Grater and Shredder - Round Mandoline Slicer for Kitchen Salad, Vegetable, Potato - Strong Suction, Chopper",,Kitchen,EGP 194.50,EGP 220.00,,2.6,List:,,,,https://m.media-amazon.com/images/I/61cXVygqkiL._AC_UL320_.jpg,https://www.amazon.eg/dp/B0B53J4LP8,2026-05-30T04:45:38.027971
amazon,,Berghoff - spoon rest pink 17.3x13.1x5.08,,Kitchen,EGP 671.93,,,4.6,,,,,https://m.media-amazon.com/images/I/51mzHGrjybL._AC_UL320_.jpg,https://www.amazon.eg/dp/B075JDW7L6,2026-05-30T04:45:38.028395
amazon,,"Storage trolley HUA Folding Kitchen Storage Trolley, Metal Mobile Rolling Trolley, Unit Trolley Organizer, Home Living Room Bathroom Utility Cart, 3 Specifications (Size : 3 layers)",,Kitchen,"EGP 2,500.00","EGP 3,334.00",,4.2,List:,,,,https://m.media-amazon.com/images/I/51xXmvsm7JL._AC_UL320_.jpg,https://www.amazon.eg/dp/B08P7K9ZZD,2026-05-30T04:45:38.028965
amazon,,"Arabest Silicone Cooking Utensil Set,Silicone Kitchen Utensil Set-13pcs,Wooden Handles Utensils Tool for Nonstick Cookware,Non Toxic Heat Resistant Kitchen Tools Set With Storage Bucket And Lid Rest",,Kitchen,,,,4.6,,,,,https://m.media-amazon.com/images/I/71b22IFrykL._AC_UL320_.jpg,https://www.amazon.eg/dp/B0953J5B3C,2026-05-30T04:45:38.029399
amazon,,Rosa Bayern Marble Rose mug,,Kitchen,,,,4.1,,,,,https://m.media-amazon.com/images/I/61PVI-+qkiL._AC_UL320_.jpg,https://www.amazon.eg/dp/B0DJ9LQWSF,2026-05-30T04:45:42.378134
amazon,,"8 Pcs Mini Ketchup Bottles,25ml Condiment Squeeze Bottle,Plastic Portable Containers Bottle for Kids,Office,Lunchbox,Picnic,Oil,Soy Sauce,Honey,Salad Dressing",,Kitchen,EGP 119.70,,,4.1,,,,,https://m.media-amazon.com/images/I/71iaKKGBPvL._AC_UL320_.jpg,https://www.amazon.eg/dp/B0BJ8RDT6G,2026-05-30T04:45:42.378600
amazon,,"Mintra Tritan Anti-Spill Water Bottle, 500 ml - Grey",,Kitchen,EGP 112.23,EGP 137.00,,4.2,List:,,,,https://m.media-amazon.com/images/I/51DeI+LRWJL._AC_UL320_.jpg,https://www.amazon.eg/dp/B08WJKC74Q,2026-05-30T04:45:42.379276
amazon,,3A Proqueen File Holder 27X10X30 Cm - Blue 8311,,Kitchen,EGP 121.53,,,2.7,,,,,https://m.media-amazon.com/images/I/410oR3S8AaL._AC_UL320_.jpg,https://www.amazon.eg/dp/B0DD7JBF1H,2026-05-30T04:45:42.379782
amazon,,"Turbo 4 role stronger, grow and kill trolley",,Kitchen,EGP 226.86,EGP 262.00,,3.4,List:,,,,https://m.media-amazon.com/images/I/71LiIBA5yPL._AC_UL320_.jpg,https://www.amazon.eg/dp/B09HP2VYG9,2026-05-30T04:45:42.380328
amazon,,"Stainless Steel Ball Herb Strainer with Compression Scissors Handle for Loose Leaf Tea and Herbal Mixes, Perfect for Tea, Healthy Drinks, Cooking Use, Best Product Supplier Al-Israa (1 Piece))",,Kitchen,EGP 38.48,,,,,,,,https://m.media-amazon.com/images/I/612WDmbT-AL._AC_UL320_.jpg,https://www.amazon.eg/dp/B0D4DMDRC9,2026-05-30T04:45:42.380711
amazon,,M-Design Lifestyle deep plate 20 cm - teal,,Kitchen,EGP 36.00,,,4.5,,,,,https://m.media-amazon.com/images/I/61SeEt1065L._AC_UL320_.jpg,https://www.amazon.eg/dp/B09NWS241J,2026-05-30T04:45:42.381266
amazon,,"TRAMONTINA Set, Premium Set Designed for Everyday Use (Ipanema, BBQ Knife Set, 3-Piece, Polypropylene, Blue, 8.4-Inch, Stainless Steel Finish, 3 BBQ Knives)",,Kitchen,EGP 213.04,EGP 263.17,,4.6,Was:,,,,https://m.media-amazon.com/images/I/71c3ilVyqZL._AC_UL320_.jpg,https://www.amazon.eg/dp/B076MBN5QG,2026-05-30T04:45:42.381762
amazon,,"kunlisa Christmas Mug Cup,Merry Christmas Santa Gnomes Ceramic Mug-11oz Coffee Milk Tea Mug Cup,Home Girls Room Decor,Christmas Gifts For Women Mom Teen Girls Boys",,Kitchen,EGP 156.76,,,4.5,,,,,https://m.media-amazon.com/images/I/61bR4im36CL._AC_UL320_.jpg,https://www.amazon.eg/dp/B0BJZ1BKXR,2026-05-30T04:45:42.382261
amazon,,"Milk Frother, Electric Whisk, Mini Kitchen Stirrer Handheld for Coffee, Egg, Milk Shake - Stainless Steel Battery Operated Mixer and Drink Whisk",,Kitchen,EGP 52.73,,,3.3,,,,,https://m.media-amazon.com/images/I/61q-FljufuL._AC_UL320_.jpg,https://www.amazon.eg/dp/B08TTZV61P,2026-05-30T04:45:42.382698
amazon,,Mintra UNBREAKABLE CUP 380ML ORANGE,,Kitchen,EGP 24.00,,,4.8,,,,,https://m.media-amazon.com/images/I/41vU+qM78tL._AC_UL320_.jpg,https://www.amazon.eg/dp/B09XLHST2Y,2026-05-30T04:45:42.383278
amazon,,Home product image 460 ML Good Morning Clear Glass Cup For Coffee/Milk/Tea/Water ‎كوب شفاف لصباح الخير سعة 460 مل للقهوة/الحليب/الشاي/الماء,,Kitchen,EGP 94.00,,,3.5,,,,,https://m.media-amazon.com/images/I/51AQUJTDO-L._AC_UL320_.jpg,https://www.amazon.eg/dp/B0CKHWNNS7,2026-05-30T04:45:42.383716
amazon,,Ripple Potato Knife Multi - Purpose Vegetable Chopper Cutter,,Kitchen,EGP 66.00,,,4.3,,,,,https://m.media-amazon.com/images/I/61fwudal-VL._AC_UL320_.jpg,https://www.amazon.eg/dp/B08YNKKM4B,2026-05-30T04:45:42.384211
amazon,,Smile - Aluminum Round Pizza Tray (Size 3-30x4cm),,Kitchen,EGP 265.00,,,3.8,,,,,https://m.media-amazon.com/images/I/91dDCksIFCL._AC_UL320_.jpg,https://www.amazon.eg/dp/B0DPGMTB71,2026-05-30T04:45:42.384636
amazon,,"SAVVY & SORTED Minimalist Spice Jar Labels - 146 Preprinted Stickers for Organizing Containers, Herbs and Seasonings in the Kitchen Pantry",,Kitchen,EGP 792.97,,,4.6,,,,,https://m.media-amazon.com/images/I/81eoldFv9pL._AC_UL320_.jpg,https://www.amazon.eg/dp/B08LCRVGLG,2026-05-30T04:45:42.385083
amazon,,Home Cookie and Petit Four Maker with 20 Pattern Discs Easy Dough Press Tool for Baking Creative Biscuits and Cookies with Organized Kitchen Storage,,Kitchen,EGP 296.90,EGP 330.00,,1.0,List:,,,,https://m.media-amazon.com/images/I/413Dxiu+XlL._AC_UL320_.jpg,https://www.amazon.eg/dp/B0GSF22P53,2026-05-30T04:45:42.386055
amazon,,Motivational Sports Water Bottle 1 Liter Free Tritan Plastic with Mirror - Best Sports Activity Product Now Available in House Centre,,Kitchen,EGP 153.00,,,,,,,,https://m.media-amazon.com/images/I/41Y2Oc3-JGL._AC_UL320_.jpg,https://www.amazon.eg/dp/B0DDHJD77S,2026-05-30T04:45:42.386455
amazon,,UanTii,UanTii,Smart Home,EGP 610.00,,,3.9,,,,,https://m.media-amazon.com/images/I/51rCAcsHJLL._AC_UL320_.jpg,https://www.amazon.eg/dp/B0978SR83F,2026-05-30T04:45:27.698393
amazon,,"Smart IR Remote Controller WiFi – Smart Controller to Control Air Conditioner, TV and Fans via Phone – Compatible with Smart Home Apps – Type-C Port",,Smart Home,EGP 500.00,,,3.0,,,,,https://m.media-amazon.com/images/I/61y3N0L74wL._AC_UL320_.jpg,https://www.amazon.eg/dp/B0GRWQ1NWQ,2026-05-30T04:45:27.699030
amazon,,"WiFi IR Remote with Temperature & Humidity Sensor, Time & Date LCD Screen Display- Universal Control for AC TV Fan -tuya Smart Life App- Home Automation-Works with Alexa- Google Home-Siri""",,Smart Home,EGP 999.00,,,5.0,,,,,https://m.media-amazon.com/images/I/61V5JMCUjwL._AC_UL320_.jpg,https://www.amazon.eg/dp/B0DFBWSCSD,2026-05-30T04:45:27.699487
amazon,,Tapo,Tapo,Smart Home,EGP 844.98,EGP 909.00,,4.6,List:,,,,https://m.media-amazon.com/images/I/41a5w8F1xGL._AC_UL320_.jpg,https://www.amazon.eg/dp/B07XLML2YS,2026-05-30T04:45:27.700121
amazon,,Mini WiFi-IR Control Remote Wi-Fi (2.4Ghz) Universal Infrared Remote Control Enabled for Air Conditioner TV DVD Use of Tuya Smart Life APP Compatible with Alexa Google Home,,Smart Home,EGP 700.00,,,3.9,,,,,https://m.media-amazon.com/images/I/41p9cxEab4L._AC_UL320_.jpg,https://www.amazon.eg/dp/B0CL6K7S4Q,2026-05-30T04:45:27.700590
amazon,,"Tuya Multi-Mode Smart Home Gateway, Zigbee 3.0 & Bluetooth Mesh Hub, WiFi Wireless Bridge for Home Automation, Compatible with Alexa & Google Home, Smart Life App Remote Control",,Smart Home,"EGP 2,350.00","EGP 2,550.00",,,List:,,,,https://m.media-amazon.com/images/I/21a66MKmV5L._AC_UL320_.jpg,https://www.amazon.eg/dp/B0GQV84MKQ,2026-05-30T04:45:27.701042
amazon,,"Tuya WiFi Mini IR Universal Remote Control | Smart Home Automation | Control TV, AC & More | Compatible with Alexa & Google Home | Easy Setup | App Control | Enhance Convenience & Efficiency",,Smart Home,EGP 550.00,,,3.9,,,,,https://m.media-amazon.com/images/I/41yzO0J1SsL._AC_UL320_.jpg,https://www.amazon.eg/dp/B0CLM9WYWH,2026-05-30T04:45:27.701479
amazon,,Smart Plug 2 Wi-Fi EU,,Smart Home,"EGP 1,799.00",,,4.7,,,,,https://m.media-amazon.com/images/I/5179eJVm9kL._AC_UL320_.jpg,https://www.amazon.eg/dp/B0CBNPHDZR,2026-05-30T04:45:27.701948
amazon,,"Tuya Smart Home WiFi Socket Plug 16A Smart Socket Plug Adapter Smart Life App Voptor Control Power Monitor WiFi Outlet Easy Setup and Use (Size : W, Color : 1PC",,Smart Home,EGP 799.00,,,3.0,,,,,https://m.media-amazon.com/images/I/41+bfn26rZL._AC_UL320_.jpg,https://www.amazon.eg/dp/B0C4KTYVCD,2026-05-30T04:45:27.702372
amazon,,"Smart Home Audio Bluetooth 2/4 Channel 25W Touch Screen PA Background Music System in Wall Mounted Amplifier, Supporting 2-8 Speakers (2CH,White)",,Smart Home,"EGP 6,000.00",,,4.0,,,,,https://m.media-amazon.com/images/I/51f9LKeqA9L._AC_UL320_.jpg,https://www.amazon.eg/dp/B089GNZYP4,2026-05-30T04:45:27.702830
amazon,,Tuya WIFI Smart Switch 16A Mini 2-Way Control Breaker Alexa G-Home App Voice Control On-off Device Product Overview,,Smart Home,EGP 520.00,,,5.0,,,,,https://m.media-amazon.com/images/I/41l2ra4NhTL._AC_UL320_.jpg,https://www.amazon.eg/dp/B0DQ2BN5TL,2026-05-30T04:45:27.703266
amazon,,TECHZONE,TECHZONE,Smart Home,EGP 798.75,,,2.1,,,,,https://m.media-amazon.com/images/I/41uQcfYMswL._AC_UL320_.jpg,https://www.amazon.eg/dp/B0G2LQX6KL,2026-05-30T04:45:27.703730
amazon,,Xiaomi,Xiaomi,Smart Home,"EGP 5,999.00",,,4.4,,,,,https://m.media-amazon.com/images/I/31+tBhGZD2L._AC_UL320_.jpg,https://www.amazon.eg/dp/B0BW66JH4Q,2026-05-30T04:45:27.704179
