platform,asin,title,brand,category,current_price,original_price,discount,rating,reviews_count,prime_eligible,amazon_choice,sponsored,main_image,product_url,scraped_at
amazon,B0G352X9GR,OZO Skins Gradient Dimond Color (SE125GDC) For Realme 14 5G,Brand: OZO,Electronics > Mobile Phones & Communication > Accessories > Protective Skins,EGP99.00,,,,,,,,https://m.media-amazon.com/images/I/218i7Kx3yIL._AC_QL70_ML2_.jpg,https://www.amazon.eg/dp/B0G352X9GR,2026-03-29T10:52:39.799076
amazon,B0GBQPVS8F,"CELEBRT- G27 Stereo Wired Earbuds, In-Ear Wired Earphones with Mic (Microphone) Pure Sound with Mic Ergonomic Design Practical for Wearing on Mobile Phones Black",Brand: Generic,"Electronics > Headphones, Earbuds & Accessories > Headphones & Earbuds > In-Ear Headphones",EGP80.00,,,,,,,,https://m.media-amazon.com/images/I/41Q-Q4aPZbL._AC_SX300_SY300_QL70_ML2_.jpg,https://www.amazon.eg/dp/B0GBQPVS8F,2026-03-29T10:53:10.850499
amazon,B0GGHWRX4J,Tender Melody Massage Oil 120 ml,Brand: Glamour D Nour,Beauty > Skin Care > Body > Moisturizers > Oils,EGP450.00,,,,,,,,https://m.media-amazon.com/images/I/41lE1HO7VWL._AC_SX300_SY300_QL70_ML2_.jpg,https://www.amazon.eg/dp/B0GGHWRX4J,2026-03-29T10:53:31.664220
amazon,B0GH22BYB7,Dog Shaped Single Hole Plastic Pencil Sharpener - Purple,Brand: Generic,"Office Products > Pens, Pencils & Writing Supplies > Pencil Sharpeners",EGP44.50,,,,,,,,https://m.media-amazon.com/images/I/51ZAzT0CTKL._AC_SX300_SY300_QL70_ML2_.jpg,https://www.amazon.eg/dp/B0GH22BYB7,2026-03-29T10:53:36.140993
amazon,B0GJQFTB2D,Case Cover Shockproof Hard PC Back Soft TPU Frame Anti-yellowing Slim Protective Cover Compatible with Oppo Reno 15F (Black),Brand: UNBLACK,Electronics > Mobile Phones & Communication > Accessories > Cases & Covers > Basic Cases,EGP200.00,,,,,,,,https://m.media-amazon.com/images/I/61Ez8UBKOIL._AC_SY300_SX300_QL70_ML2_.jpg,https://www.amazon.eg/dp/B0GJQFTB2D,2026-03-29T10:53:50.883849
amazon,B0GKPZN2PQ,Perforated Training Cone 38 cm Yellow Color for Speed Agility and Fitness Drills,Brand: DERBY SPORT,Sports & Outdoors > Exercise & Fitness > Speed & Agility Training,EGP72.00,,,,,,,,https://m.media-amazon.com/images/I/71ZH711C-uL._AC_SY300_SX300_QL70_ML2_.jpg,https://www.amazon.eg/dp/B0GKPZN2PQ,2026-03-29T10:54:00.048552
amazon,B0GNKXPZXN,10 Piece Non Woven Shopping Bag With Handle Reusable Shopping Bag For Gift And Many Uses 35X25 Cm,Brand: Generic,Arts & Crafts > Gift Wrapping Supplies > Gift Bags,,,,,,,,,https://m.media-amazon.com/images/I/41rD245MLkL._AC_SX342_SY445_QL70_ML2_.jpg,https://www.amazon.eg/dp/B0GNKXPZXN,2026-03-29T10:54:34.384175
amazon,B0GQZCK223,bear Hoodie White 16,Brand: Generic,Fashion > Women > Clothing > Hoodies & Sweatshirts > Hoodies,,,,,,,,,https://m.media-amazon.com/images/I/41WwMqTaeBL._AC_SX342_SY445_QL70_ML2_.jpg,https://www.amazon.eg/dp/B0GQZCK223,2026-03-29T10:55:07.107885
amazon,B0GR118FK8,bear Pencil case 21,Brand: Generic,"Office Products > Office Supplies > Desk Accessories & Storage Products > Desk Supplies, Organizers & Dispensers > Pencil Cases",EGP100.00,,,,,,,,https://m.media-amazon.com/images/I/616H+QTikeL._AC_SX300_SY300_QL70_ML2_.jpg,https://www.amazon.eg/dp/B0GR118FK8,2026-03-29T10:55:09.709880
amazon,B0GR75MH9M,Case Compatible with Samsung Galaxy A11 / M11 Liquid Silicone Shockproof Protection Case with Fur Lined Full Camera Cover - Black,Brand: Generic,Electronics > Mobile Phones & Communication > Accessories > Cases & Covers > Basic Cases,EGP99.00,,,,,,,,https://m.media-amazon.com/images/I/51jx9QsB3sL._AC_SY300_SX300_QL70_ML2_.jpg,https://www.amazon.eg/dp/B0GR75MH9M,2026-03-29T10:55:14.069282
amazon,B0GRTZ9QXK,"Women's Viscose Short Sleeve Button Pajamas Black, Maroon & Navy Blue Shirt and Pants Set",Dadoush,"Fashion > Women > Clothing > Nightwear, Lingerie & Underwear > Nightwear > Pajama Sets",,,,,,,,,https://m.media-amazon.com/images/I/61x6MNGoL8L._AC_SY445_SX342_QL70_ML2_.jpg,https://www.amazon.eg/dp/B0GRTZ9QXK,2026-03-29T10:55:32.820617
amazon,B0GRX34JDD,"9H Tempered Glass Screen Protector Compatible with Samsung Galaxy A16 & A26 5G, HD Clear, Anti-Fingerprint, Anti-Scratch, Bubble Free Installation",Brand: Generic,"Electronics > Mobile Phones & Communication > Accessories > Maintenance, Upkeep & Repairs > Screen Protectors",EGP110.00,,,,,,,,https://m.media-amazon.com/images/I/512zkVpJa8L._AC_SY300_SX300_QL70_ML2_.jpg,https://www.amazon.eg/dp/B0GRX34JDD,2026-03-29T10:55:36.766707
amazon,B0GS6T9FJY,"Compatible with Samsung A33 Mobile Phone Case With a Leopard Print Design, a Stylish Case for Women and Girls, Slim and Soft, Made of Flexible TPU Silicone, Shockproof and Protective. (Tiger Black)",Brand: ELMO3EZZ,Electronics > Mobile Phones & Communication > Accessories > Cases & Covers > Dry Bags,EGP108.00,EGP135.00,,,,,,,https://m.media-amazon.com/images/I/41l3ToTG+TL._AC_SX300_SY300_QL70_ML2_.jpg,https://www.amazon.eg/dp/B0GS6T9FJY,2026-03-29T10:55:43.024461
amazon,B0GSK1LJT8,"Curvy Exercise Yoga Mat 12mm Thick – Non-Slip Fitness & Workout Mat with Curved Shape for Yoga, Pilates, Stretching, Home Gym Training & Floor Exercises",Brand: Generic,Sports & Outdoors > Exercise & Fitness > Yoga Clothing & Equipment > Mats,EGP699.00,,,,,,,,https://m.media-amazon.com/images/I/51ncVwI2hsL._AC_SX300_SY300_QL70_ML2_.jpg,https://www.amazon.eg/dp/B0GSK1LJT8,2026-03-29T10:55:52.455754
amazon,B0GT42N4SN,Generic Langfon large thickened 100pcs disposable tipless piping bags and bag royal icing pastry bags for cookies decorating cupcake,Brand: generic,"Health & Household Products > Home Care & Cleaning > Papers, Wraps & Bags > Food Bags",,,,,,,,,https://m.media-amazon.com/images/I/61LmbdoFNJL._AC_SY300_SX300_QL70_ML2_.jpg,https://www.amazon.eg/dp/B0GT42N4SN,2026-03-29T10:56:36.816075
amazon,B0GTXDVWQJ,"Luxury Satin Stripe Duvet Cover Set 1cm Stripes – Soft Cotton Hotel Bedding, Breathable, Durable, Elegant Design (Blue, King (U.K. Standard)) size 240x250 cm",Brand: Relax home linens,Home & Kitchen > Bedding & Linen > Duvet Covers & Sets > Duvet Cover Sets,"EGP1,282.50",,,,,,,,https://m.media-amazon.com/images/I/61Dc8x8RjtL._AC_SY300_SX300_QL70_ML2_.jpg,https://www.amazon.eg/dp/B0GTXDVWQJ,2026-03-29T10:56:49.744536
amazon,B0GV1K65RQ,"Turkish Coffee Cup Set, 6 Pieces with 6 Saucers, White Porcelain with Golden and Brown Patterns, for Daily Use and Hospitality",Brand: Generic,"Home & Kitchen > Kitchen > Coffee, Tea & Espresso > Stovetop Espresso Pots",EGP599.00,,,,,,,,https://m.media-amazon.com/images/I/51FIpwRlZPL._AC_SX300_SY300_QL70_ML2_.jpg,https://www.amazon.eg/dp/B0GV1K65RQ,2026-03-29T10:56:54.878128
amazon,B0FKKQ9PHQ,"NIVEA Body Cream Dry Skin, Cocoa Butter Vitamin E, Jar 200ml (Pack of 2)",NIVEA,Beauty > Skin Care > Body > Moisturizers > Creams,EGP242.40,,,4.5,,,,,https://m.media-amazon.com/images/I/71p759OTzdL._AC_SX300_SY300_QL70_ML2_.jpg,https://www.amazon.eg/dp/B0FKKQ9PHQ,2026-03-29T10:57:06.966568
amazon,B0923VGYXT,Pack Of 3 Cotton Brief For Men,Brand: Dice,Fashion > Men > Clothing > Underwear > Briefs,,,,4.1,,,,,https://m.media-amazon.com/images/I/51y8ufYB1CS._AC_SX342_SY445_QL70_ML2_.jpg,https://www.amazon.eg/dp/B0923VGYXT,2026-03-29T10:57:20.726892
amazon,B0G2MVVWM2,Boxi 2 Years Extended Warranty Service Contract for Portable Electronics Products (from EGP7501 to EGP8000) (Email Delivery to your Amazon Email ID | No Physical Delivery),Brand: Boxi,Electronics > Warranties,EGP712.00,,,,,,,,https://m.media-amazon.com/images/I/41fNT87cnNL._AC_SY300_SX300_QL70_ML2_.jpg,https://www.amazon.eg/dp/B0G2MVVWM2,2026-03-29T10:57:32.518932
amazon,B09J1JYVVB,Womens Casual Loose Fit Pant - Navy,Brand: Generic,Fashion > Women > Clothing > Pants,,,,3.4,,,,,https://m.media-amazon.com/images/I/41xgft5d0CL._AC_SY445_SX342_QL70_ML2_.jpg,https://www.amazon.eg/dp/B09J1JYVVB,2026-03-29T10:57:42.979559
amazon,B09J1J7BLH,Womens Casual Loose Fit Pant - Navy,Brand: Generic,Fashion > Women > Clothing > Pants,,EGP650.00,,3.4,,,,,https://m.media-amazon.com/images/I/41xgft5d0CL._AC_SY445_SX342_QL70_ML2_.jpg,https://www.amazon.eg/dp/B09J1J7BLH,2026-03-29T10:57:46.840000
amazon,B0CLBGBP5G,"Next store Compatible with iwatch 38mm Series 3/2/1 Case with Tempered Glass Screen Protector, Bling Crystal Slim Protective Cover for iWatch Women Men (Blue)",Next store,Electronics > Wearable Technology > Smartwatch Accessories > Smartwatch Screen Protectors,EGP154.50,,,,,,,,https://m.media-amazon.com/images/I/71Ynf3Y+BQL._AC_SY300_SX300_QL70_ML2_.jpg,https://www.amazon.eg/dp/B0CLBGBP5G,2026-03-29T10:58:33.895577
amazon,B0G2MTY6JQ,Boxi 2 Years Extended Warranty Service Contract for Office Equipment Products (from EGP7501 to EGP8000) (Email Delivery to your Amazon Email ID | No Physical Delivery),Brand: Boxi,Electronics > Warranties,EGP712.00,,,,,,,,https://m.media-amazon.com/images/I/41fNT87cnNL._AC_SY300_SX300_QL70_ML2_.jpg,https://www.amazon.eg/dp/B0G2MTY6JQ,2026-03-29T10:58:35.657528
amazon,B0CZPKV9GC,adidas Girl's Essentials Linear Logo Leggings Tights,adidas,Fashion > Women > Clothing > Activewear > Leggings,,,,4.4,,,,,https://m.media-amazon.com/images/I/61peqEO-NpL._AC_SX342_SY445_QL70_ML2_.jpg,https://www.amazon.eg/dp/B0CZPKV9GC,2026-03-29T10:58:47.885464
amazon,B0G2K5CFXV,Boxi 1 Year Extended Warranty Service Contract for Portable Electronics Products (from EGP5001 to EGP5500) (Email Delivery to your Amazon Email ID | No Physical Delivery),Brand: Boxi,Electronics > Warranties,EGP308.00,,,,,,,,https://m.media-amazon.com/images/I/41fNT87cnNL._AC_SY300_SX300_QL70_ML2_.jpg,https://www.amazon.eg/dp/B0G2K5CFXV,2026-03-29T10:59:15.633817
amazon,B0G2MWFJ42,Boxi 2 Years Extended Warranty Service Contract for Sports Products (from EGP1 to EGP500) (Email Delivery to your Amazon Email ID | No Physical Delivery),Brand: Boxi,Electronics > Warranties,EGP45.00,,,,,,,,https://m.media-amazon.com/images/I/41fNT87cnNL._AC_SY300_SX300_QL70_ML2_.jpg,https://www.amazon.eg/dp/B0G2MWFJ42,2026-03-29T10:59:56.534171
amazon,B0GTX3PRXS,"Luxury Satin Stripe Duvet Cover Set 1cm Stripes – Soft Cotton Hotel Bedding, Breathable, Durable, Elegant Design (Baby blue, King (U.K. Standard)) size 240x250 cm",Brand: Relax home linens,Home & Kitchen > Bedding & Linen > Duvet Covers & Sets > Duvet Cover Sets,"EGP1,282.50",,,,,,,,https://m.media-amazon.com/images/I/61v9cTkzbkL._AC_SY300_SX300_QL70_ML2_.jpg,https://www.amazon.eg/dp/B0GTX3PRXS,2026-03-29T11:00:26.684090
amazon,B0G2K6HBTJ,Boxi 1 Year Extended Warranty Service Contract for Kitchen Products (from EGP501 to EGP1000) (Email Delivery to your Amazon Email ID | No Physical Delivery),Brand: Boxi,Electronics > Warranties,EGP56.00,,,5.0,,,,,https://m.media-amazon.com/images/I/41fNT87cnNL._AC_SY300_SX300_QL70_ML2_.jpg,https://www.amazon.eg/dp/B0G2K6HBTJ,2026-03-29T11:00:36.475483
amazon,B000JTN8JC,Stabilo point 88 fineliner pen - 0.4 mm. - green,STABILO,"Office Products > Pens, Pencils & Writing Supplies > Pens & Refills > Porous-Point Pens",EGP38.54,,,4.6,,,,,https://m.media-amazon.com/images/I/61HBiqmmhNL._AC_SY300_SX300_QL70_ML2_.jpg,https://www.amazon.eg/dp/B000JTN8JC,2026-03-29T10:34:12.736878
amazon,B003Z028G6,Pilot V-Ball VB7 Rollerball Pen Fine 0.7mm Tip Blue BLVB701,Brand: Pilot,"Office Products > Pens, Pencils & Writing Supplies > Pens & Refills > Rollerball Pens > Liquid Ink Rollerball Pens",,,,4.6,,,,,https://m.media-amazon.com/images/I/51eIjF5cjmL._AC_SY300_SX300_QL70_ML2_.jpg,https://www.amazon.eg/dp/B003Z028G6,2026-03-29T10:34:25.265912
amazon,B004RC1JAW,"Camelion Lithium Coin Cell Battery (CR2025,3V)",Camelion,Electronics > Household Batteries & Chargers > Disposable Batteries,EGP39.00,,,4.8,,,,,https://m.media-amazon.com/images/I/71+95-HOtVL._AC_SY300_SX300_QL70_ML2_.jpg,https://www.amazon.eg/dp/B004RC1JAW,2026-03-29T10:34:27.965744
amazon,B00ATBRF6C,Stabilo Pointball Pen - Violet,STABILO,"Office Products > Pens, Pencils & Writing Supplies > Pens & Refills > Ballpoint Pens > Retractable Ballpoint Pens",EGP117.93,EGP123.00,,4.5,,,,,https://m.media-amazon.com/images/I/61ysAZ8cB-L._AC_SY300_SX300_QL70_ML2_.jpg,https://www.amazon.eg/dp/B00ATBRF6C,2026-03-29T10:34:35.268735
amazon,B00SX0S2I6,"Stabilo Pen 68, 1 Piece of Felt tip, Middle tip Green Green",STABILO,"Office Products > Pens, Pencils & Writing Supplies > Pens & Refills > Porous-Point Pens",,,,4.5,,,,,https://m.media-amazon.com/images/I/41OBc5rz9nL._AC_SX300_SY300_QL70_ML2_.jpg,https://www.amazon.eg/dp/B00SX0S2I6,2026-03-29T10:34:45.554315
amazon,B01BMDWMDQ,1:18 FERRARI - 488 GTB,Brand: Bburago,Arts & Crafts > Model & Hobby Building > Pre-Built & Diecast Models > Motor Vehicles,"EGP3,924.00",,,4.7,,,,,https://m.media-amazon.com/images/I/61+GNQSHoYL._AC_SY300_SX300_QL70_ML2_.jpg,https://www.amazon.eg/dp/B01BMDWMDQ,2026-03-29T10:34:54.038485
amazon,B0754L1C94,Havit HV-MP838 Mouse Pad - Black,Brand: havit,"Electronics > Computers, Components & Accessories > Accessories > Keyboards, Mice & Input Devices > Keyboard & Mice Accessories > Mouse Pads",EGP53.00,,,4.4,,,,,https://m.media-amazon.com/images/I/51o4oun5PeL._AC_SX300_SY300_QL70_ML2_.jpg,https://www.amazon.eg/dp/B0754L1C94,2026-03-29T10:35:07.861108
amazon,B081TY1RSJ,my way Mini Cleanser and Floor Freshener with Spring Flowers (480ml),Brand: my way,Health & Household Products > Home Care & Cleaning > Household Cleaners > Floor Cleaners,EGP45.00,,,2.0,,,,,https://m.media-amazon.com/images/I/513i7scd5BL._AC_SY300_SX300_QL70_ML2_.jpg,https://www.amazon.eg/dp/B081TY1RSJ,2026-03-29T10:35:55.000410
amazon,B082MSV934,My Way Super Clintool with original smell 700 ml,Brand: My Way,Health & Household Products > Home Care & Cleaning > Household Cleaners > Disinfectant Sprays & Liquids,EGP27.00,,,,,,,,https://m.media-amazon.com/images/I/51yQMZUYFVL._AC_SY300_SX300_QL70_ML2_.jpg,https://www.amazon.eg/dp/B082MSV934,2026-03-29T10:35:57.758793
amazon,B0873CBNCL,"Radox Antibacterial Liquid Handwash Protect + Replenish With Thyme & Tea Tree, 2 Pack (250Ml X 2)",Brand: Radox,Beauty > Bath & Body > Cleansers > Hand Wash,EGP110.50,,,4.5,,,,,https://m.media-amazon.com/images/I/61i0A7Fjr6L._AC_SY300_SX300_QL70_ML2_.jpg,https://www.amazon.eg/dp/B0873CBNCL,2026-03-29T10:36:07.709066
amazon,B08V8N9D6G,"Simimi art Video Game Themed Print Room Wall Decoration (8""x10""x4pieces ，Unframed)-Perfect for Kids Boy Bedroom Decoration, Gamer room, Kids room",Brand: Simimi art,Home & Kitchen > Artwork > Posters & Prints,EGP91.00,,,3.8,,,,,https://m.media-amazon.com/images/I/81KWzYGxVeL._AC_SY300_SX300_QL70_ML2_.jpg,https://www.amazon.eg/dp/B08V8N9D6G,2026-03-29T10:36:38.030477
amazon,B08X66XCCW,Max Touch Baby Wet Wipes with Cover - 120 Pieces,Brand: Max Touch,Baby Products > Baby Care > Wipes & Accessories > Wet Wipes,EGP62.70,,,4.8,,,,,https://m.media-amazon.com/images/I/61OOYcYU1fL._AC_SY300_SX300_QL70_ML2_.jpg,https://www.amazon.eg/dp/B08X66XCCW,2026-03-29T10:36:57.795606
amazon,B08YNPVTJF,"Generic 18 oz Stainless Steel Thermal Mug, Keeps Hot or Cold Beverages 12 Hours, Leak Proof, Reusable, Travel Mug",Spaceshoop,Home & Kitchen > Kitchen > Containers & Storage > Thermos Flasks > Insulated Beverage Containers > Cups & Mugs,EGP92.00,,,3.2,,,,,https://m.media-amazon.com/images/I/51jOP7N3PcL._AC_SY300_SX300_QL70_ML2_.jpg,https://www.amazon.eg/dp/B08YNPVTJF,2026-03-29T10:37:05.929658
amazon,B091D3X7WW,Generic Men's and women's adjustable corset for back and shoulders,Brand: Other,"Health & Household Products > Medical Supplies & Equipment > Braces, Splints & Slings > Back, Neck & Shoulder Supports > Back Braces",EGP72.69,,,2.6,,,,,https://m.media-amazon.com/images/I/61pKtmCkFyL._AC_SX300_SY300_QL70_ML2_.jpg,https://www.amazon.eg/dp/B091D3X7WW,2026-03-29T10:37:30.242701
amazon,B091J4KHS7,"Armor luxury shockproof phone back capinha,coque,cover,case for samsung galaxy j7 prime j7prime silicon silicone accessories",Brand: Armor,Electronics > Mobile Phones & Communication > Accessories > Cases & Covers > Basic Cases,,,,4.1,,,,,https://m.media-amazon.com/images/I/61dx2GNDPvL._AC_SY300_SX300_QL70_ML2_.jpg,https://www.amazon.eg/dp/B091J4KHS7,2026-03-29T10:37:36.617764
amazon,B0924QD22S,"Waterproof Phone Pouch, Universal Waterproof Case,Floating Cellphone Dry Bag compatible with iPhone Xs Max, X, Max, 8 Plus, 7 Plus, 6s Plus, Samsung Galaxy s7, s8, s9, Note 7 up to 7.0 inch",Spaceshoop,Electronics > Mobile Phones & Communication > Accessories > Cases & Covers > Dry Bags,EGP47.90,EGP58.80,,3.2,,,,,https://m.media-amazon.com/images/I/61-U+BaJPSL._AC_SY300_SX300_QL70_ML2_.jpg,https://www.amazon.eg/dp/B0924QD22S,2026-03-29T10:37:59.622246
amazon,B0976FT4M4,Back Cover For Samsung Galaxy A3 - Clear & Rose,Brand: Fashion Case,Electronics > Mobile Phones & Communication > Accessories > Cases & Covers > Basic Cases,EGP50.00,,,,,,,,https://m.media-amazon.com/images/I/51ehRElIF9S._AC_SY300_SX300_QL70_ML2_.jpg,https://www.amazon.eg/dp/B0976FT4M4,2026-03-29T10:38:29.047109
amazon,B098BHZLXJ,Faber-Castell 127020 Art Eraser - Grey,Faber-Castell,Arts & Crafts > Drawing & Painting > Drawing > Erasers,EGP35.00,,,4.2,,,,,https://m.media-amazon.com/images/I/61QZKp0b8NL._AC_SY300_SX300_QL70_ML2_.jpg,https://www.amazon.eg/dp/B098BHZLXJ,2026-03-29T10:38:35.280238
amazon,B099ZJTY3R,"ZoneYan Rim Protection Rings, Car Wheel Protection Ring, Wheel Anti Rub Strip, Rim Styling Stripes, Styling Rim Protection Ring, Self-Adhesive Protector Tape, Rubber Decoration Strip, 8m (Red)",Brand: ZoneYan,"Automotive > Automobile Parts & Accessories > Car Parts > Interior Fittings > Steering Wheels, Hubs & Accessories > Steering Wheel Covers",,,,3.3,,,,,https://m.media-amazon.com/images/I/61BV3Pd-I9L._AC_SY300_SX300_QL70_ML2_.jpg,https://www.amazon.eg/dp/B099ZJTY3R,2026-03-29T10:38:47.653497
amazon,B09DNZNL7D,"Sleep Headphones Headband, Wireless V5.0 Bluetooth Headphones, Wireless Sports Headband, Built-in ultra-thin HD stereo speakers, Suitable for Side Sleep/Sports/Cycling/Traveling/Fitness/Relaxation",Brand: TAIGUKOKO,"Electronics > Headphones, Earbuds & Accessories > Headphones & Earbuds > Over-Ear Headphones",EGP399.00,,,3.9,,,,,https://m.media-amazon.com/images/I/71RPHwJFYKL._AC_SY300_SX300_QL70_ML2_.jpg,https://www.amazon.eg/dp/B09DNZNL7D,2026-03-29T10:38:54.180378
amazon,B09YP3N28Z,Classy toilet 2 rolls 2 ply,Brand: CLASSY,"Health & Household Products > Home Care & Cleaning > Tissues, Toilet Paper & Sprays > Toilet Tissues",EGP23.50,,,3.5,,,,,https://m.media-amazon.com/images/I/61+QSML358L._AC_SX300_SY300_QL70_ML2_.jpg,https://www.amazon.eg/dp/B09YP3N28Z,2026-03-29T10:39:52.149569
amazon,B0B39GMXFN,Generic King kong anti-burst hard back cover for samsung galaxy m31s - clear,Brand: Generic,Electronics > Mobile Phones & Communication > Accessories > Cases & Covers > Basic Cases,EGP64.00,,,,,,,,https://m.media-amazon.com/images/I/5163CfisGHL._AC_SY300_SX300_QL70_ML2_.jpg,https://www.amazon.eg/dp/B0B39GMXFN,2026-03-29T10:40:02.691875
amazon,B0B44GCQHF,Max Plast Round Flower Shape Plastic Basket - Assorted Colors,Brand: Max Plast,Home & Kitchen > Waste & Recycling > Paper Bins,EGP14.25,,,3.0,,,,,https://m.media-amazon.com/images/I/61PPwKAD1-L._AC_SY300_SX300_QL70_ML2_.jpg,https://www.amazon.eg/dp/B0B44GCQHF,2026-03-29T10:40:06.210584
amazon,B0B4P4JZNQ,Back cover perfect slim hard case with silicone protection edges for huawei y5p - black red,Brand: generic,Electronics > Mobile Phones & Communication > Accessories > Cases & Covers > Basic Cases,EGP41.00,,,,,,,,https://m.media-amazon.com/images/I/512J7uoW1WL._AC_SY300_SX300_QL70_ML2_.jpg,https://www.amazon.eg/dp/B0B4P4JZNQ,2026-03-29T10:40:11.068407
amazon,B0B6W86HP9,74161 IC synchronous 4-bit counter (standard reset) (2pcs),Brand: Generic,Sports & Outdoors > Sports > Track & Field > Meet Equipment > Lap Counters,EGP33.60,,,,,,,,https://m.media-amazon.com/images/I/21i9+-3kU0L._AC_SY300_SX300_QL70_ML2_.jpg,https://www.amazon.eg/dp/B0B6W86HP9,2026-03-29T10:40:21.765413
amazon,B0BRQRP3Z7,"Astroida Golden Mask 120gm 4Oz With Collagen, Hyaluronic acid, Colloidal Gold, Caffeine, Olive Oil - Anti Aging, Anti Wrinkles, Anti oxidant, Source of vitamins to nourish your skin",Brand: Astroida,Beauty > Skin Care > Face > Treatments > Masks,EGP98.00,EGP165.00,,4.1,,,,,https://m.media-amazon.com/images/I/51EaPwUqeXL._AC_SY300_SX300_QL70_ML2_.jpg,https://www.amazon.eg/dp/B0BRQRP3Z7,2026-03-29T10:41:07.363174
amazon,B0C379ZMNP,"Baby Changing Bag Backpack, Multifunctional Diaper Bags with Folding Bed, Large Capacity Nappy Backpacks Insulated Bottle Pockets, Mat, Stroller Straps, USB Port, Gray, 27*18*38cm",Brand: Rikmody,Baby Products > Diaper Changing > Changing Bags > Backpacks,,,,4.2,,,,,https://m.media-amazon.com/images/I/817rc-qamjL._AC_SX342_SY445_QL70_ML2_.jpg,https://www.amazon.eg/dp/B0C379ZMNP,2026-03-29T10:41:58.853264
amazon,B0C3MQBBG1,"HONLEN Case for Samsung Galaxy A22 5G (6.6 Inches), Soft Silicone TPU Case, Electroplating Frame Design - Pink",Brand: HONLEN,Electronics > Mobile Phones & Communication > Accessories > Cases & Covers > Basic Cases,EGP90.00,EGP100.00,,4.3,,,,,https://m.media-amazon.com/images/I/516tSNDCmvL._AC_SY300_SX300_QL70_ML2_.jpg,https://www.amazon.eg/dp/B0C3MQBBG1,2026-03-29T10:42:00.875595
amazon,B0C3RFPNJW,"Wash Bag To Protect Delicate Clothes And Interior From Elyassin, 30 x 40 cm - Multi Color",Brand: elyassin,"Home & Kitchen > Laundry, Steaming & Ironing > Laundry Bags",EGP14.65,,,3.1,,,,,https://m.media-amazon.com/images/I/71AXDPHEVZL._AC_SY300_SX300_QL70_ML2_.jpg,https://www.amazon.eg/dp/B0C3RFPNJW,2026-03-29T10:42:03.083045
amazon,B0C6MRP2FG,Women’s 100% Cotton Underwear | Elegant Lace-Trimmed Women's Underwear | Ultimate Comfort and Style,Brand: YOUNG UNDERWEAR,"Fashion > Women > Clothing > Nightwear, Lingerie & Underwear > Lingerie & Underwear > Panties",,,,3.9,,,,,https://m.media-amazon.com/images/I/416Tfh7BsWL._AC_SX342_SY445_QL70_ML2_.jpg,https://www.amazon.eg/dp/B0C6MRP2FG,2026-03-29T10:42:15.115169
amazon,B0CC116ZN1,Plastic Fish Cleaning Brush Set Of 3 Pieces - Multi Color,Brand: Spaceshoop,Home & Kitchen > Household Cleaning Tools & Vacuums > Brushes > Dustpan & Brush Sets,EGP50.00,,,4.6,,,,,https://m.media-amazon.com/images/I/61o98-sVwiL._AC_SY300_SX300_QL70_ML2_.jpg,https://www.amazon.eg/dp/B0CC116ZN1,2026-03-29T10:42:30.820193
amazon,B0CCFCBNWD,Joyroom TYPE-C Series In-Ear Metal Wired Earbuds,Joyroom,"Electronics > Headphones, Earbuds & Accessories > Headphones & Earbuds > In-Ear Headphones",EGP207.48,EGP229.30,,3.1,,,,,https://m.media-amazon.com/images/I/51xIpByADnL._AC_SY300_SX300_QL70_ML2_.jpg,https://www.amazon.eg/dp/B0CCFCBNWD,2026-03-29T10:42:33.134862
amazon,B0CDFG8W3J,"Yoedge Magnetic Case for Apple iPhone 12/iPhone 12 Pro 6.1 Inches, Compatible with MagSafe, Ultra Thin Matte Translucent PC Case, Soft TPU Silicone Anti-Shock Protective Cover, Black",Brand: Yoedge,Electronics > Mobile Phones & Communication > Accessories > Cases & Covers > Basic Cases,EGP230.00,,,4.3,,,,,https://m.media-amazon.com/images/I/61dcyrHj39L._AC_SY300_SX300_QL70_ML2_.jpg,https://www.amazon.eg/dp/B0CDFG8W3J,2026-03-29T10:42:39.075719
amazon,B0CFV9CWXV,"Fine Baby Diapers Size 5 (11-18 kg) Maxi, 134 diaper count – super saver bundle",Fine Baby,Baby Products > Diaper Changing > Disposable Diapers,EGP792.99,,,4.4,,,,,https://m.media-amazon.com/images/I/71Z4O08qOOL._AC_SY300_SX300_QL70_ML2_.jpg,https://www.amazon.eg/dp/B0CFV9CWXV,2026-03-29T10:42:44.893266
amazon,B0CGNKHTWV,"Generic 3D Laptop Desk - Multishape, Multicolour - Foldable, Portable",Brand: Generic,"Electronics > Computers, Components & Accessories > Accessories > Laptop Accessories > Lapdesks",EGP376.47,,,3.0,,,,,https://m.media-amazon.com/images/I/51RMo9n-ECL._AC_SY300_SX300_QL70_ML2_.jpg,https://www.amazon.eg/dp/B0CGNKHTWV,2026-03-29T10:42:50.254911
amazon,B0CJQF4S46,Accelerate Plain Silver Leather Protective 15-15.6 inch Premium Laptop Sleeve Case with Zipper | Slim Design Laptop Bag compatible with Macbooks and Laptops,Brand: accelerate,"Electronics > Computers, Components & Accessories > Accessories > Laptop Accessories > Bags, Cases & Sleeves > Sleeves",EGP132.00,,,3.9,,,,,https://m.media-amazon.com/images/I/41gYkFalmnL._AC_SY300_SX300_QL70_ML2_.jpg,https://www.amazon.eg/dp/B0CJQF4S46,2026-03-29T10:43:04.779295
amazon,B0CLV4YJJS,"Plastic Back Cover For Apple iPhone 11 Pro Max, Dark Clear&Yellow MF7M-75",Brand: Generic,Electronics > Mobile Phones & Communication > Accessories > Cases & Covers > Basic Cases,EGP100.00,,,,,,,,https://m.media-amazon.com/images/I/41lXdvx3vAL._AC_SY300_SX300_QL70_ML2_.jpg,https://www.amazon.eg/dp/B0CLV4YJJS,2026-03-29T10:43:28.476861
amazon,B0CNM448JH,بخاخ رذاذ نانو من Maky store، تقنية اهتزاز بالموجات فوق الصوتية، يرطب بشرتك لمكياج هادئ وشعور منعش أثناء التنقل، 30 مل (متعدد الألوان),Brand: Generic,Beauty > Skin Care > Makeup Removers > Makeup Cleansing Water,EGP120.00,,,1.0,,,,,https://m.media-amazon.com/images/I/41O28t3v3sL._AC_SY300_SX300_QL70_ML2_.jpg,https://www.amazon.eg/dp/B0CNM448JH,2026-03-29T10:43:36.874083
amazon,B0CPL4F3YK,لانجري جذاب لانجريى بلاى سوتس قصير قميص نوم أنيقة بيبي دول نسائية شفاف من كيان للتالتجارية كود 343,Brand: Generic,"Fashion > Women > Clothing > Nightwear, Lingerie & Underwear > Lingerie & Underwear > Baby Dolls, Chemises & Negligees",,,,,,,,,https://m.media-amazon.com/images/I/41m4g1y4YCL._AC_SY445_SX342_QL70_ML2_.jpg,https://www.amazon.eg/dp/B0CPL4F3YK,2026-03-29T10:43:43.412272
amazon,B0CVFWF34C,Mobelux Parquet Polish Spray 345 ml,Brand: Mobilux,Health & Household Products > Home Care & Cleaning > Household Cleaners > Floor Cleaners,EGP60.00,,,4.4,,,,,https://m.media-amazon.com/images/I/61HhUAqck6L._AC_SY300_SX300_QL70_ML2_.jpg,https://www.amazon.eg/dp/B0CVFWF34C,2026-03-29T10:44:07.301558
