platform,product_id,title,brand,category,current_price,original_price,discount,rating,reviews_count,availability,main_image,product_url,scraped_at
amazon,B0BTZ6PBX7,Product B0BTZ6PBX7,"Igea Collacogen, Box of 30 sachets",Beauty,EGP 679.75,EGP 699.00,,4.4,(146),In Stock,https://m.media-amazon.com/images/I/71HtvzHFt-L._AC_UL320_.jpg,https://www.amazon.eg/dp/B0BTZ6PBX7,2026-05-09T05:54:59.864126
amazon,B01CT3FRXK,Product B01CT3FRXK,"Gillette Venus & Olay women's razor blade refills, 4 count",Beauty,EGP 642.00,EGP 781.00,,4.6,(500),In Stock,https://m.media-amazon.com/images/I/71-J7VzSgHL._AC_UL320_.jpg,https://www.amazon.eg/dp/B01CT3FRXK,2026-05-09T05:54:59.868391
amazon,B01MSXH2BO,Product B01MSXH2BO,"Eucerin Face Sunscreen Even Pigment Perfector Hyperpigmentation Sun Fluid with Thiamidol, High UVA/UVB Protection, SPF 50+, Reduces Dark Spots, For All Skin Types, 50ml",Beauty,EGP 929.01,EGP 989.00,,4.5,(1.2K),In Stock,https://m.media-amazon.com/images/I/61CfX+NWxnL._AC_UL320_.jpg,https://www.amazon.eg/dp/B01MSXH2BO,2026-05-09T05:54:59.872228
amazon,B09NQG78ND,Product B09NQG78ND,Maybelline New York Super Stay Vinyl Ink 35 Cheeky 5.4 Ml,Beauty,EGP 519.01,EGP 690.00,,4.4,(5.8K),In Stock,https://m.media-amazon.com/images/I/41N7HjR5xJL._AC_UL320_.jpg,https://www.amazon.eg/dp/B09NQG78ND,2026-05-09T05:54:59.876065
amazon,B0CWPCX1D2,Product B0CWPCX1D2,AXIS-Y Vegan Collagen Eye Serum 10ml,Beauty,EGP 820.00,"EGP 1,185.00",,4.4,(3.1K),In Stock,https://m.media-amazon.com/images/I/61ZLWF8fOzL._AC_UL320_.jpg,https://www.amazon.eg/dp/B0CWPCX1D2,2026-05-09T05:54:59.879885
amazon,B08P4YPB8Q,Product B08P4YPB8Q,Maybelline New York Black Mascara For Extremely Long Eyelashes Lash Sensational Sky High Mascara Very Black 7.2Ml,Beauty,EGP 527.84,EGP 585.00,,3.8,(34.5K),In Stock,https://m.media-amazon.com/images/I/61JCtpKCnhL._AC_UL320_.jpg,https://www.amazon.eg/dp/B08P4YPB8Q,2026-05-09T05:54:59.884378
amazon,B09YJ1TNZ9,Product B09YJ1TNZ9,Frida Shower gel Sun Shine 3 Liters,Beauty,,,,4.6,(125),In Stock,https://m.media-amazon.com/images/I/71lM3wwGXRL._AC_UL320_.jpg,https://www.amazon.eg/dp/B09YJ1TNZ9,2026-05-09T05:54:59.886621
amazon,B00449W12S,Product B00449W12S,"Cantu Shea Butter Leave-In Conditioning Repair Cream, 16 Ounce",Beauty,EGP 521.00,EGP 680.00,,4.4,(21.9K),In Stock,https://m.media-amazon.com/images/I/71hl9yyi9BL._AC_UL320_.jpg,https://www.amazon.eg/dp/B00449W12S,2026-05-09T05:54:59.890916
amazon,B0C2ZD76TC,Product B0C2ZD76TC,"Eucerin Sunscreen Hydro Protect Face Ultra Light Fluid, High UVA/UVB Protection, SPF 50+, Suitable for Daily Use, Non sticky, Non Greasy, Suitable for All Skin Types, 50ml",Beauty,EGP 943.90,,,4.5,(234),In Stock,https://m.media-amazon.com/images/I/71EJZMCfnlL._AC_UL320_.jpg,https://www.amazon.eg/dp/B0C2ZD76TC,2026-05-09T05:54:59.894652
amazon,B000FQNPD8,Product B000FQNPD8,"Fino Shiseido Premium Hair Mask with Touch Essence, 230 g, Pack of 1",Beauty,EGP 881.90,"EGP 1,352.90",,4.3,(2.6K),In Stock,https://m.media-amazon.com/images/I/61mhN18ClsL._AC_UL320_.jpg,https://www.amazon.eg/dp/B000FQNPD8,2026-05-09T05:54:59.898902
amazon,B0D288GDWX,Product B0D288GDWX,Vgr V-109 Waterproof Ipx6 6 In 1 Professional Set Hair Beard Trimmer Clipper Shaver Nose Trimmer Mesin Gunting Rambut,Beauty,EGP 875.00,,,4.3,(129),In Stock,https://m.media-amazon.com/images/I/71JQPzHwO8L._AC_UL320_.jpg,https://www.amazon.eg/dp/B0D288GDWX,2026-05-09T05:54:59.902223
amazon,B0CK85LKF5,Product B0CK85LKF5,L’Oréal Paris Elvive Fall Resist Hair Serum For Weak Hair and Hair Fall 102ML,Beauty,EGP 659.53,,,4.1,(601),In Stock,https://m.media-amazon.com/images/I/61u3bPkhsDL._AC_UL320_.jpg,https://www.amazon.eg/dp/B0CK85LKF5,2026-05-09T05:54:59.905521
amazon,B07Q2R45XG,Product B07Q2R45XG,Normaderm Gel 200Ml,Beauty,,,,4.5,(3.8K),In Stock,https://m.media-amazon.com/images/I/61Xg8ArQ8UL._AC_UL320_.jpg,https://www.amazon.eg/dp/B07Q2R45XG,2026-05-09T05:54:59.907761
amazon,B0F8X5L98K,Product B0F8X5L98K,Sheglam Buttery Bliss Blush Stick - Love Cake- 6G,Beauty,,,,4.3,(50),In Stock,https://m.media-amazon.com/images/I/51EUhdrIZgL._AC_UL320_.jpg,https://www.amazon.eg/dp/B0F8X5L98K,2026-05-09T05:54:59.910007
amazon,B0BHBSJ2WR,Product B0BHBSJ2WR,"VGR V-107 Professional 11in1 IPX6 Washable Grooming Kit Trimmer for Men, 150 min Runtime (Silver, Black)",Beauty,EGP 725.50,,,3.8,(48),In Stock,https://m.media-amazon.com/images/I/61rRoSboPJL._AC_UL320_.jpg,https://www.amazon.eg/dp/B0BHBSJ2WR,2026-05-09T05:54:59.913720
amazon,B01BL871A6,Product B01BL871A6,Mustela Gentle Baby Shampoo - for normal skin - 200ml,Beauty,EGP 589.00,EGP 630.00,,4.8,(1.4K),In Stock,https://m.media-amazon.com/images/I/51llLcC45YL._AC_UL320_.jpg,https://www.amazon.eg/dp/B01BL871A6,2026-05-09T05:54:59.917734
