platform,product_id,title,brand,category,current_price,original_price,discount,rating,reviews_count,availability,seller,express_delivery,platform_badge,sponsored,main_image,all_images,description,weight,dimensions,model_number,country_of_origin,warranty,tech_specs,variations,ships_from,delivery_date,product_url,scraped_at
amazon,B07LGRSTVD,"SOLUDE Tool Set,82-Piece Home Repair Tool Kit for Men Women College Students,Household Basic Hand Tool Sets with Case for Home Maintenance & DIY Projects",,Tools,"EGP 1,099.00",,,4.4,,,,,,,https://m.media-amazon.com/images/I/71lfjlTScpL._AC_UL320_.jpg,https://m.media-amazon.com/images/I/71lfjlTScpL._AC_UL320_.jpg,,,,,,,,,,,https://www.amazon.eg/dp/B07LGRSTVD,2026-04-15T04:12:31.542510
amazon,B07NW95B76,Automobile Box Wrench Sleeve Suit Auto Car Repair Hardware 40 in 1 Pcs Tool Kit and Screwdriver and Socket Set,,Tools,EGP 209.98,,,3.0,,,,,,,https://m.media-amazon.com/images/I/61s+QD8+D1L._AC_UL320_.jpg,https://m.media-amazon.com/images/I/61s+QD8+D1L._AC_UL320_.jpg,,,,,,,,,,,https://www.amazon.eg/dp/B07NW95B76,2026-04-15T04:12:31.543154
amazon,B08T9GMHHW,46 in 1 Multi Purpose Case Precision Hex Socket Set (Multicolor),,Tools,EGP 263.70,,,3.4,,,,,,,https://m.media-amazon.com/images/I/710wKp9ITsL._AC_UL320_.jpg,https://m.media-amazon.com/images/I/710wKp9ITsL._AC_UL320_.jpg,,,,,,,,,,,https://www.amazon.eg/dp/B08T9GMHHW,2026-04-15T04:12:31.543705
amazon,B0DS13JYM4,"NESTIFY40 in 1 Screw Driver Set, Wrench Tool Kit, Screwdriver and Socket Set Automobile Motorcycle Tool Box Set Socket Wrench Sleeve Suit Hardware Auto Car Repair Tools Home Tool kit Set",,Tools,EGP 316.92,,,,,,,,,,https://m.media-amazon.com/images/I/71mYoZWzQhL._AC_UL320_.jpg,https://m.media-amazon.com/images/I/71mYoZWzQhL._AC_UL320_.jpg,,,,,,,,,,,https://www.amazon.eg/dp/B0DS13JYM4,2026-04-15T04:12:31.544246
amazon,B0FGQX3TY8,"12-Piece Home Tool Set, Combination Hardware Tools with Case, Includes Hex Keys, Utility Cutter, Pliers, Screwdrivers",,Tools,EGP 390.00,,,3.5,,,,,,,https://m.media-amazon.com/images/I/61QZ6l6t8UL._AC_UL320_.jpg,https://m.media-amazon.com/images/I/61QZ6l6t8UL._AC_UL320_.jpg,,,,,,,,,,,https://www.amazon.eg/dp/B0FGQX3TY8,2026-04-15T04:12:31.544773
amazon,B0194XAMPQ,Bosch Professional Bosch accessories set and hand tools - 108 pieces,,Tools,"EGP 2,007.15",,,4.2,,,,,,,https://m.media-amazon.com/images/I/A11TQn9kxLL._AC_UL320_.jpg,https://m.media-amazon.com/images/I/A11TQn9kxLL._AC_UL320_.jpg,,,,,,,,,,,https://www.amazon.eg/dp/B0194XAMPQ,2026-04-15T04:12:31.545392
amazon,B0BTC26CRV,TOTAL EasyOut Tools TACSE0056 5 Piece Multi Size Set,,Tools,EGP 157.00,EGP 219.00,,4.0,List:,,,,,,https://m.media-amazon.com/images/I/61g0x7cYc9L._AC_UL320_.jpg,https://m.media-amazon.com/images/I/61g0x7cYc9L._AC_UL320_.jpg,,,,,,,,,,,https://www.amazon.eg/dp/B0BTC26CRV,2026-04-15T04:12:31.546024
amazon,B08YNV63YB,32-in-1 Professional Hardware Screw Driver Tool Kit lym H8841,,Tools,EGP 143.00,,,3.4,,,,,,,https://m.media-amazon.com/images/I/71G-YMJoVML._AC_UL320_.jpg,https://m.media-amazon.com/images/I/71G-YMJoVML._AC_UL320_.jpg,,,,,,,,,,,https://www.amazon.eg/dp/B08YNV63YB,2026-04-15T04:12:31.546572
amazon,B08HPB4NX8,TOTAL Spring clamp size 110 mm TOTAL by INECO,,Tools,EGP 70.00,,,4.4,,,,,,,https://m.media-amazon.com/images/I/718BBxHth1L._AC_UL320_.jpg,https://m.media-amazon.com/images/I/718BBxHth1L._AC_UL320_.jpg,,,,,,,,,,,https://www.amazon.eg/dp/B08HPB4NX8,2026-04-15T04:12:31.547138
amazon,B0GH1FT32K,"4 Inch Joint and Lift Clamp with 2 Claws, Multi Purpose Tool with Screw and Puller, Black (100mm)",,Tools,EGP 199.00,EGP 229.00,,1.0,List:,,,,,,https://m.media-amazon.com/images/I/51HsJABF4ZL._AC_UL320_.jpg,https://m.media-amazon.com/images/I/51HsJABF4ZL._AC_UL320_.jpg,,,,,,,,,,,https://www.amazon.eg/dp/B0GH1FT32K,2026-04-15T04:12:31.547732
amazon,B095X8XPCM,"BAYTORY Upgrade Cabinet Hardware Jig Punch Drill Guide Locator for Installation of Drawer Pull Handle Knob, Wood Door Adjustable Drilling Doweling Template Tool with Storage Bag (Plastic Blue)",,Tools,EGP 499.00,,,4.4,,,,,,,https://m.media-amazon.com/images/I/61DMg9R9x7L._AC_UL320_.jpg,https://m.media-amazon.com/images/I/61DMg9R9x7L._AC_UL320_.jpg,,,,,,,,,,,https://www.amazon.eg/dp/B095X8XPCM,2026-04-15T04:12:31.548297
amazon,B0BZ914SPN,3pc Mini G-clamp Set Cast Iron Frame Swivel Shoe T-bar Handle DIY Clamps for Woodwork G Clamps C Clamp Joiner Woodworking Clamps Professional,,Tools,EGP 161.10,EGP 179.00,,3.5,Was:,,,,,,https://m.media-amazon.com/images/I/71-yFxATRXL._AC_UL320_.jpg,https://m.media-amazon.com/images/I/71-yFxATRXL._AC_UL320_.jpg,,,,,,,,,,,https://www.amazon.eg/dp/B0BZ914SPN,2026-04-15T04:12:31.548891
amazon,B0CMXM8FCR,"Total TMPC4468P Standard Connection Crimper, 8-Inch Size",,Tools,EGP 255.00,EGP 354.00,,4.1,List:,,,,,,https://m.media-amazon.com/images/I/41pUgbLsv2L._AC_UL320_.jpg,https://m.media-amazon.com/images/I/41pUgbLsv2L._AC_UL320_.jpg,,,,,,,,,,,https://www.amazon.eg/dp/B0CMXM8FCR,2026-04-15T04:12:31.549583
amazon,B092391PBR,TOTAL QUICK BAR CLAMPS 12Inches THT1340602,,Tools,EGP 216.00,,,4.4,,,,,,,https://m.media-amazon.com/images/I/71UygOC7ihL._AC_UL320_.jpg,https://m.media-amazon.com/images/I/71UygOC7ihL._AC_UL320_.jpg,,,,,,,,,,,https://www.amazon.eg/dp/B092391PBR,2026-04-15T04:12:31.550155
amazon,B0C59Q48DH,"Grommet Eyelet Plier Set, Eyelet Hole Punch Pliers Kit with 100 Metal Eyelets, Grommet Tool Kit for Leather Clothes Belt (100 Pieces)",,Tools,EGP 119.90,,,3.1,,,,,,,https://m.media-amazon.com/images/I/61yu9A-L82L._AC_UL320_.jpg,https://m.media-amazon.com/images/I/61yu9A-L82L._AC_UL320_.jpg,,,,,,,,,,,https://www.amazon.eg/dp/B0C59Q48DH,2026-04-15T04:12:31.550660
amazon,B002KDR83C,PRIME-LINE P 7505 Screen Rolling Tool – A Must Have Tool for Installing Window and Door Screens – Spline Roller with Wood Handle and Steel Wheels – Durable and Easy to Use (Single Pack),,Tools,EGP 310.00,,,4.6,,,,,,,https://m.media-amazon.com/images/I/41PlgZnhpxL._AC_UL320_.jpg,https://m.media-amazon.com/images/I/41PlgZnhpxL._AC_UL320_.jpg,,,,,,,,,,,https://www.amazon.eg/dp/B002KDR83C,2026-04-15T04:12:31.551205
amazon,B06Y3J2S1S,Tolsen Planer,,Tools,EGP 356.82,,,3.8,,,,,,,https://m.media-amazon.com/images/I/61n1YL72GSL._AC_UL320_.jpg,https://m.media-amazon.com/images/I/61n1YL72GSL._AC_UL320_.jpg,,,,,,,,,,,https://www.amazon.eg/dp/B06Y3J2S1S,2026-04-15T04:12:31.551704
amazon,B00SAZ7S0W,"IKEA 001.692.54 Fixa Tool Kit, 17Piece, Orange &White, Large",,Tools,EGP 774.04,,,4.4,,,,,,,https://m.media-amazon.com/images/I/71pmecKg82L._AC_UL320_.jpg,https://m.media-amazon.com/images/I/71pmecKg82L._AC_UL320_.jpg,,,,,,,,,,,https://www.amazon.eg/dp/B00SAZ7S0W,2026-04-15T04:12:31.552229
amazon,B0DPQNZ3WX,"Jadever JDCP1104 Letter G Clamp, 4-Inch Size",,Tools,EGP 130.00,EGP 136.00,,4.1,List:,,,,,,https://m.media-amazon.com/images/I/41PfWP+ZA3L._AC_UL320_.jpg,https://m.media-amazon.com/images/I/41PfWP+ZA3L._AC_UL320_.jpg,,,,,,,,,,,https://www.amazon.eg/dp/B0DPQNZ3WX,2026-04-15T04:12:31.552807
amazon,B084TR91TD,"90 Degree Corner Clamp, 4PCS Adjustable Single Handle Spring Loaded Right Angle Clamp,Swing Woodworking Clip Clamp Tool",,Tools,EGP 340.00,,,4.2,,,,,,,https://m.media-amazon.com/images/I/71-TwuLD2nL._AC_UL320_.jpg,https://m.media-amazon.com/images/I/71-TwuLD2nL._AC_UL320_.jpg,,,,,,,,,,,https://www.amazon.eg/dp/B084TR91TD,2026-04-15T04:12:31.553336
amazon,B09SGB6KGQ,Total Tools 14 Piece Screwdriver and Precision Set-THT250614,,Tools,EGP 500.00,,,4.2,,,,,,,https://m.media-amazon.com/images/I/81MX22pKh0L._AC_UL320_.jpg,https://m.media-amazon.com/images/I/81MX22pKh0L._AC_UL320_.jpg,,,,,,,,,,,https://www.amazon.eg/dp/B09SGB6KGQ,2026-04-15T04:12:31.553835
amazon,B098TYK46T,Total HAND TOOLS SET 9 PCS TOTALTOOLS THKTHP90096,,Tools,EGP 855.00,,,4.4,,,,,,,https://m.media-amazon.com/images/I/71AZh0+8XgL._AC_UL320_.jpg,https://m.media-amazon.com/images/I/71AZh0+8XgL._AC_UL320_.jpg,,,,,,,,,,,https://www.amazon.eg/dp/B098TYK46T,2026-04-15T04:12:31.554363
amazon,B0CFV6T2D5,TOTAL THKTHP21006 100 Pcs Tools Set,,Tools,"EGP 5,350.00",,,4.1,,,,,,,https://m.media-amazon.com/images/I/81c2UD6hU8L._AC_UL320_.jpg,https://m.media-amazon.com/images/I/81c2UD6hU8L._AC_UL320_.jpg,,,,,,,,,,,https://www.amazon.eg/dp/B0CFV6T2D5,2026-04-15T04:12:31.554870
amazon,B098TXT7Z2,TOTAL TOOLS 6 Pcs screwdriver set - THT250606,,Tools,EGP 222.00,EGP 328.00,,4.3,List:,,,,,,https://m.media-amazon.com/images/I/61KLen+-vLL._AC_UL320_.jpg,https://m.media-amazon.com/images/I/61KLen+-vLL._AC_UL320_.jpg,,,,,,,,,,,https://www.amazon.eg/dp/B098TXT7Z2,2026-04-15T04:12:31.555545
amazon,B09S3XFPD2,TOTAL TOOLS Claw hammer 8oz/220g - THTS7308,,Tools,EGP 250.00,,,4.4,,,,,,,https://m.media-amazon.com/images/I/61323EGlrVL._AC_UL320_.jpg,https://m.media-amazon.com/images/I/61323EGlrVL._AC_UL320_.jpg,,,,,,,,,,,https://www.amazon.eg/dp/B09S3XFPD2,2026-04-15T04:12:31.556135
amazon,B01N7T0ZGP,"Tolsen File Set Black, 32046",,Tools,EGP 175.00,EGP 185.00,,3.9,Was:,,,,,,https://m.media-amazon.com/images/I/61QMPvwq2UL._AC_UL320_.jpg,https://m.media-amazon.com/images/I/61QMPvwq2UL._AC_UL320_.jpg,,,,,,,,,,,https://www.amazon.eg/dp/B01N7T0ZGP,2026-04-15T04:12:31.556731
amazon,B0CPFMTTWF,"AH1139775-10 CR-V Straight Jaw Locking Plier with Ni-Plated Hex Screw and TPR Handle, 250 mm Size",,Tools,EGP 299.00,,,4.5,,,,,,,https://m.media-amazon.com/images/I/51o+wb5Se4L._AC_UL320_.jpg,https://m.media-amazon.com/images/I/51o+wb5Se4L._AC_UL320_.jpg,,,,,,,,,,,https://www.amazon.eg/dp/B0CPFMTTWF,2026-04-15T04:12:31.557269
amazon,B0F38N59QL,Cassette Clamp Bicycle Cassette Removal Tool Cassette Removal Wrench Gear Chain,,Tools,EGP 220.00,,,3.1,,,,,,,https://m.media-amazon.com/images/I/51a95BeFNiL._AC_UL320_.jpg,https://m.media-amazon.com/images/I/51a95BeFNiL._AC_UL320_.jpg,,,,,,,,,,,https://www.amazon.eg/dp/B0F38N59QL,2026-04-15T04:12:31.557779
amazon,B0GQDKZM7T,"Drawer Slide Installation Jig, Orange Cabinet Hardware Mounting Tool with Adjustable Clamps and Measuring Guide",,Tools,EGP 999.00,,,,,,,,,,https://m.media-amazon.com/images/I/61k9q7fWj3L._AC_UL320_.jpg,https://m.media-amazon.com/images/I/61k9q7fWj3L._AC_UL320_.jpg,,,,,,,,,,,https://www.amazon.eg/dp/B0GQDKZM7T,2026-04-15T04:12:31.558265
amazon,B091CW6PJX,4pcs/set 90 Degree Right Angle Clamp Mitre Clamps Corner Clamp Picture Holder Woodwork For Woodworking tool,,Tools,EGP 269.10,EGP 299.00,,3.6,List:,,,,,,https://m.media-amazon.com/images/I/71mJ0WWL-TL._AC_UL320_.jpg,https://m.media-amazon.com/images/I/71mJ0WWL-TL._AC_UL320_.jpg,,,,,,,,,,,https://www.amazon.eg/dp/B091CW6PJX,2026-04-15T04:12:31.558866
amazon,B0F7DX5FTT,"6 Inch Joint and Lift Clamp with 2 Claws, Multi Purpose with Screw and Puller from BERING RAMA for Automatic Mechanical Tools Heavy Duty Service by Zaghloul Equipment",,Tools,EGP 330.00,,,5.0,,,,,,,https://m.media-amazon.com/images/I/51tUNYzCLgL._AC_UL320_.jpg,https://m.media-amazon.com/images/I/51tUNYzCLgL._AC_UL320_.jpg,,,,,,,,,,,https://www.amazon.eg/dp/B0F7DX5FTT,2026-04-15T04:12:31.559394
amazon,B0GDVF9BGJ,"Furniture Strip Scraper Tool with Spare Blades, Carpentry Strip Scraper Scraper Remove Strip Excess of Various Kinds (PVC, Wood, Melamine) Craft Cleaner",,Tools,EGP 320.00,,,1.0,,,,,,,https://m.media-amazon.com/images/I/61ZXmxeY1ML._AC_UL320_.jpg,https://m.media-amazon.com/images/I/61ZXmxeY1ML._AC_UL320_.jpg,,,,,,,,,,,https://www.amazon.eg/dp/B0GDVF9BGJ,2026-04-15T04:12:31.559894
amazon,B0FJ7JJPYQ,"JAZZEEL Jewellery Pliers Set, 3-Piece Hardware Tool Kit for Jewelry Making, Includes Mini Cutting Pliers, For Necklace, Bracelet, and DIY Crafts, Essential Tools for Hobbyists",,Tools,EGP 377.00,,,,,,,,,,https://m.media-amazon.com/images/I/615h-1mTyHL._AC_UL320_.jpg,https://m.media-amazon.com/images/I/615h-1mTyHL._AC_UL320_.jpg,,,,,,,,,,,https://www.amazon.eg/dp/B0FJ7JJPYQ,2026-04-15T04:12:31.560348
amazon,B0D1TLFQWN,"KENDO 46PC HSS Damaged Screw Extractor Set - Remover for Stripped Screws Nuts & Bolts, Drill Bit Tools for Easy Removal of Rusty & Broken Hardware, Easy Removal of Rusty Broken Hardware Gift",,Tools,"EGP 1,550.00",,,4.5,,,,,,,https://m.media-amazon.com/images/I/71REmFzZkmL._AC_UL320_.jpg,https://m.media-amazon.com/images/I/71REmFzZkmL._AC_UL320_.jpg,,,,,,,,,,,https://www.amazon.eg/dp/B0D1TLFQWN,2026-04-15T04:12:31.560855
amazon,B0CNLR22B6,"JonPhoe 60/90/120 Degree Angle Clamps for Woodworking: Right Angle Clip Fixer, Corner Clip, Spring Loaded, Adjustable Frame Cabinet Wood Tools Accessories for Carpentry, Punch, DIY",,Tools,EGP 323.00,,,5.0,,,,,,,https://m.media-amazon.com/images/I/61sCW-hGVHL._AC_UL320_.jpg,https://m.media-amazon.com/images/I/61sCW-hGVHL._AC_UL320_.jpg,,,,,,,,,,,https://www.amazon.eg/dp/B0CNLR22B6,2026-04-15T04:12:31.561383
amazon,B07QZKJCT3,"Total Tools 25Pcs Handtools Set - Pliers, Side Cutters, Wrench, Screwdriver",,Tools,EGP 955.00,,,4.1,,,,,,,https://m.media-amazon.com/images/I/816-kOcxyOL._AC_UL320_.jpg,https://m.media-amazon.com/images/I/816-kOcxyOL._AC_UL320_.jpg,,,,,,,,,,,https://www.amazon.eg/dp/B07QZKJCT3,2026-04-15T04:12:31.561877
amazon,B0DD7MKDBL,"fashion mania Multi-function repair tool, 11 in 1 Multi-function repair tool, Key Chain, Screwdriver, nail file, Bottle Opener, Wrench, ruler, card pin, Cell phone Holder (Silver)",,Tools,EGP 440.00,,,3.0,,,,,,,https://m.media-amazon.com/images/I/610d8VZ-KeL._AC_UL320_.jpg,https://m.media-amazon.com/images/I/610d8VZ-KeL._AC_UL320_.jpg,,,,,,,,,,,https://www.amazon.eg/dp/B0DD7MKDBL,2026-04-15T04:12:31.562398
amazon,B085ZDV2J6,Screen Rolling Tool-2PCS Screen Spline Repair Roller Tool for Installing Window and Door Screens with Wooden Handle and Steel Bearing Wheel,,Tools,EGP 625.00,,,4.5,,,,,,,https://m.media-amazon.com/images/I/61KD1EwAYkL._AC_UL320_.jpg,https://m.media-amazon.com/images/I/61KD1EwAYkL._AC_UL320_.jpg,,,,,,,,,,,https://www.amazon.eg/dp/B085ZDV2J6,2026-04-15T04:12:31.562888
amazon,B0DY6T1GHH,Zglol Hardware T-Handle Socket Wrench Spark Plug Removal Tool Kit for Car Spark Plug 2 Long Steel Bits 16mm 21mm,,Tools,EGP 159.00,,,2.3,,,,,,,https://m.media-amazon.com/images/I/51XNBpTHhQL._AC_UL320_.jpg,https://m.media-amazon.com/images/I/51XNBpTHhQL._AC_UL320_.jpg,,,,,,,,,,,https://www.amazon.eg/dp/B0DY6T1GHH,2026-04-15T04:12:31.563415
amazon,B098TWQ9R6,"Total C-Clamps (5in, Multi)",,Tools,EGP 196.73,,,4.7,,,,,,,https://m.media-amazon.com/images/I/61cefBT4ADL._AC_UL320_.jpg,https://m.media-amazon.com/images/I/61cefBT4ADL._AC_UL320_.jpg,,,,,,,,,,,https://www.amazon.eg/dp/B098TWQ9R6,2026-04-15T04:12:31.563905
amazon,B09B8WYW1C,"Total Automatic & Singles Clamps Tools, 18in 60kg",,Tools,EGP 241.00,,,4.3,,,,,,,https://m.media-amazon.com/images/I/517vyrbmhnL._AC_UL320_.jpg,https://m.media-amazon.com/images/I/517vyrbmhnL._AC_UL320_.jpg,,,,,,,,,,,https://www.amazon.eg/dp/B09B8WYW1C,2026-04-15T04:12:31.564480
amazon,B0992YZDYW,TOTAL Turquoise Spreader Clamp,,Tools,EGP 286.00,,,4.1,,,,,,,https://m.media-amazon.com/images/I/512QRvnhjhL._AC_UL320_.jpg,https://m.media-amazon.com/images/I/512QRvnhjhL._AC_UL320_.jpg,,,,,,,,,,,https://www.amazon.eg/dp/B0992YZDYW,2026-04-15T04:12:31.565066
amazon,B0F67MVMKR,بنطه فك وربط صليبه و عادة 1 قطعة طول 7 سنتيمتر خامة فاخرة يدوم طويل - اختر النمط المناسب (1),,Tools,EGP 139.00,,,4.6,,,,,,,https://m.media-amazon.com/images/I/31FmvfNmpkL._AC_UL320_.jpg,https://m.media-amazon.com/images/I/31FmvfNmpkL._AC_UL320_.jpg,,,,,,,,,,,https://www.amazon.eg/dp/B0F67MVMKR,2026-04-15T04:12:31.565568
amazon,B0BW8LDX5Q,"CASIMR 90 Degree Corner Clamp, Adjustable Single Handle Spring Loaded Right Angle Clamp, 4PCS Swing Woodworking Clip Clamp Tool",,Tools,EGP 299.00,,,4.2,,,,,,,https://m.media-amazon.com/images/I/710CvdKSHfL._AC_UL320_.jpg,https://m.media-amazon.com/images/I/710CvdKSHfL._AC_UL320_.jpg,,,,,,,,,,,https://www.amazon.eg/dp/B0BW8LDX5Q,2026-04-15T04:12:31.566100
amazon,B0DM921SYX,"6” Spring Clamp set of 2, Heavy Duty Spring Clips for Woodwork طقم مشبك كلامب 2 قطع 6بوصة by circle tools",,Tools,EGP 125.00,,,4.0,,,,,,,https://m.media-amazon.com/images/I/41ef5O4uRFL._AC_UL320_.jpg,https://m.media-amazon.com/images/I/41ef5O4uRFL._AC_UL320_.jpg,,,,,,,,,,,https://www.amazon.eg/dp/B0DM921SYX,2026-04-15T04:12:31.566595
amazon,B07JMHNTPJ,D11-1Tool-PICK UP TOOL Flexible TOLSEN ماسك يدوى مرن,,Tools,EGP 197.99,,,4.8,,,,,,,https://m.media-amazon.com/images/I/7197Mhx0BIL._AC_UL320_.jpg,https://m.media-amazon.com/images/I/7197Mhx0BIL._AC_UL320_.jpg,,,,,,,,,,,https://www.amazon.eg/dp/B07JMHNTPJ,2026-04-15T04:12:31.567116
amazon,B072XC8W69,"AMYAMY 2.5"" Aluminum Vise Flat Pliers Mini woodworking Bench Clamp repair tools Drill press vise for Drill press stand",,Tools,EGP 424.00,,,4.3,,,,,,,https://m.media-amazon.com/images/I/51MEl6lRHfL._AC_UL320_.jpg,https://m.media-amazon.com/images/I/51MEl6lRHfL._AC_UL320_.jpg,,,,,,,,,,,https://www.amazon.eg/dp/B072XC8W69,2026-04-15T04:12:31.567611
amazon,B0D2L346Z6,"2Pcs Right Angle Clamp, 90 Degree Corner Clamps for Woodwork, Precision Open and Close Type Right Angle Splicing Clamp Locator Stainless Steel Wood Fixing Clamping Tool for DIY Woodworking Welding",,Tools,EGP 804.00,,,3.4,,,,,,,https://m.media-amazon.com/images/I/81pmn70jEtL._AC_UL320_.jpg,https://m.media-amazon.com/images/I/81pmn70jEtL._AC_UL320_.jpg,,,,,,,,,,,https://www.amazon.eg/dp/B0D2L346Z6,2026-04-15T04:12:31.568131
amazon,B0D4K12TJD,Uyus Tools Prr204 Quick Ratchet Bar Clamp 4 Inch - Yellow,,Tools,EGP 167.40,,,4.5,,,,,,,https://m.media-amazon.com/images/I/31uPFK3V39L._AC_UL320_.jpg,https://m.media-amazon.com/images/I/31uPFK3V39L._AC_UL320_.jpg,,,,,,,,,,,https://www.amazon.eg/dp/B0D4K12TJD,2026-04-15T04:12:35.256629
amazon,B0D3HPWZP2,DIY-Kit Bird Vice Fixing Tools - Electronic's Bench Vice - Aluminium Alloy Bench Clamp Mini Table Screw Vise - Aluminum Small Jewelers Hobby Clamp On Table Bench Vise,,Tools,EGP 174.99,,,3.2,,,,,,,https://m.media-amazon.com/images/I/61xU85aEeZL._AC_UL320_.jpg,https://m.media-amazon.com/images/I/61xU85aEeZL._AC_UL320_.jpg,,,,,,,,,,,https://www.amazon.eg/dp/B0D3HPWZP2,2026-04-15T04:12:35.257180
amazon,B098TXDFQZ,"Total Tools Automatic Towel Heavy Duty Clamp (30cm, 60kg, Green)",,Tools,EGP 246.00,,,3.8,,,,,,,https://m.media-amazon.com/images/I/51zZgXSOvtL._AC_UL320_.jpg,https://m.media-amazon.com/images/I/51zZgXSOvtL._AC_UL320_.jpg,,,,,,,,,,,https://www.amazon.eg/dp/B098TXDFQZ,2026-04-15T04:12:35.257748
amazon,B08P74L81P,Corner Clamps Set of 4 90°C Universal Clamp DIY Tool Right Angle Clamp,,Tools,EGP 333.00,,,3.8,,,,,,,https://m.media-amazon.com/images/I/512JXrQoaRL._AC_UL320_.jpg,https://m.media-amazon.com/images/I/512JXrQoaRL._AC_UL320_.jpg,,,,,,,,,,,https://www.amazon.eg/dp/B08P74L81P,2026-04-15T04:12:35.258294
amazon,B0DQL21HTM,"Jadever 4-Piece Corner Clamp, 90° Right Angle Clamp Set with 4 Rubber Feet, Adjustable Spring Loaded, Fit for Woodworking/Picture Framing",,Tools,EGP 196.00,,,4.0,,,,,,,https://m.media-amazon.com/images/I/61VxlmpnJIL._AC_UL320_.jpg,https://m.media-amazon.com/images/I/61VxlmpnJIL._AC_UL320_.jpg,,,,,,,,,,,https://www.amazon.eg/dp/B0DQL21HTM,2026-04-15T04:12:35.258820
amazon,B0DFZPFD22,M8 Screw Handle Used for Machines Accessory 4 Pieces,,Tools,EGP 140.00,,,5.0,,,,,,,https://m.media-amazon.com/images/I/514LxJYEE4L._AC_UL320_.jpg,https://m.media-amazon.com/images/I/514LxJYEE4L._AC_UL320_.jpg,,,,,,,,,,,https://www.amazon.eg/dp/B0DFZPFD22,2026-04-15T04:12:35.259355
amazon,B0CQZN5QYW,QUARKZMAN 100 Sets 10 x 9 mm Metal Leather Rivets with Double Cap Snap Clips and Installation Tools for Leather Crafts Repair and Decoration Bronze,,Tools,EGP 866.00,,,4.2,,,,,,,https://m.media-amazon.com/images/I/710sD7-ACiL._AC_UL320_.jpg,https://m.media-amazon.com/images/I/710sD7-ACiL._AC_UL320_.jpg,,,,,,,,,,,https://www.amazon.eg/dp/B0CQZN5QYW,2026-04-15T04:12:35.259873
amazon,B08T1K2F64,"Adjustable SpokeShave - 9""/215mm Adjustable Hand Edge Planer Spoke Shave Manual Woodworking Hand Tool for Wood Craft, Wood Craver, Wood Working",,Tools,EGP 285.00,,,4.7,,,,,,,https://m.media-amazon.com/images/I/61h1tW55rFL._AC_UL320_.jpg,https://m.media-amazon.com/images/I/61h1tW55rFL._AC_UL320_.jpg,,,,,,,,,,,https://www.amazon.eg/dp/B08T1K2F64,2026-04-15T04:12:35.260416
amazon,B0CNZ46DHH,Generic 1M T-Track + 2 Carpentry Bank Grips - Red Aluminum C-clamp Vise for Woodworking,,Tools,EGP 910.00,,,4.8,,,,,,,https://m.media-amazon.com/images/I/516ewy8O+hL._AC_UL320_.jpg,https://m.media-amazon.com/images/I/516ewy8O+hL._AC_UL320_.jpg,,,,,,,,,,,https://www.amazon.eg/dp/B0CNZ46DHH,2026-04-15T04:12:35.260936
amazon,B0D87LMT8S,"Jadever G Clamp, 6-Inch Size, Green",,Tools,EGP 271.00,,,5.0,,,,,,,https://m.media-amazon.com/images/I/51s3g00vX9L._AC_UL320_.jpg,https://m.media-amazon.com/images/I/51s3g00vX9L._AC_UL320_.jpg,,,,,,,,,,,https://www.amazon.eg/dp/B0D87LMT8S,2026-04-15T04:12:35.261565
amazon,B091D5P596,90 Degree Right Angle Clamp Photo Frames Corner Carpentry DIY Hand Tool,,Tools,EGP 117.00,,,4.2,,,,,,,https://m.media-amazon.com/images/I/61W1XSMNRxL._AC_UL320_.jpg,https://m.media-amazon.com/images/I/61W1XSMNRxL._AC_UL320_.jpg,,,,,,,,,,,https://www.amazon.eg/dp/B091D5P596,2026-04-15T04:12:35.262094
amazon,B0GJD3C2D6,"GQ 10 Pack Heavy Duty Stainless Steel Toggle Latch, Degree Spring Loaded Locking Latch, with 20 Screws, Stainless Steel Silver Catch Hasp Clamp Clip Lock for Cabinet, Wooden Case, Box, Chest, Toolbox",,Tools,EGP 599.00,,,,,,,,,,https://m.media-amazon.com/images/I/51zZ8gv4CQL._AC_UL320_.jpg,https://m.media-amazon.com/images/I/51zZ8gv4CQL._AC_UL320_.jpg,,,,,,,,,,,https://www.amazon.eg/dp/B0GJD3C2D6,2026-04-15T04:12:35.262560
amazon,B07ZC2BF3S,"F-Bar Clamps, 4pcs Woodworking F Clamp Mini 4-Inch Ratchet Bar Clamp Bar Clip Wood Carpenter Tool Grip Quick Ratchet Release Squeeze Woodworking DIY Hand Tool Kit",,Tools,EGP 799.00,,,3.4,,,,,,,https://m.media-amazon.com/images/I/61E5ScPJLEL._AC_UL320_.jpg,https://m.media-amazon.com/images/I/61E5ScPJLEL._AC_UL320_.jpg,,,,,,,,,,,https://www.amazon.eg/dp/B07ZC2BF3S,2026-04-15T04:12:35.263152
amazon,B0DF34CWXB,"Corner Clamps for Woodworking Set of 4, 90 Degree Right Angle Clamp for Wood Welding Jig Picture Photo Frame, Adjustable DIY Hand Carpenter Tool Miter Corner Clamp",,Tools,EGP 323.00,,,4.2,,,,,,,https://m.media-amazon.com/images/I/61tN2AUqrhL._AC_UL320_.jpg,https://m.media-amazon.com/images/I/61tN2AUqrhL._AC_UL320_.jpg,,,,,,,,,,,https://www.amazon.eg/dp/B0DF34CWXB,2026-04-15T04:12:35.263682
amazon,B09232DHC3,Total Bird sickle 50 mm moving 360 degrees Model: TOTAL THT6126,,Tools,,,,4.2,,,,,,,https://m.media-amazon.com/images/I/51Xwcic+zCL._AC_UL320_.jpg,https://m.media-amazon.com/images/I/51Xwcic+zCL._AC_UL320_.jpg,,,,,,,,,,,https://www.amazon.eg/dp/B09232DHC3,2026-04-15T04:12:35.264614
amazon,B08H7XVKK2,"OFYDNR 90 Degree Corner Clamps, 4 PCS Adjustable Right Angle Clamp Woodworking Clip Clamp Tool Corner Clip Fixer Corner Clamps for Woodworking Hand Tools",,Tools,EGP 369.00,,,4.2,,,,,,,https://m.media-amazon.com/images/I/619HSnNMpSL._AC_UL320_.jpg,https://m.media-amazon.com/images/I/619HSnNMpSL._AC_UL320_.jpg,,,,,,,,,,,https://www.amazon.eg/dp/B08H7XVKK2,2026-04-15T04:12:35.265235
amazon,B091D4LF2Q,"Angle Clamp, 4Pcs 90 Degree Right Angle Corner Holder Clamp, Multifunctional Picture Framing Holder, Woodworking Hand Tools",,Tools,EGP 309.60,,,3.5,,,,,,,https://m.media-amazon.com/images/I/61FrJDQ0fhL._AC_UL320_.jpg,https://m.media-amazon.com/images/I/61FrJDQ0fhL._AC_UL320_.jpg,,,,,,,,,,,https://www.amazon.eg/dp/B091D4LF2Q,2026-04-15T04:12:35.265784
amazon,B08HQLXJBK,TopHomer Band Clamp Vice Corner Jig 4m Belt for Woodwork Making Picture Frames Boxes DIY Tools(1 PCS),,Tools,EGP 382.50,,,3.6,,,,,,,https://m.media-amazon.com/images/I/51JHsxCUlpL._AC_UL320_.jpg,https://m.media-amazon.com/images/I/51JHsxCUlpL._AC_UL320_.jpg,,,,,,,,,,,https://www.amazon.eg/dp/B08HQLXJBK,2026-04-15T04:12:35.266353
amazon,B091CPPSJ3,"Other Test Screwdriver, Small- Yellow, Flat Head",,Tools,,,,4.5,,,,,,,https://m.media-amazon.com/images/I/413xac28ybL._AC_UL320_.jpg,https://m.media-amazon.com/images/I/413xac28ybL._AC_UL320_.jpg,,,,,,,,,,,https://www.amazon.eg/dp/B091CPPSJ3,2026-04-15T04:12:35.266829
amazon,B0F7DKFWJT,"4 Inch Joint and Lift Clamp with 2 Claws, Multi Purpose with Screw and Puller from BERING RAMA for Automatic Mechanical Tools Heavy Duty Service by Zaghloul Equipment",,Tools,EGP 320.00,,,,,,,,,,https://m.media-amazon.com/images/I/51tUNYzCLgL._AC_UL320_.jpg,https://m.media-amazon.com/images/I/51tUNYzCLgL._AC_UL320_.jpg,,,,,,,,,,,https://www.amazon.eg/dp/B0F7DKFWJT,2026-04-15T04:12:35.267333
amazon,B09TBH7DF6,"Total -Tools THKTHP21006 Tote Bit Manual Kit - Keys, Pins, Screwdriver",,Tools,"EGP 4,099.00","EGP 4,994.00",,1.0,List:,,,,,,https://m.media-amazon.com/images/I/81Fo9sUmZpL._AC_UL320_.jpg,https://m.media-amazon.com/images/I/81Fo9sUmZpL._AC_UL320_.jpg,,,,,,,,,,,https://www.amazon.eg/dp/B09TBH7DF6,2026-04-15T04:12:35.268035
amazon,B0FVDJ2LKG,"Zglol Hardware Model 1013_Blue and Black, Metal Heavy Duty Woodworking & Construction Tool",,Tools,EGP 925.00,,,,,,,,,,https://m.media-amazon.com/images/I/51GjRLYjXnL._AC_UL320_.jpg,https://m.media-amazon.com/images/I/51GjRLYjXnL._AC_UL320_.jpg,,,,,,,,,,,https://www.amazon.eg/dp/B0FVDJ2LKG,2026-04-15T04:12:35.268494
amazon,B0FV8JWHHG,"JAZZEEL 100 Sets of 10x9mm Bronze Metal Leather Rivets with Double Caps and Installation Tools, Complete Snap Clip Kit for Leather Crafts, DIY Repair, and Adding Decorative Metal Studs to Accessories",,Tools,EGP 799.00,,,,,,,,,,https://m.media-amazon.com/images/I/710sD7-ACiL._AC_UL320_.jpg,https://m.media-amazon.com/images/I/710sD7-ACiL._AC_UL320_.jpg,,,,,,,,,,,https://www.amazon.eg/dp/B0FV8JWHHG,2026-04-15T04:12:35.268931
