platform,asin,title,brand,category,current_price,original_price,discount,rating,reviews_count,prime_eligible,amazon_choice,sponsored,main_image,product_url,scraped_at
amazon,,"APT Wall Mounted Garden Hose Reel, Retractable Auto Rewind Pipe, 15m, 180 Swivel, Compact Blue Design, Durable PVC Hose, Outdoor Patio Watering Equipment, Lawn Plants Cleaning, Easy Storage",,Garden,"EGP 2,489.49",,,3.5,,,,,https://m.media-amazon.com/images/I/41HkGBtbr0L._AC_UL320_.jpg,https://www.amazon.eg/dp/B0FS221L7M,2026-03-28T02:51:28.576049
amazon,,"Ivy Leaf Screening Roll, Privacy Fence Screen, Artificial ivy Hedge Fence, Artificial Ivy Vine Leaf Decoration for Outdoor Decor, Garden screen (3m x 0.5m)",,Garden,EGP 240.00,,,4.1,,,,,https://m.media-amazon.com/images/I/81u7aKaWCaL._AC_UL320_.jpg,https://www.amazon.eg/dp/B09V153TYL,2026-03-28T02:51:28.576676
amazon,,"Sweet Furniture Patio Furniture Set of 3, Outdoor Rattan Chairs for Garden, Backyard, Porch, Poolside with Soft Cushion and Table Without Glass, Grey/Navy",,Garden,"EGP 3,650.00",,,5.0,,,,,https://m.media-amazon.com/images/I/61zHGHgqJ1L._AC_UL320_.jpg,https://www.amazon.eg/dp/B0DS95Y7K1,2026-03-28T02:51:28.577216
amazon,,"Natural Palm Garden Balcony Outdoor Furniture Set 5 Pieces (4 Chairs + Table), Waterproof and Sunproof Garden Session Set for Terrace and Chalet, Handmade",,Garden,"EGP 3,749.00",,,,,,,,https://m.media-amazon.com/images/I/61u2haZqCfL._AC_UL320_.jpg,https://www.amazon.eg/dp/B0GG6YRWQZ,2026-03-28T02:51:28.577700
amazon,,Plant Pot with Saucer 25cm with Drainage Holes,,Garden,EGP 90.00,,,,,,,,https://m.media-amazon.com/images/I/71TWnlUy9vL._AC_UL320_.jpg,https://www.amazon.eg/dp/B0GBCQPDDD,2026-03-28T02:51:28.578158
amazon,,"Rocks R-614 Waterproof Globe 24CM with Protective Grid – Durable Outdoor Light for Garden, Patio & Balcony – Black",,Garden,EGP 117.60,,,5.0,,,,,https://m.media-amazon.com/images/I/61EJSMbWt4L._AC_UL320_.jpg,https://www.amazon.eg/dp/B0FSLG72J3,2026-03-28T02:51:28.578752
amazon,,"DearHouse 118x39.4in Artificial Ivy Privacy Fence Wall Screen, Artificial Hedges Fence and Faux Ivy Vine Leaf Decoration for Outdoor Garden Decor",,Garden,EGP 445.00,,,4.2,,,,,https://m.media-amazon.com/images/I/812cG8JRL9L._AC_UL320_.jpg,https://www.amazon.eg/dp/B07TYLL6RP,2026-03-28T02:51:28.579310
amazon,,"Utoplike Teak Outdoor Side Table for Patio, Pool Coffee Accent Table, Wood End Tables for Garden, Backyard, Bed, Living Room, Couch",,Garden,"EGP 1,090.00","EGP 2,299.00",,4.0,Was:,,,,https://m.media-amazon.com/images/I/71W23zesPrL._AC_UL320_.jpg,https://www.amazon.eg/dp/B0C5SK9NF2,2026-03-28T02:51:28.579935
amazon,,"Solar Outdoor Garden Light, 640mm Light Pole, Black with Built-in LED Light, Modern Design with Cone Canopy for Gardens and Pathways",,Garden,EGP 800.00,,,5.0,,,,,https://m.media-amazon.com/images/I/61wS1OyOF2L._AC_UL320_.jpg,https://www.amazon.eg/dp/B0FXXQFNVV,2026-03-28T02:51:28.580475
amazon,,"Plant Pot, Plastic White 40cm - Plant Pot, Modern, Indoor and Outdoor Use, Planter Pot, Lightweight Garden",,Garden,EGP 599.00,,,,,,,,https://m.media-amazon.com/images/I/61+--ojCrjL._AC_UL320_.jpg,https://www.amazon.eg/dp/B0GMHZ6ZC7,2026-03-28T02:51:28.580928
amazon,,"Solar Outdoor Floor Lights, IP65 Waterproof Solar Garden Lights LED Solar Lights Landscape Lighting Garden Yard Path 8 LED (White) (8)",,Garden,EGP 330.00,EGP 490.00,,1.5,List:,,,,https://m.media-amazon.com/images/I/61UUK0dD46L._AC_UL320_.jpg,https://www.amazon.eg/dp/B0BXY2KTNK,2026-03-28T02:51:28.581601
amazon,,"EVERSECU Outdoor Motion Sensor Solar Lights 2000 Lumens 77 LEDs Spotlight with Remote Controller Floodlights Ip66 Waterproof, Wireless Dummy Decoy Fake Security Camera Porch Garden Patio Driveway",,Garden,EGP 269.00,EGP 300.00,,3.9,Was:,,,,https://m.media-amazon.com/images/I/61LUBaDC+ZL._AC_UL320_.jpg,https://www.amazon.eg/dp/B09D97LQQY,2026-03-28T02:51:28.582196
amazon,,"FENCE PANEL, Artificial Leaf Privacy Fence Screen, Green Leaf Hedge Screening, 0.5x3m, Plastic, for Garden, Balcony Decoration",,Garden,EGP 225.00,,,3.8,,,,,https://m.media-amazon.com/images/I/81w4i-WJyiL._AC_UL320_.jpg,https://www.amazon.eg/dp/B08ZLQDT4Z,2026-03-28T02:51:28.582827
amazon,,"Solar Lights Outdoor, 270º Four-Angle Lighting-2 Pack 100 LED Solar Security Light with Motion Sensor Solar Waterproof Wall Light Solar Powered Light with 3 Modes for Garden,Outside, Black",,Garden,EGP 329.99,,,4.0,,,,,https://m.media-amazon.com/images/I/71vp9G02APL._AC_UL320_.jpg,https://www.amazon.eg/dp/B07GVD9MYH,2026-03-28T02:51:28.583461
amazon,,"Solar Deck Lights Outdoor 8 Pack, Solar Lights Outdoor for Patio Brown Solar Step Lights LED Waterproof Lighting for Outdoor Stair, Deck,Patio,Yard, Fence (Warm White)",,Garden,EGP 400.00,,,3.8,,,,,https://m.media-amazon.com/images/I/71XfE2l+BxS._AC_UL320_.jpg,https://www.amazon.eg/dp/B07WRPH8P7,2026-03-28T02:51:28.583987
amazon,,"Geemoo 6 Pack Solar Flickering Dancing Flame Lights Waterproof Solar Torch Lights for Outdoor Garden Patio Pathway Yard Driveway Decorative, Warm White",,Garden,EGP 880.00,,,4.4,,,,,https://m.media-amazon.com/images/I/81yn6cR6AgL._AC_UL320_.jpg,https://www.amazon.eg/dp/B09MVX8HLY,2026-03-28T02:51:28.584531
amazon,,لمبه سبوط زرع لإضاءة الحدائق والحائط الزخرريه مصباح حديقة LED ديكور خارجي فائق السطوع عالية الطاقة الحديقة والجدار الفناء والممر الألومنيوم 7 وات بكاب إضاءة وروم - عدد 4 قطعه - معدن - اسود,,Garden,EGP 975.00,,,5.0,,,,,https://m.media-amazon.com/images/I/610mVuW2SpL._AC_UL320_.jpg,https://www.amazon.eg/dp/B0F9TW53S6,2026-03-28T02:51:28.585044
amazon,,Outdoor steel wall black,,Garden,EGP 312.80,,,3.6,,,,,https://m.media-amazon.com/images/I/71UBBmlOMVL._AC_UL320_.jpg,https://www.amazon.eg/dp/B0B9LLPZHN,2026-03-28T02:51:28.585622
amazon,,"Waterproof Garden Patio Furniture Cover Set,(320 x320 x72) 210D Heavy Duty Oxford Fabric UV Resistant Protection for Square Sofa Outdoor",,Garden,"EGP 1,600.00",,,4.2,,,,,https://m.media-amazon.com/images/I/71ojOk3KtaL._AC_UL320_.jpg,https://www.amazon.eg/dp/B0BK16RPYS,2026-03-28T02:51:28.586121
amazon,,"1 Pack Upgraded Solar Outdoor, Mini Solar Torch with Flickering Flames, Waterproof Landscape Decoration Dancing Flame for Garden Pathway Yard, Auto On/Off Dusk to Dawn",,Garden,EGP 109.10,,,3.3,,,,,https://m.media-amazon.com/images/I/5109cZ+7CfL._AC_UL320_.jpg,https://www.amazon.eg/dp/B08QZDKS1K,2026-03-28T02:51:28.586703
amazon,,"Solar Tungsten Wall Light for Outdoor Use, Solar Lights for Outdoor Use with Motion Sensor, IP65 Waterproof Solar Wall Lamp for Garden, Balcony, Fence, Yard (Black)",,Garden,EGP 240.00,,,3.0,,,,,https://m.media-amazon.com/images/I/618Qo0+D8eL._AC_UL320_.jpg,https://www.amazon.eg/dp/B0C7GTLG7V,2026-03-28T02:51:28.587293
amazon,,"Solar Lights Outdoor Garden, Solar Wall Lamp with 3 Lighting Modes, Wireless IP66 Waterproof Solar Motion Sensors Wall Lights, Exterior Wall Mount Lighting for Outside Courtyards Porch",,Garden,EGP 345.00,,,3.9,,,,,https://m.media-amazon.com/images/I/71AsmnLIqNL._AC_UL320_.jpg,https://www.amazon.eg/dp/B0CN6YTYGF,2026-03-28T02:51:28.587827
amazon,,"Flintronic Outdoor Solar Tungsten LED Wall Light With Motion Sensor, Waterproof IP65 Retro Lantern for Garden Lighting",,Garden,EGP 194.00,,,3.8,,,,,https://m.media-amazon.com/images/I/611B0nmnenL._AC_UL320_.jpg,https://www.amazon.eg/dp/B0CM6K6NZ7,2026-03-28T02:51:28.588335
amazon,,"Retoo Solar Lights for Outdoor Use with Motion Sensor LED, Outdoor Solar Light, Waterproof, Super Bright Garden Wall Light for Wall, Post, Pathway, Garden, Outdoor Light, Security Wall Light",,Garden,EGP 290.00,,,3.9,,,,,https://m.media-amazon.com/images/I/81gfruu-1CL._AC_UL320_.jpg,https://www.amazon.eg/dp/B0CPYCQP82,2026-03-28T02:51:28.588860
amazon,,"Sweet Furniture Patio Furniture Set of 4, Outdoor Rattan Chairs for Garden, Backyard, Porch, Poolside with Soft Cushion and Table Without Glass, Grey Beige",,Garden,"EGP 5,650.00",,,5.0,,,,,https://m.media-amazon.com/images/I/71h631Mj8sL._AC_UL320_.jpg,https://www.amazon.eg/dp/B0DQ9MB3M8,2026-03-28T02:51:31.820027
amazon,,Lilys garden Garden FirePlace Small,,Garden,EGP 611.00,,,4.0,,,,,https://m.media-amazon.com/images/I/51JqxoqUhcL._AC_UL320_.jpg,https://www.amazon.eg/dp/B0CV13T7N9,2026-03-28T02:51:31.820569
amazon,,"50W Slim LED Outdoor Flood Light, IP66 Waterproof and Sunlight for Heavy Load, 9000 Lumens, 3000K Warm Yellow - Long Lasting 50000 Hours Playtime, Outdoor Lighting for Garden, Patio, Garage",,Garden,EGP 490.00,,,,,,,,https://m.media-amazon.com/images/I/41Q94SRM5+L._AC_UL320_.jpg,https://www.amazon.eg/dp/B0GGJQVZ2G,2026-03-28T02:51:31.821026
amazon,,"25 cm Square Plastic Plant Pot with Drainage Tray – Modern Indoor Outdoor Planter – Durable Flower Pot for Home, Balcony and Garden (Yellow)",,Garden,EGP 144.15,,,,,,,,https://m.media-amazon.com/images/I/61ulrIrGVWL._AC_UL320_.jpg,https://www.amazon.eg/dp/B0GR1CD25F,2026-03-28T02:51:31.821531
amazon,,"120LED Solar Wall Lamp Outdoor Street Lights Waterproof Security Lighting Remote Control Motion Sensor Solar Powered Light for Gazebo,Garden,Garage,Yard,Patio,Lawn,Balcony",,Garden,EGP 294.00,,,2.7,,,,,https://m.media-amazon.com/images/I/5160musdtxL._AC_UL320_.jpg,https://www.amazon.eg/dp/B09WDYV7MV,2026-03-28T02:51:31.822077
amazon,,"MORA Classic Garden Lantern, Black Outdoor Lighting, Glass Pole Lamp for Fences and Balconies, Waterproof",,Garden,EGP 375.00,,,4.5,,,,,https://m.media-amazon.com/images/I/710s3v5mROL._AC_UL320_.jpg,https://www.amazon.eg/dp/B0FYGC9T9V,2026-03-28T02:51:31.822613
amazon,,"Pots4Nature 5 Tier Stacking Vertical Flowers Garden Vegetables Strawberries Herbs Plastic Planter Pots For Indoor/Outdoor, Terrace, Balcony, Patios And Backyards Gardening Tower - White - 37 Cm",,Garden,EGP 650.00,,,4.2,,,,,https://m.media-amazon.com/images/I/71vQY2y+r5L._AC_UL320_.jpg,https://www.amazon.eg/dp/B07Q4DFPT2,2026-03-28T02:51:31.823142
amazon,,"Waterproof LED Ground Aspot, Stainless Steel, 7W, Outdoor Lighting for Gardens and Pathways, 12x10.5cm",,Garden,EGP 349.00,,,5.0,,,,,https://m.media-amazon.com/images/I/31b7Pl9qeiL._AC_UL320_.jpg,https://www.amazon.eg/dp/B0G966B6QH,2026-03-28T02:51:31.823678
amazon,,"GIGALUMI Solar Outdoor Lights,12 Pack LED Solar Lights Outdoor Waterproof, Solar Walkway Lights Maintain 10 Hours of Lighting for Your Garden, Landscape, Path, Yard, Patio, Driveway",,Garden,"EGP 2,100.00","EGP 2,230.01",,4.1,List:,,,,https://m.media-amazon.com/images/I/71RZ6JvEpHL._AC_UL320_.jpg,https://www.amazon.eg/dp/B07YZ4LTH3,2026-03-28T02:51:31.824281
amazon,,ZealWe Garden Parasol 3m Umbrella Outdoor Sun Shade with Tilt Crank Handle and 8 Ribs for Patio Beach Pool Lawn Backyard Deck,,Garden,"EGP 2,950.00",,,4.2,,,,,https://m.media-amazon.com/images/I/61PQZo6Fv3L._AC_UL320_.jpg,https://www.amazon.eg/dp/B0DZ63M1L8,2026-03-28T02:51:31.824811
amazon,,"Sweet Furniture Patio Furniture Set of 4, Outdoor Rattan Chairs for Garden, Backyard, Porch, Poolside with Soft Cushion and Table Without Glass, Grey Brown",,Garden,"EGP 5,650.00",,,5.0,,,,,https://m.media-amazon.com/images/I/61K4NhsFAsL._AC_UL320_.jpg,https://www.amazon.eg/dp/B0DQ9KGBTB,2026-03-28T02:51:31.825299
amazon,,"T-SUN Solar Spotlights, 7 LED Color-Changing Solar Landscape Lamps, 2-in-1 Multi Use Outdoor Wall Lights, Decorative Lights for Outdoor, Garden, Lawn, Pathway, Party & Christma",,Garden,EGP 850.00,,,4.3,,,,,https://m.media-amazon.com/images/I/61Efj2UJ4BL._AC_UL320_.jpg,https://www.amazon.eg/dp/B078V66WM4,2026-03-28T02:51:31.825878
amazon,,"Cairolight square outdoor aluminum lantern with glass, decorative for gardens and fences, includes socket (bulb not included).",,Garden,EGP 350.00,EGP 400.00,,,List:,,,,https://m.media-amazon.com/images/I/71Z+w0SKLXL._AC_UL320_.jpg,https://www.amazon.eg/dp/B0G2SLKFV8,2026-03-28T02:51:31.826390
amazon,,Geemoo 12 Pack Solar Flickering Dancing Flame Lights Waterproof Solar Torch Lights for Outdoor Garden Patio Pathway Yard Driveway Decorative,,Garden,"EGP 1,714.68",,,4.3,,,,,https://m.media-amazon.com/images/I/812jk0ZKeLL._AC_UL320_.jpg,https://www.amazon.eg/dp/B09YR95ZR2,2026-03-28T02:51:31.826918
amazon,,Egardenkart Outdoor Watering Timer Automatic watering timer Large Screen Multifunctional Timing Watering Device Outdoor Garden Sprinkler Controller Intelligent Automatic Irrigation System Waterproof,,Garden,"EGP 1,899.99",,,4.3,,,,,https://m.media-amazon.com/images/I/51x4Z4rF-8L._AC_UL320_.jpg,https://www.amazon.eg/dp/B0B2N173XD,2026-03-28T02:51:31.827404
amazon,,"Rainberg 6ft Heavy Duty Folding Table, Sturdy Metal Frame, Foldable Table Waterproof, Portable, Picnic table, Camping table, Ideal for Parties, Garden, BBQ, Beach, Indoor & Outdoor use (6FT - WHITE)",,Garden,"EGP 5,200.00","EGP 5,626.00",,4.3,Was:,,,,https://m.media-amazon.com/images/I/510hdpEiJ2L._AC_UL320_.jpg,https://www.amazon.eg/dp/B09ZYP19CK,2026-03-28T02:51:31.828005
amazon,,"for Lighting Wall Lantern for Outdoor Lighting, 15 cm x 15 cm Size Black",,Garden,EGP 290.00,,,5.0,,,,,https://m.media-amazon.com/images/I/61wn+yCWbTL._AC_UL320_.jpg,https://www.amazon.eg/dp/B0CQ8KKFW2,2026-03-28T02:51:31.828538
amazon,,Solar Lights Outdoor Waterproof - Solar Motion Sensor Lights 270° Wide Angle: Solar Security Lights 3 Adjustable Heads LED Flood Lights Super Bright Solar Powered Wall Lights with Remote Control,,Garden,EGP 799.99,,,4.1,,,,,https://m.media-amazon.com/images/I/81XsKpp1lpL._AC_UL320_.jpg,https://www.amazon.eg/dp/B08XZLPRLG,2026-03-28T02:51:31.829036
amazon,,Rectangular Planter Pot 50cm*17cm with Built-in Plate - Durable Metal Stand Electrostatic Coated White Hanging - (Grey),,Garden,EGP 247.00,,,4.5,,,,,https://m.media-amazon.com/images/I/41RfiN6F4LL._AC_UL320_.jpg,https://www.amazon.eg/dp/B0D2YD6MPT,2026-03-28T02:51:31.829598
amazon,,"Pack of 4 Solar Lights for Outdoors, Solar Light Outdoor Wall Light, Solar Outdoor Light, 8 LED Solar Lights for Outdoor Use for Garden, Lawn, Balcony, Patio, Yard, IP65 Waterproof, Warm White",,Garden,EGP 850.00,,,3.0,,,,,https://m.media-amazon.com/images/I/71Cjoc8z8CL._AC_UL320_.jpg,https://www.amazon.eg/dp/B0CCQP7S2R,2026-03-28T02:51:31.830098
amazon,,"Outdoor Patio Furniture Set, Wicker Chair and Table Set, Hanging Egg Chair, 122 cm",,Garden,"EGP 1,650.00",,,1.0,,,,,https://m.media-amazon.com/images/I/71FDm8U0uaL._AC_UL320_.jpg,https://www.amazon.eg/dp/B0DQ1F34LK,2026-03-28T02:51:31.830619
amazon,,"ShopLaLa Wall Planter – Wooden Air Plant Succulent Holder Hanger Indoor Outdoor, Live Orchid Wall Wood Display Frame Vertical Garden Balcony Deck Bathroom Macetas para Plantas De Aire 15.7"" (40cm)",,Garden,EGP 300.00,,,4.3,,,,,https://m.media-amazon.com/images/I/71KQg5TgGJL._AC_UL320_.jpg,https://www.amazon.eg/dp/B07Y5DRLJ8,2026-03-28T02:51:31.831236
amazon,,"SWITTE Outdoor Rocking Chair, Patio Egg Rocking Chair, Indoor Papasan Chair, Rattan Wicker Lounge Chair, Comfy Modern Royal Chair for Bedroom, Living Room, Porch, Garden, Lawn-Cream New",,Garden,"EGP 6,900.00",,,4.3,,,,,https://m.media-amazon.com/images/I/81qxpxSZPQL._AC_UL320_.jpg,https://www.amazon.eg/dp/B0CNCJZ44G,2026-03-28T02:51:31.831748
amazon,,"Hydroponic Cube Set for Germination and Cuttings, Breathable and Environmentally Friendly Substrate, Ideal for Seedlings, Indoor and Outdoor Gardens, Plant Growth (100)",,Garden,EGP 490.00,,,3.8,,,,,https://m.media-amazon.com/images/I/61913dYX3jL._AC_UL320_.jpg,https://www.amazon.eg/dp/B0DN1QVJT2,2026-03-28T02:51:31.832230
amazon,,Sun Shade Sail Canopy Rectangular 3 x 6 m UV Protection 95% Greenhouse Shade Fabric with Ropes for Garden Outdoor Patio Sand Yellow,,Garden,"EGP 2,000.00",,,3.8,,,,,https://m.media-amazon.com/images/I/81l8vPXRHJL._AC_UL320_.jpg,https://www.amazon.eg/dp/B0C2JVCXKY,2026-03-28T02:51:35.471868
amazon,,"Sweet Furniture Patio Furniture Set of 4, Outdoor Rattan Chairs for Garden, Backyard, Porch, Poolside with Soft Cushion and Table Without Glass, Black Beige",,Garden,"EGP 5,650.00",,,4.3,,,,,https://m.media-amazon.com/images/I/51eH5LLgjHL._AC_UL320_.jpg,https://www.amazon.eg/dp/B0DQBJ8SB5,2026-03-28T02:51:35.472384
amazon,,"Live Areca Palm Plant, Yellow Indoor & Outdoor Decorative Tropical Plant, Easy Care Home Garden, Balcony and Patio Plant, Natural Air-Purifying Foliage, Perfect Potted Tropical Palm",,Garden,EGP 169.93,,,,,,,,https://m.media-amazon.com/images/I/61fgwd-aOpL._AC_UL320_.jpg,https://www.amazon.eg/dp/B0GMYVSJPR,2026-03-28T02:51:35.472864
amazon,,"3‑Piece Outdoor Wicker Conversation Bistro Set, Weather‑Resistant Patio Furniture with Cushions & Storage Table, Space Saving for Balcony, Garden, Porch",,Garden,"EGP 3,500.00",,,,,,,,https://m.media-amazon.com/images/I/71bSbuUA3pL._AC_UL320_.jpg,https://www.amazon.eg/dp/B0GR66ST71,2026-03-28T02:51:35.473320
amazon,,"Meridian Set of 4 Home Planters, 20cm, Black, Plastic with Platter, Nursery Pot Small Pots to Start - Simple Style Garden Pot Plant Container, Simple Design Plant Pots",,Garden,EGP 428.00,,,,,,,,https://m.media-amazon.com/images/I/41oc8vuoiqL._AC_UL320_.jpg,https://www.amazon.eg/dp/B0F9LGLMB6,2026-03-28T02:51:35.473846
amazon,,"8LED Solar Garden Lights, Solar Swaying Light, Sway by Wind, Outdoor Waterproof Landscape Decoration Lights, 2 Pack, Warm White",,Garden,EGP 700.00,,,4.1,,,,,https://m.media-amazon.com/images/I/81WwXcrEaVL._AC_UL320_.jpg,https://www.amazon.eg/dp/B0BCKSHMJ6,2026-03-28T02:51:35.474373
amazon,,"Gravity Zero Lounger, Folding Garden Sun Loungers with Pillow Reclining Beach Chair for Outdoor Camping Terrace Garden, Black",,Garden,"EGP 5,000.00",,,5.0,,,,,https://m.media-amazon.com/images/I/41bvxAsoVqL._AC_UL320_.jpg,https://www.amazon.eg/dp/B089QHNB9J,2026-03-28T02:51:35.474948
amazon,,"SKY-TOUCH Patio Furniture Cover 250x200x80cm, Garden Furniture Set Cover Waterproof, Outdoor Table and Chair Set Covers, Heavy Duty Oxford Fabric Furniture Covers Dust Proof Anti-UV",,Garden,"EGP 1,455.00",,,4.1,,,,,https://m.media-amazon.com/images/I/715lzlL4mRL._AC_UL320_.jpg,https://www.amazon.eg/dp/B0CQ578R58,2026-03-28T02:51:35.475878
amazon,,"VOTA Lilys Garden Wooden Garden Fence Panel, 100cm x 60cm",,Garden,EGP 510.00,EGP 569.00,,3.1,List:,,,,https://m.media-amazon.com/images/I/31XuyWlNfGL._AC_UL320_.jpg,https://www.amazon.eg/dp/B0DJMQMGVZ,2026-03-28T02:51:35.476583
amazon,,"Small Gardening Potted Plants for Plants, Home DIY Decor, Aquarium Gravel, Vase Fillers, Fairy Garden, Landscaping Outdoor Stones 1 Pack (700g) Outdoor Decoration - Silver",,Garden,EGP 100.00,,,,,,,,https://m.media-amazon.com/images/I/51RrGXlsJdL._AC_UL320_.jpg,https://www.amazon.eg/dp/B0CH113LC3,2026-03-28T02:51:35.477053
amazon,,Lamps® LM-2931B 12W Black Aluminum Outdoor Bollard Light,,Garden,"EGP 1,750.00",,,,,,,,https://m.media-amazon.com/images/I/61X5cagPn0L._AC_UL320_.jpg,https://www.amazon.eg/dp/B0FLWP65QG,2026-03-28T02:51:35.477546
amazon,,"Solar Lights Garden, Pack of 3 Solar Lights for Outdoor Use with 7 Colours, Waterproof IP65 Jellyfish, Solar Garden Stake for Outdoors, LED Lighting for Garden, Balcony",,Garden,EGP 875.00,,,4.2,,,,,https://m.media-amazon.com/images/I/81wgoatD2WL._AC_UL320_.jpg,https://www.amazon.eg/dp/B0C7W3N4GX,2026-03-28T02:51:35.478060
amazon,,"KOMFOTTEU Acacia Wood Garden Table, Dining Table with Umbrella Hole, Rectangular Table for 4/6/8 People, for Terrace, Balcony, Patio (Large)",,Garden,"EGP 6,755.00",,,4.6,,,,,https://m.media-amazon.com/images/I/61NHRAdSpGL._AC_UL320_.jpg,https://www.amazon.eg/dp/B0F1CQN15C,2026-03-28T02:51:35.478612
amazon,,URbazaar 1x3 Meter Privacy Garden Fence Wall Artificial Plants Hedge Screening Roll Faux Ivy Leaf Vine Decoration For Backyard Outdoor UV Sunlight Protection In Garden Home Balcony Decor.,,Garden,EGP 440.00,,,4.7,,,,,https://m.media-amazon.com/images/I/81I1Nv8V25L._AC_UL320_.jpg,https://www.amazon.eg/dp/B0BPSCC1LK,2026-03-28T02:51:35.479107
amazon,,"YoungBee Garden Furniture Covers, Rectangular/Square Outdoor Furniture Covers, Waterproof, Anti-UV, Upgraded Tear-Resistant 420D Oxford Fabric Garden Rattan Sofa Set Patio Table Covers 300*250*100cm",,Garden,"EGP 1,550.00","EGP 1,600.00",,4.2,Was:,,,,https://m.media-amazon.com/images/I/51qb1nIrmLL._AC_UL320_.jpg,https://www.amazon.eg/dp/B08GFXXYRK,2026-03-28T02:51:35.479747
amazon,,1 x 3 m Artificial Leaf Garden Protection Fence Artificial Hedge Plant Wall Balcony Fence Decoration Indoor Outdoor Ivy,,Garden,EGP 470.00,,,3.8,,,,,https://m.media-amazon.com/images/I/81skVWI-8gL._AC_UL320_.jpg,https://www.amazon.eg/dp/B0B31JTLKV,2026-03-28T02:51:35.480249
amazon,,Tomshine 5W 4 Pack COB LED Lawn Lamp AC/DC 12V Outdoor Decorative Landscape light 500LM Super Bright High Power Spotlight for Garden Wall Yard Path Warm White,,Garden,EGP 824.77,EGP 876.00,,3.2,Was:,,,,https://m.media-amazon.com/images/I/61qrWRroktL._AC_UL320_.jpg,https://www.amazon.eg/dp/B08F7XY4NP,2026-03-28T02:51:35.480921
amazon,,"T4U Large Vertical Garden Tower Planter 5 Tier - Plastic Stackable Strawberry Planter Tiered Herb Pot, Stacking Grow Tower Gardening Pot for Indoor Outdoor Balcony Lettuce, Vegetables and Flower Plant",,Garden,EGP 649.00,,,3.9,,,,,https://m.media-amazon.com/images/I/71ADawE9mOL._AC_UL320_.jpg,https://www.amazon.eg/dp/B09N78QVT7,2026-03-28T02:51:35.481417
amazon,,Solar Powered Outdoor Pathway Light Motion Sensor IP65 Waterproof,,Garden,EGP 195.80,,,3.0,,,,,https://m.media-amazon.com/images/I/61nOudsVQHL._AC_UL320_.jpg,https://www.amazon.eg/dp/B0CKN5XZR4,2026-03-28T02:51:35.481972
amazon,,"Patio Hanging Egg Chair Cover, Double 210D Fabric Oxford Waterproof Swinging Chair Cover, Veranda Patio Cocoon Egg Chair Garden Furniture Cover with Drawstring (No Chair) (190 x 115cm,Grey)",,Garden,EGP 555.00,,,4.6,,,,,https://m.media-amazon.com/images/I/61ZDg1x1vHL._AC_UL320_.jpg,https://www.amazon.eg/dp/B08NPTMQRD,2026-03-28T02:51:35.482490
amazon,,"Multi Color LED Solar Wall Light for Gardens and Walls, Solar Powered Outdoor Lighting",,Garden,EGP 252.00,,,,,,,,https://m.media-amazon.com/images/I/61C+cYs20dL._AC_UL320_.jpg,https://www.amazon.eg/dp/B0GRRFCSW4,2026-03-28T02:51:35.482929
amazon,,"SUN POWER Outdoor Decoration Lights Super Bright Solar LED Garden Lights WITH REMOTE, 2pack",,Garden,"EGP 1,350.00",,,3.4,,,,,https://m.media-amazon.com/images/I/410wsaG-p1L._AC_UL320_.jpg,https://www.amazon.eg/dp/B0BNGFM2J4,2026-03-28T02:51:35.483440
amazon,,Solar Lights Outdoor Waterproof - 4/6/8 LED - for Wall Garden Pathway (4 LED),,Garden,EGP 355.11,,,5.0,,,,,https://m.media-amazon.com/images/I/51Ef9SHbsgL._AC_UL320_.jpg,https://www.amazon.eg/dp/B0CWFCR8TK,2026-03-28T02:51:35.483970
amazon,,LED Flood light 100 Watt White light For Outdoor Using,,Garden,EGP 399.00,EGP 581.00,,3.1,List:,,,,https://m.media-amazon.com/images/I/717kJVCFTSL._AC_UL320_.jpg,https://www.amazon.eg/dp/B092FKWHGK,2026-03-28T02:51:35.484583
amazon,,"Outsunny 3(m) Garden Parasol Umbrellas, Outdoor Sun Shade with 8 Ribs, Tilt and Crank Handle for Balcony, Bench, Garden",,Garden,"EGP 2,950.00",,,4.2,,,,,https://m.media-amazon.com/images/I/61bDBcT36WL._AC_UL320_.jpg,https://www.amazon.eg/dp/B0DZMC2C3M,2026-03-28T02:51:39.939106
amazon,,"GIGALUMI Solar Deck Lights Outdoor, 20 Pack Solar Step Lights Waterproof Led Solar Lights for Outdoor Stairs, Step, Fence, Railing, Yard and Patio (Warm White)",,Garden,"EGP 1,400.00",,,4.2,,,,,https://m.media-amazon.com/images/I/81Yi-1iv2dL._AC_UL320_.jpg,https://www.amazon.eg/dp/B0BX3D69KL,2026-03-28T02:51:39.939661
amazon,,"SoliWood Raised Garden Bed with Legs,Outdoor Wood Elevated Planter Box, Thick Legs, w/Liner",,Garden,"EGP 4,365.00",,,4.6,,,,,https://m.media-amazon.com/images/I/81EFhvubF3L._AC_UL320_.jpg,https://www.amazon.eg/dp/B0DGT6BWQM,2026-03-28T02:51:39.940192
amazon,,"Meridian Set of 5 Black Plant Pots, Round Plant Pots, Garden Plant Pot Tray, Plastic Plant Saucer, Suitable for Indoor Outdoor Garden, Black Plant Pot, (45cm)",,Garden,EGP 700.00,,,3.8,,,,,https://m.media-amazon.com/images/I/21F5JHJ09HL._AC_UL320_.jpg,https://www.amazon.eg/dp/B0DK5P9SVR,2026-03-28T02:51:39.940781
amazon,,LINGWEI Wooden Fence Wooden Garden Fence Interlocking Fence Garden Edging Border Wooden Garden Bed Edging Border For Indoor and Outdoor Garden Decoration Item,,Garden,"EGP 3,085.00",,,,,,,,https://m.media-amazon.com/images/I/816EL7k5ZDL._AC_UL320_.jpg,https://www.amazon.eg/dp/B0CNCZQFFJ,2026-03-28T02:51:39.941219
amazon,,Automatic Sensor Weather Resistant Easy Installation Energy Efficient Outdoor Versatile Lamp for Home Garden Balcony (2PCS),,Garden,EGP 169.90,,,1.5,,,,,https://m.media-amazon.com/images/I/41emCsHcILL._AC_UL320_.jpg,https://www.amazon.eg/dp/B0DS9V1SF2,2026-03-28T02:51:39.941750
amazon,,"Sunnylaxx 3 x 4 m Rectangular Sun Sail, Sun Protection Awning, Colour Sand, 95% UV Protection, for Outdoor Use, Garden",,Garden,"EGP 1,450.00",,,4.3,,,,,https://m.media-amazon.com/images/I/81Lu-3oTU+L._AC_UL320_.jpg,https://www.amazon.eg/dp/B09M3L3P14,2026-03-28T02:51:39.942241
amazon,,Large Round Plastic Plant Pot – Heavy Duty Decorative Planter with Drainage – Indoor & Outdoor Garden Pot for Balcony & Patio (Purple),,Garden,EGP 144.15,,,,,,,,https://m.media-amazon.com/images/I/61v-fHNW8wL._AC_UL320_.jpg,https://www.amazon.eg/dp/B0GQZHKR99,2026-03-28T02:51:39.942753
amazon,,"Rattan Outdoor Bistro Set with Grey Cushions, 3-Piece Patio Furniture Set with 2 Chairs and Coffee Table, Wicker with Metal Legs",,Garden,,,,3.0,,,,,https://m.media-amazon.com/images/I/81Oi72zwt3L._AC_UL320_.jpg,https://www.amazon.eg/dp/B0GHG9KN44,2026-03-28T02:51:39.943534
amazon,,"Pack Solar Lights Outdoor, Ripple Glass Solar Path Lights Outdoor Waterproof Landscape Lights Lighting for Pathway Pathway Patio Backyard (White & Color Changing) 8pcs",,Garden,"EGP 1,157.00","EGP 1,300.00",,2.6,Was:,,,,https://m.media-amazon.com/images/I/710tYASGFjL._AC_UL320_.jpg,https://www.amazon.eg/dp/B0CKRV33NG,2026-03-28T02:51:39.944157
