platform,asin,title,brand,category,current_price,original_price,discount,rating,reviews_count,prime_eligible,amazon_choice,sponsored,main_image,product_url,scraped_at
amazon,,"ComfiLife Gel-Enhanced Non-slip Coccyx Memory Foam Seat Cushion - For Back Pain Relief, Tailbone Support, Sciatica, Healthy Posture, Office Chair, Car Seat, Travel, Driving, Wheelchair and more",,Office Products,"EGP 3,950.00",,,4.4,,,,,https://m.media-amazon.com/images/I/81K2tKdkw+L._AC_UL320_.jpg,https://www.amazon.eg/dp/B014F18ZGU,2026-03-31T06:08:14.168231
amazon,,"DINGHUO Acrylic File Folder Organizer Box, Letter Size Hanging File Organizer, Clear File Holder with Handles, Desktop Office Supplies Filing Storage Crate for Home Work School - 1 Pack",,Office Products,"EGP 1,399.00",,,3.6,,,,,https://m.media-amazon.com/images/I/71JQVia5+YL._AC_UL320_.jpg,https://www.amazon.eg/dp/B0DQXKBDPM,2026-03-31T06:08:14.168764
amazon,,Max Comfort American Memory Foam Large Medical Backrest Lower Pain Relief for Offices and Cars,,Office Products,EGP 573.75,,,4.3,,,,,https://m.media-amazon.com/images/I/51qm8PB+KOL._AC_UL320_.jpg,https://www.amazon.eg/dp/B0BK9KPX7W,2026-03-31T06:08:14.169296
amazon,,Leitz 5523-00-25 Office stapler With 40 Sheets Capacity Ensuring Long-Term Reliability And Performance In Any Office Environment,,Office Products,EGP 413.00,,,4.2,,,,,https://m.media-amazon.com/images/I/71bye8X7oRL._AC_UL320_.jpg,https://www.amazon.eg/dp/B001J8IB6W,2026-03-31T06:08:14.170280
amazon,,"A4 Binding Covers, 10 Sheets, Plastic, Transparent, Slide Bar, Report Cover, Document Covers, Office Documents",,Office Products,EGP 125.00,,,4.5,,,,,https://m.media-amazon.com/images/I/51a8Ito4SDL._AC_UL320_.jpg,https://www.amazon.eg/dp/B0CTY3H94L,2026-03-31T06:08:14.170789
amazon,,"20 Pieces of Binding Rod, Data Storage Supplies, Plastic Folders, Paper Sorting Tools, Study and Office Supplies.",,Office Products,EGP 225.00,,,4.5,,,,,https://m.media-amazon.com/images/I/71DNGRrqMuL._AC_UL320_.jpg,https://www.amazon.eg/dp/B0F8VW7SP9,2026-03-31T06:08:14.171229
amazon,,"Large Gaming Mouse Pad with Durable Stitched Edges，Non-Slip Rubber Base，Big Computer Keyboard Mouse Mat Desk Pad for Home Office Gaming Work, 31.5""x11.8""x0.12""in, Black",,Office Products,EGP 199.00,,,4.8,,,,,https://m.media-amazon.com/images/I/61DHvV3IoLL._AC_UL320_.jpg,https://www.amazon.eg/dp/B09WZRN475,2026-03-31T06:08:14.171705
amazon,,Cork Board For Office 90x60 With Aluminum Frame,,Office Products,EGP 960.34,,,4.7,,,,,https://m.media-amazon.com/images/I/7169J2f8QaL._AC_UL320_.jpg,https://www.amazon.eg/dp/B0D651FBR4,2026-03-31T06:08:14.172159
amazon,,3A Portfolio CE-885 Leather Zipper Card Holder with Calculator 34X25X2 CM - Black,,Office Products,EGP 466.36,,,4.0,,,,,https://m.media-amazon.com/images/I/31xCDe9Ap1L._AC_UL320_.jpg,https://www.amazon.eg/dp/B0DD7KTX46,2026-03-31T06:08:14.172634
amazon,,Plastic Hydraulic Office Chair,,Office Products,EGP 260.00,,,3.7,,,,,https://m.media-amazon.com/images/I/4103GWBLNjL._AC_UL320_.jpg,https://www.amazon.eg/dp/B091J6XL4M,2026-03-31T06:08:14.173087
amazon,,Leitz 5523-00-25 Office stapler With 40 Sheets Capacity Ensuring Long-Term Reliability And Performance In Any Office Environment,,Office Products,EGP 395.60,,,3.8,,,,,https://m.media-amazon.com/images/I/71mUHzZwcpL._AC_UL320_.jpg,https://www.amazon.eg/dp/B0012S8UW4,2026-03-31T06:08:14.173547
amazon,,"GOLD LEAF 94 Pieces Office Supplies Set, 4 Plastic Clips, 3mm 50 Paper Clips/20 I-Pins/20 Toothed Pins for School Desk Accessories Organizer with Box for Home Office School (Pink)",,Office Products,EGP 195.00,,,3.6,,,,,https://m.media-amazon.com/images/I/81fyaQIJtaL._AC_UL320_.jpg,https://www.amazon.eg/dp/B0DHXW3ZRV,2026-03-31T06:08:14.173995
amazon,,"Aothia Leather Desk Pad Protector,Mouse Pad,Office Desk Mat,Non-Slip PU Leather Desk Blotter,Laptop Desk Pad,Waterproof Desk Writing Pad for Office and Home (91cm x 43cm, Brown)",,Office Products,EGP 980.00,,,4.4,,,,,https://m.media-amazon.com/images/I/81FNHYAqJcS._AC_UL320_.jpg,https://www.amazon.eg/dp/B08C5NDGV7,2026-03-31T06:08:14.174443
amazon,,Leitz NeXXt 55026025 Office Stapler Metal 30-Sheet Capacity in Blister Packaging Red,,Office Products,EGP 305.89,,,3.4,,,,,https://m.media-amazon.com/images/I/71KF2iu2VWL._AC_UL320_.jpg,https://www.amazon.eg/dp/B004I2KGMI,2026-03-31T06:08:14.174905
amazon,,"Max Comfort Medical Backrest Pillow - for Car and Office Blue, Synthetic (Blue)",,Office Products,EGP 395.25,EGP 456.00,,3.5,List:,,,,https://m.media-amazon.com/images/I/61dXpZC3DdL._AC_UL320_.jpg,https://www.amazon.eg/dp/B0D5VL8RB3,2026-03-31T06:08:14.175492
amazon,,"Desk Organizer, Mesh Metal Office Organizer with Drawer and Pen Holder, Memo Stickers, Paper Clips, Binder Clips.",,Office Products,EGP 350.00,,,4.6,,,,,https://m.media-amazon.com/images/I/81eMwFTAgXL._AC_UL320_.jpg,https://www.amazon.eg/dp/B0C28KGVZV,2026-03-31T06:08:14.176006
amazon,,Homeries Acrylic Monitor Riser & Keyboard Stand for Home Office Business Gamers Schools | Multi Media Computer Desk Stand | Angled & Tilted Keyboard Tray Riser | Create Ergonomic Working Space,,Office Products,"EGP 1,648.90",,,4.6,,,,,https://m.media-amazon.com/images/I/91pXztAyAHL._AC_UL320_.jpg,https://www.amazon.eg/dp/B0861JXMD6,2026-03-31T06:08:14.176523
amazon,,"Basket Order office supplies by Mak, Black, DA1454",,Office Products,EGP 277.00,,,5.0,,,,,https://m.media-amazon.com/images/I/71K+JlKJ-7L._AC_UL320_.jpg,https://www.amazon.eg/dp/B099DPMS4D,2026-03-31T06:08:14.177030
amazon,,"DLME Pink Color Mini Stapler with Staple Remover & 640 Staples, Cute Stapler Gift for Student and Office Use",,Office Products,EGP 115.00,,,,,,,,https://m.media-amazon.com/images/I/31vUNS6kOWL._AC_UL320_.jpg,https://www.amazon.eg/dp/B09DSP7DQQ,2026-03-31T06:08:17.673277
amazon,,Deli 0416 50 sheet metal stapler - assorted colors,,Office Products,EGP 264.00,EGP 275.00,,4.1,Was:,,,,https://m.media-amazon.com/images/I/51BcMvQglZL._AC_UL320_.jpg,https://www.amazon.eg/dp/B013HU3MAE,2026-03-31T06:08:17.673849
amazon,,CICIMELON Large Capacity Pencil Case 3 Compartment Pouch Pen Bag for School Teen Girl Boy Men Women (Green),,Office Products,EGP 954.00,,,4.7,,,,,https://m.media-amazon.com/images/I/81rJBKU5OUL._AC_UL320_.jpg,https://www.amazon.eg/dp/B08P4CDWF3,2026-03-31T06:08:17.674307
amazon,,"20 Pack Acrylic Rigid Shelf Label Holders for School Office Library Book Shelves Tags Shelf Labels with Sticky Dots, Transparent Tabletop Price Sign Stand for Store Bakeries (1.25x3 in)",,Office Products,EGP 448.97,,,4.7,,,,,https://m.media-amazon.com/images/I/61Zia2UvC1L._AC_UL320_.jpg,https://www.amazon.eg/dp/B0DQ1J28BF,2026-03-31T06:08:17.674770
amazon,,"wood desk stylish office chairs, ergonomic study chair, home swivel adjustable height, PU leather with chrome legs for home and bedroom, white",,Office Products,"EGP 1,596.00",,,3.8,,,,,https://m.media-amazon.com/images/I/41ushrVOmML._AC_UL320_.jpg,https://www.amazon.eg/dp/B0DPR7BWSR,2026-03-31T06:08:17.675218
amazon,,3A Linen And Leather A4 Wallet/Folder With Zipper For Office And School 24 * 33.5 cm - Multi Color,,Office Products,EGP 72.01,,,3.9,,,,,https://m.media-amazon.com/images/I/61s9Hg6e0EL._AC_UL320_.jpg,https://www.amazon.eg/dp/B0BDX2DQS8,2026-03-31T06:08:17.675739
amazon,,3A Leather Appreciation Certificate Holder 22X30cm - Copper 900-1,,Office Products,EGP 159.66,,,3.0,,,,,https://m.media-amazon.com/images/I/61kSgyFz+5L._AC_UL320_.jpg,https://www.amazon.eg/dp/B0DD7LYR5W,2026-03-31T06:08:17.676192
amazon,,"Madesa Home Office Computer Writing Desk with 3 Drawers, 1 Door and 1 Storage Shelf, Plenty of Space, Wood, 45 D x 136 W x 77 H cm - White",,Office Products,"EGP 3,300.00",,,3.0,,,,,https://m.media-amazon.com/images/I/71W5fHt-VDL._AC_UL320_.jpg,https://www.amazon.eg/dp/B08QSM71R7,2026-03-31T06:08:17.676758
amazon,,"No. LG70-42 Multipurpose 100 Sheet A4 Labels Office Pack, 21 Labels/Sheet, 70 x 42.4mm Label Size, White",,Office Products,EGP 6.83,,,3.0,,,,,https://m.media-amazon.com/images/I/41+TNP+eRtL._AC_UL320_.jpg,https://www.amazon.eg/dp/B0CQXV5W8C,2026-03-31T06:08:17.677210
amazon,,"Yassin Vibrant Medium Adhesive Label Sticker, 26.5x37 mm With Premium Material Suitable For Home, School And Office - Multi Colour",,Office Products,EGP 15.00,,,,,,,,https://m.media-amazon.com/images/I/71BJdBbQcUL._AC_UL320_.jpg,https://www.amazon.eg/dp/B0FFHDCXFN,2026-03-31T06:08:17.677627
amazon,,3A File Holder 3 Pieces Carton 25X10X30 CM - Fuchsia,,Office Products,EGP 67.22,,,4.4,,,,,https://m.media-amazon.com/images/I/61i3v0Gk1fL._AC_UL320_.jpg,https://www.amazon.eg/dp/B0DD7MKS77,2026-03-31T06:08:17.678073
amazon,,Leitz Rapid 24812800 JUWEL 3000 Super Flatclinch Ensuring Long-Term Reliability And Performance In Any Office Environment,,Office Products,EGP 289.46,,,3.9,,,,,https://m.media-amazon.com/images/I/51JBjsXwWYL._AC_UL320_.jpg,https://www.amazon.eg/dp/B0041W3EJW,2026-03-31T06:08:17.678542
amazon,,"iCasso Leather Desk Mat, Leather Desk Pad, XXL Large Extended Mouse Pad (35.4"" x 15.7""), Non-Slip PU Leather Desk Blotter, Waterproof Keyboard Pad Desk Writing Mat for Computer - Black (No-Heated)",,Office Products,EGP 980.00,,,4.3,,,,,https://m.media-amazon.com/images/I/61B2RbPLUzL._AC_UL320_.jpg,https://www.amazon.eg/dp/B089CZDC7J,2026-03-31T06:08:17.678990
amazon,,3A Portfolio Wallet with Calculator and Card Holder Zipper Leather 34X25X2 CM - Grey CE811,,Office Products,EGP 588.21,,,3.0,,,,,https://m.media-amazon.com/images/I/511JJy7649L._AC_UL320_.jpg,https://www.amazon.eg/dp/B0DD7LZRDP,2026-03-31T06:08:17.679471
amazon,,Adjustable Dual Head Pencil Extender Holder Pencil Lengthener Pencil Saver Eco Friendly for Art Craft Hobby School Office Makeup Pencil Eyeliner Color Pencil Sketch Write Drawing Tool-5 PCS,,Office Products,EGP 265.00,,,4.1,,,,,https://m.media-amazon.com/images/I/61SdfaBhOxL._AC_UL320_.jpg,https://www.amazon.eg/dp/B07BNT81ZP,2026-03-31T06:08:17.679926
amazon,,"4 PCS Magnetic Whiteboard Erasers, Small Size White Board Wipers, White Board Erasers Magnetic for Eraser with Thick Felt Pad, Blackboard Eraser for Home, Office and Classrooms(10.2*5.5*2cm,4 Colours)",,Office Products,EGP 113.37,,,5.0,,,,,https://m.media-amazon.com/images/I/618uv6gxD4L._AC_UL320_.jpg,https://www.amazon.eg/dp/B0D1YJ8F8H,2026-03-31T06:08:17.680405
amazon,,Trodat 4911 Printy 4.0 Stamp,,Office Products,EGP 259.00,EGP 285.00,,3.3,Was:,,,,https://m.media-amazon.com/images/I/61ez1fu2+HL._AC_UL320_.jpg,https://www.amazon.eg/dp/B004TB5VBY,2026-03-31T06:08:17.680932
amazon,,"Sihoo Ergonomics Office Chair Computer Chair Desk Chair, AdjUStable Headrests Chair Backrest And Armrest'S Mesh Chair (Black)",,Office Products,"EGP 5,142.60","EGP 6,070.00",,3.7,List:,,,,https://m.media-amazon.com/images/I/61mLjE4u2+L._AC_UL320_.jpg,https://www.amazon.eg/dp/B07BKTDT3F,2026-03-31T06:08:17.681487
amazon,,3A HK001-2 Carton Horizontal Paper Clipboard With Paper Handle 24 * 32 cm - Multi Color,,Office Products,EGP 61.62,,,4.0,,,,,https://m.media-amazon.com/images/I/612L-flZHcL._AC_UL320_.jpg,https://www.amazon.eg/dp/B0DCTZCS5M,2026-03-31T06:08:17.681938
amazon,,"Maayergy C-6-A82/L-160 JS2001 2002 H524 Metal Mesh Organizer Tray, 2 Levels With Durable Material, Suitable For School And Home",,Office Products,EGP 327.44,,,,,,,,https://m.media-amazon.com/images/I/61vwueDdWeL._AC_UL320_.jpg,https://www.amazon.eg/dp/B0CH98JBLV,2026-03-31T06:08:17.682348
amazon,,3A 556 File Sheet Holder With Large Metal Clip Inside 8cm For Office - Purple,,Office Products,EGP 68.00,,,5.0,,,,,https://m.media-amazon.com/images/I/81JFqIxEoRL._AC_UL320_.jpg,https://www.amazon.eg/dp/B0CP1FQ5VV,2026-03-31T06:08:17.682802
amazon,,Wooden Desk Organizer/Stationary Items for office/Remote & Pen Stand/Office Stationary Stand (Brown),,Office Products,EGP 169.00,,,4.1,,,,,https://m.media-amazon.com/images/I/71+LAe+3GZL._AC_UL320_.jpg,https://www.amazon.eg/dp/B08M622QMR,2026-03-31T06:08:17.683286
amazon,,"36-Pack L-Type Plastic File Folders, Transparent Clear Project Folder with US Letter Size, L-Open Plastic Sleeves for Home, School and Office",,Office Products,EGP 382.00,EGP 412.00,,4.8,Was:,,,,https://m.media-amazon.com/images/I/51epowE5xXL._AC_UL320_.jpg,https://www.amazon.eg/dp/B0CSXD8HQF,2026-03-31T06:08:17.683820
amazon,,Rapid 24141711-721-722-720 S20 Office Stapler with 20 Sheets Capacity Ensuring Long-Term Reliability And Performance In Any Office Environment,,Office Products,EGP 96.00,,,3.5,,,,,https://m.media-amazon.com/images/I/71FJWpot7HL._AC_UL320_.jpg,https://www.amazon.eg/dp/B018JW5UVY,2026-03-31T06:08:17.684269
amazon,,3A Portfolio CE-881 Leather Zipper Card Holder with Calculator 34X25X2 CM - Black,,Office Products,EGP 593.00,,,,,,,,https://m.media-amazon.com/images/I/31FhNydNSAL._AC_UL320_.jpg,https://www.amazon.eg/dp/B0DD7LC1BS,2026-03-31T06:08:22.045163
amazon,,3A Portfolio C501 Leather Zipper Card Holder With Calculator 34X25X2 CM - Black & Red,,Office Products,EGP 368.33,,,,,,,,https://m.media-amazon.com/images/I/31RtIs4WWWL._AC_UL320_.jpg,https://www.amazon.eg/dp/B0DD7KCF2F,2026-03-31T06:08:22.045628
amazon,,"Magnetic Whiteboard for Office, School and Home",,Office Products,EGP 700.25,,,3.5,,,,,https://m.media-amazon.com/images/I/41r0tIzhPEL._AC_UL320_.jpg,https://www.amazon.eg/dp/B0CY88HZL2,2026-03-31T06:08:22.046141
amazon,,"Al-Manar High-Impact Medium Adhesive Label Sticker, 19x45 mm With Premium Material Suitable For Home, School And Office - Orange Fluorescent",,Office Products,EGP 21.00,,,,,,,,https://m.media-amazon.com/images/I/61E+1mCLTcL._AC_UL320_.jpg,https://www.amazon.eg/dp/B0FFHDMCLH,2026-03-31T06:08:22.046557
amazon,,"Di Pelle™ Retractable Badge Holder Lanyard with Heavy Duty Nylon Cord & Plastic Snap Fastener – ID Card Neck Strap with Key Reel – Unisex, Durable for Office, School & Events - Black",,Office Products,EGP 430.00,,,,,,,,https://m.media-amazon.com/images/I/61HO1afG2tL._AC_UL320_.jpg,https://www.amazon.eg/dp/B0FXBN1359,2026-03-31T06:08:22.046950
amazon,,3A Plastic B4 Binder 26 * 36 cm With Zipper 1 Piece - Pink NCF,,Office Products,EGP 44.12,,,,,,,,https://m.media-amazon.com/images/I/61tBrwhdvXL._AC_UL320_.jpg,https://www.amazon.eg/dp/B0DCTYNP98,2026-03-31T06:08:22.047426
amazon,,Computer Desk with Adjustable Storage Shelf Metal Frame Home Office Study Writing Desk (White-Beige),,Office Products,"EGP 2,353.00",,,4.0,,,,,https://m.media-amazon.com/images/I/61t9Dsiq90L._AC_UL320_.jpg,https://www.amazon.eg/dp/B0CKC1HH21,2026-03-31T06:08:22.047935
amazon,,Al-Tamayoz Al-Maadany Computer Desk for Home Office Study Writing Laptop Business T00319 (Grey),,Office Products,"EGP 1,425.00",,,3.8,,,,,https://m.media-amazon.com/images/I/81Iq3pY1pdL._AC_UL320_.jpg,https://www.amazon.eg/dp/B0CW9WMRF1,2026-03-31T06:08:22.048499
amazon,,"M&G Small Stapler, Portable and Reliable Binding, MGS-10, Durable Metal",,Office Products,EGP 62.00,,,,,,,,https://m.media-amazon.com/images/I/61ekLUmnUtL._AC_UL320_.jpg,https://www.amazon.eg/dp/B0FG572JF7,2026-03-31T06:08:22.048905
amazon,,3A Cardboard Appreciation Certificate Holder Set Of 5 Pieces 21X32 CM - Black,,Office Products,EGP 111.50,,,5.0,,,,,https://m.media-amazon.com/images/I/61jnJhib2YL._AC_UL320_.jpg,https://www.amazon.eg/dp/B0DD7L2TDK,2026-03-31T06:08:22.049416
amazon,,3A Eva Stamp With Ink Pad Set Of 8 Pieces - Multi Color,,Office Products,EGP 58.82,,,,,,,,https://m.media-amazon.com/images/I/61k5mDkJPPS._AC_UL320_.jpg,https://www.amazon.eg/dp/B099D8QTQY,2026-03-31T06:08:22.049833
amazon,,10 Pcs Bulldog Clips Binder Clamp Document Clips Foldback Clip Paper Grips Calendar Clamp for Office School Home Kitchen Shops 51 mm,,Office Products,EGP 120.04,,,3.4,,,,,https://m.media-amazon.com/images/I/61lSSXbayXL._AC_UL320_.jpg,https://www.amazon.eg/dp/B0D1JJVKJ4,2026-03-31T06:08:22.050289
amazon,,"Travel Ease Ergonomic Lumbar Support Cushion, Memory Foam Back Support Cushion for Office Chairs with Skin-friendly Cover for Comfort (Black)",,Office Products,"EGP 3,346.00",,,4.4,,,,,https://m.media-amazon.com/images/I/71OqETd1iDL._AC_UL320_.jpg,https://www.amazon.eg/dp/B096RRKV2Y,2026-03-31T06:08:22.050794
amazon,,"Tribesigns 63-inch Executive Desk, Large Office Computer Desk with Extra Thick Wooden Tabletop and Metal Frame, Modern Simple Workstation Writing Table Study Desk for Home Office, Vintage Brown",,Office Products,"EGP 5,200.00","EGP 6,050.00",,4.6,Was:,,,,https://m.media-amazon.com/images/I/81BLjl+uUQL._AC_UL320_.jpg,https://www.amazon.eg/dp/B0C4T79S1R,2026-03-31T06:08:22.051370
amazon,,"Scriveiner Rollerball Pen with 24 Carat Gold Finish, Refillable, Beautiful Gift for Men & Women with Box, Professional Office Accessory",,Office Products,"EGP 5,718.90",,,4.7,,,,,https://m.media-amazon.com/images/I/71Y2swR8sUL._AC_UL320_.jpg,https://www.amazon.eg/dp/B07YV85NNB,2026-03-31T06:08:22.051887
amazon,,3A Leather Appreciation Certificate Holder 22X30cm - Blue and Gold 003-12,,Office Products,EGP 110.64,,,3.0,,,,,https://m.media-amazon.com/images/I/71czRbk8pvL._AC_UL320_.jpg,https://www.amazon.eg/dp/B0DD7N6HDB,2026-03-31T06:08:22.052357
amazon,,"YOLEO Computer Desk 120cm, Industrial Office Desk with 2 Storage Shelves, Simple Writing Study Desk for Home Office Bedroom (Walnut Brown)",,Office Products,"EGP 2,200.00",,,4.1,,,,,https://m.media-amazon.com/images/I/61JzcXgpWjL._AC_UL320_.jpg,https://www.amazon.eg/dp/B08CS96WV7,2026-03-31T06:08:22.052834
amazon,,"Acrylic Table Stand 10 Pieces, Wooden Menu Holder, Plastic Display Prater for Restaurants, Hotels, Schools and Offices",,Office Products,"EGP 3,078.90",,,3.9,,,,,https://m.media-amazon.com/images/I/81XC-ddiNaL._AC_UL320_.jpg,https://www.amazon.eg/dp/B0BKJKFH1H,2026-03-31T06:08:22.053300
amazon,,3A Cardboard Appreciation Certificate Holder Set Of 5 Pieces 21X32 CM - Green,,Office Products,EGP 113.44,EGP 149.00,,,Was:,,,,https://m.media-amazon.com/images/I/71eUdjvB6iL._AC_UL320_.jpg,https://www.amazon.eg/dp/B0DD7PCKQS,2026-03-31T06:08:22.053802
amazon,,Medical mesh mobility office chair - blue,,Office Products,"EGP 1,520.00",,,3.7,,,,,https://m.media-amazon.com/images/I/51YA+Z2CjsL._AC_UL320_.jpg,https://www.amazon.eg/dp/B09GYSJJZS,2026-03-31T06:08:22.054313
amazon,,"Primary Premium Supply List Set Of 21 (Sketch, Metal, Pencils, Flomaster Colors, Whiteboard Markers, Colored Pens, Metal Sharpener, Glue Stick, Pencil Leads, BallPoint Pen, Erasers, Mechanical Pencil)",,Office Products,"EGP 1,365.88",,,4.5,,,,,https://m.media-amazon.com/images/I/61KAORMGKcL._AC_UL320_.jpg,https://www.amazon.eg/dp/B0DBHWRVG4,2026-03-31T06:08:22.054787
amazon,,3A Rock 2502 Portfolio Leather With Calculator And Cards Holder 210X297 Mm A4 - Multicolor,,Office Products,EGP 347.32,,,3.7,,,,,https://m.media-amazon.com/images/I/61an0zU1xpS._AC_UL320_.jpg,https://www.amazon.eg/dp/B096G3RRRL,2026-03-31T06:08:22.055286
amazon,,"Arae Desk Mat, PU Leather Waterproof, NonSlip and Ultra Thin Desk Pad for Home and Office - 31.5 x 15.7 Inch Gray",,Office Products,EGP 880.00,,,4.2,,,,,https://m.media-amazon.com/images/I/71NkTta0HAL._AC_UL320_.jpg,https://www.amazon.eg/dp/B092ZLN5N2,2026-03-31T06:08:22.055748
amazon,,"Diverse DL0001 Office Paper Clips 12-Pieces, 51 mm Size",,Office Products,EGP 120.04,,,,,,,,https://m.media-amazon.com/images/I/61FHGZcw6mL._AC_UL320_.jpg,https://www.amazon.eg/dp/B0DQJXL7Y1,2026-03-31T06:08:22.056159
amazon,,3A Proqueen File Holder 27X10X30 CM - Fuchsia 8311,,Office Products,EGP 99.43,,,2.0,,,,,https://m.media-amazon.com/images/I/41aNbhcYu4L._AC_UL320_.jpg,https://www.amazon.eg/dp/B0DD7P4C3H,2026-03-31T06:08:25.597362
amazon,,"H-100 A3 1806-6 758A A174 Plastic File Folder With 2 Zippers With Durable Material, Suitable For School And Home",,Office Products,EGP 41.46,,,2.5,,,,,https://m.media-amazon.com/images/I/61sVSB0JszL._AC_UL320_.jpg,https://www.amazon.eg/dp/B0CH59D7K6,2026-03-31T06:08:25.597837
amazon,,3A Cardboard Appreciation Certificate Holder 23X32cm Set Of 5 Pieces - Yellow 4161-1,,Office Products,EGP 102.24,,,5.0,,,,,https://m.media-amazon.com/images/I/61LdtdGjcIL._AC_UL320_.jpg,https://www.amazon.eg/dp/B0DD7K8ZF3,2026-03-31T06:08:25.598312
amazon,,"YM Sketch Bookmark-Inna Ma al Usri Yusra |5x15 cm round curve edge thick illustration cardstock paper, 1 pcs|Gift For Book Lovers,back to school,office,artists, students books reading writing",,Office Products,EGP 34.00,,,4.7,,,,,https://m.media-amazon.com/images/I/71nqQzUc3AL._AC_UL320_.jpg,https://www.amazon.eg/dp/B0C563VCD4,2026-03-31T06:08:25.598776
amazon,,Tanex Office Sticker 48 × 80 mm 30 Labels Pack of 10 Sheets A5 White Model OFC-123,,Office Products,EGP 22.40,,,2.0,,,,,https://m.media-amazon.com/images/I/513Z7tLIkzL._AC_UL320_.jpg,https://www.amazon.eg/dp/B0F1NHZX2R,2026-03-31T06:08:25.599230
amazon,,"Mini desk set, easy to carry , 2725609827114",,Office Products,EGP 75.00,,,2.5,,,,,https://m.media-amazon.com/images/I/813p+4V+NfL._AC_UL320_.jpg,https://www.amazon.eg/dp/B09B314S36,2026-03-31T06:08:25.599708
amazon,,3A Plastic B4 Binder With Zipper 26 * 36 CM 1 Piece - Orange NCF,,Office Products,EGP 69.00,,,,,,,,https://m.media-amazon.com/images/I/61Jugjd3IGL._AC_UL320_.jpg,https://www.amazon.eg/dp/B0DCTYKV2P,2026-03-31T06:08:25.600110
amazon,,3A Portfolio B-6 Leather Binder 34X25X2 cm - Navy,,Office Products,EGP 247.00,,,1.0,,,,,https://m.media-amazon.com/images/I/31P4s81OHCL._AC_UL320_.jpg,https://www.amazon.eg/dp/B0DD7P5R3P,2026-03-31T06:08:25.600566
amazon,,3A PE-14633 Brecqueen Certificate Holder 22X30 cm - Beige,,Office Products,EGP 55.06,,,,,,,,https://m.media-amazon.com/images/I/41GUYG1wb6L._AC_UL320_.jpg,https://www.amazon.eg/dp/B0DD7N8JS3,2026-03-31T06:08:25.600981
amazon,,3A File Holder 3 Pieces Carton Size 25X10X30 CM - Green,,Office Products,EGP 67.22,,,5.0,,,,,https://m.media-amazon.com/images/I/51+ay+zO16L._AC_UL320_.jpg,https://www.amazon.eg/dp/B0DD7N57YD,2026-03-31T06:08:25.601446
amazon,,TOPSTICK OP MULTIPURP.LABELS WHITE 8x12,,Office Products,EGP 84.63,,,4.6,,,,,https://m.media-amazon.com/images/I/719pMnaSYHL._AC_UL320_.jpg,https://www.amazon.eg/dp/B08Z4DFDK2,2026-03-31T06:08:25.601911
amazon,,3A Proqueen File Holder 27X10X30 Cm - Green 8311,,Office Products,EGP 99.43,,,1.0,,,,,https://m.media-amazon.com/images/I/41wjWzOh0BL._AC_UL320_.jpg,https://www.amazon.eg/dp/B0DD7L59X1,2026-03-31T06:08:25.602353
amazon,,"Artblox Office Desk Name Plate Personalized | Custom Name Plates for Desks with Your Logo On Clear Acrylic Glass - (8"" x 2.5"")",,Office Products,EGP 849.00,,,4.8,,,,,https://m.media-amazon.com/images/I/71LS+VyePLL._AC_UL320_.jpg,https://www.amazon.eg/dp/B079MFMFCQ,2026-03-31T06:08:25.604364
amazon,,3A Leather Appreciation Certificate Holder 22X30 CM - Gold and Olive 003-17,,Office Products,EGP 108.75,EGP 144.00,,5.0,Was:,,,,https://m.media-amazon.com/images/I/61v+YwkK3wL._AC_UL320_.jpg,https://www.amazon.eg/dp/B0DD7PLSMF,2026-03-31T06:08:25.604907
amazon,,Max Comfort Hemorrhoid Seat Cushion - American Memory Foam for Hemorrhoids and Lower Back Pain Round Shape for Office Chair Home Car,,Office Products,EGP 481.95,,,4.2,,,,,https://m.media-amazon.com/images/I/51BfmSUpsCL._AC_UL320_.jpg,https://www.amazon.eg/dp/B0C6V4ZBCT,2026-03-31T06:08:25.605355
amazon,,"MySouqEg - Store - Large Invoice Notebook for shops, offices, companies, and warehouses that require accurate documentation of sales and accounting data. (20 × 14.5 cm) Non-carbonated (2)",,Office Products,EGP 244.99,,,,,,,,https://m.media-amazon.com/images/I/51I+i853OiL._AC_UL320_.jpg,https://www.amazon.eg/dp/B0G7K9N1GL,2026-03-31T06:08:25.605770
amazon,,EASTHILL Big Capacity Pencil Case Large Pencil Pen Pouch Bag High Storage Case Middle School College Office Organizer for Student Teens Girls Adults,,Office Products,"EGP 1,999.00",,,4.6,,,,,https://m.media-amazon.com/images/I/71wyZLk1iBL._AC_UL320_.jpg,https://www.amazon.eg/dp/B07X2D6JJ1,2026-03-31T06:08:25.606263
amazon,,3A Cardboard Appreciation Certificate Holder 21X32 CM Set Of 5 Pieces - Mauve,,Office Products,EGP 113.44,,,3.0,,,,,https://m.media-amazon.com/images/I/71jf7q1zIrL._AC_UL320_.jpg,https://www.amazon.eg/dp/B0DD7MJ2G8,2026-03-31T06:08:25.606726
amazon,,3A Leather Appreciation Certificate Holder 22X30cm - Gold 003-17,,Office Products,EGP 144.00,,,5.0,,,,,https://m.media-amazon.com/images/I/61RSab+8cNL._AC_UL320_.jpg,https://www.amazon.eg/dp/B0DD7LRTQM,2026-03-31T06:08:25.607183
amazon,,TOPSTICK OP MULTIPURP.LABELS WHITE 12x18,,Office Products,EGP 82.00,,,4.3,,,,,https://m.media-amazon.com/images/I/71-WXOlsBfL._AC_UL320_.jpg,https://www.amazon.eg/dp/B08Z4DH3JP,2026-03-31T06:08:25.607643
amazon,,3A KM-1248 Wooden Appreciation Certificate Holder 22X30 CM - Beige and Gold,,Office Products,,,,2.7,,,,,https://m.media-amazon.com/images/I/51VI42ZzIlL._AC_UL320_.jpg,https://www.amazon.eg/dp/B0DD7LPYB9,2026-03-31T06:08:25.608325
amazon,,"Kwtrio 50-SA Heavy Duty Stapler, Capacity 100 Sheets, Use Staples 23/6-13mm, Classic Style, For Office, Student - Black Grey",,Office Products,EGP 540.19,,,,,,,,https://m.media-amazon.com/images/I/61ckA+Q8i+L._AC_UL320_.jpg,https://www.amazon.eg/dp/B0CLWGKZMG,2026-03-31T06:08:25.608756
amazon,,3A KM-1248 Wooden Appreciation Certificate Holder 22X30 CM - Brown and Gold,,Office Products,,,,,,,,,https://m.media-amazon.com/images/I/51PDl9B0CkL._AC_UL320_.jpg,https://www.amazon.eg/dp/B0DD7MF127,2026-03-31T06:08:25.609132
amazon,,3A DGG1160 Plastic Internal Ring Display Book 60 Pockets 32 * 24 cm - Blue,,Office Products,EGP 299.00,,,,,,,,https://m.media-amazon.com/images/I/41cSLCgff7L._AC_UL320_.jpg,https://www.amazon.eg/dp/B0DD7LD72Z,2026-03-31T06:08:25.609571
amazon,,Swadhin Metal 9 Section Mesh Office Desk Table Desk Organizer for Pen Pencil Rubber Stand Office Supplies Multi-Functional Caddy Pen Holder Stationery Stand with Drawer,,Office Products,EGP 350.00,,,3.1,,,,,https://m.media-amazon.com/images/I/817zGADoWEL._AC_UL320_.jpg,https://www.amazon.eg/dp/B09FGFVNSJ,2026-03-31T06:08:25.610091
