platform,product_id,title,brand,category,current_price,original_price,discount,rating,reviews_count,availability,seller,express_delivery,platform_badge,sponsored,main_image,all_images,description,weight,dimensions,model_number,country_of_origin,warranty,tech_specs,variations,ships_from,delivery_date,product_url,scraped_at
amazon,B092M74H61,"Baby Grooming Kit Newborn, Portable 10pcs Baby Essential Daily Care Kit with Storage Case, Travelling Home Nursery Baby Nail Kit for Newborn Infant Toddler Healthcare & Grooming",,Baby Products,EGP 225.00,EGP 309.99,,4.4,List:,,,,,,https://m.media-amazon.com/images/I/71U3tuRErQL._AC_UL320_.jpg,https://m.media-amazon.com/images/I/71U3tuRErQL._AC_UL320_.jpg,,,,,,,,,,,https://www.amazon.eg/dp/B092M74H61,2026-03-28T13:32:15.669536
amazon,B0B2LQPFNC,"Toddler Head Protector Upgrade Infant Safety Helmet Breathable Head Drop Protection Soft Baby Helmet for Crawling Walking Headguard Protective Safety Products, BLUE, One Size",,Baby Products,EGP 150.00,,,4.1,,,,,,,https://m.media-amazon.com/images/I/61ffYpgjWpL._AC_UL320_.jpg,https://m.media-amazon.com/images/I/61ffYpgjWpL._AC_UL320_.jpg,,,,,,,,,,,https://www.amazon.eg/dp/B0B2LQPFNC,2026-03-28T13:32:15.670118
amazon,B0DG59VPNX,Granzia Bambino Microwave Baby Dish Blue Color,,Baby Products,EGP 263.43,,,5.0,,,,,,,https://m.media-amazon.com/images/I/61dPmDibqvL._AC_UL320_.jpg,https://m.media-amazon.com/images/I/61dPmDibqvL._AC_UL320_.jpg,,,,,,,,,,,https://www.amazon.eg/dp/B0DG59VPNX,2026-03-28T13:32:15.670645
amazon,B0CPXD6WTN,"6 Pack Nylon Baby Girl Bows with Headbands, Stretchy Pink Infant Headband Bows for Baby Girls Head Wraps Newborn Toddler Unisex (03H-10)",,Baby Products,EGP 355.00,,,4.0,,,,,,,https://m.media-amazon.com/images/I/812q9J8n-1L._AC_UL320_.jpg,https://m.media-amazon.com/images/I/812q9J8n-1L._AC_UL320_.jpg,,,,,,,,,,,https://www.amazon.eg/dp/B0CPXD6WTN,2026-03-28T13:32:15.671211
amazon,B0CYLRYPZQ,Little B Baby Headband Bows Set of 4 multicolor Bright Colors,,Baby Products,EGP 205.00,,,4.2,,,,,,,https://m.media-amazon.com/images/I/61SOJOdpieL._AC_UL320_.jpg,https://m.media-amazon.com/images/I/61SOJOdpieL._AC_UL320_.jpg,,,,,,,,,,,https://www.amazon.eg/dp/B0CYLRYPZQ,2026-03-28T13:32:15.671735
amazon,B0D2WBL1V6,True Terpenes Safety cotton buds 60 pcs,,Baby Products,EGP 72.00,,,3.4,,,,,,,https://m.media-amazon.com/images/I/71CaWHArC2L._AC_UL320_.jpg,https://m.media-amazon.com/images/I/71CaWHArC2L._AC_UL320_.jpg,,,,,,,,,,,https://www.amazon.eg/dp/B0D2WBL1V6,2026-03-28T13:32:15.672240
amazon,B0FK5QFDYX,"Child Safety Lock – Secure Baby Proof Latch for Cabinets, Drawers & Fridge – No Drill, Strong Adhesive (White)",,Baby Products,EGP 69.00,,,3.5,,,,,,,https://m.media-amazon.com/images/I/31z9MS1plKL._AC_UL320_.jpg,https://m.media-amazon.com/images/I/31z9MS1plKL._AC_UL320_.jpg,,,,,,,,,,,https://www.amazon.eg/dp/B0FK5QFDYX,2026-03-28T13:32:15.672774
amazon,B0BHZQBCW3,Sanosan Nappy Rash Cream 150 ml + Sanosan Baby Bath & Shampoo 500 ml + Soap Free,,Baby Products,EGP 922.00,,,4.0,,,,,,,https://m.media-amazon.com/images/I/61BBsLHFJRL._AC_UL320_.jpg,https://m.media-amazon.com/images/I/61BBsLHFJRL._AC_UL320_.jpg,,,,,,,,,,,https://www.amazon.eg/dp/B0BHZQBCW3,2026-03-28T13:32:15.673279
amazon,B0CYCHC6VJ,La Frutta Baby Care Set (Hair Brush and Comp + Scissors and file),,Baby Products,EGP 136.46,EGP 190.00,,5.0,List:,,,,,,https://m.media-amazon.com/images/I/617MPCXkrJL._AC_UL320_.jpg,https://m.media-amazon.com/images/I/617MPCXkrJL._AC_UL320_.jpg,,,,,,,,,,,https://www.amazon.eg/dp/B0CYCHC6VJ,2026-03-28T13:32:15.673937
amazon,B0DYBVKDZZ,Baby Bows Headbands Nylon Newborn Baby Headbands Toddler Infant Hairbands with Big Bows for Baby Girl Newborn Essentials,,Baby Products,EGP 353.00,,,4.1,,,,,,,https://m.media-amazon.com/images/I/71cOekrWHrL._AC_UL320_.jpg,https://m.media-amazon.com/images/I/71cOekrWHrL._AC_UL320_.jpg,,,,,,,,,,,https://www.amazon.eg/dp/B0DYBVKDZZ,2026-03-28T13:32:15.674455
amazon,B0DXPSY22S,Newborn Mittens – Softness & Safety for Your Baby (4 Pack),,Baby Products,EGP 280.00,,,,,,,,,,https://m.media-amazon.com/images/I/315Srhu2uPL._AC_UL320_.jpg,https://m.media-amazon.com/images/I/315Srhu2uPL._AC_UL320_.jpg,,,,,,,,,,,https://www.amazon.eg/dp/B0DXPSY22S,2026-03-28T13:32:15.674916
amazon,B0DFQJ5NWQ,"Adjustable Baby Carrier, Portable Baby Sling with Breathable Dense Fabric for 0-4.5 Years Old Newborn and Toddler, One Size Fits All (Grey)",,Baby Products,EGP 142.05,EGP 170.00,,1.0,List:,,,,,,https://m.media-amazon.com/images/I/619-kldkdJL._AC_UL320_.jpg,https://m.media-amazon.com/images/I/619-kldkdJL._AC_UL320_.jpg,,,,,,,,,,,https://www.amazon.eg/dp/B0DFQJ5NWQ,2026-03-28T13:32:15.675517
amazon,B0994PWNR1,La Frutta Silicon Finger Brush with Protector Case for Babies - Clear,,Baby Products,EGP 89.00,,,4.1,,,,,,,https://m.media-amazon.com/images/I/414q0Ar9G7L._AC_UL320_.jpg,https://m.media-amazon.com/images/I/414q0Ar9G7L._AC_UL320_.jpg,,,,,,,,,,,https://www.amazon.eg/dp/B0994PWNR1,2026-03-28T13:32:15.676059
amazon,B0G3J2VV89,"Baby Towel Socks, Set of 4, Multicolor, Soft Cotton Fabric, Comfortable and Moisture-Wicking Design, Unisex",,Baby Products,EGP 199.00,,,4.5,,,,,,,https://m.media-amazon.com/images/I/71nyEQd1lEL._AC_UL320_.jpg,https://m.media-amazon.com/images/I/71nyEQd1lEL._AC_UL320_.jpg,,,,,,,,,,,https://www.amazon.eg/dp/B0G3J2VV89,2026-03-28T13:32:15.676547
amazon,B09DYSPY7W,Cartoon Animals Waterproof Children's Bib With Full Sleeve - Colorful Apron for Feeding - Long Sleeve DS19 (10),,Baby Products,EGP 62.59,,,3.6,,,,,,,https://m.media-amazon.com/images/I/61P28gHOpgL._AC_UL320_.jpg,https://m.media-amazon.com/images/I/61P28gHOpgL._AC_UL320_.jpg,,,,,,,,,,,https://www.amazon.eg/dp/B09DYSPY7W,2026-03-28T13:32:15.677073
amazon,B000MSUFIM,"Tommee Tippee Baby Bottle And Teat Cleaning Brush, Assorted Color, Piece Of 1",,Baby Products,EGP 719.91,,,4.6,,,,,,,https://m.media-amazon.com/images/I/51KXlo5wuML._AC_UL320_.jpg,https://m.media-amazon.com/images/I/51KXlo5wuML._AC_UL320_.jpg,,,,,,,,,,,https://www.amazon.eg/dp/B000MSUFIM,2026-03-28T13:32:15.677571
amazon,B09J3ZHGB3,Safety Pillow Head Cushion for Baby Headrest and Neck,,Baby Products,EGP 319.20,EGP 343.20,,2.9,List:,,,,,,https://m.media-amazon.com/images/I/6100I--1IvL._AC_UL320_.jpg,https://m.media-amazon.com/images/I/6100I--1IvL._AC_UL320_.jpg,,,,,,,,,,,https://www.amazon.eg/dp/B09J3ZHGB3,2026-03-28T13:32:15.678220
amazon,B096LXTC12,360° Anti-Collision Baby Helmet Head Protection Shockproof Protective Hat Infant Toddler Children Head Protection Cap Cotton Hat Head Protection Hat Adjustable Head Protection 6 to 60 Months Baby,,Baby Products,EGP 154.75,,,3.7,,,,,,,https://m.media-amazon.com/images/I/61HbtiJo-0S._AC_UL320_.jpg,https://m.media-amazon.com/images/I/61HbtiJo-0S._AC_UL320_.jpg,,,,,,,,,,,https://www.amazon.eg/dp/B096LXTC12,2026-03-28T13:32:15.678838
amazon,B092S2QY3W,Toptim Baby Floral with Nylon Headbands for Newborn Girls Shower Photo (6 Colors),,Baby Products,EGP 289.00,,,4.5,,,,,,,https://m.media-amazon.com/images/I/61XfAg3ciHS._AC_UL320_.jpg,https://m.media-amazon.com/images/I/61XfAg3ciHS._AC_UL320_.jpg,,,,,,,,,,,https://www.amazon.eg/dp/B092S2QY3W,2026-03-28T13:32:15.679340
amazon,B09NV535HN,Baby's Link Increase Bodysuits (Colors May Vary) - Set of 4,,Baby Products,EGP 120.50,,,3.1,,,,,,,https://m.media-amazon.com/images/I/51e9QaUWOFL._AC_UL320_.jpg,https://m.media-amazon.com/images/I/51e9QaUWOFL._AC_UL320_.jpg,,,,,,,,,,,https://www.amazon.eg/dp/B09NV535HN,2026-03-28T13:32:15.679871
amazon,B09HRG2C6T,La Frutta 22674 Plastic Baby Bib with Pocket - Multi Color,,Baby Products,EGP 80.00,EGP 145.00,,3.6,List:,,,,,,https://m.media-amazon.com/images/I/71oH5eiPHDL._AC_UL320_.jpg,https://m.media-amazon.com/images/I/71oH5eiPHDL._AC_UL320_.jpg,,,,,,,,,,,https://www.amazon.eg/dp/B09HRG2C6T,2026-03-28T13:32:15.680444
amazon,B0CHJKMNSW,BabyDam WarmWave Baby Bath Support Seat - Suitable from Newborn - with Anti-Slip Suction Cups 0-6 Months - Grey,,Baby Products,EGP 558.60,,,4.3,,,,,,,https://m.media-amazon.com/images/I/61RJBFDyliL._AC_UL320_.jpg,https://m.media-amazon.com/images/I/61RJBFDyliL._AC_UL320_.jpg,,,,,,,,,,,https://www.amazon.eg/dp/B0CHJKMNSW,2026-03-28T13:32:15.680983
amazon,B01M6YVW7B,Angelcare Baby Bath Support (Grey) | Ideal for Babies Less Than 6 Months Old,,Baby Products,EGP 954.00,,,4.8,,,,,,,https://m.media-amazon.com/images/I/61x79D9WpNL._AC_UL320_.jpg,https://m.media-amazon.com/images/I/61x79D9WpNL._AC_UL320_.jpg,,,,,,,,,,,https://www.amazon.eg/dp/B01M6YVW7B,2026-03-28T13:32:15.681475
amazon,B0DXW1RG3T,Newborn Baby Washcloths - Highly Absorbent & Versatile Cotton Towels (5 Pack),,Baby Products,EGP 199.00,,,4.0,,,,,,,https://m.media-amazon.com/images/I/61Lz845xoUL._AC_UL320_.jpg,https://m.media-amazon.com/images/I/61Lz845xoUL._AC_UL320_.jpg,,,,,,,,,,,https://www.amazon.eg/dp/B0DXW1RG3T,2026-03-28T13:32:15.682005
amazon,B0GFY4QVM2,"Candie Baby Long Sleeve T-Shirt, Cotton (White Pack, 0-3 M)",,Baby Products,EGP 185.00,,,5.0,,,,,,,https://m.media-amazon.com/images/I/41pzdCUyMZL._AC_UL320_.jpg,https://m.media-amazon.com/images/I/41pzdCUyMZL._AC_UL320_.jpg,,,,,,,,,,,https://www.amazon.eg/dp/B0GFY4QVM2,2026-03-28T13:32:15.682505
amazon,B08R72ZGVF,"a baby cherry - Baby Bibs | Bib For Baby | Comfortable Soft, Durable, Easy Wipe, Waterproof, Adjustable Neckline Buttons | Silicone Bib for Feeding Infants and Toddlers (6M to 5Y) Set of 1",,Baby Products,EGP 100.00,,,4.2,,,,,,,https://m.media-amazon.com/images/I/51G9BPGYsHL._AC_UL320_.jpg,https://m.media-amazon.com/images/I/51G9BPGYsHL._AC_UL320_.jpg,,,,,,,,,,,https://www.amazon.eg/dp/B08R72ZGVF,2026-03-28T13:32:15.683029
amazon,B00M0DWQYI,"Infantino Flip Advanced 4-in-1 Baby Carrier - Ergonomic, Convertible, Face-in and Face-Out Front and Back Baby Carrier for Newborn to Toddler 3,6-14,5kg, Grey",,Baby Products,"EGP 2,570.00","EGP 2,674.00",,4.6,Was:,,,,,,https://m.media-amazon.com/images/I/71Ysf6HGZ1L._AC_UL320_.jpg,https://m.media-amazon.com/images/I/71Ysf6HGZ1L._AC_UL320_.jpg,,,,,,,,,,,https://www.amazon.eg/dp/B00M0DWQYI,2026-03-28T13:32:15.683626
amazon,B09BNY5C8L,Sanosan Baby Care Lotion - 200ml,,Baby Products,EGP 399.00,,,4.4,,,,,,,https://m.media-amazon.com/images/I/61iMgQp3gmL._AC_UL320_.jpg,https://m.media-amazon.com/images/I/61iMgQp3gmL._AC_UL320_.jpg,,,,,,,,,,,https://www.amazon.eg/dp/B09BNY5C8L,2026-03-28T13:32:15.684149
amazon,B0BN86T43B,Béaba - Silicone Baby Bib - Waterproof - Multi-Adjustable Neck Width - Flexible and Lightweight - Ultra Soft - Easy to Clean - Large drip Tray - Terracotta,,Baby Products,EGP 110.00,,,4.2,,,,,,,https://m.media-amazon.com/images/I/61p5GZyEkqL._AC_UL320_.jpg,https://m.media-amazon.com/images/I/61p5GZyEkqL._AC_UL320_.jpg,,,,,,,,,,,https://www.amazon.eg/dp/B0BN86T43B,2026-03-28T13:32:19.122685
amazon,B0C37DB71J,Beautiful Baby Monthly Milestone Cards - The Perfect Wooden Discs for Adorable Milestone Pictures of Your Newborn Boy/Girl - 7 Reversible Circles incl. Announcement & Hello World Sign Are A Great Gift,,Baby Products,EGP 720.00,EGP 800.00,,4.8,Was:,,,,,,https://m.media-amazon.com/images/I/81LmZ+lGruL._AC_UL320_.jpg,https://m.media-amazon.com/images/I/81LmZ+lGruL._AC_UL320_.jpg,,,,,,,,,,,https://www.amazon.eg/dp/B0C37DB71J,2026-03-28T13:32:19.123324
amazon,B09BDLRY79,"Bath Head Hat for Baby, 2724274684534",,Baby Products,EGP 65.30,,,4.3,,,,,,,https://m.media-amazon.com/images/I/51kBOuH5eJL._AC_UL320_.jpg,https://m.media-amazon.com/images/I/51kBOuH5eJL._AC_UL320_.jpg,,,,,,,,,,,https://www.amazon.eg/dp/B09BDLRY79,2026-03-28T13:32:19.126109
amazon,B07VWHHNMM,"Jeval Baby Knee Pads for Crawling, Anti-Slip Padded Stretchable Elastic Cotton Soft Breathable Comfortable Knee Cap Elbow Safety Protector (Set of 1 Pairs) (Multi Color)",,Baby Products,EGP 57.00,,,,,,,,,,https://m.media-amazon.com/images/I/614MTgrK06L._AC_UL320_.jpg,https://m.media-amazon.com/images/I/614MTgrK06L._AC_UL320_.jpg,,,,,,,,,,,https://www.amazon.eg/dp/B07VWHHNMM,2026-03-28T13:32:19.126557
amazon,B0DHZQ4W2Z,"Welly 1:24 Scale Free Rolling Wheels Die Cast Mercedes-Benz G-Class Model Car, Black",,Automotive,"EGP 1,123.00","EGP 1,211.00",,5.0,List:,,,,,,https://m.media-amazon.com/images/I/61BPxw4R16L._AC_UL320_.jpg,https://m.media-amazon.com/images/I/61BPxw4R16L._AC_UL320_.jpg,,,,,,,,,,,https://www.amazon.eg/dp/B0DHZQ4W2Z,2026-03-28T13:32:29.774895
amazon,B0BP76GLJQ,"Cleaning Gel for Car, Car Cleaning Kit Universal Detailing Automotive Dust Car Crevice Cleaner Auto Air Vent Interior Detail Removal Putty Cleaning Keyboard Cleaner for Car Vents, PC, Laptops, Cameras",,Automotive,EGP 20.53,,,1.8,,,,,,,https://m.media-amazon.com/images/I/61tP89TQCcL._AC_UL320_.jpg,https://m.media-amazon.com/images/I/61tP89TQCcL._AC_UL320_.jpg,,,,,,,,,,,https://www.amazon.eg/dp/B0BP76GLJQ,2026-03-28T13:32:29.775485
amazon,B09V27R871,"NC Car Windshield Sun Shade Foldable car Sun Umbrella,Blocks UV Rays Sun Visor for car[48 25.6 inches (122 * 65 cm)] Fit Most Vehicle",,Automotive,EGP 111.00,EGP 174.99,,3.5,List:,,,,,,https://m.media-amazon.com/images/I/41gto9vM37L._AC_UL320_.jpg,https://m.media-amazon.com/images/I/41gto9vM37L._AC_UL320_.jpg,,,,,,,,,,,https://www.amazon.eg/dp/B09V27R871,2026-03-28T13:32:29.776221
amazon,B08X77LN3G,"Car Trash Can with Lid, Accmor Mini Vehicle Trash Bin Car Dustbin Garbage Organizer Storage 2 Packs, Automotive Garbage Can Bin Trash Container for Cars, Home, Office",,Automotive,EGP 125.00,EGP 153.50,,3.2,Was:,,,,,,https://m.media-amazon.com/images/I/51qm9NyY9pL._AC_UL320_.jpg,https://m.media-amazon.com/images/I/51qm9NyY9pL._AC_UL320_.jpg,,,,,,,,,,,https://www.amazon.eg/dp/B08X77LN3G,2026-03-28T13:32:29.776885
amazon,B0C4TDQR86,"2Pcs Blind Spot Car Mirror, Automotive Side Blindspot Mirror for Car, 2.2"" Round Car Rearview Mirror Accessories 360 Degree Rotating with Vacuum Suction Cup for Cars, Suv, Van and Trucks",,Automotive,EGP 79.00,EGP 91.00,,2.9,List:,,,,,,https://m.media-amazon.com/images/I/51X2SJiOsFL._AC_UL320_.jpg,https://m.media-amazon.com/images/I/51X2SJiOsFL._AC_UL320_.jpg,,,,,,,,,,,https://www.amazon.eg/dp/B0C4TDQR86,2026-03-28T13:32:29.777485
amazon,B07HZ2DN8Z,A1+ Shades Automotive Car Windshield Sunshade Car Sunshade Front Window Car Sun Shade Car Windshield Shade Truck Sun Shade for Windshield Suvs Minivan (Small),,Automotive,EGP 121.00,,,4.3,,,,,,,https://m.media-amazon.com/images/I/711dYrMKcrL._AC_UL320_.jpg,https://m.media-amazon.com/images/I/711dYrMKcrL._AC_UL320_.jpg,,,,,,,,,,,https://www.amazon.eg/dp/B07HZ2DN8Z,2026-03-28T13:32:29.778031
amazon,B097DQ5466,KESAV 5D Carbon Fiber Vinyl Car Wrap Sheet Roll Film Car stickers and Decals Motorcycle Car Styling Accessories Automobiles,,Automotive,EGP 106.88,,,4.0,,,,,,,https://m.media-amazon.com/images/I/61JSPombYHL._AC_UL320_.jpg,https://m.media-amazon.com/images/I/61JSPombYHL._AC_UL320_.jpg,,,,,,,,,,,https://www.amazon.eg/dp/B097DQ5466,2026-03-28T13:32:29.778559
amazon,B0DR3SLNQJ,"Hot Wheels National Icons, Silver Series, '87 Porsche 911 R, Red Die-Cast Collector Chase Car JBY91",,Automotive,EGP 600.00,,,5.0,,,,,,,https://m.media-amazon.com/images/I/615OcbjsT6L._AC_UL320_.jpg,https://m.media-amazon.com/images/I/615OcbjsT6L._AC_UL320_.jpg,,,,,,,,,,,https://www.amazon.eg/dp/B0DR3SLNQJ,2026-03-28T13:32:29.779106
amazon,B01D98109O,"Welly 1:24 Scale Volkswagen Beetle Hard Top Diecast Model Car, Red",,Automotive,"EGP 1,345.00",,,,,,,,,,https://m.media-amazon.com/images/I/41jf8GLNLwL._AC_UL320_.jpg,https://m.media-amazon.com/images/I/41jf8GLNLwL._AC_UL320_.jpg,,,,,,,,,,,https://www.amazon.eg/dp/B01D98109O,2026-03-28T13:32:29.779592
amazon,B0CXPDG6KV,"2PCS Car Interior Detailing Brush, Auto Car Detailing Brush Dusting Brush, Soft Bristles Car Interior Cleaning Tool for Dashboard Interior, Exterior, Skylight, Leather, Dust Brush Without Cap",,Automotive,EGP 71.00,EGP 80.00,,3.5,List:,,,,,,https://m.media-amazon.com/images/I/61b14ZGFlDL._AC_UL320_.jpg,https://m.media-amazon.com/images/I/61b14ZGFlDL._AC_UL320_.jpg,,,,,,,,,,,https://www.amazon.eg/dp/B0CXPDG6KV,2026-03-28T13:32:29.780262
amazon,B0FFCQDYV2,Hot Wheels - Gordon Murray Automotive T.50s - HW Exotics 3/5 - JBB14 - Short Card - Turquoise - Mattel 2025-1:64,,Automotive,EGP 490.00,,,4.5,,,,,,,https://m.media-amazon.com/images/I/71DcxXZ1RiL._AC_UL320_.jpg,https://m.media-amazon.com/images/I/71DcxXZ1RiL._AC_UL320_.jpg,,,,,,,,,,,https://www.amazon.eg/dp/B0FFCQDYV2,2026-03-28T13:32:29.780831
amazon,B081T7N948,"Cleaning gel for car, car cleaning kit universal detailing automotive dust car crevice cleaner auto air vent interior detail removal putty cleaning keyboard cleaner for car vents, pc, laptops, cameras",,Automotive,EGP 62.94,,,2.4,,,,,,,https://m.media-amazon.com/images/I/71YLxhnPUxL._AC_UL320_.jpg,https://m.media-amazon.com/images/I/71YLxhnPUxL._AC_UL320_.jpg,,,,,,,,,,,https://www.amazon.eg/dp/B081T7N948,2026-03-28T13:32:29.781349
amazon,B0DL9T1G1Y,"JUSTTOP Car Cleaning Gel Detailing Putty,Automotive Interior Cleaning Slime,Car Vent Cleaning Kit for Car and Keyboard,Putty Cleaning Car Accessories Blue",,Automotive,EGP 30.00,EGP 40.00,,3.9,List:,,,,,,https://m.media-amazon.com/images/I/81D+5Ht31uL._AC_UL320_.jpg,https://m.media-amazon.com/images/I/81D+5Ht31uL._AC_UL320_.jpg,,,,,,,,,,,https://www.amazon.eg/dp/B0DL9T1G1Y,2026-03-28T13:32:29.781955
amazon,B0843SCLYH,"Anker USB C Car Charger, 40W 2-Port PowerIQ 3.0 Type C Car Adapter, PowerDrive III Duo with Power Delivery for iPhone 14 13 12 11 X XS Pro Max mini, Galaxy S22/S20/S10, Pixel, iPad/iPad mini, and More",,Automotive,EGP 533.69,,,4.7,,,,,,,https://m.media-amazon.com/images/I/61POG9nvHuL._AC_UL320_.jpg,https://m.media-amazon.com/images/I/61POG9nvHuL._AC_UL320_.jpg,,,,,,,,,,,https://www.amazon.eg/dp/B0843SCLYH,2026-03-28T13:32:29.782503
amazon,B0989WJ9L2,"Car Trash Can with Lid,ShowTop Mini Vehicle Trash Bin Car Dustbin Garbage Organizer Storage 2 Packs,Automotive Garbage Can Bin Trash Container for Cars,Home,Office",,Automotive,EGP 143.00,EGP 150.00,,3.8,Was:,,,,,,https://m.media-amazon.com/images/I/51N3PnE7JfS._AC_UL320_.jpg,https://m.media-amazon.com/images/I/51N3PnE7JfS._AC_UL320_.jpg,,,,,,,,,,,https://www.amazon.eg/dp/B0989WJ9L2,2026-03-28T13:32:29.783118
amazon,B0CZP1BQZF,Six Speed Manual Transmission Shift Gear Box Fidget Toy Automotive Part Car Keychain Key Ring Key Chain Ring Keyrings Ideal for Car and Motorbike Multicolour,,Automotive,EGP 150.00,,,3.4,,,,,,,https://m.media-amazon.com/images/I/41moO0bHjSL._AC_UL320_.jpg,https://m.media-amazon.com/images/I/41moO0bHjSL._AC_UL320_.jpg,,,,,,,,,,,https://www.amazon.eg/dp/B0CZP1BQZF,2026-03-28T13:32:29.783638
amazon,B0BZJ1XFHQ,2x16 LED Car Strip Crystal Style DRL Daytime Running Turn Signal Moving Indicators Light for Automotive Retrofit Led Tubelight,,Automotive,EGP 384.26,,,4.2,,,,,,,https://m.media-amazon.com/images/I/61KRo+STrML._AC_UL320_.jpg,https://m.media-amazon.com/images/I/61KRo+STrML._AC_UL320_.jpg,,,,,,,,,,,https://www.amazon.eg/dp/B0BZJ1XFHQ,2026-03-28T13:32:29.784156
amazon,B0F2SXRJCZ,"Mandark Car Center Console Armrest Pillow, Leather Memory Foam Auto Arm Rest Box Cover with Storage Bag, Waterproof Automotive Interior Elbow Protector Accessories, Universal Fit (Black)",,Automotive,EGP 286.00,,,3.7,,,,,,,https://m.media-amazon.com/images/I/61Iy-EEXVfL._AC_UL320_.jpg,https://m.media-amazon.com/images/I/61Iy-EEXVfL._AC_UL320_.jpg,,,,,,,,,,,https://www.amazon.eg/dp/B0F2SXRJCZ,2026-03-28T13:32:29.784779
amazon,B08LSN8MT8,"Car Foam Drill 3-Inch Buffing Pad, 11 Pcs Polishing Pads Kit, Car Buffer Polisher Kit Drill Buffing Kit for Car Polishing, Waxing, Sealing Glaze",,Automotive,EGP 147.89,EGP 158.97,Save 7%,4.1,Was:,,,,,,https://m.media-amazon.com/images/I/71EncVQ7-pL._AC_UL320_.jpg,https://m.media-amazon.com/images/I/71EncVQ7-pL._AC_UL320_.jpg,,,,,,,,,,,https://www.amazon.eg/dp/B08LSN8MT8,2026-03-28T13:32:29.785398
amazon,B0DCBD2BS6,"Automotive Oil Film Cleaning Brush,Glass Cleaning Board,120ml Oil Film Cleaner for Window Remove Dirt Improve Clarity and Visibility, Enhance Visual Effect of Automotive Windshield",,Automotive,EGP 44.00,EGP 89.99,,3.2,List:,,,,,,https://m.media-amazon.com/images/I/71FRkA6vmEL._AC_UL320_.jpg,https://m.media-amazon.com/images/I/71FRkA6vmEL._AC_UL320_.jpg,,,,,,,,,,,https://www.amazon.eg/dp/B0DCBD2BS6,2026-03-28T13:32:29.786063
amazon,B0BNBXHWCF,"cobee Car Interior Cleaning Soft Brush - No Scratch, 2 Pack Car Cleaning Brushes Duster with Soft Bristles Dashboard Air Outlet Gap Dust Removal Brushes for Automotive Air Conditioner Vents(Black)",,Automotive,EGP 125.70,,,4.4,,,,,,,https://m.media-amazon.com/images/I/61G6btgyWEL._AC_UL320_.jpg,https://m.media-amazon.com/images/I/61G6btgyWEL._AC_UL320_.jpg,,,,,,,,,,,https://www.amazon.eg/dp/B0BNBXHWCF,2026-03-28T13:32:29.786625
amazon,B0CJHRYTMR,"SHAPERME Plastic Restorer for Cars, Automotive Interior Plastic Part Ceramic Coating with Sponge and Nozzle, Resists Water, UV Rays, Dirt",,Automotive,EGP 115.00,EGP 120.00,,2.6,Was:,,,,,,https://m.media-amazon.com/images/I/61fVOoM8HjL._AC_UL320_.jpg,https://m.media-amazon.com/images/I/61fVOoM8HjL._AC_UL320_.jpg,,,,,,,,,,,https://www.amazon.eg/dp/B0CJHRYTMR,2026-03-28T13:32:29.787198
amazon,B073XR5M92,A1 Shades Car windshield sunshade with storage pouch by a1 sun shade foldable automotive car truck suv front window shield blocker visor protector cover for interior accessories for heat large,,Automotive,EGP 145.00,,,3.4,,,,,,,https://m.media-amazon.com/images/I/711dYrMKcrL._AC_UL320_.jpg,https://m.media-amazon.com/images/I/711dYrMKcrL._AC_UL320_.jpg,,,,,,,,,,,https://www.amazon.eg/dp/B073XR5M92,2026-03-28T13:32:29.787773
amazon,B08YNM3DNJ,Generic Car mats with high edges 5 pieces materials for all kinds of cars black color,,Automotive,EGP 301.97,EGP 320.00,,3.7,List:,,,,,,https://m.media-amazon.com/images/I/613inMZgmAL._AC_UL320_.jpg,https://m.media-amazon.com/images/I/613inMZgmAL._AC_UL320_.jpg,,,,,,,,,,,https://www.amazon.eg/dp/B08YNM3DNJ,2026-03-28T13:32:29.788425
amazon,B0DGQR52QX,"Upgrade Automotive Oil Film Cleaning Brush, Car Glass Oil Film Cleaner, Car Windshield Oil Film Cleaner, Windshield Coating Enhances Cleaner Tool, Glass Oil Film Remover Prevents Rain And Fog",,Automotive,EGP 42.00,,,2.8,,,,,,,https://m.media-amazon.com/images/I/71xeIv2NaAL._AC_UL320_.jpg,https://m.media-amazon.com/images/I/71xeIv2NaAL._AC_UL320_.jpg,,,,,,,,,,,https://www.amazon.eg/dp/B0DGQR52QX,2026-03-28T13:32:34.467787
amazon,B0B1L63MP8,"Super Drive Superdrive 800Amp Jumper Cables for Car Battery, Heavy Duty Automotive Booster Cables for Jump Starting Dead or Weak Batteries with Carrying Blue Plastic Box Included",,Automotive,EGP 541.00,EGP 570.00,,4.2,List:,,,,,,https://m.media-amazon.com/images/I/618y5u7MpZL._AC_UL320_.jpg,https://m.media-amazon.com/images/I/618y5u7MpZL._AC_UL320_.jpg,,,,,,,,,,,https://www.amazon.eg/dp/B0B1L63MP8,2026-03-28T13:32:34.468473
amazon,B0D8Y7RW8W,"fashion mania Portable Ash Tray for Car, Car Ashtray with Lid-late model Car door Automotive Ashtray, Smokeless Ashtray, Mini Car Trash Can, Detachable aluminum alloy Smokeless Ash Tray (Black)",,Automotive,EGP 666.00,,,3.8,,,,,,,https://m.media-amazon.com/images/I/61SqbxmZxEL._AC_UL320_.jpg,https://m.media-amazon.com/images/I/61SqbxmZxEL._AC_UL320_.jpg,,,,,,,,,,,https://www.amazon.eg/dp/B0D8Y7RW8W,2026-03-28T13:32:34.469019
amazon,B08YXR2CFZ,"X XINDELL Windshield Cleaning Tool, 22inch Interior Car Window Cleaner Detailing Kit, Glass Wipes Washer Windshield Fluid Wiper Automotive Exterior Accessories-Includes 3 Microfiber Cloths (Square)",,Automotive,EGP 225.00,,,4.3,,,,,,,https://m.media-amazon.com/images/I/61sm7xtqmmL._AC_UL320_.jpg,https://m.media-amazon.com/images/I/61sm7xtqmmL._AC_UL320_.jpg,,,,,,,,,,,https://www.amazon.eg/dp/B08YXR2CFZ,2026-03-28T13:32:34.469514
amazon,B0D41PD4HR,2024 Crystal Coating for Automotive Plastics - Restore Car Plastic Parts (1 Pcs),,Automotive,EGP 60.00,EGP 85.00,,2.6,Was:,,,,,,https://m.media-amazon.com/images/I/61-j4A3+uIL._AC_UL320_.jpg,https://m.media-amazon.com/images/I/61-j4A3+uIL._AC_UL320_.jpg,,,,,,,,,,,https://www.amazon.eg/dp/B0D41PD4HR,2026-03-28T13:32:34.470178
amazon,B08L657GTN,"MaxLax Bright Red El Wire with 6mm Sewing Edge, 3m neon Wire 12V with Fuse Protection for Automotive Car Interior Decoration",,Automotive,EGP 107.00,,,3.9,,,,,,,https://m.media-amazon.com/images/I/61IjzX1jpcL._AC_UL320_.jpg,https://m.media-amazon.com/images/I/61IjzX1jpcL._AC_UL320_.jpg,,,,,,,,,,,https://www.amazon.eg/dp/B08L657GTN,2026-03-28T13:32:34.470758
amazon,B0GP1PTDBQ,"QUEST Car Trash Can with Lid Mini Vehicle Garbage Bin, Automotive Dustbin Organizer for Car Cup Holder, Compact Waste Container for Cars, Home & Office",,Automotive,EGP 139.64,,,,,,,,,,https://m.media-amazon.com/images/I/51gU0v8ryCL._AC_UL320_.jpg,https://m.media-amazon.com/images/I/51gU0v8ryCL._AC_UL320_.jpg,,,,,,,,,,,https://www.amazon.eg/dp/B0GP1PTDBQ,2026-03-28T13:32:34.471210
amazon,B0CQ4D2CD3,"AUCELI Car Interior Detailing Brush, Clean Soft Bristle Scratch Free Automotive Dashboard Air Conditioner Vents Computer Removal Tool, Curved Dirt Dust Collectors, Universal for Cars（Double Brown）",,Automotive,EGP 77.00,EGP 82.75,Save 7%,4.5,Was:,,,,,,https://m.media-amazon.com/images/I/617fpz6PUWL._AC_UL320_.jpg,https://m.media-amazon.com/images/I/617fpz6PUWL._AC_UL320_.jpg,,,,,,,,,,,https://www.amazon.eg/dp/B0CQ4D2CD3,2026-03-28T13:32:34.471866
amazon,B09KGJVM2Q,"Car Clips Fastener Remover Tool - Door Panel Removal Tool Automotive Clip Puller Kit, Remove Rivet Fasteners Plier Push Pin Upholstery Repair Pry Tools",,Automotive,EGP 99.99,EGP 122.00,,4.2,List:,,,,,,https://m.media-amazon.com/images/I/41h+BCm9CkL._AC_UL320_.jpg,https://m.media-amazon.com/images/I/41h+BCm9CkL._AC_UL320_.jpg,,,,,,,,,,,https://www.amazon.eg/dp/B09KGJVM2Q,2026-03-28T13:32:34.472501
