platform,asin,title,brand,category,current_price,original_price,discount,rating,reviews_count,prime_eligible,amazon_choice,sponsored,main_image,product_url,scraped_at
amazon,,Pet Bath Massage Brush Silicone Material Soft Beauty Pet Gloves Clean Brush Massage Comb Pet Bath Gloves Pet Cleaning Brush Pet Cleaning Supplies,,Pet Supplies,EGP 60.00,,,,,,,,https://m.media-amazon.com/images/I/61VhveQEC7L._AC_UL320_.jpg,https://www.amazon.eg/dp/B091FSBYVN,2026-05-15T05:00:50.555447
amazon,,"Cat Muzzle for Grooming,Transparent Adjustable Cat Air Muzzle with 46 Breathable Holes - Anti-Licking Ball-Shaped Kitten Space Hood Pet Supplies for Cats Kittens",,Pet Supplies,EGP 799.90,,,4.0,,,,,https://m.media-amazon.com/images/I/61RkoqccOJL._AC_UL320_.jpg,https://www.amazon.eg/dp/B0B8RS72BJ,2026-05-15T05:00:50.555777
amazon,,"Dog Summer Hoodie, Dog Hoodie Sleeveless T-Shirt Summer Lightweight Pet Clothes Pet Cotton Supplies Large for Dogs Up to 10k",,Pet Supplies,EGP 229.99,,,5.0,,,,,https://m.media-amazon.com/images/I/61Ngwq7ifIL._AC_UL320_.jpg,https://www.amazon.eg/dp/B0F4NPYPNH,2026-05-15T05:00:50.556104
amazon,,"SKY-TOUCH 40Rolls-600pcs Dog Poop Bags Pet Dog Supplies for Dogs include 1pcs Green Adjustable Dispenser，Extra Thick and Strong, 100% Leak Proof, Biodegradable Waste Bag",,Pet Supplies,"EGP 1,399.00",,,4.6,,,,,https://m.media-amazon.com/images/I/81in6WXGatL._AC_UL320_.jpg,https://www.amazon.eg/dp/B0C5TP84T4,2026-05-15T05:00:50.556441
amazon,,"Nunbell Pet Nursing Bottle Set with Silicone Nipple, Cleaning Brush, Puppy Feeding Supplies",,Pet Supplies,EGP 300.00,,,,,,,,https://m.media-amazon.com/images/I/51X9YbKm0nL._AC_UL320_.jpg,https://www.amazon.eg/dp/B0GBKM7S4P,2026-05-15T05:00:50.556727
amazon,,True touch deshedding brush glove pet dog cat gentle efficient massage grooming,,Pet Supplies,EGP 99.80,,,3.8,,,,,https://m.media-amazon.com/images/I/71CTYVbvPKL._AC_UL320_.jpg,https://www.amazon.eg/dp/B096L4K1ZV,2026-05-15T05:00:50.557050
amazon,,Cats and Dogs Grooming Supply Pet Brushes and Combs in Blue,,Pet Supplies,EGP 108.28,,,,,,,,https://m.media-amazon.com/images/I/41MH2nFnBsL._AC_UL320_.jpg,https://www.amazon.eg/dp/B091CJXZLR,2026-05-15T05:00:50.557339
amazon,,shernbao Professional High Speed Dog Hair Dryer Blower Grooming for Pets,,Pet Supplies,"EGP 8,643.20","EGP 8,999.00",,4.6,Was:,,,,https://m.media-amazon.com/images/I/61Ag2cX7xqL._AC_UL320_.jpg,https://www.amazon.eg/dp/B09MCWLSFL,2026-05-15T05:00:50.557787
amazon,,Moro Moro 3 XL size Candy Color Square Kennel House Eco-friendly Dog Bed Mat Sofa Pets Beds For Various Dogs Supplies,,Pet Supplies,EGP 531.00,EGP 560.00,,,Was:,,,,https://m.media-amazon.com/images/I/619ihogqNbL._AC_UL320_.jpg,https://www.amazon.eg/dp/B0CFT22WMY,2026-05-15T05:00:50.558146
amazon,,"Best Pet Supplies Crinkle Dog Toy for Small, Medium, and Large Breeds, Cute No Stuffing Duck with Soft Squeaker, Fun for Indoor Puppies and Senior Pups, Plush No Mess Chew and Play - Yellow",,Pet Supplies,"EGP 1,399.66",,,4.4,,,,,https://m.media-amazon.com/images/I/61c1VfRJIvL._AC_UL320_.jpg,https://www.amazon.eg/dp/B09BBM5CX8,2026-05-15T05:00:50.558489
amazon,,"Moro Moro 3 -Pet Bed Pet Bed Kennel Cat Litter Fully Removable And Washable Four Seasons In Autumn And Winter To Keep Warm Pet Supplies Cat Bed Dog Beds (Color : 4#, Size : L)",,Pet Supplies,EGP 390.00,,,2.1,,,,,https://m.media-amazon.com/images/I/71QPnTIHdvL._AC_UL320_.jpg,https://www.amazon.eg/dp/B0CCPNVMZR,2026-05-15T05:00:50.558816
amazon,,NADES+HOCL PET CARE (1000ML),,Pet Supplies,EGP 460.00,,,2.0,,,,,https://m.media-amazon.com/images/I/61BOvv4WPgL._AC_UL320_.jpg,https://www.amazon.eg/dp/B0FFBBD92T,2026-05-15T05:00:50.559140
amazon,,"Pet bathing tool, dog shower 2 in 1 functional pet tool sprayer and scrubber indoor/outdoor use",,Pet Supplies,EGP 153.10,,,2.5,,,,,https://m.media-amazon.com/images/I/51F2lZg1Q7L._AC_UL320_.jpg,https://www.amazon.eg/dp/B096R4S8JX,2026-05-15T05:00:50.559496
amazon,,"UKKO Retractable Dog Leash 3M/5M Automatic Flexible Dog Puppy Cat Traction Rope Belt Dog Leash For Small Medium Dogs Pet Supplies-Green,3M",,Pet Supplies,EGP 495.00,,,,,,,,https://m.media-amazon.com/images/I/51J5IHjt7vS._AC_UL320_.jpg,https://www.amazon.eg/dp/B09NVTSB33,2026-05-15T05:00:50.559796
amazon,,Pet Supplies Dog House Soft Mongolian Yurt Cat Rabbit Bed House Kennel Doggy Warm Cushion Basket for Puppy Home - Heart(M),,Pet Supplies,EGP 475.00,,,4.0,,,,,https://m.media-amazon.com/images/I/51KW5eKh36S._AC_UL320_.jpg,https://www.amazon.eg/dp/B09698Q3P3,2026-05-15T05:00:50.560129
amazon,,Nunbell 3 Peices Pet Hair Remover For Cats & Dogs,,Pet Supplies,EGP 640.00,,,3.6,,,,,https://m.media-amazon.com/images/I/61cjnXv3RfS._AC_UL320_.jpg,https://www.amazon.eg/dp/B092375VXS,2026-05-15T05:00:50.560474
amazon,,NADES+HOCL PET CARE (5L),,Pet Supplies,"EGP 1,070.00",,,5.0,,,,,https://m.media-amazon.com/images/I/61BakOIvjLL._AC_UL320_.jpg,https://www.amazon.eg/dp/B0FFBCH6YX,2026-05-15T05:00:50.560801
amazon,,MORO L size Candy Color Square Kennel House Eco-friendly Dog Bed Mat Sofa Pets Beds For Various Dogs Supplies - Orange,,Pet Supplies,EGP 370.00,,,3.1,,,,,https://m.media-amazon.com/images/I/61cO0a368FL._AC_UL320_.jpg,https://www.amazon.eg/dp/B0923SCMN5,2026-05-15T05:00:50.561124
amazon,,"24 Rolls-360pcs Dog Poop Bags,Basics Standard Dog Waste Bags with Dispenser and Leash Clip,Cat Puppy Thick and Strong Biodegradable Leak Proof Eco- Friendly Pet Dog Supplies",,Pet Supplies,"EGP 1,540.55",,,4.3,,,,,https://m.media-amazon.com/images/I/81Ut0LJNdmL._AC_UL320_.jpg,https://www.amazon.eg/dp/B0D2MDKM6C,2026-05-15T05:00:50.561465
amazon,,"Best Pet Supplies Pet Wipes for Dogs - Dog Wipes Cleaning Deodorizing, for Coats, Ears, Paws - Calming Lavender, Aloe Vera, 100 Count",,Pet Supplies,"EGP 2,774.52",,,4.6,,,,,https://m.media-amazon.com/images/I/71igCbmcYdL._AC_UL320_.jpg,https://www.amazon.eg/dp/B07ZPMYYZF,2026-05-15T05:00:50.561789
amazon,,"Dog Paw Washing Cup, Skin-Friendly Silicone Dog Paw Cleaner, Automatic Dog Paw Cleaner, 360° Rotation, Portable Pet Paw Cleaner Cup for Small Dogs and Cats",,Pet Supplies,EGP 999.00,,,,,,,,https://m.media-amazon.com/images/I/5120ksx98GL._AC_UL320_.jpg,https://www.amazon.eg/dp/B0DXMKM7B6,2026-05-15T05:00:50.562082
amazon,,"Generic Dog Waste Bag (Black), Bag, 1 Count, Pet Supplies",,Pet Supplies,EGP 240.00,,,4.7,,,,,https://m.media-amazon.com/images/I/61ALfRwOnzL._AC_UL320_.jpg,https://www.amazon.eg/dp/B0C6FRMYND,2026-05-15T05:00:50.562432
amazon,,Bone Shaped Dog Poop Dispenser Pet Poop Bag Dispenser Pet Supplies (Red),,Pet Supplies,EGP 280.00,,,4.1,,,,,https://m.media-amazon.com/images/I/71ENUS+ob6S._AC_UL320_.jpg,https://www.amazon.eg/dp/B091MSQTKD,2026-05-15T05:00:55.085170
amazon,,"NA Pet Supplies, Silicone Dog Bath Gloves, Soft Hair Removal Brushes Five Finger Design for Cats and Dogs Blue",,Pet Supplies,EGP 57.00,EGP 64.00,,3.2,List:,,,,https://m.media-amazon.com/images/I/61kzW2-2Q+L._AC_UL320_.jpg,https://www.amazon.eg/dp/B09X4YQZR7,2026-05-15T05:00:55.085598
amazon,,Weewooday 4 Pieces Dog Grass Pee Pads Artificial Dog Grass Mat Dog Artificial Turf Mat Pet Grass Rug Replacement Puppy Potty Trainer Fake Mat with Drainage Holes for Dogs Indoors Outdoors,,Pet Supplies,EGP 685.00,,,3.2,,,,,https://m.media-amazon.com/images/I/91-24ZSbWxL._AC_UL320_.jpg,https://www.amazon.eg/dp/B08P7K8HWR,2026-05-15T05:00:55.086260
amazon,,WYJW Pecute Ultrasonic Dog Chaser Aggressive Attack Dogs Repeller Pets Trainers LED Flashlight Useful Pet Supplies Dog Training Tools,,Pet Supplies,"EGP 1,900.00",,,5.0,,,,,https://m.media-amazon.com/images/I/516rAUBt1eL._AC_UL320_.jpg,https://www.amazon.eg/dp/B08H49FGFT,2026-05-15T05:00:55.086943
amazon,,Pet Double Diner Stainless Steel Dog Feeding Bowl Set with Stable Plastic Frog Shaped Stand Best Cat Bowls Station Perfect for Dogs Cats Puppies Blue,,Pet Supplies,EGP 183.60,EGP 204.00,,3.8,Was:,,,,https://m.media-amazon.com/images/I/61OvENSh3RL._AC_UL320_.jpg,https://www.amazon.eg/dp/B098TWR152,2026-05-15T05:00:55.087679
amazon,,"Pet Grooming Gloves Disposable,Pets Grooming Wipes for Dogs & Cats,Dog Wipes Cleaning Deodorizing,Disposable Pets Grooming Wipes for Dogs & Cats,Deodorizing Pet Cleaning Wipes,6PC",,Pet Supplies,EGP 290.00,,,4.2,,,,,https://m.media-amazon.com/images/I/61U5GV2xvPL._AC_UL320_.jpg,https://www.amazon.eg/dp/B0D56VGLDS,2026-05-15T05:00:55.088346
amazon,,"silicone pet brush, round silicone pet bathing hair grooming cleaning massage brush dogs cats comb supplies(red)",,Pet Supplies,EGP 73.99,EGP 81.00,,3.1,List:,,,,https://m.media-amazon.com/images/I/51kdk5rTShL._AC_UL320_.jpg,https://www.amazon.eg/dp/B086WJ4QRD,2026-05-15T05:00:55.088778
amazon,,"Cherry Medical Supply 140-Piece Pack of XL Pet Training Pads, Super Absorbent, Leak-Proof, Quick-Drying, Blue, 60cm x 90cm, for Dogs, Cats, Rabbits, Puppies",,Pet Supplies,"EGP 1,500.00",,,4.4,,,,,https://m.media-amazon.com/images/I/61pO4A8UADL._AC_UL320_.jpg,https://www.amazon.eg/dp/B0B3S11MGQ,2026-05-15T05:00:55.089106
amazon,,"NC Multifunctional Silicone Brush Glove, Pet Grooming Gloves, Pets Bathing Gloves with High Density Teeth, Pet Bathing Shampoo and Hair Remover Brush for Cat & Dogs with Long & Short Fur (Pink)",,Pet Supplies,EGP 61.56,,,3.0,,,,,https://m.media-amazon.com/images/I/715sDApASRL._AC_UL320_.jpg,https://www.amazon.eg/dp/B09WZTR2HY,2026-05-15T05:00:55.089455
amazon,,26cm Stainless Steel Pet Dog Bowls Puppy Cats Food Drink Water Feeder Pets Supplies Non-slip Feeding Dishes,,Pet Supplies,EGP 213.60,,,5.0,,,,,https://m.media-amazon.com/images/I/51lmwAkQXKL._AC_UL320_.jpg,https://www.amazon.eg/dp/B091CCX12P,2026-05-15T05:00:55.090426
amazon,,fashion mania 2Pcs Pet Molar Toy Cucumber Shape Exercise Chewers for Puppy Cat Supplies,,Pet Supplies,EGP 396.00,,,,,,,,https://m.media-amazon.com/images/I/61vSvV1PjIL._AC_UL320_.jpg,https://www.amazon.eg/dp/B0DN1HTK22,2026-05-15T05:00:55.091464
amazon,,L size Candy Color Square Kennel House Eco-friendly Dog Bed Mat Sofa Pets Beds For Various Dogs Supplies,,Pet Supplies,EGP 244.00,,,3.3,,,,,https://m.media-amazon.com/images/I/718ozNGbKxL._AC_UL320_.jpg,https://www.amazon.eg/dp/B0969G9DZ8,2026-05-15T05:00:55.092073
amazon,,Max & Molly Urban Pets Multi-Function Leash - Design Heroes/S SIZE,,Pet Supplies,"EGP 1,160.00",,,4.7,,,,,https://m.media-amazon.com/images/I/81PoUvtr-ZL._AC_UL320_.jpg,https://www.amazon.eg/dp/B07S8NWHSC,2026-05-15T05:00:55.092436
amazon,,"Moro Moro 3 Pets Beds Deluxe Soft Dog, Cat, Hamster & Mouse Pad Nest Summer Bag Cushion Stuffed Hedgehog Out Warm Blankets Cotton Supplies Small Nest Soft And Comfortable",,Pet Supplies,EGP 423.00,,,,,,,,https://m.media-amazon.com/images/I/81nFIgkOk1L._AC_UL320_.jpg,https://www.amazon.eg/dp/B0CBNH6L8L,2026-05-15T05:00:55.093104
amazon,,Rubber brush pet massage for dogs and cats - blue color,,Pet Supplies,EGP 88.91,,,,,,,,https://m.media-amazon.com/images/I/61eSRvNVHpL._AC_UL320_.jpg,https://www.amazon.eg/dp/B091CZGWZR,2026-05-15T05:00:55.093745
amazon,,PAWPAW Free Hugs Cotton Pet Bandana Large Fushia,,Pet Supplies,EGP 600.00,,,,,,,,https://m.media-amazon.com/images/I/71X1TE792RL._AC_UL320_.jpg,https://www.amazon.eg/dp/B0D8LGF876,2026-05-15T05:00:55.094040
amazon,,Moro Moro 3 Dog Bed Eco Friendly Large Candy Color Pet House Square Small Pet Sofa for Various Dog Supplies,,Pet Supplies,EGP 333.00,,,,,,,,https://m.media-amazon.com/images/I/61YDfjsmPvL._AC_UL320_.jpg,https://www.amazon.eg/dp/B0DKC6L9GF,2026-05-15T05:00:55.095894
amazon,,Moro Moro 3 Candy Color XL Square Dog Kennel Eco-Friendly Dog Bed Mat Sofa Bed Pet Beds for Various Dog Supplies,,Pet Supplies,EGP 490.00,,,,,,,,https://m.media-amazon.com/images/I/31vXcwsDE2L._AC_UL320_.jpg,https://www.amazon.eg/dp/B0DKD75DTG,2026-05-15T05:00:55.096514
amazon,,PAWPAW Professional Goodboy Cotton Pet Bandana Small Dark Blue,,Pet Supplies,EGP 600.00,,,,,,,,https://m.media-amazon.com/images/I/71Kv0VchIxL._AC_UL320_.jpg,https://www.amazon.eg/dp/B0D8LG4F7M,2026-05-15T05:00:55.096844
amazon,,"Moro Moro 3 Pet Supplies Dog Bone Pattern Big Soft Warm Kennel Pet Dog Cat Mat Blanket, Size: S, 60×45×15Cm (Black Grey)",,Pet Supplies,EGP 522.00,,,,,,,,https://m.media-amazon.com/images/I/510tKB9jY8L._AC_UL320_.jpg,https://www.amazon.eg/dp/B0CCPLWRJV,2026-05-15T05:00:55.097440
amazon,,TM 70cm x 70cm x 70cm Pink Tent-style Pet Shelter,,Pet Supplies,EGP 473.00,,,1.0,,,,,https://m.media-amazon.com/images/I/61JOJgy6wPL._AC_UL320_.jpg,https://www.amazon.eg/dp/B0BG57RTDT,2026-05-15T05:00:55.098097
amazon,,L size Candy Color Square Kennel House Eco-friendly Dog Bed Mat Sofa Pets Beds For Various Dogs Supplies - 2724631251621,,Pet Supplies,EGP 197.00,,,2.4,,,,,https://m.media-amazon.com/images/I/61Kg4mAaKIL._AC_UL320_.jpg,https://www.amazon.eg/dp/B0966TWKFS,2026-05-15T05:00:55.098753
amazon,,Dog Poop Bags Pet Dog Supplies 300 Bag 20 Rolls With Dispenser and Waste Dog Poop Bag Leash Clip for Doggie Cats Puppy Biodegradable Extra Thick Large Leak Proof Environment Friendly Poo Bags,,Pet Supplies,"EGP 1,300.33",,,4.7,,,,,https://m.media-amazon.com/images/I/51mGUgPG-gL._AC_UL320_.jpg,https://www.amazon.eg/dp/B08LZVLRLV,2026-05-15T05:00:55.099074
amazon,,"Silicone Lick Mat, Pet Lick Mat, Slow Feeder, Dog Lick Mat, Cat Licking Mat, Pet Lick Mat (Charcoal)",,Pet Supplies,EGP 915.00,,,5.0,,,,,https://m.media-amazon.com/images/I/51Wgnmk427L._AC_UL320_.jpg,https://www.amazon.eg/dp/B0FB14WNRF,2026-05-15T05:00:55.099411
amazon,,PAWPAW It's My Barkday Cotton Pet Bandana Large Pink,,Pet Supplies,EGP 600.00,,,,,,,,https://m.media-amazon.com/images/I/71vVOx7rltL._AC_UL320_.jpg,https://www.amazon.eg/dp/B0D8LFJGBL,2026-05-15T05:00:55.099745
amazon,,PAWPAW I Only Love My Bed & Momma I'M Sorry Cotton Pet Bandana Large Orange,,Pet Supplies,EGP 600.00,,,4.0,,,,,https://m.media-amazon.com/images/I/71aUal419jL._AC_UL320_.jpg,https://www.amazon.eg/dp/B0D9WBCR7H,2026-05-15T05:00:55.100096
amazon,,"4Pcs/Pink, 5.2x4.4CM/No4/Set Cute Dog Boots Outdoor Snow Walking Non-slip Puppy Sneakers Supplies Puppy Comfortable Snow Boots Pet Winter Warm Shoes",,Pet Supplies,EGP 737.97,,,1.0,,,,,https://m.media-amazon.com/images/I/51bYYmswgpL._AC_UL320_.jpg,https://www.amazon.eg/dp/B0BR63PFSX,2026-05-15T05:00:55.100444
amazon,,Pet Dog's Cat Puppy Automatic Food Bottles Dispenser Food Dish Bowl Feeder For Dogs Cats 3.5 L,,Pet Supplies,EGP 390.00,,,4.0,,,,,https://m.media-amazon.com/images/I/51ZSg75PNlL._AC_UL320_.jpg,https://www.amazon.eg/dp/B096B36GZ7,2026-05-15T05:00:57.929027
amazon,,Nunbell NBF1005 P Pet Brush - Pink,,Pet Supplies,EGP 100.00,,,5.0,,,,,https://m.media-amazon.com/images/I/51MWBTt6UZL._AC_UL320_.jpg,https://www.amazon.eg/dp/B097F4R4DP,2026-05-15T05:00:57.929736
amazon,,Pets Republic Flowery Perfume 250ml,,Pet Supplies,EGP 266.00,,,3.6,,,,,https://m.media-amazon.com/images/I/41H4D4H3YUL._AC_UL320_.jpg,https://www.amazon.eg/dp/B091CB939X,2026-05-15T05:00:57.930446
amazon,,"Genuine Leather Braided Stick for Dog Walking and Dog Training (Black, 27 INCH)",,Pet Supplies,"EGP 1,619.20",,,4.4,,,,,https://m.media-amazon.com/images/I/61ZTJkz6VNL._AC_UL320_.jpg,https://www.amazon.eg/dp/B09MV1HQ8H,2026-05-15T05:00:57.930786
amazon,,Hair Remover for Pet,,Pet Supplies,EGP 120.00,,,3.5,,,,,https://m.media-amazon.com/images/I/41Iaa4Vg9YL._AC_UL320_.jpg,https://www.amazon.eg/dp/B091CNZ136,2026-05-15T05:00:57.931838
amazon,,"Pet Food Scoop with Clip, 2-Piece Set, Indigo and Grey Green, Dog and Cat Supplies",,Pet Supplies,EGP 104.13,,,,,,,,https://m.media-amazon.com/images/I/61n-+v1VBTL._AC_UL320_.jpg,https://www.amazon.eg/dp/B0FPC276VZ,2026-05-15T05:00:57.932553
amazon,,Nunbell 3 Peices Pet Hair Lint Roller For Cats & Dogs,,Pet Supplies,EGP 450.00,,,4.7,,,,,https://m.media-amazon.com/images/I/61Klk3ILaXS._AC_UL320_.jpg,https://www.amazon.eg/dp/B09234K1CY,2026-05-15T05:00:57.934149
amazon,,ELECDON 2Pcs Pet Dog Bath Brush Comb Silicone Rubber Dog Grooming Brush Silicone Puppy Massage Brush Hair Fur Grooming Cleaning Brush Soft Shampoo Dispenser,,Pet Supplies,EGP 150.41,,,3.3,,,,,https://m.media-amazon.com/images/I/51vX1f4-aHS._AC_UL320_.jpg,https://www.amazon.eg/dp/B097B3HK12,2026-05-15T05:00:57.935481
amazon,,Pads 50pcs 60 x 45 cm Pet Training Pads for Pee Not Suitable Places,,Pet Supplies,EGP 785.00,,,,,,,,https://m.media-amazon.com/images/I/610xwCi9PdL._AC_UL320_.jpg,https://www.amazon.eg/dp/B0DZPBQ647,2026-05-15T05:00:57.936090
amazon,,Small Pet Dog Hammock Goods Rat Rabbit Hamster Cat Cage Hammocks Hanging Bed Cage Supplies Accessories,,Pet Supplies,EGP 424.00,,,,,,,,https://m.media-amazon.com/images/I/41NEf0EaRkL._AC_UL320_.jpg,https://www.amazon.eg/dp/B0993QYJXM,2026-05-15T05:00:57.936728
amazon,,"1 Pc Random Color Dog Toys for Aggressive Chewers,Rubber Pacifier Puppy Dog Chewing Molar Play Toy Cute Funny Pet Supplies",,Pet Supplies,EGP 200.00,,,,,,,,https://m.media-amazon.com/images/I/41OcWZNf8PL._AC_UL320_.jpg,https://www.amazon.eg/dp/B0FJ2XMM34,2026-05-15T05:00:57.937653
amazon,,Pooper Scooper for Pet,,Pet Supplies,EGP 385.00,,,1.0,,,,,https://m.media-amazon.com/images/I/61Zjj2+OJsL._AC_UL320_.jpg,https://www.amazon.eg/dp/B091JY9C23,2026-05-15T05:00:57.938319
amazon,,"Five Finger Pet Grooming Deshedding Glove For Dogs, Cats, Rabit",,Pet Supplies,EGP 92.80,,,3.0,,,,,https://m.media-amazon.com/images/I/61W5NzscyuL._AC_UL320_.jpg,https://www.amazon.eg/dp/B091D48HHW,2026-05-15T05:00:57.938697
amazon,,PAWPAW It's My Barkday Cotton Pet Bandana Medium Blue,,Pet Supplies,EGP 600.00,,,,,,,,https://m.media-amazon.com/images/I/71ztr307A3L._AC_UL320_.jpg,https://www.amazon.eg/dp/B0D9W9MQTW,2026-05-15T05:00:57.940621
amazon,,"Zoocozy 2in1 Pet Grooming Gloves, Pet Hair Removable Gloves Cat Grooming Supplies Heat Resistant Silicone Gloves Applicable to Dogs Cats with Long Short Fur Two Right Hands can be Easily Replaced",,Pet Supplies,EGP 126.75,,,,,,,,https://m.media-amazon.com/images/I/61vyAppOz6L._AC_UL320_.jpg,https://www.amazon.eg/dp/B0F1TZ3BR2,2026-05-15T05:00:57.941600
amazon,,"Pet Disposable Glove Wipes, for Daily Care and Traveling, Rinse Free,6 Pieces per Pack",,Pet Supplies,,,,,,,,,https://m.media-amazon.com/images/I/41z9WLRFFJL._AC_UL320_.jpg,https://www.amazon.eg/dp/B0FBGWC3NB,2026-05-15T05:00:57.941873
amazon,,"Nylon Safety Small and Medium Leash Beautiful Light Up Dog Pet Clip (Multicolor, 5ft)",,Pet Supplies,EGP 148.63,EGP 167.00,,4.2,Was:,,,,https://m.media-amazon.com/images/I/61e1ezZ0gvL._AC_UL320_.jpg,https://www.amazon.eg/dp/B0B47V4RDX,2026-05-15T05:00:57.942914
amazon,,"Plastic Brush for Pets, Medium - Blue from pets zone",,Pet Supplies,EGP 250.00,,,,,,,,https://m.media-amazon.com/images/I/71W5iRRe9NL._AC_UL320_.jpg,https://www.amazon.eg/dp/B0F7Y3S7MF,2026-05-15T05:01:01.946738
amazon,,"Pet Bathing Tool - Pet Shower Sprayer for Dog and Cat Bathing Massage Combo with Pet Grooming Glove and 3 Faucet Adapters, 8.2 ft Hose Indoor and Outdoor Using",,Pet Supplies,EGP 188.00,,,,,,,,https://m.media-amazon.com/images/I/61s3s2jie6L._AC_UL320_.jpg,https://www.amazon.eg/dp/B091JM28GD,2026-05-15T05:01:01.947329
amazon,,Dog Nails Clipper Pet Nail Trimmer Cutter Cat Puppy Rabbit Kitten Claw Clipper Animal Bird Cat Dog Grooming Pet Supplies Small Sharp Professional Labor Saving Stainless Steel Paw Scissors (1 Pc Pink),,Pet Supplies,EGP 130.50,,,,,,,,https://m.media-amazon.com/images/I/419cP8eHH+L._AC_UL320_.jpg,https://www.amazon.eg/dp/B0C7S4YNK6,2026-05-15T05:01:01.947937
amazon,,nunbell Pet Hair Remover Roll (Additional Spare),,Pet Supplies,EGP 150.00,,,5.0,,,,,https://m.media-amazon.com/images/I/71aH87dIeJL._AC_UL320_.jpg,https://www.amazon.eg/dp/B091D77ZNG,2026-05-15T05:01:01.950504
amazon,,Nunbell Pet Litter Scoop With Poop Bag For Dogs - Green,,Pet Supplies,EGP 125.00,,,2.9,,,,,https://m.media-amazon.com/images/I/61AWzLS6hKS._AC_UL320_.jpg,https://www.amazon.eg/dp/B0968XKRFD,2026-05-15T05:01:01.950843
amazon,,Black & White Pet Protection Cover Size 6,,Pet Supplies,EGP 265.00,,,,,,,,https://m.media-amazon.com/images/I/51lZsTHey-L._AC_UL320_.jpg,https://www.amazon.eg/dp/B0BN9BR8RD,2026-05-15T05:01:01.951815
amazon,,NA Puppy Pee Pads | Pet Training Pee Pads Super Absorbent & Leak-Proof | Disposable Pet Piddle and Potty Pads for Puppies | Dogs | Doggie| Cats | Rabbits,,Pet Supplies,EGP 350.00,,,2.8,,,,,https://m.media-amazon.com/images/I/61XbD69LndL._AC_UL320_.jpg,https://www.amazon.eg/dp/B08ZYF279R,2026-05-15T05:01:01.952820
amazon,,Pet Grooming Glove - Deshedding Brush Gloves for Dogs Cats - Pet Hair Remover Gloves for Long & Short Fur - Enhanced Five Finger Design - Pet Glove Hair Removal-1 pair,,Pet Supplies,EGP 116.00,,,2.9,,,,,https://m.media-amazon.com/images/I/618osvX9S1L._AC_UL320_.jpg,https://www.amazon.eg/dp/B091C4G6FG,2026-05-15T05:01:01.953831
amazon,,Pet Toys Resistant To Bite Bone Dog Puppy Molars Rubber Ball Play For Teeth,,Pet Supplies,EGP 65.00,EGP 82.00,,2.9,Was:,,,,https://m.media-amazon.com/images/I/31XC3fkMrGL._AC_UL320_.jpg,https://www.amazon.eg/dp/B091D8X24Q,2026-05-15T05:01:01.955809
amazon,,"Portable Dog Pooper Scooper, Pet Toilet with No-Touch Claw Mechanism, Leak-Proof Waste Storage & Bags, Compact & Easy to Use for Small to Large Dogs for Outdoor Activities (Blue+1 Roll Bag)",,Pet Supplies,"EGP 1,800.11",,,,,,,,https://m.media-amazon.com/images/I/51lZIunBEUL._AC_UL320_.jpg,https://www.amazon.eg/dp/B0DP58TJL7,2026-05-15T05:01:01.956103
amazon,,"Nail Clippers,Dogs,Cat,Animal Cuts,Nail Scissors,Security,2pcs Electric Painless Pet Nail Clipper Pedi Pet Dogs Cats Paw Nail Trimmer Cut Animals Grinding File Kit Grooming Products",,Pet Supplies,EGP 575.00,,,3.6,,,,,https://m.media-amazon.com/images/I/51KES14uJTL._AC_UL320_.jpg,https://www.amazon.eg/dp/B08ZKMZ1NM,2026-05-15T05:01:01.957190
amazon,,Pet Capsule Space Carrier Bag - Grey,,Pet Supplies,EGP 988.00,,,3.7,,,,,https://m.media-amazon.com/images/I/712ZQV+pu+L._AC_UL320_.jpg,https://www.amazon.eg/dp/B09FTNCLTN,2026-05-15T05:01:01.957542
amazon,,"Vetadine antiseptic for open wounds, accidental wounds, post-operative wounds in Dogs and Cats",,Pet Supplies,EGP 180.00,,,2.0,,,,,https://m.media-amazon.com/images/I/41h+ap4t1ML._AC_UL320_.jpg,https://www.amazon.eg/dp/B0G2J1HTT6,2026-05-15T05:01:01.957869
amazon,,"Domkim Self-Cleaning Slicker Dog & Cat Brush, Slicker Pet Grooming Combs, Shedding Grooming Tools - Gently Removes Loose Undercoat, Fur, Dirt, Mats and Tangled Hair (Grey)",,Pet Supplies,,,,3.6,,,,,https://m.media-amazon.com/images/I/51h2-PWrYZS._AC_UL320_.jpg,https://www.amazon.eg/dp/B08YDPJBFZ,2026-05-15T05:01:01.958527
amazon,,"Nobby Josi Comfort Oval Dog Bed, 65 x 57 x 22 cm, Grey",,Pet Supplies,"EGP 4,563.00",,,4.3,,,,,https://m.media-amazon.com/images/I/6150wMTc9VL._AC_UL320_.jpg,https://www.amazon.eg/dp/B00LA3ZYY8,2026-05-15T05:01:01.958856
amazon,,"training pads for puppy (60/90cm, 10 pieces)",,Pet Supplies,EGP 115.70,,,4.0,,,,,https://m.media-amazon.com/images/I/41MGug4-cyL._AC_UL320_.jpg,https://www.amazon.eg/dp/B091CG27GS,2026-05-15T05:01:05.651738
amazon,,"Automatic Water Fountains for Pets, Automatic Cat Water Bowl, Indoor Cat Watering Supplies, Pet Hydration Station, Pet Water Dispenser, Cats Silent Drinking Fountains for Cats Puppys(White)",,Pet Supplies,EGP 773.00,,,,,,,,https://m.media-amazon.com/images/I/6109PXKdsUL._AC_UL320_.jpg,https://www.amazon.eg/dp/B0DF7PQXDJ,2026-05-15T05:01:05.652035
amazon,,"Pet Grooming Gloves Cat Grooming Gloves, for Removing Static Hair Gentle Hair Removal Pet Hair Remover Gloves Versatile Furminator for Dogs,Cats with Long/Short Fur leaning Bathing Massage",,Pet Supplies,EGP 160.00,,,3.8,,,,,https://m.media-amazon.com/images/I/81u9-q44SxL._AC_UL320_.jpg,https://www.amazon.eg/dp/B0F18FFT9S,2026-05-15T05:01:05.652369
amazon,,Pet Grooming Brush Bath Brush- Pet Massage Brush Shampoo Dispenser-Soft Silicone Brush Rubber Bristle for Dogs and Cats Shower Grooming,,Pet Supplies,EGP 36.00,,,2.5,,,,,https://m.media-amazon.com/images/I/41M8T1vj6dL._AC_UL320_.jpg,https://www.amazon.eg/dp/B08JSSKJRZ,2026-05-15T05:01:05.652716
amazon,,Dexas Popware for Pets Collapsible Kennel Bowl,,Pet Supplies,EGP 685.00,,,3.6,,,,,https://m.media-amazon.com/images/I/61fMSQmG5oL._AC_UL320_.jpg,https://www.amazon.eg/dp/B00N47BQB8,2026-05-15T05:01:05.653053
amazon,,"Upgrade pet grooming gloves, gentle hair removal brush gloves - efficient pet hair removal gloves - washing gloves for long haired dogs, short haired cats, and horses - right hand (red)",,Pet Supplies,EGP 51.00,EGP 57.00,,4.2,Was:,,,,https://m.media-amazon.com/images/I/61s6GGZpHUL._AC_UL320_.jpg,https://www.amazon.eg/dp/B0C7GSK9RS,2026-05-15T05:01:05.653467
amazon,,"Fresh Pet Grooming Glove, Efficient Hair Remover, Gentle Deshedding Brush, Massage Tool with Unique 5 Finger Long and Short Fur Dog and Cat, Blue",,Pet Supplies,EGP 89.47,,,5.0,,,,,https://m.media-amazon.com/images/I/612YzZx5zJL._AC_UL320_.jpg,https://www.amazon.eg/dp/B096952RS9,2026-05-15T05:01:05.653845
amazon,,Deshedding Glove for Gentle Efficient Pet Grooming,,Pet Supplies,EGP 49.00,EGP 77.00,,4.4,List:,,,,https://m.media-amazon.com/images/I/61-D8p+Cm9L._AC_UL320_.jpg,https://www.amazon.eg/dp/B096QY7DTH,2026-05-15T05:01:05.654230
amazon,,2Pcs/set Grooming Gloves Versatile Pet Clean Grooming Massage Gloves - Blue,,Pet Supplies,EGP 189.90,,,4.0,,,,,https://m.media-amazon.com/images/I/6196IcIl4nL._AC_UL320_.jpg,https://www.amazon.eg/dp/B09232CLS7,2026-05-15T05:01:05.654585
amazon,,"2 Pack Pet Hair Removal Gloves,Double Sided Cat Grooming Glove,Static Removal Gloves For Dogs & Cats,Reusable Deshedding Pet Glove For Furniture,Bed,Carpet,Clothes,Sofa",,Pet Supplies,EGP 284.80,,,3.8,,,,,https://m.media-amazon.com/images/I/81rsZ30AugL._AC_UL320_.jpg,https://www.amazon.eg/dp/B0FBFZ8KS4,2026-05-15T05:01:05.654917
amazon,,Pet Dog Cat Nail Clipper,,Pet Supplies,EGP 124.00,,,5.0,,,,,https://m.media-amazon.com/images/I/61yA4nYNctL._AC_UL320_.jpg,https://www.amazon.eg/dp/B0BLNVR1JM,2026-05-15T05:01:05.655245
