platform,asin,title,brand,category,current_price,original_price,discount,rating,reviews_count,prime_eligible,amazon_choice,sponsored,main_image,product_url,scraped_at
amazon,,"S and A No. 9013 Vende Clipboard with Plastic Cover, 23.5 cm x 31.5 cm Size",,Office Products,EGP 80.00,,,5.0,,,,,https://m.media-amazon.com/images/I/6179tCk+anL._AC_UL320_.jpg,https://www.amazon.eg/dp/B0DPSX9XTV,2026-03-31T06:08:44.377942
amazon,,Eagle T5165AB Compact Printed Box Auto Tape Dispenser,,Office Products,EGP 308.14,,,4.3,,,,,https://m.media-amazon.com/images/I/61D54qujgoL._AC_UL320_.jpg,https://www.amazon.eg/dp/B0CQXVGK5Y,2026-03-31T06:08:44.378419
amazon,,KINARY A4 Premium Plastic File with Two-Hole and Side Holder in Vibrant Blue,,Office Products,EGP 16.67,,,,,,,,https://m.media-amazon.com/images/I/51qf4FSyTIL._AC_UL320_.jpg,https://www.amazon.eg/dp/B0FKH14K5Z,2026-03-31T06:08:47.230234
amazon,,Eagle 204 Iron Stapler - Black Grey,,Office Products,EGP 96.54,,,3.5,,,,,https://m.media-amazon.com/images/I/71Sqm+SWXPL._AC_UL320_.jpg,https://www.amazon.eg/dp/B07N6PZHTV,2026-03-31T06:08:47.232514
amazon,,Digital studio pvc dual mechanism portfolio - fuchsia,,Office Products,EGP 65.74,,,5.0,,,,,https://m.media-amazon.com/images/I/7121l+y1wfL._AC_UL320_.jpg,https://www.amazon.eg/dp/B093G1LDM4,2026-03-31T06:08:47.233961
amazon,,3A Portfolio C2507 Leather Zipper Card Holder Calculator 34X25X2 CM - Havan,,Office Products,EGP 481.77,,,3.0,,,,,https://m.media-amazon.com/images/I/411bPqfa4HL._AC_UL320_.jpg,https://www.amazon.eg/dp/B0DD7P1VSZ,2026-03-31T06:08:47.234442
amazon,,"Prima Envelope Folder, Pack of 12 - Blue",,Office Products,EGP 130.05,,,4.1,,,,,https://m.media-amazon.com/images/I/61RO8pLD2fL._AC_UL320_.jpg,https://www.amazon.eg/dp/B096VTX5RY,2026-03-31T06:08:47.234945
amazon,,"Al-Manar Dynamic Round Adhesive Label Sticker, 15 mm With Premium Material Suitable For Home, School And Office - Red Fluorescent",,Office Products,,,,,,,,,https://m.media-amazon.com/images/I/71mJYAw-kIL._AC_UL320_.jpg,https://www.amazon.eg/dp/B0FFHHTZCX,2026-03-31T06:08:47.235325
amazon,,Simba File Protctor with Capsule Flowers Shape 180 Micronronron Model 8804,,Office Products,EGP 9.00,,,4.2,,,,,https://m.media-amazon.com/images/I/41oyWUP96oL._AC_UL320_.jpg,https://www.amazon.eg/dp/B0DQK254SQ,2026-03-31T06:08:47.235784
amazon,,"Yijian pu-1618 business cards holder, pack of 180 - turquoise",,Office Products,EGP 62.68,,,1.0,,,,,https://m.media-amazon.com/images/I/91rwgPGgofL._AC_UL320_.jpg,https://www.amazon.eg/dp/B0968XWDMH,2026-03-31T06:08:47.236247
amazon,,"STALO Soft Aluminum Mdf Frame Cork Bulletin Board, 60x40",,Office Products,EGP 306.77,,,4.3,,,,,https://m.media-amazon.com/images/I/71O264c6+AL._AC_UL320_.jpg,https://www.amazon.eg/dp/B09T74Y4W6,2026-03-31T06:08:47.236769
amazon,,3A 24/6 Stapler - Mint Green 2817,,Office Products,EGP 64.66,,,,,,,,https://m.media-amazon.com/images/I/41D55laKpFL._AC_UL320_.jpg,https://www.amazon.eg/dp/B0DD7K8TTX,2026-03-31T06:08:47.237170
amazon,,"Elmaayergy T20A File Folder With 20 Pockets A4 With Durable Material, Suitable For School And Home",,Office Products,EGP 64.00,,,,,,,,https://m.media-amazon.com/images/I/41SCmAGtApL._AC_UL320_.jpg,https://www.amazon.eg/dp/B0CJYK8KHB,2026-03-31T06:08:47.237592
amazon,,3A Paul Frank Multi-Color Message Board - Foam Frame with Marker & Tape,,Office Products,EGP 71.58,,,4.0,,,,,https://m.media-amazon.com/images/I/71d2nokepQL._AC_UL320_.jpg,https://www.amazon.eg/dp/B0CP1FX7Z6,2026-03-31T06:08:47.238098
amazon,,"Clever Envelope Plastic File with a Capsule, 0.16 mm Size, Purple/White",,Office Products,EGP 18.27,,,,,,,,https://m.media-amazon.com/images/I/51KZJPIVKoL._AC_UL320_.jpg,https://www.amazon.eg/dp/B0D8JTC25S,2026-03-31T06:08:47.238502
amazon,,"YM Sketch Bookmark-Aware |5x15 cm round curve edge thick illustration cardstock paper, 1 pcs|Gift For Book Lovers,back to school,office,artists, students books reading writing",,Office Products,EGP 34.00,,,3.6,,,,,https://m.media-amazon.com/images/I/61KVnf7fCcL._AC_UL320_.jpg,https://www.amazon.eg/dp/B0C564GS88,2026-03-31T06:08:47.238957
amazon,,KW Stapler heavy duty 50LA 210 sheets,,Office Products,EGP 500.00,,,1.8,,,,,https://m.media-amazon.com/images/I/71iW7hG9yuL._AC_UL320_.jpg,https://www.amazon.eg/dp/B0923K7DQK,2026-03-31T06:08:50.251255
amazon,,Yassin File Protector With Zipper Multicolors A3,,Office Products,EGP 50.00,,,5.0,,,,,https://m.media-amazon.com/images/I/713CxnEOHOL._AC_UL320_.jpg,https://www.amazon.eg/dp/B0DQK3P8HH,2026-03-31T06:08:50.252250
amazon,,kangaro heavy duty stapler HD-23L17,,Office Products,"EGP 7,030.65",,,,,,,,https://m.media-amazon.com/images/I/514pI9GVu7S._AC_UL320_.jpg,https://www.amazon.eg/dp/B09233QTHB,2026-03-31T06:08:50.252720
amazon,,3A A4 Leather Binder with Zipper 23 * 33 cm Set Of 3 Pieces - Beige A4-3,,Office Products,EGP 72.83,,,5.0,,,,,https://m.media-amazon.com/images/I/71AvpmNW9dL._AC_UL320_.jpg,https://www.amazon.eg/dp/B0DCTZ5PNB,2026-03-31T06:08:50.253578
amazon,,"ALLboards Cork Board with Aluminium Frame, 120 x 90 cm, Cork Notice Board for Push Pins Anodized Aluminium Memoboard",,Office Products,"EGP 1,560.55",,,4.2,,,,,https://m.media-amazon.com/images/I/811bMUWvgIL._AC_UL320_.jpg,https://www.amazon.eg/dp/B081JYTF62,2026-03-31T06:08:50.254491
amazon,,Kangaro Stapler HP 45,,Office Products,EGP 340.00,,,4.2,,,,,https://m.media-amazon.com/images/I/61hV2Q6w8VL._AC_UL320_.jpg,https://www.amazon.eg/dp/B07MWTFTPQ,2026-03-31T06:08:50.254947
amazon,,"Genuine Brother TZe-M951 24mm Laminated Label Tape Replacement for Brother Label Printers, Black on Matt Silver",,Office Products,"EGP 1,350.00",,,4.7,,,,,https://m.media-amazon.com/images/I/61Bypw38WUL._AC_UL320_.jpg,https://www.amazon.eg/dp/B004YJLXEU,2026-03-31T06:08:50.255408
amazon,,Atlas A4 Box File - Black,,Office Products,EGP 108.04,,,3.2,,,,,https://m.media-amazon.com/images/I/61X5slrHHVL._AC_UL320_.jpg,https://www.amazon.eg/dp/B07MX4VBBR,2026-03-31T06:08:50.255867
amazon,,"STAEDTLER School compass, violet 550 50 M4",,Office Products,EGP 220.00,,,4.3,,,,,https://m.media-amazon.com/images/I/514R3VVKzlL._AC_UL320_.jpg,https://www.amazon.eg/dp/B07R872DCC,2026-03-31T06:08:50.256319
amazon,,"Board with Pen And Magnetic Holder, White Silver (60 * 90)",,Office Products,EGP 731.40,EGP 800.00,,3.0,List:,,,,https://m.media-amazon.com/images/I/51A3l408abL._AC_UL320_.jpg,https://www.amazon.eg/dp/B0DGLNC77W,2026-03-31T06:08:50.256886
amazon,,"Post-it Arrow Shaped Notes Pencil on Ruler Card, Assorted Colors",,Office Products,EGP 40.00,,,,,,,,https://m.media-amazon.com/images/I/313FAOJZbBL._AC_UL320_.jpg,https://www.amazon.eg/dp/B0FL191QW6,2026-03-31T06:08:50.257281
amazon,,3A Clip Pin Machine With 8 Pins - Grey,,Office Products,EGP 32.21,,,4.2,,,,,https://m.media-amazon.com/images/I/41MI4AyArQL._AC_UL320_.jpg,https://www.amazon.eg/dp/B0DKD6X5NB,2026-03-31T06:08:50.257736
amazon,,"Luxury Business Gift Set, 29.5 x 21 x 4 cm, Black",,Office Products,EGP 944.97,,,,,,,,https://m.media-amazon.com/images/I/41Y0kGZ44DL._AC_UL320_.jpg,https://www.amazon.eg/dp/B0DPVKHL56,2026-03-31T06:08:50.258122
amazon,,Generic. WH-100AT High Quality White Board with Metal Frame 20 * 30 cm for Kids and Students - White Silver,,Office Products,EGP 120.04,,,1.0,,,,,https://m.media-amazon.com/images/I/51SHjSP9UEL._AC_UL320_.jpg,https://www.amazon.eg/dp/B0CQWF6D51,2026-03-31T06:08:50.258622
amazon,,Royal Clear File- Blue,,Office Products,EGP 21.56,,,,,,,,https://m.media-amazon.com/images/I/51+HScCM78L._AC_UL320_.jpg,https://www.amazon.eg/dp/B0FDGZ31P5,2026-03-31T06:08:52.997684
amazon,,3A 24/6 Stapler - Mint Green 2816,,Office Products,EGP 77.03,,,5.0,,,,,https://m.media-amazon.com/images/I/41Tm0wZ4FiL._AC_UL320_.jpg,https://www.amazon.eg/dp/B0DD7J1KRN,2026-03-31T06:08:53.000530
amazon,,"Silver Paper Clips YY-034, 33mm, 12 per Box, Durable",,Office Products,EGP 14.00,,,5.0,,,,,https://m.media-amazon.com/images/I/41LEIiJmm+L._AC_UL320_.jpg,https://www.amazon.eg/dp/B0FL185SFR,2026-03-31T06:08:53.004220
amazon,,Bundle of Kangaro Stapler Model DS45N Blue + Staple Remover + DP280 Puncher Black + Box of 1000 Kangaro Staples,,Office Products,EGP 527.12,,,,,,,,https://m.media-amazon.com/images/I/51am32BEKSL._AC_UL320_.jpg,https://www.amazon.eg/dp/B0C96DJ5S3,2026-03-31T06:08:53.004641
amazon,,"Elmaayergy 80002 / PY-12A/198 Set Of 12 Pieces Of Plastic Numerical Colourful Dividers With Durable Material, Suitable For School And Home",,Office Products,EGP 37.39,EGP 44.02,,,Was:,,,,https://m.media-amazon.com/images/I/41QOVxRBDdL._AC_UL320_.jpg,https://www.amazon.eg/dp/B0CJYKLR8P,2026-03-31T06:08:53.005142
amazon,,"M&G Stapler, Compact Design, for Efficient Document Binding, Assorted Colors",,Office Products,EGP 117.00,EGP 131.00,,,List:,,,,https://m.media-amazon.com/images/I/51vUa+oyIBL._AC_UL320_.jpg,https://www.amazon.eg/dp/B0FG334G58,2026-03-31T06:08:53.005632
amazon,,"Belal DL6064 Q1048 Colored Paper Binder Clip in Jar 48 Pieces, 25 mm Size",,Office Products,EGP 97.77,EGP 112.00,,5.0,List:,,,,https://m.media-amazon.com/images/I/51BrDhEutzL._AC_UL320_.jpg,https://www.amazon.eg/dp/B0D47J4HRT,2026-03-31T06:08:53.006152
amazon,,"MECCANIXITY Price Tags and Hang Tag String Clothing Price Marking Tag, 2""x1.4"" Black String Tags for Clothes, Retail Store 100 Set",,Office Products,EGP 150.00,,,5.0,,,,,https://m.media-amazon.com/images/I/61nAW33hR1L._AC_UL320_.jpg,https://www.amazon.eg/dp/B0CS3737D6,2026-03-31T06:08:53.006608
amazon,,"Elmaayergy K120 Plastic Ruler With Scientific Shapes With Durable Material, Suitable For School And Home",,Office Products,EGP 81.51,,,1.0,,,,,https://m.media-amazon.com/images/I/51tRDIfDX6L._AC_UL320_.jpg,https://www.amazon.eg/dp/B0CJYK5SB8,2026-03-31T06:08:53.007068
amazon,,"various Transparent Film for Plastic Packaging 50 cm x 200 m, 23 Microns, Industrial Stretch Resistance, Transparent Adhesion, Wrap for Moving, Pallets. (Roll 3, Transparent Film)",,Office Products,EGP 650.00,,,4.6,,,,,https://m.media-amazon.com/images/I/41gtT1gwSHL._AC_UL320_.jpg,https://www.amazon.eg/dp/B0CCY81Y4P,2026-03-31T06:08:53.007520
amazon,,3A Clip Pin Machine With 8 Pins - Red,,Office Products,,,,5.0,,,,,https://m.media-amazon.com/images/I/41Hc4oq6orL._AC_UL320_.jpg,https://www.amazon.eg/dp/B0DKD6RRF4,2026-03-31T06:08:53.007952
amazon,,ARK Therapeutic Unbreakable drawing set 3 pcs 026 -multicolor,,Office Products,EGP 19.30,,,3.5,,,,,https://m.media-amazon.com/images/I/712tXb9Z7uL._AC_UL320_.jpg,https://www.amazon.eg/dp/B0B4HK59P3,2026-03-31T06:08:53.008428
amazon,,Stick'n HOPAX Art Pad with Alphabet Ruler - 25.4 x 30.5 cm,,Office Products,EGP 102.67,,,1.0,,,,,https://m.media-amazon.com/images/I/81sUMFoN1DL._AC_UL320_.jpg,https://www.amazon.eg/dp/B0983ZYSWV,2026-03-31T06:08:57.166436
amazon,,"AdirOffice 8"" x 8"" Acrylic Ballot Box With Easy Open Rear Door - Durable Acrylic With Lock - Ideal for Voting, Charity & Suggestion Collection - Clear",,Office Products,"EGP 1,350.00",,,3.2,,,,,https://m.media-amazon.com/images/I/817jNpySyLL._AC_UL320_.jpg,https://www.amazon.eg/dp/B07BQ8JTBH,2026-03-31T06:08:57.168279
amazon,,3A 24/6 Stapler With Box Of Staples 1000 Staples - Cashmere 2817,,Office Products,EGP 92.43,,,3.9,,,,,https://m.media-amazon.com/images/I/514dSpJvtxL._AC_UL320_.jpg,https://www.amazon.eg/dp/B0DD7MZ6KJ,2026-03-31T06:08:57.172113
amazon,,Deli e38561 binder clips - pack of 12-51 mm.,,Office Products,EGP 106.70,,,4.6,,,,,https://m.media-amazon.com/images/I/51RjMnUvTLL._AC_UL320_.jpg,https://www.amazon.eg/dp/B075BMLYC4,2026-03-31T06:08:57.172582
amazon,,CraftsOfEgypt Egyptian Papyrus Paper Set of 10 Bookmarks Book Marks History Educational Set.,,Office Products,EGP 175.00,,,4.3,,,,,https://m.media-amazon.com/images/I/91pbK4DguML._AC_UL320_.jpg,https://www.amazon.eg/dp/B005MY9OO2,2026-03-31T06:08:57.173084
amazon,,"GAPS Barcode Label Sticker, 38.1mm x 25.4mm, 1000 Labels per Roll",,Office Products,EGP 337.08,,,4.3,,,,,https://m.media-amazon.com/images/I/5136o04SgeL._AC_UL320_.jpg,https://www.amazon.eg/dp/B099DJHH84,2026-03-31T06:08:57.173597
amazon,,"Right F30A/A4 30 Pocket Plastic File, A4 Size Multi Color",,Office Products,EGP 44.41,,,3.0,,,,,https://m.media-amazon.com/images/I/517gdMLCFSL._AC_UL320_.jpg,https://www.amazon.eg/dp/B0CQXVT39M,2026-03-31T06:08:57.174056
amazon,,"Belle Vous Horizontal ID Card Holder Name Clip (Pack of 50) 9 x 6 cm – Transparent PVC Water Resistant – School, Company, Conference, Visitor",,Office Products,EGP 313.00,,,3.2,,,,,https://m.media-amazon.com/images/I/714t1oO1rhL._AC_UL320_.jpg,https://www.amazon.eg/dp/B01N4UFBBV,2026-03-31T06:08:57.174514
amazon,,Eagle 898l stationery tape dispenser (large) different color,,Office Products,EGP 168.00,,,,,,,,https://m.media-amazon.com/images/I/61lSkJ0WbYL._AC_UL320_.jpg,https://www.amazon.eg/dp/B091NYZTTN,2026-03-31T06:08:57.174925
amazon,,Sisley EMULSIÓN ECOLÓGICA COMOUND 60ML,,Office Products,"EGP 1,850.00",,,4.1,,,,,https://m.media-amazon.com/images/I/61B0Qaqdm7L._AC_UL320_.jpg,https://www.amazon.eg/dp/B0BVZ7314H,2026-03-31T06:09:01.182349
amazon,,Simba File with Capsule Squares Foolscap 180 Micron Orange Model FC20918 Sturdy Plastic Folder Designed for Organized Paper Storage,,Office Products,EGP 11.00,,,,,,,,https://m.media-amazon.com/images/I/71t0iHVMy3L._AC_UL320_.jpg,https://www.amazon.eg/dp/B0G1Q52N5X,2026-03-31T06:09:01.184646
amazon,,"Elmaayergy Elastic Plastic Frensh Curve Ruler With Scientific Shapes 60CM With Durable Material, Suitable For School And Home",,Office Products,EGP 216.08,,,5.0,,,,,https://m.media-amazon.com/images/I/51hRCrn1u8L._AC_UL320_.jpg,https://www.amazon.eg/dp/B0CJYJGDPS,2026-03-31T06:09:01.188018
amazon,,"SONIX MS-1001-A6 Binder A6 Zippered Mesh Divider, 6-Pack",,Office Products,EGP 97.00,,,,,,,,https://m.media-amazon.com/images/I/615JCYoqJgL._AC_UL320_.jpg,https://www.amazon.eg/dp/B0FJFS3G96,2026-03-31T06:09:01.189997
amazon,,OMEGA Tape Dispenser - Elegant,,Office Products,EGP 445.00,,,4.2,,,,,https://m.media-amazon.com/images/I/71sYaZtajdL._AC_UL320_.jpg,https://www.amazon.eg/dp/B00Q6TLFAS,2026-03-31T06:09:01.190450
amazon,,"Casio XR-9SR1 EZ Label Printer XR-9X1, self-Adhesive Tape, 9 mm x 8 m, Black on Silver Black/Silver",,Office Products,EGP 822.87,,,4.6,,,,,https://m.media-amazon.com/images/I/71Kce1StEUL._AC_UL320_.jpg,https://www.amazon.eg/dp/B000KPW4TA,2026-03-31T06:09:01.190910
amazon,,3A Cardboard Appreciation Certificate Holder 23X32cm Set Of 5 Pieces - Green 4161-1,,Office Products,EGP 129.00,,,1.0,,,,,https://m.media-amazon.com/images/I/51xB6WOftSL._AC_UL320_.jpg,https://www.amazon.eg/dp/B0DD7MKK1H,2026-03-31T06:09:01.191360
amazon,,G4GADGET 15 A4 / Foolscap Bright Transparent Popper Wallet/Paper Wallets - Assorted Colours,,Office Products,EGP 245.00,,,4.5,,,,,https://m.media-amazon.com/images/I/811Xlx+wx6L._AC_UL320_.jpg,https://www.amazon.eg/dp/B0937BKD59,2026-03-31T06:09:01.191847
amazon,,Plastic zipper file a4 size - light blue,,Office Products,,,,4.3,,,,,https://m.media-amazon.com/images/I/71ZFSAIXHeS._AC_UL320_.jpg,https://www.amazon.eg/dp/B093G8CM7V,2026-03-31T06:09:01.192290
amazon,,Apli White Labels sheet 105 * 70 mm A4/8,,Office Products,EGP 6.93,,,1.0,,,,,https://m.media-amazon.com/images/I/41Zj58AkA8L._AC_UL320_.jpg,https://www.amazon.eg/dp/B007OREY72,2026-03-31T06:09:01.192751
amazon,,3A CLASSIR Jaguar Brecoin Metal Machine File 8 cm 1 Piece - Green 556-8,,Office Products,EGP 89.00,,,,,,,,https://m.media-amazon.com/images/I/41jQUwgYHcL._AC_UL320_.jpg,https://www.amazon.eg/dp/B0DCTZJD6M,2026-03-31T06:09:01.193153
amazon,,3A HK001-1 Carton Horizontal Paper Clipboard With Paper Handle 24 * 32 cm - Multi Color,,Office Products,EGP 89.00,,,5.0,,,,,https://m.media-amazon.com/images/I/51agjPJpaTL._AC_UL320_.jpg,https://www.amazon.eg/dp/B0DCV1HVWZ,2026-03-31T06:09:01.193615
amazon,,PPAPPAPPIYO Set of 50 3x5 Color Blank index cards 180gsm (yellow),,Office Products,EGP 120.00,,,4.8,,,,,https://m.media-amazon.com/images/I/41BGWkODiSL._AC_UL320_.jpg,https://www.amazon.eg/dp/B09N91LRW3,2026-03-31T06:09:01.194116
amazon,,"M&G Lead Pen, Bold and Reliable Writing or Sketching, 2B 2mm, Durable Graphite",,Office Products,,,,5.0,,,,,https://m.media-amazon.com/images/I/51nBHWP5ILL._AC_UL320_.jpg,https://www.amazon.eg/dp/B0FG3423DX,2026-03-31T06:09:01.194567
amazon,,Brother DK-22211 Continuous Length Film Tape - 29mm x 15.24m,,Office Products,"EGP 2,222.00",,,4.5,,,,,https://m.media-amazon.com/images/I/61qc0EuiEyL._AC_UL320_.jpg,https://www.amazon.eg/dp/B0006HIQQC,2026-03-31T06:09:01.195032
amazon,,3A Classer Brecoin File 8 cm with Metal Machine 1 Piece - Yellow 556,,Office Products,EGP 89.00,,,5.0,,,,,https://m.media-amazon.com/images/I/41gVmTqMsZL._AC_UL320_.jpg,https://www.amazon.eg/dp/B0DCV1N3JK,2026-03-31T06:09:05.702545
amazon,,3A QB732-A5 Wire Paper Pouch With Zipper 18 * 32 cm 3 Pieces - Pink,,Office Products,EGP 125.00,,,,,,,,https://m.media-amazon.com/images/I/51G53ihmc1L._AC_UL320_.jpg,https://www.amazon.eg/dp/B0DCV11LY8,2026-03-31T06:09:05.709689
amazon,,3A AK10A Plastic File 10 Pockets A4 Size - Blue,,Office Products,EGP 58.00,,,,,,,,https://m.media-amazon.com/images/I/31SgPNGoR7L._AC_UL320_.jpg,https://www.amazon.eg/dp/B0DD7PW9CP,2026-03-31T06:09:05.710079
amazon,,3A MS1005-A4 Plastic Zipper File 24 * 34 cm 6 Pieces - Orange,,Office Products,,,,5.0,,,,,https://m.media-amazon.com/images/I/61nXkCAOXhL._AC_UL320_.jpg,https://www.amazon.eg/dp/B0DCTZ7N9P,2026-03-31T06:09:05.710522
amazon,,"Benge 60-Microns Sheet Protectors 100-Pieces, A4 Size",,Office Products,EGP 260.00,,,,,,,,https://m.media-amazon.com/images/I/51-TOfYprUL._AC_UL320_.jpg,https://www.amazon.eg/dp/B0FDL2LXM3,2026-03-31T06:09:08.529744
amazon,,3A E311-312 Plastic Letter L Binder 5 Pieces 30X24 cm - Red,,Office Products,EGP 100.00,,,,,,,,https://m.media-amazon.com/images/I/41eGwPbmvsL._AC_UL320_.jpg,https://www.amazon.eg/dp/B0DD7MGP5Z,2026-03-31T06:09:08.531026
