platform,product_id,title,brand,category,current_price,original_price,discount,rating,reviews_count,availability,seller,express_delivery,platform_badge,sponsored,main_image,all_images,description,weight,dimensions,model_number,country_of_origin,warranty,tech_specs,variations,ships_from,delivery_date,product_url,scraped_at
amazon,B0FMCJM5R9,"fashion mania Car Hood Decal Sticker, Racing Stripe Graphic Stickers for Auto Body Skirt Roof Hood Bumper, Automotive Exterior Decoration Vinyl Decal for Car SUV Truck, Car Accessories (Black)",,Automotive,EGP 398.00,,,,,,,,,,https://m.media-amazon.com/images/I/61gBxYlrT0L._AC_UL320_.jpg,https://m.media-amazon.com/images/I/61gBxYlrT0L._AC_UL320_.jpg,,,,,,,,,,,https://www.amazon.eg/dp/B0FMCJM5R9,2026-03-28T13:32:41.116835
amazon,B0DF5GBNHH,"Cleaning Gel for Car, Detailing Automotive Dust Crevice Cleaner Auto Air Vent Interior Detail Removal Putty For Keyboard Vents, PC, Laptops, Cameras - Pink",,Automotive,EGP 43.00,,,,,,,,,,https://m.media-amazon.com/images/I/61OJ4GA+fyL._AC_UL320_.jpg,https://m.media-amazon.com/images/I/61OJ4GA+fyL._AC_UL320_.jpg,,,,,,,,,,,https://www.amazon.eg/dp/B0DF5GBNHH,2026-03-28T13:32:44.376113
amazon,B0CMTCCRWG,"Car Trash Can with Lid, Automotive Trash Bin, Leak-Proof Back Seat Garbage Bag, Oxford Cloth Vehicle Container, Foldable Hanging Auto Organizer with Storage Pockets-Black",,Automotive,EGP 555.00,,,,,,,,,,https://m.media-amazon.com/images/I/61wz92LnUJL._AC_UL320_.jpg,https://m.media-amazon.com/images/I/61wz92LnUJL._AC_UL320_.jpg,,,,,,,,,,,https://www.amazon.eg/dp/B0CMTCCRWG,2026-03-28T13:32:44.376597
amazon,B0CNS6B3MS,"OAN 3D Chrome Emblem Automotive Car, Bike Badges Logo Self Adhesive Sticker (Skull, Silver)",,Automotive,EGP 199.00,,,4.2,,,,,,,https://m.media-amazon.com/images/I/51ivCSLc4jL._AC_UL320_.jpg,https://m.media-amazon.com/images/I/51ivCSLc4jL._AC_UL320_.jpg,,,,,,,,,,,https://www.amazon.eg/dp/B0CNS6B3MS,2026-03-28T13:32:44.377111
amazon,B0B1BG7YV4,"Generic FLAMINGO Sticker Remove for Car/Vehicles, Multicolor, (450 ml/9,17 oz) - F013",,Automotive,EGP 129.00,,,3.7,,,,,,,https://m.media-amazon.com/images/I/61gmD0zy0kL._AC_UL320_.jpg,https://m.media-amazon.com/images/I/61gmD0zy0kL._AC_UL320_.jpg,,,,,,,,,,,https://www.amazon.eg/dp/B0B1BG7YV4,2026-03-28T13:32:44.377692
amazon,B0983WX6JH,"Yamaha YRS-23 Soprano Recorder Flutes, German Fingering System Key of C Plastic Soprano, Best Gift for Students and Music Fans",,Musical Instruments,EGP 369.00,EGP 448.96,,4.6,List:,,,,,,https://m.media-amazon.com/images/I/51lSvdUbAkL._AC_UL320_.jpg,https://m.media-amazon.com/images/I/51lSvdUbAkL._AC_UL320_.jpg,,,,,,,,,,,https://www.amazon.eg/dp/B0983WX6JH,2026-03-28T13:32:31.042267
amazon,B0968W732K,Generic Wooden kids educational toy octave knock on the piano beat xylophone,,Musical Instruments,EGP 86.00,,,4.1,,,,,,,https://m.media-amazon.com/images/I/61gi1vhkvzL._AC_UL320_.jpg,https://m.media-amazon.com/images/I/61gi1vhkvzL._AC_UL320_.jpg,,,,,,,,,,,https://www.amazon.eg/dp/B0968W732K,2026-03-28T13:32:31.042876
amazon,B0FY3FP9C2,"Harmonica, 10 Holes C Key Musical Instrument, with Black Box 10.5 * 2.3cm, for Beginners and Professionals, Double Point Stabilization System",,Musical Instruments,EGP 359.10,EGP 399.00,,2.5,List:,,,,,,https://m.media-amazon.com/images/I/51WrxPfKXzL._AC_UL320_.jpg,https://m.media-amazon.com/images/I/51WrxPfKXzL._AC_UL320_.jpg,,,,,,,,,,,https://www.amazon.eg/dp/B0FY3FP9C2,2026-03-28T13:32:31.043563
amazon,B07VXJF4FP,Flute - musical instrument,,Musical Instruments,EGP 188.00,,,4.2,,,,,,,https://m.media-amazon.com/images/I/41Co2G+lU5L._AC_UL320_.jpg,https://m.media-amazon.com/images/I/41Co2G+lU5L._AC_UL320_.jpg,,,,,,,,,,,https://www.amazon.eg/dp/B07VXJF4FP,2026-03-28T13:32:31.044117
amazon,B09JL893Q4,"Wooden Kids Educational Piano Xylophone, Educational Musical Instruments Toy, 8 Key Scales (Xylophone)",,Musical Instruments,EGP 93.48,,,4.1,,,,,,,https://m.media-amazon.com/images/I/61MltGgbc4L._AC_UL320_.jpg,https://m.media-amazon.com/images/I/61MltGgbc4L._AC_UL320_.jpg,,,,,,,,,,,https://www.amazon.eg/dp/B09JL893Q4,2026-03-28T13:32:31.044671
amazon,B0C1TMYWH2,Electronic keyboard 61 keys,,Musical Instruments,"EGP 1,692.90",,,3.0,,,,,,,https://m.media-amazon.com/images/I/717sMQOtntL._AC_UL320_.jpg,https://m.media-amazon.com/images/I/717sMQOtntL._AC_UL320_.jpg,,,,,,,,,,,https://www.amazon.eg/dp/B0C1TMYWH2,2026-03-28T13:32:31.045207
amazon,B083DC9H5R,"Kalimba thumb piano 17 key finger piano musical instrument with study instruction and tune hammer, gift for kids, adult beginners.",,Musical Instruments,"EGP 1,099.00",,,4.6,,,,,,,https://m.media-amazon.com/images/I/81UwGXkBImL._AC_UL320_.jpg,https://m.media-amazon.com/images/I/81UwGXkBImL._AC_UL320_.jpg,,,,,,,,,,,https://www.amazon.eg/dp/B083DC9H5R,2026-03-28T13:32:31.045717
amazon,B09VXL3MKC,Mibee 32 Piano Keys Melodica Musical Instrument for Music Lovers Beginners Gift with Carrying Bag (Blue) 20220318 0,,Musical Instruments,EGP 999.00,,,5.0,,,,,,,https://m.media-amazon.com/images/I/61tBsLCAoCL._AC_UL320_.jpg,https://m.media-amazon.com/images/I/61tBsLCAoCL._AC_UL320_.jpg,,,,,,,,,,,https://www.amazon.eg/dp/B09VXL3MKC,2026-03-28T13:32:31.046280
amazon,B07VZP9RPS,Suzuki Folkmaster 1072 Standard Beginner Diatonic Blues Harmonica Gaita 10 Holes Key of C Musical Instrument,,Musical Instruments,EGP 749.00,,,4.4,,,,,,,https://m.media-amazon.com/images/I/6141t1V0NzL._AC_UL320_.jpg,https://m.media-amazon.com/images/I/6141t1V0NzL._AC_UL320_.jpg,,,,,,,,,,,https://www.amazon.eg/dp/B07VZP9RPS,2026-03-28T13:32:31.046789
amazon,B07PWY2G38,Violin Kit Full Size 4/4 Vintage Solid Wood Violin for Beginner Above 11 Years With Case,,Musical Instruments,"EGP 2,499.00",,,3.0,,,,,,,https://m.media-amazon.com/images/I/71NftDwYiqL._AC_UL320_.jpg,https://m.media-amazon.com/images/I/71NftDwYiqL._AC_UL320_.jpg,,,,,,,,,,,https://www.amazon.eg/dp/B07PWY2G38,2026-03-28T13:32:31.047342
amazon,B085PQ8C1D,Electric music Piano for children with microphone- S13632,,Musical Instruments,EGP 650.00,EGP 684.00,,3.6,List:,,,,,,https://m.media-amazon.com/images/I/71L5U3EmkdL._AC_UL320_.jpg,https://m.media-amazon.com/images/I/71L5U3EmkdL._AC_UL320_.jpg,,,,,,,,,,,https://www.amazon.eg/dp/B085PQ8C1D,2026-03-28T13:32:31.047957
amazon,B019JY6HPY,Wevez Belly Dancing Finger Zills Finger Cymbals 2 Pairs / 4 Pcs Golden,,Musical Instruments,EGP 80.00,,,4.0,,,,,,,https://m.media-amazon.com/images/I/71Spe6nTNGL._AC_UL320_.jpg,https://m.media-amazon.com/images/I/71Spe6nTNGL._AC_UL320_.jpg,,,,,,,,,,,https://www.amazon.eg/dp/B019JY6HPY,2026-03-28T13:32:31.048470
amazon,B0DR48R57W,"4 Piece Children's Musical Instrument Jingle Tambourines,Half Moon Tambourine,Wooden Toy Instruments,Percussion Toys,Percussion Instrument for Children",,Musical Instruments,EGP 269.00,,,5.0,,,,,,,https://m.media-amazon.com/images/I/61I02MeW-tL._AC_UL320_.jpg,https://m.media-amazon.com/images/I/61I02MeW-tL._AC_UL320_.jpg,,,,,,,,,,,https://www.amazon.eg/dp/B0DR48R57W,2026-03-28T13:32:31.049008
amazon,B0014ZG676,"Yamaha YRS-23Y Soprano Recorder Flute Instrument, Natural",,Musical Instruments,EGP 369.00,EGP 480.00,,4.6,List:,,,,,,https://m.media-amazon.com/images/I/71Ro54KOMrL._AC_UL320_.jpg,https://m.media-amazon.com/images/I/71Ro54KOMrL._AC_UL320_.jpg,,,,,,,,,,,https://www.amazon.eg/dp/B0014ZG676,2026-03-28T13:32:31.049593
amazon,B0G1H4VGV5,Foldable Xylophone Mini Marimba Glockenspiel Keyboard Percussion Instrument + Bag & Mallets - 29 Notes,,Musical Instruments,"EGP 1,200.00",,,5.0,,,,,,,https://m.media-amazon.com/images/I/51f4dCT0bQL._AC_UL320_.jpg,https://m.media-amazon.com/images/I/51f4dCT0bQL._AC_UL320_.jpg,,,,,,,,,,,https://www.amazon.eg/dp/B0G1H4VGV5,2026-03-28T13:32:31.050128
amazon,B014SCXI9U,"Flexzion Tambourine Metal Half Moon Musical Instruments Double Row Metal Jingles Hand Held Instruments Percussion with Ergonomic Handle Grip, Tambourines for Adults Church, Black",,Musical Instruments,EGP 499.00,,,4.6,,,,,,,https://m.media-amazon.com/images/I/61EXnz7Nf8L._AC_UL320_.jpg,https://m.media-amazon.com/images/I/61EXnz7Nf8L._AC_UL320_.jpg,,,,,,,,,,,https://www.amazon.eg/dp/B014SCXI9U,2026-03-28T13:32:31.050623
amazon,B09DG9YK7G,Tvoip wooden xylophone toys musical creative wooden instruments 8 notes xilofono children baby musical toys development,,Musical Instruments,EGP 89.99,,,3.9,,,,,,,https://m.media-amazon.com/images/I/617mjaIG1eL._AC_UL320_.jpg,https://m.media-amazon.com/images/I/617mjaIG1eL._AC_UL320_.jpg,,,,,,,,,,,https://www.amazon.eg/dp/B09DG9YK7G,2026-03-28T13:32:31.051170
amazon,B081PQVDWR,"Tabla sharqia (grey, 3)",,Musical Instruments,"EGP 1,200.00",,,3.4,,,,,,,https://m.media-amazon.com/images/I/61g8DfGBJjL._AC_UL320_.jpg,https://m.media-amazon.com/images/I/61g8DfGBJjL._AC_UL320_.jpg,,,,,,,,,,,https://www.amazon.eg/dp/B081PQVDWR,2026-03-28T13:32:31.051675
amazon,B0B1JGWF7J,Musical Instrument Rabbah Handmade Instrument,,Musical Instruments,EGP 179.00,,,2.7,,,,,,,https://m.media-amazon.com/images/I/41WrrTGHUhL._AC_UL320_.jpg,https://m.media-amazon.com/images/I/41WrrTGHUhL._AC_UL320_.jpg,,,,,,,,,,,https://www.amazon.eg/dp/B0B1JGWF7J,2026-03-28T13:32:31.052204
amazon,B07JK4DGLX,Donner Drum Practice Pad，12 Inches Silent Practice Drum Pad 2-Sided With Drum Sticks - Gray,,Musical Instruments,"EGP 1,099.00",,,4.6,,,,,,,https://m.media-amazon.com/images/I/71rYpcaXNhL._AC_UL320_.jpg,https://m.media-amazon.com/images/I/71rYpcaXNhL._AC_UL320_.jpg,,,,,,,,,,,https://www.amazon.eg/dp/B07JK4DGLX,2026-03-28T13:32:31.052713
amazon,B0FX8X4THN,Aluminum Kazoo Flute Mouth Simple Humming Musical Instrument for Adults & Kids (Green),,Musical Instruments,EGP 349.00,,,,,,,,,,https://m.media-amazon.com/images/I/41kx2wmfnbL._AC_UL320_.jpg,https://m.media-amazon.com/images/I/41kx2wmfnbL._AC_UL320_.jpg,,,,,,,,,,,https://www.amazon.eg/dp/B0FX8X4THN,2026-03-28T13:32:31.053189
amazon,B0CXLX8LQ7,"fashion mania Mini Thumb Piano, 8 Keys, Solid Wood, Portable, Lightweight, Modern, Polished Finish, Birthday Gift, Valentines Gift, Kids Adults Beginners",,Musical Instruments,EGP 599.00,,,5.0,,,,,,,https://m.media-amazon.com/images/I/717mIPVX82L._AC_UL320_.jpg,https://m.media-amazon.com/images/I/717mIPVX82L._AC_UL320_.jpg,,,,,,,,,,,https://www.amazon.eg/dp/B0CXLX8LQ7,2026-03-28T13:32:31.053682
amazon,B09VXMN3CH,Melodica 32 Keys (13 Black Keys) Double Tubes Mouthpiece Air Piano Keyboard Musical Instrument with Carrying Bag - Black,,Musical Instruments,"EGP 1,000.00",,,3.6,,,,,,,https://m.media-amazon.com/images/I/51zKFR6-QaL._AC_UL320_.jpg,https://m.media-amazon.com/images/I/51zKFR6-QaL._AC_UL320_.jpg,,,,,,,,,,,https://www.amazon.eg/dp/B09VXMN3CH,2026-03-28T13:32:31.054248
amazon,B0GNL435BS,"TOYS LAND 37 Key Electronic Piano Organ Keyboard with Microphone, Portable Digital Musical Learning Instrument Toy, Ideal Birthday Gift for Boys and Girls Aged 3+",,Musical Instruments,"EGP 1,099.00",,,,,,,,,,https://m.media-amazon.com/images/I/711qhsbC8lL._AC_UL320_.jpg,https://m.media-amazon.com/images/I/711qhsbC8lL._AC_UL320_.jpg,,,,,,,,,,,https://www.amazon.eg/dp/B0GNL435BS,2026-03-28T13:32:31.054712
amazon,B093X59XCQ,YONGMEI Stand&Bag Kit for 61 Keys Full Size Electronic Piano Keyboard portable Musical Instrument (Stand&Bag for Keyboard),,Musical Instruments,"EGP 1,799.00",,,4.0,,,,,,,https://m.media-amazon.com/images/I/51UXPLeiiGL._AC_UL320_.jpg,https://m.media-amazon.com/images/I/51UXPLeiiGL._AC_UL320_.jpg,,,,,,,,,,,https://www.amazon.eg/dp/B093X59XCQ,2026-03-28T13:32:31.055324
amazon,B08Z47WSN1,"Power beat wooden radiant radiant tambourine faced duff for adults, kids, dancers, singers - white/black",,Musical Instruments,EGP 323.00,EGP 333.00,,3.3,Was:,,,,,,https://m.media-amazon.com/images/I/61V8B9zmk4L._AC_UL320_.jpg,https://m.media-amazon.com/images/I/61V8B9zmk4L._AC_UL320_.jpg,,,,,,,,,,,https://www.amazon.eg/dp/B08Z47WSN1,2026-03-28T13:32:31.055918
amazon,B09BDMCS5L,Meinl Percussion Copper Cymbal 4 Pc,,Musical Instruments,EGP 130.00,,,4.5,,,,,,,https://m.media-amazon.com/images/I/51KCJUQvRdL._AC_UL320_.jpg,https://m.media-amazon.com/images/I/51KCJUQvRdL._AC_UL320_.jpg,,,,,,,,,,,https://www.amazon.eg/dp/B09BDMCS5L,2026-03-28T13:32:31.056436
amazon,B07V2M3V9D,PAL MUSIC HOUSE 4/4 Violin Full Size with Bow Rosin Carrying Hard Case Instrument for Beginners Adults Boys Girls Children Kids,,Musical Instruments,"EGP 2,499.00","EGP 2,565.00",,3.3,Was:,,,,,,https://m.media-amazon.com/images/I/61Zqrn5asHL._AC_UL320_.jpg,https://m.media-amazon.com/images/I/61Zqrn5asHL._AC_UL320_.jpg,,,,,,,,,,,https://www.amazon.eg/dp/B07V2M3V9D,2026-03-28T13:32:31.057035
amazon,B0F489ZVNM,10 Pieces Wooden Maracas Sand Hammer Hand Hold Percussion Wooden Maracas Rattles Shaker for Children Shaker Musical Instruments Educational Learning Toy Random Colour,,Musical Instruments,EGP 973.00,EGP 999.00,,,Was:,,,,,,https://m.media-amazon.com/images/I/61AI2BQd8+L._AC_UL320_.jpg,https://m.media-amazon.com/images/I/61AI2BQd8+L._AC_UL320_.jpg,,,,,,,,,,,https://www.amazon.eg/dp/B0F489ZVNM,2026-03-28T13:32:31.057564
amazon,B0FWRWWDFL,Maracas Maraca Rattle Hand Shaker Rhythm Hand Percussion Band Musical Instrument - 2 Pieces,,Musical Instruments,EGP 275.00,,,3.5,,,,,,,https://m.media-amazon.com/images/I/51qL6eqvj9L._AC_UL320_.jpg,https://m.media-amazon.com/images/I/51qL6eqvj9L._AC_UL320_.jpg,,,,,,,,,,,https://www.amazon.eg/dp/B0FWRWWDFL,2026-03-28T13:32:31.058080
amazon,B0F9FRGTRC,2Pcs Smooth Surface Hand Jingle Bells Rainbow Style Wooden Hand Bells Easy Grip Wood Handle Jingle Bells Instrument for School Band Performances,,Musical Instruments,EGP 149.00,,,4.5,,,,,,,https://m.media-amazon.com/images/I/61UX09qlZkL._AC_UL320_.jpg,https://m.media-amazon.com/images/I/61UX09qlZkL._AC_UL320_.jpg,,,,,,,,,,,https://www.amazon.eg/dp/B0F9FRGTRC,2026-03-28T13:32:31.058577
amazon,B0GQJGX8BG,"Kids Electronic Piano with Microphone, Colorful Light Music Keyboard, Musical Instrument",,Musical Instruments,EGP 540.00,,,,,,,,,,https://m.media-amazon.com/images/I/51qm1tt5SXL._AC_UL320_.jpg,https://m.media-amazon.com/images/I/51qm1tt5SXL._AC_UL320_.jpg,,,,,,,,,,,https://www.amazon.eg/dp/B0GQJGX8BG,2026-03-28T13:32:31.059047
amazon,B09SDHJBGG,MT Ramadan Toy Drum,,Musical Instruments,EGP 26.00,,,4.1,,,,,,,https://m.media-amazon.com/images/I/613NKXzRrYL._AC_UL320_.jpg,https://m.media-amazon.com/images/I/613NKXzRrYL._AC_UL320_.jpg,,,,,,,,,,,https://www.amazon.eg/dp/B09SDHJBGG,2026-03-28T13:32:31.059555
amazon,B0DHXXFKG3,MySouq.co Store Harmonica for Musical Instrument for Beginners with 10 Hole Diatonic Mouth Organ Set with Storage Box Music Boxes 11Cm Long (Silver),,Musical Instruments,EGP 745.99,,,4.6,,,,,,,https://m.media-amazon.com/images/I/51oqmfXRbhL._AC_UL320_.jpg,https://m.media-amazon.com/images/I/51oqmfXRbhL._AC_UL320_.jpg,,,,,,,,,,,https://www.amazon.eg/dp/B0DHXXFKG3,2026-03-28T13:32:31.060077
amazon,B0GH16FQ5N,"Kids Jazz Drum Set, Musical Instrument Drums, with Chair, Rock Festival 5 Pieces, Multicolor",,Musical Instruments,EGP 640.00,,,,,,,,,,https://m.media-amazon.com/images/I/61HPKxHyS9L._AC_UL320_.jpg,https://m.media-amazon.com/images/I/61HPKxHyS9L._AC_UL320_.jpg,,,,,,,,,,,https://www.amazon.eg/dp/B0GH16FQ5N,2026-03-28T13:32:31.060521
amazon,B09CZCNHT6,A to Z WOODEN XYLOPHONE,,Musical Instruments,EGP 83.48,EGP 93.48,,4.1,List:,,,,,,https://m.media-amazon.com/images/I/815YwiKncwL._AC_UL320_.jpg,https://m.media-amazon.com/images/I/815YwiKncwL._AC_UL320_.jpg,,,,,,,,,,,https://www.amazon.eg/dp/B09CZCNHT6,2026-03-28T13:32:31.061164
amazon,B091CF5JSH,Tabla with Soft Case and All Accessories,,Musical Instruments,,,,2.9,,,,,,,https://m.media-amazon.com/images/I/61mpmBLdDSL._AC_UL320_.jpg,https://m.media-amazon.com/images/I/61mpmBLdDSL._AC_UL320_.jpg,,,,,,,,,,,https://www.amazon.eg/dp/B091CF5JSH,2026-03-28T13:32:31.061923
amazon,B093QKM8ZJ,Mxzzand Bb Key Clarinet Professional Student Musical Instrument for Clarinet Beginners (Black),,Musical Instruments,"EGP 9,999.00",,,4.3,,,,,,,https://m.media-amazon.com/images/I/71nhpu9pN8L._AC_UL320_.jpg,https://m.media-amazon.com/images/I/71nhpu9pN8L._AC_UL320_.jpg,,,,,,,,,,,https://www.amazon.eg/dp/B093QKM8ZJ,2026-03-28T13:32:31.062458
amazon,B08YNRZ4D1,Piano wooden instrument for children 8 notes xylophone kids toys,,Musical Instruments,,,,4.1,,,,,,,https://m.media-amazon.com/images/I/61meWGMRY1L._AC_UL320_.jpg,https://m.media-amazon.com/images/I/61meWGMRY1L._AC_UL320_.jpg,,,,,,,,,,,https://www.amazon.eg/dp/B08YNRZ4D1,2026-03-28T13:32:31.062988
amazon,B0DBKV7JRN,Classic Handmade Percussion Instruments Wooden Frog 2.3-2.5 Inch Wooden Frog Musical Instrument (Dark Brown),,Musical Instruments,EGP 999.00,,,4.6,,,,,,,https://m.media-amazon.com/images/I/51firlIFYHL._AC_UL320_.jpg,https://m.media-amazon.com/images/I/51firlIFYHL._AC_UL320_.jpg,,,,,,,,,,,https://www.amazon.eg/dp/B0DBKV7JRN,2026-03-28T13:32:31.063509
amazon,B0GKY9K6XW,"2-in-1 Musical Xylophone and Piano Toy, Colorful Keys with 8 Notes, Includes Hammers and Music Scores, Educational Instrument for Kids (Blue)",,Musical Instruments,EGP 129.00,EGP 145.00,,2.5,Was:,,,,,,https://m.media-amazon.com/images/I/61PAOKaAkxL._AC_UL320_.jpg,https://m.media-amazon.com/images/I/61PAOKaAkxL._AC_UL320_.jpg,,,,,,,,,,,https://www.amazon.eg/dp/B0GKY9K6XW,2026-03-28T13:32:31.064137
amazon,B082MTNX83,Unistar LP6110E Oriental Keyboard,,Musical Instruments,"EGP 7,999.00",,,5.0,,,,,,,https://m.media-amazon.com/images/I/71hEY4W8qPL._AC_UL320_.jpg,https://m.media-amazon.com/images/I/71hEY4W8qPL._AC_UL320_.jpg,,,,,,,,,,,https://www.amazon.eg/dp/B082MTNX83,2026-03-28T13:32:31.064654
amazon,B0GQPYYTV6,Ukulele Musical Instrument for Kids,,Musical Instruments,EGP 475.00,,,,,,,,,,https://m.media-amazon.com/images/I/514JnBVUgdL._AC_UL320_.jpg,https://m.media-amazon.com/images/I/514JnBVUgdL._AC_UL320_.jpg,,,,,,,,,,,https://www.amazon.eg/dp/B0GQPYYTV6,2026-03-28T13:32:31.065135
amazon,B0DV9BYHVC,"4 Pack Hand Sleigh Bells，Rainbow Jingle Bells Instrument Wooden Hand Bells,Sturdy Loud Ringing,Jingle Bells for Kids,Adults （Red,Yellow,Green,Blue）",,Musical Instruments,EGP 279.00,,,,,,,,,,https://m.media-amazon.com/images/I/615RmcaL0nL._AC_UL320_.jpg,https://m.media-amazon.com/images/I/615RmcaL0nL._AC_UL320_.jpg,,,,,,,,,,,https://www.amazon.eg/dp/B0DV9BYHVC,2026-03-28T13:32:31.065588
amazon,B07PWXYKSM,Piano Keys 32 Melodica Piano Keyboard Harmonica Musical Instrument with Carry Bag Black,,Musical Instruments,,,,4.2,,,,,,,https://m.media-amazon.com/images/I/61DxFcf8GCL._AC_UL320_.jpg,https://m.media-amazon.com/images/I/61DxFcf8GCL._AC_UL320_.jpg,,,,,,,,,,,https://www.amazon.eg/dp/B07PWXYKSM,2026-03-28T13:32:31.066093
amazon,B09HCGCPNP,"Yamaha Psr F52 Keyboard, Black",,Musical Instruments,"EGP 7,700.00",,,4.0,,,,,,,https://m.media-amazon.com/images/I/61ZTXzfMP7L._AC_UL320_.jpg,https://m.media-amazon.com/images/I/61ZTXzfMP7L._AC_UL320_.jpg,,,,,,,,,,,https://www.amazon.eg/dp/B09HCGCPNP,2026-03-28T13:32:31.066598
amazon,B08ZKJ41RD,"Musfunny Tambourine Double Row Metal Jingles Hand Held Percussion Half-Moon Tambourines Musical Instrument Gifts for Kids, Adults, Party - Black",,Musical Instruments,EGP 499.00,,,4.6,,,,,,,https://m.media-amazon.com/images/I/71FmRhNe2yS._AC_UL320_.jpg,https://m.media-amazon.com/images/I/71FmRhNe2yS._AC_UL320_.jpg,,,,,,,,,,,https://www.amazon.eg/dp/B08ZKJ41RD,2026-03-28T13:32:31.067148
amazon,B0BFX54DBP,"Baby Music Toy, Early Educational Toy, Musical Instruments for Children, Baby Toy for Toddlers and Babies, Piano and Drum Music Toys for 1 Year +",,Musical Instruments,EGP 513.00,,,3.5,,,,,,,https://m.media-amazon.com/images/I/61rs409fCqL._AC_UL320_.jpg,https://m.media-amazon.com/images/I/61rs409fCqL._AC_UL320_.jpg,,,,,,,,,,,https://www.amazon.eg/dp/B0BFX54DBP,2026-03-28T13:32:31.067660
amazon,B099D9LX43,The X Files Movie - DVD,,Movies & TV,,,,3.5,,,,,,,https://m.media-amazon.com/images/I/41ygUrlvilS._AC_UY218_.jpg,https://m.media-amazon.com/images/I/41ygUrlvilS._AC_UY218_.jpg,,,,,,,,,,,https://www.amazon.eg/dp/B099D9LX43,2026-03-28T13:32:10.519594
amazon,B0050N0UR0,DOC MARTIN: THE MOVIES,,Movies & TV,,,,4.6,,,,,,,https://m.media-amazon.com/images/I/917ejrcoAyL._AC_UY218_.jpg,https://m.media-amazon.com/images/I/917ejrcoAyL._AC_UY218_.jpg,,,,,,,,,,,https://www.amazon.eg/dp/B0050N0UR0,2026-03-28T13:32:10.520160
amazon,B006ZL1PCK,8-Movie Spaghetti Western Collection,,Movies & TV,,,,3.6,,,,,,,https://m.media-amazon.com/images/I/91tV2-92tGL._AC_UY218_.jpg,https://m.media-amazon.com/images/I/91tV2-92tGL._AC_UY218_.jpg,,,,,,,,,,,https://www.amazon.eg/dp/B006ZL1PCK,2026-03-28T13:32:10.520747
amazon,B0013IJ2DE,Silly Movie 2.0: - Keine Info -,,Movies & TV,,,,3.5,,,,,,,https://m.media-amazon.com/images/I/51b738fReiL._AC_UY218_.jpg,https://m.media-amazon.com/images/I/51b738fReiL._AC_UY218_.jpg,,,,,,,,,,,https://www.amazon.eg/dp/B0013IJ2DE,2026-03-28T13:32:10.521233
amazon,B08WF2T9NJ,Mom Complete TV Series DVD Season 1-7,,Movies & TV,,,,4.1,,,,,,,https://m.media-amazon.com/images/I/61EDHPkR4yL._AC_UY218_.jpg,https://m.media-amazon.com/images/I/61EDHPkR4yL._AC_UY218_.jpg,,,,,,,,,,,https://www.amazon.eg/dp/B08WF2T9NJ,2026-03-28T13:32:10.521783
amazon,B00095VKCI,E1 ENTERTAINMENT URUSEI YATSURA TV 30,,Movies & TV,,,,5.0,,,,,,,https://m.media-amazon.com/images/I/51FQH81JMXL._AC_UY218_.jpg,https://m.media-amazon.com/images/I/51FQH81JMXL._AC_UY218_.jpg,,,,,,,,,,,https://www.amazon.eg/dp/B00095VKCI,2026-03-28T13:32:10.522213
amazon,B000WGYMD8,NEW Simpsons The Movie - Simpsons The Movie (Blu-ray),,Movies & TV,,,,4.6,,,,,,,https://m.media-amazon.com/images/I/81WwBV9N0CL._AC_UY218_.jpg,https://m.media-amazon.com/images/I/81WwBV9N0CL._AC_UY218_.jpg,,,,,,,,,,,https://www.amazon.eg/dp/B000WGYMD8,2026-03-28T13:32:10.522676
amazon,B001US0OU2,Dr. Dolittle 5 (d-t-v),,Movies & TV,,,,4.8,,,,,,,https://m.media-amazon.com/images/I/91IMlnyGxjL._AC_UY218_.jpg,https://m.media-amazon.com/images/I/91IMlnyGxjL._AC_UY218_.jpg,,,,,,,,,,,https://www.amazon.eg/dp/B001US0OU2,2026-03-28T13:32:10.523103
amazon,B004I1BEHU,AMOS 'n ANDY Show ALL 74 TV Shows DIGITALLY RESTORED,,Movies & TV,,,,4.4,,,,,,,https://m.media-amazon.com/images/I/51OgZVdWGCL._AC_UY218_.jpg,https://m.media-amazon.com/images/I/51OgZVdWGCL._AC_UY218_.jpg,,,,,,,,,,,https://www.amazon.eg/dp/B004I1BEHU,2026-03-28T13:32:10.523599
amazon,B0197ZVUWU,Velvet - 3ª Temporada - Audio and subtitles in Spanish,,Movies & TV,,,,3.7,,,,,,,https://m.media-amazon.com/images/I/81yIrZoklcL._AC_UY218_.jpg,https://m.media-amazon.com/images/I/81yIrZoklcL._AC_UY218_.jpg,,,,,,,,,,,https://www.amazon.eg/dp/B0197ZVUWU,2026-03-28T13:32:10.524022
amazon,B01N32H7KI,Universal Studios Fast & Furious: The Ultimate Ride Collection [Blu-Ray] 1-7,,Movies & TV,,,,4.7,,,,,,,https://m.media-amazon.com/images/I/819gklN2eAL._AC_UY218_.jpg,https://m.media-amazon.com/images/I/819gklN2eAL._AC_UY218_.jpg,,,,,,,,,,,https://www.amazon.eg/dp/B01N32H7KI,2026-03-28T13:32:10.524437
amazon,B000A345E4,Rudolph The Red-Nosed Reindeer - The Original TV Classic,,Movies & TV,,,,4.4,,,,,,,https://m.media-amazon.com/images/I/51HBX9SBTML._AC_UY218_.jpg,https://m.media-amazon.com/images/I/51HBX9SBTML._AC_UY218_.jpg,,,,,,,,,,,https://www.amazon.eg/dp/B000A345E4,2026-03-28T13:32:10.524950
amazon,B0833VRPKL,Arrow: Season 8 [Blu-ray] [2019] [2020] [Region Free],,Movies & TV,,,,4.5,,,,,,,https://m.media-amazon.com/images/I/81K+W18qVVL._AC_UY218_.jpg,https://m.media-amazon.com/images/I/81K+W18qVVL._AC_UY218_.jpg,,,,,,,,,,,https://www.amazon.eg/dp/B0833VRPKL,2026-03-28T13:32:10.525362
amazon,B000MCH3UQ,Augsburger Puppenkiste: Der Löwe ist los + Kommt ein Löwe geflogen (Doppel Edition 2 DVDs),,Movies & TV,,,,4.6,,,,,,,https://m.media-amazon.com/images/I/91c8ehbXCjL._AC_UY218_.jpg,https://m.media-amazon.com/images/I/91c8ehbXCjL._AC_UY218_.jpg,,,,,,,,,,,https://www.amazon.eg/dp/B000MCH3UQ,2026-03-28T13:32:10.525830
amazon,B010E4MN5G,The Lost World Season 1 Vol 1 (3 DVDs) (Region 2),,Movies & TV,,,,3.1,,,,,,,https://m.media-amazon.com/images/I/61Vn+Ue2c6L._AC_UY218_.jpg,https://m.media-amazon.com/images/I/61Vn+Ue2c6L._AC_UY218_.jpg,,,,,,,,,,,https://www.amazon.eg/dp/B010E4MN5G,2026-03-28T13:32:10.526240
amazon,B002R13MF0,Shark Tale DVD and Club Oscar karaoke CD,,Movies & TV,,,,3.6,,,,,,,https://m.media-amazon.com/images/I/31yP5PLY5aL._AC_UY218_.jpg,https://m.media-amazon.com/images/I/31yP5PLY5aL._AC_UY218_.jpg,,,,,,,,,,,https://www.amazon.eg/dp/B002R13MF0,2026-03-28T13:32:10.526677
amazon,B004QLX0UG,Sweet Dreams,,Movies & TV,,,,4.5,,,,,,,https://m.media-amazon.com/images/I/91YFjHuMyHL._AC_UY218_.jpg,https://m.media-amazon.com/images/I/91YFjHuMyHL._AC_UY218_.jpg,,,,,,,,,,,https://www.amazon.eg/dp/B004QLX0UG,2026-03-28T13:32:13.889307
amazon,B008BLCP0S,Veep: Season 1,,Movies & TV,,,,4.1,,,,,,,https://m.media-amazon.com/images/I/81JigvFjkoL._AC_UY218_.jpg,https://m.media-amazon.com/images/I/81JigvFjkoL._AC_UY218_.jpg,,,,,,,,,,,https://www.amazon.eg/dp/B008BLCP0S,2026-03-28T13:32:13.889841
amazon,B00A2JH3MC,The King of Queens 2nd Season DVD Brand New,,Movies & TV,,,,,,,,,,,https://m.media-amazon.com/images/I/51G-hkeE54L._AC_UY218_.jpg,https://m.media-amazon.com/images/I/51G-hkeE54L._AC_UY218_.jpg,,,,,,,,,,,https://www.amazon.eg/dp/B00A2JH3MC,2026-03-28T13:32:13.890190
amazon,B01K277DMI,The Spectacular Spider-Man (The Complete Series),,Movies & TV,,,,4.4,,,,,,,https://m.media-amazon.com/images/I/81Fchk4gJVL._AC_UY218_.jpg,https://m.media-amazon.com/images/I/81Fchk4gJVL._AC_UY218_.jpg,,,,,,,,,,,https://www.amazon.eg/dp/B01K277DMI,2026-03-28T13:32:13.890655
amazon,B00005ML6Y,The Simpsons: The Complete First Season,,Movies & TV,,,,4.6,,,,,,,https://m.media-amazon.com/images/I/81Am5ij5v2L._AC_UY218_.jpg,https://m.media-amazon.com/images/I/81Am5ij5v2L._AC_UY218_.jpg,,,,,,,,,,,https://www.amazon.eg/dp/B00005ML6Y,2026-03-28T13:32:13.891177
