platform,asin,title,brand,category,current_price,original_price,discount,rating,reviews_count,prime_eligible,amazon_choice,sponsored,main_image,product_url,scraped_at
amazon,,PENGUIN Think and Grow Rich: The Landmark Bestseller Now Revised and Updated for the 21st Century,,Books,EGP 366.71,EGP 562.00,,4.7,List:,,,,https://m.media-amazon.com/images/I/61IxJuRI39L._AC_UY218_.jpg,https://www.amazon.eg/dp/1585424331,2026-03-29T06:03:03.647218
amazon,,How to Talk to Anyone: 92 Little Tricks for Big Success in Relationships,,Books,EGP 408.37,EGP 477.50,,4.5,List:,,,,https://m.media-amazon.com/images/I/61B0Z0Buu6L._AC_UY218_.jpg,https://www.amazon.eg/dp/0722538073,2026-03-29T06:03:03.647884
amazon,,"Zero to One: Notes on Start Ups, or How to Build the Future",,Books,EGP 517.48,EGP 609.50,,4.6,List:,,,,https://m.media-amazon.com/images/I/71uAI28kJuL._AC_UY218_.jpg,https://www.amazon.eg/dp/0753555204,2026-03-29T06:03:03.648530
amazon,,Twisted Love: the TikTok sensation! Fall into a world of addictive romance...: 1,,Books,EGP 439.64,EGP 758.00,,4.6,List:,,,,https://m.media-amazon.com/images/I/71YJet75sxL._AC_UY218_.jpg,https://www.amazon.eg/dp/0349434271,2026-03-29T06:03:03.649159
amazon,,Profile Books The Concise 48 Laws Of Power,,Books,EGP 559.02,,,4.5,,,,,https://m.media-amazon.com/images/I/51K3uUsU94L._AC_UY218_.jpg,https://www.amazon.eg/dp/1861974043,2026-03-29T06:03:03.649687
amazon,,The Art of War,,Books,EGP 590.00,,,4.7,,,,,https://m.media-amazon.com/images/I/811ez0yerlL._AC_UY218_.jpg,https://www.amazon.eg/dp/1590302257,2026-03-29T06:03:03.650217
amazon,,It Ends With Us: The emotional #1 Sunday Times bestseller. Now a major film starring Blake Lively and Justin Baldoni,,Books,EGP 325.61,EGP 521.50,,4.7,List:,,,,https://m.media-amazon.com/images/I/817vqET828L._AC_UY218_.jpg,https://www.amazon.eg/dp/1471156265,2026-03-29T06:03:03.650795
amazon,,Ikigai: The Japanese secret to a long and happy life,,Books,EGP 860.64,EGP 977.26,,4.6,List:,,,,https://m.media-amazon.com/images/I/81l3rZK4lnL._AC_UY218_.jpg,https://www.amazon.eg/dp/178633089X,2026-03-29T06:03:03.651544
amazon,,The Inheritance Games: TikTok Made Me Buy It: 1,,Books,EGP 461.93,EGP 595.00,,4.7,List:,,,,https://m.media-amazon.com/images/I/91LFIMtflHL._AC_UY218_.jpg,https://www.amazon.eg/dp/0241476178,2026-03-29T06:03:03.652307
amazon,,Meditations,,Books,EGP 701.00,,,4.7,,,,,https://m.media-amazon.com/images/I/81DFDGzHZqL._AC_UY218_.jpg,https://www.amazon.eg/dp/0140449337,2026-03-29T06:03:03.652899
amazon,,"Thinking, Fast and Slow",,Books,EGP 776.00,,,4.6,,,,,https://m.media-amazon.com/images/I/71f6DceqZAL._AC_UY218_.jpg,https://www.amazon.eg/dp/0141033576,2026-03-29T06:03:03.653546
amazon,,your name.,,Books,EGP 623.68,,,4.8,,,,,https://m.media-amazon.com/images/I/814jIUGBawL._AC_UY218_.jpg,https://www.amazon.eg/dp/0316471860,2026-03-29T06:03:03.654086
amazon,,A Thousand Boy Kisses: The unforgettable love story and TikTok sensation,,Books,EGP 418.57,EGP 653.02,,4.5,List:,,,,https://m.media-amazon.com/images/I/71C3hjFzUjL._AC_UY218_.jpg,https://www.amazon.eg/dp/1405955317,2026-03-29T06:03:03.654663
amazon,,Who Moved My Cheese? - An Amazing Way To Deal with Change In Your Work and In Your Life by Spencer Johnson,,Books,EGP 300.00,,,4.7,,,,,https://m.media-amazon.com/images/I/71vfjx-h4wL._AC_UY218_.jpg,https://www.amazon.eg/dp/0091816971,2026-03-29T06:03:03.655283
amazon,,Rich Dad Poor Dad: What the Rich Teach Their Kids about Money That the Poor and Middle Class Do Not!,,Books,EGP 655.00,"EGP 1,025.00",,4.7,List:,,,,https://m.media-amazon.com/images/I/81BE7eeKzAL._AC_UY218_.jpg,https://www.amazon.eg/dp/1612681131,2026-03-29T06:03:03.655949
amazon,,A Good Girl's Guide to Murder,,Books,EGP 605.00,,,4.7,,,,,https://m.media-amazon.com/images/I/810KNXfKxNL._AC_UY218_.jpg,https://www.amazon.eg/dp/1405293187,2026-03-29T06:03:03.656510
amazon,,السودوكو- الكتاب الأول,,Books,EGP 113.44,EGP 125.00,,4.6,List:,,,,https://m.media-amazon.com/images/I/61hepbmXsCL._AC_UY218_.jpg,https://www.amazon.eg/dp/9776270921,2026-03-29T06:03:07.687055
amazon,,King of Wrath: from the bestselling author of the Twisted series: 1,,Books,EGP 530.40,EGP 980.00,,4.6,List:,,,,https://m.media-amazon.com/images/I/61LkGj5Hs5L._AC_UY218_.jpg,https://www.amazon.eg/dp/0349436320,2026-03-29T06:03:07.687647
amazon,,Think Again: The Power of Knowing What You Don't Know,,Books,EGP 704.36,EGP 866.42,,4.7,List:,,,,https://m.media-amazon.com/images/I/71LWrmZz4eL._AC_UY218_.jpg,https://www.amazon.eg/dp/0753553910,2026-03-29T06:03:07.688239
amazon,,Heaven: Shortlisted for the International Booker Prize,,Books,EGP 755.00,,,4.6,,,,,https://m.media-amazon.com/images/I/819zuQfXRKL._AC_UY218_.jpg,https://www.amazon.eg/dp/1509898255,2026-03-29T06:03:07.688770
amazon,,"Atomic Habits: Tiny Changes, Remarkable Results",,Books,EGP 852.54,"EGP 1,461.50",,4.8,List:,,,,https://m.media-amazon.com/images/I/817HaeblezL._AC_UY218_.jpg,https://www.amazon.eg/dp/1847941834,2026-03-29T06:03:07.689461
amazon,,فن الحرب - المكتبة التراثية,,Books,EGP 100.00,,,2.5,,,,,https://m.media-amazon.com/images/I/811JEBRcfjL._AC_UY218_.jpg,https://www.amazon.eg/dp/9779603549,2026-03-29T06:03:07.690033
amazon,,Ugly Love,,Books,EGP 475.00,EGP 756.50,,4.7,List:,,,,https://m.media-amazon.com/images/I/71E8VNPC1dL._AC_UY218_.jpg,https://www.amazon.eg/dp/1476753180,2026-03-29T06:03:07.690603
amazon,,قضية ست الحسن: تحقيقات نوح الألفي ج1,,Books,EGP 250.00,,,4.8,,,,,https://m.media-amazon.com/images/I/71e8LbCFc7L._AC_UY218_.jpg,https://www.amazon.eg/dp/9776743862,2026-03-29T06:03:07.691145
amazon,,"Book Set: Rich Dad Poor Dad, The Psychology of Money, Atomic Habits, Ikigai",,Books,EGP 360.00,,,5.0,,,,,https://m.media-amazon.com/images/I/51IMXFQPuNL._AC_UY218_.jpg,https://www.amazon.eg/dp/B0DGFFYLVY,2026-03-29T06:03:07.691596
amazon,,Before the Coffee Gets Cold: The heart-warming million-copy sensation from Japan,,Books,EGP 497.50,EGP 685.00,,4.4,List:,,,,https://m.media-amazon.com/images/I/71kW0ESYl5L._AC_UY218_.jpg,https://www.amazon.eg/dp/1529029589,2026-03-29T06:03:07.692190
amazon,,The Diary of a CEO: The 33 Laws of Business and Life,,Books,EGP 787.88,EGP 921.50,,4.6,List:,,,,https://m.media-amazon.com/images/I/61PIpidSThL._AC_UY218_.jpg,https://www.amazon.eg/dp/1529146518,2026-03-29T06:03:07.692935
amazon,,"Wonder: The award-winning, multi-million-copy bestselling phenomenon",,Books,EGP 440.01,EGP 556.00,,4.8,List:,,,,https://m.media-amazon.com/images/I/7195o6gMA9L._AC_UY218_.jpg,https://www.amazon.eg/dp/0552565970,2026-03-29T06:03:07.693710
amazon,,ما وراء الطبيعة - المجلد الأول,,Books,EGP 171.60,EGP 300.00,,4.7,List:,,,,https://m.media-amazon.com/images/I/517FXkca8rL._AC_UY218_.jpg,https://www.amazon.eg/dp/B09TCDZXMF,2026-03-29T06:03:07.694319
amazon,,Pachinko: The New York Times Bestseller,,Books,EGP 589.00,EGP 620.00,,4.7,List:,,,,https://m.media-amazon.com/images/I/81UnDYHMQbL._AC_UY218_.jpg,https://www.amazon.eg/dp/1838930507,2026-03-29T06:03:07.694908
amazon,,Vermilion The Power Of Positive Thinking by Norman Vincent Peale,,Books,EGP 313.63,EGP 463.00,,4.6,List:,,,,https://m.media-amazon.com/images/I/81ND4ZcIsxL._AC_UY218_.jpg,https://www.amazon.eg/dp/0091906385,2026-03-29T06:03:07.695477
amazon,,Little Women,,Books,EGP 606.77,EGP 789.00,,4.8,List:,,,,https://m.media-amazon.com/images/I/81XxP9qyfzL._AC_UY218_.jpg,https://www.amazon.eg/dp/0147514010,2026-03-29T06:03:07.696047
amazon,,The 48 Laws of Power,,Books,EGP 816.65,"EGP 1,057.90",,4.7,List:,,,,https://m.media-amazon.com/images/I/61GcH6gF0GL._AC_UY218_.jpg,https://www.amazon.eg/dp/0140280197,2026-03-29T06:03:12.316066
amazon,,دليل جدتي لقتل الأوغاد,,Books,EGP 220.00,,,4.3,,,,,https://m.media-amazon.com/images/I/61k7H0YtmZL._AC_UY218_.jpg,https://www.amazon.eg/dp/9778648069,2026-03-29T06:03:12.316623
amazon,,HarperCollins The Subtle Art of Not Giving a F*ck: A Counterintuitive Approach to Living a Good Life,,Books,"EGP 1,240.00",,,4.7,,,,,https://m.media-amazon.com/images/I/71t4GuxLCuL._AC_UY218_.jpg,https://www.amazon.eg/dp/0062641549,2026-03-29T06:03:12.317188
amazon,,One Of Us Is Lying: TikTok made me buy it: 1,,Books,EGP 706.49,,,4.6,,,,,https://m.media-amazon.com/images/I/81eBUKKZYyL._AC_UY218_.jpg,https://www.amazon.eg/dp/0141375639,2026-03-29T06:03:12.317763
amazon,,الداء والدواء الجواب الكافي لمن سأل عن الدواء الشافي ابن القيم الجوزية تهذيب النفس، ثمرات التوبة والدعاء,,Books,EGP 295.00,EGP 350.00,,5.0,List:,,,,https://m.media-amazon.com/images/I/81lXHsshGzL._AC_UY218_.jpg,https://www.amazon.eg/dp/9776354319,2026-03-29T06:03:12.318361
amazon,,Once Upon a Broken Heart: 1,,Books,EGP 492.08,EGP 607.50,,4.7,List:,,,,https://m.media-amazon.com/images/I/81S4dsWUoFL._AC_UY218_.jpg,https://www.amazon.eg/dp/1250268400,2026-03-29T06:03:12.319089
amazon,,"The Body Keeps the Score: Brain, Mind, and Body in the Healing of Trauma",,Books,EGP 980.00,,,4.8,,,,,https://m.media-amazon.com/images/I/71BCCd79xgL._AC_UY218_.jpg,https://www.amazon.eg/dp/0141978619,2026-03-29T06:03:12.319603
amazon,,The Concise Art of Seduction,,Books,EGP 598.93,EGP 786.00,,4.4,List:,,,,https://m.media-amazon.com/images/I/61+C5NBJCFL._AC_UY218_.jpg,https://www.amazon.eg/dp/1861976410,2026-03-29T06:03:12.320179
amazon,,Mindset - Updated Edition: Changing The Way You think To Fulfil Your Potential,,Books,EGP 764.92,EGP 984.00,,4.6,List:,,,,https://m.media-amazon.com/images/I/61y1U-lPl5L._AC_UY218_.jpg,https://www.amazon.eg/dp/147213995X,2026-03-29T06:03:12.320752
amazon,,Hold on to Your Kids: Why Parents Need to Matter More Than Peers by Dr Gabor Mate,,Books,EGP 434.81,EGP 726.00,,4.7,List:,,,,https://m.media-amazon.com/images/I/71bxrgHuUSL._AC_UY218_.jpg,https://www.amazon.eg/dp/178504219X,2026-03-29T06:03:12.321351
amazon,,Sense and Sensibility,,Books,EGP 171.47,,,4.4,,,,,https://m.media-amazon.com/images/I/71V1H-TquQL._AC_UY218_.jpg,https://www.amazon.eg/dp/0007350791,2026-03-29T06:03:12.321862
amazon,,Behave: The bestselling exploration of why humans behave as they do,,Books,EGP 608.99,EGP 741.50,,4.7,List:,,,,https://m.media-amazon.com/images/I/81QjFXzNjqL._AC_UY218_.jpg,https://www.amazon.eg/dp/009957506X,2026-03-29T06:03:12.322471
amazon,,"The Book Of Answers: The gift book that became an internet sensation, offering both enlightenment and entertainment",,Books,EGP 863.50,,,4.5,,,,,https://m.media-amazon.com/images/I/61wmfr7125L._AC_UY218_.jpg,https://www.amazon.eg/dp/0553813544,2026-03-29T06:03:12.322986
amazon,,Never Split the Difference - Negotiating as if Your Life Depended on It by Chris Voss,,Books,EGP 605.00,"EGP 1,360.00",,4.7,List:,,,,https://m.media-amazon.com/images/I/71HDfXUXO2L._AC_UY218_.jpg,https://www.amazon.eg/dp/1847941494,2026-03-29T06:03:12.323755
amazon,,Ego is the Enemy: The Fight to Master Our Greatest Opponent,,Books,EGP 603.64,EGP 830.00,,4.6,List:,,,,https://m.media-amazon.com/images/I/81gqdNObM7L._AC_UY218_.jpg,https://www.amazon.eg/dp/1781257027,2026-03-29T06:03:12.324332
amazon,,Unreasonable Hospitality: The Remarkable Power of Giving People More Than They Expect,,Books,EGP 967.30,"EGP 1,755.00",,4.8,List:,,,,https://m.media-amazon.com/images/I/71KOER-LUQL._AC_UY218_.jpg,https://www.amazon.eg/dp/0593418573,2026-03-29T06:03:12.324968
amazon,,Bloomsbury Harry Potter and the Philosopher's Stone,,Books,EGP 523.60,EGP 575.00,,4.8,List:,,,,https://m.media-amazon.com/images/I/81q77Q39nEL._AC_UY218_.jpg,https://www.amazon.eg/dp/1408855658,2026-03-29T06:03:15.349405
amazon,,The Let Them Theory: A Life-Changing Tool That Millions of People Can’t Stop Talking About,,Books,"EGP 2,120.00",,,4.7,,,,,https://m.media-amazon.com/images/I/911UmVYIcBL._AC_UY218_.jpg,https://www.amazon.eg/dp/1788176189,2026-03-29T06:03:15.349954
amazon,,The Little Prince: Paperback Picturebook,,Books,EGP 590.00,,,4.8,,,,,https://m.media-amazon.com/images/I/81YgzWyiUfL._AC_UY218_.jpg,https://www.amazon.eg/dp/0156012197,2026-03-29T06:03:15.350467
amazon,,When in Rome,,Books,EGP 460.00,EGP 650.00,,4.6,List:,,,,https://m.media-amazon.com/images/I/81MJeRCwTIL._AC_UY218_.jpg,https://www.amazon.eg/dp/0593500784,2026-03-29T06:03:15.351058
amazon,,Vermilion How to Win Friends and Influence People,,Books,EGP 960.40,,,4.7,,,,,https://m.media-amazon.com/images/I/71xnkJc3-yL._AC_UY218_.jpg,https://www.amazon.eg/dp/0091906814,2026-03-29T06:03:15.351559
amazon,,Matilda,,Books,EGP 515.00,,,4.8,,,,,https://m.media-amazon.com/images/I/81N9eGv-5ML._AC_UY218_.jpg,https://www.amazon.eg/dp/024155831X,2026-03-29T06:03:15.352170
amazon,,Fourth Wing: DISCOVER THE GLOBAL PHENOMENON THAT EVERYONE CAN'T STOP TALKING ABOUT!: 1,,Books,EGP 921.00,,,4.6,,,,,https://m.media-amazon.com/images/I/81cquiyLW8L._AC_UY218_.jpg,https://www.amazon.eg/dp/0349437017,2026-03-29T06:03:15.352692
amazon,,Secrets of Divine Love: A Spiritual Journey into the Heart of Islam,,Books,"EGP 1,630.00",,,4.8,,,,,https://m.media-amazon.com/images/I/71HKeDnwNEL._AC_UY218_.jpg,https://www.amazon.eg/dp/1734231203,2026-03-29T06:03:15.353207
amazon,,No More Nappies: A Potty-Training Book,,Books,EGP 394.76,EGP 643.00,,4.6,List:,,,,https://m.media-amazon.com/images/I/81fZHA1dDhL._AC_UY218_.jpg,https://www.amazon.eg/dp/1509836314,2026-03-29T06:03:15.353786
amazon,,Powerless: 1,,Books,EGP 897.05,"EGP 1,066.50",,4.6,List:,,,,https://m.media-amazon.com/images/I/81k5yQ9qkcL._AC_UY218_.jpg,https://www.amazon.eg/dp/1665954884,2026-03-29T06:03:15.354406
amazon,,Sapiens: THE MULTI-MILLION COPY BESTSELLER,,Books,EGP 980.00,"EGP 2,342.00",,4.7,List:,,,,https://m.media-amazon.com/images/I/713jIoMO3UL._AC_UY218_.jpg,https://www.amazon.eg/dp/0099590085,2026-03-29T06:03:15.355116
amazon,,Crime and Punishment,,Books,EGP 711.96,,,4.7,,,,,https://m.media-amazon.com/images/I/91KhR0dH+RL._AC_UY218_.jpg,https://www.amazon.eg/dp/0141192801,2026-03-29T06:03:15.355647
amazon,,"Oxford Essential German Dictionary: Over 100 000 words, phrases and translations. German-English / English-German",,Books,EGP 389.00,,,4.6,,,,,https://m.media-amazon.com/images/I/71IOlcP7PML._AC_UY218_.jpg,https://www.amazon.eg/dp/0199576394,2026-03-29T06:03:15.356193
amazon,,The Alchemist,,Books,EGP 520.00,EGP 534.70,,4.7,List:,,,,https://m.media-amazon.com/images/I/81t+zASRmqL._AC_UY218_.jpg,https://www.amazon.eg/dp/0062355309,2026-03-29T06:03:15.356826
amazon,,The Housemaid's Secret,,Books,EGP 823.02,,,4.7,,,,,https://m.media-amazon.com/images/I/81Xf0YFEpwL._AC_UY218_.jpg,https://www.amazon.eg/dp/0349132607,2026-03-29T06:03:15.357390
amazon,,New Harbinger Publications The Untethered Soul: Journey Beyond Yourself,,Books,EGP 938.69,"EGP 1,190.22",,4.7,List:,,,,https://m.media-amazon.com/images/I/61HtJhW6adL._AC_UY218_.jpg,https://www.amazon.eg/dp/1572245379,2026-03-29T06:03:15.357964
amazon,,"Welly 1:24 Scale Free Rolling Wheels Die Cast Mercedes-Benz G-Class Model Car, Black",,Automotive,"EGP 1,123.00","EGP 1,211.00",,5.0,List:,,,,https://m.media-amazon.com/images/I/61BPxw4R16L._AC_UL320_.jpg,https://www.amazon.eg/dp/B0DHZQ4W2Z,2026-03-29T06:03:03.422615
amazon,,"Cleaning Gel for Car, Car Cleaning Kit Universal Detailing Automotive Dust Car Crevice Cleaner Auto Air Vent Interior Detail Removal Putty Cleaning Keyboard Cleaner for Car Vents, PC, Laptops, Cameras",,Automotive,EGP 20.53,,,1.8,,,,,https://m.media-amazon.com/images/I/61tP89TQCcL._AC_UL320_.jpg,https://www.amazon.eg/dp/B0BP76GLJQ,2026-03-29T06:03:03.423240
amazon,,"NC Car Windshield Sun Shade Foldable car Sun Umbrella,Blocks UV Rays Sun Visor for car[48 25.6 inches (122 * 65 cm)] Fit Most Vehicle",,Automotive,EGP 111.00,EGP 174.99,,3.5,List:,,,,https://m.media-amazon.com/images/I/41gto9vM37L._AC_UL320_.jpg,https://www.amazon.eg/dp/B09V27R871,2026-03-29T06:03:03.423975
amazon,,"Car Trash Can with Lid, Accmor Mini Vehicle Trash Bin Car Dustbin Garbage Organizer Storage 2 Packs, Automotive Garbage Can Bin Trash Container for Cars, Home, Office",,Automotive,EGP 125.00,EGP 152.05,,3.2,Was:,,,,https://m.media-amazon.com/images/I/51qm9NyY9pL._AC_UL320_.jpg,https://www.amazon.eg/dp/B08X77LN3G,2026-03-29T06:03:03.424650
amazon,,A1+ Shades Automotive Car Windshield Sunshade Car Sunshade Front Window Car Sun Shade Car Windshield Shade Truck Sun Shade for Windshield Suvs Minivan (Small),,Automotive,EGP 121.00,,,4.3,,,,,https://m.media-amazon.com/images/I/711dYrMKcrL._AC_UL320_.jpg,https://www.amazon.eg/dp/B07HZ2DN8Z,2026-03-29T06:03:03.425202
amazon,,KESAV 5D Carbon Fiber Vinyl Car Wrap Sheet Roll Film Car stickers and Decals Motorcycle Car Styling Accessories Automobiles,,Automotive,EGP 106.88,,,4.1,,,,,https://m.media-amazon.com/images/I/61JSPombYHL._AC_UL320_.jpg,https://www.amazon.eg/dp/B097DQ5466,2026-03-29T06:03:03.425733
amazon,,"2Pcs Blind Spot Car Mirror, Automotive Side Blindspot Mirror for Car, 2.2"" Round Car Rearview Mirror Accessories 360 Degree Rotating with Vacuum Suction Cup for Cars, Suv, Van and Trucks",,Automotive,EGP 79.00,EGP 91.00,,2.9,List:,,,,https://m.media-amazon.com/images/I/51X2SJiOsFL._AC_UL320_.jpg,https://www.amazon.eg/dp/B0C4TDQR86,2026-03-29T06:03:03.426386
amazon,,"Welly 1:24 Scale Volkswagen Beetle Hard Top Diecast Model Car, Red",,Automotive,"EGP 1,345.00",,,,,,,,https://m.media-amazon.com/images/I/41jf8GLNLwL._AC_UL320_.jpg,https://www.amazon.eg/dp/B01D98109O,2026-03-29T06:03:03.426869
amazon,,"Hot Wheels National Icons, Silver Series, '87 Porsche 911 R, Red Die-Cast Collector Chase Car JBY91",,Automotive,EGP 600.00,,,5.0,,,,,https://m.media-amazon.com/images/I/615OcbjsT6L._AC_UL320_.jpg,https://www.amazon.eg/dp/B0DR3SLNQJ,2026-03-29T06:03:03.427438
amazon,,Hot Wheels - Gordon Murray Automotive T.50s - HW Exotics 3/5 - JBB14 - Short Card - Turquoise - Mattel 2025-1:64,,Automotive,EGP 490.00,,,4.5,,,,,https://m.media-amazon.com/images/I/71DcxXZ1RiL._AC_UL320_.jpg,https://www.amazon.eg/dp/B0FFCQDYV2,2026-03-29T06:03:03.427965
amazon,,"Cleaning gel for car, car cleaning kit universal detailing automotive dust car crevice cleaner auto air vent interior detail removal putty cleaning keyboard cleaner for car vents, pc, laptops, cameras",,Automotive,EGP 62.94,,,2.4,,,,,https://m.media-amazon.com/images/I/71YLxhnPUxL._AC_UL320_.jpg,https://www.amazon.eg/dp/B081T7N948,2026-03-29T06:03:03.428545
amazon,,"2PCS Car Interior Detailing Brush, Auto Car Detailing Brush Dusting Brush, Soft Bristles Car Interior Cleaning Tool for Dashboard Interior, Exterior, Skylight, Leather, Dust Brush Without Cap",,Automotive,EGP 64.00,EGP 80.00,,3.5,List:,,,,https://m.media-amazon.com/images/I/61b14ZGFlDL._AC_UL320_.jpg,https://www.amazon.eg/dp/B0CXPDG6KV,2026-03-29T06:03:03.429276
amazon,,"JUSTTOP Car Cleaning Gel Detailing Putty,Automotive Interior Cleaning Slime,Car Vent Cleaning Kit for Car and Keyboard,Putty Cleaning Car Accessories Blue",,Automotive,EGP 30.00,EGP 40.00,,3.9,List:,,,,https://m.media-amazon.com/images/I/81D+5Ht31uL._AC_UL320_.jpg,https://www.amazon.eg/dp/B0DL9T1G1Y,2026-03-29T06:03:03.429886
amazon,,"Anker USB C Car Charger, 40W 2-Port PowerIQ 3.0 Type C Car Adapter, PowerDrive III Duo with Power Delivery for iPhone 14 13 12 11 X XS Pro Max mini, Galaxy S22/S20/S10, Pixel, iPad/iPad mini, and More",,Automotive,EGP 533.69,,,4.7,,,,,https://m.media-amazon.com/images/I/61POG9nvHuL._AC_UL320_.jpg,https://www.amazon.eg/dp/B0843SCLYH,2026-03-29T06:03:03.430516
amazon,,"Car Trash Can with Lid,ShowTop Mini Vehicle Trash Bin Car Dustbin Garbage Organizer Storage 2 Packs,Automotive Garbage Can Bin Trash Container for Cars,Home,Office",,Automotive,EGP 143.00,EGP 150.00,,3.8,Was:,,,,https://m.media-amazon.com/images/I/51N3PnE7JfS._AC_UL320_.jpg,https://www.amazon.eg/dp/B0989WJ9L2,2026-03-29T06:03:03.431203
amazon,,2x16 LED Car Strip Crystal Style DRL Daytime Running Turn Signal Moving Indicators Light for Automotive Retrofit Led Tubelight,,Automotive,EGP 384.26,,,4.2,,,,,https://m.media-amazon.com/images/I/61KRo+STrML._AC_UL320_.jpg,https://www.amazon.eg/dp/B0BZJ1XFHQ,2026-03-29T06:03:03.431720
amazon,,Six Speed Manual Transmission Shift Gear Box Fidget Toy Automotive Part Car Keychain Key Ring Key Chain Ring Keyrings Ideal for Car and Motorbike Multicolour,,Automotive,EGP 150.00,,,3.4,,,,,https://m.media-amazon.com/images/I/41moO0bHjSL._AC_UL320_.jpg,https://www.amazon.eg/dp/B0CZP1BQZF,2026-03-29T06:03:03.432291
amazon,,"Mandark Car Center Console Armrest Pillow, Leather Memory Foam Auto Arm Rest Box Cover with Storage Bag, Waterproof Automotive Interior Elbow Protector Accessories, Universal Fit (Black)",,Automotive,EGP 286.00,,,3.7,,,,,https://m.media-amazon.com/images/I/61Iy-EEXVfL._AC_UL320_.jpg,https://www.amazon.eg/dp/B0F2SXRJCZ,2026-03-29T06:03:03.432847
amazon,,"Car Foam Drill 3-Inch Buffing Pad, 11 Pcs Polishing Pads Kit, Car Buffer Polisher Kit Drill Buffing Kit for Car Polishing, Waxing, Sealing Glaze",,Automotive,EGP 147.89,EGP 158.97,Save 7%,4.1,Was:,,,,https://m.media-amazon.com/images/I/71EncVQ7-pL._AC_UL320_.jpg,https://www.amazon.eg/dp/B08LSN8MT8,2026-03-29T06:03:03.433532
amazon,,A1 Shades Car windshield sunshade with storage pouch by a1 sun shade foldable automotive car truck suv front window shield blocker visor protector cover for interior accessories for heat large,,Automotive,EGP 145.00,,,3.4,,,,,https://m.media-amazon.com/images/I/711dYrMKcrL._AC_UL320_.jpg,https://www.amazon.eg/dp/B073XR5M92,2026-03-29T06:03:03.434137
amazon,,"SHAPERME Plastic Restorer for Cars, Automotive Interior Plastic Part Ceramic Coating with Sponge and Nozzle, Resists Water, UV Rays, Dirt",,Automotive,EGP 115.00,EGP 120.00,,2.6,Was:,,,,https://m.media-amazon.com/images/I/61fVOoM8HjL._AC_UL320_.jpg,https://www.amazon.eg/dp/B0CJHRYTMR,2026-03-29T06:03:03.434746
amazon,,"cobee Car Interior Cleaning Soft Brush - No Scratch, 2 Pack Car Cleaning Brushes Duster with Soft Bristles Dashboard Air Outlet Gap Dust Removal Brushes for Automotive Air Conditioner Vents(Black)",,Automotive,EGP 125.70,,,4.4,,,,,https://m.media-amazon.com/images/I/61G6btgyWEL._AC_UL320_.jpg,https://www.amazon.eg/dp/B0BNBXHWCF,2026-03-29T06:03:03.435360
amazon,,"Automotive Oil Film Cleaning Brush,Glass Cleaning Board,120ml Oil Film Cleaner for Window Remove Dirt Improve Clarity and Visibility, Enhance Visual Effect of Automotive Windshield",,Automotive,EGP 44.00,EGP 89.99,,3.2,List:,,,,https://m.media-amazon.com/images/I/71FRkA6vmEL._AC_UL320_.jpg,https://www.amazon.eg/dp/B0DCBD2BS6,2026-03-29T06:03:03.436020
amazon,,"fashion mania Portable Ash Tray for Car, Car Ashtray with Lid-late model Car door Automotive Ashtray, Smokeless Ashtray, Mini Car Trash Can, Detachable aluminum alloy Smokeless Ash Tray (Black)",,Automotive,EGP 666.00,,,3.8,,,,,https://m.media-amazon.com/images/I/61SqbxmZxEL._AC_UL320_.jpg,https://www.amazon.eg/dp/B0D8Y7RW8W,2026-03-29T06:03:03.436605
amazon,,"Upgrade Automotive Oil Film Cleaning Brush, Car Glass Oil Film Cleaner, Car Windshield Oil Film Cleaner, Windshield Coating Enhances Cleaner Tool, Glass Oil Film Remover Prevents Rain And Fog",,Automotive,EGP 42.00,,,2.8,,,,,https://m.media-amazon.com/images/I/71xeIv2NaAL._AC_UL320_.jpg,https://www.amazon.eg/dp/B0DGQR52QX,2026-03-29T06:03:08.230758
amazon,,Generic Car mats with high edges 5 pieces materials for all kinds of cars black color,,Automotive,EGP 301.97,EGP 320.00,,3.7,List:,,,,https://m.media-amazon.com/images/I/613inMZgmAL._AC_UL320_.jpg,https://www.amazon.eg/dp/B08YNM3DNJ,2026-03-29T06:03:08.231489
amazon,,"AUCELI Car Interior Detailing Brush, Clean Soft Bristle Scratch Free Automotive Dashboard Air Conditioner Vents Computer Removal Tool, Curved Dirt Dust Collectors, Universal for Cars（Double Brown）",,Automotive,EGP 77.00,,,4.5,,,,,https://m.media-amazon.com/images/I/617fpz6PUWL._AC_UL320_.jpg,https://www.amazon.eg/dp/B0CQ4D2CD3,2026-03-29T06:03:08.232031
amazon,,"MaxLax Bright Red El Wire with 6mm Sewing Edge, 3m neon Wire 12V with Fuse Protection for Automotive Car Interior Decoration",,Automotive,EGP 107.00,,,3.9,,,,,https://m.media-amazon.com/images/I/61IjzX1jpcL._AC_UL320_.jpg,https://www.amazon.eg/dp/B08L657GTN,2026-03-29T06:03:08.232651
amazon,,"Super Drive Superdrive 800Amp Jumper Cables for Car Battery, Heavy Duty Automotive Booster Cables for Jump Starting Dead or Weak Batteries with Carrying Blue Plastic Box Included",,Automotive,EGP 567.00,,,4.2,,,,,https://m.media-amazon.com/images/I/618y5u7MpZL._AC_UL320_.jpg,https://www.amazon.eg/dp/B0B1L63MP8,2026-03-29T06:03:08.233292
amazon,,2024 Crystal Coating for Automotive Plastics - Restore Car Plastic Parts (1 Pcs),,Automotive,EGP 60.00,EGP 85.00,,2.6,Was:,,,,https://m.media-amazon.com/images/I/61-j4A3+uIL._AC_UL320_.jpg,https://www.amazon.eg/dp/B0D41PD4HR,2026-03-29T06:03:08.233890
amazon,,"X XINDELL Windshield Cleaning Tool, 22inch Interior Car Window Cleaner Detailing Kit, Glass Wipes Washer Windshield Fluid Wiper Automotive Exterior Accessories-Includes 3 Microfiber Cloths (Square)",,Automotive,EGP 225.00,,,4.3,,,,,https://m.media-amazon.com/images/I/61sm7xtqmmL._AC_UL320_.jpg,https://www.amazon.eg/dp/B08YXR2CFZ,2026-03-29T06:03:08.234439
amazon,,"QUEST Car Trash Can with Lid Mini Vehicle Garbage Bin, Automotive Dustbin Organizer for Car Cup Holder, Compact Waste Container for Cars, Home & Office",,Automotive,EGP 139.64,,,,,,,,https://m.media-amazon.com/images/I/51gU0v8ryCL._AC_UL320_.jpg,https://www.amazon.eg/dp/B0GP1PTDBQ,2026-03-29T06:03:08.234907
amazon,,"2Pcs Car Plastic Plating Refurbishing Agent, Car Plastic Plating Refurbishing Agent, Crystal Coating for Cars Plastics Parts, Nano Coating Agent for DIY, Automotive(30ml*2)",,Automotive,EGP 182.00,EGP 191.00,,3.9,Was:,,,,https://m.media-amazon.com/images/I/71Q6LSjmZSL._AC_UL320_.jpg,https://www.amazon.eg/dp/B0F3WY433Y,2026-03-29T06:03:08.235553
