platform,asin,title,brand,category,current_price,original_price,discount,rating,reviews_count,prime_eligible,amazon_choice,sponsored,main_image,product_url,scraped_at
amazon,,"Dimple Kids Drum Set for Toddlers, with Adjustable Microphone, Lights, Stool, Drumsticks, Fun Sounds and 5 Songs, Electronic Musical Instrument Toy, Birthday Gift for 3-9 Year Old Girls and Boys",,Musical Instruments,"EGP 3,556.00",,,4.6,,,,,https://m.media-amazon.com/images/I/71NslLd292L._AC_UL320_.jpg,https://www.amazon.eg/dp/B09JWS5GF7,2026-03-29T06:02:56.878659
amazon,,Generic Animal Sounds & Sounds - Colorful Cute Baby Piano Toy - Modern Edition,,Musical Instruments,EGP 296.20,,,4.1,,,,,https://m.media-amazon.com/images/I/71wpbqIXfUL._AC_UL320_.jpg,https://www.amazon.eg/dp/B09LPCJPXL,2026-03-29T06:02:56.879182
amazon,,Musical Guitar Toy for Kids with Sound Effects (Red),,Musical Instruments,EGP 338.00,,,,,,,,https://m.media-amazon.com/images/I/51seZJVOp5L._AC_UL320_.jpg,https://www.amazon.eg/dp/B0DZHN15M6,2026-03-29T06:02:56.879656
amazon,,"Pssopp Cello Shape Musicial Box, Music Box Musical Instrument Model with Rotating Base for Home Decoration Ornament",,Musical Instruments,EGP 290.00,,,,,,,,https://m.media-amazon.com/images/I/61trKvailsL._AC_UL320_.jpg,https://www.amazon.eg/dp/B08PPF6476,2026-03-29T06:02:56.880126
amazon,,Wooden Marching Snare Drum Tabla Trombeta Band Percussion Instrument Concert Percussion with 2x 40cm Plastic Drumheads for Bands Scouts Schools Parades Matches (with Drumsticks),,Musical Instruments,"EGP 1,099.00",,,,,,,,https://m.media-amazon.com/images/I/71F51crMUqL._AC_UL320_.jpg,https://www.amazon.eg/dp/B0G1RF88RJ,2026-03-29T06:02:56.880588
amazon,,"Xylophone, Xylophone for Children, Baby Xylophone, Wooden Xylophone, Wooden Xylophone Music, Baby Musical Instrument, Educational Musical Instruments, with 2 Mallets, with Cleaning Cloth",,Musical Instruments,EGP 120.00,,,,,,,,https://m.media-amazon.com/images/I/61cZC7Zim+L._AC_UL320_.jpg,https://www.amazon.eg/dp/B0C7ZN9WLC,2026-03-29T06:02:56.881043
amazon,,"A musical instrument for children - Give your child a durable instrument with soft strings and easy-to-use features, along with a simplified guide that turns practice into a creative journey.",,Musical Instruments,EGP 499.00,,,,,,,,https://m.media-amazon.com/images/I/71Hlx0XpCWL._AC_UL320_.jpg,https://www.amazon.eg/dp/B0GF9YCQTZ,2026-03-29T06:02:56.881471
amazon,,musical instrument,,Musical Instruments,EGP 325.00,,,2.0,,,,,https://m.media-amazon.com/images/I/71A6Cbx9DEL._AC_UL320_.jpg,https://www.amazon.eg/dp/B09FTK6Q4V,2026-03-29T06:02:56.882026
amazon,,Yamaha FUAUFAS PSR-F52 61 Keys Portable Keyboard With Bajaao Keyboard Bag,,Musical Instruments,"EGP 8,799.00",,,4.1,,,,,https://m.media-amazon.com/images/I/61mkiYue++L._AC_UL320_.jpg,https://www.amazon.eg/dp/B09P1H2DCB,2026-03-29T06:02:56.882567
amazon,,"Mattel Fisher-Price Wooden Xylophone, Musical Instrument Toy For Toddlers, 2 Wood Pieces",,Musical Instruments,"EGP 1,115.00","EGP 1,250.00",,4.6,List:,,,,https://m.media-amazon.com/images/I/71BUx1jIdYL._AC_UL320_.jpg,https://www.amazon.eg/dp/B0CMFL2D8M,2026-03-29T06:02:56.883195
amazon,,Colorful wooden riq tambourine with metal jingles & plastic head - multicolour,,Musical Instruments,"EGP 1,200.00",,,,,,,,https://m.media-amazon.com/images/I/51PbgWfdqOL._AC_UL320_.jpg,https://www.amazon.eg/dp/B0FKQPPJ2H,2026-03-29T06:02:56.883677
amazon,,"PHOENIX Violin 4/4 Full Size Kit, Violin Fiddle Set for Beginner Adults with Rosewood Bow Extra Strings & Bridge (Entry-level, Full)",,Musical Instruments,"EGP 4,199.00","EGP 5,500.00",Save 24%,4.1,Was:,,,,https://m.media-amazon.com/images/I/71cvyzUdHBL._AC_UL320_.jpg,https://www.amazon.eg/dp/B0CTJCHZ76,2026-03-29T06:02:56.884290
amazon,,Musical Drum and Guitar Set,,Musical Instruments,EGP 520.00,,,3.0,,,,,https://m.media-amazon.com/images/I/71DyN+9kkhL._AC_UL320_.jpg,https://www.amazon.eg/dp/B0968YZK74,2026-03-29T06:02:56.884813
amazon,,White Piano Music Box With Ballerina Girl On The Piano Musical Toy Dancing,,Musical Instruments,EGP 245.00,EGP 481.00,,3.1,List:,,,,https://m.media-amazon.com/images/I/61FKsqBNncL._AC_UL320_.jpg,https://www.amazon.eg/dp/B091CQ871P,2026-03-29T06:02:56.885400
amazon,,"TOYS LAND Musical Electronic Piano Keyboard, 22 Keys Animals Piano Toy with Sound for Early Education Interactive Games Music Toys, Best Gift for Kids Boys and Girls 3+ Years Old (Zebra)",,Musical Instruments,EGP 399.00,,,2.9,,,,,https://m.media-amazon.com/images/I/61oeRABl8XL._AC_UL320_.jpg,https://www.amazon.eg/dp/B0DFQLJ67G,2026-03-29T06:02:56.885942
