platform,asin,title,brand,category,current_price,original_price,discount,rating,reviews_count,prime_eligible,amazon_choice,sponsored,main_image,product_url,scraped_at
amazon,,EXERZ Desk Organiser/Mesh Desk Tidy/Pen Holder/Multifunctional Organizer EX348 - Black,,Office Products,EGP 450.00,,,4.7,,,,,https://m.media-amazon.com/images/I/918OicFvn7L._AC_UL320_.jpg,https://www.amazon.eg/dp/B01L9A709S,2026-03-29T06:03:05.542326
amazon,,Quattro Manager Medical Office Chair - Black Mesh,,Office Products,"EGP 1,324.99","EGP 1,794.99",,3.0,List:,,,,https://m.media-amazon.com/images/I/514blGwuaqL._AC_UL320_.jpg,https://www.amazon.eg/dp/B09238R36V,2026-03-29T06:03:05.543010
amazon,,Tanex Office Sticker 13 mm 350 Labels 5 Sheets A5 Model OFC129 fluorescent adhesive circles for easy labeling,,Office Products,EGP 27.00,,,2.0,,,,,https://m.media-amazon.com/images/I/61ZgPALNJnL._AC_UL320_.jpg,https://www.amazon.eg/dp/B0G1MXGQTL,2026-03-29T06:03:05.543524
amazon,,"Extended XXL Gaming Mouse Map Pad 35.4X15.74X0.12 Inch,HD World Map Mouse Pad,with Non-Slip Base,Waterproof and Foldable Pad,Desktop Pad Suitable for Gamers,Suitable for Desktop,Office and Home,Black",,Office Products,EGP 250.00,,,4.2,,,,,https://m.media-amazon.com/images/I/71TKqTeaZrS._AC_UL320_.jpg,https://www.amazon.eg/dp/B08X4CFB3P,2026-03-29T06:03:05.544067
amazon,,"Di Pelle™ Vertical Leather ID Badge Holder – 99% Handmade PU Leather Card Case with Clear Window – Professional ID & Access Card Protector for Office, School, and Staff Use (Havan)",,Office Products,EGP 99.00,,,4.1,,,,,https://m.media-amazon.com/images/I/51pYRXemtsL._AC_UL320_.jpg,https://www.amazon.eg/dp/B0FW6HC234,2026-03-29T06:03:05.544581
amazon,,3A Proqueen File Holder 27X10X30 CM - Beige 8311,,Office Products,EGP 99.43,,,,,,,,https://m.media-amazon.com/images/I/41LTjPpYYJL._AC_UL320_.jpg,https://www.amazon.eg/dp/B0DD7KS78Y,2026-03-29T06:03:05.545081
amazon,,3A Proqueen File Holder 27X10X30 Cm - Blue 8311,,Office Products,EGP 92.11,,,2.7,,,,,https://m.media-amazon.com/images/I/410oR3S8AaL._AC_UL320_.jpg,https://www.amazon.eg/dp/B0DD7JBF1H,2026-03-29T06:03:05.545706
amazon,,Puricon 10 Pcs Desk Drawer Organizers Trays Set Clear Plastic Storage Bins Bathroom Drawer Tray Dividers Vanity Trays Organizer for Bedroom Dresser Makeup Kitchen Utensil Office,,Office Products,EGP 269.00,,,4.0,,,,,https://m.media-amazon.com/images/I/71YMMVhE3uL._AC_UL320_.jpg,https://www.amazon.eg/dp/B088842R52,2026-03-29T06:03:05.546274
amazon,,TY-43 Bulldog Clips 19mm Colored Pack Durable Metal Design Strong Grip Ideal for Office School and Home Paper Document Organization Multicolor,,Office Products,EGP 65.85,EGP 75.00,,,List:,,,,https://m.media-amazon.com/images/I/61aMUIHm-4L._AC_UL320_.jpg,https://www.amazon.eg/dp/B0FT3Z1CH3,2026-03-29T06:03:05.546831
amazon,,"Yamaha YRS-23 Soprano Recorder Flutes, German Fingering System Key of C Plastic Soprano, Best Gift for Students and Music Fans",,Musical Instruments,EGP 369.00,EGP 448.96,,4.6,List:,,,,https://m.media-amazon.com/images/I/51lSvdUbAkL._AC_UL320_.jpg,https://www.amazon.eg/dp/B0983WX6JH,2026-03-29T06:02:51.953307
amazon,,Generic Wooden kids educational toy octave knock on the piano beat xylophone,,Musical Instruments,EGP 86.00,,,4.1,,,,,https://m.media-amazon.com/images/I/61gi1vhkvzL._AC_UL320_.jpg,https://www.amazon.eg/dp/B0968W732K,2026-03-29T06:02:51.953963
amazon,,"Harmonica, 10 Holes C Key Musical Instrument, with Black Box 10.5 * 2.3cm, for Beginners and Professionals, Double Point Stabilization System",,Musical Instruments,EGP 359.10,EGP 399.00,,2.5,List:,,,,https://m.media-amazon.com/images/I/51WrxPfKXzL._AC_UL320_.jpg,https://www.amazon.eg/dp/B0FY3FP9C2,2026-03-29T06:02:51.954622
amazon,,Flute - musical instrument,,Musical Instruments,EGP 188.00,,,4.2,,,,,https://m.media-amazon.com/images/I/41Co2G+lU5L._AC_UL320_.jpg,https://www.amazon.eg/dp/B07VXJF4FP,2026-03-29T06:02:51.955144
amazon,,Electronic keyboard 61 keys,,Musical Instruments,"EGP 1,692.90",,,3.0,,,,,https://m.media-amazon.com/images/I/717sMQOtntL._AC_UL320_.jpg,https://www.amazon.eg/dp/B0C1TMYWH2,2026-03-29T06:02:51.955688
amazon,,"Kalimba thumb piano 17 key finger piano musical instrument with study instruction and tune hammer, gift for kids, adult beginners.",,Musical Instruments,"EGP 1,099.00",,,4.6,,,,,https://m.media-amazon.com/images/I/81UwGXkBImL._AC_UL320_.jpg,https://www.amazon.eg/dp/B083DC9H5R,2026-03-29T06:02:51.956195
amazon,,Mibee 32 Piano Keys Melodica Musical Instrument for Music Lovers Beginners Gift with Carrying Bag (Blue) 20220318 0,,Musical Instruments,EGP 999.00,,,5.0,,,,,https://m.media-amazon.com/images/I/61tBsLCAoCL._AC_UL320_.jpg,https://www.amazon.eg/dp/B09VXL3MKC,2026-03-29T06:02:51.956759
amazon,,"Yamaha YRS-23Y Soprano Recorder Flute Instrument, Natural",,Musical Instruments,EGP 369.00,EGP 480.00,,4.6,List:,,,,https://m.media-amazon.com/images/I/71Ro54KOMrL._AC_UL320_.jpg,https://www.amazon.eg/dp/B0014ZG676,2026-03-29T06:02:51.957368
amazon,,Violin Kit Full Size 4/4 Vintage Solid Wood Violin for Beginner Above 11 Years With Case,,Musical Instruments,"EGP 2,499.00",,,3.0,,,,,https://m.media-amazon.com/images/I/71NftDwYiqL._AC_UL320_.jpg,https://www.amazon.eg/dp/B07PWY2G38,2026-03-29T06:02:51.957926
amazon,,Suzuki Folkmaster 1072 Standard Beginner Diatonic Blues Harmonica Gaita 10 Holes Key of C Musical Instrument,,Musical Instruments,EGP 749.00,,,4.4,,,,,https://m.media-amazon.com/images/I/6141t1V0NzL._AC_UL320_.jpg,https://www.amazon.eg/dp/B07VZP9RPS,2026-03-29T06:02:51.958454
amazon,,"4 Piece Children's Musical Instrument Jingle Tambourines,Half Moon Tambourine,Wooden Toy Instruments,Percussion Toys,Percussion Instrument for Children",,Musical Instruments,EGP 269.00,,,5.0,,,,,https://m.media-amazon.com/images/I/61I02MeW-tL._AC_UL320_.jpg,https://www.amazon.eg/dp/B0DR48R57W,2026-03-29T06:02:51.959002
amazon,,Wevez Belly Dancing Finger Zills Finger Cymbals 2 Pairs / 4 Pcs Golden,,Musical Instruments,EGP 80.00,,,4.0,,,,,https://m.media-amazon.com/images/I/71Spe6nTNGL._AC_UL320_.jpg,https://www.amazon.eg/dp/B019JY6HPY,2026-03-29T06:02:51.959547
amazon,,Electric music Piano for children with microphone- S13632,,Musical Instruments,EGP 650.00,EGP 684.00,,3.6,List:,,,,https://m.media-amazon.com/images/I/71L5U3EmkdL._AC_UL320_.jpg,https://www.amazon.eg/dp/B085PQ8C1D,2026-03-29T06:02:51.960142
amazon,,"Flexzion Tambourine Metal Half Moon Musical Instruments Double Row Metal Jingles Hand Held Instruments Percussion with Ergonomic Handle Grip, Tambourines for Adults Church, Black",,Musical Instruments,EGP 499.00,,,4.6,,,,,https://m.media-amazon.com/images/I/61EXnz7Nf8L._AC_UL320_.jpg,https://www.amazon.eg/dp/B014SCXI9U,2026-03-29T06:02:51.960722
amazon,,Foldable Xylophone Mini Marimba Glockenspiel Keyboard Percussion Instrument + Bag & Mallets - 29 Notes,,Musical Instruments,"EGP 1,200.00",,,5.0,,,,,https://m.media-amazon.com/images/I/51f4dCT0bQL._AC_UL320_.jpg,https://www.amazon.eg/dp/B0G1H4VGV5,2026-03-29T06:02:51.961239
amazon,,Musical Instrument Rabbah Handmade Instrument,,Musical Instruments,EGP 179.00,,,2.7,,,,,https://m.media-amazon.com/images/I/41WrrTGHUhL._AC_UL320_.jpg,https://www.amazon.eg/dp/B0B1JGWF7J,2026-03-29T06:02:51.961841
amazon,,"Tabla sharqia (grey, 3)",,Musical Instruments,"EGP 1,200.00",,,3.4,,,,,https://m.media-amazon.com/images/I/61g8DfGBJjL._AC_UL320_.jpg,https://www.amazon.eg/dp/B081PQVDWR,2026-03-29T06:02:51.962352
amazon,,Donner Drum Practice Pad，12 Inches Silent Practice Drum Pad 2-Sided With Drum Sticks - Gray,,Musical Instruments,"EGP 1,099.00",,,4.6,,,,,https://m.media-amazon.com/images/I/71rYpcaXNhL._AC_UL320_.jpg,https://www.amazon.eg/dp/B07JK4DGLX,2026-03-29T06:02:51.962941
amazon,,Piano wooden instrument for children 8 notes xylophone kids toys,,Musical Instruments,EGP 98.00,,,4.1,,,,,https://m.media-amazon.com/images/I/61meWGMRY1L._AC_UL320_.jpg,https://www.amazon.eg/dp/B08YNRZ4D1,2026-03-29T06:02:51.963456
amazon,,"fashion mania Mini Thumb Piano, 8 Keys, Solid Wood, Portable, Lightweight, Modern, Polished Finish, Birthday Gift, Valentines Gift, Kids Adults Beginners",,Musical Instruments,EGP 599.00,,,5.0,,,,,https://m.media-amazon.com/images/I/717mIPVX82L._AC_UL320_.jpg,https://www.amazon.eg/dp/B0CXLX8LQ7,2026-03-29T06:02:51.963994
amazon,,Aluminum Kazoo Flute Mouth Simple Humming Musical Instrument for Adults & Kids (Green),,Musical Instruments,EGP 349.00,,,,,,,,https://m.media-amazon.com/images/I/41kx2wmfnbL._AC_UL320_.jpg,https://www.amazon.eg/dp/B0FX8X4THN,2026-03-29T06:02:51.964437
amazon,,Tvoip wooden xylophone toys musical creative wooden instruments 8 notes xilofono children baby musical toys development,,Musical Instruments,EGP 89.99,,,3.9,,,,,https://m.media-amazon.com/images/I/617mjaIG1eL._AC_UL320_.jpg,https://www.amazon.eg/dp/B09DG9YK7G,2026-03-29T06:02:51.964976
amazon,,Melodica 32 Keys (13 Black Keys) Double Tubes Mouthpiece Air Piano Keyboard Musical Instrument with Carrying Bag - Black,,Musical Instruments,"EGP 1,000.00",,,3.6,,,,,https://m.media-amazon.com/images/I/51zKFR6-QaL._AC_UL320_.jpg,https://www.amazon.eg/dp/B09VXMN3CH,2026-03-29T06:02:51.965489
amazon,,"Power beat wooden radiant radiant tambourine faced duff for adults, kids, dancers, singers - white/black",,Musical Instruments,EGP 323.00,EGP 333.00,,3.3,Was:,,,,https://m.media-amazon.com/images/I/61V8B9zmk4L._AC_UL320_.jpg,https://www.amazon.eg/dp/B08Z47WSN1,2026-03-29T06:02:51.966092
amazon,,Meinl Percussion Copper Cymbal 4 Pc,,Musical Instruments,EGP 130.00,,,4.5,,,,,https://m.media-amazon.com/images/I/51KCJUQvRdL._AC_UL320_.jpg,https://www.amazon.eg/dp/B09BDMCS5L,2026-03-29T06:02:51.966630
amazon,,PAL MUSIC HOUSE 4/4 Violin Full Size with Bow Rosin Carrying Hard Case Instrument for Beginners Adults Boys Girls Children Kids,,Musical Instruments,"EGP 2,499.00","EGP 2,565.00",,3.3,Was:,,,,https://m.media-amazon.com/images/I/61Zqrn5asHL._AC_UL320_.jpg,https://www.amazon.eg/dp/B07V2M3V9D,2026-03-29T06:02:51.967218
amazon,,YONGMEI Stand&Bag Kit for 61 Keys Full Size Electronic Piano Keyboard portable Musical Instrument (Stand&Bag for Keyboard),,Musical Instruments,"EGP 1,799.00",,,4.0,,,,,https://m.media-amazon.com/images/I/51UXPLeiiGL._AC_UL320_.jpg,https://www.amazon.eg/dp/B093X59XCQ,2026-03-29T06:02:51.967763
amazon,,10 Pieces Wooden Maracas Sand Hammer Hand Hold Percussion Wooden Maracas Rattles Shaker for Children Shaker Musical Instruments Educational Learning Toy Random Colour,,Musical Instruments,EGP 999.00,,,,,,,,https://m.media-amazon.com/images/I/61AI2BQd8+L._AC_UL320_.jpg,https://www.amazon.eg/dp/B0F489ZVNM,2026-03-29T06:02:51.968262
amazon,,2Pcs Smooth Surface Hand Jingle Bells Rainbow Style Wooden Hand Bells Easy Grip Wood Handle Jingle Bells Instrument for School Band Performances,,Musical Instruments,EGP 149.00,,,4.5,,,,,https://m.media-amazon.com/images/I/61UX09qlZkL._AC_UL320_.jpg,https://www.amazon.eg/dp/B0F9FRGTRC,2026-03-29T06:02:51.968801
amazon,,Maracas Maraca Rattle Hand Shaker Rhythm Hand Percussion Band Musical Instrument - 2 Pieces,,Musical Instruments,EGP 275.00,,,3.5,,,,,https://m.media-amazon.com/images/I/51qL6eqvj9L._AC_UL320_.jpg,https://www.amazon.eg/dp/B0FWRWWDFL,2026-03-29T06:02:51.969298
amazon,,MT Ramadan Toy Drum,,Musical Instruments,EGP 26.00,,,4.1,,,,,https://m.media-amazon.com/images/I/613NKXzRrYL._AC_UL320_.jpg,https://www.amazon.eg/dp/B09SDHJBGG,2026-03-29T06:02:51.969846
amazon,,"TOYS LAND 37 Key Electronic Piano Organ Keyboard with Microphone, Portable Digital Musical Learning Instrument Toy, Ideal Birthday Gift for Boys and Girls Aged 3+",,Musical Instruments,"EGP 1,099.00",,,,,,,,https://m.media-amazon.com/images/I/711qhsbC8lL._AC_UL320_.jpg,https://www.amazon.eg/dp/B0GNL435BS,2026-03-29T06:02:51.970297
amazon,,MySouq.co Store Harmonica for Musical Instrument for Beginners with 10 Hole Diatonic Mouth Organ Set with Storage Box Music Boxes 11Cm Long (Silver),,Musical Instruments,EGP 745.99,,,4.6,,,,,https://m.media-amazon.com/images/I/51oqmfXRbhL._AC_UL320_.jpg,https://www.amazon.eg/dp/B0DHXXFKG3,2026-03-29T06:02:51.970818
amazon,,"Kids Electronic Piano with Microphone, Colorful Light Music Keyboard, Musical Instrument",,Musical Instruments,EGP 540.00,,,,,,,,https://m.media-amazon.com/images/I/51qm1tt5SXL._AC_UL320_.jpg,https://www.amazon.eg/dp/B0GQJGX8BG,2026-03-29T06:02:51.971260
amazon,,"Kids Jazz Drum Set, Musical Instrument Drums, with Chair, Rock Festival 5 Pieces, Multicolor",,Musical Instruments,EGP 640.00,,,,,,,,https://m.media-amazon.com/images/I/61HPKxHyS9L._AC_UL320_.jpg,https://www.amazon.eg/dp/B0GH16FQ5N,2026-03-29T06:02:51.971734
amazon,,A to Z WOODEN XYLOPHONE,,Musical Instruments,EGP 83.48,EGP 93.48,,4.1,List:,,,,https://m.media-amazon.com/images/I/815YwiKncwL._AC_UL320_.jpg,https://www.amazon.eg/dp/B09CZCNHT6,2026-03-29T06:02:51.972330
amazon,,Tabla with Soft Case and All Accessories,,Musical Instruments,,,,2.9,,,,,https://m.media-amazon.com/images/I/61mpmBLdDSL._AC_UL320_.jpg,https://www.amazon.eg/dp/B091CF5JSH,2026-03-29T06:02:51.973078
amazon,,Classic Handmade Percussion Instruments Wooden Frog 2.3-2.5 Inch Wooden Frog Musical Instrument (Dark Brown),,Musical Instruments,EGP 999.00,,,4.6,,,,,https://m.media-amazon.com/images/I/51firlIFYHL._AC_UL320_.jpg,https://www.amazon.eg/dp/B0DBKV7JRN,2026-03-29T06:02:51.973634
amazon,,Mxzzand Bb Key Clarinet Professional Student Musical Instrument for Clarinet Beginners (Black),,Musical Instruments,"EGP 9,999.00",,,4.3,,,,,https://m.media-amazon.com/images/I/71nhpu9pN8L._AC_UL320_.jpg,https://www.amazon.eg/dp/B093QKM8ZJ,2026-03-29T06:02:51.974168
amazon,,"CeleMoon 25 Notes Colorful Glockenspiel Xylophone for Kids, Musical Drum Percussion Instrument Educational Music Learning Gift for Children Boys Girls, Blue",,Musical Instruments,"EGP 1,499.00",,,4.2,,,,,https://m.media-amazon.com/images/I/61YscDEA5IL._AC_UL320_.jpg,https://www.amazon.eg/dp/B0CSD4NPDF,2026-03-29T06:02:51.974736
amazon,,Unistar LP6110E Oriental Keyboard,,Musical Instruments,"EGP 7,999.00",,,5.0,,,,,https://m.media-amazon.com/images/I/71hEY4W8qPL._AC_UL320_.jpg,https://www.amazon.eg/dp/B082MTNX83,2026-03-29T06:02:51.975242
amazon,,Piano Keys 32 Melodica Piano Keyboard Harmonica Musical Instrument with Carry Bag Black,,Musical Instruments,,,,4.2,,,,,https://m.media-amazon.com/images/I/61DxFcf8GCL._AC_UL320_.jpg,https://www.amazon.eg/dp/B07PWXYKSM,2026-03-29T06:02:51.975759
amazon,,"4 Pack Hand Sleigh Bells，Rainbow Jingle Bells Instrument Wooden Hand Bells,Sturdy Loud Ringing,Jingle Bells for Kids,Adults （Red,Yellow,Green,Blue）",,Musical Instruments,EGP 279.00,,,,,,,,https://m.media-amazon.com/images/I/615RmcaL0nL._AC_UL320_.jpg,https://www.amazon.eg/dp/B0DV9BYHVC,2026-03-29T06:02:51.976222
amazon,,"Musfunny Tambourine Double Row Metal Jingles Hand Held Percussion Half-Moon Tambourines Musical Instrument Gifts for Kids, Adults, Party - Black",,Musical Instruments,EGP 499.00,,,4.6,,,,,https://m.media-amazon.com/images/I/71FmRhNe2yS._AC_UL320_.jpg,https://www.amazon.eg/dp/B08ZKJ41RD,2026-03-29T06:02:51.976759
amazon,,"Yamaha Psr F52 Keyboard, Black",,Musical Instruments,"EGP 7,700.00",,,4.0,,,,,https://m.media-amazon.com/images/I/61ZTXzfMP7L._AC_UL320_.jpg,https://www.amazon.eg/dp/B09HCGCPNP,2026-03-29T06:02:51.977252
amazon,,"2-in-1 Musical Xylophone and Piano Toy, Colorful Keys with 8 Notes, Includes Hammers and Music Scores, Educational Instrument for Kids (Blue)",,Musical Instruments,EGP 129.00,EGP 145.00,,2.5,Was:,,,,https://m.media-amazon.com/images/I/61PAOKaAkxL._AC_UL320_.jpg,https://www.amazon.eg/dp/B0GKY9K6XW,2026-03-29T06:02:51.977873
amazon,,Ukulele Musical Instrument for Kids,,Musical Instruments,EGP 475.00,,,,,,,,https://m.media-amazon.com/images/I/514JnBVUgdL._AC_UL320_.jpg,https://www.amazon.eg/dp/B0GQPYYTV6,2026-03-29T06:02:51.978323
amazon,,"Tambourine,Half Moon Tambourine Double Row Musical Tamborines Instrument Hand Tamborine with 20 Jingles Hand Percussion Shaker Musical Instruments for Adults Party Church KTV Bar Black",,Musical Instruments,EGP 499.00,,,4.6,,,,,https://m.media-amazon.com/images/I/71ICSKzIITL._AC_UL320_.jpg,https://www.amazon.eg/dp/B0D5XWZ39T,2026-03-29T06:02:51.978860
amazon,,"Hola! Music A Style Mandolin Instrument with Adjustable Truss-Rod Model HM-3TS, Glossy Sunburst Finish",,Musical Instruments,"EGP 3,999.00",,,4.5,,,,,https://m.media-amazon.com/images/I/611AYRwEEOL._AC_UL320_.jpg,https://www.amazon.eg/dp/B00MM7AMN4,2026-03-29T06:02:56.861826
amazon,,Student Acoustic Violin Musical Instrument - R13206,,Musical Instruments,"EGP 2,399.00",,,2.1,,,,,https://m.media-amazon.com/images/I/51oZ8-tQdfL._AC_UL320_.jpg,https://www.amazon.eg/dp/B08Z47YWNL,2026-03-29T06:02:56.862358
amazon,,Melodica 32 Keys Mini Air Piano Blow Organ Keyboard Flute with Mouthpiece + Extension Hose & Carry Case (Black),,Musical Instruments,"EGP 1,499.00",,,,,,,,https://m.media-amazon.com/images/I/81pt3Ccf1XL._AC_UL320_.jpg,https://www.amazon.eg/dp/B0FWNTDLDT,2026-03-29T06:02:56.862845
amazon,,MySouq.co Store Harmonica for Musical Instrument for Beginners with 10 Hole Diatonic Mouth Organ Set with Storage Box Music Boxes 11Cm Long (Pink),,Musical Instruments,,,,4.6,,,,,https://m.media-amazon.com/images/I/61mIt5eCjhL._AC_UL320_.jpg,https://www.amazon.eg/dp/B0DHXZG3GM,2026-03-29T06:02:56.863284
amazon,,MySouq.co Store Harmonica for Musical Instrument for Beginners with 10 Hole Diatonic Mouth Organ Set with Storage Box Music Boxes 11Cm Long (Red),,Musical Instruments,EGP 655.99,,,4.6,,,,,https://m.media-amazon.com/images/I/613vRmT5z1L._AC_UL320_.jpg,https://www.amazon.eg/dp/B0DHXYTVR3,2026-03-29T06:02:56.863833
amazon,,2Pcs Band Wrist Bells Christmas Wrist Bells Jingle Bells Instrument Percussion Musical Party Adjustable Bracelets Wrist Band Shaking Bells Ankle Bells Hand Bells for Birthday Christmas Party Favors,,Musical Instruments,EGP 170.00,,,5.0,,,,,https://m.media-amazon.com/images/I/71jrzFx0FuL._AC_UL320_.jpg,https://www.amazon.eg/dp/B0DLHCST1K,2026-03-29T06:02:56.864347
amazon,,"Baby Music Toy, Early Educational Toy, Musical Instruments for Children, Baby Toy for Toddlers and Babies, Piano and Drum Music Toys for 1 Year +",,Musical Instruments,EGP 513.00,,,3.5,,,,,https://m.media-amazon.com/images/I/61rs409fCqL._AC_UL320_.jpg,https://www.amazon.eg/dp/B0BFX54DBP,2026-03-29T06:02:56.864887
amazon,,Kids Piano Toy - Electronic Organ Multi Degree - Suitable for Kids Gift - Pink,,Musical Instruments,EGP 159.99,,,3.5,,,,,https://m.media-amazon.com/images/I/61p+7KoStaL._AC_UL320_.jpg,https://www.amazon.eg/dp/B0DF7PMN1W,2026-03-29T06:02:56.865407
amazon,,"Finger Cymbals, Gold, Metal, Belly Dance Zills, Musical Instrument, Decorative Pattern 4 pieces",,Musical Instruments,EGP 199.00,,,,,,,,https://m.media-amazon.com/images/I/61H6iFw1FsL._AC_UL320_.jpg,https://www.amazon.eg/dp/B0GCCP59KQ,2026-03-29T06:02:56.865890
amazon,,Arabic Tablia Navy and Red 100% Handmade by Egypt Antics,,Musical Instruments,EGP 599.00,,,3.2,,,,,https://m.media-amazon.com/images/I/61grEOns9DL._AC_UL320_.jpg,https://www.amazon.eg/dp/B0DZSFS3JQ,2026-03-29T06:02:56.866382
amazon,,Wooden Ditone Sound Block Tick Tock Block Dual Tone Sound Tube Crow Double Tone Sounder Rhythm Percussion Guiro Toy with Mallet,,Musical Instruments,EGP 249.00,,,,,,,,https://m.media-amazon.com/images/I/61GEn4VTE8L._AC_UL320_.jpg,https://www.amazon.eg/dp/B0FXT1F9PS,2026-03-29T06:02:56.866881
amazon,,"12 PCS Jingle Bells,Wrist Bells Musical Rhythm Toys,Ankle Hand Bells Percussion Instruments for Party Favors Christmas Goodie Bags Stuffers",,Musical Instruments,EGP 799.00,,,,,,,,https://m.media-amazon.com/images/I/81rmOBXk3IL._AC_UL320_.jpg,https://www.amazon.eg/dp/B0FLPW394G,2026-03-29T06:02:56.867321
amazon,,Oud Arabic Classic Musical + Cover 100% Handmade by Egypt Intex,,Musical Instruments,"EGP 7,384.53",,,,,,,,https://m.media-amazon.com/images/I/71gmBCJXZ5L._AC_UL320_.jpg,https://www.amazon.eg/dp/B0F183MLYC,2026-03-29T06:02:56.867797
amazon,,MySouq-Store Metal Kazoo Harmonica Mouth Flute Kids Party Gift Musical Instrument Professional Performce Diaphragm Guitar Ukulele Lovers (Purple),,Musical Instruments,EGP 355.00,,,2.6,,,,,https://m.media-amazon.com/images/I/41fmHbNb1aL._AC_UL320_.jpg,https://www.amazon.eg/dp/B0DJV2SQ58,2026-03-29T06:02:56.868306
amazon,,Other Moving Melody Guitar for Kids - Brown,,Musical Instruments,EGP 299.00,,,4.3,,,,,https://m.media-amazon.com/images/I/51m9ssxpUeL._AC_UL320_.jpg,https://www.amazon.eg/dp/B092LLKQYP,2026-03-29T06:02:56.868840
amazon,,"Wooden Maracas Rattles, Pack of 4 Rattles, Wooden Egg Shaker, Colourful Wooden Rattles for Children, Wooden Maracas Rattle Shaker, Baby Toy Musical - Educational Wooden Musical Instrument.",,Musical Instruments,EGP 389.00,,,,,,,,https://m.media-amazon.com/images/I/410rlNwJlCL._AC_UL320_.jpg,https://www.amazon.eg/dp/B0G4X9B5KM,2026-03-29T06:02:56.869276
amazon,,"Jectse Electronic Drum Set, Color Kids Foldable Practice Drum Pad Rechargeable Drum Kit with 2 Pedals, Multiple Sets Of Drum Sound Sources, for Daily Percussion Practice or Music Games",,Musical Instruments,"EGP 6,749.00",,,4.0,,,,,https://m.media-amazon.com/images/I/51XWJ7om+8L._AC_UL320_.jpg,https://www.amazon.eg/dp/B0DC61FS44,2026-03-29T06:02:56.869839
amazon,,"Piano Toy For Kids, Multicolor",,Musical Instruments,EGP 129.00,,,3.1,,,,,https://m.media-amazon.com/images/I/41skfDNDYmL._AC_UL320_.jpg,https://www.amazon.eg/dp/B0BM6LT6ZX,2026-03-29T06:02:56.870354
amazon,,SY-73 2 in 1 Xylophone Piano Musical Instrument Juuetes with Mallets Musical Cards for Toddlers Boys Girls,,Musical Instruments,EGP 289.00,,,,,,,,https://m.media-amazon.com/images/I/61rqZcuYnBL._AC_UL320_.jpg,https://www.amazon.eg/dp/B0CL4M241D,2026-03-29T06:02:56.870842
amazon,,Musical Instrument 8 Note Octave Piano Wooden Knock On Piano Baby Kids Toddler Learning Education Musical Toy,,Musical Instruments,EGP 120.00,,,2.7,,,,,https://m.media-amazon.com/images/I/61IS1YvEwmL._AC_UL320_.jpg,https://www.amazon.eg/dp/B091CXWN73,2026-03-29T06:02:56.871353
amazon,,"Guitar Toy 4 String Acoustic Musical Toys for Kids, Beginner Guitar Educational Toy, Children's Musical Instrument, Kids Musical Educational Toy, Acoustic Toys, Brown, 3+ Years (Pack of 1)",,Musical Instruments,EGP 450.00,,,,,,,,https://m.media-amazon.com/images/I/61dRGZeDsxL._AC_UL320_.jpg,https://www.amazon.eg/dp/B0GPQTQH7Y,2026-03-29T06:02:56.871839
amazon,,Generic Oriental Copper Gold Cymbal Set Four Pharaonic Pieces,,Musical Instruments,EGP 99.90,,,2.5,,,,,https://m.media-amazon.com/images/I/61fvLeTiBPL._AC_UL320_.jpg,https://www.amazon.eg/dp/B09FXDYN1H,2026-03-29T06:02:56.872339
amazon,,"JAZZEEL Belly Dance Finger Cymbals, 4 Pieces Small Metallic Zills with Elastic Straps, Traditional Arabic Percussion Instrument for Dancers & Performers",,Musical Instruments,EGP 120.00,,,3.0,,,,,https://m.media-amazon.com/images/I/71CUQTZzzOL._AC_UL320_.jpg,https://www.amazon.eg/dp/B0FRZJLZFH,2026-03-29T06:02:56.872863
amazon,,"Pharaoh's Seashups, Gold",,Musical Instruments,EGP 99.66,,,3.9,,,,,https://m.media-amazon.com/images/I/71YzErNTqVL._AC_UL320_.jpg,https://www.amazon.eg/dp/B09FXHJNNV,2026-03-29T06:02:56.873356
amazon,,Set of 5 Funny Wooden Sand Hammer Maraca Wood Rattle Musical Toy Children Party,,Musical Instruments,EGP 226.10,,,3.2,,,,,https://m.media-amazon.com/images/I/61BDD16tZ2L._AC_UL320_.jpg,https://www.amazon.eg/dp/B093GBHWFL,2026-03-29T06:02:56.873893
amazon,,Generic Moving Melody Guitar for Kids - Brown,,Musical Instruments,EGP 240.00,EGP 255.00,,3.5,List:,,,,https://m.media-amazon.com/images/I/51G9jboUyUL._AC_UL320_.jpg,https://www.amazon.eg/dp/B092LJX6CL,2026-03-29T06:02:56.874561
amazon,,Next Store 37 Keys Electronic Keyboard for Kids | Educational Musical Piano with Microphone for Singing | Multiple Rhythms & Melodies | Musical Skills Development Gift,,Musical Instruments,"EGP 1,490.00",,,,,,,,https://m.media-amazon.com/images/I/61APOhgK1jL._AC_UL320_.jpg,https://www.amazon.eg/dp/B0FGDPD778,2026-03-29T06:02:56.875021
amazon,,Huanger Musical Drum Toy,,Musical Instruments,EGP 399.00,,,4.1,,,,,https://m.media-amazon.com/images/I/71-diWVu+BL._AC_UL320_.jpg,https://www.amazon.eg/dp/B09FTPZYCB,2026-03-29T06:02:56.875558
amazon,,Casio CT-S200BK in black with 61 stand buttons and accompanying automatic,,Musical Instruments,"EGP 8,301.38","EGP 9,230.00",,4.5,List:,,,,https://m.media-amazon.com/images/I/71EMT4Jp19L._AC_UL320_.jpg,https://www.amazon.eg/dp/B07YPF66ZZ,2026-03-29T06:02:56.876204
amazon,,Other Musical Rabbit Piano Toy - Multicolor,,Musical Instruments,EGP 253.00,,,,,,,,https://m.media-amazon.com/images/I/71QuzMItEJL._AC_UL320_.jpg,https://www.amazon.eg/dp/B091G5552Y,2026-03-29T06:02:56.876671
amazon,,"JAZZEEL Professional Finger Zills Cymbals, 2 Pairs (4 Pieces), Oriental Dance Costume Accessory, Rhythmic Percussion Instrument for Dancer Evening Party Performance",,Musical Instruments,EGP 145.00,,,,,,,,https://m.media-amazon.com/images/I/61NYNVpBbjL._AC_UL320_.jpg,https://www.amazon.eg/dp/B0FRZFXPNM,2026-03-29T06:02:56.877096
amazon,,"4 PCS Tambourine for Kids,Sleigh Bells Instrument, Baby Tambourine with Wooden Handle, Shaking Half Moon Tambourine Handbell, Kids Musical Instruments for Child Early Educational Baby Bells",,Musical Instruments,EGP 269.00,,,,,,,,https://m.media-amazon.com/images/I/61n3j2QNCpL._AC_UL320_.jpg,https://www.amazon.eg/dp/B0DQTWS2HZ,2026-03-29T06:02:56.877557
amazon,,Yamaha Pacifica 012 - Electric Guitar White,,Musical Instruments,"EGP 12,800.00",,,4.1,,,,,https://m.media-amazon.com/images/I/5183xSoosAL._AC_UL320_.jpg,https://www.amazon.eg/dp/B08P23DP99,2026-03-29T06:02:56.878081
