platform,product_id,title,brand,category,current_price,original_price,discount,rating,reviews_count,availability,seller,express_delivery,platform_badge,sponsored,main_image,all_images,description,weight,dimensions,model_number,country_of_origin,warranty,tech_specs,variations,ships_from,delivery_date,product_url,scraped_at
amazon,B0DLX3DYS9,"Automotive Oil Film Cleaning Brush, Oil Film Cleaning Brush for Car Windows, Anti-Rain Fog Glass Cleaning Board for Windshield, Car Glass Cleaner for Improved Clarity and Visibility (1Pack)",,Automotive,EGP 63.00,EGP 70.00,,2.9,Was:,,,,,,https://m.media-amazon.com/images/I/71003-Nbh4L._AC_UL320_.jpg,https://m.media-amazon.com/images/I/71003-Nbh4L._AC_UL320_.jpg,,,,,,,,,,,https://www.amazon.eg/dp/B0DLX3DYS9,2026-03-28T13:32:34.473148
amazon,B00ES5Q610,"Bosch Car H307 Steel Rear Wiper Blade, 12 Inch Size, Black",,Automotive,EGP 192.00,,,4.5,,,,,,,https://m.media-amazon.com/images/I/41vRQ1PJ73L._AC_UL320_.jpg,https://m.media-amazon.com/images/I/41vRQ1PJ73L._AC_UL320_.jpg,,,,,,,,,,,https://www.amazon.eg/dp/B00ES5Q610,2026-03-28T13:32:34.473762
amazon,B0F28SXZYD,"Car Seat Belt Clip, 4PCS Vehicles Metal Tongue Belt Extension Splice Insert Buckle Alarm Stoppers, Safety Automotive Interior Accessories, Universal for SUV, Truck, RV",,Automotive,EGP 153.98,,,3.5,,,,,,,https://m.media-amazon.com/images/I/71Qg5Tfa-dL._AC_UL320_.jpg,https://m.media-amazon.com/images/I/71Qg5Tfa-dL._AC_UL320_.jpg,,,,,,,,,,,https://www.amazon.eg/dp/B0F28SXZYD,2026-03-28T13:32:34.474265
amazon,B09SH3VBPP,"Car Windscreen Sun Shade,Front Windshield Sunshade,Foldable Cover Visor Sunshades,Reflective UV Dust Protector,Automotive Ray Protection Block Parasol,Keep Your Vehicle Cool,Fit Various Sizes,150x70cm",,Automotive,EGP 128.73,,,3.9,,,,,,,https://m.media-amazon.com/images/I/71wfFyIg2TL._AC_UL320_.jpg,https://m.media-amazon.com/images/I/71wfFyIg2TL._AC_UL320_.jpg,,,,,,,,,,,https://www.amazon.eg/dp/B09SH3VBPP,2026-03-28T13:32:34.474790
amazon,B0F3WY433Y,"2Pcs Car Plastic Plating Refurbishing Agent, Car Plastic Plating Refurbishing Agent, Crystal Coating for Cars Plastics Parts, Nano Coating Agent for DIY, Automotive(30ml*2)",,Automotive,EGP 182.00,EGP 191.00,,3.9,Was:,,,,,,https://m.media-amazon.com/images/I/71Q6LSjmZSL._AC_UL320_.jpg,https://m.media-amazon.com/images/I/71Q6LSjmZSL._AC_UL320_.jpg,,,,,,,,,,,https://www.amazon.eg/dp/B0F3WY433Y,2026-03-28T13:32:34.475365
amazon,B094F92FW2,"Amiss 5 Pieces Car Detailing Brush Set, Car Interior Cleaning Kit, Different Sizes Automotive Detail Brushes Perfect for Cleaning Wheels, Engine, Emblems, Air Vents, Leather, Dashboard, Trim(Black)",,Automotive,EGP 182.23,,,4.4,,,,,,,https://m.media-amazon.com/images/I/61guci6JteL._AC_UL320_.jpg,https://m.media-amazon.com/images/I/61guci6JteL._AC_UL320_.jpg,,,,,,,,,,,https://www.amazon.eg/dp/B094F92FW2,2026-03-28T13:32:34.475885
amazon,B0CLD3RNMG,"COSTAR Car Sun Shade Protector, Foldable Windshield Insulation Car Sun Shade for UV Protection Reflective Sunblocker Car Accessories for Pickup, Sedans, Trucks, SUVs, and More (Large Size)",,Automotive,EGP 90.75,,,3.2,,,,,,,https://m.media-amazon.com/images/I/61UgKRTe4OL._AC_UL320_.jpg,https://m.media-amazon.com/images/I/61UgKRTe4OL._AC_UL320_.jpg,,,,,,,,,,,https://www.amazon.eg/dp/B0CLD3RNMG,2026-03-28T13:32:34.476357
amazon,B0CQQKV5HT,"10 PCS Car T5 3030 3SMD Led Lights, PCB Instrument Lights, 6000K Warning Lights, Vehicle Bulb Replacements, Automotive Lighting Tool, Universal for Most Cars, Trucks, SUVs (White)",,Automotive,EGP 114.00,,,5.0,,,,,,,https://m.media-amazon.com/images/I/710zYfwzMRL._AC_UL320_.jpg,https://m.media-amazon.com/images/I/710zYfwzMRL._AC_UL320_.jpg,,,,,,,,,,,https://www.amazon.eg/dp/B0CQQKV5HT,2026-03-28T13:32:34.476889
amazon,B0C6F4QTN2,"Back Seat Cover for Car Trucks Van SUV,Waterproof Rear Bench Towel Seat Covers for Dogs and Kids,Automotive Backseat Protector (Black)",,Automotive,EGP 388.00,,,4.3,,,,,,,https://m.media-amazon.com/images/I/51C49yMe3AL._AC_UL320_.jpg,https://m.media-amazon.com/images/I/51C49yMe3AL._AC_UL320_.jpg,,,,,,,,,,,https://www.amazon.eg/dp/B0C6F4QTN2,2026-03-28T13:32:34.477413
amazon,B091FQDD8D,"YANGMING 10 Pieces Car Detail Brush Set, Car Cleaning Brush Automotive Detail Cleaning Brushes Fiber Auto Car Detailing Brush for Cleaning Wheels Engine Air Vent (5 Sizes)",,Automotive,EGP 271.00,,,4.0,,,,,,,https://m.media-amazon.com/images/I/61mSYH6o31L._AC_UL320_.jpg,https://m.media-amazon.com/images/I/61mSYH6o31L._AC_UL320_.jpg,,,,,,,,,,,https://www.amazon.eg/dp/B091FQDD8D,2026-03-28T13:32:34.477983
amazon,B0CH367WM1,"Cleaning Gel for Car, Auto Detailing Putty for Dust Removal, Universal Crevice Cleaner Automotive Interior Cleaning Slime Mud, Car Accessories for Air Vents, Keyboard, PC, Laptops (Green)",,Automotive,EGP 58.86,,,4.0,,,,,,,https://m.media-amazon.com/images/I/71UyJzCgcfL._AC_UL320_.jpg,https://m.media-amazon.com/images/I/71UyJzCgcfL._AC_UL320_.jpg,,,,,,,,,,,https://www.amazon.eg/dp/B0CH367WM1,2026-03-28T13:32:34.478477
amazon,B0FL13Y8PP,"30ML Crystal Coating Plastic Restoration,Car Plastic Restorer with Sponge,Plas/tic Trim Restorer Dashboard Cleaner,Automotive Interior Cleaner Cars,30ML Car Pl/astic Res/torer Black with Spo/nge(1PCS)",,Automotive,EGP 91.00,EGP 4.55,,2.6,(,,,,,,https://m.media-amazon.com/images/I/714mbexSEkL._AC_UL320_.jpg,https://m.media-amazon.com/images/I/714mbexSEkL._AC_UL320_.jpg,,,,,,,,,,,https://www.amazon.eg/dp/B0FL13Y8PP,2026-03-28T13:32:34.479092
amazon,B0BXNNFMLF,"1 PC Car Windshield Sun Shade with Storage Pouch, 74.8 x 35.4 inches Foldable Automotive Interior Sun Protection Blocker, Car Front Window Visor Protector Cover (Silver)",,Automotive,EGP 120.00,,,3.6,,,,,,,https://m.media-amazon.com/images/I/61JEuVkYmZL._AC_UL320_.jpg,https://m.media-amazon.com/images/I/61JEuVkYmZL._AC_UL320_.jpg,,,,,,,,,,,https://www.amazon.eg/dp/B0BXNNFMLF,2026-03-28T13:32:34.479606
amazon,B097TQ1TZG,"Automotive Car Accessory Combo of 7 Inch TFT HD Rearview Mirror Monitor, Silver Parking Sensors, Camera",,Automotive,"EGP 1,750.00",,,4.0,,,,,,,https://m.media-amazon.com/images/I/61aB9bJIy2L._AC_UL320_.jpg,https://m.media-amazon.com/images/I/61aB9bJIy2L._AC_UL320_.jpg,,,,,,,,,,,https://www.amazon.eg/dp/B097TQ1TZG,2026-03-28T13:32:34.480096
amazon,B0B6FH9Q16,"CHAVA Car Detailing Brush, 5 Pieces Automotive Clean Wheels Interior Outdoor Leather Air Fans, Emblems, Brushes (Black)",,Automotive,EGP 114.00,,,3.7,,,,,,,https://m.media-amazon.com/images/I/61KPwPoFjJL._AC_UL320_.jpg,https://m.media-amazon.com/images/I/61KPwPoFjJL._AC_UL320_.jpg,,,,,,,,,,,https://www.amazon.eg/dp/B0B6FH9Q16,2026-03-28T13:32:34.480632
amazon,B098TYY984,Car Cleaning Brush With Drill Attachment Tub Automotive Detailing Spin Scrubber Set (3 Pieces),,Automotive,EGP 122.70,EGP 171.00,,4.3,List:,,,,,,https://m.media-amazon.com/images/I/61Y7UwyEdmL._AC_UL320_.jpg,https://m.media-amazon.com/images/I/61Y7UwyEdmL._AC_UL320_.jpg,,,,,,,,,,,https://www.amazon.eg/dp/B098TYY984,2026-03-28T13:32:38.019698
amazon,B098TWCKN6,Set of 3 Drill Brush Car Cleaning Brush with Drill Attachment Tub Cleaner Scrubber Cleaning Brushes Automotive Detailing Spin Scrubber Set,,Automotive,EGP 110.00,,,4.6,,,,,,,https://m.media-amazon.com/images/I/71b0n5K0rSL._AC_UL320_.jpg,https://m.media-amazon.com/images/I/71b0n5K0rSL._AC_UL320_.jpg,,,,,,,,,,,https://www.amazon.eg/dp/B098TWCKN6,2026-03-28T13:32:38.020247
amazon,B07D1KH9SC,LAUNCH Creader 3001 OBD2 Scanner Automotive Car Diagnostic Check Engine Light O2 Sensor Systems OBD Code Readers Scan Tool for All OBDII Protocol Cars Since 1996,,Automotive,"EGP 2,299.00",,,4.0,,,,,,,https://m.media-amazon.com/images/I/81KodmZ7KZL._AC_UL320_.jpg,https://m.media-amazon.com/images/I/81KodmZ7KZL._AC_UL320_.jpg,,,,,,,,,,,https://www.amazon.eg/dp/B07D1KH9SC,2026-03-28T13:32:38.020805
amazon,B09Y99YF4P,"(8 Pcs) Black Car Door Protector Car Door Shock Absorber Stickers,Buffer Bumper Cushion Car Door Shock Absorbing Silicone Gaskets Automotive Door Gasket for Maruti Eeco",,Automotive,EGP 130.00,,,,,,,,,,https://m.media-amazon.com/images/I/61WZwdGDo1L._AC_UL320_.jpg,https://m.media-amazon.com/images/I/61WZwdGDo1L._AC_UL320_.jpg,,,,,,,,,,,https://www.amazon.eg/dp/B09Y99YF4P,2026-03-28T13:32:38.021256
amazon,B09D76W7SB,"Car sun shade windshield front windshield reflective sunshade for vehicle blocks uv ray, foldable cover visor umbrella, automotive ray protection block parasol, keep your vehicle cool(25.5x49.2inch)",,Automotive,EGP 130.39,EGP 137.40,,3.6,Was:,,,,,,https://m.media-amazon.com/images/I/61tACESmDFL._AC_UL320_.jpg,https://m.media-amazon.com/images/I/61tACESmDFL._AC_UL320_.jpg,,,,,,,,,,,https://www.amazon.eg/dp/B09D76W7SB,2026-03-28T13:32:38.021845
amazon,B0CH36KMRM,"Cleaning Gel for Car, Auto Detailing Putty for Dust Removal, Universal Crevice Cleaner Automotive Interior Cleaning Slime Mud, Car Accessories for Air Vents, Keyboard, PC, Laptops (Blue)",,Automotive,EGP 58.86,,,3.5,,,,,,,https://m.media-amazon.com/images/I/71lzGhvU3ML._AC_UL320_.jpg,https://m.media-amazon.com/images/I/71lzGhvU3ML._AC_UL320_.jpg,,,,,,,,,,,https://www.amazon.eg/dp/B0CH36KMRM,2026-03-28T13:32:38.022346
amazon,B0CSFZK825,2Pcs Sunglasses Holder For Car Car Glasses Holder Sun Visor Sunglasses With Card Clip Vehicle Glasses Clips Sunglasses Holder With 180 Degree Rotational Ticket Card Clip Holder,,Automotive,EGP 107.00,,,4.1,,,,,,,https://m.media-amazon.com/images/I/61aGDGurdsL._AC_UL320_.jpg,https://m.media-amazon.com/images/I/61aGDGurdsL._AC_UL320_.jpg,,,,,,,,,,,https://www.amazon.eg/dp/B0CSFZK825,2026-03-28T13:32:38.022903
amazon,B0DCBQ6L5N,"Automotive Oil Film Cleaning Brush, Car Glass Oil Film Cleaner, Glass Coating for Windshield, Car Glass Cleaning Brush with Reusable Foam Sprayer, Improves Clarity and Visibility ﻿",,Automotive,EGP 154.00,,,3.2,,,,,,,https://m.media-amazon.com/images/I/71xTlHt1opL._AC_UL320_.jpg,https://m.media-amazon.com/images/I/71xTlHt1opL._AC_UL320_.jpg,,,,,,,,,,,https://www.amazon.eg/dp/B0DCBQ6L5N,2026-03-28T13:32:38.023454
amazon,B0DHR92GKN,50Pcs Black Plastic Rivet Push-Type Expansion Screw Fastener Clips 9mm for Car Automotive Parts,,Automotive,EGP 56.96,EGP 71.00,,5.0,List:,,,,,,https://m.media-amazon.com/images/I/51RU1pBd8uL._AC_UL320_.jpg,https://m.media-amazon.com/images/I/51RU1pBd8uL._AC_UL320_.jpg,,,,,,,,,,,https://www.amazon.eg/dp/B0DHR92GKN,2026-03-28T13:32:38.024059
amazon,B09F5WW9MD,"DNA MOTORING TOOLS-00201 36"" L X 17"" W x 4.25"" H Vehicle Repair Low Profile Automotive Creeper w/Padded Headrest, Red",,Automotive,"EGP 1,121.00",,,4.5,,,,,,,https://m.media-amazon.com/images/I/61bBkcLH73L._AC_UL320_.jpg,https://m.media-amazon.com/images/I/61bBkcLH73L._AC_UL320_.jpg,,,,,,,,,,,https://www.amazon.eg/dp/B09F5WW9MD,2026-03-28T13:32:38.024592
amazon,B08VRMP3LM,"KW208 12V Car Battery Tester, Automotive Battery Load Tester, 100-2000 CCA Auto Cranking & Charging System Test, Display Diagnostic Checker Scan Tool Digital Battery Analyzer for Truck Marine SUV Boat",,Automotive,"EGP 1,699.00",,,4.4,,,,,,,https://m.media-amazon.com/images/I/811PSDujLTL._AC_UL320_.jpg,https://m.media-amazon.com/images/I/811PSDujLTL._AC_UL320_.jpg,,,,,,,,,,,https://www.amazon.eg/dp/B08VRMP3LM,2026-03-28T13:32:38.025091
amazon,B0DT65Q3TW,"UCRAVO Pack of 2 Plastic Restorer for Cars, Proven Back to Black Trim Restore, Permanent Automotive Hydrophobic Ceramic Trim Coating, Instant Bring Plastic, Rubber, Vinyl Back to Life, Resists Water",,Automotive,EGP 185.00,,,1.0,,,,,,,https://m.media-amazon.com/images/I/81uBAOyixXL._AC_UL320_.jpg,https://m.media-amazon.com/images/I/81uBAOyixXL._AC_UL320_.jpg,,,,,,,,,,,https://www.amazon.eg/dp/B0DT65Q3TW,2026-03-28T13:32:38.025611
amazon,B0CGVFTXSW,"VRT 3D Chrome Emblem Automotive Car, Bike Badges Logo Self Adhesive Sticker (Batman, Black)",,Automotive,EGP 290.00,,,4.3,,,,,,,https://m.media-amazon.com/images/I/51FpYGs0+cL._AC_UL320_.jpg,https://m.media-amazon.com/images/I/51FpYGs0+cL._AC_UL320_.jpg,,,,,,,,,,,https://www.amazon.eg/dp/B0CGVFTXSW,2026-03-28T13:32:38.026113
amazon,B0DCZJ2NDF,"Automotive Oil Film Cleaning Brush, 2024 New Glass Oil Film Remover for Car, All in One Wipe On Oil Film Remover,Hydrophobic Glass Coating for Windshield ，Improves Clarity and Visibility",,Automotive,EGP 63.00,,,3.0,,,,,,,https://m.media-amazon.com/images/I/71qwJujm+wL._AC_UL320_.jpg,https://m.media-amazon.com/images/I/71qwJujm+wL._AC_UL320_.jpg,,,,,,,,,,,https://www.amazon.eg/dp/B0DCZJ2NDF,2026-03-28T13:32:38.026642
amazon,B09NQ6DYCJ,"9Pcs Car Wash Cleaning Tools Kit Auto Care, Automotive Detail Brushes for Cleaning Wheels, Interior, Exterior, Leather, Air Vents, Emblems",,Automotive,EGP 484.50,,,1.0,,,,,,,https://m.media-amazon.com/images/I/61FIHce4u5L._AC_UL320_.jpg,https://m.media-amazon.com/images/I/61FIHce4u5L._AC_UL320_.jpg,,,,,,,,,,,https://www.amazon.eg/dp/B09NQ6DYCJ,2026-03-28T13:32:38.027150
amazon,B0BYDPHNTN,"Car Interior Detailing Brush, Auto Interior Dust Brush, Car Interior Cleaning Tool for Automotive Dashboard Interior, Leather, Air Vent, Gap, Cup Holder,Keyboard(2pcs)",,Automotive,EGP 71.00,EGP 94.00,,3.4,List:,,,,,,https://m.media-amazon.com/images/I/61yhzykEMDL._AC_UL320_.jpg,https://m.media-amazon.com/images/I/61yhzykEMDL._AC_UL320_.jpg,,,,,,,,,,,https://www.amazon.eg/dp/B0BYDPHNTN,2026-03-28T13:32:38.027770
amazon,B0B6FTJBRV,"hartas Car Cleaning Brush, Clean Automotive Leather Interior Wheels Exterior Ventilation Grilles Emblems Cleaner Brushes, Black, 5 Pieces",,Automotive,EGP 141.33,,,3.6,,,,,,,https://m.media-amazon.com/images/I/61KPwPoFjJL._AC_UL320_.jpg,https://m.media-amazon.com/images/I/61KPwPoFjJL._AC_UL320_.jpg,,,,,,,,,,,https://www.amazon.eg/dp/B0B6FTJBRV,2026-03-28T13:32:38.028291
amazon,B08YNT7XYN,Car mats with high edges - black - 5 pieces,,Automotive,EGP 282.00,,,3.7,,,,,,,https://m.media-amazon.com/images/I/81pl0qPeXBL._AC_UL320_.jpg,https://m.media-amazon.com/images/I/81pl0qPeXBL._AC_UL320_.jpg,,,,,,,,,,,https://www.amazon.eg/dp/B08YNT7XYN,2026-03-28T13:32:38.028817
amazon,B0CQ4QJWTD,"2 Packs Car Window Sunshade Curtains, Foldable Suction Cup Auto Side Window Sun Visor Shield Sunshade Protector, Car Window Privacy Blackout UV Rays Heat Reflector for Breastfeeding, Taking a Nap",,Automotive,EGP 88.68,,,3.2,,,,,,,https://m.media-amazon.com/images/I/611CXWBFpxL._AC_UL320_.jpg,https://m.media-amazon.com/images/I/611CXWBFpxL._AC_UL320_.jpg,,,,,,,,,,,https://www.amazon.eg/dp/B0CQ4QJWTD,2026-03-28T13:32:38.029359
amazon,B012DDJLB0,Auto Pearl - Vehicle Roof Mount Rubber Antenna Mast Flexible Car Antenna with Anti-Theft Design and Car Wash Safe - Black -SwiftNew,,Automotive,EGP 175.00,,,3.2,,,,,,,https://m.media-amazon.com/images/I/51zqL+6xXbL._AC_UL320_.jpg,https://m.media-amazon.com/images/I/51zqL+6xXbL._AC_UL320_.jpg,,,,,,,,,,,https://www.amazon.eg/dp/B012DDJLB0,2026-03-28T13:32:38.029899
amazon,B0CF1ZKGRL,"BELEY Digital Automotive Transmission Oil Tester - Car Automatic Transmission Oil Tester with 2.8"" screen and 800 mm hose Tests light transmission and temperature of various transmission fluids",,Automotive,"EGP 3,900.00","EGP 54,166.67",,4.2,(,,,,,,https://m.media-amazon.com/images/I/618oWYODl7L._AC_UL320_.jpg,https://m.media-amazon.com/images/I/618oWYODl7L._AC_UL320_.jpg,,,,,,,,,,,https://www.amazon.eg/dp/B0CF1ZKGRL,2026-03-28T13:32:38.030478
amazon,B00N3XR0UO,Abro Carnauba Car Wax Super Gold Liquid 473ml,,Automotive,EGP 371.00,,,3.5,,,,,,,https://m.media-amazon.com/images/I/71uRWO+IeUL._AC_UL320_.jpg,https://m.media-amazon.com/images/I/71uRWO+IeUL._AC_UL320_.jpg,,,,,,,,,,,https://www.amazon.eg/dp/B00N3XR0UO,2026-03-28T13:32:38.031019
amazon,B0B2P9CMK1,"Superdrive 600Amp Jumper Cables for Car Battery, Heavy Duty Automotive Booster Cables for Jump Starting Dead or Weak Batteries with Carrying Blue Plastic Box Included",,Automotive,EGP 445.00,EGP 540.00,,4.2,List:,,,,,,https://m.media-amazon.com/images/I/71AXJl9v45L._AC_UL320_.jpg,https://m.media-amazon.com/images/I/71AXJl9v45L._AC_UL320_.jpg,,,,,,,,,,,https://www.amazon.eg/dp/B0B2P9CMK1,2026-03-28T13:32:38.031634
amazon,B0DQJV88R5,Car Glass Oil Film Remover|Automotive Oil Film Cleaning Brush|Oil Film Cleaning Brush| Oil Film Remover for Car Window|Car Glass Oil Film Cleaner|Glass Oil Film Remover for Car,,Automotive,EGP 59.00,EGP 75.00,,2.6,Was:,,,,,,https://m.media-amazon.com/images/I/71ULetw46rL._AC_UL320_.jpg,https://m.media-amazon.com/images/I/71ULetw46rL._AC_UL320_.jpg,,,,,,,,,,,https://www.amazon.eg/dp/B0DQJV88R5,2026-03-28T13:32:38.032214
amazon,B0DCC5V886,Superdrive Engine Coolant for Car Radiator Anti Freeze & Boil 1L (Red),,Automotive,EGP 39.00,,,3.8,,,,,,,https://m.media-amazon.com/images/I/71GTdGMzDJL._AC_UL320_.jpg,https://m.media-amazon.com/images/I/71GTdGMzDJL._AC_UL320_.jpg,,,,,,,,,,,https://www.amazon.eg/dp/B0DCC5V886,2026-03-28T13:32:41.104518
amazon,B0D8GZ6JF1,"Islamic Quran Ayah and Duaaa Car Sticker - Durable Vinyl, Easy to Apply and Remove Car Sticker, Badges, for Car Glass and Room Doors and Wall White (Mashallah)",,Automotive,EGP 40.50,,,4.1,,,,,,,https://m.media-amazon.com/images/I/71IX1rIhd7L._AC_UL320_.jpg,https://m.media-amazon.com/images/I/71IX1rIhd7L._AC_UL320_.jpg,,,,,,,,,,,https://www.amazon.eg/dp/B0D8GZ6JF1,2026-03-28T13:32:41.105097
amazon,B0G9YF47L1,"Automotive Hoody - Hoody Car Accessory Made of robust ABS,it offers an elegant Hoody cover for the transmission area, adds a modern touch to the interior, provides additional protection and facilitate",,Automotive,EGP 222.05,EGP 250.00,,,List:,,,,,,https://m.media-amazon.com/images/I/81jEstdFd1L._AC_UL320_.jpg,https://m.media-amazon.com/images/I/81jEstdFd1L._AC_UL320_.jpg,,,,,,,,,,,https://www.amazon.eg/dp/B0G9YF47L1,2026-03-28T13:32:41.105670
amazon,B09TDHVF8Q,"Car Windshield Sun Shade Umbrella, Foldable Car Front Window Sunshade Umbrella for UV Ray Block & Sun Heat Protection, Automotive Windshield Sunshades Fit Most Vehicles (55""X31.5"")",,Automotive,EGP 177.00,,,1.0,,,,,,,https://m.media-amazon.com/images/I/71FnT9yyDPL._AC_UL320_.jpg,https://m.media-amazon.com/images/I/71FnT9yyDPL._AC_UL320_.jpg,,,,,,,,,,,https://www.amazon.eg/dp/B09TDHVF8Q,2026-03-28T13:32:41.106176
amazon,B096473TNX,"JUYUE SUV Car Windshield Sun Shade,Foldable Automotive Windshield Shade,Sunshades Car Umbrella for Windshield Easy to Store and Use Fits Windshields of Various Sizes",,Automotive,EGP 160.20,EGP 178.00,,2.6,List:,,,,,,https://m.media-amazon.com/images/I/61OvCJ0++0L._AC_UL320_.jpg,https://m.media-amazon.com/images/I/61OvCJ0++0L._AC_UL320_.jpg,,,,,,,,,,,https://www.amazon.eg/dp/B096473TNX,2026-03-28T13:32:41.106790
amazon,B0DXPT8J61,(2 pcs) Automotive Glass Nano Repair Fluid Kit Cracked Car Windshield Repair Kit Resin | Wind Shield Car Glass Repair Set Glass Corrector Shatter Repair Glue for Cars,,Automotive,,,,1.0,,,,,,,https://m.media-amazon.com/images/I/41AC03f5P9L._AC_UL320_.jpg,https://m.media-amazon.com/images/I/41AC03f5P9L._AC_UL320_.jpg,,,,,,,,,,,https://www.amazon.eg/dp/B0DXPT8J61,2026-03-28T13:32:41.107490
amazon,B09D7C358Q,car sun shade windshield front windshield reflective sunshade for vehicle blocks uv ray foldable cover visor umbrella automotive ray protection block parasol keep your vehicle cool(31x53inch),,Automotive,EGP 140.00,,,3.6,,,,,,,https://m.media-amazon.com/images/I/61lJ-4rnPtL._AC_UL320_.jpg,https://m.media-amazon.com/images/I/61lJ-4rnPtL._AC_UL320_.jpg,,,,,,,,,,,https://www.amazon.eg/dp/B09D7C358Q,2026-03-28T13:32:41.108002
amazon,B0CWS46T3D,"Minimalist Car Windshield Sunshade - Black, Universal Fit, Spring Structure, Military-Grade Durability, Protects Interior from Sun Rays & Heat Damage",,Automotive,EGP 130.00,,,4.2,,,,,,,https://m.media-amazon.com/images/I/71sL6kb9cLL._AC_UL320_.jpg,https://m.media-amazon.com/images/I/71sL6kb9cLL._AC_UL320_.jpg,,,,,,,,,,,https://www.amazon.eg/dp/B0CWS46T3D,2026-03-28T13:32:41.108506
amazon,B0968XBJ9B,7 Inch TFT HD Rearview Mirror Monitor with 6 White Parking Sensors and Rearview Camera Automotive Car Accessory,,Automotive,"EGP 1,850.00",,,4.0,,,,,,,https://m.media-amazon.com/images/I/61p5sbzQueS._AC_UL320_.jpg,https://m.media-amazon.com/images/I/61p5sbzQueS._AC_UL320_.jpg,,,,,,,,,,,https://www.amazon.eg/dp/B0968XBJ9B,2026-03-28T13:32:41.109042
amazon,B08WJLDHXV,"300Amp Jumper Cables for Car Battery, Heavy Duty Automotive Booster Cables for Jump Starting Dead or Weak Batteries with Carrying Bag Included",,Automotive,EGP 271.79,,,3.7,,,,,,,https://m.media-amazon.com/images/I/712bh-IxBpL._AC_UL320_.jpg,https://m.media-amazon.com/images/I/712bh-IxBpL._AC_UL320_.jpg,,,,,,,,,,,https://www.amazon.eg/dp/B08WJLDHXV,2026-03-28T13:32:41.109617
amazon,B0DL3LBZBX,"Automotive Interior Dusting Brush, Car Interior Cleaning Soft Brushes, Car Interior Beauty Brush, Suitable for Cleaning Car Interior, Dashboard, Air Conditioning Vents, Leather, Keyboard (1 Pack)",,Automotive,EGP 80.00,,,4.6,,,,,,,https://m.media-amazon.com/images/I/61GxdPCFS8L._AC_UL320_.jpg,https://m.media-amazon.com/images/I/61GxdPCFS8L._AC_UL320_.jpg,,,,,,,,,,,https://www.amazon.eg/dp/B0DL3LBZBX,2026-03-28T13:32:41.110143
amazon,B0CF5TVF2W,"Super Soft Microfiber Car Duster with Handle Car Cleaning Brush for Wet & Dry Car Washing Kit, Car Dust Cleaner Brush Car Accessories Exterior and Interior Car Cleaning Kit (Car Duster)",,Automotive,EGP 129.00,,,3.9,,,,,,,https://m.media-amazon.com/images/I/51Mes3aiRbL._AC_UL320_.jpg,https://m.media-amazon.com/images/I/51Mes3aiRbL._AC_UL320_.jpg,,,,,,,,,,,https://www.amazon.eg/dp/B0CF5TVF2W,2026-03-28T13:32:41.110674
amazon,B0C72PFL1P,"Trunk Organizer for Car Trunk Organizer and Storage,SUV Trunk Organizer Leather Storage, Cargo Box-Automotive Consoles Organizers-Multi-Compartment Adjustable Auto Grocery Storage Box",,Automotive,EGP 850.00,,,4.5,,,,,,,https://m.media-amazon.com/images/I/61DoPiAkyAL._AC_UL320_.jpg,https://m.media-amazon.com/images/I/61DoPiAkyAL._AC_UL320_.jpg,,,,,,,,,,,https://www.amazon.eg/dp/B0C72PFL1P,2026-03-28T13:32:41.111180
amazon,B0C3MCMBLH,"stymart Mechanic Stethoscope, Automotive Engine Diagnostic Sensitive Hearing Tool, Car Stethoscope Automotive Engine Diagnostic Tool for Cars, Trucks and Motorcycles",,Automotive,EGP 210.00,,,4.6,,,,,,,https://m.media-amazon.com/images/I/6119Sx7hPDL._AC_UL320_.jpg,https://m.media-amazon.com/images/I/6119Sx7hPDL._AC_UL320_.jpg,,,,,,,,,,,https://www.amazon.eg/dp/B0C3MCMBLH,2026-03-28T13:32:41.111707
amazon,B0FXZT3TKK,"Crystal Coating for Car, 2026 New Plastic Parts Crystals Coating, Upgrade Plastics Parts Crystal Coating Plastic Restorer with Spong, Coatings Agent for Automotive Plastics (1Set)",,Automotive,EGP 115.00,,,3.1,,,,,,,https://m.media-amazon.com/images/I/61OTAnKvtPL._AC_UL320_.jpg,https://m.media-amazon.com/images/I/61OTAnKvtPL._AC_UL320_.jpg,,,,,,,,,,,https://www.amazon.eg/dp/B0FXZT3TKK,2026-03-28T13:32:41.112199
amazon,B0BXB6CSFG,"Generic Large cargo mat for all weather protection universal fit, premium quality trimmable black automotive,trunk liner fits most cars, suvs, and trucks - 144 cm",,Automotive,,,,4.1,,,,,,,https://m.media-amazon.com/images/I/71XLz7aLh9L._AC_UL320_.jpg,https://m.media-amazon.com/images/I/71XLz7aLh9L._AC_UL320_.jpg,,,,,,,,,,,https://www.amazon.eg/dp/B0BXB6CSFG,2026-03-28T13:32:41.112664
amazon,B0GNN6JHDN,"Plastics Repair Agent for Cars, Automotive Interior Plastic Part Ceramic Coating, 50ml with Sponge and Nozzle, Resists Water, UV Rays, Dirt",,Automotive,EGP 124.00,,,,,,,,,,https://m.media-amazon.com/images/I/61MDJVoVJSL._AC_UL320_.jpg,https://m.media-amazon.com/images/I/61MDJVoVJSL._AC_UL320_.jpg,,,,,,,,,,,https://www.amazon.eg/dp/B0GNN6JHDN,2026-03-28T13:32:41.113114
amazon,B09WTZKJF4,Car Sun Shade Front Windshield Accordion Reflective Harmful UV Rays Automotive Car Accessories Interior Visor Protector for Sun Protection Fits Most Vans SUVs (30 x 59 inches),,Automotive,,,,2.7,,,,,,,https://m.media-amazon.com/images/I/71Ht88de96L._AC_UL320_.jpg,https://m.media-amazon.com/images/I/71Ht88de96L._AC_UL320_.jpg,,,,,,,,,,,https://www.amazon.eg/dp/B09WTZKJF4,2026-03-28T13:32:41.113663
amazon,B0B1L45XZ9,"Super Drive Superdrive 800Amp Jumper Cables for Car Battery, Heavy Duty Automotive Booster Cables for Jump Starting Dead or Weak Batteries with Carrying Orange Plastic Box Included",,Automotive,EGP 560.00,EGP 672.00,,4.0,List:,,,,,,https://m.media-amazon.com/images/I/71P0tN1j-mL._AC_UL320_.jpg,https://m.media-amazon.com/images/I/71P0tN1j-mL._AC_UL320_.jpg,,,,,,,,,,,https://www.amazon.eg/dp/B0B1L45XZ9,2026-03-28T13:32:41.114261
amazon,B0977Z2Y55,Automotive Car Floor Mat,,Automotive,EGP 570.00,,,,,,,,,,https://m.media-amazon.com/images/I/51GSMIG3uIS._AC_UL320_.jpg,https://m.media-amazon.com/images/I/51GSMIG3uIS._AC_UL320_.jpg,,,,,,,,,,,https://www.amazon.eg/dp/B0977Z2Y55,2026-03-28T13:32:41.114744
amazon,B07NVVTWC9,Gm200 Paint Thickness Digital Car Coating Thickness Gauge Automotive Digital Portable Mini Painting Film Meter Tester Measure Gauge assorted colors,,Automotive,EGP 724.36,,,3.3,,,,,,,https://m.media-amazon.com/images/I/51CPrxSS0kL._AC_UL320_.jpg,https://m.media-amazon.com/images/I/51CPrxSS0kL._AC_UL320_.jpg,,,,,,,,,,,https://www.amazon.eg/dp/B07NVVTWC9,2026-03-28T13:32:41.115300
amazon,B0BWFPHL79,"USB Port to 12V Car Cigarette Lighter Socket, Female Converter Adapter Cord for Driving Recorder, Electronic Dog, Car Charger and Other Automotive Electronic Equipment",,Automotive,EGP 799.00,,,4.0,,,,,,,https://m.media-amazon.com/images/I/51ynuuxC7rL._AC_UL320_.jpg,https://m.media-amazon.com/images/I/51ynuuxC7rL._AC_UL320_.jpg,,,,,,,,,,,https://www.amazon.eg/dp/B0BWFPHL79,2026-03-28T13:32:41.115827
amazon,B097LKT4W9,"Automotive Car Accessory Combo of 7 Inch TFT HD Rearview Mirror Monitor, Black Parking Sensors, Camera",,Automotive,"EGP 1,800.00",,,,,,,,,,https://m.media-amazon.com/images/I/61ZmFX606QL._AC_UL320_.jpg,https://m.media-amazon.com/images/I/61ZmFX606QL._AC_UL320_.jpg,,,,,,,,,,,https://www.amazon.eg/dp/B097LKT4W9,2026-03-28T13:32:41.116263
