platform,asin,title,brand,category,current_price,original_price,discount,rating,reviews_count,prime_eligible,amazon_choice,sponsored,main_image,product_url,scraped_at
amazon,,"Car Clips Fastener Remover Tool - Door Panel Removal Tool Automotive Clip Puller Kit, Remove Rivet Fasteners Plier Push Pin Upholstery Repair Pry Tools",,Automotive,EGP 99.99,EGP 122.00,,4.2,List:,,,,https://m.media-amazon.com/images/I/41h+BCm9CkL._AC_UL320_.jpg,https://www.amazon.eg/dp/B09KGJVM2Q,2026-03-29T06:03:08.236231
amazon,,"Car Windscreen Sun Shade,Front Windshield Sunshade,Foldable Cover Visor Sunshades,Reflective UV Dust Protector,Automotive Ray Protection Block Parasol,Keep Your Vehicle Cool,Fit Various Sizes,150x70cm",,Automotive,EGP 128.73,,,3.9,,,,,https://m.media-amazon.com/images/I/71wfFyIg2TL._AC_UL320_.jpg,https://www.amazon.eg/dp/B09SH3VBPP,2026-03-29T06:03:08.236769
amazon,,"Automotive Oil Film Cleaning Brush, Oil Film Cleaning Brush for Car Windows, Anti-Rain Fog Glass Cleaning Board for Windshield, Car Glass Cleaner for Improved Clarity and Visibility (1Pack)",,Automotive,EGP 63.00,EGP 70.00,,2.9,Was:,,,,https://m.media-amazon.com/images/I/71003-Nbh4L._AC_UL320_.jpg,https://www.amazon.eg/dp/B0DLX3DYS9,2026-03-29T06:03:08.237451
amazon,,"Car Seat Belt Clip, 4PCS Vehicles Metal Tongue Belt Extension Splice Insert Buckle Alarm Stoppers, Safety Automotive Interior Accessories, Universal for SUV, Truck, RV",,Automotive,EGP 153.98,,,3.5,,,,,https://m.media-amazon.com/images/I/71Qg5Tfa-dL._AC_UL320_.jpg,https://www.amazon.eg/dp/B0F28SXZYD,2026-03-29T06:03:08.237954
amazon,,"10 PCS Car T5 3030 3SMD Led Lights, PCB Instrument Lights, 6000K Warning Lights, Vehicle Bulb Replacements, Automotive Lighting Tool, Universal for Most Cars, Trucks, SUVs (White)",,Automotive,EGP 114.00,,,5.0,,,,,https://m.media-amazon.com/images/I/710zYfwzMRL._AC_UL320_.jpg,https://www.amazon.eg/dp/B0CQQKV5HT,2026-03-29T06:03:08.238508
amazon,,"Bosch Car H307 Steel Rear Wiper Blade, 12 Inch Size, Black",,Automotive,EGP 192.00,,,4.5,,,,,https://m.media-amazon.com/images/I/41vRQ1PJ73L._AC_UL320_.jpg,https://www.amazon.eg/dp/B00ES5Q610,2026-03-29T06:03:08.239128
amazon,,"CHAVA Car Detailing Brush, 5 Pieces Automotive Clean Wheels Interior Outdoor Leather Air Fans, Emblems, Brushes (Black)",,Automotive,EGP 114.00,,,3.7,,,,,https://m.media-amazon.com/images/I/61KPwPoFjJL._AC_UL320_.jpg,https://www.amazon.eg/dp/B0B6FH9Q16,2026-03-29T06:03:08.239658
amazon,,"COSTAR Car Sun Shade Protector, Foldable Windshield Insulation Car Sun Shade for UV Protection Reflective Sunblocker Car Accessories for Pickup, Sedans, Trucks, SUVs, and More (Large Size)",,Automotive,EGP 90.75,,,3.2,,,,,https://m.media-amazon.com/images/I/61UgKRTe4OL._AC_UL320_.jpg,https://www.amazon.eg/dp/B0CLD3RNMG,2026-03-29T06:03:08.240193
amazon,,"Cleaning Gel for Car, Auto Detailing Putty for Dust Removal, Universal Crevice Cleaner Automotive Interior Cleaning Slime Mud, Car Accessories for Air Vents, Keyboard, PC, Laptops (Green)",,Automotive,EGP 58.86,,,4.0,,,,,https://m.media-amazon.com/images/I/71UyJzCgcfL._AC_UL320_.jpg,https://www.amazon.eg/dp/B0CH367WM1,2026-03-29T06:03:08.240712
amazon,,"Back Seat Cover for Car Trucks Van SUV,Waterproof Rear Bench Towel Seat Covers for Dogs and Kids,Automotive Backseat Protector (Black)",,Automotive,EGP 388.00,,,4.3,,,,,https://m.media-amazon.com/images/I/51C49yMe3AL._AC_UL320_.jpg,https://www.amazon.eg/dp/B0C6F4QTN2,2026-03-29T06:03:08.241308
amazon,,Car Cleaning Brush With Drill Attachment Tub Automotive Detailing Spin Scrubber Set (3 Pieces),,Automotive,EGP 122.70,EGP 171.00,,4.3,List:,,,,https://m.media-amazon.com/images/I/61Y7UwyEdmL._AC_UL320_.jpg,https://www.amazon.eg/dp/B098TYY984,2026-03-29T06:03:08.241951
amazon,,"YANGMING 10 Pieces Car Detail Brush Set, Car Cleaning Brush Automotive Detail Cleaning Brushes Fiber Auto Car Detailing Brush for Cleaning Wheels Engine Air Vent (5 Sizes)",,Automotive,EGP 271.00,,,4.0,,,,,https://m.media-amazon.com/images/I/61mSYH6o31L._AC_UL320_.jpg,https://www.amazon.eg/dp/B091FQDD8D,2026-03-29T06:03:08.242516
amazon,,LAUNCH Creader 3001 OBD2 Scanner Automotive Car Diagnostic Check Engine Light O2 Sensor Systems OBD Code Readers Scan Tool for All OBDII Protocol Cars Since 1996,,Automotive,"EGP 2,299.00",,,4.0,,,,,https://m.media-amazon.com/images/I/81KodmZ7KZL._AC_UL320_.jpg,https://www.amazon.eg/dp/B07D1KH9SC,2026-03-29T06:03:08.243028
amazon,,"Cleaning Gel for Car, Auto Detailing Putty for Dust Removal, Universal Crevice Cleaner Automotive Interior Cleaning Slime Mud, Car Accessories for Air Vents, Keyboard, PC, Laptops (Blue)",,Automotive,EGP 58.86,,,3.5,,,,,https://m.media-amazon.com/images/I/71lzGhvU3ML._AC_UL320_.jpg,https://www.amazon.eg/dp/B0CH36KMRM,2026-03-29T06:03:08.243595
amazon,,"Automotive Car Accessory Combo of 7 Inch TFT HD Rearview Mirror Monitor, Silver Parking Sensors, Camera",,Automotive,"EGP 1,750.00",,,4.0,,,,,https://m.media-amazon.com/images/I/61aB9bJIy2L._AC_UL320_.jpg,https://www.amazon.eg/dp/B097TQ1TZG,2026-03-29T06:03:08.244133
amazon,,"1 PC Car Windshield Sun Shade with Storage Pouch, 74.8 x 35.4 inches Foldable Automotive Interior Sun Protection Blocker, Car Front Window Visor Protector Cover (Silver)",,Automotive,EGP 120.00,,,3.6,,,,,https://m.media-amazon.com/images/I/61JEuVkYmZL._AC_UL320_.jpg,https://www.amazon.eg/dp/B0BXNNFMLF,2026-03-29T06:03:13.067052
amazon,,Car Kit Handsfree Wireless Bluetooth FM Transmitter Car Audio LCD MP3 Player with 3.1A Quick Charge Dual USB Car Charger,,Automotive,EGP 215.00,,,3.8,,,,,https://m.media-amazon.com/images/I/61W07RQtZFL._AC_UL320_.jpg,https://www.amazon.eg/dp/B0993W8ZZK,2026-03-29T06:03:13.067633
amazon,,"(8 Pcs) Black Car Door Protector Car Door Shock Absorber Stickers,Buffer Bumper Cushion Car Door Shock Absorbing Silicone Gaskets Automotive Door Gasket for Maruti Eeco",,Automotive,EGP 130.00,,,,,,,,https://m.media-amazon.com/images/I/61WZwdGDo1L._AC_UL320_.jpg,https://www.amazon.eg/dp/B09Y99YF4P,2026-03-29T06:03:13.068146
amazon,,"Car sun shade windshield front windshield reflective sunshade for vehicle blocks uv ray, foldable cover visor umbrella, automotive ray protection block parasol, keep your vehicle cool(25.5x49.2inch)",,Automotive,EGP 130.39,EGP 137.40,,3.6,Was:,,,,https://m.media-amazon.com/images/I/61tACESmDFL._AC_UL320_.jpg,https://www.amazon.eg/dp/B09D76W7SB,2026-03-29T06:03:13.068765
amazon,,"Automotive Oil Film Cleaning Brush, Car Glass Oil Film Cleaner, Glass Coating for Windshield, Car Glass Cleaning Brush with Reusable Foam Sprayer, Improves Clarity and Visibility ﻿",,Automotive,EGP 154.00,,,3.2,,,,,https://m.media-amazon.com/images/I/71xTlHt1opL._AC_UL320_.jpg,https://www.amazon.eg/dp/B0DCBQ6L5N,2026-03-29T06:03:13.069388
amazon,,"Car Interior Detailing Brush, Auto Interior Dust Brush, Car Interior Cleaning Tool for Automotive Dashboard Interior, Leather, Air Vent, Gap, Cup Holder,Keyboard(2pcs)",,Automotive,EGP 71.00,EGP 94.00,,3.4,List:,,,,https://m.media-amazon.com/images/I/61yhzykEMDL._AC_UL320_.jpg,https://www.amazon.eg/dp/B0BYDPHNTN,2026-03-29T06:03:13.070055
amazon,,"KW208 12V Car Battery Tester, Automotive Battery Load Tester, 100-2000 CCA Auto Cranking & Charging System Test, Display Diagnostic Checker Scan Tool Digital Battery Analyzer for Truck Marine SUV Boat",,Automotive,"EGP 1,699.00",,,4.4,,,,,https://m.media-amazon.com/images/I/811PSDujLTL._AC_UL320_.jpg,https://www.amazon.eg/dp/B08VRMP3LM,2026-03-29T06:03:13.070772
amazon,,50Pcs Black Plastic Rivet Push-Type Expansion Screw Fastener Clips 9mm for Car Automotive Parts,,Automotive,EGP 56.96,EGP 71.00,,5.0,List:,,,,https://m.media-amazon.com/images/I/51RU1pBd8uL._AC_UL320_.jpg,https://www.amazon.eg/dp/B0DHR92GKN,2026-03-29T06:03:13.071430
amazon,,"VRT 3D Chrome Emblem Automotive Car, Bike Badges Logo Self Adhesive Sticker (Batman, Black)",,Automotive,EGP 290.00,,,4.3,,,,,https://m.media-amazon.com/images/I/51FpYGs0+cL._AC_UL320_.jpg,https://www.amazon.eg/dp/B0CGVFTXSW,2026-03-29T06:03:13.071948
amazon,,"BELEY Digital Automotive Transmission Oil Tester - Car Automatic Transmission Oil Tester with 2.8"" screen and 800 mm hose Tests light transmission and temperature of various transmission fluids",,Automotive,"EGP 3,900.00","EGP 54,166.67",,4.2,(,,,,https://m.media-amazon.com/images/I/618oWYODl7L._AC_UL320_.jpg,https://www.amazon.eg/dp/B0CF1ZKGRL,2026-03-29T06:03:13.072600
amazon,,"Set of 4 Car Cleaning Brushes, Car Detailing Brush Set, Car Interior Cleaning Brushes, Soft Dust Brush, Car Interior Cleaning Tools, Brush for Dashboard, Air Outlet Gap",,Automotive,EGP 99.99,EGP 109.99,,3.8,Was:,,,,https://m.media-amazon.com/images/I/714CzCG72+L._AC_UL320_.jpg,https://www.amazon.eg/dp/B0CYYVCLM4,2026-03-29T06:03:13.073240
amazon,,"Automotive Oil Film Cleaning Brush, 2024 New Glass Oil Film Remover for Car, All in One Wipe On Oil Film Remover,Hydrophobic Glass Coating for Windshield ，Improves Clarity and Visibility",,Automotive,EGP 63.00,,,3.0,,,,,https://m.media-amazon.com/images/I/71qwJujm+wL._AC_UL320_.jpg,https://www.amazon.eg/dp/B0DCZJ2NDF,2026-03-29T06:03:13.073758
amazon,,"hartas Car Cleaning Brush, Clean Automotive Leather Interior Wheels Exterior Ventilation Grilles Emblems Cleaner Brushes, Black, 5 Pieces",,Automotive,EGP 141.33,,,3.6,,,,,https://m.media-amazon.com/images/I/61KPwPoFjJL._AC_UL320_.jpg,https://www.amazon.eg/dp/B0B6FTJBRV,2026-03-29T06:03:13.074341
amazon,,2Pcs Sunglasses Holder For Car Car Glasses Holder Sun Visor Sunglasses With Card Clip Vehicle Glasses Clips Sunglasses Holder With 180 Degree Rotational Ticket Card Clip Holder,,Automotive,EGP 107.00,,,4.1,,,,,https://m.media-amazon.com/images/I/61aGDGurdsL._AC_UL320_.jpg,https://www.amazon.eg/dp/B0CSFZK825,2026-03-29T06:03:13.074904
amazon,,"UCRAVO Pack of 2 Plastic Restorer for Cars, Proven Back to Black Trim Restore, Permanent Automotive Hydrophobic Ceramic Trim Coating, Instant Bring Plastic, Rubber, Vinyl Back to Life, Resists Water",,Automotive,EGP 185.00,,,1.0,,,,,https://m.media-amazon.com/images/I/81uBAOyixXL._AC_UL320_.jpg,https://www.amazon.eg/dp/B0DT65Q3TW,2026-03-29T06:03:13.075521
amazon,,"9Pcs Car Wash Cleaning Tools Kit Auto Care, Automotive Detail Brushes for Cleaning Wheels, Interior, Exterior, Leather, Air Vents, Emblems",,Automotive,EGP 484.50,,,1.0,,,,,https://m.media-amazon.com/images/I/61FIHce4u5L._AC_UL320_.jpg,https://www.amazon.eg/dp/B09NQ6DYCJ,2026-03-29T06:03:13.076047
amazon,,"30ML Crystal Coating Plastic Restoration,Car Plastic Restorer with Sponge,Plas/tic Trim Restorer Dashboard Cleaner,Automotive Interior Cleaner Cars,30ML Car Pl/astic Res/torer Black with Spo/nge(1PCS)",,Automotive,EGP 91.00,EGP 4.55,,2.6,(,,,,https://m.media-amazon.com/images/I/714mbexSEkL._AC_UL320_.jpg,https://www.amazon.eg/dp/B0FL13Y8PP,2026-03-29T06:03:13.076702
amazon,,"Automotive Hoody - Hoody Car Accessory Made of robust ABS,it offers an elegant Hoody cover for the transmission area, adds a modern touch to the interior, provides additional protection and facilitate",,Automotive,EGP 222.05,EGP 250.00,,,List:,,,,https://m.media-amazon.com/images/I/81jEstdFd1L._AC_UL320_.jpg,https://www.amazon.eg/dp/B0G9YF47L1,2026-03-29T06:03:13.077324
amazon,,"Se@t Car Floor Mats Set 5 Pieces Universal Fit, Anti Slip Backing, Easy to Clean, Durable Interior Protection for Most Se@t Models, Black Automotive Accessories, Sold by Magic Car Hub",,Automotive,EGP 600.00,,,,,,,,https://m.media-amazon.com/images/I/81K6uhcum+L._AC_UL320_.jpg,https://www.amazon.eg/dp/B0GQMVG5J6,2026-03-29T06:03:13.077801
amazon,,Car Glass Oil Film Remover|Automotive Oil Film Cleaning Brush|Oil Film Cleaning Brush| Oil Film Remover for Car Window|Car Glass Oil Film Cleaner|Glass Oil Film Remover for Car,,Automotive,EGP 59.00,EGP 75.00,,2.6,Was:,,,,https://m.media-amazon.com/images/I/71ULetw46rL._AC_UL320_.jpg,https://www.amazon.eg/dp/B0DQJV88R5,2026-03-29T06:03:13.078453
amazon,,Abro Carnauba Car Wax Super Gold Liquid 473ml,,Automotive,EGP 371.00,,,3.5,,,,,https://m.media-amazon.com/images/I/71uRWO+IeUL._AC_UL320_.jpg,https://www.amazon.eg/dp/B00N3XR0UO,2026-03-29T06:03:13.078995
amazon,,"2 Packs Car Window Sunshade Curtains, Foldable Suction Cup Auto Side Window Sun Visor Shield Sunshade Protector, Car Window Privacy Blackout UV Rays Heat Reflector for Breastfeeding, Taking a Nap",,Automotive,EGP 88.68,,,3.2,,,,,https://m.media-amazon.com/images/I/611CXWBFpxL._AC_UL320_.jpg,https://www.amazon.eg/dp/B0CQ4QJWTD,2026-03-29T06:03:13.079612
amazon,,Auto Pearl - Vehicle Roof Mount Rubber Antenna Mast Flexible Car Antenna with Anti-Theft Design and Car Wash Safe - Black -SwiftNew,,Automotive,EGP 175.00,,,3.2,,,,,https://m.media-amazon.com/images/I/51zqL+6xXbL._AC_UL320_.jpg,https://www.amazon.eg/dp/B012DDJLB0,2026-03-29T06:03:13.080207
amazon,,"Car Windshield Sun Shade Umbrella, Foldable Car Front Window Sunshade Umbrella for UV Ray Block & Sun Heat Protection, Automotive Windshield Sunshades Fit Most Vehicles (55""X31.5"")",,Automotive,EGP 177.00,,,1.0,,,,,https://m.media-amazon.com/images/I/71FnT9yyDPL._AC_UL320_.jpg,https://www.amazon.eg/dp/B09TDHVF8Q,2026-03-29T06:03:13.080744
amazon,,car sun shade windshield front windshield reflective sunshade for vehicle blocks uv ray foldable cover visor umbrella automotive ray protection block parasol keep your vehicle cool(31x53inch),,Automotive,EGP 140.00,,,3.6,,,,,https://m.media-amazon.com/images/I/61lJ-4rnPtL._AC_UL320_.jpg,https://www.amazon.eg/dp/B09D7C358Q,2026-03-29T06:03:16.691868
amazon,,"Trunk Organizer for Car Trunk Organizer and Storage,SUV Trunk Organizer Leather Storage, Cargo Box-Automotive Consoles Organizers-Multi-Compartment Adjustable Auto Grocery Storage Box",,Automotive,EGP 850.00,,,4.5,,,,,https://m.media-amazon.com/images/I/61DoPiAkyAL._AC_UL320_.jpg,https://www.amazon.eg/dp/B0C72PFL1P,2026-03-29T06:03:16.692435
amazon,,7 Inch TFT HD Rearview Mirror Monitor with 6 White Parking Sensors and Rearview Camera Automotive Car Accessory,,Automotive,"EGP 1,850.00",,,4.0,,,,,https://m.media-amazon.com/images/I/61p5sbzQueS._AC_UL320_.jpg,https://www.amazon.eg/dp/B0968XBJ9B,2026-03-29T06:03:16.692956
amazon,,"JUYUE SUV Car Windshield Sun Shade,Foldable Automotive Windshield Shade,Sunshades Car Umbrella for Windshield Easy to Store and Use Fits Windshields of Various Sizes",,Automotive,EGP 160.20,EGP 178.00,,2.6,List:,,,,https://m.media-amazon.com/images/I/61OvCJ0++0L._AC_UL320_.jpg,https://www.amazon.eg/dp/B096473TNX,2026-03-29T06:03:16.693571
amazon,,"Superdrive 600Amp Jumper Cables for Car Battery, Heavy Duty Automotive Booster Cables for Jump Starting Dead or Weak Batteries with Carrying Blue Plastic Box Included",,Automotive,EGP 445.00,EGP 540.00,,4.2,List:,,,,https://m.media-amazon.com/images/I/71AXJl9v45L._AC_UL320_.jpg,https://www.amazon.eg/dp/B0B2P9CMK1,2026-03-29T06:03:16.694227
amazon,,Fuse Tester Tool Automotive Circuit Voltage Tester 6V/12V/24V DC Long Wire Pen Style Electrical Probe with Bulb for Car Truck (Copper) - KaberTrade,,Automotive,EGP 199.00,,,5.0,,,,,https://m.media-amazon.com/images/I/51xnqwB5lTL._AC_UL320_.jpg,https://www.amazon.eg/dp/B0DPVXGG72,2026-03-29T06:03:16.694754
amazon,,"fashion mania Car Hood Decal Sticker, Racing Stripe Graphic Stickers for Auto Body Skirt Roof Hood Bumper, Automotive Exterior Decoration Vinyl Decal for Car SUV Truck, Car Accessories (Black)",,Automotive,EGP 398.00,,,,,,,,https://m.media-amazon.com/images/I/61gBxYlrT0L._AC_UL320_.jpg,https://www.amazon.eg/dp/B0FMCJM5R9,2026-03-29T06:03:16.695251
amazon,,"stymart Mechanic Stethoscope, Automotive Engine Diagnostic Sensitive Hearing Tool, Car Stethoscope Automotive Engine Diagnostic Tool for Cars, Trucks and Motorcycles",,Automotive,EGP 210.00,,,4.6,,,,,https://m.media-amazon.com/images/I/6119Sx7hPDL._AC_UL320_.jpg,https://www.amazon.eg/dp/B0C3MCMBLH,2026-03-29T06:03:16.695754
amazon,,"1 PC Car Interior Cleaning Tool Brush, Car Detailing Brushes, Soft Bristles Detailing Brush, Curved Design Dirt Dust Clean Brushes for Automotive Dashboard, Air Conditioner Vents (Yellow)",,Automotive,EGP 125.40,,,3.7,,,,,https://m.media-amazon.com/images/I/61oY9oB+rsL._AC_UL320_.jpg,https://www.amazon.eg/dp/B0BQXXXLWC,2026-03-29T06:03:16.696310
amazon,,"Automotive Interior Dusting Brush, Car Interior Cleaning Soft Brushes, Car Interior Beauty Brush, Suitable for Cleaning Car Interior, Dashboard, Air Conditioning Vents, Leather, Keyboard (1 Pack)",,Automotive,EGP 80.00,,,4.6,,,,,https://m.media-amazon.com/images/I/61GxdPCFS8L._AC_UL320_.jpg,https://www.amazon.eg/dp/B0DL3LBZBX,2026-03-29T06:03:16.696807
amazon,,"Minimalist Car Windshield Sunshade - Black, Universal Fit, Spring Structure, Military-Grade Durability, Protects Interior from Sun Rays & Heat Damage",,Automotive,EGP 130.00,,,4.2,,,,,https://m.media-amazon.com/images/I/71sL6kb9cLL._AC_UL320_.jpg,https://www.amazon.eg/dp/B0CWS46T3D,2026-03-29T06:03:16.697351
amazon,,"300Amp Jumper Cables for Car Battery, Heavy Duty Automotive Booster Cables for Jump Starting Dead or Weak Batteries with Carrying Bag Included",,Automotive,EGP 271.79,,,3.7,,,,,https://m.media-amazon.com/images/I/712bh-IxBpL._AC_UL320_.jpg,https://www.amazon.eg/dp/B08WJLDHXV,2026-03-29T06:03:16.697907
amazon,,"Super Soft Microfiber Car Duster with Handle Car Cleaning Brush for Wet & Dry Car Washing Kit, Car Dust Cleaner Brush Car Accessories Exterior and Interior Car Cleaning Kit (Car Duster)",,Automotive,EGP 129.00,,,3.9,,,,,https://m.media-amazon.com/images/I/51Mes3aiRbL._AC_UL320_.jpg,https://www.amazon.eg/dp/B0CF5TVF2W,2026-03-29T06:03:16.698462
amazon,,Car Sun Shade Front Windshield Accordion Reflective Harmful UV Rays Automotive Car Accessories Interior Visor Protector for Sun Protection Fits Most Vans SUVs (30 x 59 inches),,Automotive,,,,2.7,,,,,https://m.media-amazon.com/images/I/71Ht88de96L._AC_UL320_.jpg,https://www.amazon.eg/dp/B09WTZKJF4,2026-03-29T06:03:16.699268
amazon,,"Generic Large cargo mat for all weather protection universal fit, premium quality trimmable black automotive,trunk liner fits most cars, suvs, and trucks - 144 cm",,Automotive,,,,4.1,,,,,https://m.media-amazon.com/images/I/71XLz7aLh9L._AC_UL320_.jpg,https://www.amazon.eg/dp/B0BXB6CSFG,2026-03-29T06:03:16.699698
amazon,,"Crystal Coating for Car, 2026 New Plastic Parts Crystals Coating, Upgrade Plastics Parts Crystal Coating Plastic Restorer with Spong, Coatings Agent for Automotive Plastics (1Set)",,Automotive,EGP 115.00,EGP 139.00,,3.1,Was:,,,,https://m.media-amazon.com/images/I/61OTAnKvtPL._AC_UL320_.jpg,https://www.amazon.eg/dp/B0FXZT3TKK,2026-03-29T06:03:16.700342
amazon,,Automotive Car Floor Mat,,Automotive,EGP 570.00,,,,,,,,https://m.media-amazon.com/images/I/51GSMIG3uIS._AC_UL320_.jpg,https://www.amazon.eg/dp/B0977Z2Y55,2026-03-29T06:03:16.700821
amazon,,"Automotive Car Accessory Combo of 7 Inch TFT HD Rearview Mirror Monitor, Black Parking Sensors, Camera",,Automotive,"EGP 1,800.00",,,,,,,,https://m.media-amazon.com/images/I/61ZmFX606QL._AC_UL320_.jpg,https://www.amazon.eg/dp/B097LKT4W9,2026-03-29T06:03:16.701293
amazon,,"Plastics Repair Agent for Cars, Automotive Interior Plastic Part Ceramic Coating, 50ml with Sponge and Nozzle, Resists Water, UV Rays, Dirt",,Automotive,EGP 124.00,,,,,,,,https://m.media-amazon.com/images/I/61MDJVoVJSL._AC_UL320_.jpg,https://www.amazon.eg/dp/B0GNN6JHDN,2026-03-29T06:03:16.701747
amazon,,Auto Mechanics Stethoscope Car Engine Block Diagnostic Automotive Hearing Tool,,Automotive,EGP 240.00,,,4.4,,,,,https://m.media-amazon.com/images/I/61iam+21QoL._AC_UL320_.jpg,https://www.amazon.eg/dp/B078NP9MQP,2026-03-29T06:03:16.702300
amazon,,"FOXWELL Car Scanner NT604 Elite OBD2 Scanner ABS SRS Transmission, Check Engine Code Reader for Cars and Trucks, Diagnostic Scan Tool with SRS Airbag, Automotive Diagnostic Tool with Live Data",,Automotive,"EGP 17,999.00",,,4.3,,,,,https://m.media-amazon.com/images/I/71FhW3BdPNL._AC_UL320_.jpg,https://www.amazon.eg/dp/B08PFJMTY3,2026-03-29T06:03:16.702809
amazon,,"Car Detailing Brush Set, Includes 5 Pcs Automotive Detail Brushes, 2 Pcs Car Air Condition Duster, Car Wheels Exterior Interior Detail Cleaning Brushes Kit for Car Air Vents Dashboard Emblems Engine",,Automotive,EGP 327.00,,,3.7,,,,,https://m.media-amazon.com/images/I/71956FNR34L._AC_UL320_.jpg,https://www.amazon.eg/dp/B0BW9MJQ6X,2026-03-29T06:03:16.703366
amazon,,"USB Port to 12V Car Cigarette Lighter Socket, Female Converter Adapter Cord for Driving Recorder, Electronic Dog, Car Charger and Other Automotive Electronic Equipment",,Automotive,EGP 799.00,,,4.0,,,,,https://m.media-amazon.com/images/I/51ynuuxC7rL._AC_UL320_.jpg,https://www.amazon.eg/dp/B0BWFPHL79,2026-03-29T06:03:16.703865
amazon,,"Car Gear Shift Knob Cover Set Soft Silicone Anti-Skid Car Gear Shift Knob Cover, Handbrake for Car, Automotive, Black - SACAR",,Automotive,EGP 179.00,,,,,,,,https://m.media-amazon.com/images/I/31FmXhj3h+L._AC_UL320_.jpg,https://www.amazon.eg/dp/B0GLX9KKYV,2026-03-29T06:03:16.704340
amazon,,"QSHOP Pen Holder, Round Metal Mesh Desk Organizer for Office Home Study Table",,Office Products,EGP 34.07,EGP 44.09,,4.4,Was:,,,,https://m.media-amazon.com/images/I/71AyLT7DKSL._AC_UL320_.jpg,https://www.amazon.eg/dp/B0DDTQDPSY,2026-03-29T06:03:05.533906
amazon,,Office Desk Accessories 2pcs Computer Monitor Memo Board Computer Message Board Office Supplies for Women Men Computer Sticky Note Holder Home Office Accessories Office Desktop Message Office Decor,,Office Products,EGP 399.00,,,4.5,,,,,https://m.media-amazon.com/images/I/61yjorGIhAL._AC_UL320_.jpg,https://www.amazon.eg/dp/B0BRMX3SWH,2026-03-29T06:03:05.534476
amazon,,VAVSU Mesh Pen Holder Desktop Metal Pencil Compartment Case Organizer Accessories Storage Stand Office Home School Caddy Box Cards Rack(Black) (3 Compartment),,Office Products,EGP 119.00,,,4.2,,,,,https://m.media-amazon.com/images/I/71geIghNmmL._AC_UL320_.jpg,https://www.amazon.eg/dp/B08YRBMPCL,2026-03-29T06:03:05.535099
amazon,,"Mesh Pen Holder – Stylish Pencil Holder for Office Desk, Makeup Brush Organizer, Multipurpose Metal Pen Holder for Study Table & Workstation | Pink",,Office Products,EGP 46.02,,,3.8,,,,,https://m.media-amazon.com/images/I/71JwZLEsR2L._AC_UL320_.jpg,https://www.amazon.eg/dp/B0F8JDZ2JY,2026-03-29T06:03:05.535661
amazon,,Metal A4 Paper office Mesh Document Basket File Paper Tray Letter Organizer Holder Desktop Accessories-3 Tires [JS3001],,Office Products,EGP 294.50,,,4.1,,,,,https://m.media-amazon.com/images/I/714Y31YDMXL._AC_UL320_.jpg,https://www.amazon.eg/dp/B097CMQJ84,2026-03-29T06:03:05.536225
amazon,,Bi-Office Cork Board 60x45 cm,,Office Products,EGP 600.21,,,4.2,,,,,https://m.media-amazon.com/images/I/91ms3TkBBrL._AC_UL320_.jpg,https://www.amazon.eg/dp/B003AQP5VA,2026-03-29T06:03:05.536847
amazon,,ITODA Office Multi-Functional Desk Organiser Storage Rack Wooden Stationary Desk Tidy Desktop Business Card Pen Mobile Phone Remote Control Holder Storage for Home Office Supplies (Color B),,Office Products,EGP 550.00,,,4.0,,,,,https://m.media-amazon.com/images/I/613kpEVocmL._AC_UL320_.jpg,https://www.amazon.eg/dp/B07NV4FH45,2026-03-29T06:03:05.537352
amazon,,"KW-TRIO 5360R STAPLER, Full Strip, Office Products Stationary",,Office Products,EGP 399.00,,,,,,,,https://m.media-amazon.com/images/I/218Bv6dGaYL._AC_UL320_.jpg,https://www.amazon.eg/dp/B0DPD4Q1XK,2026-03-29T06:03:05.537849
amazon,,Littlesun Premium Comfort Seat Cushion – Non-Slip Orthopedic 100% Memory Foam Coccyx Cushion for Tailbone Pain – Cushion for Office Chair Car Seat – Back Pain & Sciatica Relief (Back cushion),,Office Products,EGP 334.00,,,3.9,,,,,https://m.media-amazon.com/images/I/71R1h1QS2RL._AC_UL320_.jpg,https://www.amazon.eg/dp/B07ZRSPXB3,2026-03-29T06:03:05.538353
amazon,,"Comfort Lumbar Support Pillow for Office Chair - Memory Foam Back Cushion for Chair, Car, Couch - Lumbar Pillow Promotes Better Posture, Back Pain Relief - Ideal for Gaming and Desk Chairs",,Office Products,EGP 444.00,,,5.0,,,,,https://m.media-amazon.com/images/I/71qxMusk-TL._AC_UL320_.jpg,https://www.amazon.eg/dp/B0GQHWW21D,2026-03-29T06:03:05.538875
amazon,,"Lifewit 25 PCS Drawer Organizer Set Clear Plastic Desk Drawer Dividers Trays Dresser Storage Bins Separation Box for Makeup, Jewelries and Gadgets, Bedroom, Bathroom, Office",,Office Products,EGP 501.99,EGP 515.48,,4.5,Was:,,,,https://m.media-amazon.com/images/I/71KHrR98z+L._AC_UL320_.jpg,https://www.amazon.eg/dp/B09GFJN27K,2026-03-29T06:03:05.539517
amazon,,"Leviatan Desk Organiser, Pen Holder, Pen Holder, Table Organiser Made of Metal, Office Shelf with Note Holder Mesh, 205 x 103 x 98 mm, Blue",,Office Products,EGP 154.00,,,4.5,,,,,https://m.media-amazon.com/images/I/71HeYM-CZmL._AC_UL320_.jpg,https://www.amazon.eg/dp/B082N12TL2,2026-03-29T06:03:05.540132
amazon,,"GKD Wooden Desk Organizer & Docking Station 6 in 1 with Mobile Stand | Table Organizer for Office & Home | Gift for Husband, Brother & Him | New Year Gift, Birthday Gift | Eco Friendly (Wood)",,Office Products,EGP 209.00,,,3.6,,,,,https://m.media-amazon.com/images/I/81FHg-1buNL._AC_UL320_.jpg,https://www.amazon.eg/dp/B0DDPYCXZF,2026-03-29T06:03:05.540731
amazon,,"Deli Office Accessories Metal Stapler Pins 1000 Pieces Set, 24/6 Size",,Office Products,EGP 24.00,,,4.5,,,,,https://m.media-amazon.com/images/I/515hNjFI1QL._AC_UL320_.jpg,https://www.amazon.eg/dp/B0BZVYNP17,2026-03-29T06:03:05.541242
amazon,,"Desk Tape Dispenser, Non-Skid Base Tape Roll Dispenser for School, Home, Office",,Office Products,EGP 445.00,,,4.5,,,,,https://m.media-amazon.com/images/I/61WxBQPJ0BL._AC_UL320_.jpg,https://www.amazon.eg/dp/B0B4X7RP3V,2026-03-29T06:03:05.541767
