platform,asin,title,brand,category,current_price,original_price,discount,rating,reviews_count,prime_eligible,amazon_choice,sponsored,main_image,product_url,scraped_at
amazon,,"ieLive Lint Remover - Pet Hair Remover Brush - Self-Cleaning Base - Double Sided Animal Hair Removal Tool - Perfect for Clothing, Furniture, Couch, Car Pet, Car Seat",,Pet Supplies,EGP 130.00,EGP 159.60,,3.3,Was:,,,,https://m.media-amazon.com/images/I/61HoMlMufaL._AC_UL320_.jpg,https://www.amazon.eg/dp/B096CVZX75,2026-05-15T05:01:05.655673
amazon,,"Aqua Dog 530ml Auto drinking water bottle for pets during sports, travel and walking, blue color",,Pet Supplies,EGP 250.00,,,,,,,,https://m.media-amazon.com/images/I/51EMEXhdJBS._AC_UL320_.jpg,https://www.amazon.eg/dp/B0993YYB9W,2026-05-15T05:01:05.655960
amazon,,Pet Hair Remover Glove - Gentle Pet Grooming Glove Brush - Efficient Deshedding Glove - Massage Mitt with Enhanced Five Finger Design - Perfect for Dogs & Cats with Long & Short Fur,,Pet Supplies,EGP 52.34,EGP 64.00,,4.7,List:,,,,https://m.media-amazon.com/images/I/61l2AvWrNkL._AC_UL320_.jpg,https://www.amazon.eg/dp/B091CWT68D,2026-05-15T05:01:05.656347
amazon,,"Pet Hair Remover Mitt- Grooming Glove for Horses,Long and Short Hair Dogs and Cats",,Pet Supplies,EGP 290.00,,,,,,,,https://m.media-amazon.com/images/I/81sA5HVREpL._AC_UL320_.jpg,https://www.amazon.eg/dp/B0G5J65BRK,2026-05-15T05:01:05.656659
amazon,,DAMIK Pet Hair Removal Glove: Reusable Hair Remover Mitt for Dogs & Cats - Electrostatic Pet Hair Remover Tool - Magic Brush for Furniture Sofas Clothing Carpets Car Seats,,Pet Supplies,EGP 139.00,,,2.8,,,,,https://m.media-amazon.com/images/I/91AAupE0V4L._AC_UL320_.jpg,https://www.amazon.eg/dp/B0G1193H7J,2026-05-15T05:01:05.656995
amazon,,Automatic Pet Food and Water Dispenser – Large Capacity – Practical Transparent Portion Control – Suitable for Dogs and Cats – Ideal for Daily Use with Random Colors (Rectangle Water Dispenser),,Pet Supplies,EGP 359.10,,,,,,,,https://m.media-amazon.com/images/I/61ubbdubqAL._AC_UL320_.jpg,https://www.amazon.eg/dp/B0GKHK9PRL,2026-05-15T05:01:05.657291
amazon,,Dog Carrier Backpack for Small Medium Large Dogs - Black,,Pet Supplies,EGP 430.00,,,3.3,,,,,https://m.media-amazon.com/images/I/71POkpJMPSL._AC_UL320_.jpg,https://www.amazon.eg/dp/B0B4T4TCT5,2026-05-15T05:01:05.657673
amazon,,"Generic Premium Daily K9 Dog Supplement Chews, Vitamin and Mineral Support Formula for All Breeds, Brown, 90 Pieces, with Storage Container (complementary For Dogs Probiotecs) from pets zone",,Pet Supplies,EGP 506.00,,,,,,,,https://m.media-amazon.com/images/I/31LGliXCeGL._AC_UL320_.jpg,https://www.amazon.eg/dp/B0FL7ZQX65,2026-05-15T05:01:05.657958
amazon,,"FuninCrea Dog Treat Bag, Dog Treat Pouch Bag with Built-in Poop Bag Dispenser & Adjustable Waistband, Multifunctional Dog Training Bag Puppy Treat Pouch for Dog Training, Outdoor Use (Blue)",,Pet Supplies,EGP 190.00,,,4.5,,,,,https://m.media-amazon.com/images/I/710sEFfNsSL._AC_UL320_.jpg,https://www.amazon.eg/dp/B0C1V3DF62,2026-05-15T05:01:05.658301
amazon,,"Dog Cat Puppy Bath Brush Scrubber, Shampoo Dispensing Massage Bathing Shower Brush Soft Silicone Grooming Deshedding Exfoliating Washing Hair Fur Comb For Cleaning Sensitive skin on Short Long Haired",,Pet Supplies,EGP 38.70,,,3.6,,,,,https://m.media-amazon.com/images/I/51hAkeVrWNL._AC_UL320_.jpg,https://www.amazon.eg/dp/B09SY6Z3HK,2026-05-15T05:01:05.658670
amazon,,MEKEET 1PCS Car Mesh Bag for Dog Multifunctional Dog Car Net Barrier with Auto Safety Mesh Stretchable 3 Layer Pet Dogs Car Driving Accessories for SUV Car Truck Pet Driving Organizer Safety Travel,,Pet Supplies,EGP 135.00,,,4.0,,,,,https://m.media-amazon.com/images/I/7197lvC0sBL._AC_UL320_.jpg,https://www.amazon.eg/dp/B0DR4TP7G4,2026-05-15T05:01:05.659010
amazon,,nunbell litter trapper mat. size 30 * 40cm,,Pet Supplies,EGP 215.00,,,5.0,,,,,https://m.media-amazon.com/images/I/61r+Tt7oXiL._AC_UL320_.jpg,https://www.amazon.eg/dp/B0B4KGXPX2,2026-05-15T05:01:05.659342
amazon,,Kennel for Pet Cat and Dog,,Pet Supplies,"EGP 1,999.00",,,3.8,,,,,https://m.media-amazon.com/images/I/71DVqaKzbEL._AC_UL320_.jpg,https://www.amazon.eg/dp/B09PRV8VBF,2026-05-15T05:01:05.659682
amazon,,"Super-G Lint Remover - Pet Hair Remover Brush - Blue, Plastic, Manual, Ideal for Clothing, Furniture, Couch, Car Pet & Seat - Easy to Store",,Pet Supplies,EGP 164.98,EGP 240.00,,3.4,Was:,,,,https://m.media-amazon.com/images/I/615TEt4B65L._AC_UL320_.jpg,https://www.amazon.eg/dp/B0922YYDFR,2026-05-15T05:01:05.660105
amazon,,Silicone Pets Waste Grabber for Cats & Dogs,,Pet Supplies,EGP 74.00,,,2.9,Another way to buy,,,,https://m.media-amazon.com/images/I/51iM7xP9ajL._AC_UL320_.jpg,https://www.amazon.eg/dp/B091DBGDHC,2026-05-15T05:01:05.660535
amazon,,"SUNNOW Dog Treat Pouch, Pet Treat Pouch for Dog Training Puppy Treat Pouches with Adjustable Waistband for Travel or Outdoor Use(Red)",,Pet Supplies,EGP 240.00,,,4.3,,,,,https://m.media-amazon.com/images/I/71IZgz+cKhL._AC_UL320_.jpg,https://www.amazon.eg/dp/B09J22PMJF,2026-05-15T05:01:05.660863
amazon,,"HERM SPRENGER Ultra-Plus Prong Dog Training Collar, 2.25 mm x 16"", Steel Chrome Plated Dog Prong Collar, Pinch Collar for Dogs, Dog Correction Collar, Dog Prong Training Collar, Dog Supplies",,Pet Supplies,EGP 700.00,,,4.5,,,,,https://m.media-amazon.com/images/I/6169u63wZXL._AC_UL320_.jpg,https://www.amazon.eg/dp/B0006L0UGC,2026-05-15T05:01:05.661193
amazon,,"Omega Numineral Pet Supplement,80Ml-White",,Pet Supplies,EGP 125.09,EGP 138.99,,4.3,Was:,,,,https://m.media-amazon.com/images/I/51AbI7G1GfL._AC_UL320_.jpg,https://www.amazon.eg/dp/B0CJJQWCW3,2026-05-15T05:01:05.661576
amazon,,Bravecto Tablet Medium Size Dog10-20Kg,,Pet Supplies,"EGP 2,240.00",,,,,,,,https://m.media-amazon.com/images/I/51sZg6tfOkL._AC_UL320_.jpg,https://www.amazon.eg/dp/B0DT6R32JK,2026-05-15T05:01:05.661842
amazon,,"Poo Plucker Dog Poop Picker with Built-in Bag Dispenser – Hygienic Pet Waste Grabber, Hands-Free Poop Scooper for Dogs, Portable & Easy Clean-Up Tool with Bag Storage in Handle",,Pet Supplies,EGP 599.00,EGP 699.00,,,Was:,,,,https://m.media-amazon.com/images/I/71n0pN+ddHL._AC_UL320_.jpg,https://www.amazon.eg/dp/B0FZNVSBR1,2026-05-15T05:01:05.662177
amazon,,SUPERBEAR Pet Grooming Gloves for Dog Cat Gentle Deshedding Brush Glove Efficient Pet Hair Remover Glove for Dogs Cats with Long or Short Fur Massage Mitt with 259 Silicone Tips 1Pair,,Pet Supplies,EGP 102.00,,,3.9,,,,,https://m.media-amazon.com/images/I/71qOKve6HDL._AC_UL320_.jpg,https://www.amazon.eg/dp/B086DQW21R,2026-05-15T05:01:05.662531
amazon,,OMNI GUARD Deodorizing Pet Spray 225 ml,,Pet Supplies,EGP 230.00,,,5.0,,,,,https://m.media-amazon.com/images/I/71R4GRAeyrL._AC_UL320_.jpg,https://www.amazon.eg/dp/B091BYLYDF,2026-05-15T05:01:05.662865
amazon,,"SHINE HAI Dog Car Seat Cover, Waterproof & Scratch Proof & Nonslip Back Seat Cover, Dog Travel Hammock with Seat Anchors, Machine Washable, Durable, Universal fits All Cars, Pet Cover(Black)",,Pet Supplies,EGP 495.00,,,4.6,,,,,https://m.media-amazon.com/images/I/81JlDwk6WiL._AC_UL320_.jpg,https://www.amazon.eg/dp/B071FF8LMK,2026-05-15T05:01:05.663203
amazon,,"Calcium Bite for Dogs - Vitamins and Minerals - All Ages - Helps Clean Dog Teeth, 12.4",,Pet Supplies,EGP 285.00,,,,,,,,https://m.media-amazon.com/images/I/51j30X9A0zL._AC_UL320_.jpg,https://www.amazon.eg/dp/B09XLVXCYQ,2026-05-15T05:01:05.663513
amazon,,"LZRS Oak Wood Foldable Pet Gate,Wooden Dog Gate,Cat Gate,Pet Gate with Pet Collar for House Doorway Stairs,Freestanding Indoor Outdoor Gate Safety Fence，2 Panel 24""-Grey",,Pet Supplies,"EGP 1,942.56",,,4.6,,,,,https://m.media-amazon.com/images/I/619t25FGLhL._AC_UL320_.jpg,https://www.amazon.eg/dp/B092VLBZSY,2026-05-15T05:01:05.663834
amazon,,Pets Republic urine off spray 236 ml,,Pet Supplies,EGP 224.98,,,3.4,,,,,https://m.media-amazon.com/images/I/51llCMsSLyL._AC_UL320_.jpg,https://www.amazon.eg/dp/B091DN7VHJ,2026-05-15T05:01:05.664161
amazon,,Puppy Potty Pet Toilet Trainer Set Dog Indoor House Litter Tray 47 / 34 cm,,Pet Supplies,EGP 495.00,,,4.3,,,,,https://m.media-amazon.com/images/I/713a-BeBODL._AC_UL320_.jpg,https://www.amazon.eg/dp/B091HPWY7W,2026-05-15T05:01:05.664507
amazon,,Automatic Pet Food Dispenser Water Dispenser - Random Colors Send,,Pet Supplies,"EGP 1,050.00",,,,,,,,https://m.media-amazon.com/images/I/41feaRdAKjL._AC_UL320_.jpg,https://www.amazon.eg/dp/B0GNNN5PYK,2026-05-15T05:01:05.664797
amazon,,"Dog Stairs, Wooden 4-Step Dog Ramp for Small Medium Older Cat, Puppy Essentials Pet Step Ladder for High Bed Couch Car",,Pet Supplies,"EGP 2,557.00",,,3.9,,,,,https://m.media-amazon.com/images/I/71suRAU8NTL._AC_UL320_.jpg,https://www.amazon.eg/dp/B0FC2FSBK8,2026-05-15T05:01:09.823443
amazon,,"Metal Pet Cage for Indoor Outdoor Crate, 10 Piece",,Pet Supplies,EGP 712.00,EGP 800.00,,4.4,Was:,,,,https://m.media-amazon.com/images/I/71HuQpE0NRL._AC_UL320_.jpg,https://www.amazon.eg/dp/B09FFR389J,2026-05-15T05:01:09.823840
amazon,,"Veeconn Dog Grooming Kit with 4 Cutter Heads and 4 Guide Combs, Low Noise, Electric Quiet, USB Rechargeable, Trims Dog's Hair Around Paws, Eyes, Ears, Face, Rump",,Pet Supplies,"EGP 2,450.00",,,4.3,,,,,https://m.media-amazon.com/images/I/61UhaX2liOL._AC_UL320_.jpg,https://www.amazon.eg/dp/B09FS5ZVXK,2026-05-15T05:01:09.824175
amazon,,Deshedding Pet Hair Remover Massage Brush Gloves (Right Hand),,Pet Supplies,EGP 69.23,EGP 76.00,,4.5,List:,,,,https://m.media-amazon.com/images/I/61gHdP3Lu6L._AC_UL320_.jpg,https://www.amazon.eg/dp/B091CGJ65N,2026-05-15T05:01:09.824617
amazon,,Pets Republic Powder Shampoo Caramel Marshmallow 200g,,Pet Supplies,EGP 120.00,,,3.0,,,,,https://m.media-amazon.com/images/I/51WzvZD8rvL._AC_UL320_.jpg,https://www.amazon.eg/dp/B09XR5FZ71,2026-05-15T05:01:09.824959
amazon,,YenT Pet Grooming Glove Gentle Deshedding Brush Fur Gloves Massage Tool Dog Cat Hair Remover,,Pet Supplies,EGP 54.00,,,3.9,,,,,https://m.media-amazon.com/images/I/61pq+d2yv3L._AC_UL320_.jpg,https://www.amazon.eg/dp/B091CTHM8R,2026-05-15T05:01:09.825317
amazon,,"Pet food container, airtight box, transparent storage container, organizer, dispenser, airtight lid pet food container, kitchen pantry, grains, rice flour, cat food (1, Milliliters, 3600)",,Pet Supplies,EGP 395.25,,,,,,,,https://m.media-amazon.com/images/I/61yPEzOB2KL._AC_UL320_.jpg,https://www.amazon.eg/dp/B0GGBL87Q1,2026-05-15T05:01:09.825641
amazon,,Bayer Drontal Round and Tapewormer for Dogs - 6 Tablets,,Pet Supplies,,,,4.1,,,,,https://m.media-amazon.com/images/I/61-GlZlL+gL._AC_UL320_.jpg,https://www.amazon.eg/dp/B091J9WDTF,2026-05-15T05:01:09.825955
amazon,,Transparent Square Plastic Bowl Pet Feeder Double Dish For Food and Water For Dogs and Cats (Red),,Pet Supplies,EGP 79.99,,,,,,,,https://m.media-amazon.com/images/I/31PLG7VO0QL._AC_UL320_.jpg,https://www.amazon.eg/dp/B0G2J73752,2026-05-15T05:01:09.826260
amazon,,Dog Training Urine Pad Super Absorbent 60x45CM Pet Diapers,,Pet Supplies,EGP 440.00,,,4.5,,,,,https://m.media-amazon.com/images/I/6184axCVe0L._AC_UL320_.jpg,https://www.amazon.eg/dp/B091C25GMJ,2026-05-15T05:01:09.826639
amazon,,High Quality Stainless Steel Pet Bowl – Rustproof & Stable Rubber Base – Safe & Healthy for Dogs & Cats – Easy to Wash for Daily Use (Size 26),,Pet Supplies,EGP 179.10,EGP 199.00,,5.0,Was:,,,,https://m.media-amazon.com/images/I/71yys4ILP0L._AC_UL320_.jpg,https://www.amazon.eg/dp/B0GJPYYQCB,2026-05-15T05:01:09.827041
amazon,,The X Files Movie - DVD,,Movies & TV,,,,3.5,,,,,https://m.media-amazon.com/images/I/41ygUrlvilS._AC_UY218_.jpg,https://www.amazon.eg/dp/B099D9LX43,2026-05-15T05:01:07.978907
amazon,,Silly Movie 2.0: - Keine Info -,,Movies & TV,,,,3.5,,,,,https://m.media-amazon.com/images/I/51b738fReiL._AC_UY218_.jpg,https://www.amazon.eg/dp/B0013IJ2DE,2026-05-15T05:01:07.979395
amazon,,8-Movie Spaghetti Western Collection,,Movies & TV,,,,3.6,,,,,https://m.media-amazon.com/images/I/91tV2-92tGL._AC_UY218_.jpg,https://www.amazon.eg/dp/B006ZL1PCK,2026-05-15T05:01:07.979879
amazon,,DOC MARTIN: THE MOVIES,,Movies & TV,,,,4.6,,,,,https://m.media-amazon.com/images/I/917ejrcoAyL._AC_UY218_.jpg,https://www.amazon.eg/dp/B0050N0UR0,2026-05-15T05:01:07.980334
amazon,,E1 ENTERTAINMENT URUSEI YATSURA TV 30,,Movies & TV,,,,5.0,,,,,https://m.media-amazon.com/images/I/51FQH81JMXL._AC_UY218_.jpg,https://www.amazon.eg/dp/B00095VKCI,2026-05-15T05:01:07.980706
amazon,,NEW Simpsons The Movie - Simpsons The Movie (Blu-ray),,Movies & TV,,,,4.6,,,,,https://m.media-amazon.com/images/I/81WwBV9N0CL._AC_UY218_.jpg,https://www.amazon.eg/dp/B000WGYMD8,2026-05-15T05:01:07.981100
amazon,,Mom Complete TV Series DVD Season 1-7,,Movies & TV,,,,4.2,,,,,https://m.media-amazon.com/images/I/61EDHPkR4yL._AC_UY218_.jpg,https://www.amazon.eg/dp/B08WF2T9NJ,2026-05-15T05:01:07.981570
amazon,,AMOS 'n ANDY Show ALL 74 TV Shows DIGITALLY RESTORED,,Movies & TV,,,,4.3,,,,,https://m.media-amazon.com/images/I/51OgZVdWGCL._AC_UY218_.jpg,https://www.amazon.eg/dp/B004I1BEHU,2026-05-15T05:01:07.982001
amazon,,Lawnmower Man (Widescreen),,Movies & TV,,,,4.6,,,,,https://m.media-amazon.com/images/I/51T6R15Q20L._AC_UY218_.jpg,https://www.amazon.eg/dp/6304604572,2026-05-15T05:01:07.982374
amazon,,Absolute Boyfriend /Zettai Kareshi Japanese Tv Drama Dvd English Sub Digipak Boxset,,Movies & TV,,,,4.1,,,,,https://m.media-amazon.com/images/I/51S8sLHjEEL._AC_UY218_.jpg,https://www.amazon.eg/dp/B003KQXJ0E,2026-05-15T05:01:07.982745
amazon,,Rudolph The Red-Nosed Reindeer - The Original TV Classic,,Movies & TV,,,,4.4,,,,,https://m.media-amazon.com/images/I/51HBX9SBTML._AC_UY218_.jpg,https://www.amazon.eg/dp/B000A345E4,2026-05-15T05:01:07.983197
amazon,,Shark Tale DVD and Club Oscar karaoke CD,,Movies & TV,,,,3.7,,,,,https://m.media-amazon.com/images/I/31yP5PLY5aL._AC_UY218_.jpg,https://www.amazon.eg/dp/B002R13MF0,2026-05-15T05:01:07.983564
amazon,,Universal Studios Fast & Furious: The Ultimate Ride Collection [Blu-Ray] 1-7,,Movies & TV,,,,4.7,,,,,https://m.media-amazon.com/images/I/819gklN2eAL._AC_UY218_.jpg,https://www.amazon.eg/dp/B01N32H7KI,2026-05-15T05:01:07.983937
amazon,,Happy Days: Season 4,,Movies & TV,,,,4.7,,,,,https://m.media-amazon.com/images/I/71F6tqOQxsL._AC_UY218_.jpg,https://www.amazon.eg/dp/B001E6JC26,2026-05-15T05:01:07.984341
amazon,,Dr. Dolittle 5 (d-t-v),,Movies & TV,,,,4.8,,,,,https://m.media-amazon.com/images/I/91IMlnyGxjL._AC_UY218_.jpg,https://www.amazon.eg/dp/B001US0OU2,2026-05-15T05:01:07.984712
amazon,,Van Halen Story: Early Years [DVD],,Movies & TV,,,,4.3,,,,,https://m.media-amazon.com/images/I/714NQbLJ1FL._AC_UY218_.jpg,https://www.amazon.eg/dp/B0000DJYPW,2026-05-15T05:01:07.985155
amazon,,Veep: Season 1,,Movies & TV,,,,4.1,,,,,https://m.media-amazon.com/images/I/81JigvFjkoL._AC_UY218_.jpg,https://www.amazon.eg/dp/B008BLCP0S,2026-05-15T05:01:11.390148
amazon,,Tales from The Crypt Completes Series (Spanish Release) Historias de la Cripta Serie Completa 14 DVDs + 10 Postcards,,Movies & TV,,,,,,,,,https://m.media-amazon.com/images/I/71U4o0FC5oL._AC_UY218_.jpg,https://www.amazon.eg/dp/B076F3YZRS,2026-05-15T05:01:11.390471
amazon,,Lark Rise to Candleford: The Complete Collection (DVD),,Movies & TV,,,,4.6,,,,,https://m.media-amazon.com/images/I/91fbugERCzL._AC_UY218_.jpg,https://www.amazon.eg/dp/B003WEAW18,2026-05-15T05:01:11.390900
amazon,,The Wild Wild WEST (Jim West) Season 1 -Part 2-5 DVD - Spanish Import - Region 2 - PAL Format,,Movies & TV,,,,3.8,,,,,https://m.media-amazon.com/images/I/51DbAGZ0wCL._AC_UY218_.jpg,https://www.amazon.eg/dp/B00URMQD20,2026-05-15T05:01:11.391277
amazon,,Arrow: Season 8 [Blu-ray] [2019] [2020] [Region Free],,Movies & TV,,,,4.5,,,,,https://m.media-amazon.com/images/I/81K+W18qVVL._AC_UY218_.jpg,https://www.amazon.eg/dp/B0833VRPKL,2026-05-15T05:01:11.391651
amazon,,Michael Clayton (Widescreen Edition),,Movies & TV,,,,4.0,,,,,https://m.media-amazon.com/images/I/71YPPuF8OfL._AC_UY218_.jpg,https://www.amazon.eg/dp/B00121QGPY,2026-05-15T05:01:11.392165
amazon,,The King of Queens 2nd Season DVD Brand New,,Movies & TV,,,,,,,,,https://m.media-amazon.com/images/I/51G-hkeE54L._AC_UY218_.jpg,https://www.amazon.eg/dp/B00A2JH3MC,2026-05-15T05:01:11.392473
amazon,,The Spectacular Spider-Man (The Complete Series),,Movies & TV,,,,4.2,,,,,https://m.media-amazon.com/images/I/81Fchk4gJVL._AC_UY218_.jpg,https://www.amazon.eg/dp/B01K277DMI,2026-05-15T05:01:11.392843
amazon,,Augsburger Puppenkiste: Der Löwe ist los + Kommt ein Löwe geflogen (Doppel Edition 2 DVDs),,Movies & TV,,,,4.6,,,,,https://m.media-amazon.com/images/I/91c8ehbXCjL._AC_UY218_.jpg,https://www.amazon.eg/dp/B000MCH3UQ,2026-05-15T05:01:11.393260
amazon,,Remington Steele: Season 3 [DVD] [1983] [Region 1] [US Import] [NTSC],,Movies & TV,,,,4.3,,,,,https://m.media-amazon.com/images/I/61N-Nw003pL._AC_UY218_.jpg,https://www.amazon.eg/dp/B000E6ESC6,2026-05-15T05:01:11.393632
amazon,,"The Fugitive: The Fourth and Final Season, Volume Two",,Movies & TV,,,,4.7,,,,,https://m.media-amazon.com/images/I/71lYRU49JFL._AC_UY218_.jpg,https://www.amazon.eg/dp/B004FECNJ8,2026-05-15T05:01:11.394060
amazon,,The Big Bang Theory: The Complete Series (Limited,,Movies & TV,,,,4.8,,,,,https://m.media-amazon.com/images/I/81CQ8Q-wD2L._AC_UY218_.jpg,https://www.amazon.eg/dp/B07QLB7H7W,2026-05-15T05:01:11.394427
amazon,,Velvet - 3ª Temporada - Audio and subtitles in Spanish,,Movies & TV,,,,3.8,,,,,https://m.media-amazon.com/images/I/81yIrZoklcL._AC_UY218_.jpg,https://www.amazon.eg/dp/B0197ZVUWU,2026-05-15T05:01:11.394919
amazon,,The Hunger Games: Complete 4 Film Collection,,Movies & TV,,,,4.8,,,,,https://m.media-amazon.com/images/I/81dOpurl0mL._AC_UY218_.jpg,https://www.amazon.eg/dp/B0189HKELU,2026-05-15T05:01:11.395436
amazon,,2entertain Horrible Histories - Horrible Christmas [DVD] [2015],,Movies & TV,,,,4.4,,,,,https://m.media-amazon.com/images/I/611GIoer6sL._AC_UY218_.jpg,https://www.amazon.eg/dp/B015J2MRAY,2026-05-15T05:01:11.395815
amazon,,ZOMBIE CLASSICS (1932-1981) (DVD) (2DISCS),,Movies & TV,,,,,,,,,https://m.media-amazon.com/images/I/71pdzof-GHL._AC_UY218_.jpg,https://www.amazon.eg/dp/B00AQ6ANL4,2026-05-15T05:01:11.396155
amazon,,BIGGEST LOSER:BOOT CAMP,,Movies & TV,,,,4.2,,,,,https://m.media-amazon.com/images/I/81U5Jq10YlL._AC_UY218_.jpg,https://www.amazon.eg/dp/B001GP5TLS,2026-05-15T05:01:16.046827
amazon,,The Lost World Season 1 Vol 1 (3 DVDs) (Region 2),,Movies & TV,,,,3.1,,,,,https://m.media-amazon.com/images/I/61Vn+Ue2c6L._AC_UY218_.jpg,https://www.amazon.eg/dp/B010E4MN5G,2026-05-15T05:01:16.047241
amazon,,Christie's Miss Marple - Season 3 [Blu-ray] [UK Region Spanish Import],,Movies & TV,,,,,,,,,https://m.media-amazon.com/images/I/71+H1N-3xYL._AC_UY218_.jpg,https://www.amazon.eg/dp/B009YRMW0G,2026-05-15T05:01:16.047549
amazon,,Jazzercise: Burlesque,,Movies & TV,,,,4.1,,,,,https://m.media-amazon.com/images/I/81SKUKUdqkL._AC_UY218_.jpg,https://www.amazon.eg/dp/B007QYB32M,2026-05-15T05:01:16.047958
amazon,,Copper season 1 [Blu-ray] [UK Region Spanish Import],,Movies & TV,,,,,,,,,https://m.media-amazon.com/images/I/71k6Z7TlyiL._AC_UY218_.jpg,https://www.amazon.eg/dp/B00FC3HA6M,2026-05-15T05:01:16.048263
amazon,,Cleopatra 2525 - Complete Series,,Movies & TV,,,,4.5,,,,,https://m.media-amazon.com/images/I/710JV--HeaL._AC_UY218_.jpg,https://www.amazon.eg/dp/B0009JE6FM,2026-05-15T05:01:16.048682
amazon,,Car 54 Where Are You: Complete First Season,,Movies & TV,,,,,,,,,https://m.media-amazon.com/images/I/41Ky3aLL+tL._AC_UY218_.jpg,https://www.amazon.eg/dp/B004SZWNBM,2026-05-15T05:01:16.049004
amazon,,Judge John Deed: Season 3,,Movies & TV,,,,4.3,,,,,https://m.media-amazon.com/images/I/81--u59igPL._AC_UY218_.jpg,https://www.amazon.eg/dp/B004D2GMQC,2026-05-15T05:01:16.049414
amazon,,Nova: Making Stuff,,Movies & TV,,,,4.5,,,,,https://m.media-amazon.com/images/I/71FHAR2p+tL._AC_UY218_.jpg,https://www.amazon.eg/dp/B004AR4WIK,2026-05-15T05:01:16.049778
amazon,,Visions of France: Provence and The Riviera,,Movies & TV,,,,3.6,,,,,https://m.media-amazon.com/images/I/81QWZhbLlOL._AC_UY218_.jpg,https://www.amazon.eg/dp/B000E0OBEM,2026-05-15T05:01:16.050151
amazon,,Agatha Christie's Miss Marple - Season 2 [Blu-ray] [UK Region Spanish Import],,Movies & TV,,,,,,,,,https://m.media-amazon.com/images/I/71VUYijSLIL._AC_UY218_.jpg,https://www.amazon.eg/dp/B009JVWQ6M,2026-05-15T05:01:16.050460
amazon,,Cagney and Lacey Season 1 (Spanish Release) Cagney y Lacey - Volumen 1,,Movies & TV,,,,3.4,,,,,https://m.media-amazon.com/images/I/61SqFsqMqiL._AC_UY218_.jpg,https://www.amazon.eg/dp/B07939BS8P,2026-05-15T05:01:16.050828
amazon,,"Tales of Tomorrow, Collection 3",,Movies & TV,,,,4.0,,,,,https://m.media-amazon.com/images/I/81QfrTrq60L._AC_UY218_.jpg,https://www.amazon.eg/dp/B000UYN9M2,2026-05-15T05:01:16.051255
amazon,,Sweet Dreams,,Movies & TV,,,,4.5,,,,,https://m.media-amazon.com/images/I/91YFjHuMyHL._AC_UY218_.jpg,https://www.amazon.eg/dp/B004QLX0UG,2026-05-15T05:01:16.051617
amazon,,Six Feet Under - The Complete Fifth Season,,Movies & TV,,,,4.4,,,,,https://m.media-amazon.com/images/I/61fFj9ibmgL._AC_UY218_.jpg,https://www.amazon.eg/dp/B000E6EK42,2026-05-15T05:01:16.052045
amazon,,Tracy Anderson: Perfect Design Series Sequence 1,,Movies & TV,,,,4.1,,,,,https://m.media-amazon.com/images/I/51UdYPehDnL._AC_UY218_.jpg,https://www.amazon.eg/dp/B00D2UMHMO,2026-05-15T05:01:16.052431
amazon,,"Fangor 1080P HD WiFi Bluetooth Projector, 5500 Lumens, Portable Movie Projector, Compatible with TV Stick, HDMI, VGA, USB, Laptop, iPhone, Android",,Movies & TV,"EGP 16,489.03",,,4.2,,,,,https://m.media-amazon.com/images/I/81AdfCx+Y2L._AC_UY218_.jpg,https://www.amazon.eg/dp/B07ZNSPZWX,2026-05-15T05:01:18.876932
amazon,,"Generic Mini Portable LED Projector, Outdoor Home Cinema Theater with PC Laptop USB/SD/AV/HDMI Input, Pocket Projector for Video TV Movie Party Game Home Entertainment",,Movies & TV,"EGP 1,300.00",,,,,,,,https://m.media-amazon.com/images/I/51923jiG5rL._AC_UY218_.jpg,https://www.amazon.eg/dp/B07MW986J6,2026-05-15T05:01:18.877427
amazon,,Night Court First Season 1 One (Spanish Release),,Movies & TV,,,,4.9,,,,,https://m.media-amazon.com/images/I/6167ZxQzWQL._AC_UY218_.jpg,https://www.amazon.eg/dp/B07N9F6Q3W,2026-05-15T05:01:18.877804
amazon,,Miami Vice: Season 3,,Movies & TV,,,,4.7,,,,,https://m.media-amazon.com/images/I/61h+44OAS0L._AC_UY218_.jpg,https://www.amazon.eg/dp/B000MLWQ6S,2026-05-15T05:01:18.878232
amazon,,The Simpsons: The Complete First Season,,Movies & TV,,,,4.6,,,,,https://m.media-amazon.com/images/I/81Am5ij5v2L._AC_UY218_.jpg,https://www.amazon.eg/dp/B00005ML6Y,2026-05-15T05:01:18.878698
amazon,,True Blood: Season 7,,Movies & TV,,,,4.7,,,,,https://m.media-amazon.com/images/I/81IatLn6Y4L._AC_UY218_.jpg,https://www.amazon.eg/dp/B00LPPIAZG,2026-05-15T05:01:18.879161
amazon,,Abraham Lincoln: Vampire Hunter [Blu-ray],,Movies & TV,,,,4.6,,,,,https://m.media-amazon.com/images/I/71o4j30V0VL._AC_UY218_.jpg,https://www.amazon.eg/dp/B005LAIHZE,2026-05-15T05:01:18.879614
amazon,,Ultimate Flint Collection (Our Man Flint / In Like Flint),,Movies & TV,,,,4.6,,,,,https://m.media-amazon.com/images/I/81aF4-QNuEL._AC_UY218_.jpg,https://www.amazon.eg/dp/B000HT3PF6,2026-05-15T05:01:18.880104
amazon,,Glee: Season 3 [Blu-ray],,Movies & TV,,,,4.6,,,,,https://m.media-amazon.com/images/I/811ydDMFccL._AC_UY218_.jpg,https://www.amazon.eg/dp/B0053O8A5U,2026-05-15T05:01:18.880523
amazon,,Saving Grace: The Final Season,,Movies & TV,,,,4.7,,,,,https://m.media-amazon.com/images/I/91iWMusq-uL._AC_UY218_.jpg,https://www.amazon.eg/dp/B003FSTG1I,2026-05-15T05:01:18.880948
amazon,,Batman: The Complete First Season,,Movies & TV,,,,4.8,,,,,https://m.media-amazon.com/images/I/91RkLHaug1L._AC_UY218_.jpg,https://www.amazon.eg/dp/B00M4BCFH4,2026-05-15T05:01:18.881386
amazon,,Degrassi the Next Generation: Season 12,,Movies & TV,,,,4.6,,,,,https://m.media-amazon.com/images/I/61ErwM1NVzL._AC_UY218_.jpg,https://www.amazon.eg/dp/B00E4Q6U9Q,2026-05-15T05:01:18.881825
amazon,,Eon Kid,,Movies & TV,,,,4.4,,,,,https://m.media-amazon.com/images/I/71+FEM6jQzL._AC_UY218_.jpg,https://www.amazon.eg/dp/B001A7GOE8,2026-05-15T05:01:18.882241
amazon,,Open Season (Widescreen Special Edition) [Import],,Movies & TV,,,,4.6,,,,,https://m.media-amazon.com/images/I/6116N2X0ivL._AC_UY218_.jpg,https://www.amazon.eg/dp/B000L22SG6,2026-05-15T05:01:18.882625
amazon,,Caillou: Caillou’s Outdoor Adventures,,Movies & TV,,,,4.4,,,,,https://m.media-amazon.com/images/I/81o0P3L0NGL._AC_UY218_.jpg,https://www.amazon.eg/dp/B007G8SEH0,2026-05-15T05:01:18.883006
amazon,,My Name is Earl: Season 1,,Movies & TV,,,,4.8,,,,,https://m.media-amazon.com/images/I/71qTAipiLRL._AC_UY218_.jpg,https://www.amazon.eg/dp/B000G6BL88,2026-05-15T05:01:18.883432
amazon,,BIGGEST LOSER:LAST CHANCE WORKOUTS,,Movies & TV,,,,4.4,,,,,https://m.media-amazon.com/images/I/91DkdMPa07L._AC_UY218_.jpg,https://www.amazon.eg/dp/B002OMIKLI,2026-05-15T05:01:18.883798
amazon,,Scandal: The Complete First Season,,Movies & TV,,,,4.7,,,,,https://m.media-amazon.com/images/I/91-c2A+Y9tL._AC_UY218_.jpg,https://www.amazon.eg/dp/B007MDB6Y2,2026-05-15T05:01:18.884221
amazon,,"Jane Fonda Prime Time: Trim, Tone & Flex [DVD]",,Movies & TV,,,,4.4,,,,,https://m.media-amazon.com/images/I/81W58+04WXL._AC_UY218_.jpg,https://www.amazon.eg/dp/B005G4FFDW,2026-05-15T05:01:23.269154
amazon,,"Best of MadTV Seasons 8, 9 & 10",,Movies & TV,,,,4.6,,,,,https://m.media-amazon.com/images/I/51Yd1xoyg0L._AC_UY218_.jpg,https://www.amazon.eg/dp/B000A88EUK,2026-05-15T05:01:23.269631
amazon,,"South Park: Seasons 16-20 [Blu-Ray, Collector's Edition]",,Movies & TV,,,,,,,,,https://m.media-amazon.com/images/I/51xEoBRmiTL._AC_UY218_.jpg,https://www.amazon.eg/dp/B0CKLWJ6X4,2026-05-15T05:01:23.269956
