platform,asin,title,brand,category,current_price,original_price,discount,rating,reviews_count,prime_eligible,amazon_choice,sponsored,main_image,product_url,scraped_at
amazon,,"QSHOP Pen Holder, Round Metal Mesh Desk Organizer for Office Home Study Table",,Office Products,EGP 34.07,EGP 44.09,,4.5,Was:,,,,https://m.media-amazon.com/images/I/71AyLT7DKSL._AC_UL320_.jpg,https://www.amazon.eg/dp/B0DDTQDPSY,2026-03-31T06:08:02.441901
amazon,,Office Desk Accessories 2pcs Computer Monitor Memo Board Computer Message Board Office Supplies for Women Men Computer Sticky Note Holder Home Office Accessories Office Desktop Message Office Decor,,Office Products,EGP 399.00,,,4.5,,,,,https://m.media-amazon.com/images/I/61yjorGIhAL._AC_UL320_.jpg,https://www.amazon.eg/dp/B0BRMX3SWH,2026-03-31T06:08:02.442440
amazon,,VAVSU Mesh Pen Holder Desktop Metal Pencil Compartment Case Organizer Accessories Storage Stand Office Home School Caddy Box Cards Rack(Black) (3 Compartment),,Office Products,EGP 119.00,,,4.2,,,,,https://m.media-amazon.com/images/I/71geIghNmmL._AC_UL320_.jpg,https://www.amazon.eg/dp/B08YRBMPCL,2026-03-31T06:08:02.442989
amazon,,"DIVCHI Circular Mesh Wastebasket Trash Can, Waste Basket Garbage Can Bin for Bathrooms, Kitchens, Home Offices, Dorm Rooms(BLACK)",,Office Products,EGP 127.99,EGP 143.07,,4.3,List:,,,,https://m.media-amazon.com/images/I/91fRtk82vFL._AC_UL320_.jpg,https://www.amazon.eg/dp/B07TWSK7DY,2026-03-31T06:08:02.443576
amazon,,"Mesh Pen Holder – Stylish Pencil Holder for Office Desk, Makeup Brush Organizer, Multipurpose Metal Pen Holder for Study Table & Workstation | Pink",,Office Products,EGP 46.02,,,3.8,,,,,https://m.media-amazon.com/images/I/71JwZLEsR2L._AC_UL320_.jpg,https://www.amazon.eg/dp/B0F8JDZ2JY,2026-03-31T06:08:02.444048
amazon,,Metal A4 Paper office Mesh Document Basket File Paper Tray Letter Organizer Holder Desktop Accessories-3 Tires [JS3001],,Office Products,EGP 294.00,,,4.1,,,,,https://m.media-amazon.com/images/I/714Y31YDMXL._AC_UL320_.jpg,https://www.amazon.eg/dp/B097CMQJ84,2026-03-31T06:08:02.444572
amazon,,ITODA Office Multi-Functional Desk Organiser Storage Rack Wooden Stationary Desk Tidy Desktop Business Card Pen Mobile Phone Remote Control Holder Storage for Home Office Supplies (Color B),,Office Products,EGP 550.00,,,4.0,,,,,https://m.media-amazon.com/images/I/613kpEVocmL._AC_UL320_.jpg,https://www.amazon.eg/dp/B07NV4FH45,2026-03-31T06:08:02.445025
amazon,,Bi-Office Cork Board 60x45 cm,,Office Products,EGP 600.21,,,4.2,,,,,https://m.media-amazon.com/images/I/91ms3TkBBrL._AC_UL320_.jpg,https://www.amazon.eg/dp/B003AQP5VA,2026-03-31T06:08:02.445570
amazon,,"KW-TRIO 5360R STAPLER, Full Strip, Office Products Stationary",,Office Products,EGP 399.00,,,,,,,,https://m.media-amazon.com/images/I/218Bv6dGaYL._AC_UL320_.jpg,https://www.amazon.eg/dp/B0DPD4Q1XK,2026-03-31T06:08:02.445978
amazon,,"Lifewit 25 PCS Drawer Organizer Set Clear Plastic Desk Drawer Dividers Trays Dresser Storage Bins Separation Box for Makeup, Jewelries and Gadgets, Bedroom, Bathroom, Office",,Office Products,EGP 501.99,EGP 515.48,,4.5,Was:,,,,https://m.media-amazon.com/images/I/71KHrR98z+L._AC_UL320_.jpg,https://www.amazon.eg/dp/B09GFJN27K,2026-03-31T06:08:02.446567
amazon,,"Deli Office Accessories Metal Stapler Pins 1000 Pieces Set, 24/6 Size",,Office Products,EGP 24.00,,,4.5,,,,,https://m.media-amazon.com/images/I/515hNjFI1QL._AC_UL320_.jpg,https://www.amazon.eg/dp/B0BZVYNP17,2026-03-31T06:08:02.447024
amazon,,"GKD Wooden Desk Organizer & Docking Station 6 in 1 with Mobile Stand | Table Organizer for Office & Home | Gift for Husband, Brother & Him | New Year Gift, Birthday Gift | Eco Friendly (Wood)",,Office Products,EGP 180.00,EGP 209.00,,3.6,Was:,,,,https://m.media-amazon.com/images/I/81FHg-1buNL._AC_UL320_.jpg,https://www.amazon.eg/dp/B0DDPYCXZF,2026-03-31T06:08:02.447552
amazon,,"Leviatan Desk Organiser, Pen Holder, Pen Holder, Table Organiser Made of Metal, Office Shelf with Note Holder Mesh, 205 x 103 x 98 mm, Blue",,Office Products,EGP 154.00,,,4.5,,,,,https://m.media-amazon.com/images/I/71HeYM-CZmL._AC_UL320_.jpg,https://www.amazon.eg/dp/B082N12TL2,2026-03-31T06:08:02.448090
amazon,,"Comfort Lumbar Support Pillow for Office Chair - Memory Foam Back Cushion for Chair, Car, Couch - Lumbar Pillow Promotes Better Posture, Back Pain Relief - Ideal for Gaming and Desk Chairs",,Office Products,EGP 444.00,,,5.0,,,,,https://m.media-amazon.com/images/I/71qxMusk-TL._AC_UL320_.jpg,https://www.amazon.eg/dp/B0GQHWW21D,2026-03-31T06:08:02.448544
amazon,,Littlesun Premium Comfort Seat Cushion – Non-Slip Orthopedic 100% Memory Foam Coccyx Cushion for Tailbone Pain – Cushion for Office Chair Car Seat – Back Pain & Sciatica Relief (Back cushion),,Office Products,EGP 334.00,,,3.9,,,,,https://m.media-amazon.com/images/I/71R1h1QS2RL._AC_UL320_.jpg,https://www.amazon.eg/dp/B07ZRSPXB3,2026-03-31T06:08:02.448997
amazon,,"Seville Classics 12"" Round Mesh Waste Basket, 6 Gallon Capacity, Black, Pack of 3",,Office Products,EGP 379.99,,,4.5,,,,,https://m.media-amazon.com/images/I/71Ut4d5pw8L._AC_UL320_.jpg,https://www.amazon.eg/dp/B0041EJX86,2026-03-31T06:08:02.449485
amazon,,"Di Pelle™ Vertical Leather ID Badge Holder – 99% Handmade PU Leather Card Case with Clear Window – Professional ID & Access Card Protector for Office, School, and Staff Use (Havan)",,Office Products,EGP 99.00,,,4.1,,,,,https://m.media-amazon.com/images/I/51pYRXemtsL._AC_UL320_.jpg,https://www.amazon.eg/dp/B0FW6HC234,2026-03-31T06:08:02.449945
amazon,,"Desk Tape Dispenser, Non-Skid Base Tape Roll Dispenser for School, Home, Office",,Office Products,EGP 445.00,,,4.5,,,,,https://m.media-amazon.com/images/I/61WxBQPJ0BL._AC_UL320_.jpg,https://www.amazon.eg/dp/B0B4X7RP3V,2026-03-31T06:08:02.450388
amazon,,TY-43 Bulldog Clips 19mm Colored Pack Durable Metal Design Strong Grip Ideal for Office School and Home Paper Document Organization Multicolor,,Office Products,EGP 65.85,EGP 75.00,,,List:,,,,https://m.media-amazon.com/images/I/61aMUIHm-4L._AC_UL320_.jpg,https://www.amazon.eg/dp/B0FT3Z1CH3,2026-03-31T06:08:02.450870
amazon,,3A Proqueen File Holder 27X10X30 CM - Beige 8311,,Office Products,EGP 99.43,,,,,,,,https://m.media-amazon.com/images/I/41LTjPpYYJL._AC_UL320_.jpg,https://www.amazon.eg/dp/B0DD7KS78Y,2026-03-31T06:08:02.451262
amazon,,"Extended XXL Gaming Mouse Map Pad 35.4X15.74X0.12 Inch,HD World Map Mouse Pad,with Non-Slip Base,Waterproof and Foldable Pad,Desktop Pad Suitable for Gamers,Suitable for Desktop,Office and Home,Black",,Office Products,EGP 250.00,,,4.2,,,,,https://m.media-amazon.com/images/I/71TKqTeaZrS._AC_UL320_.jpg,https://www.amazon.eg/dp/B08X4CFB3P,2026-03-31T06:08:02.451725
amazon,,3A Proqueen File Holder 27X10X30 Cm - Blue 8311,,Office Products,EGP 92.11,,,2.7,,,,,https://m.media-amazon.com/images/I/410oR3S8AaL._AC_UL320_.jpg,https://www.amazon.eg/dp/B0DD7JBF1H,2026-03-31T06:08:02.452235
amazon,,Tanex Office Sticker 13 mm 350 Labels 5 Sheets A5 Model OFC129 fluorescent adhesive circles for easy labeling,,Office Products,EGP 27.00,,,2.0,,,,,https://m.media-amazon.com/images/I/61ZgPALNJnL._AC_UL320_.jpg,https://www.amazon.eg/dp/B0G1MXGQTL,2026-03-31T06:08:02.452707
amazon,,Puricon 10 Pcs Desk Drawer Organizers Trays Set Clear Plastic Storage Bins Bathroom Drawer Tray Dividers Vanity Trays Organizer for Bedroom Dresser Makeup Kitchen Utensil Office,,Office Products,EGP 269.00,,,4.0,,,,,https://m.media-amazon.com/images/I/71YMMVhE3uL._AC_UL320_.jpg,https://www.amazon.eg/dp/B088842R52,2026-03-31T06:08:02.453198
amazon,,"Cork Bulletin Board, Bulletin-Boards, Notes Board, Memo Board, 18 x 24inch, Silver Aluminum Frame",,Office Products,EGP 480.17,,,4.4,,,,,https://m.media-amazon.com/images/I/71arfuZXIDL._AC_UL320_.jpg,https://www.amazon.eg/dp/B0BXRS6R71,2026-03-31T06:08:05.674898
amazon,,Quattro Manager Medical Office Chair - Black Mesh,,Office Products,"EGP 1,384.99","EGP 1,794.99",,3.0,List:,,,,https://m.media-amazon.com/images/I/514blGwuaqL._AC_UL320_.jpg,https://www.amazon.eg/dp/B09238R36V,2026-03-31T06:08:05.675513
amazon,,"5.5 Inch Office Chair Gas Lift Cylinder - Replacement Parts, Universal Size, Heavy Duty Hydraulic/Pneumatic Piston for Most Chairs (Black)",,Office Products,EGP 301.93,,,4.2,,,,,https://m.media-amazon.com/images/I/518dNVMxXpL._AC_UL320_.jpg,https://www.amazon.eg/dp/B097HJRVDG,2026-03-31T06:08:05.676032
amazon,,"Carpalax Wrist Rest-Mouse Pad with Wrist Rest, Wrist Support for Keyboard, Ergonomic Palm Rest, Plane & Soft Cooling Material, Pain-Relief, Glides with Mouse, Office-Gaming Computer",,Office Products,EGP 399.00,,,4.1,,,,,https://m.media-amazon.com/images/I/51CYKHvdy6L._AC_UL320_.jpg,https://www.amazon.eg/dp/B0951M267J,2026-03-31T06:08:05.676529
amazon,,"Elegant Set of a Notebook A5, Creamy with a Metal Elegant Pen All in a Hardcover Box - Dark Green",,Office Products,EGP 396.80,EGP 452.00,,5.0,List:,,,,https://m.media-amazon.com/images/I/61k-o5BKrdL._AC_UL320_.jpg,https://www.amazon.eg/dp/B0DKP9GBTX,2026-03-31T06:08:05.677065
amazon,,Large Mouse Pad Astronaut in The Universe Extended Gaming Mousepad Waterproof Desk Pad with Non-Slip Base and Stitched Edge Keyboard Pad 11.8 x 31.5 Inch Mouse Mat for Home Office Desk Decor,,Office Products,EGP 135.00,,,4.6,,,,,https://m.media-amazon.com/images/I/814VyPD9OTL._AC_UL320_.jpg,https://www.amazon.eg/dp/B0D723NL5M,2026-03-31T06:08:05.677539
amazon,,"Clear Packing Tape, 2 inches x 50 yards Strong Heavy Duty Packaging Tape for Sealing Parcel Boxes, Moving Boxes Houses, Large Postal Bags, Office Supplies [6 Rolls]",,Office Products,EGP 399.00,,,4.5,,,,,https://m.media-amazon.com/images/I/51FjFimBG-L._AC_UL320_.jpg,https://www.amazon.eg/dp/B0B9T2MDL5,2026-03-31T06:08:05.677986
amazon,,3A Wooden Appreciation Certificate Holder 22X30 cm - Brown and Gold 01820-2,,Office Products,EGP 129.64,EGP 156.00,,5.0,Was:,,,,https://m.media-amazon.com/images/I/51Fyop9LqsL._AC_UL320_.jpg,https://www.amazon.eg/dp/B0DD7R7672,2026-03-31T06:08:05.678522
amazon,,Deli Card Holder 103×68×34MM Transparent 7621,,Office Products,EGP 37.00,,,4.3,,,,,https://m.media-amazon.com/images/I/51t3zBC8WLL._AC_UL320_.jpg,https://www.amazon.eg/dp/B01N0KNLX5,2026-03-31T06:08:05.678973
amazon,,"FITUEYES Dual Monitor Stand â€“ 3 Shelf Computer Monitor Riser, Wood Desktop Stand with Adjustable Length and Angle, Desk Accessories, Office Supplies Medium Black,DT108001WB",,Office Products,EGP 330.00,EGP 350.00,,3.2,Was:,,,,https://m.media-amazon.com/images/I/71X9dr7+fAL._AC_UL320_.jpg,https://www.amazon.eg/dp/B07CWL1GR3,2026-03-31T06:08:05.679534
amazon,,"Japanese Full Moon Mouse Pad, Desk Decor Mat, Large Gaming Mouse Pad for Computer, Keyboard, and Laptop, Desk Accessories for Home and Office, 31.5x11.8 in",,Office Products,EGP 169.00,EGP 178.00,,4.3,Was:,,,,https://m.media-amazon.com/images/I/715HircpEuL._AC_UL320_.jpg,https://www.amazon.eg/dp/B0DXKYQJX7,2026-03-31T06:08:05.680051
amazon,,Numbering Machine 7 digits Arabic multicolor model 8607,,Office Products,EGP 766.80,,,,,,,,https://m.media-amazon.com/images/I/818GZQ36NyL._AC_UL320_.jpg,https://www.amazon.eg/dp/B0DQK442YV,2026-03-31T06:08:05.680538
amazon,,Tanex Office Sticker 19 × 40 mm 140 Labels Pack of 10 Sheets A5 White Model OFC-113,,Office Products,EGP 21.05,,,4.3,,,,,https://m.media-amazon.com/images/I/714WASxKz6S._AC_UL320_.jpg,https://www.amazon.eg/dp/B00LBVZS9K,2026-03-31T06:08:05.680990
amazon,,Leitz 5500 Office stapler With 30 Sheets Capacity Ensuring Long-Term Reliability And Performance In Any Office Environment,,Office Products,EGP 320.63,EGP 379.00,,4.6,List:,,,,https://m.media-amazon.com/images/I/71zYKC4Wq6L._AC_UL320_.jpg,https://www.amazon.eg/dp/B0007OEERY,2026-03-31T06:08:05.681537
amazon,,Foot Rest Under Table Natural Pine Wood Foot Rest Under Table Ottoman for Office and Home 38cm Wide 28cm Height 10cm Product Color Natural Wood Polished B Varnish,,Office Products,EGP 385.00,,,3.9,,,,,https://m.media-amazon.com/images/I/41hfe6v8zcL._AC_UL320_.jpg,https://www.amazon.eg/dp/B0G3MRHL4S,2026-03-31T06:08:05.681994
amazon,,"Desk Mat Colorful Space Desk Accessories Astronaut Extended Gaming Mouse Desk Pad Decorations for Office Keyboard Mousepad Mat31.5x11.8in, Stitched Edge Non-Slip Bottom Large Mouse Pad",,Office Products,EGP 159.00,,,3.8,,,,,https://m.media-amazon.com/images/I/81jqVn+AOsL._AC_UL320_.jpg,https://www.amazon.eg/dp/B0D5B937TJ,2026-03-31T06:08:05.682455
amazon,,Wooden Desk Organizer/Storage Box/Remote & Pen Stand/Office Stationary Stand (Black),,Office Products,EGP 200.00,,,4.1,,,,,https://m.media-amazon.com/images/I/31SVJRu8MbL._AC_UL320_.jpg,https://www.amazon.eg/dp/B08M5R7172,2026-03-31T06:08:05.682936
amazon,,Hi-Range Desk Deposit Tray 3 Layer A4 Metal tray Office Desk Organiser Paper office Mesh Document Basket File Paper Tray Letter Organiser Holder Desktop Accessories,,Office Products,EGP 444.16,,,4.0,,,,,https://m.media-amazon.com/images/I/71Nkos+yG8L._AC_UL320_.jpg,https://www.amazon.eg/dp/B092VZ5HTX,2026-03-31T06:08:05.683381
amazon,,"Executive Office Solutions Vintage Rustic Wooden Desk Organizer & Mail Rack for Desktop, Tabletop, or Counter - Distressed Torched Wood - for Supplies, Desk Accessories, or Mail - Cherry",,Office Products,"EGP 1,170.00",,,4.4,,,,,https://m.media-amazon.com/images/I/81o-DE9J8KL._AC_UL320_.jpg,https://www.amazon.eg/dp/B07RV5CSGS,2026-03-31T06:08:05.683888
amazon,,Puricon 7 Pcs Desk Drawer Organizers Trays Set Clear Plastic Storage Bins Bathroom Drawer Tray Dividers Vanity Trays Organizer for Bedroom Dresser Makeup Kitchen Utensil Office,,Office Products,EGP 223.75,EGP 397.00,,4.0,List:,,,,https://m.media-amazon.com/images/I/71L36t5+hpL._AC_UL320_.jpg,https://www.amazon.eg/dp/B082SSFH3Y,2026-03-31T06:08:05.684467
amazon,,"Arae Desk Mat, PU Leather Waterproof, Nonslip and Ultra Thin Desk Pad for Home and Office - 31.5 x 15.7 Inch Black",,Office Products,EGP 950.00,,,4.4,,,,,https://m.media-amazon.com/images/I/612zXVWqcPL._AC_UL320_.jpg,https://www.amazon.eg/dp/B092ZLR9WM,2026-03-31T06:08:05.684919
amazon,,"8 Rolls Easy Tear Transparent Tape Refills - Gift Wrapping Tape for Dispensers - Crystal Clear, Effortless Tear, Strong Adhesion - Invisible Tape 3/4 in x 1000 in for Office, School, Home",,Office Products,EGP 115.00,,,3.9,,,,,https://m.media-amazon.com/images/I/81LUJt169tL._AC_UL320_.jpg,https://www.amazon.eg/dp/B0D5DD17SQ,2026-03-31T06:08:05.685355
amazon,,Clip File A4 Premium Quality Strong Binding Document Holder for School Office and Professional Work Durable Cover and Lightweight Design Multicolor,,Office Products,EGP 28.45,EGP 38.00,,,List:,,,,https://m.media-amazon.com/images/I/51yc5VZSKnL._AC_UL320_.jpg,https://www.amazon.eg/dp/B0FT42BQLC,2026-03-31T06:08:05.685831
amazon,,5 Star CP055YTWHI Office Refill Block for Noteholder Cube Approx. 750 Sheets of Paper 90x90mm White,,Office Products,EGP 138.24,,,4.4,,,,,https://m.media-amazon.com/images/I/51QxESGiSQL._AC_UL320_.jpg,https://www.amazon.eg/dp/B004VV5LD0,2026-03-31T06:08:05.686292
amazon,,Chrome star office chairs base,,Office Products,EGP 365.00,EGP 427.00,,4.2,List:,,,,https://m.media-amazon.com/images/I/51xIEXmOASL._AC_UL320_.jpg,https://www.amazon.eg/dp/B094HK8L5C,2026-03-31T06:08:10.558159
amazon,,Tanex Office Sticker 12×30 mm 150 Labels 5 Sheets A5 Model OFC107 fluorescent labeling stickers for home and office,,Office Products,EGP 27.00,,,,,,,,https://m.media-amazon.com/images/I/614cLMD4j-L._AC_UL320_.jpg,https://www.amazon.eg/dp/B0G1N6NGKQ,2026-03-31T06:08:10.558629
amazon,,"Max Comfort High Quality Foam Back Pillow for Office Chair Office Car Home Office Medical Back Cushion, hernvy",,Office Products,EGP 395.00,,,3.6,,,,,https://m.media-amazon.com/images/I/51Wm+wcdF+L._AC_UL320_.jpg,https://www.amazon.eg/dp/B0CKTN1BH2,2026-03-31T06:08:10.559140
amazon,,"Ballucci File Organizer, 2-Tier Document Paper Sorter, Stackable Wood Desk Organizer Mail Holder, Monitor Stand with Storage Shelves, Black",,Office Products,EGP 347.00,EGP 375.00,,4.3,Was:,,,,https://m.media-amazon.com/images/I/616CwXlMleL._AC_UL320_.jpg,https://www.amazon.eg/dp/B08KR8B24Y,2026-03-31T06:08:10.559721
amazon,,"Jaguar sr-300 metal and plastic staple remover suitable to remove (24/6, 26/6) staples from 100 sheets - blue",,Office Products,EGP 264.69,,,4.4,,,,,https://m.media-amazon.com/images/I/51yzzTa1+IL._AC_UL320_.jpg,https://www.amazon.eg/dp/B0B726TSX4,2026-03-31T06:08:10.560184
amazon,,3A Portfolio C2507 Leather Zipper Card Holder With Calculator 34X25X2 CM - Black,,Office Products,EGP 481.77,,,5.0,,,,,https://m.media-amazon.com/images/I/316yYBDTCOL._AC_UL320_.jpg,https://www.amazon.eg/dp/B0DD7HT3TL,2026-03-31T06:08:10.560647
amazon,,"HI TEKNO A4 Premium L-Shape File, 180 Micron, Crystal Clear (US-E310)",,Office Products,EGP 9.34,,,,,,,,https://m.media-amazon.com/images/I/41FCHKLieuL._AC_UL320_.jpg,https://www.amazon.eg/dp/B0FKGYYCL5,2026-03-31T06:08:10.561046
amazon,,"Deli Desktop Stapler,50 Sheet Capacity, Black",,Office Products,EGP 465.00,EGP 483.17,,4.5,List:,,,,https://m.media-amazon.com/images/I/51d09x8t1TL._AC_UL320_.jpg,https://www.amazon.eg/dp/B07QH5RKQ6,2026-03-31T06:08:10.561579
amazon,,Leviatan Desk Organizer | Metal Desk Organizer | Office Pen Holder | Desk Organizer with Mesh Note Holder | 205 x 103 x 98 mm | Navy Blue,,Office Products,EGP 140.00,,,4.6,,,,,https://m.media-amazon.com/images/I/81Ky-T+S4dL._AC_UL320_.jpg,https://www.amazon.eg/dp/B082N1FZPX,2026-03-31T06:08:10.562062
amazon,,"OneLeaf 80PCS Reusable Cable Ties, Black Adjustable 6-Inch Cord Organizer Ties, Multi-purpose Hook Loop Cable Management Wire Ties for Organizing Home, Office, Data Centers",,Office Products,EGP 999.00,,,4.7,,,,,https://m.media-amazon.com/images/I/81ro7ZsW4zL._AC_UL320_.jpg,https://www.amazon.eg/dp/B08V8NK5TN,2026-03-31T06:08:10.562541
amazon,,Cork Board Pin Notice Office Memo School with Push Pins Board Requisite Needs Wooden Natural Frame Board (60CM x 90CM),,Office Products,EGP 840.29,,,4.2,,,,,https://m.media-amazon.com/images/I/71LvMRhDgbL._AC_UL320_.jpg,https://www.amazon.eg/dp/B08TLX6DPD,2026-03-31T06:08:10.563003
amazon,,"SUPEASY Mesh Desk Organizer, Desk Accessories & Workspace Organizers with Drawers, Pencil Holder for Desk with 9 Compartments for Office Supplies, 8.6 x 4.3 x 4.1 Inch, Black",,Office Products,EGP 425.00,,,4.8,,,,,https://m.media-amazon.com/images/I/81qzerbQZlL._AC_UL320_.jpg,https://www.amazon.eg/dp/B0C8TL1SC1,2026-03-31T06:08:10.563456
amazon,,"World Map Gaming Mouse Pad Black Desk Mat,Desk Pad XXL Mouse Pads for Desk 35.4x15.7in Mousepad with Stitched Edges,Non-Slip Rubber Base,Waterproof Computer Keyboard Pad for Gamer,Office&Work",,Office Products,EGP 330.00,,,4.6,,,,,https://m.media-amazon.com/images/I/810P5jOZ4KL._AC_UL320_.jpg,https://www.amazon.eg/dp/B0CQY68J7Q,2026-03-31T06:08:10.563920
amazon,,Anime Lanyard Badge Holders ID Card Holder Badge Lanyards Office Products (Cinna Lanyard Badge),,Office Products,EGP 175.00,,,2.8,,,,,https://m.media-amazon.com/images/I/61XX03UGBuL._AC_UL320_.jpg,https://www.amazon.eg/dp/B0CDW3SS8D,2026-03-31T06:08:10.564376
amazon,,Metal Mesh Desk Set 4 Pieces - Black (1),,Office Products,EGP 525.00,,,,,,,,https://m.media-amazon.com/images/I/41XpKUHS-gL._AC_UL320_.jpg,https://www.amazon.eg/dp/B0G4SN5YLQ,2026-03-31T06:08:10.564787
amazon,,Set of 5 Office Accessories Metal Mesh 3-tier document tray A4 Paper Office Document File Office Organizer Set,,Office Products,"EGP 1,110.00",,,,,,,,https://m.media-amazon.com/images/I/81OYdrSYF9L._AC_UL320_.jpg,https://www.amazon.eg/dp/B0D2BLGV1S,2026-03-31T06:08:10.565189
amazon,,"Boss Office Products B16245-BK Be Well Medical Spa Drafting Stool with Back, Black",,Office Products,"EGP 2,824.00",,,4.3,,,,,https://m.media-amazon.com/images/I/71Yxa63FgZL._AC_UL320_.jpg,https://www.amazon.eg/dp/B004I3ZRQM,2026-03-31T06:08:10.565639
amazon,,Modern Innovations 3 x 3 Crystal Clear Acrylic Notepad Holder W/O Pads - Sticky Notes Holder - Sticky Notepad Holder Perfect for Dorm Room and Office Desk Organization,,Office Products,EGP 299.00,,,4.8,,,,,https://m.media-amazon.com/images/I/610+dL5DZ4L._AC_UL320_.jpg,https://www.amazon.eg/dp/B00563U02E,2026-03-31T06:08:10.566131
amazon,,Tanex Office Sticker 19 × 23 mm 150 Labels Pack of 5 Sheets A5 Neon Orange Model OFC-111,,Office Products,EGP 22.40,,,,,,,,https://m.media-amazon.com/images/I/6121WCAosHL._AC_UL320_.jpg,https://www.amazon.eg/dp/B0F1NL8XZW,2026-03-31T06:08:10.566562
amazon,,"Belal DL0001 Multipurpose Binder Clips, 12-Pack, 51 mm Size, Black",,Office Products,EGP 121.00,,,4.9,,,,,https://m.media-amazon.com/images/I/61iX8jyeIpL._AC_UL320_.jpg,https://www.amazon.eg/dp/B0BYT1YG9H,2026-03-31T06:08:10.567016
amazon,,Plastic File Holder Capsule JM-16 A3 White Durable Design Perfect for School Office Use Professional Document Storage and Organization,,Office Products,EGP 36.00,,,5.0,,,,,https://m.media-amazon.com/images/I/419y-bHVA+L._AC_UL320_.jpg,https://www.amazon.eg/dp/B0FT3YZDPK,2026-03-31T06:08:10.567489
amazon,,"PrintFinish Heavy Duty Stapler With Ergonomic Handle - High Capacity Desk Stapler for Classroom, Office, Upholstery - Easy Grip, Free 1000 Staple Wires Included",,Office Products,EGP 590.00,,,4.0,,,,,https://m.media-amazon.com/images/I/51tcBBrMQIL._AC_UL320_.jpg,https://www.amazon.eg/dp/B0BCKY6JXW,2026-03-31T06:08:10.567941
amazon,,"Artblox Personalized Name Plate for Desk | Gold Stripe On Clear Acrylic Glass | Custom Desk Name Plate Personalized with Name and Credentials for Teacher Phd Military Office Name Plate (8"" X 2.5"")",,Office Products,EGP 799.00,,,4.7,,,,,https://m.media-amazon.com/images/I/81EGYdGUbiL._AC_UL320_.jpg,https://www.amazon.eg/dp/B07QH3M3W9,2026-03-31T06:08:10.568376
amazon,,"Durable Duraclip 30 Folder, A4 Size - Navy Blue",,Office Products,EGP 44.00,,,4.5,,,,,https://m.media-amazon.com/images/I/71dTNehvK4L._AC_UL320_.jpg,https://www.amazon.eg/dp/B000Z242FC,2026-03-31T06:08:10.568834
amazon,,"EPSON Ecotank L14150 A3 Business 3-in1 printer, Wi-Fi connected, black",,Office Products,"EGP 32,199.00","EGP 33,799.00",,4.3,List:,,,,https://m.media-amazon.com/images/I/61obhSDayuL._AC_UL320_.jpg,https://www.amazon.eg/dp/B08PBMTGLW,2026-03-31T06:08:14.161635
amazon,,"wood workers marble office accessories set, wooden 3 piece set for living room bedroom dining kitchen, marble trash bin, tissue box, tray set for office, vanity home decor accessories",,Office Products,"EGP 2,633.99",,,5.0,,,,,https://m.media-amazon.com/images/I/61qUvyp5xmL._AC_UL320_.jpg,https://www.amazon.eg/dp/B0F1V42VQT,2026-03-31T06:08:14.162184
amazon,,EPSON 103 EcoTank Yellow ink bottle,,Office Products,EGP 599.00,,,4.6,,,,,https://m.media-amazon.com/images/I/71s6cKyK0YL._AC_UL320_.jpg,https://www.amazon.eg/dp/B07FNF7C8T,2026-03-31T06:08:14.162729
amazon,,"DOZYANT Gas Lift Cylinder, Office Chair Gas Lift Cylinder Replacement,Hydraulic Pneumatic Shock Piston Heavy Duty (450 lbs) Universal Size Fits Most Executive Chairs, Highest End Class 4",,Office Products,EGP 450.00,,,4.4,,,,,https://m.media-amazon.com/images/I/51uqmfakZML._AC_UL320_.jpg,https://www.amazon.eg/dp/B078BPJ6W1,2026-03-31T06:08:14.163677
amazon,,"Board Bulletin Board, 40 * 60cm Cork Board for Office with Pin Oak Wood, Hanging Corkboards for Office School Message Board Decoration",,Office Products,EGP 600.21,,,,,,,,https://m.media-amazon.com/images/I/71vpD9ZePSL._AC_UL320_.jpg,https://www.amazon.eg/dp/B0F9XWLMK1,2026-03-31T06:08:14.164078
amazon,,Leitz 5501 Office stapler With 25 Sheets Capacity Ensuring Long-Term Reliability And Performance In Any Office Environment,,Office Products,EGP 261.00,,,4.5,,,,,https://m.media-amazon.com/images/I/51qFPBM8OhL._AC_UL320_.jpg,https://www.amazon.eg/dp/B001J8GD8U,2026-03-31T06:08:14.164548
amazon,,ARK Aristotle's small triangle ARK,,Office Products,EGP 16.01,,,3.6,,,,,https://m.media-amazon.com/images/I/51KKZkplQSL._AC_UL320_.jpg,https://www.amazon.eg/dp/B07X1XDSY1,2026-03-31T06:08:14.165008
amazon,,"Holder - Wooden square desk holder featuring pen compartment and smartphone stand on side, designed for storing stationery, beauty products, jewelry, and enhancing modern office aesthetics multicolors",,Office Products,EGP 215.00,,,,,,,,https://m.media-amazon.com/images/I/21w4gOr3m1L._AC_UL320_.jpg,https://www.amazon.eg/dp/B0FS6YL1MP,2026-03-31T06:08:14.165410
amazon,,3A Horizontal Carton Clipboard and Keeper with Paper Handle 32 * 24cm - Mauve 8363,,Office Products,EGP 61.62,,,1.0,,,,,https://m.media-amazon.com/images/I/41wESUX7YWL._AC_UL320_.jpg,https://www.amazon.eg/dp/B0DCTZLN7K,2026-03-31T06:08:14.165883
amazon,,"Bi-Office Ayda Biofusion Cork Board, 90x60cm, Cork Surface, Natural Aluminium Frame with Coconut Biocomposites",,Office Products,EGP 840.29,,,5.0,,,,,https://m.media-amazon.com/images/I/81YlQcwXamL._AC_UL320_.jpg,https://www.amazon.eg/dp/B0DZXJSDW1,2026-03-31T06:08:14.166360
amazon,,3A Portfolio CE-813 Leather Zipper Card Holder with Calculator 34X25X2 CM - Black,,Office Products,EGP 504.18,,,,,,,,https://m.media-amazon.com/images/I/31abNsQWevL._AC_UL320_.jpg,https://www.amazon.eg/dp/B0DD7L2WX7,2026-03-31T06:08:14.166773
amazon,,"Acrylic Monitor Stand Riser Keyboard Storage Organizer for Home Office School(20.5"" L×8"" W)",,Office Products,"EGP 1,153.90",,,4.6,,,,,https://m.media-amazon.com/images/I/51p+C0TtxSL._AC_UL320_.jpg,https://www.amazon.eg/dp/B08HSZ328W,2026-03-31T06:08:14.167241
amazon,,"MaxGear Acrylic Business Card Holder for Desk, Multiple Premium Business Card Stand for Workspace, Clear Plastic Name Cards Display Holder for Exhibition, Home and Office, Capacity: 50 Cards, 3 Pack",,Office Products,EGP 599.00,,,4.8,,,,,https://m.media-amazon.com/images/I/61l55a1MZxL._AC_UL320_.jpg,https://www.amazon.eg/dp/B081ZV35ZR,2026-03-31T06:08:14.167769
