platform,asin,title,brand,category,current_price,original_price,discount,rating,reviews_count,prime_eligible,amazon_choice,sponsored,main_image,product_url,scraped_at
amazon,,Exercise Rope - Innovative 4 String Leg Pull Rope Fitness Enthusiasts Abdominal Sit-up Exercise Resistance Band Elastic Exercise Routine Yoga Sports Equipment,,Sports,EGP 272.92,EGP 286.47,,,List:,,,,https://m.media-amazon.com/images/I/719tkKTN+fL._AC_UL320_.jpg,https://www.amazon.eg/dp/B0DPL657CJ,2026-05-27T05:20:41.738231
amazon,,Kid's Sports & Fitness (70cm),,Sports,EGP 150.00,,,,,,,,https://m.media-amazon.com/images/I/31yh+7cA62L._AC_UL320_.jpg,https://www.amazon.eg/dp/B0F67GNC48,2026-05-27T05:20:41.738612
amazon,,Generic Multi-Functional Spring Cable Machine Chest Expander Grip And Arm Strength Is Male Chest Muscle Training Sports Fitness Sit-ups,,Sports,EGP 391.00,EGP 426.00,,2.9,List:,,,,https://m.media-amazon.com/images/I/51kgrlK4U4L._AC_UL320_.jpg,https://www.amazon.eg/dp/B08YNP5TDN,2026-05-27T05:20:41.739108
amazon,,"Women's Men's Sports Backpack, Travel Bag with Footwear Compartment, 36L Gym Backpack Fitness Bag Large Waterproof Sports Suitcase for Swimming, Yoga, Gym, Purple, Sport",,Sports,EGP 475.00,,,4.8,,,,,https://m.media-amazon.com/images/I/51O-BigaIVL._AC_UL320_.jpg,https://www.amazon.eg/dp/B0BNLC24LL,2026-05-27T05:20:41.739536
amazon,,"Furn Aspire Gym Bag Sports Travel Duffel Bags with Shoe Compartment & Dry Wet Separated Storage Pocket, Waterproof Fitness Workout Tote Yoga Handbag for Men and Women-black",,Sports,EGP 392.40,EGP 445.00,,4.0,Was:,,,,https://m.media-amazon.com/images/I/51tsnDMGFaL._AC_UL320_.jpg,https://www.amazon.eg/dp/B0BCWCM426,2026-05-27T05:20:41.740090
amazon,,"Sports Gym Bag, Sports Fitness Bag and Backpack Function, Sports Travel Bag with Shoes Compartment and Wet Pocket for Travel, Sports, Fitness (Black)",,Sports,EGP 500.00,,,3.7,,,,,https://m.media-amazon.com/images/I/51J-HelAk9L._AC_UL320_.jpg,https://www.amazon.eg/dp/B0BV5SXQTR,2026-05-27T05:20:41.740573
amazon,,"Resistance Bands with 8 Loops for Yoga, Physical Therapy & Fitness – Black Color – Strength and Flexibility Training",,Sports,EGP 156.00,,,1.0,,,,,https://m.media-amazon.com/images/I/517FczahyPL._AC_UL320_.jpg,https://www.amazon.eg/dp/B0GKPXZRTS,2026-05-27T05:20:41.740990
amazon,,Sauna Sweat Vest for Men T Shirt Heat Trapping Tank Tops Waist Trainer Body Shaper Slimming Weight Loss Workout Suit Gym Sport Fitness Slimming Body Shaper Waist Trainer,,Sports,EGP 200.00,,,4.0,,,,,https://m.media-amazon.com/images/I/61nl9ThWfGL._AC_UL320_.jpg,https://www.amazon.eg/dp/B0DCTX332Y,2026-05-27T05:20:41.741429
amazon,,"""Triple Wheel Ab Roller - Essential Core Workout Tool for Fitness & Strengthening Abs and Back Muscles""_ Sports equipment, sports tools, sports exercises, fitness, sports games, gym games",,Sports,EGP 669.00,,,,,,,,https://m.media-amazon.com/images/I/61wtcOcPqkL._AC_UL320_.jpg,https://www.amazon.eg/dp/B0FNNGQHDX,2026-05-27T05:20:41.741801
amazon,,"Women's Sport Hip Cover with Sleeves, Activewear Wrap Skirt for Gym and Outdoor Use",,Sports,EGP 179.99,,,4.0,,,,,https://m.media-amazon.com/images/I/61ZolEhgFdL._AC_UL320_.jpg,https://www.amazon.eg/dp/B0GPRH3K79,2026-05-27T05:20:41.742356
amazon,,1x Blue Unisex Headbands Cotton Terry Sweatband for Sports Yoga Fitness Exercises Moisture Wicking Sweat Absorbing Headband Exercise Moisture,,Sports,EGP 77.78,,,4.5,,,,,https://m.media-amazon.com/images/I/618FZp-8tyL._AC_UL320_.jpg,https://www.amazon.eg/dp/B073RCMRSP,2026-05-27T05:20:41.742780
amazon,,"ComfortFlex Elastic Sports Elbow Pad, Blue & Grey, Silicone Mesh Fabric, Support for Fitness and Sports, One Size, with Silicone Protective Pad (1 Count)",,Sports,EGP 142.00,EGP 250.00,,,List:,,,,https://m.media-amazon.com/images/I/51OEikT-QzL._AC_UL320_.jpg,https://www.amazon.eg/dp/B0G4F5B6C4,2026-05-27T05:20:41.743230
amazon,,"شورت رياضي نسائي Biker Shorts, خامة سادة عالية المرونة, متوفر بألوان متعددة",,Sports,EGP 120.00,,,5.0,,,,,https://m.media-amazon.com/images/I/31rJg3vqNcL._AC_UL320_.jpg,https://www.amazon.eg/dp/B0GW6W9Q7M,2026-05-27T05:20:41.743661
amazon,,"GORILLA SPORTS® Power Bag - 5kg, 10kg, 15kg, 20kg, 25kg, 30kg, Filled, Non-Slip Handles - Sandbag, Weight Bag, Fitness Exercise, Weighted Strength Training, Functional Fitness, Powerlifting Workout",,Sports,"EGP 3,040.00",,,4.7,,,,,https://m.media-amazon.com/images/I/71-m7HQUZIL._AC_UL320_.jpg,https://www.amazon.eg/dp/B00DN5HOLW,2026-05-27T05:20:41.744104
amazon,,Generic Fitness sports drinking bottle with carabiner - 2l assorted colors,,Sports,EGP 220.00,,,3.8,,,,,https://m.media-amazon.com/images/I/311g7dq1-ZL._AC_UL320_.jpg,https://www.amazon.eg/dp/B09L65FV3L,2026-05-27T05:20:45.942770
amazon,,3PCS RESISTANCE BANDS FOR LEGS - SPORTS FITNESS STRETCH RESISTANCE LOOPS BAND,,Sports,EGP 353.00,,,3.9,,,,,https://m.media-amazon.com/images/I/61a7Ttn5c2L._AC_UL320_.jpg,https://www.amazon.eg/dp/B08ZXH3LS8,2026-05-27T05:20:45.947814
amazon,,Sports Fitness Glove for Women Men Bodybuilding Weight Lifting Excise Gloves Hollow Breathable Anti Slip Gym Fingerless Glove,,Sports,EGP 129.28,,,3.0,,,,,https://m.media-amazon.com/images/I/71Z1EZoEuzL._AC_UL320_.jpg,https://www.amazon.eg/dp/B08YNKHMSH,2026-05-27T05:20:45.948257
amazon,,Aerobics Sport Exercises Mat,,Sports,EGP 400.50,EGP 427.50,,2.9,List:,,,,https://m.media-amazon.com/images/I/61wl8mbR1UL._AC_UL320_.jpg,https://www.amazon.eg/dp/B08YNS14T5,2026-05-27T05:20:45.949176
amazon,,Zacharias Unisex Half-Finger Gloves Men's Cycling Fitness Tactics Outdoor Sports Sunscreen Non-Slip Breathable Thin Fingerless Glove bg-03 (Blue),,Sports,EGP 155.00,,,3.8,,,,,https://m.media-amazon.com/images/I/61KO8wivioL._AC_UL320_.jpg,https://www.amazon.eg/dp/B0BBN23JR3,2026-05-27T05:20:45.949608
amazon,,"MIZAYA Sports Set for Girls and Women - T-Shirt and Shorts Assorted Colors, Suitable for Sports and Fitness, Comfortable and Fashionable Design",,Sports,EGP 319.50,EGP 355.00,Save 10%,4.4,Was:,,,,https://m.media-amazon.com/images/I/615bFn1ia1L._AC_UL320_.jpg,https://www.amazon.eg/dp/B0DT4PK8T8,2026-05-27T05:20:45.950118
amazon,,"M-Store Sando 3x1 Cable Resistance Bands for Sports & Fitness - Adjustable Strength Training, Durable & Portable Workout Equipment",,Sports,EGP 442.46,,,,,,,,https://m.media-amazon.com/images/I/515qIDrfK0L._AC_UL320_.jpg,https://www.amazon.eg/dp/B0FY68G75H,2026-05-27T05:20:45.950490
amazon,,LIVEUP SPORTS Fitness Heavy Duty Hand Grip - Orange,,Sports,EGP 207.88,,,,,,,,https://m.media-amazon.com/images/I/61-G-Oa3L3L._AC_UL320_.jpg,https://www.amazon.eg/dp/B091JGL8JT,2026-05-27T05:20:45.950852
amazon,,"Yoga Mat 6mm Thick Non-Slip Exercise Mat with Carry Bag – Beige Color for Yoga, Pilates & Fitness Training",,Sports,EGP 428.00,,,,,,,,https://m.media-amazon.com/images/I/71OP1p9vrvL._AC_UL320_.jpg,https://www.amazon.eg/dp/B0GKQ971WS,2026-05-27T05:20:45.951275
amazon,,"Furn Aspire Gym Bag Sports Travel Duffel Bags with Shoe Compartment & Dry Wet Separated Storage Pocket, Waterproof Fitness Workout Tote Yoga Handbag for Men and Women, A). Purple, Gym Bags",,Sports,EGP 430.42,,,3.9,,,,,https://m.media-amazon.com/images/I/61SwyzgSeyL._AC_UL320_.jpg,https://www.amazon.eg/dp/B0B293GSYH,2026-05-27T05:20:45.951711
amazon,,"Women's Sports Hijab Breathable Quick-Dry Stretch Fabric – Lightweight Athletic Headscarf with Sweat-Wicking Technology, Non-Slip Secure Fit for Running Gym Workout Training and Daily Sports",,Sports,EGP 499.00,,Save 5%,,,,,,https://m.media-amazon.com/images/I/51BpGIvSKlL._AC_UL320_.jpg,https://www.amazon.eg/dp/B0GS47KQSZ,2026-05-27T05:20:45.952177
amazon,,Malaysian Cube Weight Lifting Sports Chalk Sports Powder Blocks Anti Slip Gymnastics Climbing Fitness Training (5),,Sports,EGP 514.00,,,,,,,,https://m.media-amazon.com/images/I/61pE7f3DNwL._AC_UL320_.jpg,https://www.amazon.eg/dp/B0FZ4QXDHG,2026-05-27T05:20:45.952542
amazon,,Mens Athletic Cut Shirt With Hoods Multiple Sizes And Colors For Workout,,Sports,EGP 275.00,,,5.0,,,,,https://m.media-amazon.com/images/I/51NEk8sezSL._AC_UL320_.jpg,https://www.amazon.eg/dp/B0GYTBYGXP,2026-05-27T05:20:45.953066
amazon,,Sauna Sweat Vest for Men T Shirt Heat Trapping Tank Tops Waist Trainer Body Shaper Slimming Weight Loss Workout Suit Gym Sport Fitness Slimming Body Shaper Waist Trainer,,Sports,EGP 200.00,,,4.0,,,,,https://m.media-amazon.com/images/I/61nl9ThWfGL._AC_UL320_.jpg,https://www.amazon.eg/dp/B0DCTXPJ55,2026-05-27T05:20:45.953538
amazon,,"DADO Nylon Replacement Band, Compatible with Amazfit Helio Strap – Adjustable, Breathable Sport Wristband for Fitness Tracker, Comfortable for All-Day Wear",,Sports,EGP 499.00,,,3.9,,,,,https://m.media-amazon.com/images/I/71N15+ycM5L._AC_UL320_.jpg,https://www.amazon.eg/dp/B0FZCNLBQW,2026-05-27T05:20:45.953957
amazon,,"Redmi Watch 5 Active Smartwatch, 2.0 Inch LCD Display, 18 Day Battery, 140+ Sports Modes, Heart Rate and SPO₂ Tracking, 5ATM Waterproof, Calls, Fitness Tracker, Silver|1 year manufacturer warranty",,Sports,,,,4.4,,,,,https://m.media-amazon.com/images/I/61su9fqRFUL._AC_UL320_.jpg,https://www.amazon.eg/dp/B0DFHFM1X9,2026-05-27T05:20:45.954710
amazon,,MIZA Women's Sports T Shirt Soft Elastic Material Workout Gym Fitness Fashion Summer Lightweight Girls Women,,Sports,EGP 310.00,,,3.0,,,,,https://m.media-amazon.com/images/I/71NkXI4Tx3L._AC_UL320_.jpg,https://www.amazon.eg/dp/B0FDGRTXTJ,2026-05-27T05:20:45.955317
amazon,,"TOTAL Half-Coated Neoprene Kettlebell | Premium Indian-Made Strength Training Equipment for Home & Gym | Durable Grip for Heavy Workout, Bodybuilding, Weightlifting & CrossFit | Ideal for Men & Women",,Sports,"EGP 3,400.00",,,,,,,,https://m.media-amazon.com/images/I/61HcaFBUWGL._AC_UL320_.jpg,https://www.amazon.eg/dp/B0DL34S143,2026-05-27T05:20:45.955701
amazon,,Mens Sports Set T-Shirt and Shorts Roselyn Rukra Multi Color Multi Size Workout Set,,Sports,EGP 450.00,,,5.0,,,,,https://m.media-amazon.com/images/I/51I-Xqef7PL._AC_UL320_.jpg,https://www.amazon.eg/dp/B0GYZ8FZV4,2026-05-27T05:20:45.956138
amazon,,Sport Sweatpants Wide Leg With Line – High Waist - Side Pockets Drawstring Pants Women Sports wear,,Sports,EGP 455.00,,,4.2,,,,,https://m.media-amazon.com/images/I/51Xjcw5ryRL._AC_UL320_.jpg,https://www.amazon.eg/dp/B0BH1C6RLS,2026-05-27T05:20:45.956699
amazon,,"Parsonver Smart Watch Men Women Answer/Make Call, 1.83"" Fitness Tracker with 100+ Sports, BMI, Heart Rate, Sleep Monitor, SpO2, Stress Measurement, IP68 Waterproof Sports Watch for Android iOS, Black",,Sports,"EGP 3,783.00",,,4.1,,,,,https://m.media-amazon.com/images/I/71MsMUdNBLL._AC_UL320_.jpg,https://www.amazon.eg/dp/B0D97YWJB1,2026-05-27T05:20:45.957133
amazon,,"Mibro Lite3 Pro 1.32 Inch Men's and Women's Smart Watch with Bluetooth Call, Supports 150+ Sports Mode, SeekBeats, GPS, Health Tracking, Fitness Tracker, Heart Rate, Waterproof 5ATM (Rose Gold)",,Sports,"EGP 5,999.00",,,4.0,,,,,https://m.media-amazon.com/images/I/71lonoJG6jL._AC_UL320_.jpg,https://www.amazon.eg/dp/B0DF7JFFTP,2026-05-27T05:20:45.957556
amazon,,Sports Head Sweat Bands Headbands,,Sports,EGP 180.48,,,2.8,,,,,https://m.media-amazon.com/images/I/6153iA1YwXL._AC_UL320_.jpg,https://www.amazon.eg/dp/B097LRRH6N,2026-05-27T05:20:45.957972
amazon,,"city star sport Set Of 3 Pieces Of Fitness Set With Non-Toxic, Long Lasting Material - Red",,Sports,EGP 470.00,,,,,,,,https://m.media-amazon.com/images/I/71eDuxuOQsL._AC_UL320_.jpg,https://www.amazon.eg/dp/B01GG2PJTC,2026-05-27T05:20:45.958353
amazon,,"M-Store Ball Super – High-Durability Plastic Ball for Sports, Fitness, and Training, Perfect for Strengthening, Balance, and Coordination - Multicolor",,Sports,"EGP 3,840.66",,,,,,,,https://m.media-amazon.com/images/I/412Olsz-IiL._AC_UL320_.jpg,https://www.amazon.eg/dp/B0FY6SL8ZL,2026-05-27T05:20:45.958718
amazon,,"Fitpolo Smart Watch for Men Women with Bluetooth Call, Alexa Built-in 1.8"" Blood Oxygen Heart Rate Sleep Fitness Watch, 100 Sports Modes Smartwatch, Activity Tracker for Android iOS Phone",,Sports,"EGP 6,290.00",,,4.2,,,,,https://m.media-amazon.com/images/I/61YAYpi1G1L._AC_UL320_.jpg,https://www.amazon.eg/dp/B0CCHM7BG7,2026-05-27T05:20:45.959141
amazon,,Sport Top - Long Sleeve Crew Neck Sport T-shirt - Sport T-shirt - Women,,Sports,EGP 355.50,,,4.2,,,,,https://m.media-amazon.com/images/I/61mOsYDfZFL._AC_UL320_.jpg,https://www.amazon.eg/dp/B0BH2Y4NZR,2026-05-27T05:20:45.959688
amazon,,"Antibacterial Sports Towel, 100% Cotton (50 x 120 cm), Polygiene Technology, Soft, Absorbent, Ideal for All Sports & Fitness – INATURAL (Royal Blue)",,Sports,EGP 699.00,,,5.0,,,,,https://m.media-amazon.com/images/I/61hooWmiAnL._AC_UL320_.jpg,https://www.amazon.eg/dp/B0DGQL7B3M,2026-05-27T05:20:45.960117
amazon,,M-Store 1.5m training stick,,Sports,EGP 148.00,,,,,,,,https://m.media-amazon.com/images/I/51UmtNqCrVL._AC_UL320_.jpg,https://www.amazon.eg/dp/B0G263BRRZ,2026-05-27T05:20:45.960489
amazon,,Slimming And Exercise Knee Pants,,Sports,EGP 270.00,,,1.8,,,,,https://m.media-amazon.com/images/I/61O+A47WttL._AC_UL320_.jpg,https://www.amazon.eg/dp/B091CQQ4SG,2026-05-27T05:20:45.960899
amazon,,"Other Sports Shaker Bottle, 500ml, Plastic, Round, Black, Protein Shakes, Sports, Fitness, Travel, Everyday Use",,Sports,EGP 180.00,EGP 185.00,,3.9,List:,,,,https://m.media-amazon.com/images/I/41rwhHKU33L._AC_UL320_.jpg,https://www.amazon.eg/dp/B091JBVDPS,2026-05-27T05:20:45.961392
amazon,,"SHOWDAY Women's Zip Front Sports Bra, Wireless High Support Workout Bra, Post Surgery Active Bra for Yoga, Gym & Fitness",,Sports,EGP 339.99,EGP 399.99,,4.0,Was:,,,,https://m.media-amazon.com/images/I/41SGwpcECAL._AC_UL320_.jpg,https://www.amazon.eg/dp/B0FL85XMCW,2026-05-27T05:20:45.961956
amazon,,"ZJchao Body Shaping Belt, Fitness Adjustable Body Shaper Corset Waist Protector Lumbar Waist Training Belt for Indoor Outdoor Sports",,Sports,EGP 250.00,,,2.1,,,,,https://m.media-amazon.com/images/I/5107Lgs0LsL._AC_UL320_.jpg,https://www.amazon.eg/dp/B08CDZGVRD,2026-05-27T05:20:49.733436
amazon,,"6 mm Floor Protection Mat for Fitness Equipment Exercise Bike - Sports Treadmill Mat, Multifunctional Mat Black | More Stability, Less Vibration, Protects the Floor, Exercise Mat Yoga Available in 4",,Sports,"EGP 3,499.00",,,,,,,,https://m.media-amazon.com/images/I/71LeaGL7sLL._AC_UL320_.jpg,https://www.amazon.eg/dp/B098X7HHS2,2026-05-27T05:20:49.733871
amazon,,"Women's Seamless Workout Set, High Waist Shorts and Sports Bra, 2 Piece Athletic Yoga Fitness Gym Wear, Free Size 50-80 kg",,Sports,EGP 299.00,,,3.8,,,,,https://m.media-amazon.com/images/I/61SaispgjgL._AC_UL320_.jpg,https://www.amazon.eg/dp/B0FLGB714T,2026-05-27T05:20:49.735390
amazon,,MEZA Dry Fit Sweatshirts for Girls and Women Soft Stretch Long Sleeve Gym Walking Everyday T-Shirt with Zipper,,Sports,EGP 404.10,EGP 449.00,,3.6,Was:,,,,https://m.media-amazon.com/images/I/61LcnqXHGrL._AC_UL320_.jpg,https://www.amazon.eg/dp/B0F9XRBPP9,2026-05-27T05:20:49.735993
amazon,,"Gym Bag Sports Duffle Bag - Large Capacity Waterproof Light Exercise Fitness Swimming Yoga Outdoor Travel Bag for Men and Women, Purple, Travel Duffle",,Sports,EGP 465.00,,,4.0,,,,,https://m.media-amazon.com/images/I/61Bz9sQoB8L._AC_UL320_.jpg,https://www.amazon.eg/dp/B0BX6DSVZR,2026-05-27T05:20:49.736442
amazon,,"MIZA Women's Long Sleeve Sports T-Shirt – Light and Comfortable Breathable Fabric – Perfect for Running, Fitness and Daily Sports Activities Half Zip",,Sports,EGP 359.10,,,3.2,,,,,https://m.media-amazon.com/images/I/71n3A6YtMGL._AC_UL320_.jpg,https://www.amazon.eg/dp/B0FNN9J54M,2026-05-27T05:20:49.736961
amazon,,"MIZAYA Sports Set for Girls and Women - T-Shirt and Shorts Assorted Colors, Suitable for Sports and Fitness, Comfortable and Fashionable Design",,Sports,EGP 319.50,EGP 355.00,Save 10%,4.4,Was:,,,,https://m.media-amazon.com/images/I/619X-0dihTL._AC_UL320_.jpg,https://www.amazon.eg/dp/B0DT4NZQZC,2026-05-27T05:20:49.737476
amazon,,"ZGWJ Sports Gym Bag with Wet Pocket & Shoes Compartment, Waterproof Shoulder Weekender Bag for Women and Men Swim Sports Travel Duffel Bag Lightweight and easy Carry on Purple",,Sports,EGP 475.00,,,4.1,,,,,https://m.media-amazon.com/images/I/618egZXkMuL._AC_UL320_.jpg,https://www.amazon.eg/dp/B0B99PYZQY,2026-05-27T05:20:49.737893
amazon,,"Sports Bag for Men and Women with Shoe Compartment & Wet Compartment, Travel Bag, Waterproof Large Weekender Bag for Sports, Fitness & Travel, Training Bag, Gym Bag, Pink",,Sports,EGP 414.45,EGP 469.90,Save 12%,4.0,Was:,,,,https://m.media-amazon.com/images/I/51ADY2geqTL._AC_UL320_.jpg,https://www.amazon.eg/dp/B0C58HQFR3,2026-05-27T05:20:49.738396
amazon,,"Women’s High Waist Sports Leggings with Multi-Color Side Stripes – Stretch Workout Yoga Pants for Gym, Running, Fitness & Daily Wear – Comfortable, Breathable,",,Sports,EGP 199.00,,,,,,,,https://m.media-amazon.com/images/I/41j53beTWCL._AC_UL320_.jpg,https://www.amazon.eg/dp/B0G4S28788,2026-05-27T05:20:49.738761
amazon,,"CMF Watch 3 Pro Smart Watch for Men Women, Bluetooth Call AI Smartwatch with Energy Score, Heart Rate Tracking, Sleep Monitor, GPS & 130+ Sport Modes, Fitness Tracker for Android iOS, IP68 Green",,Sports,"EGP 3,999.00",,,4.3,,,,,https://m.media-amazon.com/images/I/71vXbvxHC0L._AC_UL320_.jpg,https://www.amazon.eg/dp/B0F66W6YVB,2026-05-27T05:20:49.739207
amazon,,"Horse Moves - Women's Printed Legging, High Waist Gym & Yoga Pants, Breathable Stretch Fitness Tights for Running & Workout",,Sports,EGP 750.00,,,5.0,,,,,https://m.media-amazon.com/images/I/51ET1Q3chVL._AC_UL320_.jpg,https://www.amazon.eg/dp/B0H225R9W9,2026-05-27T05:20:49.739722
amazon,,MEZA Long Sleeve Athletic Workout Shirt with Finger Holes for Girls and Women,,Sports,EGP 359.10,EGP 399.00,Save 10%,4.0,Was:,,,,https://m.media-amazon.com/images/I/71I3-c8zEKL._AC_UL320_.jpg,https://www.amazon.eg/dp/B0FG3CG65H,2026-05-27T05:20:49.740288
amazon,,Sport T-shirt - Round Neck Short Sleeve T-Shirt - Sportswear - Sport T-shirt,,Sports,EGP 365.00,,,4.0,,,,,https://m.media-amazon.com/images/I/51sLMnY1X4L._AC_UL320_.jpg,https://www.amazon.eg/dp/B0B49MBTTL,2026-05-27T05:20:49.740806
amazon,,Women's Lycra Sport Short Sleeve T-Shirt Workout Top Stylish Design With Side Ties Green Navy,,Sports,EGP 564.00,,,,,,,,https://m.media-amazon.com/images/I/51gM2frbK3L._AC_UL320_.jpg,https://www.amazon.eg/dp/B0GTZQSJH7,2026-05-27T05:20:49.741219
amazon,,MIZAYEH Womens Fashion Athletic Set - Long Sleeve Zipper Crop Top + Side Stripe Leggings | Comfortable Workout Tracksuit Casual Wear for Girls and Women,,Sports,EGP 539.10,,,4.3,,,,,https://m.media-amazon.com/images/I/61pGeodnjgL._AC_UL320_.jpg,https://www.amazon.eg/dp/B0F12PM97X,2026-05-27T05:20:49.741629
amazon,,MIZAYEH Women's Seamless Comfortable Sports Set with Bra and Leggings - Sports Push Set for Workout & Gym,,Sports,EGP 431.10,,,3.6,,,,,https://m.media-amazon.com/images/I/61RbwQShL5L._AC_UL320_.jpg,https://www.amazon.eg/dp/B0FHKQ31B5,2026-05-27T05:20:49.742049
amazon,,"Women's 3pcs Seamless Workout Outfits Sets, Yoga Sportswear Tracksuit Leggings and Stretch Sports Bra Fitness",,Sports,"EGP 1,799.99",,,2.3,,,,,https://m.media-amazon.com/images/I/51ukrmmvmAL._AC_UL320_.jpg,https://www.amazon.eg/dp/B0DW9HHMC7,2026-05-27T05:20:49.742479
amazon,,Force Sports Gym Bag Mesh Durable Lightweight Travel Duffle for Workout Training Fitness and Beach with Adjustable Strap and Spacious Compartment (Blue),,Sports,EGP 330.00,,,5.0,,,,,https://m.media-amazon.com/images/I/61+gRpWaisL._AC_UL320_.jpg,https://www.amazon.eg/dp/B0CZHJFRKS,2026-05-27T05:20:49.742892
amazon,,"Miza Women's Sports Set – Crop Top & Leggings – Imported 100% Full Lycra Material – Comfortable for Workout, Yoga & Daily Wear",,Sports,EGP 788.00,,,5.0,,,,,https://m.media-amazon.com/images/I/612-u5gn5eL._AC_UL320_.jpg,https://www.amazon.eg/dp/B0GMJSHXBM,2026-05-27T05:20:49.743344
amazon,,"okasis Sport Bag, Gym Backpack Fitness Travel Waterproof Bag Weekend Travel Bag Foldable Bag with Shoe Compartment Sports Bags Ideal for Youth and Adults, Men and Women (Black)",,Sports,EGP 452.00,,,4.4,,,,,https://m.media-amazon.com/images/I/51Ua-ky8m3L._AC_UL320_.jpg,https://www.amazon.eg/dp/B07WYC5D15,2026-05-27T05:20:49.743761
amazon,,"Women's Handbag Travel Sports Bag Fitness Yoga Work School Weekend Outdoor Expandable Large Shoulder Bag, black, Large,",,Sports,EGP 311.81,,,3.3,,,,,https://m.media-amazon.com/images/I/81mZi6iqyCS._AC_UL320_.jpg,https://www.amazon.eg/dp/B0957H4C46,2026-05-27T05:20:49.744256
amazon,,"Red Plume Men Compression Tights Sports T-Shirt,Digital Printing Fitness Shirt",,Sports,EGP 650.00,,,4.0,,,,,https://m.media-amazon.com/images/I/71yUKvJ+WmL._AC_UL320_.jpg,https://www.amazon.eg/dp/B018FYTUDU,2026-05-27T05:20:49.744665
amazon,,Wholesale Fashion Fitness Beauty Back Sports Underwear Suit Shock-absorbing and Anti-shaking Seamless Sports Bra Set With Women,,Sports,EGP 410.00,,,3.0,,,,,https://m.media-amazon.com/images/I/41Q7rZU+jDL._AC_UL320_.jpg,https://www.amazon.eg/dp/B0FFL8Y818,2026-05-27T05:20:49.745080
amazon,,LAWENDA Colourful Graffiti Sports Bag Women's Cute Travel Bag Kids Girls Dance Bag Training Bag for Fitness Gymnastics Swimming Pink Blue Sports Bag with Waterproof Bag Shoe Compartment Shoulder Strap,,Sports,EGP 585.00,,,4.7,,,,,https://m.media-amazon.com/images/I/61LBesGkwsL._AC_UL320_.jpg,https://www.amazon.eg/dp/B0BZTT2YRF,2026-05-27T05:20:49.745559
amazon,,Women's Slim Fit Sports Jacket - Long Sleeve Zip Front Sport Tops for Workout Yoga Daily Wear,,Sports,EGP 764.99,EGP 899.99,,,Was:,,,,https://m.media-amazon.com/images/I/51vHkkuVqOL._AC_UL320_.jpg,https://www.amazon.eg/dp/B0GL9C6DP6,2026-05-27T05:20:49.746073
amazon,,BANGE NEW Men Backpack Shoes Backpack Waterproof Travel Sports Fitness,,Sports,"EGP 2,450.00",,,3.4,,,,,https://m.media-amazon.com/images/I/51qvktYAdEL._AC_UL320_.jpg,https://www.amazon.eg/dp/B0BFJKTDB7,2026-05-27T05:20:49.746493
amazon,,Sports Fitness And Training,,Sports,"EGP 1,794.00",,,,,,,,https://m.media-amazon.com/images/I/71vd-y89npL._AC_UL320_.jpg,https://www.amazon.eg/dp/1788824067,2026-05-27T05:20:49.746885
amazon,,"M-Store Men's XXL Athletic Pullover Hoodie - Premium Sports Sweatshirt with Bold Graphics, Comfort Fit, Breathable Fabric (Black)",,Sports,EGP 384.18,,,5.0,,,,,https://m.media-amazon.com/images/I/41cIG6CLjwL._AC_UL320_.jpg,https://www.amazon.eg/dp/B0FY6Y2CNH,2026-05-27T05:20:49.747320
amazon,,Force Sports Gym Bag Mesh Durable Lightweight Travel Duffle for Workout Training Fitness and Beach with Adjustable Strap and Spacious Compartment (Grey & Red),,Sports,EGP 330.00,,,,,,,,https://m.media-amazon.com/images/I/81p1ihG6qwL._AC_UL320_.jpg,https://www.amazon.eg/dp/B0CZHD79LJ,2026-05-27T05:20:49.747691
amazon,,Force Sports Gym Bag Mesh Durable Lightweight Travel Duffle for Workout Training Fitness and Beach with Adjustable Strap and Spacious Compartment (Coal Grey Black Straps),,Sports,EGP 330.00,,,4.0,,,,,https://m.media-amazon.com/images/I/71ohoRGWfjL._AC_UL320_.jpg,https://www.amazon.eg/dp/B0CZHSSN3R,2026-05-27T05:20:49.748124
amazon,,Force Sports Gym Bag Mesh Durable Lightweight Travel Duffle for Workout Training Fitness and Beach with Adjustable Strap and Spacious Compartment (Blue & Black),,Sports,EGP 499.00,,,5.0,,,,,https://m.media-amazon.com/images/I/81sBlRQ4O-L._AC_UL320_.jpg,https://www.amazon.eg/dp/B0CZHMW9JY,2026-05-27T05:20:49.748541
amazon,,Summer Lycra Sports wear - Sport Leggings Special,,Sports,EGP 299.00,,,3.4,,,,,https://m.media-amazon.com/images/I/515GF7+uGBL._AC_UL320_.jpg,https://www.amazon.eg/dp/B0CFZCZMJ8,2026-05-27T05:20:49.748953
amazon,,"6 Pack Yoga Headbands for Women, Non Slip Elastic Sweat Hairbands, Solid Color Head Accessories Headscarves Hair Hoop, Sweat-Absorbing Hairbands for Sports, Fitness, Running",,Sports,EGP 249.99,,,4.4,,,,,https://m.media-amazon.com/images/I/71qRhtKwHOL._AC_UL320_.jpg,https://www.amazon.eg/dp/B0BZL2B1R6,2026-05-27T05:20:49.749379
amazon,,Sports T-Shirt - long sleeve top - Half zipper quick dry Tee - Running and gym T- shirts - sportswear for men,,Sports,EGP 365.00,,,4.4,,,,,https://m.media-amazon.com/images/I/51GERLfw-BL._AC_UL320_.jpg,https://www.amazon.eg/dp/B0F9YS94WC,2026-05-27T05:20:49.749962
amazon,,"MIZAYA Sports Set for Girls and Women - T-Shirt and Shorts Assorted Colors, Suitable for Sports and Fitness, Comfortable and Fashionable Design",,Sports,EGP 319.50,EGP 355.00,,4.4,Was:,,,,https://m.media-amazon.com/images/I/61xp9Xjzd8L._AC_UL320_.jpg,https://www.amazon.eg/dp/B0DT4KFFNV,2026-05-27T05:20:49.750467
amazon,,PUMA Womens 4KEEPS BRA Sports Bra,,Sports,EGP 972.00,,,4.5,,,,,https://m.media-amazon.com/images/I/71KrI7TjS3L._AC_UL320_.jpg,https://www.amazon.eg/dp/B0D35W2221,2026-05-27T05:20:49.750901
amazon,,MEZA Women's Sports Leggings High Waist Fashion Yoga Gym Leggings Multi Color One Size 50-90KG Soft Elastic Material for Girls and Women,,Sports,EGP 206.10,EGP 229.00,,4.0,List:,,,,https://m.media-amazon.com/images/I/61Xr1LpwtwL._AC_UL320_.jpg,https://www.amazon.eg/dp/B0FTGCKW4X,2026-05-27T05:20:49.751519
amazon,,Reebok MEN RUNNING SS SPEEDWICK TEE Fitness,,Sports,EGP 898.00,"EGP 1,669.00",,3.9,List:,,,,https://m.media-amazon.com/images/I/41rpxbEyz6L._AC_UL320_.jpg,https://www.amazon.eg/dp/B0CBV28TFW,2026-05-27T05:20:49.752001
amazon,,"Sports Gym Bag Duffel with Shoes Compartment, Macause Backpack Fitness Crossbody Straps Travel Luggage Men Women Weekend Rucksack Holdall Carry on for Swimming Football Basketball, Black",,Sports,EGP 490.58,,,3.9,,,,,https://m.media-amazon.com/images/I/619B3DF42TL._AC_UL320_.jpg,https://www.amazon.eg/dp/B09NY5VGHL,2026-05-27T05:20:49.752446
