platform,asin,title,brand,category,current_price,original_price,discount,rating,reviews_count,prime_eligible,amazon_choice,sponsored,main_image,product_url,scraped_at
amazon,,"Cycling Gloves Male Spring and Summer Full Finger Outdoor Sports Touch Screen Breathable Thin Non-slip High Elastic Quick-drying Mesh Gloves Outdoor Fitness (Black,L)",,Sports,EGP 355.00,,,2.7,,,,,https://m.media-amazon.com/images/I/61Q06VFlVRL._AC_UL320_.jpg,https://www.amazon.eg/dp/B086HLNH5B,2026-05-27T05:20:49.752857
amazon,,Nexus women's Unity Seamless Leggings,,Sports,EGP 800.00,,,2.8,,,,,https://m.media-amazon.com/images/I/61JfGoCIqsL._AC_UL320_.jpg,https://www.amazon.eg/dp/B0B1MV23F8,2026-05-27T05:20:49.753313
amazon,,Doe Plain Sportive Stretch Leggings Activewear Sportswear Womens legging Gym legging Teal Blue,,Sports,EGP 550.00,,,5.0,,,,,https://m.media-amazon.com/images/I/51uAM0v-ojL._AC_UL320_.jpg,https://www.amazon.eg/dp/B0D5WNG7MT,2026-05-27T05:20:49.753716
amazon,,The Sport and Fitness Sector: An Introduction,,Sports,"EGP 1,850.00",,,4.7,,,,,https://m.media-amazon.com/images/I/61qR7IdF6oL._AC_UL320_.jpg,https://www.amazon.eg/dp/0415454050,2026-05-27T05:20:49.754178
amazon,,"Sport Gym Bag for Women Men Travel Duffle Bag with Wet Pocket & Shoe Compartment Fitness Waterproof Workout Bag Overnight Weekender Travel Bag Carry on Bag Handbag Hospital Holdalls, Blue, Travel Bag",,Sports,EGP 700.00,"EGP 1,000.00",Save 30%,4.8,Was:,,,,https://m.media-amazon.com/images/I/61zHJ2D-UgL._AC_UL320_.jpg,https://www.amazon.eg/dp/B0C1FR3SLJ,2026-05-27T05:20:49.754668
amazon,,MEZA Women's Black High Waist Pants Fashion Side Stripe Workout Yoga Pants,,Sports,EGP 179.10,EGP 199.00,,3.7,List:,,,,https://m.media-amazon.com/images/I/41EsDLUbemL._AC_UL320_.jpg,https://www.amazon.eg/dp/B0FGFHJ6MG,2026-05-27T05:20:49.755261
amazon,,"SMART Walking Pad, Multi-track home treadmill - for fitness - 5-year warranty - DC motor - automatic lubrication, for home use. Foldable and easy to move -120kg Capacity",,Sports,"EGP 17,139.33",,,,,,,,https://m.media-amazon.com/images/I/51n5rCJJEeL._AC_UL320_.jpg,https://www.amazon.eg/dp/B0G17L3XYT,2026-05-27T05:20:52.604997
amazon,,"TRUE FIT FITNESS 310 AZ treadmill with a 5-y warranty and a multifunction display, contains LCD screen and two motors with a maximum user weight of 150 kg with a dedicated motor for incline function.",,Sports,"EGP 29,870.00",,,2.0,,,,,https://m.media-amazon.com/images/I/71At6QewR3L._AC_UL320_.jpg,https://www.amazon.eg/dp/B0FBMNGC5R,2026-05-27T05:20:52.605560
amazon,,"SMART Walking Pad, Multi-track home treadmill - for fitness - 5-year warranty - DC motor - automatic lubrication, for home use -120kg Capacity",,Sports,"EGP 17,072.64",,,,,,,,https://m.media-amazon.com/images/I/511pfIB+JOL._AC_UL320_.jpg,https://www.amazon.eg/dp/B0G17PS3RK,2026-05-27T05:20:52.606009
amazon,,"SMART FIT ® Workout Elastic Band with 8 Loops for Yoga, Physical Therapy, Dance, Fitness, Stretching Assist - Light Resistance Band for Strength and Flexibility Training",,Sports,EGP 160.06,,,2.0,,,,,https://m.media-amazon.com/images/I/61ELW2IJxZL._AC_UL320_.jpg,https://www.amazon.eg/dp/B0G16TCT5V,2026-05-27T05:20:52.606543
amazon,,"CORIOS Fitness Bag Large Capacity Travel Bag Hand Bag Luggage Swimming Bag Gym Bag with Compartment Beach Shoes Weekend Bag for Men and Women, pink, L, functional sports",,Sports,EGP 450.00,EGP 500.00,,4.1,Was:,,,,https://m.media-amazon.com/images/I/51hiyT51q7L._AC_UL320_.jpg,https://www.amazon.eg/dp/B0C38K8485,2026-05-27T05:20:52.607039
amazon,,RUIXIA Children's Half Finger Gloves Cycling Gloves Sports Gloves Fingerless Gloves Outdoor Non-Slip Mittens Gloves for Cycling Fitness Training for Boys Girls,,Sports,EGP 245.00,,,3.4,,,,,https://m.media-amazon.com/images/I/717VGkoj0SL._AC_UL320_.jpg,https://www.amazon.eg/dp/B08YDTPK96,2026-05-27T05:20:52.607472
amazon,,"MIZAYA Sports Set for Girls and Women - T-Shirt and Shorts Assorted Colors, Suitable for Sports and Fitness, Comfortable and Fashionable Design",,Sports,EGP 319.50,EGP 355.00,,4.4,Was:,,,,https://m.media-amazon.com/images/I/61e9QJfD33L._AC_UL320_.jpg,https://www.amazon.eg/dp/B0DT4PJ3S7,2026-05-27T05:20:52.607952
amazon,,"Men's Digital Sports Watch, WR30M Water Resistant with LED Backlight, Alarm, Stopwatch, and Calendar - Modern Durable & Comfortable Design",,Sports,EGP 399.00,,,,,,,,https://m.media-amazon.com/images/I/61M3Aov7hbL._AC_UL320_.jpg,https://www.amazon.eg/dp/B0GZC7VW1N,2026-05-27T05:20:52.608358
amazon,,"M-Store Men's XXL Athletic Pullover Hoodie - Premium Sports Sweatshirt with Bold Graphics, Comfort Fit, Breathable Fabric (Gray)",,Sports,EGP 384.18,,,,,,,,https://m.media-amazon.com/images/I/512AswXi-FL._AC_UL320_.jpg,https://www.amazon.eg/dp/B0FY68NXRN,2026-05-27T05:20:52.608731
amazon,,Romba Women's High Waist Athletic Leggings | Camo Stripe | Comfortable Fit for Sports & Fitness,,Sports,EGP 359.10,EGP 399.00,,3.4,Was:,,,,https://m.media-amazon.com/images/I/612nXuXA6kL._AC_UL320_.jpg,https://www.amazon.eg/dp/B0DQ57DS45,2026-05-27T05:20:52.609308
amazon,,MIZA Women's Long Sleeve Half Zip Athletic Tops - Comfortable Elastic Material Suitable for Sports and Daily Use Sports T-Shirt for Girls and Women,,Sports,EGP 404.10,,,3.0,,,,,https://m.media-amazon.com/images/I/81bFsG8CqeL._AC_UL320_.jpg,https://www.amazon.eg/dp/B0FK5JP4YP,2026-05-27T05:20:52.609839
amazon,,"Beauenty Men's And Women's Sports Fitness Bag With Shoe Position Dry And Wet Separation, Large Capacity, Foldable, 3 in1 Fitness/Yoga/Training/Handbag For Travel Sports Fitness Convertible Bag (Black)",,Sports,EGP 430.00,,,2.2,,,,,https://m.media-amazon.com/images/I/61PygpuomNL._AC_UL320_.jpg,https://www.amazon.eg/dp/B08ZMXNN45,2026-05-27T05:20:52.610296
amazon,,Force Sports Gym Bag Mesh Durable Lightweight Travel Duffle for Workout Training Fitness and Beach with Adjustable Strap and Spacious Compartment (Mesh Ocean Blue),,Sports,EGP 499.00,,,2.0,,,,,https://m.media-amazon.com/images/I/81AE8WD-gIL._AC_UL320_.jpg,https://www.amazon.eg/dp/B0CZH8WWMN,2026-05-27T05:20:52.610712
amazon,,Force Sports Gym Bag Mesh Durable Lightweight Travel Duffle for Workout Training Fitness and Beach with Adjustable Strap and Spacious Compartment (Yellow),,Sports,EGP 330.00,EGP 499.00,,4.6,List:,,,,https://m.media-amazon.com/images/I/81-81TgM0lL._AC_UL320_.jpg,https://www.amazon.eg/dp/B0CZHB473N,2026-05-27T05:20:52.611217
amazon,,"FURN ASPIRE cotton blend 25 Cms Gym Bag(VERI-316-BAGS_Blue), H. Blue, Leisure Sports Fitness Swimming Yoga Gym Bag",,Sports,EGP 466.71,,,3.6,,,,,https://m.media-amazon.com/images/I/61hR5IcWTSL._AC_UL320_.jpg,https://www.amazon.eg/dp/B0B294871Z,2026-05-27T05:20:52.611639
amazon,,"Sports Bag Women Men Travel Bag Foldable Waterproof Fitness Bag with Wet Compartment Pockets, Lightweight Swimming Bag Duffel Bag Weekend Bag School Gym Outdoor Shopping Training Bag Unisex,",,Sports,EGP 264.60,,,4.2,,,,,https://m.media-amazon.com/images/I/61MFfsuKNmL._AC_UL320_.jpg,https://www.amazon.eg/dp/B09XB8YMZV,2026-05-27T05:20:52.612094
amazon,,Force Sports Gym Bag Mesh Durable Lightweight Travel Duffle for Workout Training Fitness and Beach with Adjustable Strap and Spacious Compartment (Grey),,Sports,EGP 330.00,,,3.5,,,,,https://m.media-amazon.com/images/I/71NzFXRRtSL._AC_UL320_.jpg,https://www.amazon.eg/dp/B0CZGZ2XZR,2026-05-27T05:20:52.612535
amazon,,Souq Albasha Unisex Grey Headbands Cotton Terry Sweatband Headbands Ideal for Sports Yoga Fitness,,Sports,EGP 249.00,,,,,,,,https://m.media-amazon.com/images/I/81hc3FDMStL._AC_UL320_.jpg,https://www.amazon.eg/dp/B0DJHP37M6,2026-05-27T05:20:52.612908
amazon,,Force Sports Gym Bag Mesh Orange Durable Lightweight Travel Duffle for Workout Training Fitness and Beach with Adjustable Strap and Spacious Compartment,,Sports,EGP 499.00,,,,,,,,https://m.media-amazon.com/images/I/81hkfrNRlPL._AC_UL320_.jpg,https://www.amazon.eg/dp/B0CZHG7QKW,2026-05-27T05:20:52.613291
amazon,,Sports Hat for Men Women Classic Knit Sun Protection UV Protection Wide Brim Beachwear Running Yoga Fitness Cycling Cap,,Sports,EGP 120.00,,,4.4,,,,,https://m.media-amazon.com/images/I/51yZKIk5xCL._AC_UL320_.jpg,https://www.amazon.eg/dp/B0F4SS296K,2026-05-27T05:20:52.613784
amazon,,"SONIX FIT ® Relax SUN 540R Sports Wheel Designed for Fitness Exercise and Various Weight Loss Programs. Muscle Building and Slimming, Multi Measurement Screen, 150 kg Weight Capacity",,Sports,"EGP 14,100.00",,,,,,,,https://m.media-amazon.com/images/I/51uXR0zWaVL._AC_UL320_.jpg,https://www.amazon.eg/dp/B0GRRQGCR3,2026-05-27T05:20:52.614239
amazon,,"SONIX FIT ® EH-MB02WIN Sports Wheel Designed for Fitness Exercise and Various Weight Loss Programs, Muscle Building and Slimming 100 kg",,Sports,"EGP 10,750.00",,,,,,,,https://m.media-amazon.com/images/I/51A9fw+odiL._AC_UL320_.jpg,https://www.amazon.eg/dp/B0GRRK3JVW,2026-05-27T05:20:52.614682
amazon,,"SMART FIT ® Powerful Foam Exercise Roller, Fitness Equipment, Yoga, Pilates for Deep Tissue Massage, Sports Accessories, Muscle Massager Block by Active Forever (Green)",,Sports,EGP 350.00,EGP 380.13,,,List:,,,,https://m.media-amazon.com/images/I/21ox9rUq6AL._AC_UL320_.jpg,https://www.amazon.eg/dp/B0G16YQ3PM,2026-05-27T05:20:52.615193
amazon,,"Foldable Travel Bag - Waterproof with Shoe Compartment for Long Plane Journeys, Short Train Journeys",,Sports,EGP 450.00,,,3.7,,,,,https://m.media-amazon.com/images/I/710z2yq6PfL._AC_UL320_.jpg,https://www.amazon.eg/dp/B0C1RKVZZK,2026-05-27T05:20:52.616206
amazon,,"2pcs Cotton Sweat Bands - 95% Egyption Cotton, Sport Headbands for Women's, Men - Workout Headbands - Running Headband - perfect for daily wear.",,Sports,EGP 149.99,,,3.9,,,,,https://m.media-amazon.com/images/I/61oC1bfWewL._AC_UL320_.jpg,https://www.amazon.eg/dp/B0FHJW4MSH,2026-05-27T05:20:52.616626
amazon,,"Sports Gym Bag with Wet Pocket & Shoe Compartment Fitness Workout for Women Duffel Travel Girls Weekender Overnight Workout Sports Carry On Luggage Waterproof Large Capacity Lightweight, Red, Large",,Sports,EGP 444.90,,,1.0,,,,,https://m.media-amazon.com/images/I/612ga9lwFmL._AC_UL320_.jpg,https://www.amazon.eg/dp/B09Q5KT14J,2026-05-27T05:20:52.617044
amazon,,Outdoor Leisure Bag Yoga Fitness Sports Backpack With Shoe Compartment College Students Sports Duffels For Travel Basketball Football,,Sports,EGP 450.00,,,3.4,,,,,https://m.media-amazon.com/images/I/51WJTjMZcPL._AC_UL320_.jpg,https://www.amazon.eg/dp/B09VZ3BK22,2026-05-27T05:20:52.617482
amazon,,"Sports Bag Women Men Travel Bag Foldable Waterproof Fitness Bag with Wet Compartment Pockets, Lightweight Swimming Bag Duffel Bag Weekend Bag School Gym Outdoor Shopping Training Bag Unisex,",,Sports,EGP 296.35,,,3.6,,,,,https://m.media-amazon.com/images/I/61OLKjEonkL._AC_UL320_.jpg,https://www.amazon.eg/dp/B09XB7C5C1,2026-05-27T05:20:52.617924
amazon,,"Gym Bag Sports Duffle Bag - Large Capacity Waterproof Light Exercise Fitness Swimming Yoga Outdoor Travel Bag for Men and Women, Blue2, Travel Duffle",,Sports,EGP 465.70,,,3.8,,,,,https://m.media-amazon.com/images/I/710PmdJ8FYL._AC_UL320_.jpg,https://www.amazon.eg/dp/B0BX6DKPGP,2026-05-27T05:20:52.618379
amazon,,Women's Gym Shorts V Cross Stretch Push Up Yoga Shorts Booty Scrunch Fitness Trousers Short High Waist Seamless Workout Sports Shorts Butt Lift Short Leggings Summer,,Sports,EGP 718.10,EGP 799.00,,3.4,Was:,,,,https://m.media-amazon.com/images/I/71mdXzqDqBL._AC_UL320_.jpg,https://www.amazon.eg/dp/B0CJJMQ6HD,2026-05-27T05:20:52.618868
amazon,,"Furn Aspire Gym Bag Sports Travel Duffel Bags with Shoe Compartment & Dry Wet Separated Storage Pocket, Waterproof Fitness Workout Tote Yoga Handbag for Men and Women, B). Green, Gym Bags",,Sports,EGP 490.52,,,3.6,,,,,https://m.media-amazon.com/images/I/61k6UIM59KL._AC_UL320_.jpg,https://www.amazon.eg/dp/B0B28ZRK6W,2026-05-27T05:20:52.619315
amazon,,"Sports Gym Bag with Wet Pocket & Shoe Compartment for Men Women Backpack or handheld Fitness Workout Duffel Travel Weekender Overnight Waterproof Large Capacity Lightweight GYM bag…, black",,Sports,EGP 447.65,,,3.4,,,,,https://m.media-amazon.com/images/I/61HnkT4xjKL._AC_UL320_.jpg,https://www.amazon.eg/dp/B0B49NNJ8W,2026-05-27T05:20:52.619737
amazon,,"CORIOS Nylon Sports Bag for Men/Women Travel Bags Duffle Bag Weekender Overnight Bag Fitness Bag Swimming Bag Large Training Bag Cabin Travel Sports Gym, Green, L",,Sports,EGP 400.50,EGP 445.00,Save 10%,4.0,Was:,,,,https://m.media-amazon.com/images/I/51lmEATlKjL._AC_UL320_.jpg,https://www.amazon.eg/dp/B0C38K9HJD,2026-05-27T05:20:52.620257
amazon,,Multi Use Sports Bag with 2 Zippers + Shoe Compartment – Adjustable Shoulder Strap & Back Strap + 2 Hand Grips – Strong Waterproof Material – Ideal for Gym & Travel (Black),,Sports,EGP 755.61,,,,,,,,https://m.media-amazon.com/images/I/61WKfDsyqCL._AC_UL320_.jpg,https://www.amazon.eg/dp/B0GW3666QH,2026-05-27T05:20:52.620647
amazon,,"Sports Gym Bag with Shoes Compartment and Wet Pocket, Travel Duffle Bag Fitness Holdall Barrel Sports Bags for Men and Women, Purple",,Sports,EGP 474.90,,,2.0,,,,,https://m.media-amazon.com/images/I/51-41h4yoJL._AC_UL320_.jpg,https://www.amazon.eg/dp/B09T37XBVS,2026-05-27T05:20:52.621083
amazon,,"Half Finger Fitness Gloves Home Gym Weight Carrying Cycling Gloves (Large, Blue)",,Sports,EGP 139.50,EGP 155.00,,3.5,Was:,,,,https://m.media-amazon.com/images/I/71tVvJfZyOL._AC_UL320_.jpg,https://www.amazon.eg/dp/B09W64K6TP,2026-05-27T05:20:52.621585
amazon,,"Sports Bag & Travel Bag for Men and Women with Shoe Compartment and Wet Dry Compartment Large Capacity Travel Bag for Travel, Sports, Fitness, black, Movement",,Sports,EGP 499.90,,,2.9,,,,,https://m.media-amazon.com/images/I/61xR2E2sVIL._AC_UL320_.jpg,https://www.amazon.eg/dp/B0BHL7XS8Z,2026-05-27T05:20:52.622010
amazon,,Romba Women's High Waist Athletic Leggings | Camo Stripe | Comfortable Fit for Sports & Fitness,,Sports,EGP 359.10,EGP 399.00,,3.4,Was:,,,,https://m.media-amazon.com/images/I/71T9oNkBJML._AC_UL320_.jpg,https://www.amazon.eg/dp/B0F9B5N4MS,2026-05-27T05:20:52.622582
amazon,,"Furn Aspire Gym Bag Sports Travel Duffel Bags with Shoe Compartment & Dry Wet Separated Storage Pocket, Waterproof Fitness Workout Tote Yoga Handbag for Men and Women-w (Purple)",,Sports,EGP 485.00,,,5.0,,,,,https://m.media-amazon.com/images/I/61yqp5HAixL._AC_UL320_.jpg,https://www.amazon.eg/dp/B0BCYSRVWG,2026-05-27T05:20:52.623013
amazon,,Liveup mens Ls3033a-Xl Slim Short,,Sports,EGP 353.56,,,1.6,,,,,https://m.media-amazon.com/images/I/41nUPxt6QNL._AC_UL320_.jpg,https://www.amazon.eg/dp/B0BSCKQX8B,2026-05-27T05:20:52.623450
amazon,,"Talha Gym Bag, Travel Bag Sport Duffel Bag with Wet Pocket, Gym Duffle Bag Foldable Men Women Travel Fitness Holdall Barrel Sports Overnight Weekender Bags for Gym Travel Swimming (pruple)",,Sports,EGP 440.00,,,2.2,,,,,https://m.media-amazon.com/images/I/2109gfoChKL._AC_UL320_.jpg,https://www.amazon.eg/dp/B0DJ7PY3XK,2026-05-27T05:20:52.623927
amazon,,Romba Women's High Waist Athletic Leggings | Camo Stripe | Comfortable Fit for Sports & Fitness,,Sports,EGP 359.10,EGP 399.00,,3.4,Was:,,,,https://m.media-amazon.com/images/I/61WIiSXG5yL._AC_UL320_.jpg,https://www.amazon.eg/dp/B0DQ59KYF4,2026-05-27T05:20:52.624494
amazon,,Energetics Girls Kelina 3 Compression Pants (pack of 1),,Sports,EGP 692.00,,,,,,,,https://m.media-amazon.com/images/I/51BrKXLkltL._AC_UL320_.jpg,https://www.amazon.eg/dp/B0D45DMZ8Y,2026-05-27T05:20:52.624883
amazon,,"Di Pelle™ Cylindrical Gym Bag for Men & Women | Dual Carry Handles & Shoulder Strap | No Pain No Gain | Sports Duffel for Gym, Travel & Daily Use (Black, Small -15 L)",,Sports,EGP 320.00,,,,,,,,https://m.media-amazon.com/images/I/71DIAxJ4l0L._AC_UL320_.jpg,https://www.amazon.eg/dp/B0GWK2MS2V,2026-05-27T05:20:52.625298
amazon,,"Gym Bag Dry Wet Separated, Waterproof Sport Duffle Bag with Shoes Compartment for Sport, Yoga, Travel, Fitness, Overnight Weekend with Shoulder Strap (Pink)",,Sports,EGP 500.00,,,2.2,,,,,https://m.media-amazon.com/images/I/61+On9mPnTL._AC_UL320_.jpg,https://www.amazon.eg/dp/B08HL67KXK,2026-05-27T05:20:52.625737
amazon,,"Furn Aspire Gym Bag Sports Travel Duffel Bags with Shoe Compartment & Dry Wet Separated Storage Pocket, Waterproof Fitness Workout Tote Yoga Handbag for Men and Women, D). Black, Gym Bags",,Sports,EGP 444.00,,,3.4,,,,,https://m.media-amazon.com/images/I/51zS+hIAnsL._AC_UL320_.jpg,https://www.amazon.eg/dp/B0B2959T4W,2026-05-27T05:20:52.626173
amazon,,MySouq-Store [1PCs - Grey] Sport Headbands Sweatband Elastic Yoga Running Hair Band Sweat Bandage Workout Tennis Fitness Jog Basketball Headscarf Men Women(053),,Sports,EGP 355.00,,,,,,,,https://m.media-amazon.com/images/I/71Std+lQFNL._AC_UL320_.jpg,https://www.amazon.eg/dp/B0D3LJRCB4,2026-05-27T05:20:52.626538
amazon,,MySouq-Store [1PCs - Grey Green] Sport Headbands Sweatband Elastic Yoga Running Hair Band Sweat Bandage Workout Tennis Fitness Jog Basketball Headscarf Men Women(GG01),,Sports,EGP 333.00,,,,,,,,https://m.media-amazon.com/images/I/71G-xi7u2wL._AC_UL320_.jpg,https://www.amazon.eg/dp/B0D3LN2Y4W,2026-05-27T05:20:52.626901
amazon,,Soft Silicone Sport Band Stripe Silicone Wrist Strap Replacement for Huawei Watch Fit Fitness Smart Watch Huawei Fit - White,,Sports,EGP 118.80,EGP 139.00,,3.9,List:,,,,https://m.media-amazon.com/images/I/61MiiwlaC+S._AC_UL320_.jpg,https://www.amazon.eg/dp/B0966TBQXY,2026-05-27T05:20:52.627393
amazon,,"Gym Gloves,Training Gloves Full Wrist Support,Breathable Extra Grip Palm Protection Fitness Crossfit for Men & Women",,Sports,"EGP 1,499.00",,,3.6,,,,,https://m.media-amazon.com/images/I/71V2661HCbL._AC_UL320_.jpg,https://www.amazon.eg/dp/B0FYNLHZR8,2026-05-27T05:20:52.627808
amazon,,"M-Store Men's Premium Pullover Hoodie – Large Size Athletic Sweatshirt with Bold Sporty Prints, Breathable & Comfortable (Black)",,Sports,EGP 384.18,,,1.0,,,,,https://m.media-amazon.com/images/I/41dY6UjiPdL._AC_UL320_.jpg,https://www.amazon.eg/dp/B0FY6VD21X,2026-05-27T05:20:52.628241
amazon,,MIZEH Women's Wide Leg Sweatpants - Comfortable and Trendy Everyday Wear High Waist Wide Leg Sweatpants for Girls and Women,,Sports,EGP 386.10,,,3.9,,,,,https://m.media-amazon.com/images/I/71-oHdN5csL._AC_UL320_.jpg,https://www.amazon.eg/dp/B0F4VXX8N3,2026-05-27T05:20:52.628731
amazon,,"Pedal resistance band,resistance bands exercise bands,super light 4-tube yoga rally strap elastic pull rope fitness equipment,sit-up exercise device,pedal fitness tube(blue)",,Sports,EGP 104.60,EGP 140.00,,3.0,List:,,,,https://m.media-amazon.com/images/I/51l0SMGju3L._AC_UL320_.jpg,https://www.amazon.eg/dp/B08FDMDVFC,2026-05-27T05:20:52.629237
amazon,,5 Color Body Building Yoga Stretch Bands Fitness Resistance Belt Fitness Rubber Band Elastic Exercise Straps Indoor Sport Gym Pull Up for Fit Body Building Exercise,,Sports,EGP 100.00,,,,,,,,https://m.media-amazon.com/images/I/51jCza8kOXL._AC_UL320_.jpg,https://www.amazon.eg/dp/B091BLZVS5,2026-05-27T05:20:52.629610
amazon,,"WuGU Fitness Elastic Bands, 4 Pieces Loop Bands, Elastic Resistance Band for Pull-Up, Heavy Duty Fitness for Stretching, Resistance Workouts, Muscle Strengthening",,Sports,"EGP 2,255.00",,,4.4,,,,,https://m.media-amazon.com/images/I/71v0RJFAeCL._AC_UL320_.jpg,https://www.amazon.eg/dp/B0CQXFWMH5,2026-05-27T05:20:52.630024
amazon,,"Next Store Sports Jump Rope with Digital Jump Counter, Jump Rope for Fitness, Burn Calories, Improve Endurance, Suitable for Men and Women for Home Use and Daily Workout",,Sports,EGP 157.55,,,,,,,,https://m.media-amazon.com/images/I/61xZ2OkLPNL._AC_UL320_.jpg,https://www.amazon.eg/dp/B0FNK5H28D,2026-05-27T05:20:52.631658
amazon,,"9-Piece Sports Sweatband Wrist Set, Includes 6 Sweatbands Wristband and 3 Headbands, Fitness Arm Sports Wristbands for Men, Women, Children, Suitable for Fitness, Football and Running",,Sports,"EGP 1,499.00",,,4.4,,,,,https://m.media-amazon.com/images/I/71bMfPjXY3L._AC_UL320_.jpg,https://www.amazon.eg/dp/B0D86MV6SF,2026-05-27T05:20:52.632176
amazon,,Generic Multi-Functional Spring Cable Chest Expander Grip & Arm Strengthener - Male Chest Muscle Training - Sports Fitness - Sit-ups - Exercise Machine,,Sports,EGP 489.98,,,2.9,,,,,https://m.media-amazon.com/images/I/51kgrlK4U4L._AC_UL320_.jpg,https://www.amazon.eg/dp/B09V9LWC75,2026-05-27T05:20:57.362583
amazon,,Smart Sport Polypropylene Adjustable Home Gym Exercise Fitness Stepper for Exercise Aerobics Stepper 68cm (Blue),,Sports,EGP 753.31,,,,,,,,https://m.media-amazon.com/images/I/21peUKuoqAL._AC_UL320_.jpg,https://www.amazon.eg/dp/B0G14WKGJ6,2026-05-27T05:20:57.362981
amazon,,"SportQ Double Fun Qillet Pedal Resistance Pull Rope with 4 Tubes Foot Pedal Fitness Equipment for Abdomen, Leg, Arm, Slimming Exercise (Pink)",,Sports,EGP 92.63,EGP 118.28,,3.3,List:,,,,https://m.media-amazon.com/images/I/61q0znVpaKL._AC_UL320_.jpg,https://www.amazon.eg/dp/B0BX55N9BX,2026-05-27T05:20:57.363508
amazon,,"SKY-TOUCH Exercise Ball Anti-Burst, Yoga Ball Anti-Slip with Quick Air Pump, Gym Ball Thickened for Yoga, Pilates, Birthing,Fitness (multicolor/65cm)",,Sports,EGP 375.00,EGP 420.00,,4.0,List:,,,,https://m.media-amazon.com/images/I/61vKI6XyunL._AC_UL320_.jpg,https://www.amazon.eg/dp/B0BVQW4411,2026-05-27T05:20:57.364007
amazon,,Sports Water Bottle 1l With Time Marker Leak Proof Bpa Free Drinking Bottle For Gym Office School Travel Outdoor Fitness Motivational Reusable For Kids And Adults (Pink),,Sports,EGP 210.00,,,5.0,,,,,https://m.media-amazon.com/images/I/51fcp4Y4jNL._AC_UL320_.jpg,https://www.amazon.eg/dp/B0H2NMDTW2,2026-05-27T05:20:57.364470
amazon,,Resistance bands exercise bands for woman yoga resistance loop bands for legs and butt workout bands for home gym fitness 5 set with bag,,Sports,EGP 68.00,EGP 109.00,,2.5,List:,,,,https://m.media-amazon.com/images/I/61B1T1QnPJL._AC_UL320_.jpg,https://www.amazon.eg/dp/B091BVCWCC,2026-05-27T05:20:57.364976
amazon,,"Yoga Mat 6mm with Carrying Strap, Non-Slip Exercise Mat, Multicolor",,Sports,EGP 360.00,,,3.7,,,,,https://m.media-amazon.com/images/I/61qfsKVAnmL._AC_UL320_.jpg,https://www.amazon.eg/dp/B0F8P9WQ1C,2026-05-27T05:20:57.365522
amazon,,5 Color Body Building Yoga Stretch Bands Fitness Resistance Belt Fitness Rubber Band Elastic Exercise Straps Indoor Sport Gym Pull Up for Fit Body Building Exercise - 2724676528900,,Sports,EGP 98.10,EGP 109.00,,3.4,List:,,,,https://m.media-amazon.com/images/I/61BDJuQVfmL._AC_UL320_.jpg,https://www.amazon.eg/dp/B096D7PWQL,2026-05-27T05:20:57.366000
amazon,,"Signature Fitness BalanceFrom BFGY-AP6BLK Go Yoga All Purpose Anti-Tear Exercise Yoga Mat with Carrying Strap, Black, One Size",,Sports,EGP 685.00,,,4.4,,,,,https://m.media-amazon.com/images/I/61sUfwkakNL._AC_UL320_.jpg,https://www.amazon.eg/dp/B00FO9U46W,2026-05-27T05:20:57.366446
amazon,,"XSPORT Exercise Mat for Home, Gym or Outdoor Activities 10mm Thick - High Quality Material Made of Safe and Environmentally Friendly PVC Material with Carrying Bag",,Sports,EGP 445.00,,,2.9,,,,,https://m.media-amazon.com/images/I/51P2-H6z8SL._AC_UL320_.jpg,https://www.amazon.eg/dp/B0D12J2WW1,2026-05-27T05:20:57.366913
amazon,,Fitness Jump Rope Blue for Daily Cardio Workouts,,Sports,EGP 107.00,,,,,,,,https://m.media-amazon.com/images/I/51sEJtFBhhL._AC_UL320_.jpg,https://www.amazon.eg/dp/B0GKQ7YX33,2026-05-27T05:20:57.367300
amazon,,"Vibration Plate Exercise Machine, Whole Body Workout Fitness Platform Vibration Plate with Resistance Bands for Home Training Equipment Speed Control",,Sports,"EGP 5,000.00",,,4.4,,,,,https://m.media-amazon.com/images/I/71UHn0JHlPL._AC_UL320_.jpg,https://www.amazon.eg/dp/B0DHCVPHKN,2026-05-27T05:20:57.367721
amazon,,Exercise Band 1200 * 15 * 0.5Cm Ls3204 @Fs,,Sports,EGP 103.46,EGP 142.96,,4.3,List:,,,,https://m.media-amazon.com/images/I/41-BMcPsTGL._AC_UL320_.jpg,https://www.amazon.eg/dp/B089G9Z5J3,2026-05-27T05:20:57.368226
amazon,,Premium Latex Loop Resistance Band for Warm-up Stretching Muscle Building Strength Training Home Gym Equipment for Men and Women,,Sports,EGP 199.00,EGP 224.50,,3.5,Was:,,,,https://m.media-amazon.com/images/I/611W5ff+kKL._AC_UL320_.jpg,https://www.amazon.eg/dp/B0B37NJZ3Q,2026-05-27T05:20:57.368749
amazon,,Step Fitness Aerobic Sports Gymnastics Board Adjustable Height 2 Levels â€¦,,Sports,EGP 860.00,,,,,,,,https://m.media-amazon.com/images/I/41NFp4bIraL._AC_UL320_.jpg,https://www.amazon.eg/dp/B0FX4Z1SGC,2026-05-27T05:20:57.369145
amazon,,"Spider Shaker Bottle 500ml with Storage Compartment | Ideal for Whey Protein Mix, BCAA, Pre workout Drinks, Cycling, Gym, Sports, Fitness, Water bottle | BPA Free Material (Red)",,Sports,EGP 205.00,,,3.8,,,,,https://m.media-amazon.com/images/I/61uWh1TI48L._AC_UL320_.jpg,https://www.amazon.eg/dp/B08GQ3P2QW,2026-05-27T05:20:57.369638
amazon,,"Multi-Function Tension Rope, Bodybuilding Expander Elastic Resistance Band Yoga Sports Equipment Waist Arm Leg Trainer Portable Home Gym Device for Fitness Weight Loss Training",,Sports,EGP 140.79,,,3.4,,,,,https://m.media-amazon.com/images/I/51ToGwp21XL._AC_UL320_.jpg,https://www.amazon.eg/dp/B086MXMK1Z,2026-05-27T05:20:57.370072
amazon,,Generic Unisex Premium Resistance Bands&Resistance Bands 8 Shaped Fitness Elastic Rubber Loops Pull Rope Sports Rubber Expander Band Yoga Fitness Belt-yellow,,Sports,EGP 145.00,,,3.0,,,,,https://m.media-amazon.com/images/I/51XI1bdu5qL._AC_UL320_.jpg,https://www.amazon.eg/dp/B08YNS5F7K,2026-05-27T05:20:57.370495
amazon,,Chest Expander Arm Strength Multifunctional Exercise Fitness Muscle Training Sports for Home Gym,,Sports,EGP 432.00,,,3.0,,,,,https://m.media-amazon.com/images/I/51GTtK4tiGL._AC_UL320_.jpg,https://www.amazon.eg/dp/B07R8MRWZC,2026-05-27T05:20:57.370906
