platform,asin,title,brand,category,current_price,original_price,discount,rating,reviews_count,prime_eligible,amazon_choice,sponsored,main_image,product_url,scraped_at
amazon,,"𝐒𝐩𝐨𝐫𝐭𝐛𝐢𝐭 𝐄𝐱𝐞𝐫𝐜𝐢𝐬𝐞 𝐑𝐞𝐬𝐢𝐬𝐭𝐚𝐧𝐜𝐞 𝐁𝐚𝐧𝐝𝐬 Set of 5 + Bag | Best Elastic Resistance Loop Bands for Stretching, Yoga, Physical Therapy, Workout, Home Fitness and Sport",,Sports,EGP 499.00,,,4.3,,,,,https://m.media-amazon.com/images/I/61M0PI6iO6L._AC_UL320_.jpg,https://www.amazon.eg/dp/B06W52PD85,2026-05-27T05:20:57.371334
amazon,,"Multifunctional Tension Rope, Fitness Resistance Band, 4 Tubes Quality Latex Elastic Bodybuilding, Pedal Elastic Resistance Band, for Abdominal Arms, Legs, Slimming Yoga Sport Home",,Sports,EGP 220.00,,,3.9,,,,,https://m.media-amazon.com/images/I/71ntuRvZymL._AC_UL320_.jpg,https://www.amazon.eg/dp/B0FPD2WMJB,2026-05-27T05:20:57.371743
amazon,,Elastic Band Fitness Elastic Split Belt Perfect Muscle Strengthening Tool Improve Sports Performance and Flexibility,,Sports,EGP 160.00,,,,,,,,https://m.media-amazon.com/images/I/419hVvD3KiL._AC_UL320_.jpg,https://www.amazon.eg/dp/B0FDL4MBVS,2026-05-27T05:20:57.372128
amazon,,"SportQ Master Your Cardio Premium Quality Tangle-Free Skipping Rope for Men, Women and Kids Adjustable Fitness Exercise with Anti-Slip Foam Handles",,Sports,EGP 99.75,,,4.1,,,,,https://m.media-amazon.com/images/I/61ndZS-DW0L._AC_UL320_.jpg,https://www.amazon.eg/dp/B0F94DW2CS,2026-05-27T05:20:57.372558
amazon,,"londys Resistance Bands for Working Out, Exercise Bands, Physical Therapy Equipment, 59 Inch Non-Latex Stretching Yoga Strap for Upper & Lower Body, Workouts & Rehab at Home-5 Progressive Resistance",,Sports,EGP 115.00,,,4.2,,,,,https://m.media-amazon.com/images/I/711S1--K4XL._AC_UL320_.jpg,https://www.amazon.eg/dp/B0B5N99RX1,2026-05-27T05:20:57.372983
amazon,,15mm Non-Slip Yoga Sport Mat Exercise Fitness Pilates Workout Cushion Thick (Green),,Sports,EGP 630.00,,,3.4,,,,,https://m.media-amazon.com/images/I/71wu9R6+srL._AC_UL320_.jpg,https://www.amazon.eg/dp/B07MXDFD9T,2026-05-27T05:20:57.373415
amazon,,"Rubber Exercise Equipment with Foot Pedals and Handle, Resistance Rope for Abdomen, Arms, Legs, Red for Home and Sports",,Sports,EGP 120.00,,,,,,,,https://m.media-amazon.com/images/I/51Qwz1Tp+aL._AC_UL320_.jpg,https://www.amazon.eg/dp/B0GJFMK847,2026-05-27T05:20:57.373784
amazon,,"Latex Fitness Pull Rope Elastic Rope Resistance Bands Resistance Tubes with Foam Handles, Exercise Tubes For Resistance Training, Fitness Pilates Strength Training, Home Workouts,blue",,Sports,EGP 151.62,,,3.0,,,,,https://m.media-amazon.com/images/I/61OHYQbvI4L._AC_UL320_.jpg,https://www.amazon.eg/dp/B091D3JLM5,2026-05-27T05:20:57.374212
amazon,,Anti-Slip Sports Yoga Mat 10mm Thick Sports Pilates Fitness Exercise Mat Thick Padded Belt Carrying Bag,,Sports,EGP 850.00,,,5.0,,,,,https://m.media-amazon.com/images/I/614yvGXOC9L._AC_UL320_.jpg,https://www.amazon.eg/dp/B09NLBPJWD,2026-05-27T05:20:57.374620
amazon,,Anti-Slip Sports Yoga Mat 10mm Thick Sports Pilates Fitness Exercise Mat Thick Padded Belt Carrying Bag,,Sports,EGP 999.00,,,5.0,,,,,https://m.media-amazon.com/images/I/71yYLPaR7RL._AC_UL320_.jpg,https://www.amazon.eg/dp/B09NLDRTKC,2026-05-27T05:20:57.375026
amazon,,Yoga Pull Rally Rope Elastic Band Fitness Sports Tube Workout Exercise Elastic String Black,,Sports,EGP 132.00,EGP 171.00,,,List:,,,,https://m.media-amazon.com/images/I/519MaYkFd9L._AC_UL320_.jpg,https://www.amazon.eg/dp/B08YNP9SML,2026-05-27T05:20:57.375546
amazon,,"Military Smart Watch for Men, 1.85'' HD Large Screen Smartwatch, Flashlight/5ATM Waterproof/700mAh/100+ Sports Fitness Tracker Watch, Pedometer Mens Smart Watch for Android iPhone Compatible",,Sports,"EGP 3,394.99","EGP 3,499.99",,3.8,Was:,,,,https://m.media-amazon.com/images/I/71+njc6cxJL._AC_UL320_.jpg,https://www.amazon.eg/dp/B0F29ZTF6N,2026-05-27T05:20:57.376046
amazon,,"city star sport Yoga Mat Roll 45CM With Non-Toxic, Long Lasting Material - Purple",,Sports,EGP 251.05,,,5.0,,,,,https://m.media-amazon.com/images/I/61SZKeMynCL._AC_UL320_.jpg,https://www.amazon.eg/dp/B01GG2OYJS,2026-05-27T05:20:57.376495
amazon,,"Smart Sport Fitness Stepper,Fitness Exercise Machine Mini Stepper,Household Hydraulic Mute Stepper Multi-function Foot Pedal,for Men and Women for Home Gym",,Sports,"EGP 1,816.02",,,,,,,,https://m.media-amazon.com/images/I/31C7V7t3qJL._AC_UL320_.jpg,https://www.amazon.eg/dp/B0G14TT587,2026-05-27T05:20:57.376858
amazon,,one piece -sports-fitness-4-tube-latex-resistance-bands-latex-pedal-exerciser-sit-up-pull-rope-expander-elastic-bands-slim-workout-fitness-5732041,,Sports,EGP 291.00,,,,,,,,https://m.media-amazon.com/images/I/514iMwcLtsL._AC_UL320_.jpg,https://www.amazon.eg/dp/B0BXQQJ9GP,2026-05-27T05:20:57.377239
amazon,,"Smart Sport Fitness Set of 5 - Resistance Close Loop Bands for Exercise, Loop Elastic Bands with Dual-Sided Suitable for Men and Women, Exercise Band for Stretching, Squats, Legs & Buttocks",,Sports,EGP 94.16,,,,,,,,https://m.media-amazon.com/images/I/41x14fl9dPL._AC_UL320_.jpg,https://www.amazon.eg/dp/B0G155KBRN,2026-05-27T05:20:57.377606
amazon,,"Cottonil VEGA Bra Women's Sports Padded Bra, Racerback Style",,Sports,EGP 250.00,,,2.1,,,,,https://m.media-amazon.com/images/I/61aY1BUeq5L._AC_UL320_.jpg,https://www.amazon.eg/dp/B0GM2D6RNT,2026-05-27T05:20:57.378098
amazon,,"MIZA Womens High Waist Rib Seamless Shorts - Perfect for Yoga, Gym, Running and Casual Wear for Girls and Women",,Sports,EGP 108.00,EGP 120.00,,2.9,Was:,,,,https://m.media-amazon.com/images/I/710L39aYfRL._AC_UL320_.jpg,https://www.amazon.eg/dp/B0FNMZM34L,2026-05-27T05:20:57.378681
amazon,,Gym Bag Sports Duffle Bag - Large Capacity Waterproof Light Exercise Fitness Swimming Yoga Outdoor Travel Bag for Men and Women (Black),,Sports,EGP 396.90,EGP 450.00,,3.4,Was:,,,,https://m.media-amazon.com/images/I/61lLD02qboL._AC_UL320_.jpg,https://www.amazon.eg/dp/B0BX6CQBRX,2026-05-27T05:20:57.379180
amazon,,"SERIOUS STEEL FITNESS Assisted 41"" Pull-Up Band, Resistance & Stretch Band, Powerlifting Band & Pull-up Assist Loop Band (Single Band)",,Sports,EGP 640.00,,,4.6,,,,,https://m.media-amazon.com/images/I/71zAFSSB-eL._AC_UL320_.jpg,https://www.amazon.eg/dp/B00KLMU03O,2026-05-27T05:20:57.379594
amazon,,"GHAZAL black sports resistance band, used for fitness exercises and muscle strengthening.",,Sports,EGP 74.00,,,,,,,,https://m.media-amazon.com/images/I/41D-fe1c7TL._AC_UL320_.jpg,https://www.amazon.eg/dp/B0GW5NHQVS,2026-05-27T05:20:57.379960
amazon,,"Smart Sport Agility ladder, speed reaction sport training soccer adjustable rungs soft ladder 7m 13 rungs soccer, football fitness boxing exercise tool carry bag",,Sports,EGP 201.78,,,,,,,,https://m.media-amazon.com/images/I/51FFxAty7uL._AC_UL320_.jpg,https://www.amazon.eg/dp/B0G14M11CL,2026-05-27T05:20:57.380343
amazon,,TERRIFI Pedal Resistance 4 Tube Pull Rope with Foot Pedal Abdominal Exerciser Equipment Fitness Equipment for Abdomen Leg Arm Stretching Slimming Training,,Sports,EGP 113.60,,,5.0,,,,,https://m.media-amazon.com/images/I/61SbbPh3ZpL._AC_UL320_.jpg,https://www.amazon.eg/dp/B0BWNDKTY7,2026-05-27T05:20:57.380761
amazon,,"Oraimo Watch 2R Bluetooth SmartWatch for Men&Women,1.39""HD Smart Fitness Watch with Stepping Meter Heart Rate Monitor,120+ Sports Modes & Quickly Reply SMS, Black, 1 Year Warranty",,Sports,"EGP 1,225.00",,,4.1,,,,,https://m.media-amazon.com/images/I/61shUuiQKiL._AC_UL320_.jpg,https://www.amazon.eg/dp/B0CYT4PJP9,2026-05-27T05:20:57.381260
amazon,,SportQ 5 Set of 6 Levels of Strength and Resistance Sport Elastic Band Bracelet Gym Training Cross Fit Yoga Rope Tug Fitness,,Sports,EGP 118.56,,,3.6,,,,,https://m.media-amazon.com/images/I/61dUHBLkaPL._AC_UL320_.jpg,https://www.amazon.eg/dp/B09NHV5K1C,2026-05-27T05:20:57.381680
amazon,,one piece -sports-fitness-4-tube-latex-resistance-bands-latex-pedal-exerciser-sit-up-pull-rope-expander-elastic-bands-slim-workout-fitness-5732022,,Sports,EGP 291.00,,,,,,,,https://m.media-amazon.com/images/I/31BLEkh9vHL._AC_UL320_.jpg,https://www.amazon.eg/dp/B0BXQKNQPQ,2026-05-27T05:20:57.382045
amazon,,"sports & fitness bottle, with time indicator, a hole, bisphene a, 32 oz capacity assorted color(Shapes May Vary)",,Sports,EGP 172.00,,,,,,,,https://m.media-amazon.com/images/I/61h+PI6muHL._AC_UL320_.jpg,https://www.amazon.eg/dp/B0FZ4S8QKW,2026-05-27T05:20:57.382439
amazon,,"WIWU SW02 Pro Classic Smartwatch – IP68 Waterproof, Bluetooth 5.0, 1.39"" HD IPS Screen, Multi-Sport Fitness Tracker with Sleep Analysis, Wireless Charging, 10-Day Standby – Silver|18 Months Warranty",,Sports,"EGP 1,408.17",,,3.0,,,,,https://m.media-amazon.com/images/I/71v7a51UwuL._AC_UL320_.jpg,https://www.amazon.eg/dp/B0C2CPDYS9,2026-05-27T05:20:57.382864
amazon,,one piece -sports-fitness-4-tube-latex-resistance-bands-latex-pedal-exerciser-sit-up-pull-rope-expander-elastic-bands-slim-workout-fitness-5732029,,Sports,EGP 291.00,,,,,,,,https://m.media-amazon.com/images/I/31BLEkh9vHL._AC_UL320_.jpg,https://www.amazon.eg/dp/B0BXQD63FP,2026-05-27T05:20:57.383247
amazon,,Two year waranty -one piece -sports-fitness-4-tube-latex-resistance-bands-latex-pedal-exerciser-sit-up-pull-rope-expander-elastic-bands-slim-workout-fitness-5732040,,Sports,EGP 291.00,,,,,,,,https://m.media-amazon.com/images/I/41wcAfc8prL._AC_UL320_.jpg,https://www.amazon.eg/dp/B0BXSNM4QK,2026-05-27T05:21:01.505087
amazon,,2 Handle Resistance Bands Fitness Exercise Bands with Door Anchor 6-8 lbs - Blue,,Sports,EGP 219.00,,,5.0,,,,,https://m.media-amazon.com/images/I/61DMeqFHZ7L._AC_UL320_.jpg,https://www.amazon.eg/dp/B0CY7NGW3X,2026-05-27T05:21:01.505558
amazon,,Workout Set for Women High Waist Bra and Leggings Backless Sports Jumpsuits 2 Piece Compression Leggings for Women Seamless Sexy Yoga Fitness Sports,,Sports,,,,1.0,,,,,https://m.media-amazon.com/images/I/51e6qLjetGL._AC_UL320_.jpg,https://www.amazon.eg/dp/B0D8WKDX8F,2026-05-27T05:21:01.505926
amazon,,"SMART FIT ® Color Sport Purpose, Training Equipment, Men and Women, Half - Finger Riding Fitness Gloves",,Sports,EGP 120.04,,,5.0,,,,,https://m.media-amazon.com/images/I/31bIHLjRYvL._AC_UL320_.jpg,https://www.amazon.eg/dp/B0G16YGCF8,2026-05-27T05:21:01.506373
amazon,,Stretch expander belt pull strap resistance pilates exercise sport workout fitness equipment rubber loop for exercise,,Sports,EGP 100.10,,,2.4,,,,,https://m.media-amazon.com/images/I/61mI-isA+TL._AC_UL320_.jpg,https://www.amazon.eg/dp/B08YNLTNY7,2026-05-27T05:21:01.506792
amazon,,5PCS Resistance Bands Exercise Loops Set Thicker Workout Stretch Bands for Legs Glutes Yoga Fitness Physical Therapy Home Equipment Training for Women Men with Carry Bag,,Sports,EGP 75.00,,,,,,,,https://m.media-amazon.com/images/I/419+M6krhRL._AC_UL320_.jpg,https://www.amazon.eg/dp/B091D1CNBG,2026-05-27T05:21:01.507183
amazon,,Elastic Exercise Resistance Band Exercise Fitness Equipment Home Exercise Equipment with Foot Pedals Foam Handle for Strength Muscle Fitness Exercise (H),,Sports,EGP 157.50,,,,,,,,https://m.media-amazon.com/images/I/41XITVdCupL._AC_UL320_.jpg,https://www.amazon.eg/dp/B0GYSN1K19,2026-05-27T05:21:01.507568
amazon,,"TRUE FIT® Heavy Duty Resistance Bands - Weight Lifting Elastic Band - Perfect Elastic Band for Gym, Thighs, Yoga, Fitness Equipment Multicolor (Pack of 5) Powerfull Leg Band",,Sports,EGP 102.60,,,2.0,,,,,https://m.media-amazon.com/images/I/61VK9oSniAL._AC_UL320_.jpg,https://www.amazon.eg/dp/B0FRSN62VT,2026-05-27T05:21:01.508029
amazon,,Spring Expander Fitness Sports Equipment Chest Muscle Training Equipmentco20376,,Sports,EGP 347.00,,,,,,,,https://m.media-amazon.com/images/I/316QgnNtKCL._AC_UL320_.jpg,https://www.amazon.eg/dp/B09JKW8DCW,2026-05-27T05:21:01.508411
amazon,,"SportQ Double Fun Qillet Pedal Resistance Pull Rope with 4 Tubes Foot Pedal Fitness Equipment for Abdomen, Leg, Arm, Slimming Exercise (Purple)",,Sports,EGP 92.63,EGP 118.28,,2.9,List:,,,,https://m.media-amazon.com/images/I/71zhXpiBk8L._AC_UL320_.jpg,https://www.amazon.eg/dp/B0BX556YDC,2026-05-27T05:21:01.508893
amazon,,"Rubber Stretch Resistance Exercise Fitness Band For Yoga (1.5M, Blue)",,Sports,EGP 106.78,,,3.5,,,,,https://m.media-amazon.com/images/I/417qYn9aCPL._AC_UL320_.jpg,https://www.amazon.eg/dp/B091BVH9GD,2026-05-27T05:21:01.509329
amazon,,one piece -sports-fitness-4-tube-latex-resistance-bands-latex-pedal-exerciser-sit-up-pull-rope-expander-elastic-bands-slim-workout-fitness-5732035,,Sports,EGP 291.00,,,,,,,,https://m.media-amazon.com/images/I/41GHm89FCsL._AC_UL320_.jpg,https://www.amazon.eg/dp/B0BXQMYN3P,2026-05-27T05:21:01.509700
amazon,,Two year warranty sports fitness 4 tube latex resistance bands latex pedal exerciser sit up pull rope expander elastic bands slim workout fitness-471666,,Sports,EGP 291.00,,,,,,,,https://m.media-amazon.com/images/I/31BLEkh9vHL._AC_UL320_.jpg,https://www.amazon.eg/dp/B0BX19528L,2026-05-27T05:21:01.510077
amazon,,Two year warranty sports fitness 4 tube latex resistance bands latex pedal exerciser sit up pull rope expander elastic bands slim workout fitness-471757,,Sports,EGP 291.00,,,,,,,,https://m.media-amazon.com/images/I/31BLEkh9vHL._AC_UL320_.jpg,https://www.amazon.eg/dp/B0BX14Z2KT,2026-05-27T05:21:01.510444
amazon,,Two year warranty sports fitness 4 tube latex resistance bands latex pedal exerciser sit up pull rope expander elastic bands slim workout fitness-471743,,Sports,EGP 291.00,,,,,,,,https://m.media-amazon.com/images/I/31BLEkh9vHL._AC_UL320_.jpg,https://www.amazon.eg/dp/B0BX14S8QL,2026-05-27T05:21:01.510810
amazon,,"Smart Sport Fitness Lightweight Portable Adjustable Height Workout Aerobic Stepper Step Platform Trainer with Raisers, Black/Red",,Sports,EGP 814.00,,,,,,,,https://m.media-amazon.com/images/I/71YbSpcnFzL._AC_UL320_.jpg,https://www.amazon.eg/dp/B0G14R3DSP,2026-05-27T05:21:01.511238
amazon,,5PCS/Set Resistance Band fitness 5Levels Latex Gym Strength Training Rubber Loops Bands,,Sports,EGP 95.00,,,3.5,,,,,https://m.media-amazon.com/images/I/61LzrDX4CRL._AC_UL320_.jpg,https://www.amazon.eg/dp/B091CPQX1F,2026-05-27T05:21:01.511664
amazon,,"Protein Shaker, Protein Shaker with Compartment, Protein Shaker 16 OZ Sports Shaker BPA Free Leak-Proof Protein Shaker for Sports, Fitness (Red)",,Sports,EGP 499.00,,,,,,,,https://m.media-amazon.com/images/I/61-peydHowL._AC_UL320_.jpg,https://www.amazon.eg/dp/B0CWGV3YY5,2026-05-27T05:21:01.512084
