platform,asin,title,brand,category,current_price,original_price,discount,rating,reviews_count,prime_eligible,amazon_choice,sponsored,main_image,product_url,scraped_at
amazon,,"Taharah Pure Original Musk Fragrances and its unique persistence, with a touch of watermelon and pomegranate for a sense of rogan.Enjoy a long lasting unique scent. from - by Generic",,Fragrances,EGP 100.71,,,5.0,,,,,https://m.media-amazon.com/images/I/41cQVGRsNBL._AC_UL320_.jpg,https://www.amazon.eg/dp/B0F74P8ZDP,2026-04-04T05:44:54.008567
amazon,,فلامبوينت دجنتي100مل FLAMBOYANT Dignity,,Fragrances,"EGP 2,408.96",,,,,,,,https://m.media-amazon.com/images/I/61U5dJ4+3ML._AC_UL320_.jpg,https://www.amazon.eg/dp/B0BZN116MM,2026-04-04T05:44:57.708658
amazon,,"PRIVE IDEAL POUR FEMME DEO, IRRESISTABLE FRAGRANCE, LONG-LASTING ODOUR - 250ML",,Fragrances,EGP 195.97,,,,,,,,https://m.media-amazon.com/images/I/61-NO9OBMLL._AC_UL320_.jpg,https://www.amazon.eg/dp/B0CDYZLDJF,2026-04-04T05:44:57.714688
amazon,,Oriflame Amber ELixir Mystery Eau de Parfum - 75 ML,,Fragrances,,,,5.0,,,,,https://m.media-amazon.com/images/I/61C1VAAOg6L._AC_UL320_.jpg,https://www.amazon.eg/dp/B098TX816F,2026-04-04T05:44:57.715175
amazon,,U-Richi Body Mist Gold Kiss - 250ML,,Fragrances,EGP 231.70,,,,,,,,https://m.media-amazon.com/images/I/715rMqMy3UL._AC_UL320_.jpg,https://www.amazon.eg/dp/B0FVVRMBVH,2026-04-04T05:44:57.715722
amazon,,Maa Althahab Woody R201 Explorer Montblanc Eau De Parfum For Men 100Ml,,Fragrances,EGP 850.00,,,3.8,,,,,https://m.media-amazon.com/images/I/41vfLv0noVL._AC_UL320_.jpg,https://www.amazon.eg/dp/B0CFW2GLZF,2026-04-04T05:44:57.716265
amazon,,Flamboint Perseus Silver 100ml FLAMBOYANT Precious Si,,Fragrances,"EGP 2,408.96",,,,,,,,https://m.media-amazon.com/images/I/31WDaGwSHML._AC_UL320_.jpg,https://www.amazon.eg/dp/B0BZN3FZS1,2026-04-04T05:44:57.716729
amazon,,Flamingo Secret Garden Intense Body Mist 150 ml,,Fragrances,EGP 225.00,,,,,,,,https://m.media-amazon.com/images/I/41fmKhhxpiL._AC_UL320_.jpg,https://www.amazon.eg/dp/B0G1P5N8NG,2026-04-04T05:44:57.717180
amazon,,"CHANEL Chanel Allure Homme Sports Super Reggera Eau De Parfum 3.4 fl oz (100 ml) EDP Exclusive Perfume, Birthday Gift, Shopper Included",,Fragrances,"EGP 12,401.60",,,3.2,,,,,https://m.media-amazon.com/images/I/61URI6iufkL._AC_UL320_.jpg,https://www.amazon.eg/dp/B0DFWGCYKT,2026-04-04T05:44:57.717734
amazon,,ARMAF CDN PRIVATE KEY TO MY DREAMS 100ML,,Fragrances,"EGP 3,430.00",,,4.7,,,,,https://m.media-amazon.com/images/I/51t+QtxoVoL._AC_UL320_.jpg,https://www.amazon.eg/dp/B0CH3YCRRB,2026-04-04T05:44:57.718280
amazon,,Musk Al Tahara Alcohol Free Concentrated Perfume - 5ml,,Fragrances,EGP 149.00,,,,,,,,https://m.media-amazon.com/images/I/6179OKQDZyS._AC_UL320_.jpg,https://www.amazon.eg/dp/B0923MQQ89,2026-04-04T05:44:57.718714
amazon,,Victoria's secret citrus chill 250ml,,Fragrances,EGP 999.00,,,4.8,,,,,https://m.media-amazon.com/images/I/51h9qqS2BAL._AC_UL320_.jpg,https://www.amazon.eg/dp/B08RWRT6ZF,2026-04-04T05:44:57.719263
amazon,,"Metallic Travel a portable, refillable perfume atomizer, ideal for travel or carrying your favorite fragrance on the go Set, 3 Colours - Green, Purple, blue",,Fragrances,EGP 229.00,,,,,,,,https://m.media-amazon.com/images/I/61H6fo13T3L._AC_UL320_.jpg,https://www.amazon.eg/dp/B0FF2PCLK2,2026-04-04T05:44:57.719721
amazon,,"Mini Bottle - Perfect for perfumes, fragrances, or alcohol, this 10ml plastic bottle comes with a cute sticker, making it an essential addition to your bag.",,Fragrances,EGP 241.00,,,,,,,,https://m.media-amazon.com/images/I/61cl07Ncy+L._AC_UL320_.jpg,https://www.amazon.eg/dp/B0FF3DVMMJ,2026-04-04T05:44:57.720157
amazon,,"Elegant Mini Perfume Atomizer Bottle 8ml – Lightweight Refillable Spray Set for Daily, Travel & Gym Use – Pocket Fragrance Dispenser",,Fragrances,,,,,,,,,https://m.media-amazon.com/images/I/61rodXaKn+L._AC_UL320_.jpg,https://www.amazon.eg/dp/B0FVVQ7FKT,2026-04-04T05:44:57.720534
amazon,,Flamingo Velvet Dream Intense Body Mist 250 ml,,Fragrances,EGP 350.00,,,,,,,,https://m.media-amazon.com/images/I/419ZJ58AyCL._AC_UL320_.jpg,https://www.amazon.eg/dp/B0G1P26YBK,2026-04-04T05:44:57.720986
amazon,,Lattafa SQaa'ed Concentrated Extra Long Lasting Perfumed Spray For Men 250Ml,,Fragrances,EGP 210.00,,,3.1,,,,,https://m.media-amazon.com/images/I/51syKBYXtHL._AC_UL320_.jpg,https://www.amazon.eg/dp/B082WKNHBL,2026-04-04T05:44:57.721546
amazon,,"8ml Mini Refillable Perfume Bottle, Stylish Travel Atomizer for Fragrances, Portable Pocket Spray, Durable Glass Perfume Container for On-the-Go Use (Two packs)",,Fragrances,EGP 300.00,,,,,,,,https://m.media-amazon.com/images/I/41D2fopaG0L._AC_UL320_.jpg,https://www.amazon.eg/dp/B0GHJQKXBL,2026-04-04T05:44:57.721995
amazon,,مسك انجليزي مركز – تولة 6 جرام – ريشة – عالي الثبات – للجنسين,,Fragrances,EGP 249.50,,,,,,,,https://m.media-amazon.com/images/I/61f5zH5xdfL._AC_UL320_.jpg,https://www.amazon.eg/dp/B0FTZKZLTV,2026-04-04T05:44:57.722465
amazon,,Ormella Violet Perfume Oil - 30 ml,,Fragrances,EGP 120.00,,,3.6,,,,,https://m.media-amazon.com/images/I/51srp-+j3TL._AC_UL320_.jpg,https://www.amazon.eg/dp/B0CMV5BBKT,2026-04-04T05:45:01.733039
amazon,,"Ajmal Perfumes Verde - perfume for men, 100 ml",,Fragrances,"EGP 1,680.00",,,3.6,,,,,https://m.media-amazon.com/images/I/51WyIL7EmeL._AC_UL320_.jpg,https://www.amazon.eg/dp/B07THKQN7N,2026-04-04T05:45:01.733592
amazon,,Armaf Night Club Perfume Body Spray for Women 200 ml,,Fragrances,EGP 192.58,,,,,,,,https://m.media-amazon.com/images/I/61tqUUFp1oL._AC_UL320_.jpg,https://www.amazon.eg/dp/B0FBX67XXG,2026-04-04T05:45:01.734063
amazon,,"""Wild Flower"" by AURA EDP 50 ml inspired by ""Gucci Bloom"".",,Fragrances,EGP 564.65,,,3.0,,,,,https://m.media-amazon.com/images/I/51TlpHmsiPL._AC_UL320_.jpg,https://www.amazon.eg/dp/B0CCSTM99H,2026-04-04T05:45:01.734655
amazon,,Emanuel Ungaro Silver For Men 90ml - Eau de Toilette,,Fragrances,"EGP 3,593.75",,,3.5,,,,,https://m.media-amazon.com/images/I/71zD0mWhwBL._AC_UL320_.jpg,https://www.amazon.eg/dp/B071SM6GNT,2026-04-04T05:45:01.735184
amazon,,Amouroud White Sands Eau de Parfum Spray 100 ml,,Fragrances,"EGP 11,787.50",,,1.0,,,,,https://m.media-amazon.com/images/I/51oxlSkkF7L._AC_UL320_.jpg,https://www.amazon.eg/dp/B0CW28DB2D,2026-04-04T05:45:01.735805
amazon,,B.Mist Memwa Spr F/W gabore250ml,,Fragrances,EGP 231.00,,,,,,,,https://m.media-amazon.com/images/I/51qk9jJiQlL._AC_UL320_.jpg,https://www.amazon.eg/dp/B0D5848V9V,2026-04-04T05:45:01.736295
amazon,,LA MAISON DE LA VANILLE FLEURIE DE TAHITI EDT 100ML,,Fragrances,"EGP 1,879.20",,,,,,,,https://m.media-amazon.com/images/I/71euS9D+OcL._AC_UL320_.jpg,https://www.amazon.eg/dp/B00135NLBG,2026-04-04T05:45:01.736760
amazon,,"3 PCS 5ml Perfume Atomiser Bottles,Refillable Travel Perfume Atomiser Bottles,EmptyTravel Bottle for Purse Handbag Pocket Luggage(Bright gold + bright silver + bright purple), Brown, 1",,Fragrances,EGP 82.90,EGP 104.90,,3.4,Was:,,,,https://m.media-amazon.com/images/I/61uU0tLWGxL._AC_UL320_.jpg,https://www.amazon.eg/dp/B09MCNMNR2,2026-04-04T05:45:01.737401
amazon,,Emper Sovereign Lady Of Wisdom Eau De Parfum For Women 100ml,,Fragrances,"EGP 1,015.00",,,4.0,,,,,https://m.media-amazon.com/images/I/81c9FAvBlcL._AC_UL320_.jpg,https://www.amazon.eg/dp/B0F8PKQ671,2026-04-04T05:45:01.737949
amazon,,Lapetra Makhmaria Sofy flory For Body & Hair,,Fragrances,EGP 60.00,,,,,,,,https://m.media-amazon.com/images/I/71fi6GvNI2L._AC_UL320_.jpg,https://www.amazon.eg/dp/B0G6ZWT87K,2026-04-04T05:45:01.738439
amazon,,"Luxury 8ml Refillable Perfume Bottle, Portable Mini Glass Atomizer for Travel and Everyday Use, Pocket-Sized Fragrance Spray for Men and Women (One pack)",,Fragrances,EGP 200.00,,,,,,,,https://m.media-amazon.com/images/I/31sbSdZ+KFL._AC_UL320_.jpg,https://www.amazon.eg/dp/B0GHJV26VR,2026-04-04T05:45:01.738874
amazon,,Rasasi Woody For for Women Edp 55 Ml,,Fragrances,"EGP 1,955.00",,,3.9,,,,,https://m.media-amazon.com/images/I/61JGrU8aCDL._AC_UL320_.jpg,https://www.amazon.eg/dp/B00LVIUYMO,2026-04-04T05:45:01.739424
amazon,,Salvatore Ferragamo UOMO CASUAL LIFE EDT 100ML,,Fragrances,,,,4.5,,,,,https://m.media-amazon.com/images/I/71-hOLHvLSL._AC_UL320_.jpg,https://www.amazon.eg/dp/B071FVNXSN,2026-04-04T05:45:01.739910
amazon,,AZHA BODY SPLASH Triple Oud - 200ml,,Fragrances,EGP 239.00,,,,,,,,https://m.media-amazon.com/images/I/51wKGUbqs9L._AC_UL320_.jpg,https://www.amazon.eg/dp/B0FHKWSVMF,2026-04-04T05:45:01.740382
amazon,,Maa Althahab Forever Young Hair and Body Mist for Women 100 ml,,Fragrances,EGP 271.98,,,4.0,,,,,https://m.media-amazon.com/images/I/61d83qRhX0L._AC_UL320_.jpg,https://www.amazon.eg/dp/B0FSSQBZNK,2026-04-04T05:45:01.740939
amazon,,Gulf Orchid Memoah Spray 200ml - Dream,,Fragrances,EGP 142.99,,,,,,,,https://m.media-amazon.com/images/I/51pgReAcLCL._AC_UL320_.jpg,https://www.amazon.eg/dp/B0CS9BVPWY,2026-04-04T05:45:01.741418
amazon,,"Old Spice Captain Antiperspirant & Deodorant Clear Gel Stick for Men 70ml, Perfume Quality Scent & 48H Dry and Fresh, Anti-White Mark Technology",,Fragrances,EGP 572.00,EGP 699.00,,4.6,Was:,,,,https://m.media-amazon.com/images/I/71NzRr4FnoL._AC_UL320_.jpg,https://www.amazon.eg/dp/B0DFWZV1K3,2026-04-04T05:45:01.742017
amazon,,Milestone perfumes Party Girl Body Spray For Women 200m,,Fragrances,EGP 145.00,,,,,,,,https://m.media-amazon.com/images/I/51yt6G5kcwL._AC_UL320_.jpg,https://www.amazon.eg/dp/B0D2917M3D,2026-04-04T05:45:01.742504
amazon,,"VETELLY Mini Perfume Atomizer, Refillable and Portable for Travel, Trips, Handbags and Suitcases - 5ml Capacity (5 pcs - Random Color)",,Fragrances,EGP 151.62,EGP 160.75,,2.0,Was:,,,,https://m.media-amazon.com/images/I/71eL0MYiG6L._AC_UL320_.jpg,https://www.amazon.eg/dp/B0DKC5PNCV,2026-04-04T05:45:01.743092
amazon,,V2 Darkness Unisex Edp 30Ml,,Fragrances,"EGP 1,571.96",,,,,,,,https://m.media-amazon.com/images/I/61l9TcdL6OL._AC_UL320_.jpg,https://www.amazon.eg/dp/B0C8C1Q9Z5,2026-04-04T05:45:01.743624
amazon,,Arabiyat Red Oud Perfume Body Spray 200ml,,Fragrances,EGP 180.00,,,,,,,,https://m.media-amazon.com/images/I/611cjat3pNL._AC_UL320_.jpg,https://www.amazon.eg/dp/B0F4DSX7JG,2026-04-04T05:45:01.744099
amazon,,Arabiyat Purple Oud Perfume Body Spray 200ml,,Fragrances,EGP 150.00,,,,,,,,https://m.media-amazon.com/images/I/61N6a4KwhfL._AC_UL320_.jpg,https://www.amazon.eg/dp/B0F4DQL9ZH,2026-04-04T05:45:01.744601
amazon,,Carolina Herrera 212 Man Heroes Eau De Toilette Spray 150Ml,,Fragrances,"EGP 10,792.14",,,4.5,,,,,https://m.media-amazon.com/images/I/51lyttR8blL._AC_UL320_.jpg,https://www.amazon.eg/dp/B0B2KCX9NM,2026-04-04T05:45:04.855722
amazon,,L’Oréal Paris L'Oreal Men Expert Fragrance Roll on | Anti Odor ) XXL Ball | 50ml (Magnesium Defence),,Fragrances,EGP 282.00,,,3.4,,,,,https://m.media-amazon.com/images/I/61gUZTl5sML._AC_UL320_.jpg,https://www.amazon.eg/dp/B0B4JRBJ5P,2026-04-04T05:45:04.857682
amazon,,"Bath & Body Works Fragrance Mist (In The Stars, 236ml)",,Fragrances,,,,4.2,,,,,https://m.media-amazon.com/images/I/61+hqcQbQiL._AC_UL320_.jpg,https://www.amazon.eg/dp/B09V2Z9GQV,2026-04-04T05:45:04.858171
amazon,,"Vintage Crystal Glass Perfume Bottle with Decorative Cut Pattern, Round Shape, Clear Glass with Gold Accent, Elegant Design",,Fragrances,EGP 450.00,,,,,,,,https://m.media-amazon.com/images/I/7162Yb4EscL._AC_UL320_.jpg,https://www.amazon.eg/dp/B0FTZ6LGPY,2026-04-04T05:45:04.858647
amazon,,مجموعة المسك الخم… 3 رائحة تتمس الفخامة! مسك ملكي - مسك توب - مسك رمان,,Fragrances,EGP 245.00,,,,,,,,https://m.media-amazon.com/images/I/61FK3yF17CL._AC_UL320_.jpg,https://www.amazon.eg/dp/B0F6NZ8CJQ,2026-04-04T05:45:04.859116
amazon,,ARMAF Momento Lace Deodorant Perfume Body Spray for Women 200 ml,,Fragrances,EGP 165.05,,,,,,,,https://m.media-amazon.com/images/I/51KOF8aYRSL._AC_UL320_.jpg,https://www.amazon.eg/dp/B0FP9S2WV2,2026-04-04T05:45:04.859608
amazon,,"David Beckham Homme Deodorant Spray,150 ml (Pack of 1)",,Fragrances,EGP 242.00,,,4.5,,,,,https://m.media-amazon.com/images/I/81qVeaph7KL._AC_UL320_.jpg,https://www.amazon.eg/dp/B0056GK7O2,2026-04-04T05:45:04.860140
amazon,,ELIZABETH ARDEN WHITE TEA MANDARIN BLOSSOM EDT 10,,Fragrances,"EGP 2,018.25",,,4.6,,,,,https://m.media-amazon.com/images/I/61Q-bHrEV3L._AC_UL320_.jpg,https://www.amazon.eg/dp/B095H1Q7CP,2026-04-04T05:45:04.860693
amazon,,bonballoon Cream Musk Al Tahara Oud Saudi Arabian Arabic Hamil Al-Musk Al Musk Altahara For Women Makhmaryia Makhmaria مخمرية (0.70 oz / 20 gm) (كريم مسك الطهارة عود),,Fragrances,EGP 165.00,,,3.7,,,,,https://m.media-amazon.com/images/I/61mp6eJfStL._AC_UL320_.jpg,https://www.amazon.eg/dp/B0926174WQ,2026-04-04T05:45:04.861248
amazon,,GUESS SEXY SKIN METALLIQUE CHAMPANGE (W) 250ML BODY MIST,,Fragrances,EGP 855.23,,,4.6,,,,,https://m.media-amazon.com/images/I/61cw+moBFiL._AC_UL320_.jpg,https://www.amazon.eg/dp/B0DFHMD8G5,2026-04-04T05:45:04.861786
amazon,,LA MAISON DE LA VANILLE NOIRE DU MEXIQUE EDT 100ML,,Fragrances,"EGP 3,548.44",,,5.0,,,,,https://m.media-amazon.com/images/I/51TdXAqxmtL._AC_UL320_.jpg,https://www.amazon.eg/dp/B000G0Y69A,2026-04-04T05:45:04.862336
amazon,,مسك الحجر الأسود – تولة 12 جرام – ريشة – مسك خليجي أصيل مركز – ثبات وفوحان عالي,,Fragrances,EGP 349.50,,,,,,,,https://m.media-amazon.com/images/I/51ezW+At6KL._AC_UL320_.jpg,https://www.amazon.eg/dp/B0FV14V8HZ,2026-04-04T05:45:04.862781
amazon,,"8ml Refillable Perfume Atomizer Spray Bottle – Compact Travel Spray for Perfume, Cosmetics & Coffee Bean Mist – Durable Plastic, Leakproof, Portable Black Mini Atomizer for Men & Women",,Fragrances,,,,4.1,,,,,https://m.media-amazon.com/images/I/412KBzmNIiL._AC_UL320_.jpg,https://www.amazon.eg/dp/B0F3X71BBF,2026-04-04T05:45:04.863337
amazon,,Flamingo Pistachio Crème Intense Body Mist 150 ml,,Fragrances,EGP 222.40,,,,,,,,https://m.media-amazon.com/images/I/41+elx57YZL._AC_UL320_.jpg,https://www.amazon.eg/dp/B0G1P294N2,2026-04-04T05:45:04.863805
amazon,,Ted Lapidus Poker Face EDT Spray Men 3.4 oz,,Fragrances,,,,2.8,,,,,https://m.media-amazon.com/images/I/51ImqaDxOIL._AC_UL320_.jpg,https://www.amazon.eg/dp/B08HX1PY8Z,2026-04-04T05:45:04.864331
amazon,,Armaf Active Pure 05 Perfume Body Spray 250 ml,,Fragrances,EGP 275.30,,,5.0,,,,,https://m.media-amazon.com/images/I/61lNqz0qXvL._AC_UL320_.jpg,https://www.amazon.eg/dp/B0FBX7J2RJ,2026-04-04T05:45:04.864841
amazon,,Avon Passion Dance Eau De Toilette En Vaporisateur 50ml - 1.7oz,,Fragrances,EGP 573.00,,,4.2,,,,,https://m.media-amazon.com/images/I/71F9x2lsmrL._AC_UL320_.jpg,https://www.amazon.eg/dp/B00PH29QOW,2026-04-04T05:45:04.865389
amazon,,Mini 5ml Refillable Perfume and Sanitizer Spray Bottle Portable Travel Container Leak-Proof Easy to Carry for Alcohol Fragrance Hand Sanitizer,,Fragrances,EGP 120.00,,,,,,,,https://m.media-amazon.com/images/I/612jve6afJL._AC_UL320_.jpg,https://www.amazon.eg/dp/B0G44PC8D6,2026-04-04T05:45:04.865832
amazon,,Safari Body Spray Unisex 250 ml,,Fragrances,EGP 210.90,,,,,,,,https://m.media-amazon.com/images/I/41Emtb9uM7L._AC_UL320_.jpg,https://www.amazon.eg/dp/B0F27T8373,2026-04-04T05:45:04.866320
amazon,,"Spicekick Mastic Oil 100ml Premium Natural Essential Oil with Distinctive Oriental Scent for Skin and Hair Care, Perfume, Massage",,Fragrances,EGP 350.00,,,1.0,,,,,https://m.media-amazon.com/images/I/61isBqKtQoL._AC_UL320_.jpg,https://www.amazon.eg/dp/B0GHMRXMKW,2026-04-04T05:45:04.866836
amazon,,Travel Friendly 5ml Mini Refillable Perfume Spray Bottle Portable Leak-Proof Container for Hand Sanitizer Alcohol Fragrance Easy Carry,,Fragrances,EGP 127.00,,,,,,,,https://m.media-amazon.com/images/I/71HDCotizxL._AC_UL320_.jpg,https://www.amazon.eg/dp/B0G44SCSDR,2026-04-04T05:45:04.867306
amazon,,Risala al fasl 6 perfume body spray - 250 ml,,Fragrances,EGP 185.43,,,3.2,,,,,https://m.media-amazon.com/images/I/61B-jPtk+YL._AC_UL320_.jpg,https://www.amazon.eg/dp/B08WJL732W,2026-04-04T05:45:04.867824
amazon,,FLAMBOYANT Tender 100ml FLAMBOYANT tender,,Fragrances,"EGP 1,232.62",,,,,,,,https://m.media-amazon.com/images/I/71D-B7w68bL._AC_UL320_.jpg,https://www.amazon.eg/dp/B0BZN1D5VJ,2026-04-04T05:45:04.868332
amazon,,ARMAF CLUB DE INTENSE WOMAN SPRAY 250ML,,Fragrances,EGP 397.00,EGP 408.70,,3.1,List:,,,,https://m.media-amazon.com/images/I/61YJ+1b8q3L._AC_UL320_.jpg,https://www.amazon.eg/dp/B0C7N76PNK,2026-04-04T05:45:04.868935
amazon,,Yves Saint Laurent Ladies Black Opium Gift Set,,Fragrances,"EGP 8,331.75",,,1.0,,,,,https://m.media-amazon.com/images/I/91ZiFGt4J0L._AC_UL320_.jpg,https://www.amazon.eg/dp/B0BN458ZLY,2026-04-04T05:45:04.869498
amazon,,VALENTINO DONNA ROSA VERDE (W) EDT 125ML,,Fragrances,,,,5.0,,,,,https://m.media-amazon.com/images/I/614Q5FL1nqL._AC_UL320_.jpg,https://www.amazon.eg/dp/B08CY5VNRJ,2026-04-04T05:45:09.496864
amazon,,"Franck boclet leather white eau de parfum, 100 ml",,Fragrances,"EGP 6,480.25",,,4.1,,,,,https://m.media-amazon.com/images/I/614SOsBlypL._AC_UL320_.jpg,https://www.amazon.eg/dp/B017W5C6EI,2026-04-04T05:45:09.505906
amazon,,Velvet Souly Body Splash 250 Ml,,Fragrances,EGP 176.00,,,1.0,,,,,https://m.media-amazon.com/images/I/51UtYs-C0-L._AC_UL320_.jpg,https://www.amazon.eg/dp/B0D8ZNV13N,2026-04-04T05:45:09.508140
amazon,,"Areon Garden Home Perfume 50 ml, Saffron",,Fragrances,EGP 390.49,,,3.6,,,,,https://m.media-amazon.com/images/I/61uwQxlQJgS._AC_UL320_.jpg,https://www.amazon.eg/dp/B08WDB16LT,2026-04-04T05:45:09.508713
amazon,,"Si Belle Jasmine Valley Reed Refill Liquid for Sea Bell Blister Diffuser, 20ml, Aura White, Alcohol - Perfume - Water",,Fragrances,EGP 224.00,EGP 250.00,,3.3,List:,,,,https://m.media-amazon.com/images/I/61gpwiPbhiL._AC_UL320_.jpg,https://www.amazon.eg/dp/B0CR1FZB26,2026-04-04T05:45:09.509355
amazon,,Embara Spray Perfumed Body Grey 200ml EMPRESS,,Fragrances,EGP 109.54,,,3.0,,,,,https://m.media-amazon.com/images/I/71N1LYEbX0L._AC_UL320_.jpg,https://www.amazon.eg/dp/B0BZMZYMQ7,2026-04-04T05:45:09.509927
amazon,,"""Unique Product - Small and Practical Fragrance Pack - Comfort and Freshness Everywhere"" - Generic",,Fragrances,EGP 110.84,,,,,,,,https://m.media-amazon.com/images/I/515CEdLNhgL._AC_UL320_.jpg,https://www.amazon.eg/dp/B0FXPCZ8ZP,2026-04-04T05:45:09.510408
amazon,,ShirleyMay Shirley May Vida Vida - Women - EDT - 100ml,,Fragrances,EGP 198.66,,,3.0,,,,,https://m.media-amazon.com/images/I/71JM4GqLGIL._AC_UL320_.jpg,https://www.amazon.eg/dp/B0CKNL64XX,2026-04-04T05:45:09.510989
amazon,,Storm Body Spray King Kong,,Fragrances,EGP 207.09,,,,,,,,https://m.media-amazon.com/images/I/61L52iAIg5L._AC_UL320_.jpg,https://www.amazon.eg/dp/B08HZ753RL,2026-04-04T05:45:09.511599
amazon,,"Metallic Travel a portable, refillable perfume atomizer, ideal for travel or carrying your favorite fragrance on the go Set, 3 Colours - pink, gold, black",,Fragrances,EGP 229.00,,,,,,,,https://m.media-amazon.com/images/I/71hb3fMyTcL._AC_UL320_.jpg,https://www.amazon.eg/dp/B0FF2SBN11,2026-04-04T05:45:09.512064
amazon,,ARMAF HUNTER FOR MEN PERFUME SPRAY 200ML,,Fragrances,EGP 138.82,EGP 144.00,,1.4,List:,,,,https://m.media-amazon.com/images/I/5127bOjFRuL._AC_UL320_.jpg,https://www.amazon.eg/dp/B01CTUQHK0,2026-04-04T05:45:09.512743
amazon,,Portable Travel Perfume - Mini Perfume Atomizer - Easy Filling - for Men and Women - Leak Proof Perfume Pump - Travel Accessories - 5ml Generic,,Fragrances,EGP 99.00,,,,,,,,https://m.media-amazon.com/images/I/619LPGAM3bL._AC_UL320_.jpg,https://www.amazon.eg/dp/B0D5MR2S94,2026-04-04T05:45:09.513197
amazon,,ستورم بدي اسبراي Tiger Claw,,Fragrances,EGP 180.00,,,5.0,,,,,https://m.media-amazon.com/images/I/71krZ+-PTTL._AC_UL320_.jpg,https://www.amazon.eg/dp/B08HZ7MYFT,2026-04-04T05:45:09.513761
amazon,,Majouri Blue Desert Eau de Parfum for Man 75 ml,,Fragrances,"EGP 3,397.09",,,,,,,,https://m.media-amazon.com/images/I/51c6nt7LtbL._AC_UL320_.jpg,https://www.amazon.eg/dp/B0B9SBDC1P,2026-04-04T05:45:09.514255
amazon,,MONTALE AOUD NIGHT EDP 100ML,,Fragrances,"EGP 6,440.00",,,4.3,,,,,https://m.media-amazon.com/images/I/71d4Q1w4gXL._AC_UL320_.jpg,https://www.amazon.eg/dp/B013V7EMLG,2026-04-04T05:45:09.514794
amazon,,Golf Orchid Body Mist 250ml - Blue Berry,,Fragrances,EGP 440.62,,,4.1,,,,,https://m.media-amazon.com/images/I/71Q2Xpy7arL._AC_UL320_.jpg,https://www.amazon.eg/dp/B0CT5V7Z1K,2026-04-04T05:45:09.515348
amazon,,Concentrated White Musk for Women - 3 Grams Tola,,Fragrances,EGP 125.00,,,3.0,,,,,https://m.media-amazon.com/images/I/51-XDfkzwPL._AC_UL320_.jpg,https://www.amazon.eg/dp/B07NY6TX6Y,2026-04-04T05:45:09.515868
amazon,,Storm Body Spray Bear Skin,,Fragrances,EGP 234.64,,,3.0,,,,,https://m.media-amazon.com/images/I/616EUASMvWL._AC_UL320_.jpg,https://www.amazon.eg/dp/B08HZ6HYBL,2026-04-04T05:45:09.516434
amazon,,"Revealed Perfume for Unisex by Ajmal - Eau de Parfum, 50ml",,Fragrances,"EGP 2,750.00",,,,,,,,https://m.media-amazon.com/images/I/710Aih7OZPL._AC_UL320_.jpg,https://www.amazon.eg/dp/B081931731,2026-04-04T05:45:09.516887
amazon,,"Fogg Extreme Fragrance Body Spray For Men, 120 ml",,Fragrances,EGP 164.00,EGP 219.21,,4.0,List:,,,,https://m.media-amazon.com/images/I/51c041ZtmNL._AC_UL320_.jpg,https://www.amazon.eg/dp/B00R2AASS0,2026-04-04T05:45:13.291778
amazon,,"Purity Musk & Pomegranate (White Bride) Beauty & Feminine Fragrance Long Lasting & Refreshes Skin Can Be Used In Sensitive Places, Available In Three A - Generic",,Fragrances,EGP 102.22,,,,,,,,https://m.media-amazon.com/images/I/411dWhnU5UL._AC_UL320_.jpg,https://www.amazon.eg/dp/B0F74RJ8RT,2026-04-04T05:45:13.292254
amazon,,Gulf Orchid Eau de Parfum 100ml - Moonlight,,Fragrances,EGP 703.99,,,,,,,,https://m.media-amazon.com/images/I/71xIf5xtReL._AC_UL320_.jpg,https://www.amazon.eg/dp/B0DPWY5WG4,2026-04-04T05:45:13.292850
amazon,,Dolce & Gabbana rose for her edt 75ml,,Fragrances,"EGP 4,200.00",,,4.6,,,,,https://m.media-amazon.com/images/I/71QemuXqK4L._AC_UL320_.jpg,https://www.amazon.eg/dp/B08ZMQFHMK,2026-04-04T05:45:13.293424
amazon,,"ZOZY Refillable Perfume Atomiser Mini Spray Bottle, Portable Travel Fragrance Dispenser for Handbag Purse Pocket or Luggage, Leak-Resistant Reusable Perfume Spray (4 PCS)",,Fragrances,EGP 124.00,,,,,,,,https://m.media-amazon.com/images/I/512v0+jk0bL._AC_UL320_.jpg,https://www.amazon.eg/dp/B0G7J7P6QT,2026-04-04T05:45:13.293891
amazon,,Axe Body Spray for Men Leather & Cookies 150ML,,Fragrances,EGP 149.95,EGP 195.00,,4.5,List:,,,,https://m.media-amazon.com/images/I/51kRZ5uQxhL._AC_UL320_.jpg,https://www.amazon.eg/dp/B07SJ6NYBT,2026-04-04T05:45:13.294542
amazon,,"CHANEL Coco Mademoiselle Intense Women's Eau De Parfum, 200 ml",,Fragrances,"EGP 16,927.38",,,3.6,,,,,https://m.media-amazon.com/images/I/51rhxZzw+bL._AC_UL320_.jpg,https://www.amazon.eg/dp/B07P9TK9NK,2026-04-04T05:45:13.295068
amazon,,Emper Body Spray Legend Pour Femme 200ml,,Fragrances,EGP 140.39,EGP 149.00,,2.8,Was:,,,,https://m.media-amazon.com/images/I/51ezf1ZuukL._AC_UL320_.jpg,https://www.amazon.eg/dp/B0F5QR75WM,2026-04-04T05:45:13.295692
amazon,,ARMAF OROS PURE LEATHER GOLD100MLEDPاوروس بيورليزير جولد,,Fragrances,"EGP 5,977.12",,,4.3,,,,,https://m.media-amazon.com/images/I/4104F-BODzL._AC_UL320_.jpg,https://www.amazon.eg/dp/B09XF1LZD8,2026-04-04T05:45:13.296241
amazon,,Emper Chic Boy Perfume Body Spray For Men 200ml,,Fragrances,,,,1.0,,,,,https://m.media-amazon.com/images/I/61kp8s+XmkL._AC_UL320_.jpg,https://www.amazon.eg/dp/B0FX3H7K1H,2026-04-04T05:45:13.296743
amazon,,Gulf Orchid Spray 200 ml - Blue Berry,,Fragrances,EGP 157.92,,,4.5,,,,,https://m.media-amazon.com/images/I/51JHYOu9aOL._AC_UL320_.jpg,https://www.amazon.eg/dp/B0DPWY2WLX,2026-04-04T05:45:13.297283
amazon,,Flamingo Watermelon Raspberry Body Mist 100 ml,,Fragrances,EGP 135.00,,,,,,,,https://m.media-amazon.com/images/I/410FfN3M+ML._AC_UL320_.jpg,https://www.amazon.eg/dp/B0G1NK2WWJ,2026-04-04T05:45:13.297733
amazon,,‎Storm Breeze Perfumed Deodorant Body Spray for Women 250 ml,,Fragrances,EGP 179.57,,,2.2,,,,,https://m.media-amazon.com/images/I/61bMVfFTPfL._AC_UL320_.jpg,https://www.amazon.eg/dp/B0CWYSZS1B,2026-04-04T05:45:13.298272
amazon,,Ajmal Mizyaan Perfume Deodorant Spray - 200 ml,,Fragrances,EGP 299.00,,,3.7,,,,,https://m.media-amazon.com/images/I/51CrrK3LAoL._AC_UL320_.jpg,https://www.amazon.eg/dp/B07GJRRF3B,2026-04-04T05:45:13.298793
amazon,,Memwa Very Sexy Body Mist 250 ml,,Fragrances,EGP 265.49,,,5.0,,,,,https://m.media-amazon.com/images/I/41-F0lVeVHL._AC_UL320_.jpg,https://www.amazon.eg/dp/B0CGSWZ3PC,2026-04-04T05:45:13.299349
amazon,,Bath & Body Works In The Stars Fine Fragrance Mist 236 Ml,,Fragrances,EGP 710.00,,,4.4,,,,,https://m.media-amazon.com/images/I/61+hqcQbQiL._AC_UL320_.jpg,https://www.amazon.eg/dp/B0BDMMXP6N,2026-04-04T05:45:13.299917
amazon,,Reebok Activate Your Senses Deodorant Spray for Men 150 ml,,Fragrances,EGP 212.00,,,,,,,,https://m.media-amazon.com/images/I/61nads+NQ3L._AC_UL320_.jpg,https://www.amazon.eg/dp/B0F6PPMZJD,2026-04-04T05:45:13.300402
amazon,,Enchanter Perfume Lotion ROMANTIC 250ml,,Fragrances,,,,,,,,,https://m.media-amazon.com/images/I/31pgqqKwINL._AC_UL320_.jpg,https://www.amazon.eg/dp/B0FY3H1521,2026-04-04T05:45:13.300811
amazon,,"Portable Travel Perfume: Refillable Perfume Atomizer for Unisex, Ideal for Trips and Travel (5ml), Pocket Size Portable Mini Spray Bottle, Leak Proof Design. - Generic",,Fragrances,EGP 130.48,,,1.0,,,,,https://m.media-amazon.com/images/I/21Awcrm5nEL._AC_UL320_.jpg,https://www.amazon.eg/dp/B0D5MQRNPR,2026-04-04T05:45:13.301348
amazon,,1 Pcs Empty Refillable Perfume Bottle - Essential Oils - Distinctively Decorated Perfume Vials 50ml/1.69oz (Rectangular),,Fragrances,EGP 224.00,,,,,,,,https://m.media-amazon.com/images/I/617KOsyC6TL._AC_UL320_.jpg,https://www.amazon.eg/dp/B0CWRXN6Y1,2026-04-04T05:45:13.301802
