platform,asin,title,brand,category,current_price,original_price,discount,rating,reviews_count,prime_eligible,amazon_choice,sponsored,main_image,product_url,scraped_at
amazon,,Lattafa Asad Edp 100Ml,,Fragrances,EGP 961.36,"EGP 1,222.00",,4.3,List:,,,,https://m.media-amazon.com/images/I/415tTA0HfOL._AC_UL320_.jpg,https://www.amazon.eg/dp/B0B8TQ7YRW,2026-04-04T05:37:46.662173
amazon,,"My Way - Perfume, Candy Rose, Eau De Parfum For Women, Long Lasting Perfume Spray, 55ML",,Fragrances,EGP 181.88,EGP 195.00,,3.9,List:,,,,https://m.media-amazon.com/images/I/51XNN40Ja2L._AC_UL320_.jpg,https://www.amazon.eg/dp/B0F99KV549,2026-04-04T05:37:46.662874
amazon,,Fogg marco perfume spray for men - 120 ml,,Fragrances,EGP 88.00,EGP 125.00,,4.1,List:,,,,https://m.media-amazon.com/images/I/615o0mQ0eQL._AC_UL320_.jpg,https://www.amazon.eg/dp/B07NZJ34LN,2026-04-04T05:37:46.663648
amazon,,My Way Women's Perfume Eau de Parfum 50ml Concentrated Perfume Long Lasting Charming Fragrance (Allure Gold),,Fragrances,EGP 282.00,,,,,,,,https://m.media-amazon.com/images/I/81asUN+GJvL._AC_UL320_.jpg,https://www.amazon.eg/dp/B0GF33VJCN,2026-04-04T05:37:46.664161
amazon,,"Avon Rare pearls for women - eau de parfum, 50ml",,Fragrances,EGP 623.90,EGP 650.00,,4.2,Was:,,,,https://m.media-amazon.com/images/I/516fvACaShL._AC_UL320_.jpg,https://www.amazon.eg/dp/B07NDZLLY2,2026-04-04T05:37:46.664798
amazon,,Starky Panache Perfume Spray For Women 125ml-Blue,,Fragrances,EGP 95.00,,,,,,,,https://m.media-amazon.com/images/I/41ca7t-l+2L._AC_UL320_.jpg,https://www.amazon.eg/dp/B0GK13S4XG,2026-04-04T05:37:46.665290
amazon,,Guess gold eau de parfum for women 75ml,,Fragrances,"EGP 1,641.00","EGP 1,756.00",,4.4,List:,,,,https://m.media-amazon.com/images/I/71NWWsp1a9L._AC_UL320_.jpg,https://www.amazon.eg/dp/B00NC6W5A2,2026-04-04T05:37:46.665909
amazon,,Ajmal Perfumes Wisal by ajmal for woman - eau de parfum-50 ml (pack of 1),,Fragrances,"EGP 1,296.95","EGP 1,430.39",Save 9%,4.4,Was:,,,,https://m.media-amazon.com/images/I/61ys9DNteLL._AC_UL320_.jpg,https://www.amazon.eg/dp/B00LGO6ZKS,2026-04-04T05:37:46.666585
amazon,,Colour Me Milton Lloyd Colour Me Pink For Women 100ml - Eau De Parfum,,Fragrances,EGP 936.50,,,4.2,Another way to buy,,,,https://m.media-amazon.com/images/I/71zftVgD8IL._AC_UL320_.jpg,https://www.amazon.eg/dp/B00F991ZD8,2026-04-04T05:37:46.667188
amazon,,TheBathland Hair Perfume & Mist Warm Vanilla - 80 ml,,Fragrances,EGP 155.65,,,3.9,,,,,https://m.media-amazon.com/images/I/618Eml2xnnL._AC_UL320_.jpg,https://www.amazon.eg/dp/B0BTHWK389,2026-04-04T05:37:46.667861
amazon,,"My Way - Perfume, Lila, Eau De Parfum For Women, Long Lasting Fragrance Spray, Elegant & Delicate Feminine Scent, 50ML",,Fragrances,EGP 184.00,EGP 195.00,,3.5,List:,,,,https://m.media-amazon.com/images/I/717Tkt0l-JL._AC_UL320_.jpg,https://www.amazon.eg/dp/B0F54S8PJW,2026-04-04T05:37:46.668482
amazon,,Milestone perfumes Blue Eclat Fragrance Mist For Women 250ml,,Fragrances,EGP 164.54,,,,,,,,https://m.media-amazon.com/images/I/61TcFwyvIqL._AC_UL320_.jpg,https://www.amazon.eg/dp/B0CSZ5L7HF,2026-04-04T05:37:46.668933
amazon,,UTC ColoutMe Hawaii Cashmere Extrait Perfume 50 ml,,Fragrances,EGP 189.00,EGP 221.00,,4.2,Was:,,,,https://m.media-amazon.com/images/I/51qqtaQfp2L._AC_UL320_.jpg,https://www.amazon.eg/dp/B0CBK8BW4L,2026-04-04T05:37:46.669574
amazon,,My Way Women's Perfume Eau de Parfum 50ml Concentrated Perfume Long Lasting Charming Fragrance (Crystal),,Fragrances,EGP 307.00,,,,,,,,https://m.media-amazon.com/images/I/81N0ZoOVCJL._AC_UL320_.jpg,https://www.amazon.eg/dp/B0GDY848VK,2026-04-04T05:37:46.670065
amazon,,"Hamil Al Musk - Perfume, Musk Al Tahara (6ML, Oud)",,Fragrances,EGP 79.00,,,4.3,,,,,https://m.media-amazon.com/images/I/615Y4ei25UL._AC_UL320_.jpg,https://www.amazon.eg/dp/B0GHG67V9Q,2026-04-04T05:37:46.670647
amazon,,"Daniel Leon Men’s Perfume Package Set | 4×10ml Inspired Fragrance Testers | 1 Million, 212 VIP, Black Afgano & D&G | Long-Lasting",,Fragrances,EGP 295.00,,,3.8,,,,,https://m.media-amazon.com/images/I/71tYDDGmgDL._AC_UL320_.jpg,https://www.amazon.eg/dp/B0F54C4PXW,2026-04-04T05:37:46.671191
amazon,,Ajmal Love Addict Eau de Parfum for Women – 100 ml | Long Lasting Floral Fruity Perfume with Musk & Amber | Everyday Wear Fragrance | Designed by Ajmal Perfumes,,Fragrances,"EGP 1,089.95",,,,,,,,https://m.media-amazon.com/images/I/51uxdBnW5EL._AC_UL320_.jpg,https://www.amazon.eg/dp/B0FR2GV25P,2026-04-04T05:37:46.671701
amazon,,"Fogg Scent Wood For Men, Eau De Parfum - 100 Ml",,Fragrances,EGP 433.05,,,4.0,,,,,https://m.media-amazon.com/images/I/61OKhmlErCL._AC_UL320_.jpg,https://www.amazon.eg/dp/B0BHRHR1GR,2026-04-04T05:37:46.672294
amazon,,Emper Intimation Eau De Parfum For Men - 3.4 Fl.Oz | Long-Lasting Masculine Fragrance | Elegant New Packaging,,Fragrances,EGP 692.92,EGP 810.00,Save 14%,4.1,Was:,,,,https://m.media-amazon.com/images/I/61zZuRdauKL._AC_UL320_.jpg,https://www.amazon.eg/dp/B0DJC76SM3,2026-04-04T05:37:46.672915
amazon,,"My Way - Perfume, Golden Touch, Eau De Parfum For Women, 40ML",,Fragrances,EGP 235.00,,,3.8,,,,,https://m.media-amazon.com/images/I/612Vwi84KiL._AC_UL320_.jpg,https://www.amazon.eg/dp/B0F492Y61D,2026-04-04T05:37:46.673459
amazon,,Beauty & Perfumecandy Carnival Fragrance Mist 250 Ml,,Fragrances,EGP 200.51,,,2.8,,,,,https://m.media-amazon.com/images/I/61yrJwgXkdL._AC_UL320_.jpg,https://www.amazon.eg/dp/B0DNWFPHK7,2026-04-04T05:37:46.674010
amazon,,ColourMe Red Perfume for women ( 7201 ),,Fragrances,EGP 907.45,,,4.2,,,,,https://m.media-amazon.com/images/I/71rNA2oU0xL._AC_UL320_.jpg,https://www.amazon.eg/dp/B00F99246U,2026-04-04T05:37:46.674599
amazon,,Fogg Brazilian Brust Perfume Spray For Men - 120Ml,,Fragrances,EGP 104.00,EGP 125.00,,4.3,List:,,,,https://m.media-amazon.com/images/I/51BcgOlDXML._AC_UL320_.jpg,https://www.amazon.eg/dp/B0CGRNX16Y,2026-04-04T05:37:46.675198
amazon,,Turkish Jasmine for Unisex – Turkish Jasmine Roll-On 12ml – Alcohol Free Concentrated Fragrance Oil – Luxurious Oriental Floral Fragrance with a Sophisticated Feminine Scent – La Perfumes Neach,,Fragrances,EGP 229.00,,,4.0,,,,,https://m.media-amazon.com/images/I/51CqqZ+QY5L._AC_UL320_.jpg,https://www.amazon.eg/dp/B0FX12FKQZ,2026-04-04T05:37:46.675728
amazon,,Ajmal Women's Raindrops Eau De Perfume (50ml),,Fragrances,EGP 639.50,EGP 667.78,,3.9,List:,,,,https://m.media-amazon.com/images/I/51x3XUNWFoL._AC_UL320_.jpg,https://www.amazon.eg/dp/B081VGLT3V,2026-04-04T05:37:46.676334
amazon,,Cloud Candy 100ml by Khadlaj - Extrait De Parfum Spray - Marshmallow Coconut Sugar Candy Vanilla Perfume for Women,,Fragrances,"EGP 1,957.05",,,4.5,,,,,https://m.media-amazon.com/images/I/71tM7WCR3aL._AC_UL320_.jpg,https://www.amazon.eg/dp/B0F1DY8QD3,2026-04-04T05:37:46.676864
amazon,,"Creation Lamis Diable Bleu Eau de Toilette Perfume for Men, Oriental & Woody Long Lasting Masculine Fragrance, Body Perfume for Men - 100ml",,Fragrances,EGP 440.49,,,4.3,,,,,https://m.media-amazon.com/images/I/51l7XJhXkdL._AC_UL320_.jpg,https://www.amazon.eg/dp/B0014WL4K8,2026-04-04T05:37:46.677440
amazon,,Rasasi Eau De Parfum for Men | Long Lasting Luxury Perfume | Premium Fragrance (Emotion EDP),,Fragrances,EGP 827.28,EGP 919.20,,4.1,Was:,,,,https://m.media-amazon.com/images/I/41FVnyQEQpL._AC_UL320_.jpg,https://www.amazon.eg/dp/B07L46CMR7,2026-04-04T05:37:46.678034
amazon,,"Daniel Leon, inspired perfume by Mademoiselle, Elegant Floral Perfume for Women with Orange & Patchouli tester, 10 ml",,Fragrances,EGP 110.00,,,4.1,,,,,https://m.media-amazon.com/images/I/611VfocQCGL._AC_UL320_.jpg,https://www.amazon.eg/dp/B0CRQC9QV3,2026-04-04T05:37:46.678568
amazon,,Emper Le Chameau (Arabia) Haya Eau De Parfum For Women 100Ml,,Fragrances,EGP 899.95,,,4.5,,,,,https://m.media-amazon.com/images/I/61Z6g35KR6L._AC_UL320_.jpg,https://www.amazon.eg/dp/B0CRHYJN4L,2026-04-04T05:37:46.679066
amazon,,"Pink Rose Solid Perfume Makhmarya - 1 Piece (17g, Bonbon)",,Fragrances,EGP 129.00,,,5.0,,,,,https://m.media-amazon.com/images/I/41sKMG6KNcL._AC_UL320_.jpg,https://www.amazon.eg/dp/B0FY6GG9KZ,2026-04-04T05:37:46.679609
amazon,,"QuiQia Yara Pink Parfum with FREE 3ml Perfume Spray - Arabian Latafa Oud Long Lasting For Women - Sweet, Vanilla & Powdery - Eau De Parfum 100 ML",,Fragrances,"EGP 1,349.00",,,3.8,,,,,https://m.media-amazon.com/images/I/61rbpmtgktL._AC_UL320_.jpg,https://www.amazon.eg/dp/B0C3MSR6VV,2026-04-04T05:37:46.680103
amazon,,"Britney Spears Midnight Fantasy - perfumes for women - Eau de Parfum, 100 ml",,Fragrances,"EGP 1,590.00","EGP 2,205.00",,4.6,List:,,,,https://m.media-amazon.com/images/I/41dpa1npIYL._AC_UL320_.jpg,https://www.amazon.eg/dp/B000M8BE3C,2026-04-04T05:37:46.680712
amazon,,"My Way - Perfume, Allure Gold, Eau De Parfum For Women, Long Lasting Perfume Spray, 50ML",,Fragrances,EGP 249.00,,,,,,,,https://m.media-amazon.com/images/I/61iIDbd-xuL._AC_UL320_.jpg,https://www.amazon.eg/dp/B0GTRFTRV7,2026-04-04T05:37:46.681154
amazon,,Mesk Al Tahara Musk Pure Arabian Oil Perfume Body Fragrance for Long-Lasting Freshnes and Elegance Musk AlTahara 1Bottle=6ml (White mus),,Fragrances,EGP 75.00,,,,,,,,https://m.media-amazon.com/images/I/61ezwZbnS-L._AC_UL320_.jpg,https://www.amazon.eg/dp/B0GPX7NJP1,2026-04-04T05:37:46.681620
amazon,,Azha Perfumes Arabian Lady Eau De Parfum Spray For Women 100 Ml,,Fragrances,EGP 703.17,,,4.0,,,,,https://m.media-amazon.com/images/I/71nWb2VUXdL._AC_UL320_.jpg,https://www.amazon.eg/dp/B0BXL4RKQ3,2026-04-04T05:37:46.682130
amazon,,My Way Oduperfan Tender Night Perfume - 55ml,,Fragrances,EGP 205.00,,,3.4,,,,,https://m.media-amazon.com/images/I/615dR-S5lKL._AC_UL320_.jpg,https://www.amazon.eg/dp/B0B3QD3G8F,2026-04-04T05:37:46.682659
amazon,,"Giorgio perfume - black special edition by giorgio - perfume for men - eau de parfum, 100ml",,Fragrances,EGP 724.00,EGP 858.00,,3.5,List:,,,,https://m.media-amazon.com/images/I/41M9xPb4nSL._AC_UL320_.jpg,https://www.amazon.eg/dp/B076KZW4N7,2026-04-04T05:37:46.683269
amazon,,Camara Eau De Parfum Posh De Arabie For Women 100Ml,,Fragrances,EGP 700.00,,,4.2,,,,,https://m.media-amazon.com/images/I/716QaI3auUL._AC_UL320_.jpg,https://www.amazon.eg/dp/B0C1NFD24Y,2026-04-04T05:37:46.683810
amazon,,"His Love Bikini Perfume, Tropical Summer Body Mist, Long-Lasting Fragrance",,Fragrances,EGP 375.00,,,5.0,,,,,https://m.media-amazon.com/images/I/2102VmvQ92L._AC_UL320_.jpg,https://www.amazon.eg/dp/B0DY9LQ2VB,2026-04-04T05:37:46.684340
amazon,,My Way Women's Perfume Eau de Parfum 50ml Concentrated Perfume Long Lasting Charming Fragrance (GREEN),,Fragrances,EGP 210.00,,,,,,,,https://m.media-amazon.com/images/I/71x3oCuP8LL._AC_UL320_.jpg,https://www.amazon.eg/dp/B0GDYM4YZ8,2026-04-04T05:37:46.684827
amazon,,Emper Her Bravery,,Fragrances,EGP 445.00,,,3.9,,,,,https://m.media-amazon.com/images/I/51wgWs3BcsL._AC_UL320_.jpg,https://www.amazon.eg/dp/B0CPC7NXGG,2026-04-04T05:37:46.685365
amazon,,Geparlys Pure Sensual Perfume for women 100ml eau de parfum,,Fragrances,EGP 680.00,,,4.9,,,,,https://m.media-amazon.com/images/I/61DVLVQXf7L._AC_UL320_.jpg,https://www.amazon.eg/dp/B00B4TW48C,2026-04-04T05:37:46.685874
amazon,,Fogg Perfume Spray Pocket - Dynamic 17 Ml,,Fragrances,EGP 35.00,,,4.2,,,,,https://m.media-amazon.com/images/I/51hcKNilWuL._AC_UL320_.jpg,https://www.amazon.eg/dp/B0BTW1Y5LF,2026-04-04T05:37:46.686446
amazon,,AVON ATTRACTION Perfume for Women,,Fragrances,EGP 794.00,,,4.5,,,,,https://m.media-amazon.com/images/I/519l+XtLXaL._AC_UL320_.jpg,https://www.amazon.eg/dp/B07ZZ3HWR7,2026-04-04T05:37:46.686937
amazon,,Emper Women's EDP Perfume (100ml),,Fragrances,EGP 687.96,,,3.9,,,,,https://m.media-amazon.com/images/I/51omNksUbyL._AC_UL320_.jpg,https://www.amazon.eg/dp/B005UXOPOE,2026-04-04T05:37:46.687527
amazon,,Oud Velvet Rose Perfume 100ml Eau De Perfume EDP Arabian Fragrance For Women,,Fragrances,"EGP 1,099.00",,,5.0,,,,,https://m.media-amazon.com/images/I/61NJKNiZroL._AC_UL320_.jpg,https://www.amazon.eg/dp/B0BW8BYXTG,2026-04-04T05:37:46.688026
amazon,,Emper Mirada Perfumes Sky Women 100 Ml,,Fragrances,EGP 402.56,EGP 415.00,,4.4,Was:,,,,https://m.media-amazon.com/images/I/61lUM318jEL._AC_UL320_.jpg,https://www.amazon.eg/dp/B08D9PD7MJ,2026-04-04T05:37:46.688635
amazon,,"Teriaq Original Perfume 100 ml, Unisex Long Lasting Arabic Perfume, EDP Imported from Dubai, Includes 5ML Refillable Atomizer, Sweet and Floral Fragrance with Woody Notes (Intense)",,Fragrances,"EGP 1,894.23",,,4.4,,,,,https://m.media-amazon.com/images/I/61ElIZgSkYL._AC_UL320_.jpg,https://www.amazon.eg/dp/B0F88R3YFN,2026-04-04T05:37:50.603649
amazon,,Flora Gardenia perfume for her,,Fragrances,EGP 575.10,EGP 639.00,,5.0,List:,,,,https://m.media-amazon.com/images/I/61uBaV34IEL._AC_UL320_.jpg,https://www.amazon.eg/dp/B0GH1X4J7F,2026-04-04T05:37:50.604338
amazon,,Lattafa Bade'e AL Oud for Glory Amethyst EDP Perfume,,Fragrances,"EGP 1,269.95",,,4.4,,,,,https://m.media-amazon.com/images/I/61zGUAwBVnL._AC_UL320_.jpg,https://www.amazon.eg/dp/B0BRGJ8QSM,2026-04-04T05:37:50.604880
amazon,,"Avon Rare Pearls Eau de Parfum (Women, Spray, SD Alcohol 40-B Fragrance Water, Non-Refillable Bottle)",,Fragrances,EGP 799.00,,,4.7,,,,,https://m.media-amazon.com/images/I/51Cs2yv9maL._AC_UL320_.jpg,https://www.amazon.eg/dp/B0014XCGRW,2026-04-04T05:37:50.605475
amazon,,Milton Lloyd Essentials Quad Pack Fragrance For Her Edp 4 X 50Ml,,Fragrances,"EGP 1,819.00",,,4.3,,,,,https://m.media-amazon.com/images/I/71OQZFK7bAL._AC_UL320_.jpg,https://www.amazon.eg/dp/B08VXNGH9S,2026-04-04T05:37:50.605987
amazon,,BPI Fantasy Garden Fragrance Mist 250 ml,,Fragrances,EGP 205.27,,,,,,,,https://m.media-amazon.com/images/I/61C8mnFPDPL._AC_UL320_.jpg,https://www.amazon.eg/dp/B0DNWC8XTS,2026-04-04T05:37:50.606527
amazon,,PENDORA SCENTS Clasico De Profondo Eau De Parfum - 100ml | Unisex Perfume | Long Lasting Fragrance | Luxury Scent | Sillage Perfume | Alluring Fragrance For Both Men & Women,,Fragrances,EGP 665.00,,,5.0,,,,,https://m.media-amazon.com/images/I/51yD9HBYovL._AC_UL320_.jpg,https://www.amazon.eg/dp/B0CL26ZVL3,2026-04-04T05:37:50.607046
amazon,,R.Baccarat For Unisex Eau De Parfum 100ml,,Fragrances,EGP 575.00,EGP 880.00,,,List:,,,,https://m.media-amazon.com/images/I/61NnVIQQ6DL._AC_UL320_.jpg,https://www.amazon.eg/dp/B0FVVXCCY2,2026-04-04T05:37:50.607618
amazon,,"GUESS, Fragrance Bella Vita Eau De Parfum Edp Spray Perfume for Women, Gold, 3.4 Fl Oz",,Fragrances,"EGP 2,743.92",,,4.5,,,,,https://m.media-amazon.com/images/I/71Pv7Fo-56L._AC_UL320_.jpg,https://www.amazon.eg/dp/B08VXJCR2R,2026-04-04T05:37:50.608152
amazon,,"My Way - Perfume, Awtar, Eau De Parfum For Women, 50ML",,Fragrances,EGP 340.00,EGP 359.00,,5.0,List:,,,,https://m.media-amazon.com/images/I/61MfJsaTdaL._AC_UL320_.jpg,https://www.amazon.eg/dp/B0F4PNS492,2026-04-04T05:37:50.608805
amazon,,Mancera roses vanille unisex edp 120ml,,Fragrances,"EGP 3,780.00","EGP 5,108.00",,4.2,List:,,,,https://m.media-amazon.com/images/I/51NjhuUYH3L._AC_UL320_.jpg,https://www.amazon.eg/dp/B013V7DBJA,2026-04-04T05:37:50.609476
amazon,,"Lattafa Perfumes Bade'e Al Oud Amethyst for Unisex Eau de Parfum Spray, 3.4 Ounce",,Fragrances,"EGP 1,418.29",,,4.4,,,,,https://m.media-amazon.com/images/I/811k0wIsGLL._AC_UL320_.jpg,https://www.amazon.eg/dp/B097V46KFD,2026-04-04T05:37:50.610057
amazon,,"Makhmarya Perfume Balm, 1 Piece (17 g, GOOD GIRL)",,Fragrances,EGP 129.00,,,,,,,,https://m.media-amazon.com/images/I/51t7ObdyHXL._AC_UL320_.jpg,https://www.amazon.eg/dp/B0GNS95S79,2026-04-04T05:37:50.610589
amazon,,Memwa Coco Memwa Long Lasting Perfume Fragrance Luxury Eau De Parfum EDP Perfume for Women,,Fragrances,EGP 816.83,,,3.2,,,,,https://m.media-amazon.com/images/I/51EiBseCbcL._AC_UL320_.jpg,https://www.amazon.eg/dp/B0CVS2FXPH,2026-04-04T05:37:50.611097
amazon,,"Badee Al Oud Amethyst Original Perfume 100 ml, Eau da Parfum Imported from Dubai with Long Lasting Sweet Aromas, Ideal for Daily and Night Use, Includes Refillable Atomizer 5ML (Amethyst)",,Fragrances,"EGP 1,274.00",,,4.3,,,,,https://m.media-amazon.com/images/I/61b7dnDiazL._AC_UL320_.jpg,https://www.amazon.eg/dp/B0DQ6DKFZZ,2026-04-04T05:37:50.611646
amazon,,"PERFUME Concentrated Scent ""Strawberry Cheesecake"" Flavor - 100 ML",,Fragrances,EGP 140.00,,,,,,,,https://m.media-amazon.com/images/I/61mpd8HlIUL._AC_UL320_.jpg,https://www.amazon.eg/dp/B0FZCL55R8,2026-04-04T05:37:50.612103
amazon,,Pheromone Perfume for Women #54 Vanilla Cream Fragrances,,Fragrances,"EGP 1,650.00",,,3.8,,,,,https://m.media-amazon.com/images/I/61VQs9owdUL._AC_UL320_.jpg,https://www.amazon.eg/dp/B0DKTF8L7Q,2026-04-04T05:37:50.612689
amazon,,Ajmal Ruby Blossom For Women Eau De Parfum 50ml Luxurious Floral Fragrance With Sweet Oriental Notes Long Lasting Perfume Crafted in Dubai,,Fragrances,"EGP 1,201.74","EGP 1,250.00",,5.0,List:,,,,https://m.media-amazon.com/images/I/61XDFDD96nL._AC_UL320_.jpg,https://www.amazon.eg/dp/B0F2XK5VN3,2026-04-04T05:37:50.613349
amazon,,"UTC Milton Lloyd Milton-Lloyd Hawaii - Fragrance for Women, Parfum de Toilette, 55ml",,Fragrances,,,,4.0,,,,,https://m.media-amazon.com/images/I/61jBYYCXPrL._AC_UL320_.jpg,https://www.amazon.eg/dp/B008L0OPBQ,2026-04-04T05:37:50.614098
amazon,,ColourMe Perfume for women (5176),,Fragrances,EGP 855.01,,,4.2,,,,,https://m.media-amazon.com/images/I/81dnN1Qe3NL._AC_UL320_.jpg,https://www.amazon.eg/dp/B09CND7JMH,2026-04-04T05:37:50.614710
amazon,,Tesori Di Oriente Aromatic - Lotus Flower Perfume 100ml for Female,,Fragrances,EGP 399.00,,,,,,,,https://m.media-amazon.com/images/I/31RKjMd1g1L._AC_UL320_.jpg,https://www.amazon.eg/dp/B0GGVLXSV3,2026-04-04T05:37:50.615162
amazon,,Saqr Al Arab Gold Eau De Parfum for unisex 100ml,,Fragrances,EGP 603.00,,,4.0,,,,,https://m.media-amazon.com/images/I/61yvTHW25eL._AC_UL320_.jpg,https://www.amazon.eg/dp/B0DMP5YZC7,2026-04-04T05:37:50.615752
amazon,,Milestone L'intercode Rouge Eau De Parfum For Women 100ml,,Fragrances,EGP 682.73,,,4.8,,,,,https://m.media-amazon.com/images/I/6183WhU5ceL._AC_UL320_.jpg,https://www.amazon.eg/dp/B0D14VBFBS,2026-04-04T05:37:50.616316
amazon,,Gulf Orchid Matine Martin Perfume 100 ml Lady Rosa for Woman,,Fragrances,"EGP 1,717.59",,,4.4,,,,,https://m.media-amazon.com/images/I/613tb7QIsyL._AC_UL320_.jpg,https://www.amazon.eg/dp/B09W82HN95,2026-04-04T05:37:50.616858
amazon,,Rasasi Diamonte Long Lasting Eau De Parfum 100ml,,Fragrances,EGP 683.10,EGP 759.00,,3.9,Was:,,,,https://m.media-amazon.com/images/I/71nkKkohRPL._AC_UL320_.jpg,https://www.amazon.eg/dp/B0C6KLTG8L,2026-04-04T05:37:50.617513
amazon,,Milestone perfumes Night Party Fragrance Mist For Women 250ml,,Fragrances,EGP 240.00,,,5.0,,,,,https://m.media-amazon.com/images/I/61aSFOTdKoL._AC_UL320_.jpg,https://www.amazon.eg/dp/B0CSZ3J6FW,2026-04-04T05:37:50.618051
amazon,,ARMAF CLUB DE NUIT (W) EDP 105ML,,Fragrances,"EGP 2,694.99","EGP 2,824.50",,4.5,List:,,,,https://m.media-amazon.com/images/I/71Sx3oTiSsL._AC_UL320_.jpg,https://www.amazon.eg/dp/B00CLF6K3I,2026-04-04T05:37:50.618746
amazon,,Milestone perfumes Safran Noir Eau De Parfum Unisex 100ml,,Fragrances,EGP 743.73,,,4.4,,,,,https://m.media-amazon.com/images/I/51YWI6CdI+L._AC_UL320_.jpg,https://www.amazon.eg/dp/B0CZTTXDGW,2026-04-04T05:37:50.619311
amazon,,Coco Essence for Women – Coco Essence Perfume 12ml Roll-On – Luxury Women's Perfume Alcohol Free Firm and Elegant Oriental Floral Aroma – Inspired by Coco Mademoiselle – La Perfumes Niche,,Fragrances,EGP 299.00,,,,,,,,https://m.media-amazon.com/images/I/51UXKJ3-0RL._AC_UL320_.jpg,https://www.amazon.eg/dp/B0FVZM74SS,2026-04-04T05:37:50.619772
amazon,,LUMIERE GOLD Eau De Parfum for women100ml,,Fragrances,EGP 700.00,,,5.0,,,,,https://m.media-amazon.com/images/I/71aAdd8rrOL._AC_UL320_.jpg,https://www.amazon.eg/dp/B0DMNV7PMV,2026-04-04T05:37:50.620344
amazon,,Silk Desire Perfume for Women – Silk Desire Essence Perfume Oil Roll-On 12ml – Special Fragrance for Bikini & Sensitive Areas – Luxury Pink Vanilla Inspired by Dir Addict – perfumes for women,,Fragrances,EGP 349.00,,,,,,,,https://m.media-amazon.com/images/I/61hUK2m4MpL._AC_UL320_.jpg,https://www.amazon.eg/dp/B0FX3FKK4D,2026-04-04T05:37:50.620810
amazon,,Emper Fasio Perfume Pour Femme Eau de Parfum - for Women,,Fragrances,EGP 668.95,EGP 698.95,,3.7,List:,,,,https://m.media-amazon.com/images/I/61UR+tb-w0L._AC_UL320_.jpg,https://www.amazon.eg/dp/B0888TQFWT,2026-04-04T05:37:50.621466
amazon,,Deliina xclusif perfume for her,,Fragrances,EGP 699.00,,,5.0,,,,,https://m.media-amazon.com/images/I/61yHs420ziL._AC_UL320_.jpg,https://www.amazon.eg/dp/B0GH23TKB4,2026-04-04T05:37:50.621968
amazon,,My Perfume Vanilla and Tobacco Eau De Parfum for Unisex 100 ml,,Fragrances,"EGP 1,394.90",,,,,,,,https://m.media-amazon.com/images/I/51TTRNxaNsL._AC_UL320_.jpg,https://www.amazon.eg/dp/B0CZJN9ZDN,2026-04-04T05:37:50.622457
amazon,,Chris Adams CA Dreamz Women's Eau de Perfume - 100ml,,Fragrances,EGP 695.00,,,3.8,,,,,https://m.media-amazon.com/images/I/61mknaEF45L._AC_UL320_.jpg,https://www.amazon.eg/dp/B005UCIRGM,2026-04-04T05:37:50.622977
amazon,,Camara Posh In Paradise For Eau De Parfum Women 100ml,,Fragrances,EGP 700.00,EGP 860.00,,4.6,List:,,,,https://m.media-amazon.com/images/I/7150gBGytyL._AC_UL320_.jpg,https://www.amazon.eg/dp/B0C1NJYDJH,2026-04-04T05:37:50.623605
amazon,,Emper Women's Chiffon Rouge Eau De Perfume (3.4oz),,Fragrances,EGP 578.82,EGP 604.82,,3.5,List:,,,,https://m.media-amazon.com/images/I/51Qcza-LZFL._AC_UL320_.jpg,https://www.amazon.eg/dp/B09DBBVQ42,2026-04-04T05:37:50.624269
amazon,,Arabian Tonka perfume 50 ml,,Fragrances,EGP 799.00,,,5.0,,,,,https://m.media-amazon.com/images/I/61ztbcVIuvL._AC_UL320_.jpg,https://www.amazon.eg/dp/B0FX1JP3MX,2026-04-04T05:37:50.624790
amazon,,Almas Perfumes Al Oud Al Azraq Eau De Parfum For Unisex 100Ml,,Fragrances,"EGP 1,046.83",,,3.8,,,,,https://m.media-amazon.com/images/I/71qH4NpMnKL._AC_UL320_.jpg,https://www.amazon.eg/dp/B0DMP279WW,2026-04-04T05:37:50.625409
amazon,,"Lancome la vie est belle - perfumes for women - eau de parfum, 100 ml (Pack of 1)",,Fragrances,"EGP 6,608.46","EGP 7,735.00",,4.7,List:,,,,https://m.media-amazon.com/images/I/710fa-Et8LL._AC_UL320_.jpg,https://www.amazon.eg/dp/B00I7PK3GQ,2026-04-04T05:37:50.626007
amazon,,Emper Le Chameau Arabia Inter Rouge Eau de Toilette Spray for Women - 100 ml Fragrance in Floral Scent Profile,,Fragrances,EGP 975.00,,,5.0,,,,,https://m.media-amazon.com/images/I/517wVqBWEKL._AC_UL320_.jpg,https://www.amazon.eg/dp/B0B3Y1DTWM,2026-04-04T05:37:50.626549
amazon,,Karen Low Code 37 Perfume for women 100ml eau de parfum,,Fragrances,EGP 699.00,,,4.1,,,,,https://m.media-amazon.com/images/I/51GoFEBaIrL._AC_UL320_.jpg,https://www.amazon.eg/dp/B01LMNCBRI,2026-04-04T05:37:50.627050
amazon,,Milestone perfumes Real Oud Eau De Parfum For Women 100ml,,Fragrances,EGP 680.00,,,4.0,,,,,https://m.media-amazon.com/images/I/71DwOThfORL._AC_UL320_.jpg,https://www.amazon.eg/dp/B0D11LH68R,2026-04-04T05:37:50.627586
amazon,,My Perfumes EDP Qamar Alzeyan For Unisex 85ml,,Fragrances,EGP 715.00,,,,,,,,https://m.media-amazon.com/images/I/51K6OZv7ePL._AC_UL320_.jpg,https://www.amazon.eg/dp/B0D122QWH9,2026-04-04T05:37:50.628037
amazon,,Milestone perfumes Best Peach Eau De For Unisex 100ml,,Fragrances,EGP 595.00,,,3.7,,,,,https://m.media-amazon.com/images/I/51GAlr2G4NL._AC_UL320_.jpg,https://www.amazon.eg/dp/B0D2D9YP62,2026-04-04T05:37:50.628580
amazon,,"QuiQia Khamrah Perfume EDP 100ml - Luxury Arabian Fragrance For Men, Women, Unisex - Sweet, Vanilla, Amberwood - Long Lasting Spray",,Fragrances,"EGP 1,790.00",,,3.6,,,,,https://m.media-amazon.com/images/I/61VcrDDJe7L._AC_UL320_.jpg,https://www.amazon.eg/dp/B0C1TFLRS7,2026-04-04T05:37:50.629104
amazon,,"Makhmarya Perfume Balm, 1 Piece (17 g, Si)",,Fragrances,EGP 129.00,,,,,,,,https://m.media-amazon.com/images/I/51L+qn1XDEL._AC_UL320_.jpg,https://www.amazon.eg/dp/B0GNSH17NY,2026-04-04T05:37:50.629721
amazon,,Long Lasting Body Perfume (Tuesday Majesty Body Perfum),,Fragrances,EGP 310.00,,,4.7,,,,,https://m.media-amazon.com/images/I/41kAcA-1YGL._AC_UL320_.jpg,https://www.amazon.eg/dp/B0FCGB6F8W,2026-04-04T05:37:50.630298
amazon,,"LAVERNE In Love Perfume, 200 ml",,Fragrances,"EGP 2,850.00",,,5.0,,,,,https://m.media-amazon.com/images/I/31ecf7SwMbL._AC_UL320_.jpg,https://www.amazon.eg/dp/B0FXVB4HGS,2026-04-04T05:37:55.234645
amazon,,"Milestone Perfumes Rosebomb Women'S Eau De Parfum, Long-Lasting Floral Fragrance, 100Ml, Day Or Night Wear",,Fragrances,EGP 801.00,,,,,,,,https://m.media-amazon.com/images/I/715sh-oa4YL._AC_UL320_.jpg,https://www.amazon.eg/dp/B0D9WB2KM7,2026-04-04T05:37:55.235121
amazon,,Emper Luxe Verde Eau de Parfum Spray for Unisex 100 ml,,Fragrances,EGP 673.06,,,3.5,,,,,https://m.media-amazon.com/images/I/51ZJWK1WB4L._AC_UL320_.jpg,https://www.amazon.eg/dp/B0B3Y15XVB,2026-04-04T05:37:55.235732
amazon,,"My Way Essential perfume for men, Eau de Toilette, 50 ml",,Fragrances,EGP 229.00,EGP 235.00,,3.9,Was:,,,,https://m.media-amazon.com/images/I/51JoisXx+uL._AC_UL320_.jpg,https://www.amazon.eg/dp/B091JWXH1S,2026-04-04T05:37:55.236357
amazon,,"Guess Perfume - Guess Dare - perfume for men, 100 ml - EDT Spray",,Fragrances,"EGP 2,018.94",,,4.5,,,,,https://m.media-amazon.com/images/I/81weCO6t6gL._AC_UL320_.jpg,https://www.amazon.eg/dp/B01HQMQE5O,2026-04-04T05:37:55.236884
amazon,,Milestone Perfumes Sole Age Men Long Lasting Fragrance Eau De Parfum 100Ml,,Fragrances,EGP 765.75,,,4.4,,,,,https://m.media-amazon.com/images/I/41mQ6+gOG5L._AC_UL320_.jpg,https://www.amazon.eg/dp/B0D9QWZ12K,2026-04-04T05:37:55.237474
amazon,,"Miss YOU Perfume for Women, 12 ml Roll-On, Natural Raw Fragrance Inspired by Miss DIOR Perfume, No Alcohol, Long Lasting Lasting Fragrance Fragrance by L'Parfum Niche",,Fragrances,EGP 299.00,,,3.3,,,,,https://m.media-amazon.com/images/I/51dQN3BUMbL._AC_UL320_.jpg,https://www.amazon.eg/dp/B0FM4LTLQ7,2026-04-04T05:37:55.237990
