platform,asin,title,brand,category,current_price,original_price,discount,rating,reviews_count,prime_eligible,amazon_choice,sponsored,main_image,product_url,scraped_at
amazon,,"UTEX Toy Storage Organizer with Bookcase, Kid’s Multi Shelf Cubby for Books,Toys, Storage Organizer for Boys,Girls Play Room/Bedroom-White",,Furniture,"EGP 8,430.00",,,4.6,,,,,https://m.media-amazon.com/images/I/8104+5uNW0L._AC_UL320_.jpg,https://www.amazon.eg/dp/B08QSBVRYQ,2026-03-28T02:54:29.743969
amazon,,DeFacto Man Fit Knitted Oversize Fit Crew Neck Short Sleeve Short Sleeve T-Shirt E4007AX,,Furniture,EGP 669.00,,,,,,,,https://m.media-amazon.com/images/I/616DMlCJIVL._AC_UL320_.jpg,https://www.amazon.eg/dp/B07XHQC384,2026-03-28T02:54:33.992595
amazon,,DeFacto Man Fit Knitted Oversize Fit Crew Neck Short Sleeve Short Sleeve T-Shirt E4007AX,,Furniture,EGP 667.00,,,,,,,,https://m.media-amazon.com/images/I/616DMlCJIVL._AC_UL320_.jpg,https://www.amazon.eg/dp/B07XKG6Z4F,2026-03-28T02:54:33.993095
amazon,,DeFacto Man Fit Knitted Oversize Fit Crew Neck Short Sleeve Short Sleeve T-Shirt E4007AX,,Furniture,EGP 667.00,,,,,,,,https://m.media-amazon.com/images/I/616DMlCJIVL._AC_UL320_.jpg,https://www.amazon.eg/dp/B07XMHFFF6,2026-03-28T02:54:33.993529
amazon,,"10/50 M2 M2.5 M3 M3.5 M4 M5 M6 M8 A2 304 Stainless Steel Cross Round Phillips Pan Head Screw Dia 2 3 4 5 8mm Length 3-100mm (Length : 6mm, Size : M5 10pcs)",,Furniture,EGP 88.00,,,,,,,,https://m.media-amazon.com/images/I/41msk8WXREL._AC_UL320_.jpg,https://www.amazon.eg/dp/B087JNN7W4,2026-03-28T02:54:33.993989
amazon,,Premium Heated Blanket Shawl (Oversized Size) | Heavy Heidi Plush | 3D HD Digital Printing | Full Body Wrap | Upscale Home Shawl | Sundus 2028,,Furniture,EGP 349.99,,,1.7,,,,,https://m.media-amazon.com/images/I/512HhznjrOL._AC_UL320_.jpg,https://www.amazon.eg/dp/B0G5H7FBWP,2026-03-28T02:54:33.994491
amazon,,"BIKI Leather Care Spray – Instant Revive & Deep Nourish – Protects Sofas, Boots, Wallets, Shoes – Moisturizes, Restores Color, Guards Against Water & Scratch – Safe for All Leather Types (Navy)",,Furniture,EGP 149.00,,,,,,,,https://m.media-amazon.com/images/I/51UQYur6nwL._AC_UL320_.jpg,https://www.amazon.eg/dp/B0GNSMT5LK,2026-03-28T02:54:33.994952
amazon,,DeFacto Man Fit Knitted Oversize Fit Crew Neck Short Sleeve Short Sleeve T-Shirt E4007AX,,Furniture,EGP 669.00,,,,,,,,https://m.media-amazon.com/images/I/616DMlCJIVL._AC_UL320_.jpg,https://www.amazon.eg/dp/B07XHQBLRH,2026-03-28T02:54:33.995414
amazon,,DeFacto Mens D5508AX Modern,,Furniture,EGP 674.00,,,4.0,,,,,https://m.media-amazon.com/images/I/61XtvrHO1oL._AC_UL320_.jpg,https://www.amazon.eg/dp/B07XH1NZ8P,2026-03-28T02:54:33.995896
amazon,,DeFacto Man Man Young Knitted Boxy Fit Crew Neck Short Sleeve T-Shirt D9846AX T-Shirt,,Furniture,EGP 639.00,,,,,,,,https://m.media-amazon.com/images/I/61XtvrHO1oL._AC_UL320_.jpg,https://www.amazon.eg/dp/B07X9Z891J,2026-03-28T02:54:33.996472
amazon,,Saxony Oak 3 Shelves 2 Door Bookcase Storage Unit Display Cabinet Home Living Room Furniture,,Furniture,"EGP 7,020.00",,,4.3,,,,,https://m.media-amazon.com/images/I/61ZCBtCRVXL._AC_UL320_.jpg,https://www.amazon.eg/dp/B07LBWTZSY,2026-03-28T02:54:33.997013
amazon,,SBF Furniture Engineered Wood Bookshelf Multipurpose Home Decor Storage Rack Bookcase Showcase for Living Room Book Shelves (7 Shelf Rectangular Bookrack) (Brown Accasiya Dark),,Furniture,,,,3.2,,,,,https://m.media-amazon.com/images/I/71fv43aSPfL._AC_UL320_.jpg,https://www.amazon.eg/dp/B0CV9HN6W2,2026-03-28T02:54:33.997488
amazon,,"SBF Furniture Engineered Wood Printer Stand with 3 Compartment Storage, Workspace Desk Organizers for Home & Office Desk Organizers,Office Supplies Desk Organize (Black Wenge) DIY(Do-It-Yourself)",,Furniture,"EGP 4,753.00",,,,,,,,https://m.media-amazon.com/images/I/71iCSka7hpL._AC_UL320_.jpg,https://www.amazon.eg/dp/B0CSWJCT5N,2026-03-28T02:54:33.997967
amazon,,"Rustic Natural Wood Book Stand Shelf for Table and Home Decor | 1-Shelf, Classic Style, Book Shelf, Shelf, Bookshelf",,Furniture,EGP 441.00,,,5.0,,,,,https://m.media-amazon.com/images/I/81b-tpSgkTL._AC_UL320_.jpg,https://www.amazon.eg/dp/B0B28YDZPB,2026-03-28T02:54:33.998997
amazon,,Home gallery Wall mounted folding desk 60 x 40 cm black x gray,,Furniture,EGP 960.00,,,3.7,,,,,https://m.media-amazon.com/images/I/51zSpIodYQL._AC_UL320_.jpg,https://www.amazon.eg/dp/B0B6T64WDR,2026-03-28T02:54:33.999751
amazon,,"JIALTO Multipurpose Trolley with Wheels- Heavy Duty 3-Tier Utility Cart for Storage & Organization- Movable Rack for Home, Kitchen, Bathroom, Pantry- Durable Metal Frame with Lockable Wheels (Pink)",,Furniture,"EGP 1,300.00",,,4.2,,,,,https://m.media-amazon.com/images/I/71OTKqCnAeL._AC_UL320_.jpg,https://www.amazon.eg/dp/B0CGLRRKGY,2026-03-28T02:54:34.000319
amazon,,"100 Imitation Gold Leaf Sheets 14 x 14 cm Gold Leaf for Art, Gilding, Crafting, Paintings, Home Furniture Decoration, Nail & DIY Arts Projects",,Furniture,EGP 238.00,EGP 256.73,,4.3,Was:,,,,https://m.media-amazon.com/images/I/71EPfGkCZES._AC_UL320_.jpg,https://www.amazon.eg/dp/B09P1YDT3R,2026-03-28T02:54:34.000903
amazon,,"Idea Poof Set - 2 Pieces (Large:48x50cm, Small:37x38cm) - Panda Fabric, Natural Wood Contour, Modern Interlocking Design by No Comment Furniture (Mustard)",,Furniture,"EGP 3,949.99",,,5.0,,,,,https://m.media-amazon.com/images/I/61Jg8-OEF-L._AC_UL320_.jpg,https://www.amazon.eg/dp/B0FHF48JBX,2026-03-28T02:54:34.001621
amazon,,"Reversible Open Shelf, Modern Storage Organizer, Multipurpose Bookcase and Room Divider, Horizontal or Vertical Use, Simple Minimalist Design - 7 Cube - White",,Furniture,EGP 765.00,,,3.3,,,,,https://m.media-amazon.com/images/I/51Au6fjm9gL._AC_UL320_.jpg,https://www.amazon.eg/dp/B0FPD3Y948,2026-03-28T02:54:34.002269
amazon,,Greeno Shoe Rack Stand for Home Multipurpose Storage Organizer Lightweight with PVC Hard Pipes Dust Proof Cover (4 Layer Black),,Furniture,EGP 264.00,,,3.5,,,,,https://m.media-amazon.com/images/I/61W9dpOKMnL._AC_UL320_.jpg,https://www.amazon.eg/dp/B0CTFGJ9QT,2026-03-28T02:54:34.002801
amazon,,"Bush Furniture Essence 2 Shelf Bookcase in White | Organizers and Shelves for Home Office Workspace, Living Room, Entryway, Bedroom, and Mudroom",,Furniture,"EGP 4,999.00",,,,,,,,https://m.media-amazon.com/images/I/517ccZ2ohPL._AC_UL320_.jpg,https://www.amazon.eg/dp/B0CZYJDMZ4,2026-03-28T02:54:34.003290
amazon,,"Iris Ohyama, Cabinet with 4 shelving/Wooden storage with shelves/Bookcase/Side furniture, Modern & Design, Office, Living Room,Bedroom - Basic Storage Shelf CX-4 - Light Brown",,Furniture,EGP 830.00,,,4.3,,,,,https://m.media-amazon.com/images/I/71afEK4kL4L._AC_UL320_.jpg,https://www.amazon.eg/dp/B07TSTJXJN,2026-03-28T02:54:34.003777
amazon,,"Cat Scratches Sofa Protection, Cat Scratching Mat Self-Adhesive 100 x 30 cm, Reusable and Cuttable, Ideal for Sofas, Furniture and Walls, Easy to Apply (Blue)",,Furniture,EGP 260.00,,,3.8,,,,,https://m.media-amazon.com/images/I/81G59yp3-pL._AC_UL320_.jpg,https://www.amazon.eg/dp/B0F1YTYZJ8,2026-03-28T02:54:34.004338
amazon,,Adjustable Wood Desktop Storage Organizer Display Shelf Rack | Spice Rack | Counter Top Bookcase Book Shelf | Home Décor Display & Storage Rack Cabinet Unit (3 Tier Brown),,Furniture,"EGP 4,300.00",,,4.2,,,,,https://m.media-amazon.com/images/I/51jPvgc9oVL._AC_UL320_.jpg,https://www.amazon.eg/dp/B0DTK45B5X,2026-03-28T02:54:34.004833
amazon,,"Home Source Chest of Drawers Bedroom Living Room Storage Furniture with Metal Handles, Engineered Wood, Grey, 4",,Furniture,"EGP 15,557.00",,,4.1,,,,,https://m.media-amazon.com/images/I/71ynpd5TgfL._AC_UL320_.jpg,https://www.amazon.eg/dp/B08TH3XVS9,2026-03-28T02:54:34.005365
amazon,,All Smiles Outdoor Pillow Covers Fall Patio Orange Throw Pillow Covers 18x18 Fall Decor Boho Furniture Pillow Cases Decorative Cushion Set of 4 for Home Porch Chair Couch Sofa Living Room Geometric,,Furniture,EGP 235.81,EGP 399.00,,4.4,Was:,,,,https://m.media-amazon.com/images/I/61ysqVHoguL._AC_UL320_.jpg,https://www.amazon.eg/dp/B0744BM2P2,2026-03-28T02:54:34.006067
amazon,,"7 Tier Bookcase,Tree Bookshelf for Small Spaces,Wooden Storage for Books, CDs, Files in Living Room, Bedroom, Home Office Grey BS36GB",,Furniture,"EGP 8,439.00",,,4.2,,,,,https://m.media-amazon.com/images/I/61ps3emnMJL._AC_UL320_.jpg,https://www.amazon.eg/dp/B0CQK3M2GR,2026-03-28T02:54:34.006586
amazon,,"3 Tier Low Bookcase, White Wooden Shelving Display Storage Unit, Modern Office and Living Room Furniture, Wide and Compact Bookshelf, Elegant Design",,Furniture,EGP 600.00,,,2.0,,,,,https://m.media-amazon.com/images/I/519FQ1ULxnL._AC_UL320_.jpg,https://www.amazon.eg/dp/B0FPFS883H,2026-03-28T02:54:34.007103
amazon,,"5 Drawer Chest Dressers Storage Cabinets, Wood File Cabinet Mobile Office Storage Cabinets with Wheels, Small Tall Dressers Rolling Vertical File Cabinet Organization Furniture for Office, Home, White",,Furniture,"EGP 9,500.00",,,,,,,,https://m.media-amazon.com/images/I/51zr-NoR3DL._AC_UL320_.jpg,https://www.amazon.eg/dp/B0DQY8B3J9,2026-03-28T02:54:34.007547
amazon,,"Furniture Stabilizer & Anti-Vibration Bumper – Adjustable Protector for Beds, Sofas, Chairs, Doors, Secure Installation, Heavy Duty Home Solution (Two packs (6 pieces))",,Furniture,EGP 588.00,,,5.0,,,,,https://m.media-amazon.com/images/I/619LrSHGb9L._AC_UL320_.jpg,https://www.amazon.eg/dp/B0FPZ8NZPY,2026-03-28T02:54:34.008093
amazon,,"Home Source Grey Oak Storage Cube 9 Shelf Bookcase Wooden Display Unit Organiser Furniture, Large",,Furniture,"EGP 14,535.00",,,3.9,,,,,https://m.media-amazon.com/images/I/81KP0m+xcLL._AC_UL320_.jpg,https://www.amazon.eg/dp/B0B5VHTVBY,2026-03-28T02:54:34.008613
amazon,,Solid Sheesham Wood Book Shelf with Storage Book Racks for Living Room Study Room Home | Wooden Furniture Open Book Shelf for Hallway Bedroom Office | Walnut,,Furniture,"EGP 6,125.00",,,,,,,,https://m.media-amazon.com/images/I/51HAIIJULVL._AC_UL320_.jpg,https://www.amazon.eg/dp/B0CQ8VX7FQ,2026-03-28T02:54:34.009074
amazon,,Set Of Floating Wooden Shelves - 3Pcs,,Furniture,,,,3.4,,,,,https://m.media-amazon.com/images/I/6123LHNfTEL._AC_UL320_.jpg,https://www.amazon.eg/dp/B09248TGHV,2026-03-28T02:54:34.009543
amazon,,"2 Tier Desktop Shelf Printer Rack for Home Office Free Standing, Kitchen Countertop Microwave Oven Unit Shelving Stand Rack with Drawers for Household Storage Organizer Metal Frame Wood Tabletop",,Furniture,"EGP 6,500.00",,,4.5,,,,,https://m.media-amazon.com/images/I/51bHP35X8oL._AC_UL320_.jpg,https://www.amazon.eg/dp/B08XBB82ZB,2026-03-28T02:54:34.010061
amazon,,"JAZZEEL Office Desk, 3 Drawer Pedestal Workstation, 130 cm, Driftwood Dreams, Professional Writing Table for Home Corporate, Durable Storage Furniture, Heavy Duty Commercial Unit.",,Furniture,"EGP 18,555.00",,,,,,,,https://m.media-amazon.com/images/I/71Kiv0TspCL._AC_UL320_.jpg,https://www.amazon.eg/dp/B0G657JSKH,2026-03-28T02:54:34.010483
amazon,,Basket Touch Chic Furniture Piece Adds Elegance And Practical To Your Home And Touch Great For Keeping Cleanliness Y,,Furniture,EGP 544.50,,,,,,,,https://m.media-amazon.com/images/I/217a72JdhXL._AC_UL320_.jpg,https://www.amazon.eg/dp/B0FX142XN8,2026-03-28T02:54:34.010899
amazon,,"HOCUS PICUS Home Furniture, One Size",,Furniture,,,,,,,,,https://m.media-amazon.com/images/I/91dplHDkLoL._AC_UL320_.jpg,https://www.amazon.eg/dp/B0BXPQ4DVB,2026-03-28T02:54:34.011320
amazon,,"Portal 3 Tier Cube Bookcase, Black Wooden Shelving Display Storage Unit Office Living Room Furniture (80 * 33 * 24)",,Furniture,EGP 693.00,,,3.2,,,,,https://m.media-amazon.com/images/I/51CDAUDiNKL._AC_UL320_.jpg,https://www.amazon.eg/dp/B0C6HYQYKD,2026-03-28T02:54:34.011822
amazon,,Captiver Riko Engineered Wood Floor Standing Bookshelf Organizer 1 Doors Cabinet Wardrobe for Home Library Without Drawer (Wenge),,Furniture,"EGP 3,950.00",,,,,,,,https://m.media-amazon.com/images/I/61bmZyaSArL._AC_UL320_.jpg,https://www.amazon.eg/dp/B0CLZZ9WFW,2026-03-28T02:54:34.012272
amazon,,"Generic Linen Sofa Cover Set with Tassels, 10 Pieces, Living Room Furniture Protector, 195 x 90 cm Large Sofa .flo (grey)",,Furniture,"EGP 1,500.00",,,3.0,,,,,https://m.media-amazon.com/images/I/41Q1wD0Z2HL._AC_UL320_.jpg,https://www.amazon.eg/dp/B0F288SXZT,2026-03-28T02:54:34.012821
amazon,,"Generic Spanish Jacquard Elastic Furniture Cover Set, Slipcovers for Large Sofa, Small Sofa and 2 Chairs,set of 4 .OR 6..8 COVER CHAIRS CHOOSE BEFORE BUY (بيج, انتريه 4 قطع 2 كنبه و2 كرسي)",,Furniture,"EGP 1,880.00",,,1.0,,,,,https://m.media-amazon.com/images/I/51E9g3N9x5L._AC_UL320_.jpg,https://www.amazon.eg/dp/B0FP3LCNHZ,2026-03-28T02:54:34.013418
amazon,,"Shoe rack, simple assembly single row 8-tier 7-cube shoe tower rack with dust-proof cover, space saving storage shelf organizer cabinet for shoes and others",,Furniture,EGP 344.90,EGP 380.00,,3.1,Was:,,,,https://m.media-amazon.com/images/I/613AOWdRo+L._AC_UL320_.jpg,https://www.amazon.eg/dp/B092LHL33G,2026-03-28T02:54:34.014085
amazon,,"Kings Brand Furniture Gray Metal Home & Office Folding Storage Bookcase Organizer Display Unit, 4 Tier, 4 Tier",,Furniture,"EGP 8,900.00",,,3.4,,,,,https://m.media-amazon.com/images/I/91QRlv0fYeL._AC_UL320_.jpg,https://www.amazon.eg/dp/B076QH2R3M,2026-03-28T02:54:34.014657
amazon,,"HSH Furniture 4-Shelf Vintage Industrial Bookshelf, Rustic Wood and Metal Bookcase, Open Wide Office Etagere Book Shelf, Dark Oak",,Furniture,"EGP 8,999.00",,,4.7,,,,,https://m.media-amazon.com/images/I/61oLLWntqyL._AC_UL320_.jpg,https://www.amazon.eg/dp/B071HTCYHH,2026-03-28T02:54:34.015208
amazon,,Home Gallery Multipurpose functional tv stand black natural wood,,Furniture,"EGP 3,335.00",,,3.6,,,,,https://m.media-amazon.com/images/I/71zqDSxyeLS._AC_UL320_.jpg,https://www.amazon.eg/dp/B0973LDPT6,2026-03-28T02:54:34.015698
amazon,,Adjustable Wood Desktop Storage Organizer Display Shelf Rack | Spice Rack | Counter Top Bookcase Book Shelf | Home Décor Display & Storage Rack Cabinet Unit (Yellow),,Furniture,"EGP 4,300.00",,,3.6,,,,,https://m.media-amazon.com/images/I/81QLZPra+XL._AC_UL320_.jpg,https://www.amazon.eg/dp/B0CNH2FC9G,2026-03-28T02:54:34.016223
amazon,,"3 Tier Low Bookcase, Oak Finish Wooden Shelving Display Unit, Modern Office and Living Room Furniture, Wide and Compact Bookshelf, Elegant Design",,Furniture,EGP 603.00,EGP 670.00,,,Was:,,,,https://m.media-amazon.com/images/I/71t9DmnqCJL._AC_UL320_.jpg,https://www.amazon.eg/dp/B0FPFRNMQP,2026-03-28T02:54:34.016753
amazon,,"Wooden Bathroom Shelf Wall Mounted, Teak Wood Towel Holder, Simple Design Storage Organizer with Hooks, Spa Style Bathroom Decor",,Furniture,"EGP 1,200.00",,,,,,,,https://m.media-amazon.com/images/I/61cm98CQi3L._AC_UL320_.jpg,https://www.amazon.eg/dp/B0GCHPPVFY,2026-03-28T02:54:34.017219
amazon,,"Panana Bookcase with Doors, 5 Shelves Free Standing Display Bookshelf with Cabinet Storage Organizer Home Office Furniture (Black)",,Furniture,"EGP 18,900.00",,,4.1,,,,,https://m.media-amazon.com/images/I/61akwl52ekL._AC_UL320_.jpg,https://www.amazon.eg/dp/B0CN16GGX8,2026-03-28T02:54:37.789404
amazon,,Casaria Deuba bookcase vela 5 compartments bookshelf wooden storage rack modern shelving books stand shelf any room office 190 x 60 x 31 cm oak,,Furniture,"EGP 2,920.00","EGP 3,232.23",,4.0,List:,,,,https://m.media-amazon.com/images/I/61bG3HTlG5L._AC_UL320_.jpg,https://www.amazon.eg/dp/B07H4L7SZV,2026-03-28T02:54:37.790096
amazon,,I Khayal Gallery Exclusive Luxury Wooden Side Table - Artistic Decor Table - High Quality Oriental Furniture Exclusive Side Table Handcrafted 3D Accent Decor -Oriental Mandala Colorful 55cm,,Furniture,"EGP 1,590.00",,,5.0,,,,,https://m.media-amazon.com/images/I/91+1JmR5V6L._AC_UL320_.jpg,https://www.amazon.eg/dp/B0FY1ZPXV6,2026-03-28T02:54:37.790604
amazon,,"O&K FURNITURE Gold End Table for Living Room, Modern Glass Side Table with Metal Frames for Home&Office, Glass End Table Nightstand for Bedroom, Gold Finish, 1 PC",,Furniture,"EGP 12,499.00",,,4.7,,,,,https://m.media-amazon.com/images/I/71GMDcNPKwL._AC_UL320_.jpg,https://www.amazon.eg/dp/B0BFF1W2KD,2026-03-28T02:54:37.791127
amazon,,"Tribesigns 70.8”Executive Desk, Large Office Computer Desk with Thicken Frame, Modern Simple Workstation Business Furniture for Home Office, Vintage Brown/Black",,Furniture,"EGP 15,800.00",,,4.5,,,,,https://m.media-amazon.com/images/I/81bPwKfEQzL._AC_UL320_.jpg,https://www.amazon.eg/dp/B0BCYMD7ZS,2026-03-28T02:54:37.791621
amazon,,Home gallery wall mounted folding drop leaf desk 90 x 50 cm brown,,Furniture,"EGP 1,100.81",,,3.0,,,,,https://m.media-amazon.com/images/I/51VNR-uBb+L._AC_UL320_.jpg,https://www.amazon.eg/dp/B0BK57V1Y8,2026-03-28T02:54:37.792178
amazon,,SBF Furniture Engineered Wood Bookshelf Multipurpose Home Decor Storage Rack Bookcase Showcase Organizer for Living Room Kitchen (Square 6 Shelf Bookrack) (White Marble),,Furniture,"EGP 2,699.00",,,3.7,,,,,https://m.media-amazon.com/images/I/71nR1En4ojL._AC_UL320_.jpg,https://www.amazon.eg/dp/B0CGM52D8P,2026-03-28T02:54:37.792717
amazon,,"Wooden Book Rack,Rectangular Space Saver Engineered Wood Book Shelf for Home, Living Room and Office, Table Top Free Standing, Laminated Finish, Modern Tree Shape (3 Tier Brown)",,Furniture,"EGP 3,465.00",,,,,,,,https://m.media-amazon.com/images/I/51jPvgc9oVL._AC_UL320_.jpg,https://www.amazon.eg/dp/B0DTK3ZBWK,2026-03-28T02:54:37.793172
amazon,,"Kidilo T701L Foldable Toddler Bed – Lightweight Portable Kids Sleeping Cot with Soft Fabric, Safety Lock & Sturdy Frame – Ideal for Home, Travel & Daycare (Gray)",,Furniture,"EGP 6,400.00",,,,,,,,https://m.media-amazon.com/images/I/51N1XfwvJ3L._AC_UL320_.jpg,https://www.amazon.eg/dp/B0FG1QVCFR,2026-03-28T02:54:37.793611
amazon,,"MRBLS Bedside Table, Set of 2, Box Spring Bed, Bedside Cabinet, Modern Furniture without Drawers for Your Bedroom, Living Room, Side Table, Simple Sofa Table (Wotan), 32 x 40 x 30 cm (W x H x D)",,Furniture,"EGP 7,800.00",,,4.8,,,,,https://m.media-amazon.com/images/I/61fJCNgBUEL._AC_UL320_.jpg,https://www.amazon.eg/dp/B0CLQ1R15J,2026-03-28T02:54:37.794141
amazon,,"Star Bags Water Proof Soccer Pouf Chair Bean Bag - 2XL Size 100x100cm - White and Black - For Sea, Garden, Home",,Furniture,"EGP 1,750.00",,,3.0,,,,,https://m.media-amazon.com/images/I/51fGiQOz02L._AC_UL320_.jpg,https://www.amazon.eg/dp/B0FXRW13W4,2026-03-28T02:54:37.794631
amazon,,"3-Tiers Storage Shelf with Solid Wood Frame Open Bookcase Furniture Display Shelving for Home Office,Kitchen,Living Room,White",,Furniture,"EGP 4,300.00",,,,,,,,https://m.media-amazon.com/images/I/81sKgoKIDML._AC_UL320_.jpg,https://www.amazon.eg/dp/B0C49LGSKG,2026-03-28T02:54:37.795086
amazon,,"ABenkle 6 Pcs Coasters for Drinks,Super Absorbent Drink Coasters, Stylish Handmade Round Woven Coaster for Coffee Table Tabletop Protection Housewarming Gift for Home Decor - 4.3 Inches, Bright Pink",,Furniture,EGP 229.00,,,4.7,,,,,https://m.media-amazon.com/images/I/71DztkPWJJL._AC_UL320_.jpg,https://www.amazon.eg/dp/B0CLP6CRLP,2026-03-28T02:54:37.795576
amazon,,@home by Nilkamal Astero Shoe Cabinet (Walnut),,Furniture,,,,4.0,,,,,https://m.media-amazon.com/images/I/81XkqjMdPdL._AC_UL320_.jpg,https://www.amazon.eg/dp/B08KM9BX3Q,2026-03-28T02:54:37.796063
amazon,,Rovanio Plastic Folding Chair and Table Set for Garden and Home - Beige,,Furniture,"EGP 1,799.00",,,3.0,,,,,https://m.media-amazon.com/images/I/618U4GGhDQL._AC_UL320_.jpg,https://www.amazon.eg/dp/B0DK828M79,2026-03-28T02:54:37.796545
amazon,,"Furniture polish, home furniture polish with beeswax, treats scratches and renews wood, one box",,Furniture,EGP 231.00,,,,,,,,https://m.media-amazon.com/images/I/51k-zr-I04L._AC_UL320_.jpg,https://www.amazon.eg/dp/B0D7TX98VN,2026-03-28T02:54:37.797006
amazon,,"BURLYWORTH Fabelio Engineered Wood Coffee Table for Living Room, Centre Table With Storage, Modern Designer Tea Table, Sofa Set (White)",,Furniture,"EGP 1,750.00",,,3.0,,,,,https://m.media-amazon.com/images/I/7155hTZAXQL._AC_UL320_.jpg,https://www.amazon.eg/dp/B0BP4QS9PF,2026-03-28T02:54:37.797496
amazon,,SBF Furniture® Wooden Bookcase for Home Office and Library Engineering Wood Space Saving Freestanding Books Holder Stylish Book Organizer (DIY) (Tree Shape 3 Step) (White Marble),,Furniture,"EGP 6,984.00",,,3.3,,,,,https://m.media-amazon.com/images/I/81GZDcknx9L._AC_UL320_.jpg,https://www.amazon.eg/dp/B0CG3984QF,2026-03-28T02:54:37.798082
