platform,asin,title,brand,category,current_price,original_price,discount,rating,reviews_count,prime_eligible,amazon_choice,sponsored,main_image,product_url,scraped_at
amazon,B0CJYKDCBT,"Elmaayergy BH-2 Children's Stamp With Durable Material, Suitable For School And Home",,Toys & Games,EGP 7.34,,,2.4,,,,,https://m.media-amazon.com/images/I/613eyQZe9eL._AC_UL320_.jpg,https://www.amazon.eg/dp/B0CJYKDCBT,2026-03-28T13:02:09.684992
amazon,B078W42FZ7,Turkish Bedspread (Havana),,Toys & Games,EGP 8.15,,,3.7,,,,,https://m.media-amazon.com/images/I/61CI3RAoHaL._AC_UL320_.jpg,https://www.amazon.eg/dp/B078W42FZ7,2026-03-28T13:02:09.685629
amazon,B0CCLFV6H3,Flash Cards Assorted Shapes & Colors,,Toys & Games,EGP 8.77,,,3.0,,,,,https://m.media-amazon.com/images/I/51S6OGQryoL._AC_UL320_.jpg,https://www.amazon.eg/dp/B0CCLFV6H3,2026-03-28T13:02:09.686166
amazon,B0C2D9Q2HT,Template Brushes,,Toys & Games,EGP 8.77,,,,,,,,https://m.media-amazon.com/images/I/61ugWbKHuQL._AC_UL320_.jpg,https://www.amazon.eg/dp/B0C2D9Q2HT,2026-03-28T13:02:09.686692
amazon,B0FJFVZD41,"SONIX C6-6OPP Watercolor Palette 6-Color Stone + Brush, Single Piece",,Toys & Games,EGP 9.00,,,3.7,,,,,https://m.media-amazon.com/images/I/61QQoNJg5hL._AC_UL320_.jpg,https://www.amazon.eg/dp/B0FJFVZD41,2026-03-28T13:02:09.687211
amazon,B0FD8R1MY9,Keyroad Eraser small double-sided for pencil & ink model KR971645,,Toys & Games,EGP 9.00,,,3.0,,,,,https://m.media-amazon.com/images/I/51rpGQ3kuML._AC_UL320_.jpg,https://www.amazon.eg/dp/B0FD8R1MY9,2026-03-28T13:02:09.687774
amazon,B0D4K81CXZ,"Elmaayergy Eraser Pen Refill Suitable For classroom, Homeschooling, And Individual Study Environments",,Toys & Games,EGP 9.82,,,4.0,,,,,https://m.media-amazon.com/images/I/410cmhjNdWL._AC_UL320_.jpg,https://www.amazon.eg/dp/B0D4K81CXZ,2026-03-28T13:02:09.688290
amazon,B07Y7MMTB4,Fortnite Panini Sticker Pack - 5 Stickers,,Toys & Games,,,,4.4,,,,,https://m.media-amazon.com/images/I/81yXVw2wAML._AC_UL320_.jpg,https://www.amazon.eg/dp/B07Y7MMTB4,2026-03-28T13:02:09.689022
amazon,B07D9PBR32,L.O.L. Surprise! 5x Panini Sticker Pack (5 sealed packs),,Toys & Games,EGP 10.00,,,2.0,,,,,https://m.media-amazon.com/images/I/71gBWx6-lUL._AC_UL320_.jpg,https://www.amazon.eg/dp/B07D9PBR32,2026-03-28T13:02:09.689552
amazon,B0GSRRT996,"Easter Card for Kids, Cross and Resurrection Story Picture Card Christian Religious Educational Toys",,Toys & Games,EGP 10.00,,,,,,,,https://m.media-amazon.com/images/I/412ukHz3cnL._AC_UL320_.jpg,https://www.amazon.eg/dp/B0GSRRT996,2026-03-28T13:02:09.689995
amazon,B08WJN5RDB,Textile Deco Accessories - 561,,Toys & Games,EGP 10.17,,,2.0,,,,,https://m.media-amazon.com/images/I/71lZs5+qTRL._AC_UL320_.jpg,https://www.amazon.eg/dp/B08WJN5RDB,2026-03-28T13:02:09.690581
amazon,B092LLQQPK,"Deli scribe eraser h00610, black",,Toys & Games,EGP 10.49,,,2.8,,,,,https://m.media-amazon.com/images/I/61OlhsF-XQL._AC_UL320_.jpg,https://www.amazon.eg/dp/B092LLQQPK,2026-03-28T13:02:09.691102
amazon,B0DPDV64B4,Keyroad Eraser large black model KR972953,,Toys & Games,EGP 11.00,,,4.1,,,,,https://m.media-amazon.com/images/I/51G7FWHgn8L._AC_UL320_.jpg,https://www.amazon.eg/dp/B0DPDV64B4,2026-03-28T13:02:09.691639
amazon,B0FG2ZJ6HM,"M&G White Eraser, Compact Smudge-Free Precise Corrections",,Toys & Games,EGP 11.00,,,5.0,,,,,https://m.media-amazon.com/images/I/515L3HjOT6L._AC_UL320_.jpg,https://www.amazon.eg/dp/B0FG2ZJ6HM,2026-03-28T13:02:09.692157
amazon,B0719634HZ,EH02200#Eraser #50 * 20 * 11mm #ASST.,,Toys & Games,EGP 11.20,,,3.5,,,,,https://m.media-amazon.com/images/I/61jt8bKwozL._AC_UL320_.jpg,https://www.amazon.eg/dp/B0719634HZ,2026-03-28T13:02:09.692705
amazon,B087PW5486,Faber-Castell Faber Castell 181640 Ink Eraser - Blue,,Toys & Games,EGP 11.49,,,3.6,,,,,https://m.media-amazon.com/images/I/51-NA4-Wf+L._AC_UL320_.jpg,https://www.amazon.eg/dp/B087PW5486,2026-03-28T13:02:09.693236
amazon,B0FMQ5FLYZ,Keyroad Eraser Goldfish with handle multicolor model KR973125,,Toys & Games,EGP 11.50,,,3.5,,,,,https://m.media-amazon.com/images/I/518XlASw7RL._AC_UL320_.jpg,https://www.amazon.eg/dp/B0FMQ5FLYZ,2026-03-28T13:02:09.693776
amazon,B0FT3ZVS88,Stars Stickers Set A206 BSD-66-209-A210-A211-A207 Decorative Adhesive Labels for School Projects Kids Crafts and Creative Artwork Multicolor,,Toys & Games,EGP 11.90,,,5.0,,,,,https://m.media-amazon.com/images/I/710tveCbydL._AC_UL320_.jpg,https://www.amazon.eg/dp/B0FT3ZVS88,2026-03-28T13:02:09.694342
amazon,B091CFWP5Q,1pcs wall mounted broom holder kitchen bathroom wall mop holder magic sticker max loading 5kg broom mop rack,,Toys & Games,EGP 12.00,,,2.4,,,,,https://m.media-amazon.com/images/I/51HB1WZadqL._AC_UL320_.jpg,https://www.amazon.eg/dp/B091CFWP5Q,2026-03-28T13:02:09.694918
amazon,B08CS6ZMZ5,Stick'n HOPAX- 21402,,Toys & Games,EGP 12.03,,,4.3,,,,,https://m.media-amazon.com/images/I/515NSR9JzML._AC_UL320_.jpg,https://www.amazon.eg/dp/B08CS6ZMZ5,2026-03-28T13:02:09.695463
amazon,B0C1VWR22T,Folia Embossed Paper Sheet 50 × 70 cm 150 gsm pink,,Toys & Games,EGP 12.31,,,,,,,,https://m.media-amazon.com/images/I/21D79sEaqJL._AC_UL320_.jpg,https://www.amazon.eg/dp/B0C1VWR22T,2026-03-28T13:02:09.695922
amazon,B0FD94WS16,Pad Notepad 100 Sheets White,,Toys & Games,EGP 12.31,,,,,,,,https://m.media-amazon.com/images/I/31XAPGIM4UL._AC_UL320_.jpg,https://www.amazon.eg/dp/B0FD94WS16,2026-03-28T13:02:09.696357
amazon,B00V4DO26A,Deli Eraser 3045-1 Piece assorted color,,Toys & Games,EGP 12.60,,,3.7,,,,,https://m.media-amazon.com/images/I/51W0numHpNL._AC_UL320_.jpg,https://www.amazon.eg/dp/B00V4DO26A,2026-03-28T13:02:09.696879
amazon,B0B3TBNJXQ,By luck biscuits stuffed with dates,,Toys & Games,EGP 14.00,,,3.2,,,,,https://m.media-amazon.com/images/I/61rttAbA6fL._AC_UL320_.jpg,https://www.amazon.eg/dp/B0B3TBNJXQ,2026-03-28T13:02:09.697401
amazon,B0GJQ4DSGG,"Wooden Xylophone Musical Instrument Toy, Tiger Theme, Multicolor, 18x7x1 cm, Wood and Metal, 3+ Years",,Toys & Games,EGP 90.00,,,,,,,,https://m.media-amazon.com/images/I/51oCIki1KxL._AC_UL320_.jpg,https://www.amazon.eg/dp/B0GJQ4DSGG,2026-03-28T13:02:09.697942
amazon,B0GDDHD3X9,TRUE FIT®Mini robots transforming model vehicles car,,Toys & Games,EGP 438.90,,,,,,,,https://m.media-amazon.com/images/I/41RaKmbcWoL._AC_UL320_.jpg,https://www.amazon.eg/dp/B0GDDHD3X9,2026-03-28T13:02:09.698507
amazon,B08BX6BF6P,Guy Fawkes Mask -V for Vendetta， Anonymous Hacker Cosplay Party Mask （White）,,Toys & Games,EGP 90.00,EGP 95.00,,3.8,Was:,,,,https://m.media-amazon.com/images/I/519RdbRtSkL._AC_UL320_.jpg,https://www.amazon.eg/dp/B08BX6BF6P,2026-03-28T13:02:09.699295
amazon,B07N3S5WLX,Keyroad wood colors 6 color short triangle medical model kr971283,,Toys & Games,EGP 14.04,,,4.4,,,,,https://m.media-amazon.com/images/I/51lMhnIjIrL._AC_UL320_.jpg,https://www.amazon.eg/dp/B07N3S5WLX,2026-03-28T13:02:12.424226
amazon,B0BNL348JG,Prima File Red,,Toys & Games,EGP 14.19,,,4.1,,,,,https://m.media-amazon.com/images/I/31JLXCOsDwL._AC_UL320_.jpg,https://www.amazon.eg/dp/B0BNL348JG,2026-03-28T13:02:12.424808
amazon,B0DQK4FCBS,Keyroad KR971071 Flash Shape Eraser,,Toys & Games,EGP 15.00,,,,,,,,https://m.media-amazon.com/images/I/51pnbspt43L._AC_UL320_.jpg,https://www.amazon.eg/dp/B0DQK4FCBS,2026-03-28T13:02:12.425264
amazon,B096VTHN5W,"El Manar Sticker - Green, 130x155 CM",,Toys & Games,EGP 15.00,,,1.0,,,,,https://m.media-amazon.com/images/I/51BioiqoPIS._AC_UL320_.jpg,https://www.amazon.eg/dp/B096VTHN5W,2026-03-28T13:02:12.425830
amazon,B0DQLKY8RL,"M&G Eraser, 963Cy",,Toys & Games,EGP 15.00,,,,,,,,https://m.media-amazon.com/images/I/614JUY9jwmL._AC_UL320_.jpg,https://www.amazon.eg/dp/B0DQLKY8RL,2026-03-28T13:02:12.426284
amazon,B0BFZ4T127,"M&G Eraser, 96378.",,Toys & Games,EGP 15.16,,,,,,,,https://m.media-amazon.com/images/I/31WTlJxLcdL._AC_UL320_.jpg,https://www.amazon.eg/dp/B0BFZ4T127,2026-03-28T13:02:12.426754
amazon,B0DTQF8QCM,"Pop It Stress Relief Squeeze Sensory For Stress Relief, Round Shape Design - Multicolor Pop It Stress Relief",,Toys & Games,EGP 15.96,,,5.0,,,,,https://m.media-amazon.com/images/I/51q-tPauvbL._AC_UL320_.jpg,https://www.amazon.eg/dp/B0DTQF8QCM,2026-03-28T13:02:12.427287
amazon,B0FG579N3V,"Yassin Dabous Small Sketchbook, Compact Design for Creative Art and Sketches",,Toys & Games,EGP 16.00,,,4.7,,,,,https://m.media-amazon.com/images/I/81UlZodKZIL._AC_UL320_.jpg,https://www.amazon.eg/dp/B0FG579N3V,2026-03-28T13:02:12.427899
amazon,B09J1GNTCZ,100 Pcs Colorful Glow in The Dark Luminous Stars Fluorescent Noctilucent Plastic Wall Stickers Murals Decals for Home Art Decor Ceiling Wall Decorate Kids Babys Bedroom Room Decorations (Colorful),,Toys & Games,,,,3.0,,,,,https://m.media-amazon.com/images/I/61a6nI77OeL._AC_UL320_.jpg,https://www.amazon.eg/dp/B09J1GNTCZ,2026-03-28T13:02:12.428373
amazon,B0DQJSG46R,Dexa Kids Scissors plastic zigzag blade 12.5 cm assorted colors model 7001,,Toys & Games,EGP 16.00,,,5.0,,,,,https://m.media-amazon.com/images/I/61a4Bz-9z1L._AC_UL320_.jpg,https://www.amazon.eg/dp/B0DQJSG46R,2026-03-28T13:02:12.428923
amazon,B0CNLR2B9N,"100 Pcs Stars Glow in The Dark, Glowing Stars Wall Stickers, Fluorescent Resin, Decorative, Romantic, Bright, Colourful",,Toys & Games,EGP 16.00,,,3.8,,,,,https://m.media-amazon.com/images/I/61NCip5H5zL._AC_UL320_.jpg,https://www.amazon.eg/dp/B0CNLR2B9N,2026-03-28T13:02:12.429424
amazon,B09GDSNYX1,Glow In The Dark 3D Stars Wall Stickers 100Pcs Luminous Fluorescent Plastic Wall Sticker for Kids Baby Room Bedroom Ceiling Home Decor,,Toys & Games,EGP 16.00,,,3.0,,,,,https://m.media-amazon.com/images/I/51kvMt0X9bL._AC_UL320_.jpg,https://www.amazon.eg/dp/B09GDSNYX1,2026-03-28T13:02:12.429983
amazon,B0D4K7Z1GN,"Elmaayergy M-57 Scratch Sketch Suitable For classroom, Homeschooling, And Individual Study Environments",,Toys & Games,EGP 16.00,,,2.4,,,,,https://m.media-amazon.com/images/I/71UUOTu0tkL._AC_UL320_.jpg,https://www.amazon.eg/dp/B0D4K7Z1GN,2026-03-28T13:02:12.430520
amazon,B07Q86XKDX,Decdeal Baby Girl's 100Pcs 3D Stars Wall Stickers Glow In The Dark Luminous Fluorescent Plastic Wall Sticker For Kids Room Bedroom Ceiling Home Decor One Size Green,,Toys & Games,EGP 16.00,,,2.8,,,,,https://m.media-amazon.com/images/I/51uzOWNRvPL._AC_UL320_.jpg,https://www.amazon.eg/dp/B07Q86XKDX,2026-03-28T13:02:12.431028
amazon,B09KYHG8B3,M&G Eraser Classic Design Useful Kawaii Rubber - No:AXPN0763 (1pcs),,Toys & Games,EGP 16.55,,,,,,,,https://m.media-amazon.com/images/I/616pXVvl66L._AC_UL320_.jpg,https://www.amazon.eg/dp/B09KYHG8B3,2026-03-28T13:02:12.431496
amazon,B07PBCV39L,Faber-Castell Faber Castell PVC Free Eraser - Red B,,Toys & Games,EGP 16.78,,,4.5,,,,,https://m.media-amazon.com/images/I/51Uw9Jgpo+L._AC_UL320_.jpg,https://www.amazon.eg/dp/B07PBCV39L,2026-03-28T13:02:12.431999
amazon,B0DPX5GTZN,Keyroad Glitter Powder Jar 8 g Multicolor Model KR971940,,Toys & Games,EGP 17.00,,,,,,,,https://m.media-amazon.com/images/I/41yGHa1CyvL._AC_UL320_.jpg,https://www.amazon.eg/dp/B0DPX5GTZN,2026-03-28T13:02:12.432428
amazon,B0CQXT7LD8,"579 Bleached Bristle Artist Brush with Flat Wooden Handle, Size 1",,Toys & Games,EGP 17.00,,,5.0,,,,,https://m.media-amazon.com/images/I/41daib9OWvL._AC_UL320_.jpg,https://www.amazon.eg/dp/B0CQXT7LD8,2026-03-28T13:02:12.432958
amazon,B01N4KI52F,"Faber-Castell Colour Grip Triangular Colouring Pencil, Phthalo Green",,Toys & Games,EGP 17.00,,,4.5,,,,,https://m.media-amazon.com/images/I/51jJsUQbMdS._AC_UL320_.jpg,https://www.amazon.eg/dp/B01N4KI52F,2026-03-28T13:02:12.433608
amazon,B0FG32LKD2,80 Micron Quarter KMA File,,Toys & Games,EGP 17.00,,,5.0,,,,,https://m.media-amazon.com/images/I/41YjYD8DoaL._AC_UL320_.jpg,https://www.amazon.eg/dp/B0FG32LKD2,2026-03-28T13:02:12.434131
amazon,B0GSW3VRLT,"Easter Resurrection Card Assembly Set, Holy Week Theme",,Toys & Games,EGP 17.00,,,,,,,,https://m.media-amazon.com/images/I/81+X+1Qm4wL._AC_UL320_.jpg,https://www.amazon.eg/dp/B0GSW3VRLT,2026-03-28T13:02:12.434585
amazon,B0012FAEKI,"Faber-Castell 112456 ""Colour Grip Crayon, Cobalt Green",,Toys & Games,EGP 17.00,,,4.3,,,,,https://m.media-amazon.com/images/I/31BAxTvASWS._AC_UL320_.jpg,https://www.amazon.eg/dp/B0012FAEKI,2026-03-28T13:02:12.435092
amazon,B000MPP6IO,"Faber-Castell 112453 ""Colour Grip Crayon, Cobalt Turquoise",,Toys & Games,EGP 17.00,,,4.6,,,,,https://m.media-amazon.com/images/I/51832k7yJ5L._AC_UL320_.jpg,https://www.amazon.eg/dp/B000MPP6IO,2026-03-28T13:02:12.435622
amazon,B07ZG7R5LC,XAFXAH M&G Paint Brush -Art training - Size: 1 - No:ABH97886A,,Toys & Games,EGP 17.17,,,3.2,,,,,https://m.media-amazon.com/images/I/51F+lfLN+4L._AC_UL320_.jpg,https://www.amazon.eg/dp/B07ZG7R5LC,2026-03-28T13:02:12.436128
amazon,B0G1Q7995W,"Simba Model FT-160-2 Drawing Paper Sheet - 70x100 cm 150gsm Beige, Natural Tone for Realistic Portraits and Designs, Quality Finish - Beige",,Toys & Games,,,,,,,,,https://m.media-amazon.com/images/I/41j4vZPyJHL._AC_UL320_.jpg,https://www.amazon.eg/dp/B0G1Q7995W,2026-03-28T13:02:15.736316
amazon,B0FKGY4LLR,"SKAG Primo Blue Cover Exercise Book, 40 Sheets, Arabic Ruler, 17x25cm",,Toys & Games,EGP 17.34,,,,,,,,https://m.media-amazon.com/images/I/61xNtjwr5NL._AC_UL320_.jpg,https://www.amazon.eg/dp/B0FKGY4LLR,2026-03-28T13:02:15.737079
amazon,B0DYNWQ9QC,Pop It Fidget Rainbow Heart Shape - CD-03,,Toys & Games,EGP 17.74,EGP 23.00,,3.9,Was:,,,,https://m.media-amazon.com/images/I/511GQeQelvL._AC_UL320_.jpg,https://www.amazon.eg/dp/B0DYNWQ9QC,2026-03-28T13:02:15.738013
amazon,B009FEFG1K,Faber Castell 7085 Large White Eraser,,Toys & Games,EGP 18.00,,,4.4,,,,,https://m.media-amazon.com/images/I/7121h4sxxPL._AC_UL320_.jpg,https://www.amazon.eg/dp/B009FEFG1K,2026-03-28T13:02:15.738916
amazon,B0BBQPY4PM,"3D Glow in the Dark Star Stickers, 100 pcs Florescent Wall Decals, Decor Stickers for Sensory Nursery, Baby Kids Children Bedroom, Living Room Decoration",,Toys & Games,EGP 18.00,,,3.0,,,,,https://m.media-amazon.com/images/I/61zi58YNnhL._AC_UL320_.jpg,https://www.amazon.eg/dp/B0BBQPY4PM,2026-03-28T13:02:15.739752
amazon,B0FG36G7BL,"M&G Jelly Color Eraser, Vibrant Smudge-Free Pencil Corrections",,Toys & Games,EGP 18.00,,,,,,,,https://m.media-amazon.com/images/I/51+t0nqB4XL._AC_UL320_.jpg,https://www.amazon.eg/dp/B0FG36G7BL,2026-03-28T13:02:15.740465
amazon,B0CDH7SR2K,SQUINS JAR SMALL DIFFERENT SHAPES MODEL LB-510,,Toys & Games,EGP 18.25,,,,,,,,https://m.media-amazon.com/images/I/611n8lyBzpL._AC_UL320_.jpg,https://www.amazon.eg/dp/B0CDH7SR2K,2026-03-28T13:02:15.741124
amazon,B093QCHCGX,Educational flash cards farm animal for Kids,,Toys & Games,EGP 18.47,,,3.0,,,,,https://m.media-amazon.com/images/I/610FymGkBqL._AC_UL320_.jpg,https://www.amazon.eg/dp/B093QCHCGX,2026-03-28T13:02:15.742028
amazon,B093GBW7CF,Generic The inverse flash cards for unisex - multi color,,Toys & Games,EGP 18.47,,,4.4,,,,,https://m.media-amazon.com/images/I/71Ps35AYbAL._AC_UL320_.jpg,https://www.amazon.eg/dp/B093GBW7CF,2026-03-28T13:02:15.742894
amazon,B0CJYGV4ZB,"Elmaayergy 2040 Body Organ With Arabic Language On Elastic Foam Board With Durable Material, Suitable For School And Home",,Toys & Games,EGP 18.60,,,5.0,,,,,https://m.media-amazon.com/images/I/51LJnskdVPL._AC_UL320_.jpg,https://www.amazon.eg/dp/B0CJYGV4ZB,2026-03-28T13:02:15.743756
amazon,B0CDLSQBSF,Colourful Wooden Sticks NO:S-225 10CM For Endless Hours Of Entertainment - Multi Colour,,Toys & Games,EGP 18.74,,,1.8,,,,,https://m.media-amazon.com/images/I/617qnaSD8GL._AC_UL320_.jpg,https://www.amazon.eg/dp/B0CDLSQBSF,2026-03-28T13:02:15.744627
amazon,B0CSDX8RGN,"Spices, Herbs And Spices Sticker - 70 Cm - Clear",,Toys & Games,EGP 19.00,,,3.3,,,,,https://m.media-amazon.com/images/I/61CB0027wOL._AC_UL320_.jpg,https://www.amazon.eg/dp/B0CSDX8RGN,2026-03-28T13:02:15.745378
amazon,B0FG355VTM,"M&G Watercolor Round Brush, Smooth Art Painting, Synthetic Bristles, No. 3",,Toys & Games,EGP 19.00,EGP 28.00,,,Was:,,,,https://m.media-amazon.com/images/I/41ciFPaXawL._AC_UL320_.jpg,https://www.amazon.eg/dp/B0FG355VTM,2026-03-28T13:02:15.746334
amazon,B0FJFTNKPX,"SONIX Small Pond Sketchbook 18-Sheet 80g, Single Pack",,Toys & Games,EGP 19.00,,,4.7,,,,,https://m.media-amazon.com/images/I/71oFzj2PbWL._AC_UL320_.jpg,https://www.amazon.eg/dp/B0FJFTNKPX,2026-03-28T13:02:15.747166
amazon,B09J1GXMKH,WTECH 100 Pcs Colorful Glow in The Dark Luminous Stars Fluorescent Noctilucent Plastic Wall Stickers Murals Decals for Home Art Decor Ceiling Wall Decorate Kids Babys Bedroom Room Decorations (Blue),,Toys & Games,EGP 19.00,,,3.5,,,,,https://m.media-amazon.com/images/I/61mmBszu3YL._AC_UL320_.jpg,https://www.amazon.eg/dp/B09J1GXMKH,2026-03-28T13:02:15.747973
amazon,B09J1GQHD5,WTECH 100 Pcs Colorful Glow in The Dark Luminous Stars Fluorescent Noctilucent Plastic Wall Stickers Murals Decals for Home Art Decor Ceiling Wall Decorate Kids Babys Bedroom Room Decorations (Yellow),,Toys & Games,EGP 19.00,,,5.0,,,,,https://m.media-amazon.com/images/I/51+N+mfl-cS._AC_UL320_.jpg,https://www.amazon.eg/dp/B09J1GQHD5,2026-03-28T13:02:15.748769
amazon,B0FKH11ZZF,"HI TEKNO A4 Premium 80-Sheet Face and Face Ruler Exercise Book, 16x22cm, Elegant Beige",,Toys & Games,EGP 19.49,,,4.6,,,,,https://m.media-amazon.com/images/I/51kN66Y8wnL._AC_UL320_.jpg,https://www.amazon.eg/dp/B0FKH11ZZF,2026-03-28T13:02:15.749633
amazon,B0B5S4413N,Nova Turkish Poster Jar 25mm Brown,,Toys & Games,EGP 19.64,,,3.5,,,,,https://m.media-amazon.com/images/I/71zeWv3LKzL._AC_UL320_.jpg,https://www.amazon.eg/dp/B0B5S4413N,2026-03-28T13:02:15.750518
amazon,B0DHVDHKJY,Bingo Dough Can 56gm - Pink,,Toys & Games,EGP 20.00,,,4.2,,,,,https://m.media-amazon.com/images/I/51NrYRqFloL._AC_UL320_.jpg,https://www.amazon.eg/dp/B0DHVDHKJY,2026-03-28T13:02:15.751434
amazon,B0DHVDSVRV,Bingo Dough Can 56gm - Purple,,Toys & Games,EGP 20.00,,,4.5,,,,,https://m.media-amazon.com/images/I/51BvPueh4EL._AC_UL320_.jpg,https://www.amazon.eg/dp/B0DHVDSVRV,2026-03-28T13:02:15.752288
amazon,B0DHVDWKCK,Bingo Dough Can 56gm - Red,,Toys & Games,EGP 20.00,,,4.4,,,,,https://m.media-amazon.com/images/I/51fXMbB62YL._AC_UL320_.jpg,https://www.amazon.eg/dp/B0DHVDWKCK,2026-03-28T13:02:15.753108
amazon,B0CF5MPFBW,Animal Empire Ring Collection Koala – 142,,Toys & Games,EGP 20.00,,,,,,,,https://m.media-amazon.com/images/I/61Ez4xvccaL._AC_UL320_.jpg,https://www.amazon.eg/dp/B0CF5MPFBW,2026-03-28T13:02:15.753846
amazon,B0D47KF11X,"Keep Smiling A5015-2R Single Round Single Brush, Size 2",,Toys & Games,EGP 20.00,,,,,,,,https://m.media-amazon.com/images/I/41+UY8+Dt4L._AC_UL320_.jpg,https://www.amazon.eg/dp/B0D47KF11X,2026-03-28T13:02:15.754630
amazon,B0CF5QDQJS,Generic Animal Empire Ring Collection Eagle – 142,,Toys & Games,EGP 20.00,,,,,,,,https://m.media-amazon.com/images/I/61wE433vI9L._AC_UL320_.jpg,https://www.amazon.eg/dp/B0CF5QDQJS,2026-03-28T13:02:15.755355
amazon,B0FKGZBNH2,"HI TEKNO A4 Premium 80-Sheet Small Squares Ruler Exercise Book, 16x22cm, White and Pink",,Toys & Games,EGP 20.01,,,5.0,,,,,https://m.media-amazon.com/images/I/51Ahk6yGjtL._AC_UL320_.jpg,https://www.amazon.eg/dp/B0FKGZBNH2,2026-03-28T13:02:18.317032
amazon,B0FKH17H34,"HI TEKNO A4 Premium 80-Sheet Face and Face Ruler Exercise Book, 16x22cm, Vibrant Green",,Toys & Games,EGP 20.01,,,,,,,,https://m.media-amazon.com/images/I/511+EeClQKL._AC_UL320_.jpg,https://www.amazon.eg/dp/B0FKH17H34,2026-03-28T13:02:18.317532
amazon,B0BNQG6C2C,Faber-castle rubber small red,,Toys & Games,EGP 20.41,,,4.5,,,,,https://m.media-amazon.com/images/I/51U46gofzbL._AC_UL320_.jpg,https://www.amazon.eg/dp/B0BNQG6C2C,2026-03-28T13:02:18.318050
amazon,B01LXX84F1,Milan 936022 NATA Eraser - Blue,,Toys & Games,EGP 20.41,,,4.1,,,,,https://m.media-amazon.com/images/I/61m1yQOBJyL._AC_UL320_.jpg,https://www.amazon.eg/dp/B01LXX84F1,2026-03-28T13:02:18.318587
amazon,B01MT4EKWH,"Post eight phosphorous, different shapes, 3 * 3, no: a61 k3-1",,Toys & Games,EGP 20.43,,,,,,,,https://m.media-amazon.com/images/I/41LJziXIeFL._AC_UL320_.jpg,https://www.amazon.eg/dp/B01MT4EKWH,2026-03-28T13:02:18.319040
amazon,B0DQJRZ96Y,Simba EVA Foam 2mm 50×70 cm Silver,,Toys & Games,EGP 20.59,,,,,,,,https://m.media-amazon.com/images/I/21M1nwM4SmL._AC_UL320_.jpg,https://www.amazon.eg/dp/B0DQJRZ96Y,2026-03-28T13:02:18.319544
amazon,B093G29WGY,"El Manar Sticker - Yellow, 20x37 CM",,Toys & Games,EGP 20.75,,,4.6,,,,,https://m.media-amazon.com/images/I/61+n0s49dOL._AC_UL320_.jpg,https://www.amazon.eg/dp/B093G29WGY,2026-03-28T13:02:18.320109
amazon,B093G1MGPK,"El Manar Sticker - White, 38x67 CM",,Toys & Games,EGP 20.75,,,5.0,,,,,https://m.media-amazon.com/images/I/51LppLuC5pS._AC_UL320_.jpg,https://www.amazon.eg/dp/B093G1MGPK,2026-03-28T13:02:18.320638
amazon,B0CQXV259G,Yiwu 3D Decoration Co Sticker,,Toys & Games,,,,,,,,,https://m.media-amazon.com/images/I/41e+xgkIxcL._AC_UL320_.jpg,https://www.amazon.eg/dp/B0CQXV259G,2026-03-28T13:02:18.320986
amazon,B093G36P5H,Yassin Markers Colou - 6 Pcs,,Toys & Games,EGP 21.00,,,4.0,,,,,https://m.media-amazon.com/images/I/61ERBdbJK3L._AC_UL320_.jpg,https://www.amazon.eg/dp/B093G36P5H,2026-03-28T13:02:18.321501
amazon,B0FJG22B4H,"AG 508 965 Shaped Sticks Colored, Single Set",,Toys & Games,EGP 21.00,,,,,,,,https://m.media-amazon.com/images/I/81DBXcyXhaL._AC_UL320_.jpg,https://www.amazon.eg/dp/B0FJG22B4H,2026-03-28T13:02:18.321959
amazon,B07CBHWPWV,Tanex Stickers English Numbers 2 Sheets Model STC-416,,Toys & Games,EGP 21.05,,,,,,,,https://m.media-amazon.com/images/I/61vZ8PZXk2L._AC_UL320_.jpg,https://www.amazon.eg/dp/B07CBHWPWV,2026-03-28T13:02:18.322399
amazon,B0D4K6XYYQ,"Elmaayergy Educational Sheet 32 * 32 About The World Of Professions And Business in Arabic Suitable For classroom, Homeschooling, And Individual Study Environments",,Toys & Games,EGP 21.09,,,,,,,,https://m.media-amazon.com/images/I/81MLBtlJTwL._AC_UL320_.jpg,https://www.amazon.eg/dp/B0D4K6XYYQ,2026-03-28T13:02:18.322865
amazon,B0CQXTD2MF,"Yiwu Abs Shapes Sticker for Kids, 12.5 cm x 26 cm Size",,Toys & Games,EGP 21.23,,,,,,,,https://m.media-amazon.com/images/I/41EQppAnsML._AC_UL320_.jpg,https://www.amazon.eg/dp/B0CQXTD2MF,2026-03-28T13:02:18.323316
amazon,B0C4JYGJXJ,Simba wool balls 6 pcs multicolor Model F404,,Toys & Games,EGP 21.60,,,,,,,,https://m.media-amazon.com/images/I/61oKFCd9G6L._AC_UL320_.jpg,https://www.amazon.eg/dp/B0C4JYGJXJ,2026-03-28T13:02:18.323824
amazon,B093G8M9QD,Generic Marine Organisms Flash Cards For Unisex - Multi Color-multi size,,Toys & Games,EGP 21.89,,,3.3,,,,,https://m.media-amazon.com/images/I/71ZR56QYdhL._AC_UL320_.jpg,https://www.amazon.eg/dp/B093G8M9QD,2026-03-28T13:02:18.324361
amazon,B0D9FPRXVL,Pop It Fidget Rainbow Apple Shape 6100 Multicolor,,Toys & Games,EGP 22.00,,,4.5,,,,,https://m.media-amazon.com/images/I/51JgU3UcCLL._AC_UL320_.jpg,https://www.amazon.eg/dp/B0D9FPRXVL,2026-03-28T13:02:18.324907
amazon,B0FG329KYC,"M&G Watercolor Round Brush, Precise Art Painting, Synthetic Bristles, No. 6",,Toys & Games,EGP 22.00,,,4.0,,,,,https://m.media-amazon.com/images/I/41if-zx-33L._AC_UL320_.jpg,https://www.amazon.eg/dp/B0FG329KYC,2026-03-28T13:02:18.325407
amazon,B0DFVHPKYK,"Keep Smiling A0571-1 KS-16 Paint Brush, Size 1, Made With Premium Material For Durability And Long-Lasting Use - Multi Colour",,Toys & Games,EGP 22.00,,,,,,,,https://m.media-amazon.com/images/I/41uH5kI6mML._AC_UL320_.jpg,https://www.amazon.eg/dp/B0DFVHPKYK,2026-03-28T13:02:18.325892
amazon,B0DYNW63DW,Pop It Fidget Rainbow Circle Shape - CD-04,,Toys & Games,EGP 22.17,,,,,,,,https://m.media-amazon.com/images/I/61kDnhXVeiL._AC_UL320_.jpg,https://www.amazon.eg/dp/B0DYNW63DW,2026-03-28T13:02:18.326318
amazon,B0CDLRLJ2R,NO:C2 100159-C_QM-4 _114 Wooden Small Tongue Depressor Set 11.4CM For Endless Hours Of Entertainment - Multi Colour,,Toys & Games,EGP 22.39,,,2.6,,,,,https://m.media-amazon.com/images/I/51Q6Ms9kLaL._AC_UL320_.jpg,https://www.amazon.eg/dp/B0CDLRLJ2R,2026-03-28T13:02:18.326848
amazon,B00KHN5K0A,Tanex Office Sticker 8 mm 750 Labels Pack of 5 Sheets A5 Neon Orange Model OFC-127,,Toys & Games,EGP 22.40,,,3.0,,,,,https://m.media-amazon.com/images/I/51FNd-euxGS._AC_UL320_.jpg,https://www.amazon.eg/dp/B00KHN5K0A,2026-03-28T13:02:18.327358
amazon,B00LBVWRHG,Tanex Office Sticker 12 × 17 mm 280 Labels Pack of 5 Sheets A5 Neon Orange Model OFC-106,,Toys & Games,EGP 22.40,,,,,,,,https://m.media-amazon.com/images/I/71EKLjHxgGL._AC_UL320_.jpg,https://www.amazon.eg/dp/B00LBVWRHG,2026-03-28T13:02:18.327876
amazon,B0CL7HDZ3K,"Elmaayergy M-260-9 Eco-Friendly Painting Brush, Size 8, Synthetic Bristles, Watercolor or Acrylic",,Toys & Games,EGP 22.66,,,3.9,,,,,https://m.media-amazon.com/images/I/51ZHF06+4vL._AC_UL320_.jpg,https://www.amazon.eg/dp/B0CL7HDZ3K,2026-03-28T13:02:18.328376
amazon,B0CH56X142,"Mini Drawing Sketch, 12 Sheet, 130GM With Durable Material, Suitable For School And Home",,Toys & Games,EGP 22.78,,,4.0,,,,,https://m.media-amazon.com/images/I/511x1Om5nrL._AC_UL320_.jpg,https://www.amazon.eg/dp/B0CH56X142,2026-03-28T13:02:20.698992
amazon,B0CF1DLZPY,Meta Quest 3 Advanced All-In-One VR Headset | 512 GB | White,,Video Games,"EGP 33,999.00","EGP 34,999.00",,4.6,List:,,,,https://m.media-amazon.com/images/I/61FeHNhoEjL._AC_UY218_.jpg,https://www.amazon.eg/dp/B0CF1DLZPY,2026-03-28T13:08:46.415529
amazon,B09841SX92,E-train controllers for pc,,Video Games,EGP 320.00,,,3.2,,,,,https://m.media-amazon.com/images/I/514XT-rLgFL._AC_UY218_.jpg,https://www.amazon.eg/dp/B09841SX92,2026-03-28T13:08:46.416094
amazon,B08LKQ5L9L,TNP Products Controller Case for PS5 Silicone Controller Skin for Dualsense Cover + 8 Pro Thumb Grips Set Sony Playstation 5 Skins Accessories Camo Red with Ergonomic Textured Grip,,Video Games,EGP 269.10,EGP 299.00,,4.4,Was:,,,,https://m.media-amazon.com/images/I/61+d5jemFZL._AC_UY218_.jpg,https://www.amazon.eg/dp/B08LKQ5L9L,2026-03-28T13:08:46.416761
