platform,asin,title,brand,category,current_price,original_price,discount,rating,reviews_count,prime_eligible,amazon_choice,sponsored,main_image,product_url,scraped_at
amazon,B08X5Y1X2Q,Five Fives IShave Mint Shaving Cream for Men - 90 gm,,Cat2322031,EGP 35.00,,,4.2,,,,,https://m.media-amazon.com/images/I/61sEozwMsSL._AC_UL320_.jpg,https://www.amazon.eg/dp/B08X5Y1X2Q,2026-03-28T13:02:59.538323
amazon,B0F9X58Y9Z,"Lord Horus 5 Blade Razor Refills – 4 Cartridges for Smooth, Close Shave",,Cat2322031,EGP 350.00,EGP 500.00,,4.0,List:,,,,https://m.media-amazon.com/images/I/51q+gxuxFVL._AC_UL320_.jpg,https://www.amazon.eg/dp/B0F9X58Y9Z,2026-03-28T13:02:59.538901
amazon,B082MNX3GZ,Gillette SkinGuard Sensitive Razor Handle with 2 Blade,,Cat2322031,EGP 514.00,EGP 540.00,,4.5,List:,,,,https://m.media-amazon.com/images/I/61U2f+WMYoL._AC_UL320_.jpg,https://www.amazon.eg/dp/B082MNX3GZ,2026-03-28T13:02:59.539455
amazon,B082MPCSFY,"Gillette SkinGuard Sensitive Blades Refills, 2 Bladed, 8 Count",,Cat2322031,"EGP 1,200.00","EGP 1,300.00",,4.5,List:,,,,https://m.media-amazon.com/images/I/81K+-F4vGaL._AC_UL320_.jpg,https://www.amazon.eg/dp/B082MPCSFY,2026-03-28T13:02:59.540019
amazon,B08XZJH5TY,"Eyebrow Hair Remover, RayMiruy USB Rechargeable 2021 Newest Waterproof Eyebrow Razor Hair Remover Nose Trimmer, Eyebrow Razor Tool, for Face Lips Nose Facial Hair Removal for Men Women.",,Cat2322031,EGP 125.63,,,3.6,,,,,https://m.media-amazon.com/images/I/416ASIpVvSL._AC_UL320_.jpg,https://www.amazon.eg/dp/B08XZJH5TY,2026-03-28T13:02:59.540475
amazon,B07NPLJ42V,Lord Disposable Razor Twin Blades With Lubricating Strip 10+4 Razors,,Cat2322031,EGP 75.00,,,3.8,,,,,https://m.media-amazon.com/images/I/51bO-YeolTL._AC_UL320_.jpg,https://www.amazon.eg/dp/B07NPLJ42V,2026-03-28T13:02:59.540941
amazon,B09LYY6Q6Z,"Gillette Refreshing Breeze, After Shave Splash, 100ml",,Cat2322031,EGP 349.00,,,4.3,,,,,https://m.media-amazon.com/images/I/81s5G0W4n9L._AC_UL320_.jpg,https://www.amazon.eg/dp/B09LYY6Q6Z,2026-03-28T13:02:59.541434
amazon,B098TY7N7N,VGR Men's USB Charging Washable Hair Trimmer (V-055),,Cat2322031,EGP 354.80,,,4.1,,,,,https://m.media-amazon.com/images/I/61dVa2l89pL._AC_UL320_.jpg,https://www.amazon.eg/dp/B098TY7N7N,2026-03-28T13:02:59.541942
amazon,B09VKWTPC6,VGR V-033 Electric Hair Trimmer Hair Clippers,,Cat2322031,EGP 532.80,,,4.3,,,,,https://m.media-amazon.com/images/I/51OptEDEsUL._AC_UL320_.jpg,https://www.amazon.eg/dp/B09VKWTPC6,2026-03-28T13:02:59.542410
amazon,B0B3Y5NRW6,VGR V-323 Professional Men's Shaver | Cordless Rechargeable IPX6 Fully Waterproof Triple Rotary Head Electric Shaver Runtime 60 minutes | Electric Shaver for Men’s,,Cat2322031,EGP 749.00,,,3.8,,,,,https://m.media-amazon.com/images/I/71VcxEsY7zL._AC_UL320_.jpg,https://www.amazon.eg/dp/B0B3Y5NRW6,2026-03-28T13:02:59.542865
amazon,B0CFM6NXKK,"THE PACK Electric Razor for Men, 5 in 1 | Amazing.EGP | Rechargeable Wet & Dry Rotary Shaver | | Cordless Grooming Kit with Beard, Nose, Ear, Body, Facial Cleansing Brush",,Cat2322031,EGP 890.00,"EGP 1,468.00",,2.2,List:,,,,https://m.media-amazon.com/images/I/71LcxICQM0L._AC_UL320_.jpg,https://www.amazon.eg/dp/B0CFM6NXKK,2026-03-28T13:02:59.543470
amazon,B0DGLRRNJV,"Generic V-083 Professional Hair Clipper, Cordless Rechargeable, Sharp Stainless Steel Blades, Multi-Length Attachments, Men's Grooming Trimmer",,Cat2322031,EGP 650.00,,,,,,,,https://m.media-amazon.com/images/I/41RC9iGG8wL._AC_UL320_.jpg,https://www.amazon.eg/dp/B0DGLRRNJV,2026-03-28T13:02:59.543936
amazon,B0FVYFR8BG,"Hair Shaver, Hair Clipper For Men Rechargeable Beard Trimmer With Precision Blades USB Charging 200 Min Runtime Turbo Function Low Noise Grooming Kit With 3 Comb Attachments V-963",,Cat2322031,"EGP 1,200.00",,,,,,,,https://m.media-amazon.com/images/I/514ROJuwgOL._AC_UL320_.jpg,https://www.amazon.eg/dp/B0FVYFR8BG,2026-03-28T13:02:59.544403
amazon,B0GHLLS159,Beard Comb All In One Styling Tool With Shaving Stencil Set For Chin Beard Neck Line Precision Shaping Grooming Guide Easy Beard Styling Control,,Cat2322031,EGP 119.00,,,,,,,,https://m.media-amazon.com/images/I/51TvZOf2iLL._AC_UL320_.jpg,https://www.amazon.eg/dp/B0GHLLS159,2026-03-28T13:02:59.544858
amazon,B09J32SX5Q,DORCO PACE 6 PRO - SYSTEM CARTRIDGE - 4PCS,,Cat2322031,EGP 349.00,,,4.2,,,,,https://m.media-amazon.com/images/I/71QHjcN3sEL._AC_UL320_.jpg,https://www.amazon.eg/dp/B09J32SX5Q,2026-03-28T13:02:59.545319
amazon,B0BZQTSBWZ,"Philips Norelco OneBlade 360 Face Hybrid Trimmer and Shaver, Frustration Free Packaging, QP2724/90",,Cat2322031,"EGP 2,437.45",,,4.4,,,,,https://m.media-amazon.com/images/I/71GIIOqNSYL._AC_UL320_.jpg,https://www.amazon.eg/dp/B0BZQTSBWZ,2026-03-28T13:02:59.545769
amazon,B09GYH9W5D,"Ckeyin Rechargeable Eyebrow Hair Remover USB Rechargeable 2 in 1 Painless-Precision Eyebrow Trimmer Eyebrow Razor Tool with Built-in LED Light Facial Trimmer for Nose, Lips,Body",,Cat2322031,EGP 186.11,,,3.0,,,,,https://m.media-amazon.com/images/I/81qT9spFpwL._AC_UL320_.jpg,https://www.amazon.eg/dp/B09GYH9W5D,2026-03-28T13:02:59.546299
amazon,B098VYCMW9,"Kemei KM-690 5in1 Professional Hair trimmer, Beard Shaver & Nose Trimmer",,Cat2322031,EGP 750.00,EGP 871.82,,4.0,List:,,,,https://m.media-amazon.com/images/I/51AXrf6c3HL._AC_UL320_.jpg,https://www.amazon.eg/dp/B098VYCMW9,2026-03-28T13:02:59.546826
amazon,B0DWFWHJLD,Lord New Shaving Foam for Men 200 ml,,Cat2322031,EGP 230.00,,,4.6,,,,,https://m.media-amazon.com/images/I/410MaQsUNyL._AC_UL320_.jpg,https://www.amazon.eg/dp/B0DWFWHJLD,2026-03-28T13:02:59.547306
amazon,B0CWW5SMQ5,Mr. Beard Full Grooming Kit Including Brush,,Cat2322031,"EGP 1,395.00",,,4.4,,,,,https://m.media-amazon.com/images/I/61PeYc06qxL._AC_UL320_.jpg,https://www.amazon.eg/dp/B0CWW5SMQ5,2026-03-28T13:02:59.547756
amazon,B0CG26X7SX,"Braun 9-in-1 Style Kit 5 MGK5420 Beard, Body, Ear & Nose. With 100-min Runtime, Pouch - Black/Grey",,Cat2322031,"EGP 3,724.55","EGP 4,431.00",,4.2,List:,,,,https://m.media-amazon.com/images/I/91bEjKX8aHL._AC_UL320_.jpg,https://www.amazon.eg/dp/B0CG26X7SX,2026-03-28T13:02:59.548297
amazon,B098W13Z2B,Kemei 5558 Dry For Men - Clipper & Trimmer,,Cat2322031,EGP 384.93,,,3.9,,,,,https://m.media-amazon.com/images/I/71m1wf3FQcL._AC_UL320_.jpg,https://www.amazon.eg/dp/B098W13Z2B,2026-03-28T13:02:59.548803
amazon,B08X6257LQ,KEMEI KM850 Electric Shaver For Men - Silver,,Cat2322031,EGP 529.98,,,3.6,,,,,https://m.media-amazon.com/images/I/61IJEiTUpBL._AC_UL320_.jpg,https://www.amazon.eg/dp/B08X6257LQ,2026-03-28T13:02:59.549316
amazon,B09GKYGZ4L,Braun Series X XT10 Replacement Blade for Braun Series X – XT5 – XT3 – Black,,Cat2322031,EGP 599.00,,,4.3,,,,,https://m.media-amazon.com/images/I/61faVNZSLBL._AC_UL320_.jpg,https://www.amazon.eg/dp/B09GKYGZ4L,2026-03-28T13:02:59.549775
amazon,B08L5ZDTGM,Gillette Mach3 Turbo 3D Blade Refills – Pack of 2,,Cat2322031,EGP 260.00,EGP 286.00,,4.3,List:,,,,https://m.media-amazon.com/images/I/81VILCvK48L._AC_UL320_.jpg,https://www.amazon.eg/dp/B08L5ZDTGM,2026-03-28T13:02:59.550310
amazon,B0DJMPR78H,DORCO PACE 2 PLUS 5+1 (Premium),,Cat2322031,EGP 52.00,,,3.7,,,,,https://m.media-amazon.com/images/I/71F7HgWuScL._AC_UL320_.jpg,https://www.amazon.eg/dp/B0DJMPR78H,2026-03-28T13:02:59.550762
amazon,B0DN23S936,"Aluminum Rechargeable Electric Razor for Men - Quick Charge, Continuous Shaving, and Super Hard Titanium Alloy Plating Foil for a Comfortable Grooming Experience, Beard Trimmer, 3W (Gold)",,Cat2322031,EGP 315.35,,,4.5,,,,,https://m.media-amazon.com/images/I/51IbFejJyWL._AC_UL320_.jpg,https://www.amazon.eg/dp/B0DN23S936,2026-03-28T13:02:59.551222
amazon,B0F64HJG8X,"Hair Shaver, Hair Trimmer for Men, 180 Min Runtime, Precision Blade, LED Display, USB Charging cable 3 Guide Combs for men, Modern Design, V-228",,Cat2322031,EGP 587.35,EGP 606.50,,2.5,List:,,,,https://m.media-amazon.com/images/I/61JDciR21aL._AC_UL320_.jpg,https://www.amazon.eg/dp/B0F64HJG8X,2026-03-28T13:02:59.551787
amazon,B0D18VHGQL,VGR 3-in-1 Nose and Ear Hair Trimmer for Men - Eyebrow Body Razor and Beard Trimming Attachment - Cordless Rechargeable 120 mins Battery - Painless Nostril Nasal Remover,,Cat2322031,EGP 460.00,EGP 519.00,,3.5,List:,,,,https://m.media-amazon.com/images/I/8184MqbGUUL._AC_UL320_.jpg,https://www.amazon.eg/dp/B0D18VHGQL,2026-03-28T13:02:59.552368
amazon,B0C99TYR8G,"Yandou Aluminum Rechargeable Electric Razor for Men - Quick Charge, Continuous Shaving, and Super Hard Titanium Alloy Plating Foil for a Comfortable Grooming Experience, Beard Trimmer, 3W (Silver)",,Cat2322031,EGP 275.00,,,3.5,,,,,https://m.media-amazon.com/images/I/61C0h-ehWBL._AC_UL320_.jpg,https://www.amazon.eg/dp/B0C99TYR8G,2026-03-28T13:02:59.552866
amazon,B0C8DYY1JT,VGR V-962 hair shaver Rechargeable Hair Cutting Machine-hair shaver and trimming beard,,Cat2322031,EGP 595.00,,,4.3,,,,,https://m.media-amazon.com/images/I/718TCoMwb3L._AC_UL320_.jpg,https://www.amazon.eg/dp/B0C8DYY1JT,2026-03-28T13:02:59.553332
amazon,B0CRB5WYCF,VGR V-989 Professional Hair Clipper Corded & Cordless with LED Display & Turbo Mode Function | Runtime: 180 min Trimmer for Men -1 year warranty (Black/Gold),,Cat2322031,EGP 590.00,EGP 650.00,,4.2,List:,,,,https://m.media-amazon.com/images/I/61o+97-UJvL._AC_UL320_.jpg,https://www.amazon.eg/dp/B0CRB5WYCF,2026-03-28T13:02:59.554382
amazon,B07PLZ7JCY,"Gillette Blue3 Simple Disposable Razor for Men, Up To 20 Clean Shaves Per Pack - 4 Pieces",,Cat2322031,EGP 177.00,EGP 187.00,,4.2,List:,,,,https://m.media-amazon.com/images/I/712S8nwOJpL._AC_UL320_.jpg,https://www.amazon.eg/dp/B07PLZ7JCY,2026-03-28T13:02:59.554909
amazon,B0FHJMMS3F,SHAVECODE Shaving Foam - All Skin Types (Charcoal) 200ml,,Cat2322031,EGP 145.00,,,,,,,,https://m.media-amazon.com/images/I/41NsG1nBJlL._AC_UL320_.jpg,https://www.amazon.eg/dp/B0FHJMMS3F,2026-03-28T13:02:59.555309
amazon,B07LBNMZS7,Kemei KM-5021 3 In 1 Rechargeable Trimmer & Clipper,,Cat2322031,EGP 375.00,EGP 440.00,,4.1,List:,,,,https://m.media-amazon.com/images/I/61ovVYl4m6L._AC_UL320_.jpg,https://www.amazon.eg/dp/B07LBNMZS7,2026-03-28T13:02:59.555841
amazon,B0922YTLT6,VGR V - 085 Electric shaving machine,,Cat2322031,EGP 524.00,EGP 557.75,,4.3,List:,,,,https://m.media-amazon.com/images/I/61ab+w1-9VL._AC_UL320_.jpg,https://www.amazon.eg/dp/B0922YTLT6,2026-03-28T13:02:59.556377
amazon,B08WJNM6XG,Roofa Spain Hiar Scissor stainless steel - Silver -005SC,,Cat2322031,EGP 368.45,,,3.8,,,,,https://m.media-amazon.com/images/I/51oZzV6+2pL._AC_UL320_.jpg,https://www.amazon.eg/dp/B08WJNM6XG,2026-03-28T13:02:59.556826
amazon,B09FHS6JTM,KEMEI Electric shaving machine for men - charging - dry shaving,,Cat2322031,EGP 621.43,EGP 649.00,,4.0,List:,,,,https://m.media-amazon.com/images/I/51yPaM3vCvL._AC_UL320_.jpg,https://www.amazon.eg/dp/B09FHS6JTM,2026-03-28T13:02:59.557405
amazon,B08WJNCXBK,VGR Electric Shave Machine For Men v-055,,Cat2322031,EGP 332.23,,,4.2,,,,,https://m.media-amazon.com/images/I/71Ubs22G+4L._AC_UL320_.jpg,https://www.amazon.eg/dp/B08WJNCXBK,2026-03-28T13:02:59.557916
amazon,B0DQWLLMBS,"Braun All-in-One Series 3 8-in-1 Grooming Kit, Ultra Sharp Blade, 14 Lengths AIO3540, Grey",,Cat2322031,"EGP 2,699.00","EGP 2,999.00",,3.9,List:,,,,https://m.media-amazon.com/images/I/71tbpkZFWGL._AC_UL320_.jpg,https://www.amazon.eg/dp/B0DQWLLMBS,2026-03-28T13:02:59.558436
amazon,B09V5LC6BT,"VGR V-932 Professional Rechargeable Corded & Cordless Pocket Hair Trimmer for Men’s Runtime: 120 Minutes, Black",,Cat2322031,EGP 430.00,EGP 455.00,,4.0,List:,,,,https://m.media-amazon.com/images/I/61dWq4QJW2L._AC_UL320_.jpg,https://www.amazon.eg/dp/B09V5LC6BT,2026-03-28T13:02:59.558974
amazon,B0D151SSDW,The Hair Addict Beard Oil Recipe,,Cat2322031,EGP 170.00,,,4.0,,,,,https://m.media-amazon.com/images/I/510Cc-L98PL._AC_UL320_.jpg,https://www.amazon.eg/dp/B0D151SSDW,2026-03-28T13:02:59.559435
amazon,B0D46G7F32,Kemei KM-2269,,Cat2332031,EGP 747.27,,,4.4,,,,,https://m.media-amazon.com/images/I/71ENlGQuojL._AC_UL320_.jpg,https://www.amazon.eg/dp/B0D46G7F32,2026-03-28T13:06:28.992744
amazon,B00V7RTULU,"Philips BikiniGenie BRT383/15 - Handy Bikini Trimmer for T, Shaving and Styling The Bikini Zone with Comb attachments and Shaving Heads - for Effortless Hair Removal",,Cat2332031,"EGP 2,099.00",,,4.2,,,,,https://m.media-amazon.com/images/I/31a-xAj8S8L._AC_UL320_.jpg,https://www.amazon.eg/dp/B00V7RTULU,2026-03-28T13:06:28.993333
amazon,B0C6ZV3CP1,Mini Hair Straightener for Women 2-in-1 Portable Hair Curlers Suitable for Women Short Hair Bangs Beard (Purple),,Cat2332031,EGP 90.00,,,2.1,,,,,https://m.media-amazon.com/images/I/51sV0En08oL._AC_UL320_.jpg,https://www.amazon.eg/dp/B0C6ZV3CP1,2026-03-28T13:06:28.993895
amazon,B0B2DN85RB,VGR V-212 Professional Hair Clipper | Rechargeable | For Men,,Cat2332031,EGP 392.76,,,4.1,,,,,https://m.media-amazon.com/images/I/51Po34XUW4L._AC_UL320_.jpg,https://www.amazon.eg/dp/B0B2DN85RB,2026-03-28T13:06:28.994494
amazon,B09H51PKTQ,Moser electric shaver 1400,,Cat2332031,"EGP 1,300.00","EGP 1,590.00",,3.2,List:,,,,https://m.media-amazon.com/images/I/61qM3z110ZL._AC_UL320_.jpg,https://www.amazon.eg/dp/B09H51PKTQ,2026-03-28T13:06:28.995160
amazon,B0B6WQCVDS,"Spring Facial Hair Remover, Threading Hair Removal Manual Face Epilator Coil Hair Removal Portable Handheld Stainless Steel with Handle for Women Removing Chin Cheek Mustache Upper Lip Neck Sideburns",,Cat2332031,EGP 84.60,,,3.5,,,,,https://m.media-amazon.com/images/I/51PVJ-AddFL._AC_UL320_.jpg,https://www.amazon.eg/dp/B0B6WQCVDS,2026-03-28T13:06:28.995785
amazon,B087F3DKJK,Men's Beard Brush with Wooden Handle Firm Bristles for Taming & Softening Facial Hair Skin Care & Beard Grooming Palm Size,,Cat2332031,EGP 225.00,EGP 250.00,,4.1,Was:,,,,https://m.media-amazon.com/images/I/71PWURSmt-L._AC_UL320_.jpg,https://www.amazon.eg/dp/B087F3DKJK,2026-03-28T13:06:28.996439
amazon,B0FM3NWS53,"VGR 344 Mini Portable Electric Shaver for Men, Men's Travel Razor with Dual Magnetic Swivel Head, Comes with Storage Bag, Waterproof IPx6, USB Charging, Green",,Cat2332031,EGP 975.00,,,4.1,,,,,https://m.media-amazon.com/images/I/71xCdZJFScL._AC_UL320_.jpg,https://www.amazon.eg/dp/B0FM3NWS53,2026-03-28T13:06:28.996962
amazon,B07P61JN14,Flawless Women's Rotary Shaver (101),,Cat2332031,EGP 480.00,,,3.0,,,,,https://m.media-amazon.com/images/I/61c1-Dnp9QL._AC_UL320_.jpg,https://www.amazon.eg/dp/B07P61JN14,2026-03-28T13:06:28.997507
amazon,B0CNVS1J41,"Vgr 003 Fresh Fade Hair Clipper, Professional Hair Trimmer, Cord/Cordless Rechargeable Hair Cutting Tools With Led Display",,Cat2332031,"EGP 1,678.12","EGP 1,825.00",,4.5,List:,,,,https://m.media-amazon.com/images/I/71wkBgXCM-L._AC_UL320_.jpg,https://www.amazon.eg/dp/B0CNVS1J41,2026-03-28T13:06:28.998751
amazon,B07W863RWR,BABYLISS ST397E,,Cat2332031,"EGP 2,349.00",,,4.3,,,,,https://m.media-amazon.com/images/I/61fdlGLaGaL._AC_UL320_.jpg,https://www.amazon.eg/dp/B07W863RWR,2026-03-28T13:06:28.999255
amazon,B0DJSVVBJM,"Auto Waver Hair Curler, Auto Curler Easy, fast and effortless, Titanium barrel for longer lasting curls, heat settings up to 230C, Negative ions.",,Cat2332031,"EGP 2,599.00",,,,,,,,https://m.media-amazon.com/images/I/61YvrS6tO6L._AC_UL320_.jpg,https://www.amazon.eg/dp/B0DJSVVBJM,2026-03-28T13:06:28.999763
amazon,B0CF2JB45B,"VGR V-150 Baby Hair Clippers, Ceramic Blade Electric Kids Infant and Toddler Hair Trimmer, Ultra-Quiet Cordless Rechargeable Waterproof Haircut Kit for Kids Green",,Cat2332031,EGP 449.00,,,4.2,,,,,https://m.media-amazon.com/images/I/61oW618zmML._AC_UL320_.jpg,https://www.amazon.eg/dp/B0CF2JB45B,2026-03-28T13:06:29.000287
amazon,B0FQX2458B,"Lexical LAS-5203 4 in 1 Rotating Hair Styler, 1200W, 20,000 Turns, Golden Black",,Cat2332031,"EGP 1,200.00",,,3.7,,,,,https://m.media-amazon.com/images/I/517uS5JcpsL._AC_UL320_.jpg,https://www.amazon.eg/dp/B0FQX2458B,2026-03-28T13:06:29.000816
amazon,B07HG3Y6VT,"Panasonic EH-KE46 Hair Styler 4-in-1, Ionity Blow Brush",,Cat2332031,"EGP 2,699.00",,,3.6,,,,,https://m.media-amazon.com/images/I/61iSKEhwTNS._AC_UL320_.jpg,https://www.amazon.eg/dp/B07HG3Y6VT,2026-03-28T13:06:29.001322
amazon,B0F4R6DWD2,"VGR 706 Professional Epilator for Women, Portable Wireless Hair Removal Device with Smooth Gliding Mechanism for Legs, Armpits, Back, Full Body Epilator with 18 Tweezers System",,Cat2332031,EGP 480.00,,,3.7,,,,,https://m.media-amazon.com/images/I/71yshE6SJuL._AC_UL320_.jpg,https://www.amazon.eg/dp/B0F4R6DWD2,2026-03-28T13:06:29.001874
amazon,B0FWZVMLGL,"Beard Shaver Electric Rotary Shaver 3-Head with LCD Power Display IPX7 Waterproof Wet Dry Rechargeable Portable for Face and Beard Men, HG-2024",,Cat2332031,EGP 570.00,,,4.0,,,,,https://m.media-amazon.com/images/I/41Yv84kTwxL._AC_UL320_.jpg,https://www.amazon.eg/dp/B0FWZVMLGL,2026-03-28T13:06:29.002419
amazon,B0DM25V6SY,"Hot Air brush Pro 2x1, for Drying Straightening Volumizing Hair, Create styles full of shine and health,Fit All Hair Types, 3 Heat Levels, 1000W",,Cat2332031,"EGP 3,499.00",,,5.0,,,,,https://m.media-amazon.com/images/I/71mccCPlyoL._AC_UL320_.jpg,https://www.amazon.eg/dp/B0DM25V6SY,2026-03-28T13:06:29.002936
amazon,B0CP99ZG61,"IPL Hair Removal, Laser Hair Remover with 5 Energy Levels Permanent Painless and Effective Hair Removal for Body Bikini and FacePermanent Painless Hair Removal Device for Men Women(White)",,Cat2332031,"EGP 1,580.00",,,1.0,,,,,https://m.media-amazon.com/images/I/61uAP-SIuYL._AC_UL320_.jpg,https://www.amazon.eg/dp/B0CP99ZG61,2026-03-28T13:06:29.003520
amazon,B0C289HC3M,Philips S5887/10 Series 5000 Wet & Dry Razor,,Cat2332031,"EGP 4,637.00",,,4.4,,,,,https://m.media-amazon.com/images/I/81tBTVDXRrL._AC_UL320_.jpg,https://www.amazon.eg/dp/B0C289HC3M,2026-03-28T13:06:29.004048
amazon,B0B9W5TNN1,4 Combs 3 6 9 & 12 Steel Zipper Hair and Beard Grading Fits All Men's Razor,,Cat2332031,EGP 129.00,,,3.6,,,,,https://m.media-amazon.com/images/I/71ymWiyPYWL._AC_UL320_.jpg,https://www.amazon.eg/dp/B0B9W5TNN1,2026-03-28T13:06:29.004598
amazon,B0BF8JDQPS,Rush Brush X2 Infra Revolver with Ionic Technology -Purple,,Cat2332031,"EGP 2,321.56","EGP 3,299.00",,4.0,List:,,,,https://m.media-amazon.com/images/I/61UI++YU1HL._AC_UL320_.jpg,https://www.amazon.eg/dp/B0BF8JDQPS,2026-03-28T13:06:29.005234
amazon,B0CBXL2F5C,VGR V-318 Premium Cordless Rechargeable IPX6 Waterproof 3 Head Electric Shaver Wet & Dry Rotary Shavers for Men with Pop-up Trimmer Super with LED Digital Display,,Cat2332031,EGP 625.00,EGP 750.00,,3.2,List:,,,,https://m.media-amazon.com/images/I/61SA341cwmL._AC_UL320_.jpg,https://www.amazon.eg/dp/B0CBXL2F5C,2026-03-28T13:06:29.006530
amazon,B0BV6G93DG,"KEMEI 1949 Trimmer Professional Hair Clippers for Men Zero Gap Electric Cordless Beard/Hair Trimmer Rechargeable T-Blade Haircut Machine for Stylists and Barbers Grooming Kit, Silver",,Cat2332031,EGP 839.00,,,4.3,,,,,https://m.media-amazon.com/images/I/71wuRvxTJoL._AC_UL320_.jpg,https://www.amazon.eg/dp/B0BV6G93DG,2026-03-28T13:06:29.007082
amazon,B0D8PQTBSV,"2 Pcs Best Universal Manual Nose Hair Trimmer for Men and Women - Painless Nasal and Ear Hair Remover, Small Trimmer for Men, Ear Cutter Knife, Trimmers Clipper",,Cat2332031,EGP 70.00,EGP 93.00,,3.8,Was:,,,,https://m.media-amazon.com/images/I/51qmpCv9nPL._AC_UL320_.jpg,https://www.amazon.eg/dp/B0D8PQTBSV,2026-03-28T13:06:29.007725
amazon,B07Q3LQJL8,Kemei KM-6558 Professional Multi Usage Hair Clipper For Men,,Cat2332031,,,,3.9,,,,,https://m.media-amazon.com/images/I/61WeAI4Pd4L._AC_UL320_.jpg,https://www.amazon.eg/dp/B07Q3LQJL8,2026-03-28T13:06:29.008472
amazon,B0DDR4XP3W,"Hair Diffuser Attachment for Hair Dryer with 1.65-inch to 2.05-inch, Professional Hair Dryer Diffuser for Curly Hair, Lightweight (Black)",,Cat2332031,EGP 199.99,,,3.7,,,,,https://m.media-amazon.com/images/I/61xPKiscrSL._AC_UL320_.jpg,https://www.amazon.eg/dp/B0DDR4XP3W,2026-03-28T13:06:29.008997
amazon,B0CH8471YD,Shaver Oil - Spray Bottle for Easy Lubrication and Leaking Problems - Pure White Mineral Oil - 60ml,,Cat2332031,EGP 89.00,,,4.2,,,,,https://m.media-amazon.com/images/I/51VHmbN3GPL._AC_UL320_.jpg,https://www.amazon.eg/dp/B0CH8471YD,2026-03-28T13:06:29.009535
amazon,B077QYPHPW,"Babyliss 2 in 1 Wet and Dry Hair Curler & Straightener, Black - ST330E",,Cat2332031,"EGP 3,199.00",,,4.4,,,,,https://m.media-amazon.com/images/I/61RMgsEYdyL._AC_UL320_.jpg,https://www.amazon.eg/dp/B077QYPHPW,2026-03-28T13:06:29.010050
amazon,B0BQ7BPMJ5,VGR V-290 Professional Hair Clipper with LED Display Runtime: 120 min Trimmer for Men (Gold),,Cat2332031,EGP 419.00,,,4.5,,,,,https://m.media-amazon.com/images/I/510UwZno7+L._AC_UL320_.jpg,https://www.amazon.eg/dp/B0BQ7BPMJ5,2026-03-28T13:06:29.010592
amazon,B0C81LTWJY,"Panasonic EH-HV11-P615 Hair Straightener with Ceramic Plates, 200°C Professional Temperature, Lightweight Design for Smooth Styling",,Cat2332031,"EGP 1,042.65",,,3.7,,,,,https://m.media-amazon.com/images/I/31q98YxAiBL._AC_UL320_.jpg,https://www.amazon.eg/dp/B0C81LTWJY,2026-03-28T13:06:29.011112
amazon,B0DHW1V8CC,Electric Hair Dryer 3 in 1 Imported Heavy Duty 2 Air Speed 2 Heat Speed with 1 Nozzle and Long Styling Comb,,Cat2332031,EGP 379.00,EGP 399.00,,4.0,List:,,,,https://m.media-amazon.com/images/I/618TLww28oL._AC_UL320_.jpg,https://www.amazon.eg/dp/B0DHW1V8CC,2026-03-28T13:06:29.011734
amazon,B0FMXY5YY9,Philips Beard Trimmer 5000 BT5780/15,,Cat2332031,"EGP 3,395.00",,,5.0,,,,,https://m.media-amazon.com/images/I/71TXpRhlV9L._AC_UL320_.jpg,https://www.amazon.eg/dp/B0FMXY5YY9,2026-03-28T13:06:29.012237
amazon,B0DHVXQCJ9,فرشاة فرد الشعر الحراية - مشط حرارى 1080F درجه - لفرد جميع انواع الشعر,,Cat2332031,EGP 399.00,,,3.1,,,,,https://m.media-amazon.com/images/I/71awxKaPr+L._AC_UL320_.jpg,https://www.amazon.eg/dp/B0DHVXQCJ9,2026-03-28T13:06:29.012794
amazon,B09H643VX7,Salon Pt-v3-4in1 Hair Dryer - 5000,,Cat2332031,EGP 449.00,,,3.7,,,,,https://m.media-amazon.com/images/I/61+aBVQgTQL._AC_UL320_.jpg,https://www.amazon.eg/dp/B09H643VX7,2026-03-28T13:06:29.013300
amazon,B004QO97PA,"Philips Tt2000/43 Replacement Shaving Head For Bodygroom Electric Shavers – Compatible With Series S3000, S5000, S7000 Models, Waterproof – Easy Rinse & Replacement Foil For Smooth Shaving – Tt2000/43",,Cat2332031,"EGP 1,225.00","EGP 1,425.00",,4.6,Was:,,,,https://m.media-amazon.com/images/I/71dA6GhHBOL._AC_UL320_.jpg,https://www.amazon.eg/dp/B004QO97PA,2026-03-28T13:06:29.013931
amazon,B0BFXKV82T,BR-2288 Hair Dryer 3000W -Red,,Cat2332031,,,,3.2,,,,,https://m.media-amazon.com/images/I/41aKA7lSfyL._AC_UL320_.jpg,https://www.amazon.eg/dp/B0BFXKV82T,2026-03-28T13:06:29.014437
amazon,B0CRZDH31K,"Anzo Premium and Durable Electric Hair Dryer for Home, Bathroom, Salon - Wall Mounted - 3000W (White)",,Cat2332031,EGP 949.00,"EGP 1,000.00",,5.0,Was:,,,,https://m.media-amazon.com/images/I/615Lo9EiUZL._AC_UL320_.jpg,https://www.amazon.eg/dp/B0CRZDH31K,2026-03-28T13:06:29.015047
amazon,B0DYZYYZDV,"MLAY T14 IPL Hair Removal Device, Hair Remover With Ice Cooling, 500000 Flashes, 5 Energy Levels, Permanent Painless Epilator For Face Back Leg Arm Armpit Bikini Line Black (1*HR Lamp)",,Cat2332031,"EGP 7,999.00","EGP 9,500.00",,5.0,List:,,,,https://m.media-amazon.com/images/I/21wPT8I+e4L._AC_UL320_.jpg,https://www.amazon.eg/dp/B0DYZYYZDV,2026-03-28T13:06:29.015675
amazon,B0F8BV4GGN,"Sokany SK-1925 Hair Straightener, Pink",,Cat2332031,EGP 428.53,,,3.2,,,,,https://m.media-amazon.com/images/I/31ugyQe9kIL._AC_UL320_.jpg,https://www.amazon.eg/dp/B0F8BV4GGN,2026-03-28T13:06:29.016224
amazon,B07MB2P8G1,Philips StyleCare Heated Straightening Brush BHH880,,Cat2332031,"EGP 3,299.00",,,4.3,,,,,https://m.media-amazon.com/images/I/610CwaiqHVL._AC_UL320_.jpg,https://www.amazon.eg/dp/B07MB2P8G1,2026-03-28T13:06:29.016771
amazon,B0FH59TY5V,Ionic Brush | Healthy and fast daily straightening | Temperature 170?450F | Auto shut off after 60 minutes | Anti-tangle nano comb | Dual ion generator | PTC hair protection technology,,Cat2332031,"EGP 2,490.00",,,4.2,,,,,https://m.media-amazon.com/images/I/61MKMXfoBbL._AC_UL320_.jpg,https://www.amazon.eg/dp/B0FH59TY5V,2026-03-28T13:06:29.017275
amazon,B0F3BGP7SB,"Home Gold HG-1914 Hair Styler 1200 Blow Dryer Brush, Black, 1200.0 Watts",,Cat2332031,EGP 604.92,,,3.3,,,,,https://m.media-amazon.com/images/I/51NghRkuA-L._AC_UL320_.jpg,https://www.amazon.eg/dp/B0F3BGP7SB,2026-03-28T13:06:29.017855
amazon,B0DNR49Z8D,HG-5250,,Cat2332031,,,,2.6,,,,,https://m.media-amazon.com/images/I/51JlWPoYQrL._AC_UL320_.jpg,https://www.amazon.eg/dp/B0DNR49Z8D,2026-03-28T13:06:29.018328
amazon,B0FQPDK8S1,HG-700 Professional Wall Mounted Electric Hair Dryer,,Cat2332031,"EGP 1,050.00",,,4.6,,,,,https://m.media-amazon.com/images/I/41nmfCDWiyL._AC_UL320_.jpg,https://www.amazon.eg/dp/B0FQPDK8S1,2026-03-28T13:06:29.018867
amazon,B0CH54WNVH,Crystal Hair Removal Multi Color,,Cat2332031,EGP 22.79,,,2.7,,,,,https://m.media-amazon.com/images/I/61hI+SrTapL._AC_UL320_.jpg,https://www.amazon.eg/dp/B0CH54WNVH,2026-03-28T13:10:02.331493
amazon,B0CW1PPGYM,"VGR V-953 Professional T-Blade Hair Trimmer for Men, 120 min Runtime with 3 Cutting Guide Combs (Multicolor)",,Cat2332031,EGP 386.00,,,5.0,,,,,https://m.media-amazon.com/images/I/61KdlqSrNoL._AC_UL320_.jpg,https://www.amazon.eg/dp/B0CW1PPGYM,2026-03-28T13:10:02.332024
amazon,B0DMWG7LXS,Hair Styling Brush and Hair Dryer 1000W Black,,Cat2332031,"EGP 1,350.00",,,2.9,,,,,https://m.media-amazon.com/images/I/5149t6UkSaL._AC_UL320_.jpg,https://www.amazon.eg/dp/B0DMWG7LXS,2026-03-28T13:10:02.332580
amazon,B00KSQQ07I,ST326E Baby Lace Dry Straightener,,Cat2332031,"EGP 2,519.00",,,4.3,,,,,https://m.media-amazon.com/images/I/71reya+7kwL._AC_UL320_.jpg,https://www.amazon.eg/dp/B00KSQQ07I,2026-03-28T13:10:02.333092
