platform,asin,title,brand,category,current_price,original_price,discount,rating,reviews_count,prime_eligible,amazon_choice,sponsored,main_image,product_url,scraped_at
amazon,B0038PW84A,HSM Classic 70.2 (5.8) Shredder,,Cat7879031,"EGP 4,500.00",,,,,,,,https://m.media-amazon.com/images/I/61uzGwQfQoL._AC_UL320_.jpg,https://www.amazon.eg/dp/B0038PW84A,2026-03-28T13:02:47.677630
amazon,B001ERJUJK,"Eba Office Cross Cut Shredder - 400 mm, 3140 C",,Cat7879031,"EGP 159,600.05",,,,,,,,https://m.media-amazon.com/images/I/51vWBbcPvfL._AC_UL320_.jpg,https://www.amazon.eg/dp/B001ERJUJK,2026-03-28T13:02:47.678112
amazon,B001EQV8UA,"Eba Office Strip Cut Shredder - 260 mm, 2127 S",,Cat7879031,"EGP 55,996.90",,,4.0,,,,,https://m.media-amazon.com/images/I/417b+KQgqSL._AC_UL320_.jpg,https://www.amazon.eg/dp/B001EQV8UA,2026-03-28T13:02:47.678627
amazon,B001EQQF4E,EBA DESKSIDE SHREDDER 3140S,,Cat7879031,"EGP 50,576.63",,,5.0,,,,,https://m.media-amazon.com/images/I/51sl-s7xhZL._AC_UL320_.jpg,https://www.amazon.eg/dp/B001EQQF4E,2026-03-28T13:02:47.679154
amazon,B000J69OIE,HSM Classic 125.2 (5.8) Shredder,,Cat7879031,"EGP 25,000.00",,,,,,,,https://m.media-amazon.com/images/I/81T0dRoejML._AC_UL320_.jpg,https://www.amazon.eg/dp/B000J69OIE,2026-03-28T13:02:47.679584
amazon,B0GFG4Q64N,Manual Paper Shredder A4 - Black 8294,,Cat7879031,EGP 620.00,,,,,,,,https://m.media-amazon.com/images/I/51UOZ4JMrTL._AC_UL320_.jpg,https://www.amazon.eg/dp/B0GFG4Q64N,2026-03-28T13:02:50.688683
amazon,B0DJRKGFJN,3A Manual Paper Shredder A4 - Black 8294,,Cat7879031,EGP 629.03,EGP 669.43,,3.9,List:,,,,https://m.media-amazon.com/images/I/51TkBOlX+jL._AC_UL320_.jpg,https://www.amazon.eg/dp/B0DJRKGFJN,2026-03-28T13:02:50.689342
amazon,B091JHWXN9,A3 PAPER CUTTER A3,,Cat7879031,EGP 920.00,,,4.3,,,,,https://m.media-amazon.com/images/I/81IAjJfxhYL._AC_UL320_.jpg,https://www.amazon.eg/dp/B091JHWXN9,2026-03-28T13:02:50.690463
amazon,B0DDQDFCN1,"Elmaayergy S606B PS-1 Paper Shredder MachineA4, With 5 Papers Capacity, Premium Materials Ensure Durability And Professional Finish - Black",,Cat7879031,"EGP 2,021.65","EGP 2,380.09",,3.7,Was:,,,,https://m.media-amazon.com/images/I/51vSy8aB0WL._AC_UL320_.jpg,https://www.amazon.eg/dp/B0DDQDFCN1,2026-03-28T13:02:50.692048
amazon,B0FN47D92G,"Deli ET001 Paper Shredder, White",,Cat7879031,"EGP 4,525.00","EGP 5,495.26",,4.8,List:,,,,https://m.media-amazon.com/images/I/41h+Cf1tFYL._AC_UL320_.jpg,https://www.amazon.eg/dp/B0FN47D92G,2026-03-28T13:02:50.695426
amazon,B09DQ8NCT1,"Dahle PaperSAFE PS 100 Paper Shredder, Oil Free, Jam Protection, Security Level P-4, 5 Sheet Max, Shreds Staples, Paper Clips & Credit Cards",,Cat7879031,"EGP 4,710.00",,,4.3,,,,,https://m.media-amazon.com/images/I/61CMsec-NVL._AC_UL320_.jpg,https://www.amazon.eg/dp/B09DQ8NCT1,2026-03-28T13:02:50.695920
amazon,B0013F3DA0,Rexel Alpha Cross Cut Shredder,,Cat7879031,"EGP 4,950.00",,,3.9,,,,,https://m.media-amazon.com/images/I/71xdz9RsKDL._AC_UL320_.jpg,https://www.amazon.eg/dp/B0013F3DA0,2026-03-28T13:02:50.696913
amazon,B0968YSHZ8,"Paper Shredder Machine, 10 Sheets - OS1007D",,Cat7879031,"EGP 5,008.02","EGP 6,184.00",,5.0,List:,,,,https://m.media-amazon.com/images/I/6167qWIAvTL._AC_UL320_.jpg,https://www.amazon.eg/dp/B0968YSHZ8,2026-03-28T13:02:54.007715
amazon,B0GHRYY5RZ,HP 2800 Paper Shredder,,Cat7879031,"EGP 5,268.51",,,,,,,,https://m.media-amazon.com/images/I/31bsnhcUkgL._AC_UL320_.jpg,https://www.amazon.eg/dp/B0GHRYY5RZ,2026-03-28T13:02:54.009681
amazon,B08XF5J195,"Dahle PaperSAFE 120 paper shredder Particle-cut shredding 65 dB 22 cm Grey, White",,Cat7879031,"EGP 6,030.00",,,3.8,,,,,https://m.media-amazon.com/images/I/51mXEi4w+dL._AC_UL320_.jpg,https://www.amazon.eg/dp/B08XF5J195,2026-03-28T13:02:54.011736
amazon,B08TZJSB8D,HP OneShred 8CC Shredder Security Level P-4 Cross Cut 8 Sheets 2801,,Cat7879031,"EGP 6,758.00",,,4.3,,,,,https://m.media-amazon.com/images/I/41P2YV7xyhL._AC_UL320_.jpg,https://www.amazon.eg/dp/B08TZJSB8D,2026-03-28T13:02:54.013641
amazon,B0D6GJHD4K,HP Shredder2826,,Cat7879031,"EGP 6,935.76",,,4.4,,,,,https://m.media-amazon.com/images/I/71IFuRmnwjL._AC_UL320_.jpg,https://www.amazon.eg/dp/B0D6GJHD4K,2026-03-28T13:02:54.014181
amazon,B0988SD543,Deli office machine paper shredder 9951 white,,Cat7879031,"EGP 9,513.99",,,5.0,,,,,https://m.media-amazon.com/images/I/41+l8MviNKL._AC_UL320_.jpg,https://www.amazon.eg/dp/B0988SD543,2026-03-28T13:02:56.885717
amazon,B08V1B4C55,HP OneShred 12CC Shredder Security Level P-4 Cross Cut 12 Sheets 2802,,Cat7879031,"EGP 11,085.59",,,4.4,,,,,https://m.media-amazon.com/images/I/618UHNfLIuL._AC_UL320_.jpg,https://www.amazon.eg/dp/B08V1B4C55,2026-03-28T13:02:56.886849
amazon,B0FFH2X7PG,"EBA Shredcat 8200 12-Sheet Opening Micro Cut Shredder, 21 Liter Bin Capacity",,Cat7879031,"EGP 12,888.00",,,5.0,,,,,https://m.media-amazon.com/images/I/41KatYU8S1L._AC_UL320_.jpg,https://www.amazon.eg/dp/B0FFH2X7PG,2026-03-28T13:02:56.888418
amazon,B08V1B33KL,HP 2804 Oneshred 10MC Microcut P5 10 Sheets,,Cat7879031,"EGP 17,567.40",,,4.7,,,,,https://m.media-amazon.com/images/I/51XZhBVB4iL._AC_UL320_.jpg,https://www.amazon.eg/dp/B08V1B33KL,2026-03-28T13:02:56.893362
amazon,B0FFH8KYHR,"EBA Shredcat 8292 Auto Cross Cut Shredder with 200-Sheet Feeder, 26 Liter Bin Capacity",,Cat7879031,"EGP 17,813.57",,,5.0,,,,,https://m.media-amazon.com/images/I/51ETZWnqcKL._AC_UL320_.jpg,https://www.amazon.eg/dp/B0FFH8KYHR,2026-03-28T13:02:56.893910
amazon,B08V11G72J,"HP OneShred 15CC Shredder, Security Level P-4, Cross Cut, 15 Sheets, 2803",,Cat7879031,"EGP 18,170.46",,,4.2,,,,,https://m.media-amazon.com/images/I/51By-au+POL._AC_UL320_.jpg,https://www.amazon.eg/dp/B08V11G72J,2026-03-28T13:02:56.894526
amazon,B0FN4B6C1Z,"Deli ET048 Paper Shredder, White",,Cat7879031,"EGP 18,743.22",,,5.0,,,,,https://m.media-amazon.com/images/I/31tKbrV5TcL._AC_UL320_.jpg,https://www.amazon.eg/dp/B0FN4B6C1Z,2026-03-28T13:02:56.895042
amazon,B08T1QK944,"Rexel optimum autofeed+ 90x automatic shredder, 90 sheets automatic, security level p4, particle cut, for home/home office, 34 litre waste bin, 2020090xch",,Cat7879031,"EGP 20,822.18","EGP 22,680.00",,4.0,List:,,,,https://m.media-amazon.com/images/I/61GS+QdN3mL._AC_UL320_.jpg,https://www.amazon.eg/dp/B08T1QK944,2026-03-28T13:02:56.896244
amazon,B08V138YS6,HP Distruggidocumenti Pro Shredder 18CC,,Cat7879031,"EGP 27,034.00",,,,,,,,https://m.media-amazon.com/images/I/717oXKkfbxL._AC_UL320_.jpg,https://www.amazon.eg/dp/B08V138YS6,2026-03-28T13:02:59.680177
amazon,B08VRMVWLD,HP PRO SHREDDER 12MC 2814 Mikroschnitt P5 12Blatt,,Cat7879031,"EGP 28,879.00",,,5.0,,,,,https://m.media-amazon.com/images/I/61s1xDjFwRL._AC_UL320_.jpg,https://www.amazon.eg/dp/B08VRMVWLD,2026-03-28T13:02:59.684317
amazon,B0DMF7BWXW,Magnetic Whiteboard WH100AM -40x30centimeter,,Cat7914031,EGP 180.06,,,5.0,,,,,https://m.media-amazon.com/images/I/21KZXmQGfCL._AC_UL320_.jpg,https://www.amazon.eg/dp/B0DMF7BWXW,2026-03-28T13:03:10.926169
amazon,B0CSP8BH2D,R400 2.4GHz Wireless Remote Control USB Wireless Remote Control Red Laser Pen Pointer PPT Presentation for Projector,,Cat7914031,EGP 431.00,,,3.9,,,,,https://m.media-amazon.com/images/I/51t0bQQKf0L._AC_UL320_.jpg,https://www.amazon.eg/dp/B0CSP8BH2D,2026-03-28T13:03:10.926734
amazon,B07NDTBFVM,"Cork Notice Board - 120 x 90 cm - Cork Board with Aluminium Frame, BPM05054040",,Cat7914031,"EGP 1,560.55",,,4.3,,,,,https://m.media-amazon.com/images/I/91Io8j0l3sL._AC_UL320_.jpg,https://www.amazon.eg/dp/B07NDTBFVM,2026-03-28T13:03:10.927232
amazon,B003AQP5VA,Bi-Office Cork Board 60x45 cm,,Cat7914031,EGP 600.21,,,4.2,,,,,https://m.media-amazon.com/images/I/91ms3TkBBrL._AC_UL320_.jpg,https://www.amazon.eg/dp/B003AQP5VA,2026-03-28T13:03:10.927752
amazon,B091CHK2CN,Generic Funny Stick LED Light Laser Pointer Pen Toy - Blue,,Cat7914031,EGP 65.00,,,3.5,,,,,https://m.media-amazon.com/images/I/51azcqYv+tL._AC_UL320_.jpg,https://www.amazon.eg/dp/B091CHK2CN,2026-03-28T13:03:10.928260
amazon,B0GQ9K4N3F,Double sided board with built-in stand,,Cat7914031,EGP 250.00,,,,,,,,https://m.media-amazon.com/images/I/71aU4s2gLfL._AC_UL320_.jpg,https://www.amazon.eg/dp/B0GQ9K4N3F,2026-03-28T13:03:10.928665
amazon,B0FCG59F2H,Rubber Magnetic Whiteboard Eraser With Comfortable Design And Practical For Board - Red Gray,,Cat7914031,EGP 28.81,,,3.7,,,,,https://m.media-amazon.com/images/I/41s08WNWI2L._AC_UL320_.jpg,https://www.amazon.eg/dp/B0FCG59F2H,2026-03-28T13:03:10.929132
amazon,B0CK1VFVKN,Whiteboard 90x120 + Pack Of Roto 501,,Cat7914031,"EGP 1,560.55",,,5.0,,,,,https://m.media-amazon.com/images/I/31jgqWylRML._AC_UL320_.jpg,https://www.amazon.eg/dp/B0CK1VFVKN,2026-03-28T13:03:10.929594
amazon,B0CP1DYHK2,3A NYB1001 High Quality Message Board Foam Frame Mickey Mouse Shape With Marker & Tape - Multi Color,,Cat7914031,EGP 72.83,,,3.6,,,,,https://m.media-amazon.com/images/I/71g-znH6HeL._AC_UL320_.jpg,https://www.amazon.eg/dp/B0CP1DYHK2,2026-03-28T13:03:10.930107
amazon,B09X47QCM4,"Digital Corkboard, Double Face - 45x60 cm",,Cat7914031,EGP 400.00,,,5.0,,,,,https://m.media-amazon.com/images/I/61LqB-gQEdL._AC_UL320_.jpg,https://www.amazon.eg/dp/B09X47QCM4,2026-03-28T13:03:10.930585
amazon,B08YNRZPDR,"Generic 2in1 LED Laser Pen Pointer - Green, 5mW",,Cat7914031,EGP 60.00,,,3.3,,,,,https://m.media-amazon.com/images/I/51CdM8HQ87L._AC_UL320_.jpg,https://www.amazon.eg/dp/B08YNRZPDR,2026-03-28T13:03:10.931055
amazon,B0FQQRG1RW,"Telescopic Hand Pointer with Thumbs Up Design, Extendable Teaching Aid,For school teacher pointer, Blue, 1 piece",,Cat7914031,EGP 188.00,,,5.0,,,,,https://m.media-amazon.com/images/I/31QMlaSlklL._AC_UL320_.jpg,https://www.amazon.eg/dp/B0FQQRG1RW,2026-03-28T13:03:10.931519
amazon,B0977XG3S2,Presenter Pointer for computer and laptop,,Cat7914031,EGP 359.10,EGP 399.00,,4.7,Was:,,,,https://m.media-amazon.com/images/I/61g2c+p4GiL._AC_UL320_.jpg,https://www.amazon.eg/dp/B0977XG3S2,2026-03-28T13:03:10.932087
amazon,B09V5KL4XL,"Raylu Paper® - Natural cork board with pine frame, pin board with markings and mounting kit (40 x 30 cm)",,Cat7914031,EGP 444.16,,,4.2,,,,,https://m.media-amazon.com/images/I/71jK0otsStL._AC_UL320_.jpg,https://www.amazon.eg/dp/B09V5KL4XL,2026-03-28T13:03:10.932571
amazon,B0CP1DQ1ZD,3A Winnie Pooh Message Board - Multi Color Foam Frame Whiteboard With Marker & Tape,,Cat7914031,EGP 72.00,,,4.5,,,,,https://m.media-amazon.com/images/I/61lZH2gMWaL._AC_UL320_.jpg,https://www.amazon.eg/dp/B0CP1DQ1ZD,2026-03-28T13:03:10.933042
amazon,B0BYZY7M8Z,"Light Up Dry Erase Board | Clear Dry Erase Board Calendar with Light - Clear Whiteboard with Stand for Desk, Acrylic Tablet for Office and School",,Cat7914031,EGP 177.11,,,3.5,,,,,https://m.media-amazon.com/images/I/71vRm1FUiGL._AC_UL320_.jpg,https://www.amazon.eg/dp/B0BYZY7M8Z,2026-03-28T13:03:10.933523
amazon,B0FLYQ2H4L,"R400 Handheld bluetooth clicker Wireless Presenter with Directional Control Panel & Pointer with Red Laser Pen & Receiver, Remote control, Comfortable hand, 50-foot range, 15-meter wireless port",,Cat7914031,EGP 548.81,,,3.7,,,,,https://m.media-amazon.com/images/I/51Gfo27lCjL._AC_UL320_.jpg,https://www.amazon.eg/dp/B0FLYQ2H4L,2026-03-28T13:03:10.933976
amazon,B01IIVZ0DY,"MBC MAT BOARD CENTER Pack of 10 1/8 White Foam Core Backing s (5x7, White)",,Cat7914031,EGP 225.00,,,4.6,,,,,https://m.media-amazon.com/images/I/61G5idhyrWL._AC_UL320_.jpg,https://www.amazon.eg/dp/B01IIVZ0DY,2026-03-28T13:03:10.934441
amazon,B0DLGT8GHP,"Acrylic Photo A4 Display Board, 21×29.7cm Thickness 2mm A4 Clear Sheet, Home Decoration Slides, Photo Display and Drawing (2pcs)",,Cat7914031,EGP 280.00,,,4.6,,,,,https://m.media-amazon.com/images/I/11koVckRIeL._AC_UL320_.jpg,https://www.amazon.eg/dp/B0DLGT8GHP,2026-03-28T13:03:10.934910
amazon,B0B5DB2NSC,"CPI 4 X 6 Inch (A6) Transparent Bar code standee, QR Code L Shape Perfect for Restaurants, Promotions, Photo Frames for BHIM, PHONEPE, GOOGLE Pay Stand (Set of 3)",,Cat7914031,EGP 599.00,,,4.1,,,,,https://m.media-amazon.com/images/I/61TTiJV5-sL._AC_UL320_.jpg,https://www.amazon.eg/dp/B0B5DB2NSC,2026-03-28T13:03:10.935372
amazon,B09YHPRJWH,"Digital Chalkboard Digital Draw & Writing LCD 12 Inch with Single Touch Self Wiping Pen/Green"")",,Cat7914031,EGP 176.70,,,4.5,,,,,https://m.media-amazon.com/images/I/31NoLWNCZaL._AC_UL320_.jpg,https://www.amazon.eg/dp/B09YHPRJWH,2026-03-28T13:03:10.935872
amazon,B0GPK5Z2KJ,"Whiteboard with Stand, 35 x 50 cm",,Cat7914031,EGP 370.00,,,2.0,,,,,https://m.media-amazon.com/images/I/4123QsER3nL._AC_UL320_.jpg,https://www.amazon.eg/dp/B0GPK5Z2KJ,2026-03-28T13:03:10.936367
amazon,B0D6BQRHKL,"Rapoo Wireless Presenter XR100, Reliable 2.4G wireless connection, Rechargeable battery, One-click hyperlink - 12347",,Cat7914031,EGP 719.00,,,5.0,,,,,https://m.media-amazon.com/images/I/41dk0+AbCJL._AC_UL320_.jpg,https://www.amazon.eg/dp/B0D6BQRHKL,2026-03-28T13:03:10.936875
amazon,B0CXHG14S7,Dry Erase Board Sticker- Whiteboard Stickers-8.3''x11.7'' Removable Dry Erase Sheets- Fridge Dry Erase Paper for Wall/Desk/Refrigerator/Door/Locker/Home/Office/Classroom (White-10Pcs),,Cat7914031,EGP 330.00,,,4.5,,,,,https://m.media-amazon.com/images/I/61qoG2XT3DL._AC_UL320_.jpg,https://www.amazon.eg/dp/B0CXHG14S7,2026-03-28T13:03:10.937351
amazon,B07N6PQ6V8,Legamaster PREMIUM cork pinboards. 60 x 90 cm,,Cat7914031,EGP 810.46,,,4.3,,,,,https://m.media-amazon.com/images/I/61p44tOV7+L._AC_UL320_.jpg,https://www.amazon.eg/dp/B07N6PQ6V8,2026-03-28T13:03:14.487875
amazon,B0F9LJ73B6,Fitto Cork Board 40cm x 60cm Brown with Wooden Frame for Home and Office Use,,Cat7914031,EGP 600.21,,,3.3,,,,,https://m.media-amazon.com/images/I/61k33T-n1GL._AC_UL320_.jpg,https://www.amazon.eg/dp/B0F9LJ73B6,2026-03-28T13:03:14.488385
amazon,B097ML88MN,"AITEE 10 Pack Acrylic Mini Chalkboard Signs for Food, Mini Tabletop Chalkboard Signs, Small Tent Buffet Chalkboards Signs for Food and Weddings, Birthday Parties, Message Board Signs, Buffet, Bakery",,Cat7914031,EGP 490.00,,,4.6,,,,,https://m.media-amazon.com/images/I/61oH+0qRgsL._AC_UL320_.jpg,https://www.amazon.eg/dp/B097ML88MN,2026-03-28T13:03:14.488844
amazon,B08TLX6DPD,Cork Board Pin Notice Office Memo School with Push Pins Board Requisite Needs Wooden Natural Frame Board (60CM x 90CM),,Cat7914031,EGP 840.29,,,4.2,,,,,https://m.media-amazon.com/images/I/71LvMRhDgbL._AC_UL320_.jpg,https://www.amazon.eg/dp/B08TLX6DPD,2026-03-28T13:03:14.489348
amazon,B0D49ZB8LC,PCB Prototype Board Double Layer Vero Board (FR-4) 9×15 cm,,Cat7914031,EGP 69.00,EGP 77.00,,3.8,Was:,,,,https://m.media-amazon.com/images/I/517u6-zPZ4L._AC_UL320_.jpg,https://www.amazon.eg/dp/B0D49ZB8LC,2026-03-28T13:03:14.489884
amazon,B00LJ4I274,"Kassa X-Large Chalkboard Wallpaper - Clear | 1.4ft x 6.5ft Adhesive Paper Roll | Includes 3 Markers & Eraser Cloth | Peel & Stick on a Wall, Table & Desk | Ideal for Use at Home, School, Office & More",,Cat7914031,EGP 205.20,,,4.2,,,,,https://m.media-amazon.com/images/I/71cKeErS80S._AC_UL320_.jpg,https://www.amazon.eg/dp/B00LJ4I274,2026-03-28T13:03:14.490397
amazon,B09PBLQW96,CAPOT Acrylic Dry Erase Board/Luminous Acrylic Board for Office/School or Home Desktop as a Note Board/Message Board/LED Letter Message Boards/Desktop Whiteboard with 7 Color Pen,,Cat7914031,EGP 338.98,,,4.2,,,,,https://m.media-amazon.com/images/I/71P3xwXwNiL._AC_UL320_.jpg,https://www.amazon.eg/dp/B09PBLQW96,2026-03-28T13:03:14.490917
amazon,B0FCDK43QX,"Pack of 2 A5 size - 6 inch x 8.25 inch Acrylic Sign Display (L-stand, pack of 2)",,Cat7914031,EGP 499.00,,,,,,,,https://m.media-amazon.com/images/I/41wEoj96mtL._AC_UL320_.jpg,https://www.amazon.eg/dp/B0FCDK43QX,2026-03-28T13:03:14.491326
amazon,B08WJHZ77J,S&a 501a Double Face Cork Board - 45 x 30 Centimeters,,Cat7914031,EGP 299.00,,,3.8,,,,,https://m.media-amazon.com/images/I/81KWzmrz7IL._AC_UL320_.jpg,https://www.amazon.eg/dp/B08WJHZ77J,2026-03-28T13:03:14.491833
amazon,B0B5LPKF6Q,"EUROPEL Chalkboard Desktop A5 Portrait, Pine Wood Base with Natural Wood Finish, Double Sided, for Water Based Marker, for Restaurant, Hotel, Conference, Festivals, Food Truck, Counter",,Cat7914031,EGP 165.00,,,3.8,,,,,https://m.media-amazon.com/images/I/61zbdFTqfWL._AC_UL320_.jpg,https://www.amazon.eg/dp/B0B5LPKF6Q,2026-03-28T13:03:14.492337
amazon,B091CP68F6,S&a 503a Double Face Cork Board - 90 x 60 Centimeters,,Cat7914031,EGP 790.00,,,5.0,,,,,https://m.media-amazon.com/images/I/81YW1fMI43L._AC_UL320_.jpg,https://www.amazon.eg/dp/B091CP68F6,2026-03-28T13:03:14.492787
amazon,B07Y76H9V4,Magnetic White Board Size 45x60cm With Aluminum Frame,,Cat7914031,EGP 397.88,,,3.6,,,,,https://m.media-amazon.com/images/I/516LDfPaivL._AC_UL320_.jpg,https://www.amazon.eg/dp/B07Y76H9V4,2026-03-28T13:03:14.493339
amazon,B093G4HDPJ,Double face cork board 45 * 60 cm ideal for both adults and kids - wooden,,Cat7914031,EGP 490.00,EGP 608.21,,4.6,List:,,,,https://m.media-amazon.com/images/I/91QcAgOp4FL._AC_UL320_.jpg,https://www.amazon.eg/dp/B093G4HDPJ,2026-03-28T13:03:14.493919
amazon,B07MGD935Q,eWINNER R400 Wireless Presenter Receiver,,Cat7914031,EGP 450.00,,,4.4,,,,,https://m.media-amazon.com/images/I/516iMmXYsyL._AC_UL320_.jpg,https://www.amazon.eg/dp/B07MGD935Q,2026-03-28T13:03:14.494392
amazon,B0D7G8NWW5,"2 Pcs Cork Board, 11.8''x15.7'' Bulletin Board, Wooden Framed Corkboards for Wall, Small Cork Board, Vision Board Supplies, Prayer Board, Picture Board for Photos, Office, Home Decor, School",,Cat7914031,EGP 800.28,,,4.5,,,,,https://m.media-amazon.com/images/I/81dRNC9gr0L._AC_UL320_.jpg,https://www.amazon.eg/dp/B0D7G8NWW5,2026-03-28T13:03:14.494849
amazon,B0CY97JFRC,"Large Magnetic Whiteboard, Dry Erase Board, Magnetic, Home Office, Classroom",,Cat7914031,"EGP 1,600.56",,,4.5,,,,,https://m.media-amazon.com/images/I/61sWMp10eVL._AC_UL320_.jpg,https://www.amazon.eg/dp/B0CY97JFRC,2026-03-28T13:03:14.495311
amazon,B088QVCDQ8,Chalkboard Wall Sticker Wall Decal Blackboard Wallpaper Large Chalkboard Contact Paper Roll KDG Self Adhesive DIY Reusable Erasable Stickers,,Cat7914031,EGP 299.00,,,4.1,,,,,https://m.media-amazon.com/images/I/71zgTt9qkFL._AC_UL320_.jpg,https://www.amazon.eg/dp/B088QVCDQ8,2026-03-28T13:03:14.495758
amazon,B08WJLBXSX,S&A WH103aM Magnetic White Board - 90 x 60 Centimeters,,Cat7914031,EGP 671.36,EGP 746.93,,3.0,List:,,,,https://m.media-amazon.com/images/I/415UA0wau5L._AC_UL320_.jpg,https://www.amazon.eg/dp/B08WJLBXSX,2026-03-28T13:03:14.496339
amazon,B074QL8FLP,Blackboard Chalk Board Wall Sticker Wrapping Paper 43cm x 200cm for Home School & Office,,Cat7914031,,,,4.2,,,,,https://m.media-amazon.com/images/I/61uTbsWK4oL._AC_UL320_.jpg,https://www.amazon.eg/dp/B074QL8FLP,2026-03-28T13:03:14.497069
amazon,B0D5R31F2P,Magnetic White Board Dry Wipe 90 x 60 cm Aluminium Frame Whiteboard for Office School and Home,,Cat7914031,EGP 800.28,,,4.3,,,,,https://m.media-amazon.com/images/I/51HjCAA32OL._AC_UL320_.jpg,https://www.amazon.eg/dp/B0D5R31F2P,2026-03-28T13:03:14.497549
amazon,B0GH1L7JVL,"Metal Double-Sided Magnetic Whiteboard, Aluminium Frame with Movable Hooks, Horizontal Wall-Mount Design for Home and Office Writing (90 * 120 cm)",,Cat7914031,"EGP 1,385.00",,,,,,,,https://m.media-amazon.com/images/I/31NeqcD7sXL._AC_UL320_.jpg,https://www.amazon.eg/dp/B0GH1L7JVL,2026-03-28T13:03:14.497964
amazon,B0GPJM84M3,Board 50cm by 70cm,,Cat7914031,EGP 340.00,,,,,,,,https://m.media-amazon.com/images/I/51TqYiW6eAL._AC_UL320_.jpg,https://www.amazon.eg/dp/B0GPJM84M3,2026-03-28T13:03:14.498378
amazon,B0CGDM97TX,"DOLLAR BOSS Framless Cork Board, 2 Pcs 16"" x 12"" Magnetic Cork Bulletin Board Small Corkboards for Walls Pin Board Notice Board with 8 Magnets 10 Pushpins for Home Office Kitchen School Decor Display",,Cat7914031,EGP 800.28,,,3.7,,,,,https://m.media-amazon.com/images/I/81mmQfT-UFL._AC_UL320_.jpg,https://www.amazon.eg/dp/B0CGDM97TX,2026-03-28T13:03:14.498842
amazon,B0FTHVFGSZ,"Telescopic Hand Pointer with Thumbs Up Design, Extendable Teaching Aid,For school teacher pointer,Pink Red, One Piece",,Cat7914031,EGP 188.00,,,5.0,,,,,https://m.media-amazon.com/images/I/41lbLRBqXVL._AC_UL320_.jpg,https://www.amazon.eg/dp/B0FTHVFGSZ,2026-03-28T13:03:14.499302
amazon,B07MXBS6G4,"Digital Corkboard, Double Face - 60x90 cm",,Cat7914031,EGP 728.27,,,4.3,,,,,https://m.media-amazon.com/images/I/61Vs9THhQJL._AC_UL320_.jpg,https://www.amazon.eg/dp/B07MXBS6G4,2026-03-28T13:03:17.616868
amazon,B08PPNPKTS,"Self-adhesive Blackboard Wall Sticker, Chalkboard Paper Roll Set with 5Pieces of Colored Chalks, for Home, School & Office Use(200 x 45cm)",,Cat7914031,EGP 170.00,,,4.1,,,,,https://m.media-amazon.com/images/I/418uZb8EQcL._AC_UL320_.jpg,https://www.amazon.eg/dp/B08PPNPKTS,2026-03-28T13:03:17.617351
amazon,B0FHHSMGK6,"Next Store Drawing Board, Magnetic Cute Cat Erasable Chalkboard with Pen and Stamps, Develops Creativity and Skills, Fun Educational Toy and Perfect Gift for Girls Boys Age 3+",,Cat7914031,EGP 150.00,,,,,,,,https://m.media-amazon.com/images/I/61up4yRn8XL._AC_UL320_.jpg,https://www.amazon.eg/dp/B0FHHSMGK6,2026-03-28T13:03:17.617757
amazon,B09Q8Y82ND,"shoes sign Restaurant,Theke",,Cat7914031,"EGP 1,098.90",,,4.3,,,,,https://m.media-amazon.com/images/I/61oQmakaumL._AC_UL320_.jpg,https://www.amazon.eg/dp/B09Q8Y82ND,2026-03-28T13:03:17.618228
amazon,B0FHKZMKHK,Double face cork board 45 * 60 cm ideal for both adults and kids - wooden,,Cat7914031,EGP 520.87,,,2.8,,,,,https://m.media-amazon.com/images/I/81n2Ht0OrhL._AC_UL320_.jpg,https://www.amazon.eg/dp/B0FHKZMKHK,2026-03-28T13:03:17.618724
amazon,B0DT21HMZK,"Magnetic Writing White Board - Smooth & Easy to Wipe, Aluminum Frame, Includes Wall-Mounted Hangers & Pen Tray (45x60 cm)",,Cat7914031,EGP 455.00,,,3.1,,,,,https://m.media-amazon.com/images/I/41B2FhHbeBL._AC_UL320_.jpg,https://www.amazon.eg/dp/B0DT21HMZK,2026-03-28T13:03:17.619229
amazon,B002GHBUTK,Logitech R400 Wireless presenter with direction pad controls and laser pointer,,Cat7914031,,,,4.7,,,,,https://m.media-amazon.com/images/I/51-7XfmB4ZL._AC_UL320_.jpg,https://www.amazon.eg/dp/B002GHBUTK,2026-03-28T13:03:17.619680
amazon,B0DHPFXSF3,مسبحة الكترونية (قطعتين) متعددة الالوان,,Cat7914031,EGP 44.00,,,4.1,,,,,https://m.media-amazon.com/images/I/41u4jjuKubL._AC_UL320_.jpg,https://www.amazon.eg/dp/B0DHPFXSF3,2026-03-28T13:03:17.620145
amazon,B0C5QZN9L7,"OWLKELA 24'' x 36'' Cork Board Bulletin Board, Wooden Framed Corkboard, Wood Oak Frame Corkboard, Vision Board and Decorative Hanging Pin Board",,Cat7914031,EGP 840.29,,,4.2,,,,,https://m.media-amazon.com/images/I/81Bxq-UW6PL._AC_UL320_.jpg,https://www.amazon.eg/dp/B0C5QZN9L7,2026-03-28T13:03:17.620585
amazon,B09FQ5PFD6,Magnetic Chalk-board Animals - White,,Cat7914031,EGP 250.00,,,,,,,,https://m.media-amazon.com/images/I/51CGbSV8ftL._AC_UL320_.jpg,https://www.amazon.eg/dp/B09FQ5PFD6,2026-03-28T13:03:17.621040
amazon,B0BXRS6R71,"Cork Bulletin Board, Bulletin-Boards, Notes Board, Memo Board, 18 x 24inch, Silver Aluminum Frame",,Cat7914031,EGP 480.17,,,4.4,,,,,https://m.media-amazon.com/images/I/71arfuZXIDL._AC_UL320_.jpg,https://www.amazon.eg/dp/B0BXRS6R71,2026-03-28T13:03:17.621493
amazon,B07LBQWBLP,"HIIMIEI A5 Acrylic Poster Menu Holder (6 Pack) - Clear, Durable, Easy Assembly - Ideal for Offices, Hotels, Restaurants",,Cat7914031,EGP 735.00,,,4.5,,,,,https://m.media-amazon.com/images/I/61FjvahKlCL._AC_UL320_.jpg,https://www.amazon.eg/dp/B07LBQWBLP,2026-03-28T13:03:17.621951
amazon,B07MWWP3GB,eWINNER Rf 2.4ghz Wireless USB Power Point Presentation Remote Control Laser Pointer Pen,,Cat7914031,EGP 615.00,,,4.1,,,,,https://m.media-amazon.com/images/I/51DobRo0FzL._AC_UL320_.jpg,https://www.amazon.eg/dp/B07MWWP3GB,2026-03-28T13:03:17.622425
amazon,B0DZFJKDSW,Magnetic Mobile Board on Wheels - 90 x 60 cm Whiteboard with Double-Sided Magnetic Surface and Durable Aluminium Frame - For Office and School,,Cat7914031,"EGP 3,267.81",,,,,,,,https://m.media-amazon.com/images/I/51JljT6Z16L._AC_UL320_.jpg,https://www.amazon.eg/dp/B0DZFJKDSW,2026-03-28T13:03:17.622813
amazon,B09231KXFX,2b Wireless Presenter 2.4 Ghz,,Cat7914031,"EGP 1,137.38",,,4.9,,,,,https://m.media-amazon.com/images/I/51jNG81dkyL._AC_UL320_.jpg,https://www.amazon.eg/dp/B09231KXFX,2026-03-28T13:03:17.623364
amazon,B0FCG6W9K5,Rubber Magnetic Whiteboard Eraser With Comfortable Design And Practical For Board - Green Gray,,Cat7914031,EGP 31.21,,,4.4,,,,,https://m.media-amazon.com/images/I/41LWxKAd5wL._AC_UL320_.jpg,https://www.amazon.eg/dp/B0FCG6W9K5,2026-03-28T13:03:17.623826
amazon,B098RHKVKS,"Magnetoplan Magnetic Whiteboard, 90 cm x 3 cm x 120 cm",,Cat7914031,"EGP 1,333.80",,,2.5,,,,,https://m.media-amazon.com/images/I/41AutnG8dOL._AC_UL320_.jpg,https://www.amazon.eg/dp/B098RHKVKS,2026-03-28T13:03:17.624282
amazon,B0D7TQ7QDF,"50 Packs Poster Boards, 11 x 14 White Poster Paper Poster Board Bulk Trifold Poster Board Bulk for Art Display Board,Classroom Use,School Craft Project,Presentation Drawing",,Cat7914031,EGP 475.00,,,4.9,,,,,https://m.media-amazon.com/images/I/71gutVF7YmL._AC_UL320_.jpg,https://www.amazon.eg/dp/B0D7TQ7QDF,2026-03-28T13:03:17.624744
amazon,B0FJFXYJWL,"SONIX 555 Magnetic Whiteboard Chalkboard, Single Count",,Cat7914031,EGP 54.00,,,,,,,,https://m.media-amazon.com/images/I/51Ltk2PD+WL._AC_UL320_.jpg,https://www.amazon.eg/dp/B0FJFXYJWL,2026-03-28T13:03:17.625153
amazon,B078JDLR3K,"Neo STALO Wood Cork Bulletin Board, 100x70",,Cat7914031,"EGP 1,200.42",,,4.2,,,,,https://m.media-amazon.com/images/I/6191OYNEeGL._AC_UL320_.jpg,https://www.amazon.eg/dp/B078JDLR3K,2026-03-28T13:03:17.625608
amazon,B0BY4Y745Q,"Extra Long Removable Chalkboard Contact Paper Roll, Self-Adhesive Blackboard Sticker for Home School Office Wall Decoration (45x100cm) Decals Paper Sticker",,Cat7914031,,,,2.8,,,,,https://m.media-amazon.com/images/I/61fRU8OhkCL._AC_UL320_.jpg,https://www.amazon.eg/dp/B0BY4Y745Q,2026-03-28T13:03:17.626053
